transaction_id,machine_id,location_city,location_type,refill_date,refill_time,product_id,product_name,product_category,unit_price,quantity_refilled,quantity_sold,current_stock,revenue_generated,refill_person_id,refill_person_name,machine_status,temperature_C,payment_method,avg_customer_rating,downtime_minutes,power_consumption_kwh,network_latency_ms,maintenance_flag,refill_datetime
VMX-10001,VM-053,Delhi,Metro Station,25-04-2025,04:47:00,P-101,Pepsi Can,Drinks,13.5,90.0,83.0,7.0,1120.5,RP-003,Rahul,Low Power,10.5,Cash,2.7,64.0,3.41,337.0,0.0,2025-04-25 04:47:00
VMX-10002,VM-082,Delhi,Hospital,23-05-2025,00:48:00,P-108,Sprite Bottle,Drinks,68.73,134.0,116.0,18.0,7972.68,RP-011,Anita,Working,13.2,UPI,2.3,48.0,1.39,483.0,1.0,2025-05-23 00:48:00
VMX-10003,VM-194,Hyderabad,Metro Station,02-10-2025,03:59:00,P-109,Doritos,Snacks,47.03,31.0,17.0,14.0,799.51,RP-010,Rahul,Low Power,18.7,Card,2.2,84.0,1.91,198.0,0.0,2025-10-02 03:59:00
VMX-10004,VM-187,Bangalore,Office,21-08-2025,20:53:00,P-103,Oreo Pack,Snacks,131.31,117.0,109.0,8.0,14312.79,RP-012,Suresh,Maintenance,14.0,Card,3.9,77.0,3.54,323.0,0.0,2025-08-21 20:53:00
VMX-10005,VM-029,Bangalore,College,23-04-2025,21:20:00,P-102,Bisleri Water,Drinks,74.72,89.0,69.0,20.0,5155.68,RP-011,Kiran,Low Power,11.0,Card,4.6,40.0,1.85,305.0,1.0,2025-04-23 21:20:00
VMX-10006,VM-300,Mumbai,Metro Station,03-10-2025,08:47:00,P-107,Colgate Mini,Hygiene,30,55.0,48.0,7.0,1440.0,RP-013,Deepa,Working,25.0,Cash,3.5,11.0,4.02,490.0,0.0,2025-10-03 08:47:00
VMX-10007,VM-240,Pune,Office,02-02-2025,12:24:00,P-102,Bisleri Water,Drinks,97.84,194.0,181.0,13.0,17709.04,RP-018,Mahesh,Maintenance,20.8,Card,4.7,96.0,2.07,378.0,1.0,2025-02-02 12:24:00
VMX-10008,VM-135,Pune,Mall,02-01-2025,23:56:00,P-101,Pepsi Can,Drinks,51.09,60.0,46.0,14.0,2350.14,RP-017,Ravi,Maintenance,14.5,Card,3.5,25.0,1.61,440.0,0.0,2025-01-02 23:56:00
VMX-10009,VM-058,Chennai,Office,15-06-2025,15:01:00,P-108,Sprite Bottle,Drinks,143.49,155.0,155.0,0.0,22240.95,RP-008,Mahesh,Working,23.2,Cash,2.3,62.0,4.26,439.0,0.0,2025-06-15 15:01:00
VMX-10010,VM-217,Bangalore,Metro Station,16-05-2025,16:55:00,P-102,Bisleri Water,Drinks,102.37,160.0,155.0,5.0,15867.35,RP-007,Anita,Low Power,24.9,Card,3.1,115.0,3.07,111.0,0.0,2025-05-16 16:55:00
VMX-10011,VM-004,Hyderabad,College,28-04-2025,18:14:00,P-103,Oreo Pack,Snacks,18.96,25.0,7.0,18.0,132.72,RP-008,Ravi,Working,22.9,Cash,3.5,35.0,3.68,159.0,0.0,2025-04-28 18:14:00
VMX-10012,VM-050,Delhi,Hospital,28-07-2025,06:06:00,P-109,Doritos,Snacks,90.67,82.0,67.0,15.0,6074.89,RP-012,Kiran,Low Power,17.0,Card,2.2,83.0,4.94,100.0,0.0,2025-07-28 06:06:00
VMX-10013,VM-230,Bangalore,Hospital,09-04-2025,06:34:00,P-106,Snickers Bar,Snacks,111.95,47.0,40.0,7.0,4478.0,RP-006,Anita,Low Power,13.7,Cash,3.3,110.0,4.42,100.0,0.0,2025-04-09 06:34:00
VMX-10014,VM-247,Bangalore,Hospital,27-03-2025,13:31:00,P-108,Sprite Bottle,Drinks,127.04,43.0,36.0,7.0,4573.44,RP-002,Amit,Low Power,10.0,UPI,2.8,100.0,4.14,196.0,1.0,2025-03-27 13:31:00
VMX-10015,VM-030,Pune,Metro Station,08-04-2025,09:13:00,P-108,Sprite Bottle,Drinks,102.66,144.0,140.0,4.0,14372.4,RP-002,Deepa,Working,10.8,UPI,3.5,109.0,3.12,79.0,0.0,2025-04-08 09:13:00
VMX-10016,VM-292,Bangalore,Metro Station,26-07-2025,03:56:00,P-102,Bisleri Water,Drinks,19.59,37.0,30.0,7.0,587.7,RP-020,Mahesh,Maintenance,11.2,Card,3.8,66.0,2.27,183.0,0.0,2025-07-26 03:56:00
VMX-10017,VM-038,Hyderabad,Hospital,03-06-2025,14:20:00,P-105,Dettol Wipe,Hygiene,43.42,121.0,117.0,4.0,5080.14,RP-020,Rahul,Working,11.1,Cash,3.5,16.0,4.73,85.0,0.0,2025-06-03 14:20:00
VMX-10018,VM-271,Hyderabad,Metro Station,04-06-2025,19:51:00,P-105,Dettol Wipe,Hygiene,49.9,132.0,115.0,17.0,5738.5,RP-010,Ravi,Working,14.0,Cash,4.2,19.0,2.09,359.0,0.0,2025-06-04 19:51:00
VMX-10019,VM-027,Hyderabad,Hospital,16-09-2025,15:16:00,P-105,Dettol Wipe,Hygiene,38.5,182.0,174.0,8.0,6699.0,RP-009,Mahesh,Working,15.0,Cash,3.9,33.0,1.65,276.0,1.0,2025-09-16 15:16:00
VMX-10020,VM-190,Pune,Metro Station,07-10-2025,01:53:00,P-108,Sprite Bottle,Drinks,11.35,39.0,35.0,4.0,397.25,RP-005,Kiran,Working,10.6,UPI,4.7,101.0,4.89,70.0,1.0,2025-10-07 01:53:00
VMX-10021,VM-209,Pune,Mall,01-07-2025,17:56:00,P-103,Oreo Pack,Snacks,105.49,190.0,187.0,3.0,19726.63,RP-008,Amit,Working,23.2,Cash,2.5,118.0,2.33,260.0,0.0,2025-07-01 17:56:00
VMX-10022,VM-241,Bangalore,Mall,15-07-2025,01:54:00,P-104,Red Bull,Drinks,32.29,199.0,196.0,3.0,6328.84,RP-015,Deepa,Low Power,22.3,Cash,2.7,84.0,1.77,218.0,1.0,2025-07-15 01:54:00
VMX-10023,VM-275,Chennai,College,18-09-2025,12:43:00,P-101,Pepsi Can,Drinks,145.36,91.0,80.0,11.0,11628.8,RP-004,Anita,Working,18.7,UPI,2.1,0.0,2.74,423.0,1.0,2025-09-18 12:43:00
VMX-10024,VM-131,Hyderabad,Hospital,17-07-2025,18:12:00,P-106,Snickers Bar,Snacks,94.87,150.0,147.0,3.0,13945.89,RP-001,Fatima,Maintenance,20.3,Card,4.2,25.0,2.46,85.0,1.0,2025-07-17 18:12:00
VMX-10025,VM-210,Chennai,Hospital,17-09-2025,09:42:00,P-109,Doritos,Snacks,53.95,51.0,42.0,9.0,2265.9,RP-010,Fatima,Working,12.9,Card,4.8,86.0,3.99,139.0,1.0,2025-09-17 09:42:00
VMX-10026,VM-297,Pune,Office,27-05-2025,06:27:00,P-106,Snickers Bar,Snacks,86.71,20.0,11.0,9.0,953.81,RP-015,Rajesh,Low Power,20.1,Card,3.4,115.0,4.84,426.0,0.0,2025-05-27 06:27:00
VMX-10027,VM-121,Delhi,Office,21-06-2025,02:52:00,P-101,Pepsi Can,Drinks,49.73,189.0,169.0,20.0,8404.37,RP-008,Suresh,Working,10.4,Cash,5.0,78.0,4.4,87.0,1.0,2025-06-21 02:52:00
VMX-10028,VM-125,Bangalore,College,16-07-2025,15:25:00,P-106,Snickers Bar,Snacks,134.06,167.0,161.0,6.0,21583.66,RP-004,Kiran,Working,12.6,Card,3.6,6.0,3.23,484.0,0.0,2025-07-16 15:25:00
VMX-10029,VM-259,Mumbai,Metro Station,12-06-2025,14:39:00,P-107,Colgate Mini,Hygiene,28.67,138.0,122.0,16.0,3497.74,RP-015,Amit,Maintenance,22.9,UPI,2.8,31.0,4.36,191.0,1.0,2025-06-12 14:39:00
VMX-10030,VM-164,Pune,College,01-05-2025,08:21:00,P-103,Oreo Pack,Snacks,48.44,39.0,30.0,9.0,1453.2,RP-005,Amit,Working,15.7,Cash,4.1,8.0,2.66,219.0,1.0,2025-05-01 08:21:00
VMX-10031,VM-245,Hyderabad,Office,11-01-2025,18:24:00,P-106,Snickers Bar,Snacks,18.72,127.0,115.0,12.0,2152.8,RP-010,Kiran,Low Power,18.1,Card,3.6,77.0,4.59,299.0,0.0,2025-01-11 18:24:00
VMX-10032,VM-208,Delhi,Mall,22-06-2025,21:43:00,P-104,Red Bull,Drinks,71.02,27.0,15.0,12.0,1065.3,RP-015,Amit,Maintenance,18.0,UPI,3.8,84.0,1.11,379.0,1.0,2025-06-22 21:43:00
VMX-10033,VM-109,Mumbai,Office,14-05-2025,12:20:00,P-102,Bisleri Water,Drinks,131.36,66.0,65.0,1.0,8538.4,RP-011,Kiran,Low Power,21.3,UPI,2.8,10.0,2.88,433.0,0.0,2025-05-14 12:20:00
VMX-10034,VM-103,Kolkata,College,21-01-2025,00:15:00,P-105,Dettol Wipe,Hygiene,41.39,37.0,17.0,20.0,703.63,RP-020,Amit,Working,11.9,Card,2.3,27.0,2.86,181.0,1.0,2025-01-21 00:15:00
VMX-10035,VM-014,Chennai,Metro Station,09-06-2025,03:37:00,P-102,Bisleri Water,Drinks,94.82,49.0,44.0,5.0,4172.08,RP-013,Kiran,Maintenance,13.0,Card,4.1,80.0,1.97,406.0,1.0,2025-06-09 03:37:00
VMX-10036,VM-190,Hyderabad,Metro Station,27-06-2025,17:27:00,P-109,Doritos,Snacks,122.77,164.0,163.0,1.0,20011.51,RP-011,Mahesh,Low Power,22.3,Cash,3.3,46.0,3.54,474.0,1.0,2025-06-27 17:27:00
VMX-10037,VM-276,Kolkata,Hospital,19-05-2025,19:51:00,P-102,Bisleri Water,Drinks,70.97,153.0,133.0,20.0,9439.01,RP-015,Kiran,Maintenance,18.9,UPI,4.6,106.0,4.74,192.0,1.0,2025-05-19 19:51:00
VMX-10038,VM-254,Kolkata,Office,14-07-2025,10:01:00,P-103,Oreo Pack,Snacks,115.07,165.0,146.0,19.0,16800.22,RP-006,Rajesh,Working,15.3,UPI,3.0,112.0,3.38,500.0,1.0,2025-07-14 10:01:00
VMX-10039,VM-251,Pune,Mall,04-05-2025,23:26:00,P-108,Sprite Bottle,Drinks,11.42,68.0,66.0,2.0,753.72,RP-016,Rajesh,Low Power,21.9,Cash,2.9,51.0,3.77,206.0,1.0,2025-05-04 23:26:00
VMX-10040,VM-233,Chennai,Office,19-06-2025,11:44:00,P-107,Colgate Mini,Hygiene,87.49,108.0,95.0,13.0,8311.55,RP-009,Suresh,Working,20.8,UPI,2.4,68.0,4.8,403.0,0.0,2025-06-19 11:44:00
VMX-10041,VM-052,Kolkata,Mall,26-09-2025,19:18:00,P-103,Oreo Pack,Snacks,40.29,143.0,135.0,8.0,5439.15,RP-010,Suresh,Low Power,12.7,Cash,4.1,16.0,2.1,77.0,1.0,2025-09-26 19:18:00
VMX-10042,VM-241,Mumbai,Hospital,07-01-2025,18:18:00,P-102,Bisleri Water,Drinks,99.3,145.0,142.0,3.0,14100.6,RP-011,Amit,Working,13.8,UPI,2.3,8.0,2.6,87.0,0.0,2025-01-07 18:18:00
VMX-10043,VM-286,Kolkata,Hospital,13-02-2025,07:07:00,P-102,Bisleri Water,Drinks,30.89,164.0,155.0,9.0,4787.95,RP-020,Rahul,Maintenance,13.4,Card,3.1,116.0,2.77,490.0,1.0,2025-02-13 07:07:00
VMX-10044,VM-109,Chennai,College,20-02-2025,06:40:00,P-104,Red Bull,Drinks,89.61,35.0,16.0,19.0,1433.76,RP-006,Suresh,Working,18.3,Cash,2.0,57.0,3.76,290.0,1.0,2025-02-20 06:40:00
VMX-10045,VM-120,Chennai,Metro Station,21-08-2025,02:43:00,P-100,Lays Classic,Snacks,42.41,200.0,191.0,9.0,8100.31,RP-007,Kiran,Working,18.2,Card,2.4,34.0,4.31,86.0,0.0,2025-08-21 02:43:00
VMX-10046,VM-240,Delhi,Office,28-05-2025,14:07:00,P-102,Bisleri Water,Drinks,120.97,172.0,154.0,18.0,18629.38,RP-013,Anita,Maintenance,18.1,UPI,2.2,5.0,4.56,426.0,1.0,2025-05-28 14:07:00
VMX-10047,VM-138,Pune,College,11-01-2025,21:52:00,P-109,Doritos,Snacks,45.05,43.0,36.0,7.0,1621.8,RP-006,Rajesh,Maintenance,19.8,UPI,2.5,74.0,2.74,466.0,1.0,2025-01-11 21:52:00
VMX-10048,VM-083,Chennai,Hospital,14-06-2025,21:06:00,P-101,Pepsi Can,Drinks,75.8,124.0,114.0,10.0,8641.2,RP-016,Anita,Maintenance,24.2,Card,2.1,11.0,2.26,215.0,0.0,2025-06-14 21:06:00
VMX-10049,VM-097,Pune,Office,25-08-2025,13:03:00,P-106,Snickers Bar,Snacks,131.09,20.0,3.0,17.0,393.27,RP-020,Rajesh,Maintenance,16.6,Cash,2.6,70.0,1.52,197.0,1.0,2025-08-25 13:03:00
VMX-10050,VM-160,Pune,College,03-05-2025,22:10:00,P-107,Colgate Mini,Hygiene,27,181.0,162.0,19.0,4374.0,RP-018,Kiran,Working,13.4,Cash,3.4,15.0,3.59,128.0,1.0,2025-05-03 22:10:00
VMX-10051,VM-234,Pune,Mall,05-09-2025,15:15:00,P-104,Red Bull,Drinks,81.24,89.0,76.0,13.0,6174.24,RP-013,Suresh,Maintenance,17.6,Cash,4.6,35.0,4.09,487.0,1.0,2025-09-05 15:15:00
VMX-10052,VM-153,Kolkata,Metro Station,02-01-2025,09:46:00,P-105,Dettol Wipe,Hygiene,140.79,149.0,141.0,8.0,19851.39,RP-019,Rajesh,Working,16.7,UPI,3.0,70.0,4.05,243.0,1.0,2025-01-02 09:46:00
VMX-10053,VM-211,Hyderabad,Office,16-07-2025,07:54:00,P-105,Dettol Wipe,Hygiene,131.74,198.0,191.0,7.0,25162.34,RP-016,Kiran,Low Power,24.8,Card,4.9,63.0,4.86,114.0,1.0,2025-07-16 07:54:00
VMX-10054,VM-074,Mumbai,Mall,27-09-2025,14:00:00,P-101,Pepsi Can,Drinks,132.39,132.0,129.0,3.0,17078.31,RP-003,Rajesh,Low Power,15.1,Card,3.2,10.0,4.41,486.0,1.0,2025-09-27 14:00:00
VMX-10055,VM-121,Delhi,Office,19-01-2025,19:04:00,P-105,Dettol Wipe,Hygiene,97.75,144.0,127.0,17.0,12414.25,RP-008,Ravi,Low Power,24.7,Card,4.1,12.0,2.77,405.0,1.0,2025-01-19 19:04:00
VMX-10056,VM-075,Bangalore,Metro Station,03-07-2025,11:27:00,P-100,Lays Classic,Snacks,16.44,34.0,25.0,9.0,411.0,RP-014,Rahul,Maintenance,21.9,Cash,2.5,78.0,4.48,367.0,0.0,2025-07-03 11:27:00
VMX-10057,VM-236,Chennai,College,25-08-2025,20:16:00,P-107,Colgate Mini,Hygiene,137.8,56.0,49.0,7.0,6752.2,RP-015,Anita,Maintenance,18.2,Cash,3.3,44.0,4.95,203.0,1.0,2025-08-25 20:16:00
VMX-10058,VM-122,Mumbai,Metro Station,16-07-2025,15:06:00,P-104,Red Bull,Drinks,73.96,97.0,91.0,6.0,6730.36,RP-012,Rahul,Low Power,24.9,UPI,2.1,106.0,3.63,190.0,0.0,2025-07-16 15:06:00
VMX-10059,VM-118,Pune,Office,12-09-2025,09:49:00,P-109,Doritos,Snacks,131.11,32.0,13.0,19.0,1704.43,RP-008,Suresh,Maintenance,13.8,Card,4.3,87.0,4.35,371.0,0.0,2025-09-12 09:49:00
VMX-10060,VM-047,Chennai,Office,06-07-2025,23:08:00,P-100,Lays Classic,Snacks,53.25,132.0,131.0,1.0,6975.75,RP-014,Amit,Working,12.0,Card,4.6,46.0,3.12,189.0,0.0,2025-07-06 23:08:00
VMX-10061,VM-039,Bangalore,Mall,23-06-2025,03:29:00,P-104,Red Bull,Drinks,137.97,143.0,134.0,9.0,18487.98,RP-013,Fatima,Low Power,11.4,UPI,2.0,68.0,1.49,238.0,1.0,2025-06-23 03:29:00
VMX-10062,VM-242,Hyderabad,Metro Station,25-02-2025,21:14:00,P-109,Doritos,Snacks,63.34,183.0,172.0,11.0,10894.48,RP-018,Deepa,Maintenance,13.3,Cash,3.9,59.0,4.64,204.0,1.0,2025-02-25 21:14:00
VMX-10063,VM-121,Pune,Mall,10-09-2025,03:06:00,P-101,Pepsi Can,Drinks,29.57,29.0,20.0,9.0,591.4,RP-013,Rajesh,Low Power,20.1,Card,4.1,69.0,2.68,430.0,0.0,2025-09-10 03:06:00
Unknown,VM-190,Bangalore,Hospital,28-07-2025,08:02:00,P-106,Snickers Bar,Snacks,101.69,145.0,126.0,19.0,12812.94,RP-015,Suresh,Low Power,11.5,Card,3.1,115.0,4.91,233.0,0.0,2025-07-28 08:02:00
VMX-10065,VM-011,Hyderabad,Office,16-02-2025,21:13:00,P-106,Snickers Bar,Snacks,48.62,51.0,37.0,14.0,1798.94,RP-008,Amit,Maintenance,13.1,Card,2.6,27.0,4.25,169.0,1.0,2025-02-16 21:13:00
VMX-10066,VM-277,Chennai,Mall,22-05-2025,04:08:00,P-102,Bisleri Water,Drinks,120.41,172.0,172.0,0.0,20710.52,RP-004,Mahesh,Working,10.2,Cash,3.8,2.0,1.7,76.0,0.0,2025-05-22 04:08:00
VMX-10067,VM-056,Mumbai,Metro Station,18-08-2025,11:32:00,P-106,Snickers Bar,Snacks,83.65,36.0,21.0,15.0,1756.65,RP-008,Rahul,Working,20.9,Card,3.6,58.0,3.57,65.0,0.0,2025-08-18 11:32:00
VMX-10068,VM-228,Hyderabad,College,09-09-2025,22:58:00,P-107,Colgate Mini,Hygiene,128.62,129.0,126.0,3.0,16206.12,RP-011,Rahul,Working,11.0,UPI,3.9,74.0,3.19,216.0,1.0,2025-09-09 22:58:00
VMX-10069,VM-059,Kolkata,Metro Station,09-08-2025,03:50:00,P-109,Doritos,Snacks,84.28,136.0,120.0,16.0,10113.6,RP-007,Kiran,Low Power,23.3,UPI,3.0,58.0,2.59,423.0,0.0,2025-08-09 03:50:00
VMX-10070,VM-243,Hyderabad,College,11-07-2025,04:43:00,P-105,Dettol Wipe,Hygiene,69.75,190.0,182.0,8.0,12694.5,RP-003,Ravi,Low Power,11.4,Card,3.1,16.0,3.23,350.0,1.0,2025-07-11 04:43:00
VMX-10071,VM-160,Chennai,College,27-01-2025,09:38:00,P-101,Pepsi Can,Drinks,67.51,190.0,177.0,13.0,11949.27,RP-019,Fatima,Working,12.3,UPI,2.7,13.0,2.4,334.0,0.0,2025-01-27 09:38:00
VMX-10072,VM-286,Hyderabad,Metro Station,08-08-2025,17:49:00,P-101,Pepsi Can,Drinks,116.76,166.0,159.0,7.0,18564.84,RP-009,Mahesh,Working,14.1,UPI,4.8,44.0,1.02,495.0,0.0,2025-08-08 17:49:00
VMX-10073,VM-272,Bangalore,Hospital,16-01-2025,02:47:00,P-109,Doritos,Snacks,102.03,37.0,33.0,4.0,3366.99,RP-014,Rajesh,Low Power,12.4,UPI,4.2,99.0,4.77,355.0,0.0,2025-01-16 02:47:00
VMX-10074,VM-218,Mumbai,Metro Station,11-02-2025,08:28:00,P-100,Lays Classic,Snacks,31.78,178.0,177.0,1.0,5625.06,RP-015,Kiran,Low Power,13.2,Card,2.3,55.0,1.44,397.0,1.0,2025-02-11 08:28:00
VMX-10075,VM-004,Bangalore,Office,22-07-2025,19:03:00,P-108,Sprite Bottle,Drinks,103.4,31.0,24.0,7.0,2481.6,RP-007,Amit,Low Power,14.3,Cash,2.0,95.0,2.72,116.0,1.0,2025-07-22 19:03:00
VMX-10076,VM-022,Mumbai,College,01-07-2025,02:25:00,P-108,Sprite Bottle,Drinks,108.51,148.0,131.0,17.0,14214.81,RP-015,Ravi,Low Power,18.6,Card,3.2,81.0,2.67,108.0,1.0,2025-07-01 02:25:00
VMX-10077,VM-186,Hyderabad,Hospital,24-08-2025,22:58:00,P-100,Lays Classic,Snacks,145.27,63.0,44.0,19.0,6391.88,RP-004,Suresh,Low Power,18.8,Card,2.2,111.0,2.24,223.0,0.0,2025-08-24 22:58:00
VMX-10078,VM-100,Kolkata,Office,28-02-2025,16:32:00,P-105,Dettol Wipe,Hygiene,119.08,39.0,23.0,16.0,2738.84,RP-012,Amit,Working,11.5,UPI,2.6,77.0,1.61,438.0,0.0,2025-02-28 16:32:00
VMX-10079,VM-297,Mumbai,Metro Station,26-08-2025,18:48:00,P-102,Bisleri Water,Drinks,143.18,180.0,165.0,15.0,23624.7,RP-020,Deepa,Maintenance,14.7,UPI,2.2,56.0,3.53,457.0,1.0,2025-08-26 18:48:00
VMX-10080,VM-020,Hyderabad,Office,08-06-2025,14:28:00,P-109,Doritos,Snacks,17.86,149.0,147.0,2.0,2625.42,RP-010,Ravi,Maintenance,23.0,Cash,3.8,64.0,2.54,347.0,0.0,2025-06-08 14:28:00
VMX-10081,VM-244,Pune,Mall,07-04-2025,10:38:00,P-107,Colgate Mini,Hygiene,137.27,166.0,146.0,20.0,20041.42,RP-002,Rajesh,Working,22.2,UPI,4.9,10.0,3.02,138.0,0.0,2025-04-07 10:38:00
VMX-10082,VM-187,Chennai,Office,25-09-2025,19:10:00,P-103,Oreo Pack,Snacks,109.07,132.0,116.0,16.0,12652.12,RP-013,Kiran,Low Power,20.2,Cash,4.4,82.0,2.34,218.0,0.0,2025-09-25 19:10:00
VMX-10083,VM-299,Delhi,Mall,18-03-2025,10:05:00,P-108,Sprite Bottle,Drinks,104.97,92.0,84.0,8.0,8817.48,RP-012,Anita,Maintenance,20.5,UPI,2.4,90.0,4.75,208.0,1.0,2025-03-18 10:05:00
VMX-10084,VM-217,Pune,Office,17-02-2025,20:42:00,P-105,Dettol Wipe,Hygiene,123.85,191.0,175.0,16.0,21673.75,RP-001,Deepa,Low Power,12.7,Cash,3.0,98.0,2.95,165.0,0.0,2025-02-17 20:42:00
VMX-10085,VM-270,Hyderabad,Office,04-10-2025,23:56:00,P-102,Bisleri Water,Drinks,20.8,45.0,29.0,16.0,603.2,RP-020,Amit,Maintenance,15.7,Cash,2.5,88.0,4.08,464.0,0.0,2025-10-04 23:56:00
VMX-10086,VM-230,Bangalore,Metro Station,16-08-2025,19:18:00,P-107,Colgate Mini,Hygiene,16.12,113.0,106.0,7.0,1708.72,RP-008,Anita,Low Power,23.6,Cash,3.1,73.0,4.94,286.0,1.0,2025-08-16 19:18:00
VMX-10087,VM-129,Hyderabad,Hospital,13-04-2025,19:08:00,P-106,Snickers Bar,Snacks,80.41,127.0,122.0,5.0,9810.02,RP-012,Fatima,Working,20.7,Card,4.6,36.0,1.34,132.0,1.0,2025-04-13 19:08:00
VMX-10088,VM-231,Chennai,College,16-02-2025,07:52:00,P-107,Colgate Mini,Hygiene,136.74,57.0,44.0,13.0,6016.56,RP-014,Mahesh,Low Power,17.5,Cash,3.2,10.0,2.5,64.0,1.0,2025-02-16 07:52:00
VMX-10089,VM-147,Kolkata,Hospital,16-03-2025,04:02:00,P-101,Pepsi Can,Drinks,127.48,186.0,176.0,10.0,22436.48,RP-005,Rajesh,Low Power,19.2,Cash,2.1,27.0,4.34,330.0,1.0,2025-03-16 04:02:00
VMX-10090,VM-215,Delhi,Metro Station,04-03-2025,01:15:00,P-101,Pepsi Can,Drinks,118.66,80.0,71.0,9.0,8424.86,RP-015,Ravi,Working,22.6,UPI,3.8,2.0,3.53,344.0,0.0,2025-03-04 01:15:00
VMX-10091,VM-214,Bangalore,College,30-06-2025,07:36:00,P-102,Bisleri Water,Drinks,50.78,20.0,1.0,19.0,50.78,RP-017,Deepa,Working,24.3,Card,3.5,64.0,3.22,249.0,1.0,2025-06-30 07:36:00
VMX-10092,VM-035,Chennai,Mall,09-01-2025,11:50:00,P-100,Lays Classic,Snacks,98.99,115.0,107.0,8.0,10591.93,RP-004,Rahul,Maintenance,21.4,Cash,2.1,69.0,2.35,379.0,0.0,2025-01-09 11:50:00
VMX-10093,VM-235,Hyderabad,Office,04-04-2025,04:04:00,P-107,Colgate Mini,Hygiene,147.31,142.0,122.0,20.0,17971.82,RP-007,Mahesh,Working,23.3,UPI,4.8,65.0,2.59,467.0,1.0,2025-04-04 04:04:00
VMX-10094,VM-025,Kolkata,Office,27-05-2025,11:55:00,P-104,Red Bull,Drinks,15.13,185.0,179.0,6.0,2708.27,RP-009,Ravi,Low Power,16.6,UPI,4.2,114.0,4.83,223.0,0.0,2025-05-27 11:55:00
VMX-10095,VM-218,Hyderabad,Hospital,17-05-2025,02:46:00,P-107,Colgate Mini,Hygiene,106.89,114.0,98.0,16.0,10475.22,RP-020,Amit,Maintenance,14.4,Cash,2.2,84.0,2.18,278.0,1.0,2025-05-17 02:46:00
VMX-10096,VM-181,Pune,Hospital,22-01-2025,23:55:00,P-102,Bisleri Water,Drinks,106.57,109.0,95.0,14.0,10124.15,RP-009,Mahesh,Working,20.1,UPI,3.1,102.0,4.0,131.0,0.0,2025-01-22 23:55:00
VMX-10097,VM-121,Kolkata,Office,18-01-2025,04:04:00,P-102,Bisleri Water,Drinks,128.81,193.0,179.0,14.0,23056.99,RP-012,Kiran,Maintenance,10.5,Cash,4.0,47.0,2.49,440.0,0.0,2025-01-18 04:04:00
VMX-10098,VM-128,Hyderabad,College,10-06-2025,20:17:00,P-109,Doritos,Snacks,29.28,113.0,101.0,12.0,2957.28,RP-006,Rajesh,Maintenance,15.8,Card,2.4,99.0,2.04,278.0,0.0,2025-06-10 20:17:00
VMX-10099,VM-038,Mumbai,Mall,04-03-2025,04:54:00,P-109,Doritos,Snacks,49.98,145.0,139.0,6.0,6947.22,RP-015,Ravi,Maintenance,24.5,UPI,4.0,90.0,1.26,327.0,1.0,2025-03-04 04:54:00
VMX-10100,VM-115,Hyderabad,Mall,31-03-2025,11:32:00,P-104,Red Bull,Drinks,129.19,199.0,179.0,20.0,23125.01,RP-005,Suresh,Low Power,10.4,Card,3.7,59.0,4.21,332.0,0.0,2025-03-31 11:32:00
VMX-10101,VM-246,Pune,Hospital,23-07-2025,22:46:00,P-109,Doritos,Snacks,133.79,36.0,27.0,9.0,3612.33,RP-014,Rahul,Working,11.9,UPI,3.9,57.0,2.86,314.0,1.0,2025-07-23 22:46:00
VMX-10102,VM-258,Kolkata,College,04-04-2025,04:27:00,P-102,Bisleri Water,Drinks,132.91,161.0,141.0,20.0,18740.31,RP-004,Fatima,Working,14.6,Cash,3.0,90.0,1.9,315.0,1.0,2025-04-04 04:27:00
VMX-10103,VM-156,Pune,Metro Station,21-05-2025,04:40:00,P-101,Pepsi Can,Drinks,45.08,182.0,165.0,17.0,7438.2,RP-003,Fatima,Maintenance,12.5,Card,2.5,84.0,3.5,359.0,1.0,2025-05-21 04:40:00
VMX-10104,VM-296,Chennai,Mall,24-01-2025,20:49:00,P-109,Doritos,Snacks,15.77,27.0,25.0,2.0,394.25,RP-019,Kiran,Maintenance,19.6,UPI,4.7,69.0,2.16,204.0,1.0,2025-01-24 20:49:00
VMX-10105,VM-031,Bangalore,Hospital,02-06-2025,14:04:00,P-103,Oreo Pack,Snacks,122.66,195.0,183.0,12.0,22446.78,RP-014,Rajesh,Low Power,13.1,Card,2.4,110.0,3.87,425.0,1.0,2025-06-02 14:04:00
VMX-10106,VM-239,Hyderabad,Office,24-02-2025,10:15:00,P-106,Snickers Bar,Snacks,28.31,114.0,98.0,16.0,2774.38,RP-015,Suresh,Working,11.5,UPI,4.8,110.0,3.46,177.0,0.0,2025-02-24 10:15:00
VMX-10107,VM-240,Mumbai,Office,23-03-2025,15:32:00,P-105,Dettol Wipe,Hygiene,140.73,100.0,94.0,6.0,13228.62,RP-016,Mahesh,Working,24.2,Card,3.4,30.0,1.86,230.0,0.0,2025-03-23 15:32:00
VMX-10108,VM-005,Kolkata,College,29-08-2025,09:34:00,P-100,Lays Classic,Snacks,49.39,172.0,152.0,20.0,7507.28,RP-014,Amit,Low Power,20.9,UPI,3.1,51.0,1.2,337.0,0.0,2025-08-29 09:34:00
VMX-10109,VM-282,Chennai,Metro Station,16-09-2025,14:48:00,P-105,Dettol Wipe,Hygiene,87.45,38.0,26.0,12.0,2273.7,RP-020,Ravi,Working,24.6,UPI,3.1,43.0,3.23,237.0,0.0,2025-09-16 14:48:00
VMX-10110,VM-071,Delhi,Office,21-01-2025,01:02:00,P-103,Oreo Pack,Snacks,94.34,122.0,106.0,16.0,10000.04,RP-016,Fatima,Low Power,12.2,Card,2.4,119.0,3.45,133.0,1.0,2025-01-21 01:02:00
VMX-10111,VM-261,Pune,Hospital,22-06-2025,16:53:00,P-109,Doritos,Snacks,113.5,96.0,78.0,18.0,8853.0,RP-019,Anita,Low Power,22.2,UPI,3.0,14.0,4.92,348.0,1.0,2025-06-22 16:53:00
VMX-10112,VM-299,Mumbai,Mall,27-04-2025,23:03:00,P-100,Lays Classic,Snacks,93.57,87.0,67.0,20.0,6269.19,RP-017,Rahul,Low Power,12.2,Card,2.7,73.0,4.79,106.0,0.0,2025-04-27 23:03:00
VMX-10113,VM-211,Pune,Metro Station,31-07-2025,22:13:00,P-100,Lays Classic,Snacks,71.75,127.0,123.0,4.0,8825.25,RP-016,Mahesh,Maintenance,12.1,Cash,3.7,84.0,2.91,242.0,1.0,2025-07-31 22:13:00
VMX-10114,VM-136,Pune,Hospital,07-10-2025,11:43:00,P-102,Bisleri Water,Drinks,74.35,156.0,146.0,10.0,10855.1,RP-007,Suresh,Low Power,18.4,Cash,4.8,38.0,4.08,410.0,0.0,2025-10-07 11:43:00
VMX-10115,VM-294,Delhi,Metro Station,21-05-2025,09:07:00,P-107,Colgate Mini,Hygiene,54.39,109.0,92.0,17.0,5003.88,RP-013,Kiran,Low Power,24.3,Cash,2.9,36.0,4.82,90.0,1.0,2025-05-21 09:07:00
VMX-10116,VM-288,Delhi,Office,14-04-2025,17:17:00,P-107,Colgate Mini,Hygiene,101.84,142.0,136.0,6.0,13850.24,RP-005,Ravi,Maintenance,21.1,Cash,2.7,85.0,4.62,165.0,0.0,2025-04-14 17:17:00
VMX-10117,VM-071,Hyderabad,Metro Station,21-02-2025,21:49:00,P-100,Lays Classic,Snacks,24.03,104.0,89.0,15.0,2138.67,RP-006,Kiran,Maintenance,24.0,UPI,3.4,25.0,4.02,197.0,1.0,2025-02-21 21:49:00
VMX-10118,VM-020,Bangalore,Hospital,29-04-2025,17:47:00,P-104,Red Bull,Drinks,100.43,42.0,26.0,20.0,2209.46,RP-006,Mahesh,Low Power,21.8,Cash,4.8,111.0,4.7,498.0,0.0,2025-04-29 17:47:00
VMX-10119,VM-279,Pune,Hospital,21-06-2025,09:29:00,P-100,Lays Classic,Snacks,51.77,174.0,171.0,3.0,8852.67,RP-005,Fatima,Low Power,14.1,Cash,3.0,93.0,2.84,181.0,0.0,2025-06-21 09:29:00
VMX-10120,VM-208,Kolkata,Hospital,09-04-2025,05:39:00,P-100,Lays Classic,Snacks,113.13,95.0,77.0,18.0,8711.01,RP-017,Deepa,Working,16.0,Cash,2.6,17.0,2.91,177.0,0.0,2025-04-09 05:39:00
VMX-10121,VM-294,Hyderabad,Office,18-06-2025,09:37:00,P-104,Red Bull,Drinks,63.7,134.0,126.0,8.0,8026.2,RP-012,Suresh,Working,20.0,UPI,2.9,51.0,3.74,410.0,1.0,2025-06-18 09:37:00
VMX-10122,VM-245,Bangalore,Hospital,24-04-2025,07:08:00,P-101,Pepsi Can,Drinks,99.42,95.0,84.0,11.0,8351.28,RP-020,Deepa,Low Power,20.5,UPI,4.3,102.0,3.66,161.0,0.0,2025-04-24 07:08:00
VMX-10123,VM-186,Hyderabad,Metro Station,17-08-2025,16:45:00,P-109,Doritos,Snacks,132.24,40.0,24.0,16.0,3173.76,RP-004,Mahesh,Maintenance,23.5,Cash,3.7,19.0,1.66,487.0,1.0,2025-08-17 16:45:00
VMX-10124,VM-029,Mumbai,Mall,16-02-2025,16:28:00,P-101,Pepsi Can,Drinks,105.24,169.0,154.0,15.0,16206.96,RP-017,Kiran,Low Power,18.5,Card,3.4,103.0,2.23,61.0,1.0,2025-02-16 16:28:00
VMX-10125,VM-177,Delhi,College,07-02-2025,01:27:00,Unknown,Red Bull,Drinks,124.3,75.0,57.0,18.0,7085.1,RP-018,Mahesh,Working,24.8,UPI,2.1,52.0,1.72,119.0,1.0,2025-02-07 01:27:00
VMX-10126,VM-277,Bangalore,Office,13-07-2025,12:05:00,P-105,Dettol Wipe,Hygiene,149,117.0,103.0,14.0,15347.0,RP-004,Amit,Maintenance,15.9,Cash,4.2,28.0,4.34,437.0,0.0,2025-07-13 12:05:00
VMX-10127,VM-118,Bangalore,Hospital,30-09-2025,12:52:00,P-104,Red Bull,Drinks,74.82,159.0,146.0,13.0,10923.72,RP-012,Amit,Low Power,12.8,Card,4.3,4.0,4.24,264.0,0.0,2025-09-30 12:52:00
VMX-10128,VM-025,Bangalore,College,18-01-2025,14:38:00,P-103,Oreo Pack,Snacks,38.85,45.0,26.0,19.0,1010.1,RP-013,Rajesh,Working,18.1,Cash,2.4,37.0,1.94,424.0,1.0,2025-01-18 14:38:00
VMX-10129,VM-074,Delhi,Metro Station,02-05-2025,09:56:00,P-109,Doritos,Snacks,93.71,192.0,182.0,10.0,17055.22,RP-008,Kiran,Low Power,14.1,Card,4.8,112.0,3.94,139.0,1.0,2025-05-02 09:56:00
VMX-10130,VM-214,Mumbai,Mall,15-07-2025,16:20:00,P-108,Sprite Bottle,Drinks,79.39,108.0,88.0,20.0,6986.32,RP-010,Kiran,Working,21.3,UPI,2.7,28.0,2.2,412.0,0.0,2025-07-15 16:20:00
VMX-10131,VM-069,Mumbai,Mall,02-08-2025,17:33:00,P-107,Colgate Mini,Hygiene,138.06,163.0,150.0,13.0,20709.0,RP-009,Suresh,Low Power,19.7,UPI,4.5,11.0,3.14,474.0,0.0,2025-08-02 17:33:00
VMX-10132,VM-287,Bangalore,Hospital,21-01-2025,02:12:00,P-100,Lays Classic,Snacks,47.58,192.0,173.0,19.0,8231.34,RP-007,Deepa,Low Power,24.4,Cash,2.6,24.0,4.85,110.0,1.0,2025-01-21 02:12:00
VMX-10133,VM-165,Kolkata,Office,23-07-2025,07:35:00,P-103,Oreo Pack,Snacks,107.39,200.0,194.0,6.0,20833.66,RP-013,Rajesh,Maintenance,19.7,UPI,2.8,65.0,4.53,288.0,0.0,2025-07-23 07:35:00
VMX-10134,VM-024,Pune,Mall,09-07-2025,10:26:00,P-107,Colgate Mini,Hygiene,116.63,101.0,95.0,6.0,11079.85,RP-005,Mahesh,Low Power,18.3,Card,3.7,53.0,2.18,150.0,1.0,2025-07-09 10:26:00
VMX-10135,VM-251,Delhi,Hospital,22-06-2025,08:48:00,P-103,Oreo Pack,Snacks,63.18,82.0,67.0,15.0,4233.06,RP-015,Amit,Maintenance,21.9,Cash,2.4,69.0,2.95,327.0,0.0,2025-06-22 08:48:00
VMX-10136,VM-119,Hyderabad,Mall,04-01-2025,13:08:00,P-108,Sprite Bottle,Drinks,14.74,39.0,38.0,1.0,560.12,RP-001,Suresh,Maintenance,16.8,Cash,3.9,85.0,4.74,297.0,1.0,2025-01-04 13:08:00
VMX-10137,VM-141,Pune,Office,07-01-2025,00:33:00,P-100,Lays Classic,Snacks,10.93,161.0,148.0,13.0,1617.64,RP-001,Fatima,Maintenance,20.1,Cash,2.3,12.0,3.1,173.0,0.0,2025-01-07 00:33:00
VMX-10138,VM-208,Mumbai,Metro Station,23-07-2025,02:23:00,P-109,Doritos,Snacks,83.7,110.0,102.0,8.0,8537.4,RP-008,Suresh,Low Power,20.3,Cash,4.0,109.0,3.6,66.0,0.0,2025-07-23 02:23:00
VMX-10139,VM-088,Hyderabad,Hospital,29-01-2025,20:00:00,P-106,Snickers Bar,Snacks,63.1,161.0,146.0,15.0,9212.6,RP-014,Deepa,Maintenance,24.7,Cash,4.7,117.0,1.17,158.0,1.0,2025-01-29 20:00:00
VMX-10140,VM-017,Bangalore,Office,06-10-2025,18:42:00,P-104,Red Bull,Drinks,16.52,39.0,31.0,8.0,512.12,RP-001,Suresh,Maintenance,12.2,Card,4.5,118.0,1.31,133.0,0.0,2025-10-06 18:42:00
VMX-10141,VM-072,Kolkata,College,19-06-2025,12:48:00,P-109,Doritos,Snacks,126.85,119.0,102.0,17.0,12938.7,RP-017,Deepa,Working,11.5,Cash,4.5,43.0,3.42,364.0,1.0,2025-06-19 12:48:00
VMX-10142,VM-284,Mumbai,Hospital,09-09-2025,07:22:00,P-105,Dettol Wipe,Hygiene,14.15,89.0,75.0,14.0,1061.25,RP-006,Rahul,Maintenance,15.7,Card,2.9,31.0,3.85,92.0,1.0,2025-09-09 07:22:00
VMX-10143,VM-055,Hyderabad,College,19-07-2025,10:23:00,P-102,Bisleri Water,Drinks,63.2,182.0,178.0,4.0,11249.6,RP-010,Rajesh,Low Power,21.4,Cash,2.4,23.0,2.72,335.0,1.0,2025-07-19 10:23:00
VMX-10144,VM-167,Kolkata,Hospital,17-02-2025,19:38:00,P-101,Pepsi Can,Drinks,13.68,110.0,93.0,17.0,1272.24,RP-001,Anita,Low Power,15.8,Cash,4.2,71.0,4.62,174.0,0.0,2025-02-17 19:38:00
VMX-10145,VM-033,Bangalore,Hospital,18-05-2025,15:09:00,P-106,Snickers Bar,Snacks,33.73,88.0,79.0,9.0,2664.67,RP-009,Kiran,Low Power,17.3,Cash,3.1,120.0,1.99,370.0,1.0,2025-05-18 15:09:00
VMX-10146,VM-203,Chennai,Metro Station,11-03-2025,09:00:00,P-109,Doritos,Snacks,96.33,137.0,134.0,3.0,12908.22,RP-013,Deepa,Low Power,0.0,Card,4.9,17.0,2.2,358.0,0.0,2025-03-11 09:00:00
VMX-10147,VM-252,Pune,Mall,30-05-2025,23:44:00,P-107,Colgate Mini,Hygiene,53.99,121.0,111.0,10.0,5992.89,RP-011,Kiran,Low Power,22.2,UPI,3.1,119.0,3.26,353.0,0.0,2025-05-30 23:44:00
VMX-10148,VM-036,Kolkata,Hospital,13-08-2025,09:53:00,P-108,Sprite Bottle,Drinks,13.77,138.0,132.0,6.0,1817.64,RP-016,Amit,Maintenance,14.5,UPI,4.0,91.0,2.69,243.0,0.0,2025-08-13 09:53:00
VMX-10149,VM-215,Pune,College,25-07-2025,17:32:00,P-107,Colgate Mini,Hygiene,148.7,142.0,124.0,18.0,18438.8,RP-012,Fatima,Maintenance,19.6,Cash,2.3,31.0,3.63,231.0,0.0,2025-07-25 17:32:00
VMX-10150,VM-221,Hyderabad,College,24-07-2025,10:50:00,P-109,Doritos,Snacks,16.2,185.0,165.0,20.0,2673.0,RP-004,Anita,Working,17.7,Card,3.7,88.0,3.3,278.0,1.0,2025-07-24 10:50:00
VMX-10151,VM-013,Mumbai,College,14-09-2025,04:22:00,P-106,Snickers Bar,Snacks,74.83,193.0,175.0,18.0,13095.25,RP-010,Kiran,Working,11.7,Card,2.4,39.0,2.37,451.0,0.0,2025-09-14 04:22:00
VMX-10152,VM-232,Chennai,College,13-08-2025,23:44:00,P-108,Sprite Bottle,Drinks,77.61,141.0,138.0,3.0,10710.18,RP-010,Mahesh,Maintenance,11.7,UPI,3.9,86.0,4.2,429.0,0.0,2025-08-13 23:44:00
VMX-10153,VM-208,Delhi,Mall,07-08-2025,14:14:00,P-108,Sprite Bottle,Drinks,34.42,60.0,50.0,10.0,1721.0,RP-006,Kiran,Low Power,10.4,Card,4.6,57.0,3.37,249.0,0.0,2025-08-07 14:14:00
VMX-10154,VM-188,Chennai,Mall,22-02-2025,17:11:00,P-103,Oreo Pack,Snacks,38.81,200.0,198.0,2.0,7684.38,RP-015,Ravi,Low Power,20.1,UPI,3.6,81.0,2.25,248.0,1.0,2025-02-22 17:11:00
VMX-10155,VM-153,Pune,Metro Station,30-03-2025,21:45:00,P-109,Doritos,Snacks,25.99,110.0,96.0,14.0,2495.04,RP-003,Amit,Low Power,11.8,UPI,2.4,47.0,3.77,311.0,1.0,2025-03-30 21:45:00
VMX-10156,VM-276,Delhi,Mall,05-08-2025,05:31:00,P-106,Snickers Bar,Snacks,93.5,167.0,155.0,12.0,14492.5,RP-018,Amit,Low Power,14.3,Cash,2.9,57.0,3.48,493.0,1.0,2025-08-05 05:31:00
VMX-10157,VM-210,Delhi,Hospital,16-09-2025,20:31:00,P-100,Lays Classic,Snacks,77.85,69.0,57.0,12.0,4437.45,RP-014,Rajesh,Low Power,12.5,Card,2.1,97.0,1.88,66.0,1.0,2025-09-16 20:31:00
VMX-10158,VM-058,Pune,College,11-09-2025,17:32:00,P-103,Oreo Pack,Snacks,85.27,63.0,49.0,14.0,4178.23,RP-009,Fatima,Low Power,18.1,Cash,4.3,56.0,3.19,267.0,0.0,2025-09-11 17:32:00
VMX-10159,VM-045,Mumbai,College,15-05-2025,11:55:00,P-103,Oreo Pack,Snacks,51.68,28.0,14.0,14.0,723.52,RP-008,Suresh,Maintenance,18.8,UPI,4.6,78.0,3.53,134.0,0.0,2025-05-15 11:55:00
VMX-10160,VM-276,Bangalore,Office,29-06-2025,17:17:00,P-103,Oreo Pack,Snacks,123.89,35.0,17.0,18.0,2106.13,RP-010,Anita,Maintenance,14.0,Card,5.0,86.0,4.26,119.0,1.0,2025-06-29 17:17:00
VMX-10161,VM-165,Kolkata,Mall,09-03-2025,07:09:00,P-100,Lays Classic,Snacks,148.95,187.0,183.0,4.0,27257.85,RP-013,Rajesh,Working,18.7,UPI,3.9,48.0,2.81,374.0,0.0,2025-03-09 07:09:00
VMX-10162,VM-298,Hyderabad,College,21-08-2025,15:20:00,P-106,Snickers Bar,Snacks,82.19,91.0,80.0,11.0,6575.2,RP-015,Deepa,Working,21.9,UPI,2.7,54.0,4.3,303.0,1.0,2025-08-21 15:20:00
VMX-10163,VM-249,Kolkata,Office,08-03-2025,18:54:00,P-105,Dettol Wipe,Hygiene,125.97,106.0,89.0,17.0,11211.33,RP-002,Mahesh,Working,19.4,UPI,2.0,118.0,4.43,275.0,1.0,2025-03-08 18:54:00
VMX-10164,VM-082,Kolkata,Office,09-03-2025,20:19:00,P-100,Lays Classic,Snacks,148.86,129.0,123.0,6.0,18309.78,RP-003,Deepa,Low Power,11.2,Card,4.7,21.0,1.21,370.0,1.0,2025-03-09 20:19:00
VMX-10165,VM-040,Bangalore,Metro Station,01-01-2025,06:30:00,P-103,Oreo Pack,Snacks,70.09,43.0,40.0,3.0,2803.6,RP-008,Fatima,Maintenance,16.7,Cash,4.1,104.0,1.48,490.0,1.0,2025-01-01 06:30:00
VMX-10166,VM-053,Hyderabad,Office,15-02-2025,23:51:00,P-102,Bisleri Water,Drinks,76.88,78.0,66.0,12.0,5074.08,RP-012,Anita,Working,15.7,Cash,3.9,86.0,1.57,321.0,0.0,2025-02-15 23:51:00
VMX-10167,VM-078,Mumbai,Metro Station,20-04-2025,20:47:00,P-109,Doritos,Snacks,101,132.0,121.0,11.0,12221.0,RP-015,Suresh,Working,23.4,Cash,4.3,75.0,3.92,229.0,1.0,2025-04-20 20:47:00
VMX-10168,VM-146,Kolkata,College,13-02-2025,07:35:00,P-105,Dettol Wipe,Hygiene,120.75,83.0,75.0,8.0,9056.25,RP-010,Suresh,Maintenance,19.1,Cash,4.2,37.0,3.58,451.0,0.0,2025-02-13 07:35:00
VMX-10169,VM-007,Chennai,Office,06-02-2025,16:56:00,P-107,Colgate Mini,Hygiene,64.02,81.0,66.0,15.0,4225.32,RP-005,Kiran,Maintenance,16.3,Card,4.0,97.0,2.88,444.0,0.0,2025-02-06 16:56:00
VMX-10170,VM-031,Kolkata,Hospital,21-04-2025,01:59:00,P-100,Lays Classic,Snacks,92.23,23.0,15.0,8.0,1383.45,RP-017,Anita,Maintenance,20.7,UPI,3.3,51.0,1.33,324.0,0.0,2025-04-21 01:59:00
VMX-10171,VM-168,Mumbai,Metro Station,15-04-2025,04:34:00,P-104,Red Bull,Drinks,21.7,40.0,24.0,16.0,520.8,RP-003,Anita,Maintenance,16.6,Cash,2.2,11.0,4.7,109.0,1.0,2025-04-15 04:34:00
VMX-10172,VM-071,Delhi,College,03-03-2025,00:45:00,P-109,Doritos,Snacks,95.24,99.0,94.0,5.0,8952.56,RP-006,Rajesh,Low Power,17.8,Card,2.8,47.0,1.51,449.0,1.0,2025-03-03 00:45:00
VMX-10173,VM-033,Chennai,Metro Station,08-08-2025,08:33:00,P-101,Pepsi Can,Drinks,118,27.0,17.0,10.0,2006.0,RP-003,Rajesh,Low Power,17.7,Cash,3.5,72.0,1.67,130.0,1.0,2025-08-08 08:33:00
VMX-10174,VM-002,Hyderabad,College,27-04-2025,23:32:00,P-101,Pepsi Can,Drinks,135.2,192.0,189.0,3.0,25552.8,RP-008,Mahesh,Low Power,15.5,Cash,2.5,109.0,1.14,461.0,1.0,2025-04-27 23:32:00
VMX-10175,VM-191,Hyderabad,Metro Station,19-05-2025,02:36:00,P-103,Oreo Pack,Snacks,55.05,126.0,116.0,10.0,6385.8,RP-002,Amit,Working,22.1,Cash,4.9,8.0,4.51,493.0,1.0,2025-05-19 02:36:00
VMX-10176,VM-150,Pune,Office,05-01-2025,11:12:00,P-104,Red Bull,Drinks,55.82,161.0,147.0,14.0,8205.54,RP-020,Suresh,Low Power,15.5,UPI,5.0,99.0,1.78,329.0,0.0,2025-01-05 11:12:00
VMX-10177,VM-005,Chennai,College,30-04-2025,17:22:00,P-102,Bisleri Water,Drinks,10.89,124.0,124.0,0.0,1350.36,RP-013,Anita,Working,13.1,Cash,3.3,7.0,4.89,122.0,1.0,2025-04-30 17:22:00
VMX-10178,VM-191,Mumbai,College,31-07-2025,22:57:00,P-101,Pepsi Can,Drinks,16.15,79.0,63.0,16.0,1017.45,RP-019,Ravi,Maintenance,12.0,UPI,2.2,72.0,1.25,389.0,0.0,2025-07-31 22:57:00
VMX-10179,VM-140,Bangalore,College,17-06-2025,10:28:00,P-103,Oreo Pack,Snacks,50.83,100.0,88.0,12.0,4473.04,RP-007,Amit,Maintenance,11.6,Cash,2.5,59.0,2.26,111.0,1.0,2025-06-17 10:28:00
VMX-10180,VM-156,Kolkata,Metro Station,03-03-2025,02:10:00,P-103,Oreo Pack,Snacks,73.27,138.0,130.0,8.0,9525.1,RP-002,Suresh,Low Power,12.2,Card,2.7,45.0,2.58,75.0,1.0,2025-03-03 02:10:00
VMX-10181,VM-282,Bangalore,College,27-07-2025,14:35:00,P-104,Red Bull,Drinks,124.81,64.0,64.0,0.0,7987.84,RP-015,Ravi,Working,11.8,Cash,4.5,28.0,1.52,471.0,1.0,2025-07-27 14:35:00
VMX-10182,VM-034,Bangalore,Hospital,13-05-2025,02:01:00,P-105,Dettol Wipe,Hygiene,106.08,185.0,183.0,2.0,19412.64,RP-005,Ravi,Low Power,11.8,UPI,2.2,118.0,3.3,470.0,1.0,2025-05-13 02:01:00
VMX-10183,VM-096,Chennai,Office,30-03-2025,11:13:00,P-107,Colgate Mini,Hygiene,14.13,194.0,181.0,13.0,2557.53,RP-015,Amit,Working,19.2,Card,2.7,37.0,3.0,331.0,1.0,2025-03-30 11:13:00
VMX-10184,VM-270,Bangalore,Metro Station,03-08-2025,06:41:00,P-100,Lays Classic,Snacks,22.28,118.0,114.0,4.0,2539.92,RP-001,Kiran,Maintenance,15.4,Card,4.3,44.0,4.65,307.0,1.0,2025-08-03 06:41:00
VMX-10185,VM-144,Hyderabad,Hospital,23-04-2025,00:57:00,P-106,Snickers Bar,Snacks,47.86,26.0,16.0,10.0,765.76,RP-017,Deepa,Maintenance,25.0,Cash,2.3,84.0,1.96,323.0,0.0,2025-04-23 00:57:00
VMX-10186,VM-163,Kolkata,Office,30-03-2025,05:15:00,P-103,Oreo Pack,Snacks,90.6,119.0,108.0,11.0,9784.8,RP-019,Mahesh,Maintenance,20.5,Card,3.7,72.0,4.79,478.0,1.0,2025-03-30 05:15:00
VMX-10187,VM-113,Hyderabad,Metro Station,16-02-2025,01:14:00,P-108,Sprite Bottle,Drinks,53.27,145.0,144.0,1.0,7670.88,RP-016,Mahesh,Low Power,23.8,Cash,4.4,43.0,3.87,460.0,1.0,2025-02-16 01:14:00
VMX-10188,VM-187,Hyderabad,Office,26-02-2025,16:55:00,P-100,Lays Classic,Snacks,13.07,170.0,166.0,4.0,2169.62,RP-013,Rahul,Working,15.0,UPI,2.4,20.0,3.93,273.0,1.0,2025-02-26 16:55:00
VMX-10189,VM-090,Mumbai,Office,02-07-2025,07:42:00,P-105,Dettol Wipe,Hygiene,34.39,163.0,144.0,19.0,4952.16,RP-010,Amit,Working,20.9,Card,4.8,50.0,4.4,444.0,0.0,2025-07-02 07:42:00
VMX-10190,VM-170,Delhi,College,23-02-2025,15:09:00,P-102,Bisleri Water,Drinks,94.33,176.0,169.0,7.0,15941.77,RP-008,Deepa,Low Power,12.5,Cash,4.5,85.0,3.56,221.0,1.0,2025-02-23 15:09:00
VMX-10191,VM-056,Delhi,College,29-06-2025,08:50:00,P-100,Lays Classic,Snacks,47.13,83.0,81.0,2.0,3817.53,RP-002,Kiran,Low Power,21.0,Cash,4.7,63.0,4.53,229.0,1.0,2025-06-29 08:50:00
VMX-10192,VM-038,Kolkata,College,26-04-2025,05:28:00,P-101,Pepsi Can,Drinks,126.03,167.0,147.0,20.0,18526.41,RP-010,Mahesh,Low Power,13.9,Cash,2.2,21.0,4.55,132.0,0.0,2025-04-26 05:28:00
VMX-10193,VM-221,Delhi,Mall,05-09-2025,22:01:00,P-108,Sprite Bottle,Drinks,141.86,43.0,33.0,10.0,4681.38,RP-020,Kiran,Working,10.8,UPI,2.6,24.0,2.64,333.0,1.0,2025-09-05 22:01:00
VMX-10194,VM-252,Bangalore,College,21-07-2025,18:35:00,P-104,Red Bull,Drinks,51.64,44.0,43.0,1.0,2220.52,RP-012,Mahesh,Low Power,11.3,Card,0.0,61.0,1.8,63.0,0.0,2025-07-21 18:35:00
VMX-10195,VM-204,Mumbai,Hospital,01-03-2025,09:50:00,P-102,Bisleri Water,Drinks,99.35,40.0,25.0,15.0,2483.75,RP-009,Ravi,Maintenance,18.2,Cash,3.1,48.0,2.48,278.0,0.0,2025-03-01 09:50:00
VMX-10196,VM-078,Kolkata,College,18-05-2025,18:03:00,P-104,Red Bull,Drinks,71.56,87.0,80.0,7.0,5724.8,RP-003,Deepa,Maintenance,16.2,Card,2.7,7.0,4.36,469.0,1.0,2025-05-18 18:03:00
VMX-10197,VM-041,Mumbai,College,01-05-2025,15:19:00,P-108,Sprite Bottle,Drinks,106.19,141.0,123.0,18.0,13061.37,RP-017,Rahul,Maintenance,22.0,Card,4.9,18.0,1.48,437.0,1.0,2025-05-01 15:19:00
VMX-10198,VM-217,Hyderabad,Hospital,09-04-2025,04:02:00,P-102,Bisleri Water,Drinks,142.87,62.0,56.0,6.0,8000.72,RP-007,Amit,Maintenance,13.9,Card,4.7,8.0,1.35,334.0,1.0,2025-04-09 04:02:00
VMX-10199,VM-268,Kolkata,Hospital,23-08-2025,00:50:00,P-108,Sprite Bottle,Drinks,55.66,90.0,74.0,16.0,4118.84,RP-004,Kiran,Working,12.2,Card,3.7,120.0,1.4,104.0,0.0,2025-08-23 00:50:00
VMX-10200,VM-249,Pune,Metro Station,16-05-2025,12:41:00,P-104,Red Bull,Drinks,131.45,108.0,95.0,13.0,12487.75,RP-016,Mahesh,Working,14.1,Cash,3.9,87.0,3.77,69.0,1.0,2025-05-16 12:41:00
VMX-10201,VM-173,Kolkata,Office,18-05-2025,11:01:00,P-105,Dettol Wipe,Hygiene,106.67,32.0,17.0,15.0,1813.39,RP-010,Anita,Low Power,22.9,Card,2.3,111.0,1.91,203.0,1.0,2025-05-18 11:01:00
VMX-10202,VM-109,Kolkata,Hospital,15-02-2025,06:28:00,P-105,Dettol Wipe,Hygiene,47.72,126.0,107.0,19.0,5106.04,RP-016,Fatima,Low Power,22.3,Card,4.4,8.0,2.24,309.0,1.0,2025-02-15 06:28:00
VMX-10203,VM-103,Kolkata,College,15-01-2025,05:12:00,P-102,Bisleri Water,Drinks,119.27,154.0,136.0,18.0,16220.72,RP-008,Mahesh,Low Power,10.8,UPI,4.1,35.0,2.47,287.0,1.0,2025-01-15 05:12:00
VMX-10204,VM-091,Kolkata,Hospital,08-09-2025,19:28:00,P-101,Pepsi Can,Drinks,105.36,81.0,70.0,11.0,7375.2,RP-019,Fatima,Low Power,15.2,UPI,4.2,88.0,1.36,64.0,1.0,2025-09-08 19:28:00
VMX-10205,VM-106,Chennai,Hospital,24-04-2025,20:14:00,P-100,Lays Classic,Snacks,32.81,166.0,160.0,6.0,5249.6,RP-017,Mahesh,Maintenance,10.1,Cash,3.9,76.0,4.2,164.0,1.0,2025-04-24 20:14:00
VMX-10206,VM-193,Kolkata,Office,21-05-2025,13:57:00,P-109,Doritos,Snacks,122.71,98.0,78.0,20.0,9571.38,RP-015,Anita,Working,17.0,Card,3.6,79.0,2.59,102.0,0.0,2025-05-21 13:57:00
VMX-10207,VM-056,Mumbai,College,25-05-2025,09:43:00,P-108,Sprite Bottle,Drinks,149.92,115.0,98.0,17.0,14692.16,RP-011,Anita,Maintenance,14.9,UPI,2.8,91.0,4.81,383.0,1.0,2025-05-25 09:43:00
VMX-10208,VM-072,Delhi,College,26-07-2025,21:20:00,P-103,Oreo Pack,Snacks,30.99,81.0,80.0,1.0,2479.2,RP-016,Anita,Unknown,23.6,UPI,3.2,4.0,3.33,342.0,0.0,2025-07-26 21:20:00
VMX-10209,VM-260,Chennai,Mall,01-09-2025,21:22:00,P-105,Dettol Wipe,Hygiene,111.72,76.0,59.0,17.0,6591.48,RP-018,Amit,Low Power,11.5,Cash,4.2,92.0,4.23,440.0,0.0,2025-09-01 21:22:00
VMX-10210,VM-158,Mumbai,Office,25-04-2025,23:55:00,P-105,Dettol Wipe,Hygiene,101.62,76.0,65.0,11.0,6605.3,RP-012,Anita,Maintenance,14.4,Cash,3.4,110.0,3.54,347.0,0.0,2025-04-25 23:55:00
VMX-10211,VM-212,Hyderabad,Mall,15-07-2025,16:19:00,P-107,Colgate Mini,Hygiene,134.52,148.0,145.0,3.0,19505.4,RP-005,Suresh,Low Power,16.1,Card,4.7,58.0,1.57,491.0,0.0,2025-07-15 16:19:00
VMX-10212,VM-003,Mumbai,Office,10-06-2025,20:03:00,P-101,Pepsi Can,Drinks,78.26,181.0,176.0,5.0,13773.76,RP-007,Amit,Maintenance,21.5,UPI,4.4,99.0,1.35,364.0,1.0,2025-06-10 20:03:00
VMX-10213,VM-103,Delhi,Office,03-01-2025,01:34:00,P-106,Snickers Bar,Snacks,66.48,142.0,130.0,12.0,8642.4,RP-001,Deepa,Maintenance,12.9,Card,2.0,93.0,2.0,405.0,1.0,2025-01-03 01:34:00
VMX-10214,VM-024,Chennai,Office,06-06-2025,05:04:00,P-104,Red Bull,Drinks,28.05,118.0,102.0,16.0,2861.1,RP-015,Fatima,Maintenance,17.9,UPI,4.7,17.0,2.37,300.0,1.0,2025-06-06 05:04:00
VMX-10215,VM-068,Bangalore,College,27-04-2025,07:46:00,P-103,Oreo Pack,Snacks,33.08,123.0,123.0,0.0,4068.84,RP-019,Fatima,Working,11.8,Card,4.0,4.0,2.5,377.0,1.0,2025-04-27 07:46:00
VMX-10216,VM-011,Hyderabad,College,25-02-2025,20:53:00,P-108,Sprite Bottle,Drinks,97.24,0.0,171.0,1.0,16628.04,RP-014,Rajesh,Low Power,11.9,UPI,3.4,19.0,1.82,401.0,0.0,2025-02-25 20:53:00
VMX-10217,VM-071,Mumbai,College,19-05-2025,19:38:00,P-104,Red Bull,Drinks,68.92,45.0,29.0,16.0,1998.68,RP-017,Rahul,Working,14.2,Cash,3.5,77.0,1.8,184.0,0.0,2025-05-19 19:38:00
VMX-10218,VM-107,Delhi,Hospital,21-01-2025,17:31:00,P-105,Dettol Wipe,Hygiene,108.48,95.0,90.0,5.0,9763.2,RP-011,Suresh,Working,10.2,Cash,4.7,106.0,3.3,302.0,0.0,2025-01-21 17:31:00
VMX-10219,VM-234,Chennai,Office,12-05-2025,20:14:00,P-101,Pepsi Can,Drinks,119.13,39.0,36.0,3.0,4288.68,RP-015,Mahesh,Working,22.2,Cash,4.6,46.0,4.21,210.0,1.0,2025-05-12 20:14:00
VMX-10220,VM-088,Chennai,Office,12-03-2025,21:41:00,P-101,Pepsi Can,Drinks,23.3,31.0,31.0,0.0,722.3,RP-015,Rahul,Low Power,23.2,Cash,3.1,43.0,1.73,255.0,1.0,2025-03-12 21:41:00
VMX-10221,VM-086,Hyderabad,Mall,04-08-2025,20:56:00,P-107,Colgate Mini,Hygiene,48.06,118.0,103.0,15.0,4950.18,RP-002,Amit,Working,16.2,Card,3.4,72.0,3.71,142.0,1.0,2025-08-04 20:56:00
VMX-10222,VM-211,Mumbai,College,05-09-2025,15:07:00,P-105,Dettol Wipe,Hygiene,95.59,195.0,191.0,4.0,18257.69,RP-003,Anita,Maintenance,14.7,Card,4.6,67.0,4.07,345.0,0.0,2025-09-05 15:07:00
VMX-10223,VM-128,Mumbai,Office,18-02-2025,13:42:00,P-105,Dettol Wipe,Hygiene,82.67,196.0,177.0,19.0,14632.59,RP-013,Amit,Maintenance,23.4,Card,2.2,82.0,4.74,308.0,1.0,2025-02-18 13:42:00
VMX-10224,VM-143,Hyderabad,Metro Station,14-06-2025,07:21:00,P-107,Colgate Mini,Hygiene,131.72,39.0,24.0,15.0,3161.28,RP-008,Fatima,Maintenance,15.7,Cash,2.2,56.0,4.21,279.0,0.0,2025-06-14 07:21:00
VMX-10225,VM-212,Hyderabad,Metro Station,10-01-2025,03:25:00,P-107,Colgate Mini,Hygiene,72.59,50.0,35.0,15.0,2540.65,RP-018,Mahesh,Working,21.9,Card,3.9,113.0,3.03,155.0,1.0,2025-01-10 03:25:00
VMX-10226,VM-243,Delhi,Office,21-08-2025,10:35:00,P-105,Dettol Wipe,Hygiene,60.87,33.0,26.0,7.0,1582.62,RP-015,Ravi,Working,21.4,Cash,2.0,45.0,4.32,459.0,1.0,2025-08-21 10:35:00
VMX-10227,VM-072,Kolkata,Hospital,24-01-2025,05:31:00,P-108,Sprite Bottle,Drinks,83.08,199.0,196.0,3.0,16283.68,RP-004,Anita,Maintenance,12.9,Cash,4.8,50.0,1.86,472.0,0.0,2025-01-24 05:31:00
VMX-10228,VM-259,Bangalore,Hospital,05-03-2025,14:29:00,P-105,Dettol Wipe,Hygiene,25.09,126.0,125.0,1.0,3136.25,RP-001,Fatima,Maintenance,10.7,UPI,4.5,61.0,4.7,449.0,0.0,2025-03-05 14:29:00
VMX-10229,VM-165,Pune,Hospital,18-07-2025,21:38:00,P-109,Doritos,Snacks,34.31,52.0,49.0,3.0,1681.19,RP-014,Rahul,Maintenance,21.4,UPI,3.2,43.0,4.88,281.0,0.0,2025-07-18 21:38:00
VMX-10230,VM-161,Delhi,Metro Station,03-06-2025,22:35:00,P-102,Bisleri Water,Drinks,67.78,199.0,183.0,16.0,12403.74,RP-007,Suresh,Working,19.4,UPI,4.1,117.0,3.69,413.0,0.0,2025-06-03 22:35:00
VMX-10231,VM-246,Pune,Metro Station,01-03-2025,11:35:00,P-108,Sprite Bottle,Drinks,85.95,183.0,173.0,10.0,14869.35,RP-014,Fatima,Low Power,23.2,UPI,4.4,66.0,1.43,245.0,0.0,2025-03-01 11:35:00
VMX-10232,VM-129,Bangalore,College,24-03-2025,09:43:00,P-100,Lays Classic,Snacks,103.84,71.0,63.0,8.0,6541.92,RP-010,Suresh,Maintenance,10.5,UPI,2.3,111.0,3.7,337.0,0.0,2025-03-24 09:43:00
VMX-10233,VM-214,Kolkata,Office,25-01-2025,12:24:00,P-108,Sprite Bottle,Drinks,64.44,150.0,141.0,9.0,9086.04,RP-018,Mahesh,Working,21.2,Cash,3.9,99.0,4.44,276.0,0.0,2025-01-25 12:24:00
VMX-10234,VM-151,Mumbai,Mall,11-04-2025,23:12:00,P-105,Dettol Wipe,Hygiene,115.72,159.0,140.0,19.0,16200.8,RP-003,Amit,Working,21.0,Cash,3.1,54.0,2.12,185.0,0.0,2025-04-11 23:12:00
VMX-10235,VM-080,Hyderabad,Mall,19-06-2025,14:45:00,P-102,Bisleri Water,Drinks,91.76,85.0,85.0,0.0,7799.6,RP-011,Rahul,Working,21.6,Card,3.8,84.0,2.2,454.0,1.0,2025-06-19 14:45:00
VMX-10236,VM-035,Kolkata,Metro Station,23-04-2025,05:33:00,P-101,Pepsi Can,Drinks,119.76,101.0,85.0,16.0,10179.6,RP-006,Kiran,Maintenance,18.1,Cash,3.0,113.0,1.85,219.0,1.0,2025-04-23 05:33:00
VMX-10237,VM-005,Hyderabad,Office,01-09-2025,17:52:00,P-105,Dettol Wipe,Hygiene,51.1,178.0,162.0,16.0,8278.2,RP-015,Suresh,Maintenance,19.2,Card,2.7,5.0,3.73,214.0,1.0,2025-09-01 17:52:00
VMX-10238,VM-192,Pune,Metro Station,13-01-2025,16:52:00,P-101,Pepsi Can,Drinks,64.02,158.0,149.0,9.0,9538.98,RP-015,Rajesh,Working,14.4,Card,2.6,65.0,1.33,99.0,0.0,2025-01-13 16:52:00
VMX-10239,VM-110,Kolkata,Hospital,18-04-2025,21:40:00,P-108,Sprite Bottle,Drinks,84.65,180.0,178.0,2.0,15067.7,RP-004,Suresh,Maintenance,22.4,Card,4.3,82.0,4.27,86.0,0.0,2025-04-18 21:40:00
VMX-10240,VM-092,Kolkata,Office,14-02-2025,02:03:00,P-100,Lays Classic,Snacks,74.29,104.0,103.0,1.0,7651.87,RP-018,Ravi,Maintenance,22.3,UPI,3.2,57.0,3.52,271.0,1.0,2025-02-14 02:03:00
VMX-10241,VM-033,Kolkata,Metro Station,04-01-2025,20:46:00,P-100,Lays Classic,Snacks,64.53,50.0,33.0,17.0,2129.49,RP-002,Ravi,Low Power,23.9,Cash,2.9,87.0,2.21,94.0,1.0,2025-01-04 20:46:00
VMX-10242,VM-113,Bangalore,Hospital,31-08-2025,05:34:00,P-107,Colgate Mini,Hygiene,63.4,189.0,189.0,0.0,11982.6,RP-018,Anita,Maintenance,12.2,Card,4.7,101.0,4.47,381.0,1.0,2025-08-31 05:34:00
VMX-10243,VM-294,Pune,Hospital,05-03-2025,01:00:00,P-100,Lays Classic,Snacks,87.49,162.0,158.0,4.0,13823.42,RP-018,Fatima,Working,14.6,Card,4.2,92.0,2.38,261.0,0.0,2025-03-05 01:00:00
VMX-10244,VM-291,Kolkata,College,10-04-2025,03:11:00,P-102,Bisleri Water,Drinks,35.76,177.0,169.0,8.0,6043.44,RP-018,Rajesh,Maintenance,18.2,UPI,4.0,32.0,1.39,421.0,1.0,2025-04-10 03:11:00
VMX-10245,VM-036,Bangalore,Office,01-05-2025,03:18:00,P-105,Dettol Wipe,Hygiene,60,191.0,171.0,20.0,10260.0,RP-016,Rajesh,Low Power,19.2,UPI,4.1,19.0,3.26,236.0,1.0,2025-05-01 03:18:00
VMX-10246,VM-224,Chennai,Office,24-04-2025,22:47:00,P-106,Snickers Bar,Snacks,33.61,100.0,93.0,7.0,3125.73,RP-005,Deepa,Low Power,16.9,UPI,4.3,62.0,3.21,139.0,0.0,2025-04-24 22:47:00
VMX-10247,VM-040,Delhi,College,11-04-2025,08:46:00,P-104,Red Bull,Drinks,130.22,55.0,38.0,17.0,4948.36,RP-001,Fatima,Maintenance,10.5,Card,3.7,98.0,3.36,68.0,1.0,2025-04-11 08:46:00
VMX-10248,VM-115,Kolkata,Metro Station,18-03-2025,11:25:00,P-108,Sprite Bottle,Drinks,135.16,158.0,143.0,15.0,19327.88,RP-010,Amit,Low Power,17.5,Cash,3.2,64.0,1.04,172.0,0.0,2025-03-18 11:25:00
VMX-10249,VM-248,Chennai,College,16-03-2025,23:46:00,P-108,Sprite Bottle,Drinks,29.65,60.0,55.0,5.0,1630.75,RP-008,Rajesh,Working,10.9,UPI,2.7,85.0,1.83,455.0,1.0,2025-03-16 23:46:00
VMX-10250,VM-053,Delhi,Metro Station,21-01-2025,20:20:00,P-106,Snickers Bar,Snacks,75.75,136.0,135.0,1.0,10226.25,RP-009,Anita,Maintenance,18.2,Cash,3.1,48.0,2.46,384.0,0.0,2025-01-21 20:20:00
VMX-10251,VM-177,Mumbai,Hospital,27-07-2025,11:52:00,P-108,Sprite Bottle,Drinks,45.22,77.0,61.0,16.0,2758.42,RP-020,Mahesh,Maintenance,23.2,UPI,2.5,9.0,3.06,193.0,0.0,2025-07-27 11:52:00
VMX-10252,VM-213,Kolkata,Office,02-03-2025,21:14:00,P-102,Bisleri Water,Drinks,36.17,112.0,93.0,19.0,3363.81,RP-004,Rajesh,Maintenance,17.2,Cash,3.8,82.0,4.33,61.0,0.0,2025-03-02 21:14:00
VMX-10253,VM-021,Pune,Mall,10-03-2025,20:32:00,P-100,Lays Classic,Snacks,27.9,171.0,166.0,5.0,4631.4,RP-002,Amit,Low Power,23.8,Card,4.9,76.0,4.88,376.0,0.0,2025-03-10 20:32:00
VMX-10254,VM-113,Kolkata,Hospital,30-08-2025,15:10:00,P-104,Red Bull,Drinks,142.62,75.0,61.0,14.0,8699.82,RP-020,Amit,Maintenance,22.3,Cash,3.9,65.0,2.06,420.0,1.0,2025-08-30 15:10:00
VMX-10255,VM-056,Hyderabad,Mall,13-07-2025,12:08:00,P-107,Colgate Mini,Hygiene,93.51,37.0,30.0,7.0,2805.3,RP-017,Fatima,Maintenance,16.3,Cash,3.8,22.0,2.9,364.0,0.0,2025-07-13 12:08:00
VMX-10256,VM-277,Kolkata,College,04-09-2025,21:08:00,P-108,Sprite Bottle,Drinks,80.47,50.0,48.0,2.0,3862.56,RP-014,Fatima,Low Power,15.6,Cash,4.1,54.0,1.92,460.0,1.0,2025-09-04 21:08:00
VMX-10257,VM-131,Mumbai,Mall,20-02-2025,13:08:00,P-106,Snickers Bar,Snacks,59.07,198.0,180.0,18.0,10632.6,RP-003,Anita,Maintenance,23.2,UPI,2.8,0.0,3.84,454.0,0.0,2025-02-20 13:08:00
VMX-10258,VM-162,Mumbai,Office,12-07-2025,20:13:00,P-109,Doritos,Snacks,83.16,153.0,153.0,0.0,12723.48,RP-004,Amit,Low Power,19.8,UPI,2.8,68.0,2.69,237.0,1.0,2025-07-12 20:13:00
VMX-10259,VM-287,Pune,Hospital,05-09-2025,05:23:00,P-106,Snickers Bar,Snacks,115.7,125.0,108.0,17.0,12495.6,RP-009,Anita,Maintenance,15.2,Card,3.2,17.0,4.42,387.0,0.0,2025-09-05 05:23:00
VMX-10260,VM-206,Kolkata,Office,21-02-2025,06:32:00,P-103,Oreo Pack,Snacks,72.52,199.0,194.0,5.0,14068.88,RP-018,Rahul,Maintenance,20.3,Cash,2.5,81.0,1.02,96.0,0.0,2025-02-21 06:32:00
VMX-10261,VM-190,Hyderabad,Metro Station,02-02-2025,08:14:00,P-107,Colgate Mini,Hygiene,139.62,131.0,129.0,2.0,18010.98,RP-002,Kiran,Low Power,19.2,Card,2.9,76.0,1.23,446.0,0.0,2025-02-02 08:14:00
VMX-10262,VM-262,Pune,Mall,27-05-2025,06:02:00,P-107,Colgate Mini,Hygiene,71.46,71.0,55.0,16.0,3930.3,RP-020,Amit,Maintenance,10.5,Cash,4.0,20.0,1.35,191.0,1.0,2025-05-27 06:02:00
VMX-10263,VM-036,Hyderabad,Metro Station,13-04-2025,16:00:00,P-105,Dettol Wipe,Hygiene,103.75,123.0,105.0,18.0,10893.75,RP-010,Fatima,Maintenance,15.2,UPI,2.7,24.0,2.82,256.0,0.0,2025-04-13 16:00:00
VMX-10264,VM-175,Hyderabad,Metro Station,07-02-2025,16:18:00,P-104,Red Bull,Drinks,34.5,149.0,146.0,3.0,5037.0,RP-009,Fatima,Maintenance,13.8,UPI,4.9,72.0,2.93,174.0,1.0,2025-02-07 16:18:00
VMX-10265,VM-035,Mumbai,Mall,04-09-2025,03:16:00,P-107,Colgate Mini,Hygiene,105.42,170.0,170.0,0.0,17921.4,RP-008,Deepa,Low Power,24.3,Card,3.6,89.0,4.33,177.0,1.0,2025-09-04 03:16:00
VMX-10266,VM-182,Bangalore,Metro Station,02-04-2025,15:20:00,P-101,Pepsi Can,Drinks,65.85,107.0,105.0,2.0,6914.25,RP-009,Amit,Maintenance,20.2,Cash,3.5,25.0,1.94,173.0,1.0,2025-04-02 15:20:00
VMX-10267,VM-055,Hyderabad,College,02-07-2025,04:49:00,P-103,Oreo Pack,Snacks,42.09,83.0,64.0,19.0,2693.76,RP-016,Rahul,Working,21.5,Card,4.9,108.0,2.93,367.0,1.0,2025-07-02 04:49:00
VMX-10268,VM-262,Chennai,Hospital,09-09-2025,05:48:00,P-107,Colgate Mini,Hygiene,135.74,167.0,159.0,8.0,21582.66,RP-008,Rahul,Working,10.8,UPI,3.4,69.0,1.13,227.0,1.0,2025-09-09 05:48:00
VMX-10269,VM-005,Hyderabad,Mall,24-08-2025,10:44:00,P-102,Bisleri Water,Drinks,74.01,50.0,34.0,16.0,2516.34,RP-013,Rahul,Working,14.9,Card,4.6,23.0,3.19,171.0,1.0,2025-08-24 10:44:00
VMX-10270,VM-108,Mumbai,Office,05-04-2025,15:27:00,P-107,Colgate Mini,Hygiene,144.19,107.0,96.0,11.0,13842.24,RP-012,Kiran,Low Power,16.8,Card,2.4,73.0,3.74,466.0,0.0,2025-04-05 15:27:00
VMX-10271,VM-077,Mumbai,College,15-07-2025,06:09:00,P-104,Red Bull,Drinks,122.57,162.0,149.0,13.0,18262.93,RP-006,Kiran,Low Power,12.0,Card,3.6,92.0,2.26,299.0,1.0,2025-07-15 06:09:00
VMX-10272,VM-084,Hyderabad,Mall,23-07-2025,03:44:00,P-104,Red Bull,Drinks,88.7,165.0,164.0,1.0,14546.8,RP-009,Rajesh,Maintenance,11.4,Card,3.0,46.0,2.44,335.0,1.0,2025-07-23 03:44:00
VMX-10273,VM-276,Bangalore,Office,12-04-2025,18:36:00,P-105,Dettol Wipe,Hygiene,12.78,51.0,40.0,11.0,511.2,RP-012,Deepa,Maintenance,17.7,Card,3.3,10.0,2.52,196.0,1.0,2025-04-12 18:36:00
VMX-10274,VM-293,Mumbai,College,04-08-2025,20:39:00,P-102,Bisleri Water,Drinks,131.56,183.0,173.0,10.0,22759.88,RP-003,Amit,Low Power,13.4,UPI,4.0,90.0,2.07,380.0,1.0,2025-08-04 20:39:00
VMX-10275,VM-086,Bangalore,College,24-09-2025,14:26:00,P-104,Red Bull,Drinks,134.28,112.0,94.0,18.0,12622.32,RP-005,Suresh,Maintenance,13.8,Card,4.1,10.0,1.84,253.0,0.0,2025-09-24 14:26:00
VMX-10276,VM-204,Pune,College,28-01-2025,00:49:00,P-101,Pepsi Can,Drinks,18.93,141.0,124.0,17.0,2347.32,RP-004,Anita,Maintenance,12.3,Card,4.8,49.0,2.24,176.0,1.0,2025-01-28 00:49:00
VMX-10277,VM-183,Kolkata,Office,29-03-2025,00:02:00,P-107,Colgate Mini,Hygiene,97.71,53.0,37.0,16.0,3615.27,RP-016,Rajesh,Maintenance,24.0,Card,3.3,89.0,3.16,352.0,1.0,2025-03-29 00:02:00
VMX-10278,VM-178,Mumbai,Metro Station,01-10-2025,09:58:00,P-109,Doritos,Snacks,70.9,183.0,163.0,20.0,11556.7,RP-008,Ravi,Low Power,14.6,UPI,2.8,38.0,1.04,317.0,0.0,2025-10-01 09:58:00
VMX-10279,VM-005,Kolkata,Hospital,09-09-2025,15:19:00,P-105,Dettol Wipe,Hygiene,50.15,156.0,156.0,0.0,7823.4,RP-010,Rahul,Working,22.0,Card,3.1,52.0,4.53,273.0,1.0,2025-09-09 15:19:00
VMX-10280,VM-041,Mumbai,Mall,13-07-2025,07:16:00,P-103,Oreo Pack,Snacks,32.86,185.0,173.0,12.0,5684.78,RP-017,Rahul,Maintenance,20.3,UPI,3.9,68.0,4.24,261.0,0.0,2025-07-13 07:16:00
VMX-10281,VM-140,Delhi,Metro Station,22-08-2025,19:28:00,P-101,Pepsi Can,Drinks,35.54,94.0,91.0,3.0,3234.14,RP-016,Suresh,Low Power,10.3,Cash,4.9,2.0,1.74,102.0,1.0,2025-08-22 19:28:00
VMX-10282,VM-008,Mumbai,Mall,30-04-2025,02:09:00,P-104,Red Bull,Drinks,27.51,132.0,132.0,0.0,3631.32,RP-011,Kiran,Low Power,21.8,UPI,5.0,59.0,3.79,66.0,1.0,2025-04-30 02:09:00
VMX-10283,VM-279,Mumbai,Mall,17-05-2025,12:04:00,P-101,Pepsi Can,Drinks,128.1,57.0,56.0,1.0,7173.6,RP-007,Anita,Low Power,22.4,Cash,4.9,91.0,2.0,444.0,1.0,2025-05-17 12:04:00
VMX-10284,VM-049,Pune,Mall,24-08-2025,23:49:00,P-103,Oreo Pack,Snacks,113.27,28.0,22.0,6.0,2491.94,RP-016,Kiran,Maintenance,24.4,UPI,2.5,93.0,1.17,331.0,0.0,2025-08-24 23:49:00
VMX-10285,VM-112,Hyderabad,Mall,04-07-2025,01:55:00,P-104,Red Bull,Drinks,77.37,96.0,90.0,6.0,6963.3,RP-014,Deepa,Working,12.5,UPI,3.8,50.0,4.16,54.0,0.0,2025-07-04 01:55:00
VMX-10286,VM-046,Bangalore,Mall,21-03-2025,11:49:00,P-109,Doritos,Snacks,119.69,141.0,122.0,19.0,14602.18,RP-016,Ravi,Maintenance,19.3,Card,2.2,45.0,3.58,409.0,0.0,2025-03-21 11:49:00
VMX-10287,VM-099,Hyderabad,Hospital,27-06-2025,14:46:00,P-102,Bisleri Water,Drinks,78.3,101.0,84.0,17.0,6577.2,RP-012,Amit,Low Power,23.5,UPI,4.1,71.0,2.18,406.0,1.0,2025-06-27 14:46:00
VMX-10288,VM-141,Kolkata,Metro Station,15-06-2025,23:29:00,P-103,Oreo Pack,Snacks,89.34,159.0,148.0,11.0,13222.32,RP-018,Amit,Working,18.0,UPI,2.9,33.0,3.17,282.0,0.0,2025-06-15 23:29:00
VMX-10289,VM-165,Delhi,College,06-07-2025,19:15:00,P-108,Sprite Bottle,Drinks,63.07,67.0,67.0,0.0,4225.69,RP-018,Kiran,Working,17.9,UPI,4.3,19.0,3.45,215.0,1.0,2025-07-06 19:15:00
VMX-10290,VM-017,Bangalore,College,23-01-2025,04:11:00,P-105,Dettol Wipe,Hygiene,25.46,153.0,151.0,2.0,3844.46,RP-016,Suresh,Working,10.5,Card,4.5,84.0,2.96,369.0,1.0,2025-01-23 04:11:00
VMX-10291,VM-252,Kolkata,College,07-01-2025,06:41:00,P-100,Lays Classic,Snacks,61.29,175.0,173.0,2.0,10603.17,RP-015,Mahesh,Low Power,18.4,UPI,4.5,101.0,3.83,471.0,1.0,2025-01-07 06:41:00
VMX-10292,VM-050,Hyderabad,Mall,09-02-2025,06:33:00,P-108,Sprite Bottle,Drinks,15.69,38.0,29.0,9.0,455.01,RP-018,Kiran,Working,12.9,Card,2.7,80.0,4.79,335.0,1.0,2025-02-09 06:33:00
VMX-10293,VM-219,Hyderabad,Mall,23-08-2025,22:42:00,P-101,Pepsi Can,Drinks,117.28,167.0,156.0,11.0,18295.68,RP-006,Fatima,Low Power,17.6,Card,2.5,76.0,2.77,230.0,1.0,2025-08-23 22:42:00
VMX-10294,VM-166,Pune,Mall,31-07-2025,20:27:00,P-108,Sprite Bottle,Drinks,148.8,103.0,92.0,11.0,13689.6,RP-019,Fatima,Working,15.6,Card,4.8,32.0,2.44,281.0,1.0,2025-07-31 20:27:00
VMX-10295,VM-155,Hyderabad,Office,09-01-2025,16:08:00,P-106,Snickers Bar,Snacks,10.03,28.0,19.0,9.0,190.57,RP-008,Suresh,Low Power,10.3,Card,4.5,117.0,3.21,334.0,0.0,2025-01-09 16:08:00
VMX-10296,VM-299,Bangalore,Mall,12-03-2025,08:23:00,P-101,Pepsi Can,Drinks,15.28,111.0,107.0,4.0,1634.96,RP-009,Anita,Working,18.6,Card,4.8,93.0,1.31,216.0,1.0,2025-03-12 08:23:00
VMX-10297,VM-154,Hyderabad,Metro Station,18-02-2025,19:41:00,P-102,Bisleri Water,Drinks,78.36,196.0,178.0,18.0,13948.08,RP-013,Ravi,Working,23.8,UPI,3.0,104.0,2.74,494.0,0.0,2025-02-18 19:41:00
VMX-10298,VM-269,Hyderabad,Office,15-07-2025,01:19:00,P-103,Oreo Pack,Snacks,114.68,174.0,174.0,0.0,19954.32,RP-018,Rahul,Working,14.9,Card,2.7,6.0,3.69,251.0,1.0,2025-07-15 01:19:00
VMX-10299,VM-202,Bangalore,Mall,10-08-2025,09:50:00,P-109,Doritos,Snacks,90.54,43.0,36.0,7.0,3259.44,RP-011,Ravi,Low Power,18.6,Cash,3.6,33.0,1.34,306.0,1.0,2025-08-10 09:50:00
VMX-10300,VM-293,Bangalore,Metro Station,12-04-2025,15:25:00,P-102,Bisleri Water,Drinks,116.68,143.0,126.0,17.0,14701.68,RP-020,Fatima,Working,13.6,UPI,4.3,41.0,3.74,344.0,0.0,2025-04-12 15:25:00
VMX-10301,VM-177,Pune,College,28-06-2025,06:20:00,P-101,Pepsi Can,Drinks,104.04,128.0,117.0,11.0,12172.68,RP-010,Amit,Low Power,19.2,UPI,3.9,56.0,1.18,468.0,0.0,2025-06-28 06:20:00
VMX-10302,VM-125,Pune,Mall,27-02-2025,23:03:00,P-103,Oreo Pack,Snacks,105.95,59.0,57.0,2.0,6039.15,RP-010,Mahesh,Low Power,20.4,Cash,2.9,60.0,1.09,157.0,0.0,2025-02-27 23:03:00
VMX-10303,VM-073,Delhi,College,05-09-2025,19:46:00,P-103,Oreo Pack,Snacks,86.5,86.0,69.0,17.0,5968.5,RP-013,Rahul,Maintenance,17.9,UPI,2.5,36.0,1.8,406.0,1.0,2025-09-05 19:46:00
VMX-10304,VM-185,Kolkata,College,18-07-2025,21:17:00,P-100,Lays Classic,Snacks,75.09,22.0,20.0,2.0,1501.8,RP-001,Anita,Maintenance,15.8,UPI,3.5,90.0,1.4,211.0,1.0,2025-07-18 21:17:00
VMX-10305,VM-012,Hyderabad,Mall,14-09-2025,14:35:00,P-109,Doritos,Snacks,84.42,67.0,61.0,6.0,5149.62,RP-017,Anita,Low Power,17.3,Card,2.5,44.0,3.74,231.0,0.0,2025-09-14 14:35:00
VMX-10306,VM-199,Kolkata,College,01-02-2025,20:16:00,P-103,Oreo Pack,Snacks,149.44,148.0,140.0,8.0,20921.6,RP-018,Anita,Working,12.3,UPI,4.0,11.0,3.92,316.0,0.0,2025-02-01 20:16:00
VMX-10307,VM-230,Pune,Mall,09-06-2025,19:21:00,P-106,Snickers Bar,Snacks,43.65,59.0,46.0,13.0,2007.9,RP-007,Amit,Maintenance,18.1,Cash,4.6,39.0,3.75,318.0,0.0,2025-06-09 19:21:00
VMX-10308,VM-286,Pune,College,22-03-2025,10:04:00,P-106,Snickers Bar,Snacks,149.4,57.0,37.0,20.0,5527.8,RP-006,Deepa,Working,20.9,UPI,4.6,52.0,4.84,205.0,1.0,2025-03-22 10:04:00
VMX-10309,VM-137,Pune,Metro Station,09-03-2025,05:01:00,P-104,Red Bull,Drinks,31.27,68.0,65.0,3.0,2032.55,RP-020,Suresh,Maintenance,13.5,Card,2.1,10.0,3.75,294.0,0.0,2025-03-09 05:01:00
VMX-10310,VM-199,Mumbai,Hospital,11-07-2025,05:54:00,P-108,Sprite Bottle,Drinks,128.46,140.0,120.0,20.0,15415.2,RP-005,Amit,Working,13.4,UPI,4.3,1.0,4.7,261.0,0.0,2025-07-11 05:54:00
VMX-10311,VM-167,Kolkata,Hospital,13-08-2025,19:31:00,P-103,Oreo Pack,Snacks,116.09,36.0,31.0,5.0,3598.79,RP-008,Kiran,Low Power,21.6,Card,4.2,48.0,3.88,251.0,0.0,2025-08-13 19:31:00
VMX-10312,VM-203,Delhi,College,06-05-2025,16:34:00,P-108,Sprite Bottle,Drinks,25.3,136.0,135.0,1.0,3415.5,RP-018,Kiran,Maintenance,21.5,Cash,2.6,56.0,2.59,205.0,1.0,2025-05-06 16:34:00
VMX-10313,VM-073,Mumbai,Hospital,28-01-2025,22:33:00,P-107,Colgate Mini,Hygiene,33.31,95.0,76.0,19.0,2531.56,RP-003,Fatima,Working,12.7,Card,4.8,89.0,3.19,251.0,1.0,2025-01-28 22:33:00
VMX-10314,VM-129,Chennai,Mall,14-04-2025,14:05:00,P-105,Dettol Wipe,Hygiene,73.12,65.0,51.0,14.0,3729.12,RP-004,Ravi,Working,20.6,Card,3.1,67.0,3.83,422.0,0.0,2025-04-14 14:05:00
VMX-10315,VM-077,Bangalore,Mall,21-06-2025,18:55:00,P-106,Snickers Bar,Snacks,87.05,31.0,26.0,5.0,2263.3,RP-006,Mahesh,Low Power,14.6,Card,4.3,57.0,2.16,142.0,0.0,2025-06-21 18:55:00
VMX-10316,VM-255,Kolkata,Hospital,10-05-2025,00:29:00,P-102,Bisleri Water,Drinks,144.46,20.0,1.0,19.0,144.46,RP-018,Mahesh,Maintenance,23.2,Cash,2.7,84.0,2.9,259.0,1.0,2025-05-10 00:29:00
VMX-10317,VM-286,Kolkata,Mall,08-10-2025,08:39:00,P-101,Pepsi Can,Drinks,94.17,21.0,14.0,7.0,1318.38,RP-002,Amit,Working,10.8,UPI,2.1,109.0,1.13,345.0,1.0,2025-10-08 08:39:00
VMX-10318,VM-146,Pune,Metro Station,02-08-2025,05:10:00,P-105,Dettol Wipe,Hygiene,138.85,32.0,29.0,3.0,4026.65,RP-019,Fatima,Working,24.5,Card,3.7,119.0,1.14,443.0,1.0,2025-08-02 05:10:00
VMX-10319,VM-150,Mumbai,Mall,07-08-2025,17:04:00,P-105,Dettol Wipe,Hygiene,61.6,117.0,115.0,2.0,7084.0,RP-004,Anita,Low Power,17.9,Card,2.6,26.0,3.45,105.0,0.0,2025-08-07 17:04:00
VMX-10320,VM-163,Chennai,Metro Station,07-08-2025,19:54:00,P-107,Colgate Mini,Hygiene,111.37,174.0,165.0,9.0,18376.05,RP-019,Rahul,Low Power,23.9,Card,3.7,66.0,3.92,304.0,1.0,2025-08-07 19:54:00
VMX-10321,VM-013,Mumbai,College,10-04-2025,00:07:00,P-102,Bisleri Water,Drinks,133.71,79.0,70.0,9.0,9359.7,RP-007,Rahul,Low Power,16.2,UPI,3.0,103.0,3.55,55.0,0.0,2025-04-10 00:07:00
VMX-10322,VM-166,Kolkata,College,03-06-2025,16:35:00,P-104,Red Bull,Drinks,45.62,37.0,28.0,9.0,1277.36,RP-004,Deepa,Low Power,15.9,Card,3.8,3.0,4.33,149.0,1.0,2025-06-03 16:35:00
VMX-10323,VM-247,Bangalore,Hospital,19-01-2025,20:08:00,P-105,Dettol Wipe,Hygiene,139.12,142.0,127.0,15.0,17668.24,RP-018,Deepa,Low Power,21.8,UPI,4.8,7.0,4.34,203.0,1.0,2025-01-19 20:08:00
VMX-10324,VM-077,Chennai,College,19-06-2025,11:04:00,P-108,Sprite Bottle,Drinks,85.02,73.0,55.0,18.0,4676.1,RP-011,Kiran,Maintenance,18.0,Cash,3.7,49.0,1.75,109.0,1.0,2025-06-19 11:04:00
VMX-10325,VM-122,Chennai,Hospital,14-02-2025,15:56:00,P-105,Dettol Wipe,Hygiene,109.38,89.0,76.0,13.0,8312.88,RP-010,Suresh,Maintenance,14.5,Cash,3.1,4.0,4.11,97.0,1.0,2025-02-14 15:56:00
VMX-10326,VM-248,Delhi,Metro Station,20-03-2025,06:21:00,P-108,Sprite Bottle,Drinks,13.49,143.0,127.0,16.0,1713.23,RP-010,Deepa,Working,21.5,Cash,4.5,120.0,3.06,117.0,0.0,2025-03-20 06:21:00
VMX-10327,VM-023,Delhi,Metro Station,03-01-2025,09:59:00,P-100,Lays Classic,Snacks,74.31,153.0,150.0,3.0,11146.5,RP-003,Deepa,Low Power,23.3,Cash,3.6,84.0,3.98,61.0,1.0,2025-01-03 09:59:00
VMX-10328,VM-226,Delhi,College,22-05-2025,17:20:00,P-103,Oreo Pack,Snacks,54.92,69.0,60.0,9.0,3295.2,RP-009,Amit,Working,14.1,Cash,4.9,71.0,3.06,155.0,1.0,2025-05-22 17:20:00
VMX-10329,VM-160,Pune,Office,06-05-2025,05:04:00,P-108,Sprite Bottle,Drinks,54.59,56.0,47.0,9.0,2565.73,RP-018,Rajesh,Working,12.0,UPI,4.7,6.0,1.42,77.0,0.0,2025-05-06 05:04:00
VMX-10330,VM-160,Chennai,Mall,17-08-2025,19:22:00,P-106,Snickers Bar,Snacks,64.87,200.0,181.0,19.0,11741.47,RP-018,Ravi,Low Power,18.5,Cash,4.4,117.0,3.79,99.0,1.0,2025-08-17 19:22:00
VMX-10331,VM-133,Chennai,Hospital,29-04-2025,07:09:00,P-104,Red Bull,Drinks,105.83,139.0,124.0,15.0,13122.92,RP-006,Deepa,Low Power,16.8,Cash,2.2,14.0,2.41,286.0,0.0,2025-04-29 07:09:00
VMX-10332,VM-208,Kolkata,College,07-03-2025,16:06:00,P-104,Red Bull,Drinks,117.51,174.0,156.0,18.0,18331.56,RP-011,Fatima,Maintenance,11.1,UPI,3.6,51.0,3.36,172.0,0.0,2025-03-07 16:06:00
VMX-10333,VM-221,Kolkata,Hospital,03-02-2025,10:13:00,P-108,Sprite Bottle,Drinks,32.26,143.0,131.0,12.0,4226.06,RP-019,Deepa,Maintenance,20.4,Cash,4.0,9.0,3.96,414.0,1.0,2025-02-03 10:13:00
VMX-10334,VM-158,Mumbai,College,19-02-2025,14:11:00,P-101,Pepsi Can,Drinks,92.9,138.0,128.0,10.0,11891.2,RP-020,Ravi,Maintenance,22.2,UPI,3.0,82.0,3.64,96.0,0.0,2025-02-19 14:11:00
VMX-10335,VM-232,Pune,Office,17-03-2025,21:09:00,P-102,Bisleri Water,Drinks,134.22,182.0,182.0,0.0,24428.04,RP-013,Rahul,Maintenance,16.7,Cash,4.0,40.0,2.2,456.0,1.0,2025-03-17 21:09:00
VMX-10336,VM-207,Kolkata,Mall,05-01-2025,19:32:00,P-106,Snickers Bar,Snacks,110.49,108.0,106.0,2.0,11711.94,RP-010,Mahesh,Low Power,23.5,Cash,2.0,71.0,4.28,233.0,0.0,2025-01-05 19:32:00
VMX-10337,VM-196,Mumbai,Hospital,21-07-2025,20:20:00,P-104,Red Bull,Drinks,131.2,80.0,67.0,13.0,8790.4,RP-014,Fatima,Working,19.9,UPI,2.4,71.0,2.54,234.0,1.0,2025-07-21 20:20:00
VMX-10338,VM-009,Bangalore,Hospital,10-03-2025,00:04:00,P-102,Bisleri Water,Drinks,50.39,191.0,187.0,4.0,9422.93,RP-014,Amit,Working,12.1,UPI,4.6,114.0,4.16,359.0,1.0,2025-03-10 00:04:00
VMX-10339,VM-116,Bangalore,Hospital,19-08-2025,12:22:00,P-109,Doritos,Snacks,35.17,150.0,137.0,13.0,4818.29,RP-020,Mahesh,Maintenance,17.5,Card,2.7,64.0,2.08,329.0,1.0,2025-08-19 12:22:00
VMX-10340,VM-247,Delhi,College,08-07-2025,03:37:00,P-100,Lays Classic,Snacks,146.95,165.0,150.0,15.0,22042.5,RP-005,Fatima,Low Power,17.0,Cash,3.6,78.0,1.35,291.0,0.0,2025-07-08 03:37:00
VMX-10341,VM-006,Mumbai,Hospital,28-01-2025,10:34:00,P-108,Sprite Bottle,Drinks,121.73,99.0,80.0,19.0,9738.4,RP-017,Rajesh,Maintenance,21.0,UPI,3.1,102.0,2.18,135.0,0.0,2025-01-28 10:34:00
VMX-10342,VM-297,Bangalore,Metro Station,01-02-2025,20:30:00,P-109,Doritos,Snacks,114.92,164.0,156.0,8.0,17927.52,RP-002,Anita,Maintenance,19.4,UPI,3.5,16.0,3.02,485.0,1.0,2025-02-01 20:30:00
VMX-10343,VM-058,Pune,Mall,12-05-2025,00:47:00,P-104,Red Bull,Drinks,28.56,91.0,83.0,8.0,2370.48,RP-019,Amit,Maintenance,16.7,Cash,2.8,89.0,1.94,142.0,0.0,2025-05-12 00:47:00
VMX-10344,VM-212,Kolkata,Hospital,20-03-2025,15:48:00,P-105,Dettol Wipe,Hygiene,147.77,57.0,38.0,19.0,5615.26,RP-008,Rajesh,Maintenance,19.6,Cash,3.7,107.0,2.38,378.0,1.0,2025-03-20 15:48:00
VMX-10345,VM-273,Bangalore,Hospital,01-09-2025,09:30:00,P-101,Pepsi Can,Drinks,17.35,138.0,126.0,12.0,2186.1,RP-013,Rajesh,Low Power,12.2,UPI,2.0,118.0,4.19,245.0,1.0,2025-09-01 09:30:00
VMX-10346,VM-222,Pune,Office,30-09-2025,20:22:00,P-108,Sprite Bottle,Drinks,105.6,30.0,27.0,3.0,2851.2,RP-011,Anita,Low Power,22.0,UPI,4.0,50.0,2.84,395.0,0.0,2025-09-30 20:22:00
VMX-10347,VM-006,Delhi,College,03-04-2025,10:35:00,P-109,Doritos,Snacks,117.87,153.0,143.0,10.0,16855.41,RP-003,Mahesh,Low Power,11.5,Cash,4.1,44.0,1.88,195.0,1.0,2025-04-03 10:35:00
VMX-10348,VM-112,Pune,College,30-01-2025,19:42:00,P-103,Oreo Pack,Snacks,14.77,178.0,176.0,2.0,2599.52,RP-004,Ravi,Maintenance,11.9,Card,4.3,82.0,3.26,144.0,0.0,2025-01-30 19:42:00
VMX-10349,VM-219,Delhi,Office,21-08-2025,08:49:00,P-102,Bisleri Water,Drinks,45.47,139.0,137.0,2.0,6229.39,RP-009,Amit,Working,14.2,Cash,3.1,42.0,4.98,182.0,1.0,2025-08-21 08:49:00
VMX-10350,VM-252,Hyderabad,Mall,21-07-2025,05:41:00,P-102,Bisleri Water,Drinks,71.68,145.0,139.0,6.0,9963.52,RP-018,Kiran,Working,19.2,Cash,4.7,91.0,2.04,67.0,0.0,2025-07-21 05:41:00
VMX-10351,VM-001,Hyderabad,Hospital,10-01-2025,15:09:00,P-101,Pepsi Can,Drinks,89.99,84.0,70.0,14.0,6299.3,RP-009,Amit,Maintenance,14.9,UPI,3.7,65.0,3.83,444.0,1.0,2025-01-10 15:09:00
VMX-10352,VM-247,Hyderabad,Metro Station,26-04-2025,00:24:00,P-107,Colgate Mini,Hygiene,71.05,37.0,20.0,17.0,1421.0,RP-018,Deepa,Low Power,20.2,UPI,2.2,82.0,1.36,323.0,1.0,2025-04-26 00:24:00
VMX-10353,VM-021,Mumbai,Mall,14-04-2025,05:35:00,P-101,Pepsi Can,Drinks,127.77,94.0,74.0,20.0,9454.98,RP-010,Kiran,Working,19.5,UPI,3.5,113.0,3.53,426.0,0.0,2025-04-14 05:35:00
VMX-10354,VM-033,Kolkata,Metro Station,03-05-2025,15:24:00,P-102,Bisleri Water,Drinks,15,26.0,8.0,18.0,120.0,RP-010,Rajesh,Maintenance,24.5,UPI,4.9,2.0,1.15,78.0,1.0,2025-05-03 15:24:00
VMX-10355,VM-275,Bangalore,Metro Station,25-09-2025,14:43:00,P-100,Lays Classic,Snacks,66.77,74.0,54.0,20.0,3605.58,RP-008,Ravi,Working,21.0,UPI,4.0,60.0,4.63,366.0,0.0,2025-09-25 14:43:00
VMX-10356,VM-158,Kolkata,College,30-03-2025,20:03:00,P-103,Oreo Pack,Snacks,108.18,53.0,53.0,0.0,5733.54,RP-015,Rahul,Working,22.5,Cash,4.5,13.0,1.46,354.0,0.0,2025-03-30 20:03:00
VMX-10357,VM-295,Pune,Mall,25-07-2025,10:07:00,P-101,Pepsi Can,Drinks,122.62,129.0,119.0,10.0,14591.78,RP-011,Suresh,Working,18.9,UPI,2.2,35.0,1.56,262.0,0.0,2025-07-25 10:07:00
VMX-10358,VM-193,Kolkata,Mall,21-01-2025,04:06:00,P-105,Dettol Wipe,Hygiene,87.48,132.0,125.0,7.0,10935.0,RP-001,Rajesh,Working,10.1,Cash,4.8,90.0,3.61,195.0,1.0,2025-01-21 04:06:00
VMX-10359,VM-211,Bangalore,Mall,19-05-2025,16:28:00,P-107,Colgate Mini,Hygiene,106.93,72.0,68.0,4.0,7271.24,RP-020,Mahesh,Maintenance,12.7,UPI,3.8,11.0,3.51,450.0,1.0,2025-05-19 16:28:00
VMX-10360,VM-049,Pune,Office,09-04-2025,03:33:00,P-105,Dettol Wipe,Hygiene,68.63,162.0,155.0,7.0,10637.65,RP-018,Fatima,Working,17.0,Card,4.0,35.0,1.21,107.0,0.0,2025-04-09 03:33:00
VMX-10361,VM-146,Bangalore,Hospital,28-01-2025,20:23:00,P-107,Colgate Mini,Hygiene,79.65,60.0,59.0,1.0,4699.35,RP-009,Deepa,Maintenance,22.1,UPI,2.1,94.0,1.21,325.0,0.0,2025-01-28 20:23:00
VMX-10362,VM-121,Delhi,Hospital,01-03-2025,02:57:00,P-102,Bisleri Water,Drinks,119.97,144.0,128.0,16.0,15356.16,RP-019,Rahul,Low Power,16.3,Card,4.0,41.0,0.0,106.0,1.0,2025-03-01 02:57:00
VMX-10363,VM-242,Pune,Hospital,12-07-2025,07:04:00,P-103,Oreo Pack,Snacks,23.73,125.0,119.0,6.0,2823.87,RP-002,Kiran,Working,13.2,Card,3.4,49.0,2.49,284.0,0.0,2025-07-12 07:04:00
VMX-10364,VM-292,Hyderabad,Office,07-03-2025,01:44:00,P-105,Dettol Wipe,Hygiene,146.58,71.0,61.0,10.0,8941.38,RP-005,Ravi,Low Power,16.9,Cash,4.3,28.0,4.55,359.0,0.0,2025-03-07 01:44:00
VMX-10365,VM-268,Mumbai,Mall,28-04-2025,02:26:00,P-109,Doritos,Snacks,136.78,167.0,150.0,17.0,20517.0,RP-019,Rajesh,Low Power,14.2,Card,3.3,111.0,1.99,217.0,1.0,2025-04-28 02:26:00
VMX-10366,VM-021,Mumbai,Metro Station,03-01-2025,13:02:00,P-109,Doritos,Snacks,41.14,171.0,167.0,4.0,6870.38,RP-002,Kiran,Maintenance,15.9,Card,4.5,57.0,2.98,92.0,0.0,2025-01-03 13:02:00
VMX-10367,VM-047,Hyderabad,Hospital,01-06-2025,07:41:00,P-106,Snickers Bar,Snacks,142.99,53.0,42.0,11.0,6005.58,RP-010,Amit,Maintenance,16.9,Card,4.2,3.0,4.91,287.0,0.0,2025-06-01 07:41:00
VMX-10368,VM-001,Kolkata,College,26-08-2025,22:40:00,P-106,Snickers Bar,Snacks,35.89,114.0,94.0,20.0,3373.66,RP-013,Deepa,Maintenance,10.5,UPI,4.3,89.0,4.78,327.0,0.0,2025-08-26 22:40:00
VMX-10369,VM-027,Hyderabad,Hospital,21-09-2025,21:23:00,P-101,Pepsi Can,Drinks,96.86,105.0,104.0,1.0,10073.44,RP-012,Rajesh,Maintenance,10.6,UPI,2.5,71.0,3.82,337.0,0.0,2025-09-21 21:23:00
VMX-10370,VM-298,Kolkata,Mall,28-02-2025,20:30:00,P-102,Bisleri Water,Drinks,147.38,81.0,64.0,17.0,9432.32,RP-008,Deepa,Low Power,23.5,Card,4.0,35.0,1.22,240.0,1.0,2025-02-28 20:30:00
VMX-10371,VM-273,Chennai,Hospital,29-08-2025,22:34:00,P-107,Colgate Mini,Hygiene,78.07,154.0,151.0,3.0,11788.57,RP-020,Deepa,Maintenance,24.2,Cash,2.6,113.0,2.83,91.0,1.0,2025-08-29 22:34:00
VMX-10372,VM-076,Mumbai,Mall,26-03-2025,08:07:00,P-102,Bisleri Water,Drinks,50.37,39.0,36.0,3.0,1813.32,RP-007,Fatima,Maintenance,10.3,UPI,4.9,69.0,4.73,292.0,1.0,2025-03-26 08:07:00
VMX-10373,VM-012,Kolkata,Mall,30-05-2025,06:04:00,P-106,Snickers Bar,Snacks,72.14,185.0,185.0,0.0,13345.9,RP-017,Deepa,Low Power,18.7,Card,3.9,41.0,2.94,390.0,1.0,2025-05-30 06:04:00
VMX-10374,VM-248,Chennai,Office,29-03-2025,08:14:00,P-107,Colgate Mini,Hygiene,52.57,53.0,44.0,9.0,2313.08,RP-002,Amit,Low Power,14.3,Cash,3.9,20.0,3.85,196.0,0.0,2025-03-29 08:14:00
VMX-10375,VM-022,Chennai,Metro Station,24-03-2025,07:07:00,P-102,Bisleri Water,Drinks,127.51,197.0,193.0,4.0,24609.43,RP-005,Rajesh,Low Power,15.5,Cash,3.7,4.0,3.66,226.0,0.0,2025-03-24 07:07:00
VMX-10376,VM-013,Mumbai,Hospital,04-06-2025,03:58:00,P-105,Dettol Wipe,Hygiene,72.78,61.0,44.0,17.0,3202.32,RP-005,Rajesh,Low Power,12.3,Card,3.6,64.0,2.33,411.0,1.0,2025-06-04 03:58:00
VMX-10377,VM-058,Delhi,Hospital,15-08-2025,10:44:00,P-107,Colgate Mini,Hygiene,135.44,166.0,162.0,4.0,21941.28,RP-002,Amit,Maintenance,18.3,UPI,2.1,79.0,4.36,278.0,1.0,2025-08-15 10:44:00
VMX-10378,VM-114,Kolkata,Office,10-04-2025,18:33:00,P-101,Pepsi Can,Drinks,55.69,175.0,155.0,20.0,8631.95,RP-007,Mahesh,Working,18.1,UPI,4.0,11.0,4.9,251.0,0.0,2025-04-10 18:33:00
VMX-10379,VM-204,Bangalore,Hospital,29-01-2025,21:23:00,P-107,Colgate Mini,Hygiene,54.49,174.0,158.0,16.0,8609.42,RP-012,Kiran,Low Power,10.2,UPI,3.1,57.0,4.5,94.0,0.0,2025-01-29 21:23:00
VMX-10380,VM-218,Delhi,Hospital,28-05-2025,05:51:00,P-107,Colgate Mini,Hygiene,113.81,126.0,112.0,14.0,12746.72,RP-005,Rahul,Maintenance,11.3,Cash,2.9,111.0,3.1,221.0,0.0,2025-05-28 05:51:00
VMX-10381,VM-140,Mumbai,Mall,29-07-2025,20:58:00,P-109,Doritos,Snacks,115.86,42.0,42.0,0.0,4866.12,RP-018,Rajesh,Maintenance,18.5,Cash,2.6,106.0,2.53,333.0,1.0,2025-07-29 20:58:00
VMX-10382,VM-238,Bangalore,College,05-06-2025,15:35:00,P-100,Lays Classic,Snacks,125.19,97.0,79.0,18.0,9890.01,RP-001,Amit,Low Power,14.5,Card,4.5,60.0,1.5,390.0,1.0,2025-06-05 15:35:00
VMX-10383,VM-142,Mumbai,College,06-05-2025,00:07:00,P-106,Snickers Bar,Snacks,35.11,196.0,176.0,20.0,6179.36,RP-020,Deepa,Maintenance,17.2,UPI,4.6,80.0,3.74,405.0,0.0,2025-05-06 00:07:00
VMX-10384,VM-030,Bangalore,Office,13-05-2025,05:37:00,P-105,Dettol Wipe,Hygiene,81.75,167.0,167.0,0.0,13652.25,RP-015,Amit,Low Power,12.4,UPI,3.1,81.0,4.65,232.0,0.0,2025-05-13 05:37:00
VMX-10385,VM-094,Kolkata,College,21-09-2025,06:49:00,P-104,Red Bull,Drinks,50.83,183.0,181.0,2.0,9200.23,RP-020,Amit,Maintenance,14.8,UPI,4.5,87.0,4.2,188.0,1.0,2025-09-21 06:49:00
VMX-10386,VM-145,Chennai,Hospital,07-01-2025,04:33:00,P-101,Pepsi Can,Drinks,84.82,110.0,106.0,4.0,8990.92,RP-014,Deepa,Working,11.5,Cash,3.5,106.0,1.75,336.0,0.0,2025-01-07 04:33:00
VMX-10387,VM-179,Chennai,Office,09-03-2025,00:30:00,P-106,Snickers Bar,Snacks,74.47,39.0,36.0,3.0,2680.92,RP-005,Rajesh,Maintenance,17.8,UPI,2.5,38.0,1.12,467.0,0.0,2025-03-09 00:30:00
VMX-10388,VM-108,Bangalore,College,27-04-2025,09:08:00,P-103,Oreo Pack,Snacks,28.02,197.0,193.0,4.0,5407.86,RP-014,Ravi,Working,10.3,UPI,4.3,5.0,1.79,66.0,0.0,2025-04-27 09:08:00
VMX-10389,VM-006,Kolkata,College,03-02-2025,09:42:00,P-107,Colgate Mini,Hygiene,26.65,84.0,83.0,1.0,2211.95,RP-004,Rahul,Working,18.8,Cash,2.6,44.0,1.12,124.0,1.0,2025-02-03 09:42:00
VMX-10390,VM-035,Hyderabad,Metro Station,04-05-2025,16:36:00,P-109,Doritos,Snacks,58.7,61.0,45.0,16.0,2641.5,RP-001,Fatima,Working,20.7,UPI,2.5,96.0,3.15,421.0,0.0,2025-05-04 16:36:00
VMX-10391,VM-055,Bangalore,Office,05-04-2025,14:43:00,P-103,Oreo Pack,Snacks,138.87,141.0,130.0,11.0,18053.1,RP-013,Kiran,Working,17.7,UPI,2.3,40.0,1.49,106.0,0.0,2025-04-05 14:43:00
VMX-10392,VM-253,Hyderabad,Hospital,21-01-2025,02:20:00,P-107,Colgate Mini,Hygiene,116.72,200.0,191.0,9.0,22293.52,RP-010,Rajesh,Maintenance,21.0,Card,4.9,56.0,1.9,258.0,1.0,2025-01-21 02:20:00
VMX-10393,VM-252,Delhi,College,08-07-2025,05:00:00,P-106,Snickers Bar,Snacks,error,37.0,22.0,15.0,801.46,RP-013,Rajesh,Maintenance,19.9,Cash,2.4,50.0,2.6,352.0,0.0,2025-07-08 05:00:00
VMX-10394,VM-207,Hyderabad,Mall,13-04-2025,19:54:00,P-102,Bisleri Water,Drinks,19.06,70.0,60.0,10.0,1143.6,RP-014,Rajesh,Low Power,21.5,Card,3.8,96.0,4.16,379.0,1.0,2025-04-13 19:54:00
VMX-10395,VM-076,Kolkata,Hospital,06-09-2025,16:17:00,P-105,Dettol Wipe,Hygiene,76.62,174.0,162.0,12.0,12412.44,RP-004,Ravi,Low Power,17.3,Cash,3.9,17.0,1.12,427.0,0.0,2025-09-06 16:17:00
VMX-10396,VM-168,Bangalore,Office,15-07-2025,19:43:00,P-101,Pepsi Can,Drinks,79.74,26.0,21.0,5.0,1674.54,RP-020,Rahul,Working,21.4,Card,4.3,98.0,2.97,288.0,0.0,2025-07-15 19:43:00
VMX-10397,VM-277,Pune,College,14-05-2025,17:21:00,P-104,Red Bull,Drinks,102.69,145.0,129.0,16.0,13247.01,RP-002,Kiran,Working,15.8,UPI,4.6,56.0,2.84,66.0,0.0,2025-05-14 17:21:00
VMX-10398,VM-160,Delhi,Hospital,09-09-2025,13:08:00,P-108,Sprite Bottle,Drinks,102.32,97.0,92.0,5.0,9413.44,RP-016,Ravi,Maintenance,20.1,Card,3.7,69.0,3.29,293.0,0.0,2025-09-09 13:08:00
VMX-10399,VM-181,Kolkata,Office,13-07-2025,19:43:00,P-108,Sprite Bottle,Drinks,17.8,87.0,72.0,15.0,1281.6,RP-011,Mahesh,Working,18.9,Cash,4.5,44.0,4.24,348.0,0.0,2025-07-13 19:43:00
VMX-10400,VM-029,Delhi,Mall,02-07-2025,13:22:00,P-105,Dettol Wipe,Hygiene,63.28,129.0,118.0,11.0,7467.04,RP-008,Suresh,Maintenance,14.7,Cash,4.7,8.0,4.48,108.0,1.0,2025-07-02 13:22:00
VMX-10401,VM-217,Pune,Metro Station,24-08-2025,21:55:00,P-102,Bisleri Water,Drinks,12.76,103.0,102.0,1.0,1301.52,RP-014,Anita,Working,20.4,Card,2.1,40.0,2.51,249.0,1.0,2025-08-24 21:55:00
VMX-10402,VM-258,Kolkata,Office,16-04-2025,10:31:00,P-109,Doritos,Snacks,23.68,145.0,142.0,3.0,3362.56,RP-006,Rahul,Low Power,15.5,UPI,2.6,81.0,4.39,453.0,0.0,2025-04-16 10:31:00
VMX-10403,VM-116,Pune,College,02-06-2025,18:25:00,P-108,Sprite Bottle,Drinks,39.97,87.0,86.0,1.0,3437.42,RP-019,Ravi,Maintenance,15.1,Cash,3.7,67.0,2.9,157.0,1.0,2025-06-02 18:25:00
VMX-10404,VM-277,Chennai,Mall,03-06-2025,13:42:00,P-101,Pepsi Can,Drinks,101.22,97.0,81.0,16.0,8198.82,RP-014,Kiran,Low Power,19.4,UPI,4.0,70.0,1.72,59.0,0.0,2025-06-03 13:42:00
VMX-10405,VM-223,Pune,College,18-05-2025,20:34:00,P-109,Doritos,Snacks,79.89,189.0,175.0,14.0,13980.75,RP-017,Suresh,Low Power,16.9,Cash,2.5,87.0,4.06,482.0,1.0,2025-05-18 20:34:00
VMX-10406,VM-147,Delhi,Mall,15-04-2025,13:17:00,P-106,Snickers Bar,Snacks,54.61,36.0,16.0,20.0,873.76,RP-009,Rahul,Working,16.1,Cash,2.4,3.0,1.98,473.0,1.0,2025-04-15 13:17:00
VMX-10407,VM-140,Bangalore,College,19-01-2025,06:10:00,P-107,Colgate Mini,Hygiene,77.95,131.0,118.0,13.0,9198.1,RP-009,Anita,Maintenance,18.3,Card,4.6,92.0,2.94,60.0,0.0,2025-01-19 06:10:00
VMX-10408,VM-047,Mumbai,Mall,28-07-2025,11:42:00,P-101,Pepsi Can,Drinks,53.95,96.0,94.0,2.0,5071.3,RP-008,Ravi,Maintenance,21.0,Cash,3.6,106.0,3.32,446.0,1.0,2025-07-28 11:42:00
VMX-10409,VM-300,Delhi,Hospital,04-03-2025,10:21:00,P-107,Colgate Mini,Hygiene,133.84,80.0,61.0,19.0,8164.24,RP-008,Kiran,Working,12.2,Cash,2.6,35.0,2.76,180.0,0.0,2025-03-04 10:21:00
VMX-10410,VM-244,Delhi,Mall,12-06-2025,17:27:00,P-107,Colgate Mini,Hygiene,84.69,199.0,196.0,3.0,16599.24,RP-009,Amit,Low Power,17.1,UPI,4.5,2.0,3.58,360.0,0.0,2025-06-12 17:27:00
VMX-10411,VM-159,Delhi,Office,10-05-2025,17:24:00,P-100,Lays Classic,Snacks,106.7,191.0,184.0,7.0,19632.8,RP-004,Fatima,Working,22.9,UPI,2.0,50.0,4.71,180.0,1.0,2025-05-10 17:24:00
VMX-10412,VM-225,Delhi,Office,18-04-2025,05:58:00,P-101,Pepsi Can,Drinks,141.09,80.0,71.0,9.0,10017.39,RP-014,Mahesh,Low Power,23.0,UPI,3.4,52.0,4.71,220.0,1.0,2025-04-18 05:58:00
VMX-10413,VM-216,Pune,Metro Station,17-09-2025,02:22:00,P-101,Pepsi Can,Drinks,125.42,198.0,190.0,8.0,23829.8,RP-011,Rajesh,Maintenance,10.4,Cash,3.9,23.0,3.52,455.0,0.0,2025-09-17 02:22:00
VMX-10414,VM-057,Bangalore,Mall,10-06-2025,18:05:00,P-100,Lays Classic,Snacks,66.09,180.0,171.0,9.0,11301.39,RP-017,Amit,Maintenance,20.3,UPI,3.4,111.0,3.94,183.0,0.0,2025-06-10 18:05:00
VMX-10415,VM-094,Mumbai,Hospital,13-02-2025,13:23:00,P-109,Doritos,Snacks,125.75,92.0,86.0,6.0,10814.5,RP-019,Suresh,Working,24.2,Card,3.9,80.0,1.91,95.0,1.0,2025-02-13 13:23:00
VMX-10416,VM-134,Bangalore,College,25-07-2025,19:27:00,P-103,Oreo Pack,Snacks,46.65,63.0,62.0,1.0,2892.3,RP-012,Amit,Maintenance,11.8,Card,3.6,98.0,4.68,282.0,1.0,2025-07-25 19:27:00
VMX-10417,VM-254,Mumbai,Mall,17-05-2025,09:47:00,P-101,Pepsi Can,Drinks,41.43,72.0,66.0,6.0,2734.38,RP-014,Suresh,Maintenance,13.2,UPI,4.2,24.0,2.67,259.0,0.0,2025-05-17 09:47:00
VMX-10418,VM-299,Delhi,Hospital,19-08-2025,07:23:00,P-100,Lays Classic,Snacks,50.63,87.0,80.0,7.0,4050.4,RP-003,Mahesh,Low Power,12.0,UPI,4.9,50.0,3.75,415.0,1.0,2025-08-19 07:23:00
VMX-10419,VM-027,Chennai,Mall,18-02-2025,17:03:00,P-106,Snickers Bar,Snacks,113.05,85.0,83.0,2.0,9383.15,RP-016,Deepa,Maintenance,24.1,Card,4.1,103.0,1.18,179.0,1.0,2025-02-18 17:03:00
VMX-10420,VM-298,Bangalore,Office,09-03-2025,17:02:00,P-104,Red Bull,Drinks,146.85,191.0,180.0,11.0,26433.0,RP-006,Fatima,Low Power,24.0,UPI,2.4,40.0,3.84,271.0,0.0,2025-03-09 17:02:00
VMX-10421,VM-185,Mumbai,Office,13-09-2025,08:47:00,P-104,Red Bull,Drinks,26.36,31.0,27.0,4.0,711.72,RP-009,Rahul,Low Power,17.8,UPI,4.7,40.0,3.95,301.0,0.0,2025-09-13 08:47:00
VMX-10422,VM-077,Hyderabad,Mall,14-08-2025,01:12:00,P-108,Sprite Bottle,Drinks,129.42,188.0,168.0,20.0,21742.56,RP-006,Mahesh,Low Power,13.9,Card,3.4,14.0,4.98,303.0,0.0,2025-08-14 01:12:00
VMX-10423,VM-076,Hyderabad,Office,23-08-2025,15:07:00,P-107,Colgate Mini,Hygiene,59.91,163.0,148.0,15.0,8866.68,RP-003,Suresh,Low Power,12.7,Cash,4.2,105.0,2.09,389.0,0.0,2025-08-23 15:07:00
VMX-10424,VM-040,Bangalore,Hospital,03-04-2025,13:58:00,P-109,Doritos,Snacks,149.72,21.0,5.0,16.0,748.6,RP-004,Deepa,Working,14.3,Card,2.4,47.0,3.36,104.0,1.0,2025-04-03 13:58:00
VMX-10425,VM-003,Chennai,College,21-08-2025,20:17:00,P-102,Bisleri Water,Drinks,14.04,137.0,122.0,15.0,1712.88,RP-020,Rajesh,Low Power,24.2,Card,4.7,102.0,3.28,158.0,0.0,2025-08-21 20:17:00
VMX-10426,VM-048,Mumbai,Office,08-10-2025,19:24:00,P-104,Red Bull,Drinks,55.24,34.0,32.0,2.0,1767.68,RP-006,Suresh,Low Power,11.3,Cash,2.5,99.0,2.61,381.0,0.0,2025-10-08 19:24:00
VMX-10427,VM-050,Kolkata,Office,09-03-2025,11:42:00,P-101,Pepsi Can,Drinks,51.8,130.0,121.0,9.0,6267.8,RP-017,Suresh,Low Power,16.7,UPI,3.4,72.0,3.4,96.0,1.0,2025-03-09 11:42:00
VMX-10428,VM-263,Chennai,Hospital,07-08-2025,02:02:00,P-105,Dettol Wipe,Hygiene,95.94,131.0,111.0,20.0,10649.34,RP-008,Amit,Low Power,17.9,Card,3.6,37.0,2.87,90.0,1.0,2025-08-07 02:02:00
VMX-10429,VM-152,Pune,College,08-05-2025,16:27:00,P-104,Red Bull,Drinks,30.8,52.0,43.0,9.0,1324.4,RP-018,Ravi,Working,17.7,Card,3.3,12.0,2.86,418.0,1.0,2025-05-08 16:27:00
VMX-10430,VM-237,Bangalore,Mall,09-01-2025,03:47:00,P-105,Dettol Wipe,Hygiene,45.68,40.0,24.0,16.0,1096.32,RP-013,Mahesh,Working,16.2,Card,2.9,75.0,3.9,437.0,1.0,2025-01-09 03:47:00
VMX-10431,VM-133,Kolkata,College,19-04-2025,05:05:00,P-109,Doritos,Snacks,123.1,107.0,102.0,5.0,12556.2,RP-014,Fatima,Working,10.1,Cash,2.0,83.0,2.91,404.0,1.0,2025-04-19 05:05:00
VMX-10432,VM-203,Kolkata,Office,04-07-2025,22:43:00,P-109,Doritos,Snacks,111.63,97.0,78.0,19.0,8707.14,RP-003,Amit,Working,10.2,Cash,4.4,89.0,4.88,489.0,0.0,2025-07-04 22:43:00
VMX-10433,VM-276,Bangalore,College,04-05-2025,13:53:00,P-103,Oreo Pack,Snacks,77.36,57.0,37.0,20.0,2862.32,RP-010,Rajesh,Working,17.1,Cash,2.3,115.0,1.61,409.0,1.0,2025-05-04 13:53:00
VMX-10434,VM-292,Kolkata,Hospital,05-05-2025,06:18:00,P-107,Colgate Mini,Hygiene,76.01,135.0,117.0,18.0,8893.17,RP-002,Deepa,Working,11.5,Card,3.3,53.0,4.39,427.0,1.0,2025-05-05 06:18:00
VMX-10435,VM-032,Pune,College,07-09-2025,07:45:00,P-100,Lays Classic,Snacks,78.25,144.0,128.0,16.0,10016.0,RP-014,Rahul,Low Power,18.3,UPI,4.7,53.0,4.56,109.0,1.0,2025-09-07 07:45:00
VMX-10436,VM-148,Delhi,Mall,12-08-2025,00:10:00,P-109,Doritos,Snacks,141.46,108.0,94.0,14.0,13297.24,RP-016,Deepa,Low Power,13.5,Cash,3.8,87.0,2.36,358.0,1.0,2025-08-12 00:10:00
VMX-10437,VM-083,Pune,Mall,04-07-2025,15:51:00,P-102,Bisleri Water,Drinks,133.64,119.0,106.0,13.0,14165.84,RP-010,Ravi,Maintenance,17.2,Cash,2.6,77.0,2.97,456.0,1.0,2025-07-04 15:51:00
VMX-10438,VM-134,Chennai,Mall,25-01-2025,00:22:00,P-107,Colgate Mini,Hygiene,52.51,73.0,56.0,17.0,2940.56,RP-006,Fatima,Working,22.1,UPI,3.3,79.0,1.91,337.0,0.0,2025-01-25 00:22:00
VMX-10439,VM-078,Kolkata,Metro Station,24-01-2025,17:17:00,P-107,Colgate Mini,Hygiene,46.1,107.0,96.0,11.0,4425.6,RP-020,Ravi,Maintenance,10.8,UPI,4.4,107.0,4.02,104.0,0.0,2025-01-24 17:17:00
VMX-10440,VM-186,Bangalore,Office,02-03-2025,06:58:00,P-108,Sprite Bottle,Drinks,15.88,46.0,41.0,5.0,651.08,RP-015,Fatima,Low Power,21.0,Cash,2.5,46.0,2.34,120.0,0.0,2025-03-02 06:58:00
VMX-10441,VM-147,Pune,Mall,06-05-2025,15:21:00,P-103,Oreo Pack,Snacks,71.48,126.0,104.0,0.0,9006.48,RP-003,Anita,Low Power,20.7,UPI,3.1,85.0,1.98,435.0,1.0,2025-05-06 15:21:00
VMX-10442,VM-265,Kolkata,Office,29-07-2025,14:54:00,P-103,Oreo Pack,Snacks,29.32,129.0,116.0,13.0,3401.12,RP-001,Rajesh,Working,21.6,Card,4.4,120.0,1.28,223.0,1.0,2025-07-29 14:54:00
VMX-10443,VM-019,Delhi,Mall,01-02-2025,12:48:00,P-106,Snickers Bar,Snacks,147.47,62.0,49.0,13.0,7226.03,RP-019,Mahesh,Maintenance,24.7,Card,4.6,37.0,2.68,398.0,1.0,2025-02-01 12:48:00
VMX-10444,VM-076,Delhi,Hospital,28-09-2025,19:58:00,P-105,Dettol Wipe,Hygiene,137.29,22.0,14.0,8.0,1922.06,RP-015,Suresh,Maintenance,19.4,Card,4.0,89.0,2.38,465.0,1.0,2025-09-28 19:58:00
VMX-10445,VM-065,Pune,Metro Station,03-10-2025,10:24:00,P-103,Oreo Pack,Snacks,133.34,41.0,40.0,1.0,5333.6,RP-010,Suresh,Working,17.7,UPI,3.6,96.0,3.54,61.0,0.0,2025-10-03 10:24:00
VMX-10446,VM-031,Kolkata,Office,05-08-2025,16:07:00,P-108,Sprite Bottle,Drinks,92.95,81.0,72.0,9.0,6692.4,RP-009,Fatima,Low Power,11.9,Card,4.8,57.0,2.19,427.0,0.0,2025-08-05 16:07:00
VMX-10447,VM-180,Chennai,Office,01-10-2025,19:14:00,P-107,Colgate Mini,Hygiene,57.46,80.0,62.0,18.0,3562.52,RP-019,Amit,Maintenance,15.7,Card,2.7,41.0,3.07,148.0,1.0,2025-10-01 19:14:00
VMX-10448,VM-218,Bangalore,Hospital,11-02-2025,02:03:00,P-107,Colgate Mini,Hygiene,23.72,128.0,115.0,13.0,2727.8,RP-007,Rajesh,Working,15.5,Card,3.2,71.0,3.08,252.0,1.0,2025-02-11 02:03:00
VMX-10449,VM-084,Bangalore,Metro Station,08-09-2025,23:26:00,P-109,Doritos,Snacks,79.84,128.0,114.0,14.0,9101.76,RP-005,Rajesh,Maintenance,16.9,Card,3.5,67.0,1.47,158.0,1.0,2025-09-08 23:26:00
VMX-10450,VM-210,Hyderabad,College,09-07-2025,03:38:00,P-107,Colgate Mini,Hygiene,14.57,60.0,43.0,17.0,626.51,RP-012,Rahul,Low Power,10.6,Cash,2.4,39.0,4.96,205.0,1.0,2025-07-09 03:38:00
VMX-10451,VM-157,Chennai,Mall,04-08-2025,01:59:00,P-107,Colgate Mini,Hygiene,13.92,56.0,52.0,4.0,723.84,RP-006,Rajesh,Working,11.8,UPI,2.2,5.0,2.67,343.0,1.0,2025-08-04 01:59:00
VMX-10452,VM-068,Kolkata,Mall,01-09-2025,23:53:00,P-109,Doritos,Snacks,73.33,106.0,94.0,12.0,6893.02,RP-017,Rajesh,Low Power,20.0,Cash,4.6,41.0,1.36,369.0,1.0,2025-09-01 23:53:00
VMX-10453,VM-227,Delhi,Office,04-10-2025,01:42:00,P-106,Snickers Bar,Snacks,42.6,121.0,111.0,10.0,4728.6,RP-003,Amit,Maintenance,10.4,Card,4.4,90.0,2.24,380.0,0.0,2025-10-04 01:42:00
VMX-10454,VM-097,Kolkata,Hospital,28-01-2025,18:33:00,P-108,Sprite Bottle,Drinks,21.92,178.0,161.0,17.0,3529.12,RP-017,Mahesh,Working,19.9,Card,2.5,2.0,2.1,155.0,0.0,2025-01-28 18:33:00
VMX-10455,VM-024,Mumbai,College,14-06-2025,12:37:00,P-109,Doritos,Snacks,72.19,156.0,137.0,19.0,9890.03,RP-011,Kiran,Working,16.2,Card,3.0,32.0,1.36,100.0,0.0,2025-06-14 12:37:00
VMX-10456,VM-087,Hyderabad,Metro Station,20-03-2025,09:26:00,P-104,Red Bull,Drinks,30.16,85.0,83.0,2.0,2503.28,RP-011,Amit,Working,20.7,UPI,3.2,40.0,1.57,215.0,1.0,2025-03-20 09:26:00
VMX-10457,VM-122,Mumbai,Metro Station,14-04-2025,07:48:00,P-106,Snickers Bar,Snacks,141.82,50.0,49.0,1.0,6949.18,RP-017,Kiran,Working,14.0,UPI,3.4,52.0,1.26,64.0,1.0,2025-04-14 07:48:00
VMX-10458,VM-285,Delhi,Mall,21-02-2025,07:48:00,P-103,Oreo Pack,Snacks,137.92,24.0,16.0,8.0,2206.72,RP-010,Rahul,Low Power,16.7,Card,3.5,100.0,4.87,241.0,0.0,2025-02-21 07:48:00
VMX-10459,VM-238,Kolkata,Metro Station,20-08-2025,01:00:00,P-103,Oreo Pack,Snacks,85.25,128.0,111.0,17.0,9462.75,RP-010,Amit,Working,10.9,UPI,2.8,32.0,4.36,244.0,1.0,2025-08-20 01:00:00
VMX-10460,VM-274,Pune,College,24-01-2025,05:47:00,P-103,Oreo Pack,Snacks,91.92,150.0,141.0,9.0,12960.72,RP-010,Ravi,Low Power,20.5,Cash,4.2,35.0,4.51,157.0,1.0,2025-01-24 05:47:00
VMX-10461,VM-175,Bangalore,Hospital,06-05-2025,21:20:00,P-105,Dettol Wipe,Hygiene,98.92,135.0,127.0,8.0,12562.84,RP-020,Deepa,Working,23.7,Cash,3.9,0.0,3.44,52.0,0.0,2025-05-06 21:20:00
VMX-10462,VM-040,Pune,College,21-07-2025,17:05:00,P-102,Bisleri Water,Drinks,67.84,198.0,183.0,15.0,12414.72,RP-015,Ravi,Low Power,24.6,UPI,4.5,45.0,2.55,479.0,0.0,2025-07-21 17:05:00
VMX-10463,VM-011,Kolkata,Office,05-01-2025,07:47:00,P-101,Pepsi Can,Drinks,74.78,69.0,55.0,14.0,4112.9,RP-012,Suresh,Working,22.2,Card,2.9,91.0,1.88,302.0,1.0,2025-01-05 07:47:00
VMX-10464,VM-203,Hyderabad,Office,18-04-2025,00:12:00,P-100,Lays Classic,Snacks,49.31,200.0,181.0,19.0,8925.11,RP-019,Fatima,Low Power,12.6,Cash,4.0,72.0,3.69,358.0,0.0,2025-04-18 00:12:00
VMX-10465,VM-117,Pune,Office,13-05-2025,18:54:00,P-101,Pepsi Can,Drinks,92.34,36.0,32.0,4.0,2954.88,RP-007,Mahesh,Maintenance,20.2,Card,2.8,71.0,4.53,51.0,1.0,2025-05-13 18:54:00
VMX-10466,VM-266,Mumbai,Hospital,28-07-2025,08:07:00,P-100,Lays Classic,Snacks,129.54,102.0,89.0,13.0,11529.06,RP-012,Fatima,Working,23.3,Cash,2.1,117.0,2.68,279.0,1.0,2025-07-28 08:07:00
VMX-10467,VM-217,Hyderabad,Mall,13-01-2025,23:14:00,P-100,Lays Classic,Snacks,64.86,105.0,103.0,2.0,6680.58,RP-007,Amit,Low Power,14.7,Card,3.9,3.0,2.92,463.0,0.0,2025-01-13 23:14:00
VMX-10468,VM-123,Chennai,College,07-05-2025,03:30:00,P-109,Doritos,Snacks,121.61,105.0,97.0,8.0,11796.17,RP-011,Fatima,Working,24.2,Card,3.9,97.0,1.38,278.0,0.0,2025-05-07 03:30:00
VMX-10469,VM-066,Hyderabad,Hospital,10-06-2025,22:04:00,P-101,Pepsi Can,Drinks,146.43,28.0,16.0,12.0,2342.88,RP-002,Anita,Maintenance,19.4,Cash,2.3,7.0,3.24,200.0,1.0,2025-06-10 22:04:00
VMX-10470,VM-238,Kolkata,Hospital,06-01-2025,14:24:00,P-106,Snickers Bar,Snacks,23.42,125.0,118.0,7.0,2763.56,RP-020,Rahul,Working,15.1,Card,4.3,58.0,3.07,350.0,0.0,2025-01-06 14:24:00
VMX-10471,VM-261,Chennai,Office,10-04-2025,18:08:00,P-101,Pepsi Can,Drinks,24.38,172.0,170.0,2.0,4144.6,RP-014,Rajesh,Maintenance,19.3,Cash,2.7,102.0,1.18,115.0,1.0,2025-04-10 18:08:00
VMX-10472,VM-278,Kolkata,Mall,09-06-2025,18:56:00,P-109,Doritos,Snacks,71.02,186.0,175.0,11.0,12428.5,RP-005,Rajesh,Low Power,19.0,UPI,3.1,1.0,3.07,386.0,0.0,2025-06-09 18:56:00
VMX-10473,VM-103,Delhi,Mall,05-08-2025,11:12:00,P-100,Lays Classic,Snacks,43.23,163.0,162.0,1.0,7003.26,RP-003,Deepa,Working,20.0,Card,4.1,59.0,3.4,219.0,1.0,2025-08-05 11:12:00
VMX-10474,VM-022,Mumbai,Mall,23-02-2025,14:56:00,P-109,Doritos,Snacks,51.95,104.0,99.0,5.0,5143.05,RP-001,Suresh,Maintenance,13.5,Card,2.6,61.0,3.94,467.0,1.0,2025-02-23 14:56:00
VMX-10475,VM-184,Hyderabad,Metro Station,05-07-2025,00:04:00,P-106,Snickers Bar,Snacks,38.74,67.0,67.0,0.0,2595.58,RP-004,Amit,Low Power,16.6,Card,3.8,97.0,2.44,65.0,0.0,2025-07-05 00:04:00
VMX-10476,VM-284,Bangalore,Mall,31-03-2025,10:54:00,P-103,Oreo Pack,Snacks,49.77,76.0,68.0,8.0,3384.36,RP-007,Mahesh,Working,22.6,Cash,2.1,86.0,1.55,385.0,0.0,2025-03-31 10:54:00
VMX-10477,VM-191,Delhi,Mall,03-05-2025,11:51:00,P-105,Dettol Wipe,Hygiene,141.06,98.0,84.0,14.0,11849.04,RP-017,Rahul,Low Power,23.2,Cash,2.4,112.0,4.7,456.0,0.0,2025-05-03 11:51:00
VMX-10478,VM-126,Hyderabad,Metro Station,12-06-2025,19:27:00,P-103,Oreo Pack,Snacks,84.56,197.0,186.0,11.0,15728.16,RP-019,Suresh,Maintenance,14.4,Cash,3.0,6.0,3.52,193.0,0.0,2025-06-12 19:27:00
VMX-10479,VM-034,Bangalore,Metro Station,11-02-2025,15:50:00,P-108,Sprite Bottle,Drinks,145.57,145.0,139.0,6.0,20234.23,RP-013,Fatima,Low Power,17.5,UPI,2.5,91.0,2.5,405.0,1.0,2025-02-11 15:50:00
VMX-10480,VM-104,Mumbai,Mall,19-01-2025,06:14:00,P-107,Colgate Mini,Hygiene,76.33,168.0,156.0,12.0,11907.48,RP-013,Suresh,Low Power,16.4,UPI,3.7,119.0,4.37,180.0,0.0,2025-01-19 06:14:00
VMX-10481,VM-299,Hyderabad,Hospital,23-09-2025,11:14:00,P-102,Bisleri Water,Drinks,115.23,95.0,81.0,14.0,9333.63,RP-017,Rahul,Low Power,16.4,UPI,3.3,47.0,4.22,212.0,1.0,2025-09-23 11:14:00
VMX-10482,VM-184,Hyderabad,Office,16-05-2025,20:04:00,P-106,Snickers Bar,Snacks,13.46,133.0,126.0,7.0,1695.96,RP-017,Fatima,Maintenance,19.7,UPI,4.8,12.0,1.47,234.0,0.0,2025-05-16 20:04:00
VMX-10483,VM-141,Bangalore,Metro Station,09-05-2025,09:47:00,P-108,Sprite Bottle,Drinks,38.04,70.0,60.0,10.0,2282.4,RP-005,Fatima,Low Power,10.1,UPI,2.8,44.0,4.13,256.0,1.0,2025-05-09 09:47:00
VMX-10484,VM-204,Bangalore,Mall,20-09-2025,04:55:00,P-109,Doritos,Snacks,116.09,23.0,8.0,15.0,928.72,RP-007,Rajesh,Working,17.7,Card,4.3,92.0,4.26,224.0,0.0,2025-09-20 04:55:00
VMX-10485,VM-286,Hyderabad,Office,18-04-2025,14:28:00,P-105,Dettol Wipe,Hygiene,128.41,129.0,116.0,13.0,14895.56,RP-005,Rahul,Working,14.6,Card,2.0,103.0,3.64,231.0,1.0,2025-04-18 14:28:00
VMX-10486,VM-012,Pune,College,03-10-2025,09:20:00,P-103,Oreo Pack,Snacks,68.68,195.0,183.0,12.0,12568.44,RP-005,Amit,Low Power,18.5,Card,4.7,73.0,4.47,245.0,0.0,2025-10-03 09:20:00
VMX-10487,VM-292,Mumbai,Office,01-09-2025,03:21:00,P-106,Snickers Bar,Snacks,18.92,118.0,112.0,6.0,2119.04,RP-003,Amit,Working,20.1,Cash,2.1,88.0,3.41,63.0,0.0,2025-09-01 03:21:00
VMX-10488,VM-269,Hyderabad,Hospital,16-04-2025,07:18:00,P-103,Oreo Pack,Snacks,19.73,118.0,109.0,9.0,2150.57,RP-002,Deepa,Maintenance,10.2,UPI,4.6,52.0,2.56,106.0,0.0,2025-04-16 07:18:00
VMX-10489,VM-106,Chennai,Hospital,16-04-2025,04:55:00,P-108,Sprite Bottle,Drinks,68.58,37.0,25.0,12.0,1714.5,RP-016,Amit,Maintenance,18.6,UPI,3.8,64.0,3.87,284.0,1.0,2025-04-16 04:55:00
VMX-10490,VM-127,Pune,Office,02-02-2025,12:38:00,P-103,Oreo Pack,Snacks,11.04,56.0,42.0,14.0,463.68,RP-019,Rajesh,Low Power,16.9,Cash,4.2,36.0,3.59,283.0,1.0,2025-02-02 12:38:00
VMX-10491,VM-222,Mumbai,Hospital,08-05-2025,05:57:00,P-104,Red Bull,Drinks,64.75,64.0,51.0,13.0,3302.25,RP-006,Rahul,Working,15.9,Cash,2.7,111.0,1.63,371.0,1.0,2025-05-08 05:57:00
VMX-10492,VM-189,Hyderabad,College,30-07-2025,17:07:00,P-101,Pepsi Can,Drinks,107.73,75.0,60.0,15.0,6463.8,RP-017,Deepa,Low Power,16.8,UPI,2.6,5.0,2.85,87.0,1.0,2025-07-30 17:07:00
VMX-10493,VM-129,Hyderabad,Mall,23-07-2025,01:00:00,P-106,Snickers Bar,Snacks,58.11,122.0,116.0,6.0,6740.76,RP-011,Rajesh,Low Power,16.9,Cash,3.6,31.0,3.85,274.0,0.0,2025-07-23 01:00:00
VMX-10494,VM-091,Chennai,College,10-01-2025,19:06:00,P-107,Colgate Mini,Hygiene,124.86,61.0,56.0,5.0,6992.16,RP-018,Kiran,Working,11.2,Cash,4.0,19.0,2.76,141.0,0.0,2025-01-10 19:06:00
VMX-10495,VM-268,Delhi,College,15-08-2025,22:03:00,P-100,Lays Classic,Snacks,134.98,156.0,150.0,6.0,20247.0,RP-013,Anita,Low Power,10.8,Cash,2.1,48.0,4.07,177.0,1.0,2025-08-15 22:03:00
VMX-10496,VM-099,Delhi,College,15-01-2025,00:21:00,P-103,Oreo Pack,Snacks,38,24.0,11.0,13.0,418.0,RP-008,Ravi,Maintenance,12.5,Cash,2.1,65.0,1.43,217.0,1.0,2025-01-15 00:21:00
VMX-10497,VM-062,Bangalore,Mall,05-10-2025,12:27:00,P-108,Sprite Bottle,Drinks,97.75,179.0,173.0,6.0,16910.75,RP-004,Deepa,Low Power,12.6,UPI,4.0,1.0,2.56,284.0,0.0,2025-10-05 12:27:00
VMX-10498,VM-112,Mumbai,Office,08-07-2025,01:04:00,P-101,Pepsi Can,Drinks,102.11,91.0,71.0,20.0,7249.81,RP-020,Rajesh,Working,20.7,Card,2.5,12.0,3.4,373.0,1.0,2025-07-08 01:04:00
VMX-10499,VM-010,Pune,Metro Station,04-09-2025,02:21:00,P-102,Bisleri Water,Drinks,56.49,182.0,172.0,10.0,9716.28,RP-015,Kiran,Maintenance,19.6,Cash,3.5,90.0,4.95,169.0,0.0,2025-09-04 02:21:00
VMX-10500,VM-125,Pune,College,02-05-2025,23:27:00,P-109,Doritos,Snacks,116.25,51.0,42.0,9.0,4882.5,RP-002,Amit,Low Power,17.5,Cash,2.5,26.0,3.57,171.0,1.0,2025-05-02 23:27:00
VMX-10501,VM-213,Delhi,Office,21-01-2025,16:50:00,P-105,Dettol Wipe,Hygiene,28.8,101.0,81.0,20.0,2332.8,RP-001,Suresh,Maintenance,15.0,Cash,2.6,6.0,4.63,390.0,0.0,2025-01-21 16:50:00
VMX-10502,VM-004,Hyderabad,Hospital,14-06-2025,05:28:00,P-103,Oreo Pack,Snacks,95.13,117.0,101.0,16.0,9608.13,RP-003,Suresh,Working,19.5,Cash,4.8,16.0,1.37,353.0,0.0,2025-06-14 05:28:00
VMX-10503,VM-102,Bangalore,Hospital,09-06-2025,05:46:00,P-103,Oreo Pack,Snacks,81.04,129.0,115.0,14.0,9319.6,RP-006,Rahul,Working,14.5,Card,3.3,81.0,1.81,491.0,1.0,2025-06-09 05:46:00
VMX-10504,VM-226,Mumbai,Metro Station,13-07-2025,05:30:00,P-101,Pepsi Can,Drinks,143.14,112.0,100.0,12.0,14314.0,RP-020,Kiran,Working,22.3,UPI,2.1,48.0,2.71,92.0,1.0,2025-07-13 05:30:00
VMX-10505,VM-157,Mumbai,Office,12-05-2025,12:29:00,P-109,Doritos,Snacks,85.21,161.0,156.0,5.0,13292.76,RP-013,Fatima,Maintenance,17.2,UPI,2.4,60.0,1.78,147.0,0.0,2025-05-12 12:29:00
VMX-10506,VM-192,Mumbai,Hospital,27-07-2025,13:25:00,P-100,Lays Classic,Snacks,130.63,115.0,100.0,15.0,13063.0,RP-010,Rahul,Working,16.1,Cash,5.0,15.0,2.54,339.0,0.0,2025-07-27 13:25:00
VMX-10507,VM-189,Delhi,College,18-09-2025,22:31:00,P-103,Oreo Pack,Snacks,116.81,85.0,74.0,11.0,8643.94,RP-013,Kiran,Maintenance,13.7,UPI,2.1,104.0,2.45,411.0,0.0,2025-09-18 22:31:00
VMX-10508,VM-297,Delhi,Mall,11-05-2025,07:38:00,P-102,Bisleri Water,Drinks,46.59,136.0,132.0,4.0,6149.88,RP-001,Ravi,Working,19.7,UPI,3.2,75.0,4.9,91.0,0.0,2025-05-11 07:38:00
VMX-10509,VM-196,Pune,Office,04-06-2025,16:34:00,P-106,Snickers Bar,Snacks,33.22,129.0,121.0,8.0,4019.62,RP-014,Ravi,Working,19.5,UPI,4.4,34.0,3.99,433.0,1.0,2025-06-04 16:34:00
VMX-10510,VM-214,Pune,Hospital,01-01-2025,03:04:00,P-104,Red Bull,Drinks,10.9,63.0,48.0,15.0,523.2,RP-010,Kiran,Working,12.6,Cash,4.1,25.0,2.95,307.0,0.0,2025-01-01 03:04:00
VMX-10511,VM-094,Kolkata,Mall,13-04-2025,01:47:00,P-107,Colgate Mini,Hygiene,89.39,74.0,69.0,5.0,6167.91,RP-009,Kiran,Low Power,19.4,Card,2.3,81.0,1.66,200.0,0.0,2025-04-13 01:47:00
VMX-10512,VM-245,Mumbai,College,16-01-2025,18:15:00,P-106,Snickers Bar,Snacks,27.46,36.0,26.0,10.0,713.96,RP-001,Mahesh,Low Power,21.3,Cash,4.0,101.0,4.95,99.0,0.0,2025-01-16 18:15:00
VMX-10513,VM-249,Mumbai,Office,24-09-2025,08:59:00,P-108,Sprite Bottle,Drinks,120.85,116.0,97.0,19.0,11722.45,RP-020,Kiran,Low Power,15.6,UPI,5.0,104.0,1.96,234.0,1.0,2025-09-24 08:59:00
VMX-10514,VM-206,Delhi,Mall,21-02-2025,00:29:00,P-106,Snickers Bar,Snacks,95.51,111.0,101.0,10.0,9646.51,RP-001,Rahul,Working,23.0,UPI,4.9,96.0,4.26,238.0,1.0,2025-02-21 00:29:00
VMX-10515,VM-002,Delhi,Office,31-07-2025,21:12:00,P-109,Doritos,Snacks,106.07,141.0,41.0,16.0,13258.75,RP-001,Deepa,Working,24.5,Card,3.0,56.0,1.93,298.0,1.0,2025-07-31 21:12:00
VMX-10516,VM-052,Delhi,Hospital,01-09-2025,21:54:00,P-109,Doritos,Snacks,121.15,109.0,96.0,13.0,11630.4,RP-010,Rahul,Working,20.7,Card,4.6,100.0,4.43,308.0,0.0,2025-09-01 21:54:00
VMX-10517,VM-229,Hyderabad,Hospital,08-10-2025,14:10:00,P-102,Bisleri Water,Drinks,79.71,42.0,33.0,9.0,2630.43,RP-018,Suresh,Working,13.2,Card,4.1,13.0,2.74,416.0,0.0,2025-10-08 14:10:00
VMX-10518,VM-132,Delhi,Hospital,24-05-2025,07:46:00,P-102,Bisleri Water,Drinks,140.06,103.0,91.0,12.0,12745.46,RP-004,Amit,Maintenance,19.5,UPI,2.3,88.0,2.33,164.0,0.0,2025-05-24 07:46:00
VMX-10519,VM-133,Hyderabad,Office,12-08-2025,07:14:00,P-105,Dettol Wipe,Hygiene,62.78,117.0,97.0,20.0,6089.66,RP-003,Ravi,Working,15.1,Card,4.8,95.0,4.77,343.0,1.0,2025-08-12 07:14:00
VMX-10520,VM-275,Bangalore,Hospital,01-01-2025,09:03:00,P-102,Bisleri Water,Drinks,129.47,117.0,99.0,18.0,12817.53,RP-014,Deepa,Low Power,22.0,Cash,3.6,77.0,3.36,104.0,1.0,2025-01-01 09:03:00
VMX-10521,VM-113,Mumbai,Hospital,16-03-2025,09:53:00,P-100,Lays Classic,Snacks,85.36,137.0,127.0,10.0,10840.72,RP-005,Rahul,Low Power,12.2,Card,4.5,105.0,3.81,356.0,1.0,2025-03-16 09:53:00
VMX-10522,VM-245,Delhi,Mall,21-05-2025,22:36:00,P-104,Red Bull,Drinks,80.33,196.0,193.0,3.0,15503.69,RP-016,Anita,Maintenance,24.5,Cash,4.9,42.0,1.61,416.0,0.0,2025-05-21 22:36:00
VMX-10523,VM-154,Kolkata,Mall,07-09-2025,23:25:00,P-103,Oreo Pack,Snacks,108.06,33.0,28.0,5.0,3025.68,RP-001,Fatima,Low Power,15.1,Card,3.4,44.0,4.03,250.0,0.0,2025-09-07 23:25:00
VMX-10524,VM-068,Chennai,Metro Station,08-10-2025,12:06:00,P-108,Sprite Bottle,Drinks,111.75,92.0,86.0,6.0,9610.5,RP-002,Anita,Low Power,19.8,Card,2.4,89.0,2.93,124.0,0.0,2025-10-08 12:06:00
VMX-10525,VM-295,Hyderabad,Mall,05-01-2025,11:46:00,P-103,Oreo Pack,Snacks,122.61,70.0,50.0,20.0,0.0,RP-013,Kiran,Maintenance,22.6,Cash,2.3,60.0,1.72,76.0,0.0,2025-01-05 11:46:00
VMX-10526,VM-207,Bangalore,College,18-03-2025,20:46:00,P-108,Sprite Bottle,Drinks,101.01,171.0,158.0,13.0,15959.58,RP-004,Suresh,Low Power,17.3,Card,3.8,22.0,3.61,242.0,0.0,2025-03-18 20:46:00
VMX-10527,VM-228,Chennai,College,21-05-2025,20:41:00,P-107,Colgate Mini,Hygiene,131.09,186.0,174.0,12.0,22809.66,RP-004,Ravi,Working,11.8,Card,4.0,65.0,1.9,350.0,1.0,2025-05-21 20:41:00
VMX-10528,VM-223,Chennai,Metro Station,03-04-2025,12:30:00,P-104,Red Bull,Drinks,107.12,44.0,26.0,18.0,2785.12,RP-005,Ravi,Low Power,11.0,Card,2.6,104.0,3.8,251.0,1.0,2025-04-03 12:30:00
VMX-10529,VM-061,Bangalore,Metro Station,05-03-2025,06:42:00,P-101,Pepsi Can,Drinks,82.65,169.0,152.0,17.0,12562.8,RP-006,Mahesh,Maintenance,16.7,UPI,2.4,16.0,3.3,384.0,0.0,2025-03-05 06:42:00
VMX-10530,VM-187,Pune,Mall,05-03-2025,16:19:00,P-101,Pepsi Can,Drinks,88.75,28.0,26.0,2.0,2307.5,RP-014,Mahesh,Working,14.5,Card,4.7,37.0,3.64,277.0,0.0,2025-03-05 16:19:00
VMX-10531,VM-262,Bangalore,College,30-06-2025,19:34:00,P-109,Doritos,Snacks,78.66,100.0,84.0,16.0,6607.44,RP-002,Suresh,Working,12.8,UPI,4.6,27.0,4.83,358.0,0.0,2025-06-30 19:34:00
VMX-10532,VM-131,Chennai,Hospital,05-08-2025,02:35:00,P-109,Doritos,Snacks,60.27,52.0,33.0,19.0,1988.91,RP-006,Kiran,Low Power,11.2,UPI,4.0,120.0,3.78,324.0,0.0,2025-08-05 02:35:00
VMX-10533,VM-289,Delhi,Metro Station,09-04-2025,22:23:00,P-101,Pepsi Can,Drinks,98.14,88.0,68.0,20.0,6673.52,RP-020,Amit,Low Power,22.3,UPI,5.0,55.0,2.52,359.0,0.0,2025-04-09 22:23:00
VMX-10534,VM-169,Delhi,College,08-10-2025,13:04:00,P-101,Pepsi Can,Drinks,47.82,156.0,153.0,3.0,7316.46,RP-012,Deepa,Low Power,12.2,Cash,2.8,12.0,2.51,163.0,1.0,2025-10-08 13:04:00
VMX-10535,VM-157,Pune,Hospital,27-09-2025,23:56:00,P-101,Pepsi Can,Drinks,119.58,51.0,46.0,5.0,5500.68,RP-004,Fatima,Low Power,20.5,UPI,3.7,77.0,1.4,74.0,0.0,2025-09-27 23:56:00
VMX-10536,VM-273,Pune,Metro Station,26-06-2025,23:43:00,P-105,Dettol Wipe,Hygiene,142.51,119.0,114.0,5.0,16246.14,RP-013,Rajesh,Maintenance,11.9,Cash,4.1,91.0,1.62,114.0,0.0,2025-06-26 23:43:00
VMX-10537,VM-128,Delhi,Metro Station,09-07-2025,22:49:00,P-106,Snickers Bar,Snacks,89.46,88.0,87.0,1.0,7783.02,RP-014,Rajesh,Working,16.6,UPI,4.4,64.0,2.15,269.0,0.0,2025-07-09 22:49:00
VMX-10538,VM-047,Delhi,College,28-07-2025,10:54:00,P-104,Red Bull,Drinks,98.99,42.0,33.0,9.0,3266.67,RP-003,Suresh,Working,12.5,Cash,2.3,36.0,3.22,302.0,0.0,2025-07-28 10:54:00
VMX-10539,VM-273,Delhi,College,12-09-2025,16:43:00,P-106,Snickers Bar,Snacks,104.78,54.0,39.0,15.0,4086.42,RP-013,Mahesh,Maintenance,12.9,Card,2.0,54.0,3.81,433.0,1.0,2025-09-12 16:43:00
VMX-10540,VM-087,Delhi,Metro Station,22-01-2025,19:28:00,P-103,Oreo Pack,Snacks,149.19,189.0,173.0,16.0,25809.87,RP-008,Amit,Working,15.5,Cash,3.5,6.0,2.69,244.0,0.0,2025-01-22 19:28:00
VMX-10541,VM-154,Mumbai,Office,04-10-2025,03:18:00,P-105,Dettol Wipe,Hygiene,145.76,106.0,99.0,7.0,14430.24,RP-009,Suresh,Working,21.1,Card,3.2,118.0,2.22,379.0,0.0,2025-10-04 03:18:00
VMX-10542,VM-236,Chennai,Office,02-07-2025,00:39:00,P-107,Colgate Mini,Hygiene,134.95,144.0,143.0,1.0,19297.85,RP-012,Ravi,Working,15.2,Card,2.6,45.0,1.04,270.0,1.0,2025-07-02 00:39:00
VMX-10543,VM-250,Hyderabad,Mall,30-07-2025,03:58:00,P-103,Oreo Pack,Snacks,21.86,151.0,147.0,4.0,3213.42,RP-009,Suresh,Low Power,15.9,UPI,3.1,114.0,1.73,465.0,1.0,2025-07-30 03:58:00
VMX-10544,VM-223,Hyderabad,Office,24-03-2025,04:22:00,P-101,Pepsi Can,Drinks,148.51,188.0,174.0,14.0,25840.74,RP-007,Ravi,Working,14.3,Cash,3.2,95.0,2.32,66.0,0.0,2025-03-24 04:22:00
VMX-10545,VM-282,Mumbai,Mall,02-03-2025,13:31:00,P-103,Oreo Pack,Snacks,142.77,190.0,182.0,8.0,25984.14,RP-011,Kiran,Maintenance,20.9,Card,4.5,49.0,1.53,105.0,0.0,2025-03-02 13:31:00
VMX-10546,VM-176,Mumbai,Metro Station,02-05-2025,01:43:00,P-102,Bisleri Water,Drinks,error,148.0,148.0,0.0,4703.44,RP-001,Kiran,Low Power,14.3,UPI,2.2,54.0,1.99,128.0,0.0,2025-05-02 01:43:00
VMX-10547,VM-220,Bangalore,Hospital,07-05-2025,21:52:00,P-103,Oreo Pack,Snacks,49.36,49.0,41.0,8.0,2023.76,RP-004,Fatima,Maintenance,12.7,Card,3.9,19.0,1.92,117.0,1.0,2025-05-07 21:52:00
VMX-10548,VM-103,Hyderabad,College,07-08-2025,00:39:00,P-100,Lays Classic,Snacks,48.34,69.0,65.0,4.0,3142.1,RP-013,Kiran,Maintenance,14.6,Card,4.9,28.0,2.34,295.0,0.0,2025-08-07 00:39:00
VMX-10549,VM-144,Chennai,Hospital,26-02-2025,08:23:00,P-108,Sprite Bottle,Drinks,69.79,33.0,24.0,9.0,1674.96,RP-008,Deepa,Working,12.7,Cash,2.2,95.0,2.29,196.0,1.0,2025-02-26 08:23:00
VMX-10550,VM-187,Chennai,Office,05-04-2025,08:31:00,P-104,Red Bull,Drinks,137.19,45.0,32.0,13.0,4390.08,RP-004,Ravi,Maintenance,10.2,Card,4.3,16.0,2.32,429.0,1.0,2025-04-05 08:31:00
VMX-10551,VM-197,Hyderabad,College,22-05-2025,06:37:00,P-109,Doritos,Snacks,84.04,115.0,108.0,7.0,9076.32,RP-005,Rahul,Working,10.6,Card,4.5,24.0,3.82,100.0,0.0,2025-05-22 06:37:00
VMX-10552,VM-079,Hyderabad,Mall,14-04-2025,17:46:00,P-108,Sprite Bottle,Drinks,96.66,97.0,82.0,15.0,7926.12,RP-007,Kiran,Maintenance,20.7,Card,4.9,114.0,2.46,372.0,0.0,2025-04-14 17:46:00
VMX-10553,VM-141,Delhi,Mall,15-09-2025,00:10:00,P-106,Snickers Bar,Snacks,19.48,127.0,111.0,16.0,2162.28,RP-010,Mahesh,Maintenance,10.9,Card,2.6,104.0,2.59,400.0,0.0,2025-09-15 00:10:00
VMX-10554,VM-140,Bangalore,Mall,19-07-2025,12:38:00,P-102,Bisleri Water,Drinks,71.28,150.0,138.0,12.0,9836.64,RP-001,Amit,Maintenance,13.3,Card,2.0,118.0,4.16,283.0,1.0,2025-07-19 12:38:00
VMX-10555,VM-024,Pune,Mall,02-03-2025,05:14:00,P-104,Red Bull,Drinks,129.35,95.0,87.0,8.0,11253.45,RP-010,Mahesh,Maintenance,12.2,UPI,4.8,34.0,4.49,76.0,0.0,2025-03-02 05:14:00
VMX-10556,VM-189,Chennai,College,27-06-2025,20:38:00,P-103,Oreo Pack,Snacks,84.84,20.0,0.0,20.0,0.0,RP-018,Anita,Maintenance,12.0,Card,2.9,7.0,3.5,55.0,1.0,2025-06-27 20:38:00
VMX-10557,VM-299,Hyderabad,Hospital,12-05-2025,00:34:00,P-103,Oreo Pack,Snacks,112.27,91.0,86.0,5.0,9655.22,RP-009,Rahul,Maintenance,13.1,UPI,2.7,34.0,1.82,372.0,1.0,2025-05-12 00:34:00
VMX-10558,VM-254,Bangalore,Hospital,17-03-2025,15:05:00,P-102,Bisleri Water,Drinks,72.45,131.0,120.0,11.0,8694.0,RP-006,Amit,Working,18.5,Card,2.5,36.0,1.08,133.0,0.0,2025-03-17 15:05:00
VMX-10559,VM-126,Mumbai,Hospital,15-03-2025,02:27:00,P-106,Snickers Bar,Snacks,106.23,68.0,66.0,2.0,7011.18,RP-004,Fatima,Working,20.9,Cash,3.8,48.0,2.54,106.0,0.0,2025-03-15 02:27:00
VMX-10560,VM-007,Kolkata,College,15-03-2025,20:38:00,P-100,Lays Classic,Snacks,28.51,41.0,33.0,8.0,940.83,RP-004,Fatima,Maintenance,22.3,Card,2.3,17.0,2.92,338.0,1.0,2025-03-15 20:38:00
VMX-10561,VM-137,Delhi,Metro Station,05-05-2025,01:34:00,P-102,Bisleri Water,Drinks,53.03,142.0,138.0,4.0,7318.14,RP-004,Mahesh,Working,11.5,UPI,2.3,113.0,4.35,122.0,0.0,2025-05-05 01:34:00
VMX-10562,VM-147,Bangalore,Hospital,17-03-2025,11:41:00,P-103,Oreo Pack,Snacks,13.36,129.0,117.0,12.0,1563.12,RP-004,Rajesh,Working,24.9,Cash,2.3,36.0,2.43,365.0,1.0,2025-03-17 11:41:00
VMX-10563,VM-272,Chennai,Metro Station,19-03-2025,05:27:00,P-101,Pepsi Can,Drinks,60.47,41.0,40.0,1.0,2418.8,RP-006,Kiran,Working,23.4,Card,2.9,104.0,2.15,498.0,0.0,2025-03-19 05:27:00
VMX-10564,VM-040,Kolkata,College,16-05-2025,22:51:00,P-104,Red Bull,Drinks,138.27,189.0,178.0,11.0,24612.06,RP-005,Amit,Low Power,12.2,UPI,4.2,100.0,4.91,467.0,0.0,2025-05-16 22:51:00
VMX-10565,VM-094,Kolkata,Hospital,16-02-2025,10:08:00,P-101,Pepsi Can,Drinks,90.9,91.0,87.0,4.0,7908.3,RP-012,Deepa,Low Power,16.4,Card,4.9,77.0,4.17,220.0,0.0,2025-02-16 10:08:00
VMX-10566,VM-273,Pune,Mall,03-10-2025,17:31:00,P-103,Oreo Pack,Snacks,63.65,160.0,145.0,15.0,9229.25,RP-013,Ravi,Maintenance,20.7,Card,3.7,88.0,4.25,162.0,0.0,2025-10-03 17:31:00
VMX-10567,VM-069,Hyderabad,College,05-07-2025,17:30:00,P-103,Oreo Pack,Snacks,60.64,72.0,7.0,0.0,4366.08,RP-012,Deepa,Working,14.4,Cash,4.5,70.0,4.89,265.0,0.0,2025-07-05 17:30:00
VMX-10568,VM-074,Mumbai,College,02-03-2025,22:45:00,P-103,Oreo Pack,Snacks,125.9,34.0,30.0,4.0,3777.0,RP-014,Deepa,Working,20.5,Card,3.7,61.0,4.35,495.0,0.0,2025-03-02 22:45:00
VMX-10569,VM-292,Kolkata,Hospital,06-05-2025,02:00:00,P-100,Lays Classic,Snacks,30.56,56.0,54.0,2.0,1650.24,RP-005,Amit,Low Power,21.2,Card,3.6,38.0,2.88,419.0,1.0,2025-05-06 02:00:00
VMX-10570,VM-031,Delhi,College,27-05-2025,03:09:00,P-107,Colgate Mini,Hygiene,119.4,197.0,197.0,0.0,23521.8,RP-020,Amit,Maintenance,12.4,UPI,4.5,87.0,4.79,0.0,1.0,2025-05-27 03:09:00
VMX-10571,VM-268,Mumbai,Mall,22-03-2025,08:05:00,P-109,Doritos,Snacks,80.26,78.0,65.0,13.0,5216.9,RP-007,Kiran,Maintenance,10.8,UPI,2.6,95.0,4.9,359.0,0.0,2025-03-22 08:05:00
VMX-10572,VM-028,Kolkata,Office,27-07-2025,12:10:00,P-107,Colgate Mini,Hygiene,76.84,187.0,167.0,20.0,12832.28,RP-014,Suresh,Low Power,11.6,Cash,3.1,99.0,4.39,64.0,0.0,2025-07-27 12:10:00
VMX-10573,VM-159,Bangalore,Metro Station,19-04-2025,19:00:00,P-104,Red Bull,Drinks,32.79,47.0,45.0,2.0,1475.55,RP-007,Mahesh,Working,14.0,Card,3.7,72.0,4.95,297.0,0.0,2025-04-19 19:00:00
VMX-10574,VM-257,Bangalore,Office,02-07-2025,09:25:00,P-100,Lays Classic,Snacks,54.04,99.0,99.0,0.0,5349.96,RP-013,Deepa,Working,20.5,Cash,3.0,114.0,3.97,101.0,0.0,2025-07-02 09:25:00
VMX-10575,VM-078,Delhi,Hospital,20-01-2025,09:10:00,P-100,Lays Classic,Snacks,92.2,117.0,102.0,15.0,9404.4,RP-003,Ravi,Maintenance,13.5,Cash,4.4,83.0,1.56,417.0,0.0,2025-01-20 09:10:00
VMX-10576,VM-068,Chennai,Office,25-09-2025,10:28:00,P-108,Sprite Bottle,Drinks,82.28,175.0,155.0,20.0,12753.4,RP-012,Rahul,Low Power,10.6,Card,4.3,49.0,1.96,362.0,0.0,2025-09-25 10:28:00
VMX-10577,VM-159,Pune,College,08-01-2025,04:49:00,P-102,Bisleri Water,Drinks,89.37,147.0,144.0,3.0,12869.28,RP-016,Ravi,Low Power,14.7,UPI,2.5,35.0,3.31,230.0,0.0,2025-01-08 04:49:00
VMX-10578,VM-227,Delhi,Mall,31-08-2025,08:48:00,P-101,Pepsi Can,Drinks,35.09,137.0,129.0,8.0,4526.61,RP-004,Rahul,Low Power,10.6,UPI,3.2,109.0,3.48,398.0,0.0,2025-08-31 08:48:00
VMX-10579,VM-212,Pune,Hospital,11-07-2025,02:43:00,P-107,Colgate Mini,Hygiene,61.34,179.0,169.0,10.0,10366.46,RP-009,Mahesh,Maintenance,24.7,Cash,4.2,31.0,3.8,337.0,0.0,2025-07-11 02:43:00
VMX-10580,VM-038,Bangalore,Hospital,23-03-2025,18:25:00,P-102,Bisleri Water,Drinks,129.43,94.0,82.0,12.0,10613.26,RP-015,Ravi,Low Power,17.0,Card,3.6,104.0,2.86,93.0,0.0,2025-03-23 18:25:00
VMX-10581,VM-034,Chennai,Office,13-04-2025,12:21:00,P-101,Pepsi Can,Drinks,138.44,121.0,108.0,13.0,14951.52,RP-020,Rajesh,Working,20.5,UPI,2.3,58.0,1.15,129.0,1.0,2025-04-13 12:21:00
VMX-10582,VM-195,Hyderabad,Office,17-01-2025,19:49:00,P-102,Bisleri Water,Drinks,99.63,101.0,83.0,18.0,8269.29,RP-014,Rajesh,Working,10.8,Cash,4.9,87.0,2.69,179.0,0.0,2025-01-17 19:49:00
VMX-10583,VM-232,Kolkata,Hospital,11-02-2025,09:55:00,P-101,Pepsi Can,Drinks,29.84,90.0,78.0,12.0,2327.52,RP-017,Suresh,Maintenance,23.4,Cash,4.5,11.0,4.58,269.0,1.0,2025-02-11 09:55:00
VMX-10584,VM-083,Delhi,Hospital,04-09-2025,15:34:00,P-104,Red Bull,Drinks,33.03,109.0,96.0,13.0,3170.88,RP-012,Rahul,Low Power,22.3,Card,4.3,76.0,1.79,420.0,0.0,2025-09-04 15:34:00
VMX-10585,VM-076,Mumbai,Office,19-03-2025,14:59:00,P-105,Dettol Wipe,Hygiene,102.97,101.0,101.0,0.0,10399.97,RP-004,Kiran,Low Power,17.8,Cash,5.0,120.0,4.33,114.0,1.0,2025-03-19 14:59:00
VMX-10586,VM-086,Pune,Hospital,04-08-2025,22:34:00,P-109,Doritos,Snacks,23.64,75.0,69.0,6.0,1631.16,RP-007,Deepa,Working,24.3,Card,3.7,1.0,2.48,236.0,0.0,2025-08-04 22:34:00
VMX-10587,VM-212,Mumbai,Office,13-09-2025,20:29:00,P-104,Red Bull,Drinks,135.53,148.0,145.0,3.0,19651.85,RP-012,Fatima,Low Power,17.8,UPI,2.3,22.0,2.84,241.0,0.0,2025-09-13 20:29:00
VMX-10588,VM-224,Delhi,Office,15-07-2025,09:54:00,P-108,Sprite Bottle,Drinks,93.28,158.0,145.0,13.0,13525.6,RP-020,Ravi,Working,22.1,Cash,2.3,2.0,3.47,260.0,0.0,2025-07-15 09:54:00
VMX-10589,VM-258,Pune,College,21-02-2025,20:28:00,P-107,Colgate Mini,Hygiene,114.99,179.0,162.0,17.0,18628.38,RP-010,Kiran,Working,13.3,UPI,3.7,14.0,1.78,290.0,0.0,2025-02-21 20:28:00
VMX-10590,VM-115,Pune,Office,22-07-2025,00:23:00,P-105,Dettol Wipe,Hygiene,145.47,138.0,125.0,13.0,18183.75,RP-009,Anita,Low Power,22.6,UPI,4.0,0.0,4.6,262.0,0.0,2025-07-22 00:23:00
VMX-10591,VM-293,Mumbai,Mall,12-06-2025,10:10:00,P-100,Lays Classic,Snacks,13.67,115.0,99.0,16.0,1353.33,RP-018,Kiran,Working,19.2,UPI,4.5,102.0,4.73,269.0,0.0,2025-06-12 10:10:00
VMX-10592,VM-224,Bangalore,College,12-06-2025,16:10:00,P-106,Snickers Bar,Snacks,146.83,64.0,52.0,12.0,7635.16,RP-005,Fatima,Working,19.5,UPI,4.5,80.0,4.67,478.0,0.0,2025-06-12 16:10:00
VMX-10593,VM-079,Hyderabad,Metro Station,12-08-2025,00:40:00,P-105,Dettol Wipe,Hygiene,38.53,43.0,43.0,0.0,1656.79,RP-018,Ravi,Maintenance,15.7,Card,4.2,58.0,3.54,448.0,1.0,2025-08-12 00:40:00
VMX-10594,VM-126,Delhi,Hospital,10-04-2025,17:53:00,P-102,Bisleri Water,Drinks,43.56,76.0,67.0,9.0,2918.52,RP-009,Mahesh,Low Power,11.2,Cash,3.9,81.0,4.94,493.0,0.0,2025-04-10 17:53:00
VMX-10595,VM-135,Bangalore,College,24-02-2025,04:18:00,P-101,Pepsi Can,Drinks,74.28,172.0,167.0,3.0,12553.32,RP-003,Rajesh,Low Power,23.7,Cash,3.2,62.0,4.18,261.0,0.0,2025-02-24 04:18:00
VMX-10596,VM-161,Delhi,Hospital,03-08-2025,12:56:00,P-107,Colgate Mini,Hygiene,144.29,39.0,33.0,6.0,4761.57,RP-006,Amit,Low Power,10.2,Cash,4.0,80.0,3.43,66.0,0.0,2025-08-03 12:56:00
VMX-10597,VM-268,Delhi,Office,07-10-2025,00:10:00,P-105,Dettol Wipe,Hygiene,149.12,143.0,124.0,19.0,18490.88,RP-004,Suresh,Maintenance,10.4,Cash,3.6,97.0,1.61,493.0,1.0,2025-10-07 00:10:00
VMX-10598,VM-065,Chennai,Office,12-03-2025,07:05:00,P-101,Pepsi Can,Drinks,135.8,27.0,17.0,10.0,2308.6,RP-016,Suresh,Working,15.2,Card,4.0,59.0,3.98,303.0,1.0,2025-03-12 07:05:00
VMX-10599,VM-144,Mumbai,College,30-03-2025,06:43:00,P-108,Sprite Bottle,Drinks,142.49,69.0,61.0,8.0,8691.89,RP-019,Rahul,Low Power,12.5,Cash,4.9,62.0,2.73,278.0,1.0,2025-03-30 06:43:00
VMX-10600,VM-220,Bangalore,Metro Station,25-02-2025,19:24:00,P-109,Doritos,Snacks,114.59,101.0,82.0,19.0,9396.38,RP-012,Deepa,Maintenance,22.3,UPI,2.5,4.0,4.83,179.0,1.0,2025-02-25 19:24:00
VMX-10601,VM-059,Bangalore,Office,30-06-2025,12:01:00,P-104,Red Bull,Drinks,94.54,185.0,169.0,16.0,15977.26,RP-014,Amit,Low Power,13.7,Cash,4.0,47.0,1.58,210.0,0.0,2025-06-30 12:01:00
VMX-10602,VM-165,Bangalore,Metro Station,20-04-2025,14:36:00,P-100,Lays Classic,Snacks,54.6,22.0,12.0,10.0,655.2,RP-003,Kiran,Low Power,19.0,Card,2.7,71.0,2.11,361.0,0.0,2025-04-20 14:36:00
VMX-10603,VM-101,Hyderabad,Hospital,12-06-2025,10:12:00,P-109,Doritos,Snacks,134.97,127.0,114.0,13.0,15386.58,RP-016,Mahesh,Low Power,16.3,Cash,3.4,76.0,2.31,246.0,0.0,2025-06-12 10:12:00
VMX-10604,VM-068,Kolkata,Hospital,03-01-2025,14:18:00,P-109,Doritos,Snacks,12.98,24.0,4.0,20.0,51.92,RP-002,Fatima,Maintenance,10.6,Card,2.0,60.0,1.38,460.0,1.0,2025-01-03 14:18:00
VMX-10605,VM-161,Mumbai,Metro Station,10-02-2025,17:49:00,P-104,Red Bull,Drinks,48.45,108.0,96.0,12.0,4651.2,RP-002,Kiran,Low Power,20.4,UPI,3.5,82.0,4.87,112.0,1.0,2025-02-10 17:49:00
VMX-10606,VM-166,Kolkata,Hospital,06-01-2025,04:06:00,P-109,Doritos,Snacks,24.38,77.0,76.0,1.0,1852.88,RP-008,Amit,Working,12.9,UPI,4.4,68.0,4.96,402.0,0.0,2025-01-06 04:06:00
VMX-10607,VM-136,Chennai,Metro Station,25-01-2025,09:04:00,P-104,Red Bull,Drinks,133.66,31.0,28.0,3.0,3742.48,RP-013,Anita,Maintenance,12.6,Cash,3.8,15.0,1.51,491.0,0.0,2025-01-25 09:04:00
VMX-10608,VM-268,Pune,Mall,17-08-2025,21:07:00,P-109,Doritos,Snacks,134.29,125.0,105.0,20.0,14100.45,RP-019,Rajesh,Maintenance,17.4,UPI,3.0,93.0,2.93,97.0,1.0,2025-08-17 21:07:00
VMX-10609,VM-106,Delhi,College,05-05-2025,21:41:00,P-104,Red Bull,Drinks,109.59,110.0,93.0,17.0,10191.87,RP-003,Rajesh,Working,13.2,Card,2.6,104.0,2.54,299.0,0.0,2025-05-05 21:41:00
VMX-10610,VM-160,Delhi,Hospital,21-09-2025,10:48:00,P-105,Dettol Wipe,Hygiene,39.21,171.0,155.0,16.0,6077.55,RP-005,Fatima,Working,23.7,Cash,4.8,49.0,4.9,494.0,0.0,2025-09-21 10:48:00
VMX-10611,VM-296,Delhi,College,26-03-2025,21:19:00,P-106,Snickers Bar,Snacks,36.31,91.0,78.0,13.0,2832.18,RP-005,Rajesh,Working,21.2,Cash,2.0,58.0,1.75,64.0,1.0,2025-03-26 21:19:00
VMX-10612,VM-109,Bangalore,Hospital,13-02-2025,11:27:00,P-108,Sprite Bottle,Drinks,73.37,87.0,84.0,3.0,6163.08,RP-017,Kiran,Maintenance,15.0,UPI,2.8,12.0,1.2,245.0,1.0,2025-02-13 11:27:00
VMX-10613,VM-253,Pune,Hospital,22-05-2025,16:38:00,P-103,Oreo Pack,Snacks,51.16,123.0,118.0,5.0,6036.88,RP-004,Mahesh,Maintenance,13.7,Cash,2.7,6.0,4.58,344.0,1.0,2025-05-22 16:38:00
VMX-10614,VM-208,Mumbai,Hospital,26-04-2025,19:44:00,P-103,Oreo Pack,Snacks,19.22,45.0,37.0,8.0,711.14,RP-004,Suresh,Maintenance,22.4,Card,2.8,26.0,1.68,154.0,1.0,2025-04-26 19:44:00
VMX-10615,VM-245,Delhi,Office,18-02-2025,05:32:00,P-104,Red Bull,Drinks,108.82,93.0,93.0,0.0,10120.26,RP-008,Amit,Low Power,20.2,Cash,2.6,115.0,2.82,56.0,1.0,2025-02-18 05:32:00
VMX-10616,VM-005,Pune,Office,09-02-2025,05:43:00,P-106,Snickers Bar,Snacks,56.77,65.0,57.0,8.0,3235.89,RP-016,Rahul,Working,17.3,Cash,3.4,5.0,4.28,340.0,1.0,2025-02-09 05:43:00
VMX-10617,VM-172,Mumbai,Hospital,18-02-2025,03:19:00,P-103,Oreo Pack,Snacks,83.54,62.0,58.0,4.0,4845.32,RP-012,Fatima,Low Power,20.0,UPI,3.1,1.0,4.31,204.0,1.0,2025-02-18 03:19:00
VMX-10618,VM-266,Delhi,College,27-02-2025,08:43:00,P-108,Sprite Bottle,Drinks,118.43,172.0,157.0,15.0,18593.51,RP-005,Kiran,Working,19.9,Cash,3.1,3.0,1.98,429.0,1.0,2025-02-27 08:43:00
VMX-10619,VM-141,Delhi,Metro Station,13-07-2025,20:06:00,P-105,Dettol Wipe,Hygiene,38.88,42.0,36.0,6.0,1399.68,RP-015,Fatima,Working,14.0,Card,3.0,42.0,2.56,263.0,1.0,2025-07-13 20:06:00
VMX-10620,VM-222,Kolkata,Hospital,25-06-2025,19:07:00,P-104,Red Bull,Drinks,36.68,168.0,152.0,16.0,5575.36,RP-019,Deepa,Low Power,11.7,Cash,3.5,87.0,1.59,398.0,0.0,2025-06-25 19:07:00
VMX-10621,VM-148,Hyderabad,Office,25-03-2025,09:31:00,P-108,Sprite Bottle,Drinks,145.33,179.0,162.0,17.0,23543.46,RP-001,Rajesh,Working,13.3,Card,2.4,62.0,2.22,270.0,1.0,2025-03-25 09:31:00
VMX-10622,VM-288,Bangalore,College,26-05-2025,16:42:00,P-100,Lays Classic,Snacks,16.99,55.0,44.0,11.0,747.56,RP-009,Amit,Maintenance,13.0,Card,4.8,37.0,1.88,292.0,1.0,2025-05-26 16:42:00
VMX-10623,VM-051,Chennai,Office,05-08-2025,12:57:00,P-103,Oreo Pack,Snacks,123.64,183.0,171.0,12.0,21142.44,RP-020,Anita,Working,18.5,Card,4.6,102.0,3.31,399.0,0.0,2025-08-05 12:57:00
VMX-10624,VM-153,Pune,Hospital,04-06-2025,09:05:00,P-104,Red Bull,Drinks,29,161.0,155.0,6.0,4495.0,RP-018,Amit,Low Power,21.7,UPI,2.3,67.0,2.77,210.0,1.0,2025-06-04 09:05:00
VMX-10625,VM-287,Hyderabad,Hospital,30-07-2025,14:01:00,P-107,Colgate Mini,Hygiene,59.59,139.0,126.0,13.0,7508.34,RP-003,Amit,Maintenance,23.6,Cash,3.7,47.0,1.51,328.0,1.0,2025-07-30 14:01:00
VMX-10626,VM-237,Kolkata,Metro Station,26-07-2025,21:00:00,P-100,Lays Classic,Snacks,115.75,120.0,116.0,4.0,13427.0,RP-015,Mahesh,Working,10.8,Card,2.3,76.0,1.39,198.0,1.0,2025-07-26 21:00:00
VMX-10627,VM-028,Delhi,Mall,19-09-2025,23:45:00,P-105,Dettol Wipe,Hygiene,131,51.0,33.0,18.0,4323.0,RP-017,Amit,Maintenance,21.1,UPI,2.4,114.0,3.7,486.0,0.0,2025-09-19 23:45:00
VMX-10628,VM-001,Bangalore,Metro Station,13-04-2025,03:04:00,P-104,Red Bull,Drinks,97.95,21.0,6.0,15.0,587.7,RP-004,Fatima,Working,13.7,Cash,3.4,106.0,3.02,250.0,0.0,2025-04-13 03:04:00
VMX-10629,VM-225,Kolkata,Metro Station,01-05-2025,17:16:00,P-101,Pepsi Can,Drinks,51.99,143.0,138.0,5.0,7174.62,RP-004,Kiran,Working,19.5,Cash,2.4,95.0,3.63,137.0,0.0,2025-05-01 17:16:00
VMX-10630,VM-141,Mumbai,Hospital,10-09-2025,11:42:00,P-107,Colgate Mini,Hygiene,77.27,94.0,91.0,3.0,7031.57,RP-004,Rajesh,Low Power,22.2,Cash,2.1,58.0,1.48,249.0,0.0,2025-09-10 11:42:00
VMX-10631,VM-182,Bangalore,Hospital,16-08-2025,01:58:00,P-109,Doritos,Snacks,52.39,185.0,165.0,20.0,8644.35,RP-015,Anita,Working,24.7,UPI,3.5,110.0,3.01,228.0,1.0,2025-08-16 01:58:00
VMX-10632,VM-289,Chennai,Hospital,30-06-2025,20:46:00,P-108,Sprite Bottle,Drinks,18.79,187.0,183.0,4.0,3438.57,RP-005,Anita,Maintenance,14.5,UPI,2.2,107.0,3.58,242.0,1.0,2025-06-30 20:46:00
VMX-10633,VM-166,Pune,Metro Station,27-09-2025,08:08:00,P-109,Doritos,Snacks,102.26,167.0,151.0,16.0,15441.26,RP-012,Rahul,Maintenance,22.4,Cash,2.1,109.0,3.93,168.0,0.0,2025-09-27 08:08:00
VMX-10634,VM-122,Hyderabad,Mall,15-06-2025,07:49:00,P-101,Pepsi Can,Drinks,79.92,193.0,178.0,15.0,14225.76,RP-013,Kiran,Working,10.9,UPI,2.3,108.0,4.0,276.0,1.0,2025-06-15 07:49:00
VMX-10635,VM-231,Mumbai,Mall,14-06-2025,03:44:00,P-109,Doritos,Snacks,98.38,27.0,22.0,5.0,2164.36,RP-019,Fatima,Working,12.9,UPI,3.3,36.0,1.9,429.0,0.0,2025-06-14 03:44:00
VMX-10636,VM-050,Bangalore,College,13-01-2025,20:42:00,P-106,Snickers Bar,Snacks,123.94,69.0,67.0,2.0,8303.98,RP-005,Mahesh,Low Power,21.6,Card,3.6,9.0,2.36,399.0,1.0,2025-01-13 20:42:00
VMX-10637,VM-287,Kolkata,Mall,14-09-2025,11:22:00,P-103,Oreo Pack,Snacks,126.54,166.0,151.0,15.0,19107.54,RP-003,Rajesh,Low Power,19.4,Cash,3.7,16.0,4.13,202.0,0.0,2025-09-14 11:22:00
VMX-10638,VM-115,Kolkata,Office,04-10-2025,10:01:00,P-101,Pepsi Can,Drinks,79.82,33.0,14.0,19.0,1117.48,RP-009,Kiran,Maintenance,15.4,Cash,4.9,9.0,3.14,173.0,1.0,2025-10-04 10:01:00
VMX-10639,VM-016,Hyderabad,Office,30-08-2025,08:41:00,P-106,Snickers Bar,Snacks,96.61,159.0,156.0,3.0,15071.16,RP-014,Anita,Working,15.0,Cash,2.4,70.0,4.27,218.0,0.0,2025-08-30 08:41:00
VMX-10640,VM-214,Pune,Metro Station,19-01-2025,11:04:00,P-103,Oreo Pack,Snacks,79.1,164.0,145.0,19.0,11469.5,RP-003,Fatima,Low Power,24.2,UPI,4.2,13.0,1.14,309.0,0.0,2025-01-19 11:04:00
VMX-10641,VM-101,Pune,Metro Station,11-01-2025,01:01:00,P-105,Dettol Wipe,Hygiene,70.41,97.0,90.0,7.0,6336.9,RP-013,Mahesh,Maintenance,17.2,UPI,4.3,89.0,1.5,409.0,1.0,2025-01-11 01:01:00
VMX-10642,VM-176,Mumbai,College,08-07-2025,11:12:00,P-108,Sprite Bottle,Drinks,29.29,132.0,129.0,3.0,3778.41,RP-008,Suresh,Working,18.8,Cash,3.2,96.0,4.55,456.0,0.0,2025-07-08 11:12:00
VMX-10643,VM-225,Bangalore,Office,09-02-2025,01:08:00,P-100,Lays Classic,Snacks,132.26,83.0,82.0,1.0,10845.32,RP-002,Deepa,Low Power,19.0,Cash,5.0,16.0,3.42,295.0,0.0,2025-02-09 01:08:00
VMX-10644,VM-183,Kolkata,Mall,11-09-2025,22:47:00,P-101,Pepsi Can,Drinks,20.69,159.0,153.0,6.0,3165.57,RP-015,Anita,Low Power,21.7,UPI,4.6,31.0,3.11,186.0,1.0,2025-09-11 22:47:00
VMX-10645,VM-249,Chennai,College,30-07-2025,22:39:00,P-108,Sprite Bottle,Drinks,80.48,33.0,22.0,11.0,1770.56,RP-007,Amit,Maintenance,13.5,Card,3.7,15.0,2.49,467.0,0.0,2025-07-30 22:39:00
VMX-10646,VM-256,Kolkata,College,21-08-2025,03:01:00,P-100,Lays Classic,Snacks,146.91,198.0,184.0,14.0,27031.44,RP-009,Anita,Maintenance,15.8,Cash,2.2,109.0,3.44,303.0,0.0,2025-08-21 03:01:00
VMX-10647,VM-221,Pune,College,16-04-2025,12:11:00,P-106,Snickers Bar,Snacks,63.85,31.0,24.0,7.0,1532.4,RP-010,Mahesh,Maintenance,21.4,Cash,4.7,96.0,4.57,474.0,1.0,2025-04-16 12:11:00
VMX-10648,VM-030,Kolkata,College,11-08-2025,13:50:00,P-109,Doritos,Snacks,40.32,27.0,17.0,10.0,685.44,RP-018,Kiran,Maintenance,24.0,UPI,4.6,120.0,3.14,267.0,1.0,2025-08-11 13:50:00
VMX-10649,VM-141,Hyderabad,Mall,09-03-2025,00:17:00,P-102,Bisleri Water,Drinks,144.44,139.0,132.0,7.0,19066.08,RP-018,Anita,Low Power,18.6,Cash,3.8,46.0,2.07,178.0,0.0,2025-03-09 00:17:00
VMX-10650,VM-237,Hyderabad,Hospital,16-05-2025,05:28:00,P-101,Pepsi Can,Drinks,52.97,189.0,179.0,10.0,9481.63,RP-001,Rajesh,Working,24.5,UPI,3.9,71.0,1.87,79.0,0.0,2025-05-16 05:28:00
VMX-10651,VM-133,Kolkata,Office,02-02-2025,14:11:00,P-104,Red Bull,Drinks,135.59,161.0,151.0,10.0,20474.09,RP-009,Rajesh,Working,13.4,Cash,2.4,79.0,3.62,169.0,0.0,2025-02-02 14:11:00
VMX-10652,VM-117,Hyderabad,Office,12-06-2025,01:35:00,P-100,Lays Classic,Snacks,35.8,149.0,135.0,14.0,4833.0,RP-009,Mahesh,Maintenance,22.7,UPI,3.6,5.0,3.4,229.0,0.0,2025-06-12 01:35:00
VMX-10653,VM-167,Pune,Office,09-02-2025,07:13:00,P-101,Pepsi Can,Drinks,80.97,48.0,32.0,16.0,2591.04,RP-014,Ravi,Maintenance,16.4,UPI,2.4,41.0,3.43,234.0,1.0,2025-02-09 07:13:00
VMX-10654,VM-083,Chennai,College,31-05-2025,19:01:00,P-106,Unknown,Snacks,135.63,115.0,100.0,15.0,13563.0,RP-010,Amit,Maintenance,10.4,Card,2.6,40.0,3.04,449.0,1.0,2025-05-31 19:01:00
VMX-10655,VM-041,Hyderabad,Mall,18-03-2025,12:48:00,P-103,Oreo Pack,Snacks,63.04,169.0,168.0,1.0,10590.72,RP-019,Fatima,Maintenance,19.5,Card,3.3,93.0,1.48,499.0,0.0,2025-03-18 12:48:00
VMX-10656,VM-100,Kolkata,Metro Station,14-08-2025,10:17:00,P-109,Doritos,Snacks,76.13,154.0,138.0,16.0,10505.94,RP-010,Suresh,Low Power,13.6,UPI,2.7,40.0,3.99,109.0,0.0,2025-08-14 10:17:00
VMX-10657,VM-259,Hyderabad,Office,10-02-2025,11:35:00,P-107,Colgate Mini,Hygiene,112.59,124.0,113.0,11.0,12722.67,RP-016,Rahul,Working,16.7,UPI,2.7,105.0,4.31,114.0,0.0,2025-02-10 11:35:00
VMX-10658,VM-161,Hyderabad,College,14-05-2025,09:21:00,P-106,Snickers Bar,Snacks,104.37,190.0,186.0,4.0,19412.82,RP-014,Kiran,Maintenance,24.7,Card,3.5,112.0,4.09,142.0,1.0,2025-05-14 09:21:00
VMX-10659,VM-065,Kolkata,College,29-08-2025,23:06:00,P-100,Lays Classic,Snacks,33.35,127.0,119.0,8.0,3968.65,RP-014,Mahesh,Maintenance,12.5,Cash,2.4,110.0,3.12,248.0,1.0,2025-08-29 23:06:00
VMX-10660,VM-061,Chennai,Office,04-05-2025,22:18:00,P-105,Dettol Wipe,Hygiene,27.84,198.0,181.0,17.0,5039.04,RP-019,Rahul,Maintenance,11.6,Card,2.1,94.0,4.68,279.0,1.0,2025-05-04 22:18:00
VMX-10661,VM-094,Delhi,Metro Station,02-09-2025,22:08:00,P-107,Colgate Mini,Hygiene,113.7,131.0,122.0,9.0,13871.4,RP-017,Ravi,Working,23.4,Card,3.8,86.0,3.6,244.0,1.0,2025-09-02 22:08:00
VMX-10662,VM-253,Chennai,College,19-02-2025,07:19:00,P-107,Colgate Mini,Hygiene,34.74,170.0,162.0,8.0,5627.88,RP-019,Fatima,Maintenance,18.7,UPI,2.9,49.0,2.27,141.0,0.0,2025-02-19 07:19:00
VMX-10663,VM-161,Hyderabad,Office,23-09-2025,08:36:00,P-100,Lays Classic,Snacks,123.96,73.0,60.0,13.0,7437.6,RP-010,Amit,Working,14.3,UPI,3.3,113.0,1.68,182.0,0.0,2025-09-23 08:36:00
VMX-10664,VM-261,Kolkata,Mall,16-04-2025,17:53:00,P-103,Oreo Pack,Snacks,103.3,56.0,53.0,3.0,5474.9,RP-001,Rahul,Working,24.4,Card,3.6,24.0,1.03,476.0,0.0,2025-04-16 17:53:00
VMX-10665,VM-233,Chennai,College,16-08-2025,16:08:00,P-105,Dettol Wipe,Hygiene,38.44,166.0,153.0,13.0,5881.32,RP-004,Rajesh,Low Power,17.4,Cash,4.6,35.0,3.93,109.0,1.0,2025-08-16 16:08:00
VMX-10666,VM-172,Chennai,Hospital,17-06-2025,05:32:00,P-101,Pepsi Can,Drinks,114.2,76.0,74.0,2.0,8450.8,RP-017,Ravi,Maintenance,20.3,Cash,3.3,119.0,3.82,316.0,1.0,2025-06-17 05:32:00
VMX-10667,VM-005,Bangalore,Mall,19-01-2025,20:40:00,P-103,Oreo Pack,Snacks,127.8,189.0,169.0,20.0,21598.2,RP-019,Kiran,Working,20.1,UPI,3.4,62.0,4.26,425.0,1.0,2025-01-19 20:40:00
VMX-10668,VM-110,Hyderabad,Hospital,22-09-2025,23:47:00,P-104,Red Bull,Drinks,0,182.0,180.0,2.0,5121.0,RP-003,Rajesh,Maintenance,19.2,Card,2.5,53.0,3.75,364.0,1.0,2025-09-22 23:47:00
VMX-10669,VM-154,Kolkata,Mall,29-09-2025,21:11:00,P-109,Doritos,Snacks,42.86,109.0,94.0,15.0,4028.84,RP-010,Rajesh,Low Power,22.0,UPI,3.8,69.0,2.92,99.0,0.0,2025-09-29 21:11:00
VMX-10670,VM-218,Hyderabad,Mall,17-08-2025,10:15:00,P-101,Pepsi Can,Drinks,144.81,93.0,80.0,13.0,11584.8,RP-015,Deepa,Maintenance,11.7,Card,3.2,16.0,4.09,297.0,1.0,2025-08-17 10:15:00
VMX-10671,VM-111,Kolkata,Hospital,29-05-2025,08:32:00,P-109,Doritos,Snacks,67.68,80.0,80.0,0.0,5414.4,RP-002,Fatima,Low Power,13.9,UPI,3.2,103.0,2.77,254.0,1.0,2025-05-29 08:32:00
VMX-10672,VM-210,Bangalore,Metro Station,24-01-2025,09:28:00,P-100,Lays Classic,Snacks,47.56,76.0,66.0,10.0,3138.96,RP-006,Fatima,Working,21.7,Cash,4.8,78.0,3.44,116.0,0.0,2025-01-24 09:28:00
VMX-10673,VM-026,Pune,Mall,30-06-2025,17:04:00,P-100,Lays Classic,Snacks,122.34,43.0,33.0,10.0,4037.22,RP-012,Fatima,Working,24.8,Card,3.2,91.0,1.92,460.0,0.0,2025-06-30 17:04:00
VMX-10674,VM-011,Kolkata,Metro Station,08-05-2025,00:02:00,P-105,Dettol Wipe,Hygiene,56.41,75.0,58.0,17.0,3271.78,RP-004,Fatima,Low Power,21.9,Cash,2.5,38.0,1.1,373.0,0.0,2025-05-08 00:02:00
VMX-10675,VM-139,Kolkata,College,25-07-2025,04:52:00,P-100,Lays Classic,Snacks,48.14,51.0,39.0,12.0,1877.46,RP-003,Ravi,Maintenance,20.8,Card,3.2,1.0,3.97,327.0,0.0,2025-07-25 04:52:00
VMX-10676,VM-263,Delhi,College,09-06-2025,10:27:00,P-101,Pepsi Can,Drinks,113.02,120.0,114.0,6.0,12884.28,RP-010,Anita,Low Power,13.0,UPI,4.9,73.0,2.89,199.0,1.0,2025-06-09 10:27:00
VMX-10677,VM-274,Pune,Mall,23-05-2025,15:18:00,P-101,Pepsi Can,Drinks,41.12,124.0,107.0,17.0,4399.84,RP-013,Mahesh,Low Power,20.9,UPI,4.3,91.0,1.43,164.0,0.0,2025-05-23 15:18:00
VMX-10678,VM-160,Chennai,Mall,02-09-2025,18:06:00,P-106,Snickers Bar,Snacks,117.97,134.0,123.0,11.0,14510.31,RP-003,Ravi,Maintenance,12.5,UPI,3.8,10.0,1.57,365.0,1.0,2025-09-02 18:06:00
VMX-10679,VM-211,Chennai,Office,31-01-2025,15:16:00,P-108,Sprite Bottle,Drinks,111.22,165.0,158.0,7.0,17572.76,RP-005,Mahesh,Low Power,0.0,Card,3.2,0.0,2.07,157.0,1.0,2025-01-31 15:16:00
VMX-10680,VM-248,Pune,Metro Station,14-06-2025,14:45:00,P-108,Sprite Bottle,Drinks,79.97,186.0,179.0,7.0,14314.63,RP-003,Ravi,Low Power,20.5,UPI,2.4,1.0,1.65,433.0,0.0,2025-06-14 14:45:00
VMX-10681,VM-269,Mumbai,Mall,06-08-2025,15:10:00,P-102,Bisleri Water,Drinks,37.63,49.0,48.0,1.0,1806.24,RP-018,Kiran,Low Power,10.1,Cash,3.3,37.0,3.88,500.0,1.0,2025-08-06 15:10:00
VMX-10682,VM-268,Delhi,Mall,26-03-2025,04:18:00,P-108,Sprite Bottle,Drinks,55.13,115.0,97.0,18.0,5347.61,RP-020,Deepa,Maintenance,19.1,UPI,3.4,119.0,2.32,432.0,0.0,2025-03-26 04:18:00
VMX-10683,VM-077,Mumbai,College,12-06-2025,13:11:00,P-102,Bisleri Water,Drinks,83.41,141.0,141.0,0.0,11760.81,RP-001,Anita,Maintenance,12.8,Card,2.3,58.0,2.32,81.0,1.0,2025-06-12 13:11:00
VMX-10684,VM-008,Bangalore,Office,26-04-2025,11:40:00,P-109,Doritos,Snacks,31.9,109.0,89.0,20.0,2839.1,RP-010,Kiran,Maintenance,20.9,UPI,3.9,51.0,4.74,337.0,0.0,2025-04-26 11:40:00
VMX-10685,VM-289,Hyderabad,Mall,24-05-2025,05:16:00,P-101,Pepsi Can,Drinks,92.97,46.0,40.0,6.0,3718.8,RP-017,Rahul,Maintenance,21.5,UPI,3.7,109.0,3.37,191.0,1.0,2025-05-24 05:16:00
VMX-10686,VM-074,Bangalore,Hospital,16-02-2025,19:09:00,P-103,Oreo Pack,Snacks,33.53,79.0,73.0,6.0,2447.69,RP-001,Deepa,Working,23.4,Cash,2.4,103.0,2.76,390.0,1.0,2025-02-16 19:09:00
VMX-10687,VM-198,Delhi,Hospital,21-07-2025,12:49:00,P-105,Dettol Wipe,Hygiene,52.36,50.0,43.0,7.0,2251.48,RP-012,Anita,Maintenance,14.8,Cash,4.6,107.0,1.86,135.0,1.0,2025-07-21 12:49:00
VMX-10688,VM-129,Delhi,College,08-09-2025,22:50:00,P-102,Bisleri Water,Drinks,127.58,163.0,149.0,14.0,19009.42,RP-018,Kiran,Maintenance,15.2,Cash,4.6,109.0,2.86,393.0,1.0,2025-09-08 22:50:00
VMX-10689,VM-006,Bangalore,Hospital,15-07-2025,11:11:00,P-106,Snickers Bar,Snacks,39.93,163.0,157.0,6.0,6269.01,RP-012,Fatima,Working,10.1,UPI,3.0,116.0,2.48,179.0,0.0,2025-07-15 11:11:00
VMX-10690,VM-130,Chennai,College,03-09-2025,12:02:00,P-109,Doritos,Snacks,48.22,185.0,177.0,8.0,8534.94,RP-019,Mahesh,Maintenance,23.9,Card,3.9,62.0,1.7,433.0,0.0,2025-09-03 12:02:00
VMX-10691,VM-215,Kolkata,College,01-04-2025,04:05:00,P-100,Lays Classic,Snacks,61.73,176.0,172.0,4.0,10617.56,RP-002,Rajesh,Maintenance,20.7,UPI,2.3,69.0,2.11,486.0,0.0,2025-04-01 04:05:00
VMX-10692,VM-188,Pune,College,28-03-2025,18:46:00,P-109,Doritos,Snacks,113.24,105.0,95.0,10.0,10757.8,RP-013,Kiran,Maintenance,20.0,Cash,2.6,97.0,3.01,423.0,1.0,2025-03-28 18:46:00
VMX-10693,VM-210,Bangalore,College,12-04-2025,22:32:00,P-101,Pepsi Can,Drinks,34.16,31.0,23.0,8.0,785.68,RP-010,Anita,Maintenance,15.3,UPI,3.4,107.0,3.79,339.0,1.0,2025-04-12 22:32:00
VMX-10694,VM-011,Kolkata,Mall,14-02-2025,05:20:00,P-101,Pepsi Can,Drinks,26.28,43.0,38.0,5.0,998.64,RP-001,Suresh,Maintenance,15.6,Cash,4.6,120.0,1.99,478.0,0.0,2025-02-14 05:20:00
VMX-10695,VM-290,Chennai,Hospital,02-04-2025,08:08:00,P-102,Bisleri Water,Drinks,53.47,117.0,108.0,9.0,5774.76,RP-008,Suresh,Low Power,23.3,Cash,4.9,33.0,3.79,185.0,0.0,2025-04-02 08:08:00
VMX-10696,VM-088,Hyderabad,Metro Station,25-09-2025,14:53:00,P-107,Colgate Mini,Hygiene,59.72,113.0,102.0,11.0,6091.44,RP-013,Amit,Maintenance,18.5,Card,3.3,82.0,4.24,457.0,1.0,2025-09-25 14:53:00
VMX-10697,VM-108,Chennai,Mall,18-05-2025,02:32:00,P-103,Oreo Pack,Snacks,57.91,148.0,131.0,17.0,7586.21,RP-015,Anita,Working,23.8,Card,4.0,23.0,2.9,289.0,1.0,2025-05-18 02:32:00
VMX-10698,VM-054,Delhi,Office,18-01-2025,10:44:00,P-105,Dettol Wipe,Hygiene,88.93,188.0,170.0,18.0,15118.1,RP-001,Amit,Low Power,17.1,UPI,3.9,12.0,1.75,233.0,1.0,2025-01-18 10:44:00
VMX-10699,VM-295,Delhi,Hospital,13-08-2025,19:29:00,P-102,Bisleri Water,Drinks,75.36,67.0,67.0,0.0,5049.12,RP-013,Rajesh,Working,13.8,UPI,3.8,61.0,3.71,203.0,0.0,2025-08-13 19:29:00
VMX-10700,VM-138,Pune,Hospital,04-08-2025,13:49:00,P-103,Oreo Pack,Snacks,116.84,149.0,146.0,3.0,17058.64,RP-019,Mahesh,Working,17.7,UPI,4.7,89.0,4.77,151.0,0.0,2025-08-04 13:49:00
VMX-10701,VM-178,Mumbai,Hospital,08-06-2025,04:51:00,P-102,Bisleri Water,Drinks,102.88,33.0,31.0,2.0,3189.28,RP-006,Rajesh,Working,19.9,Cash,4.6,38.0,2.23,144.0,0.0,2025-06-08 04:51:00
VMX-10702,VM-082,Chennai,College,11-07-2025,00:30:00,P-103,Oreo Pack,Snacks,71.12,82.0,78.0,4.0,5547.36,RP-016,Fatima,Maintenance,15.9,Cash,4.7,85.0,2.51,287.0,0.0,2025-07-11 00:30:00
VMX-10703,VM-145,Kolkata,Hospital,24-07-2025,10:57:00,P-101,Pepsi Can,Drinks,64.26,101.0,97.0,4.0,6233.22,RP-020,Kiran,Maintenance,11.1,UPI,4.0,75.0,1.11,361.0,0.0,2025-07-24 10:57:00
VMX-10704,VM-204,Hyderabad,Mall,01-01-2025,19:38:00,P-103,Oreo Pack,Snacks,61.68,107.0,91.0,16.0,5612.88,RP-005,Rajesh,Working,10.7,UPI,3.3,43.0,2.54,142.0,1.0,2025-01-01 19:38:00
VMX-10705,VM-092,Bangalore,Hospital,18-01-2025,08:26:00,P-102,Bisleri Water,Drinks,49.89,119.0,104.0,15.0,5188.56,RP-017,Ravi,Low Power,22.1,UPI,4.1,12.0,3.62,257.0,0.0,2025-01-18 08:26:00
VMX-10706,VM-006,Mumbai,Hospital,16-07-2025,21:29:00,P-102,Bisleri Water,Drinks,54.66,167.0,151.0,16.0,8253.66,RP-014,Mahesh,Low Power,16.4,Card,3.9,77.0,4.23,280.0,1.0,2025-07-16 21:29:00
VMX-10707,VM-273,Kolkata,Hospital,27-02-2025,05:27:00,P-107,Colgate Mini,Hygiene,109.68,156.0,145.0,11.0,15903.6,RP-003,Amit,Working,15.1,Card,3.8,25.0,3.06,364.0,1.0,2025-02-27 05:27:00
VMX-10708,VM-188,Hyderabad,Metro Station,04-03-2025,15:29:00,P-106,Snickers Bar,Snacks,16.8,92.0,91.0,1.0,1528.8,RP-012,Anita,Low Power,15.1,UPI,4.3,3.0,3.17,141.0,1.0,2025-03-04 15:29:00
VMX-10709,VM-058,Chennai,College,02-06-2025,20:02:00,P-105,Dettol Wipe,Hygiene,68.39,134.0,124.0,10.0,8480.36,RP-018,Kiran,Working,12.6,Card,2.3,93.0,1.58,302.0,1.0,2025-06-02 20:02:00
VMX-10710,VM-269,Pune,Hospital,05-05-2025,23:52:00,P-104,Red Bull,Drinks,58.35,137.0,118.0,19.0,6885.3,RP-002,Ravi,Low Power,15.6,Cash,3.8,92.0,3.55,101.0,1.0,2025-05-05 23:52:00
VMX-10711,VM-012,Bangalore,Office,04-06-2025,13:25:00,P-108,Sprite Bottle,Drinks,147.24,40.0,30.0,10.0,4417.2,RP-003,Kiran,Working,21.9,Card,2.8,38.0,3.46,326.0,0.0,2025-06-04 13:25:00
VMX-10712,VM-096,Chennai,Metro Station,12-08-2025,08:47:00,P-100,Lays Classic,Snacks,62.39,141.0,135.0,6.0,8422.65,RP-002,Rahul,Low Power,23.6,Card,2.9,0.0,2.63,59.0,1.0,2025-08-12 08:47:00
VMX-10713,VM-116,Hyderabad,Office,12-06-2025,03:14:00,P-102,Bisleri Water,Drinks,48.47,138.0,119.0,19.0,5767.93,RP-008,Ravi,Maintenance,14.3,Card,3.8,58.0,3.35,375.0,1.0,2025-06-12 03:14:00
VMX-10714,VM-178,Kolkata,Hospital,25-06-2025,10:20:00,P-108,Sprite Bottle,Drinks,64.47,162.0,162.0,0.0,10444.14,RP-005,Rajesh,Maintenance,17.5,Card,4.1,86.0,2.56,256.0,0.0,2025-06-25 10:20:00
VMX-10715,VM-272,Chennai,Office,26-06-2025,02:13:00,P-109,Doritos,Snacks,145.48,181.0,166.0,15.0,24149.68,RP-010,Deepa,Low Power,20.1,Cash,2.5,74.0,1.67,230.0,1.0,2025-06-26 02:13:00
VMX-10716,VM-276,Bangalore,Hospital,09-09-2025,07:24:00,P-106,Snickers Bar,Snacks,149.42,25.0,16.0,9.0,2390.72,RP-020,Ravi,Working,15.9,Cash,5.0,73.0,2.16,492.0,0.0,2025-09-09 07:24:00
VMX-10717,VM-164,Kolkata,Office,03-08-2025,19:17:00,P-106,Snickers Bar,Snacks,87.01,110.0,104.0,6.0,9049.04,RP-004,Deepa,Maintenance,18.0,UPI,2.7,51.0,2.98,287.0,1.0,2025-08-03 19:17:00
VMX-10718,VM-172,Kolkata,Hospital,28-05-2025,00:34:00,P-107,Colgate Mini,Hygiene,31.98,65.0,53.0,12.0,1694.94,RP-006,Ravi,Low Power,18.7,UPI,4.9,52.0,1.76,64.0,0.0,2025-05-28 00:34:00
VMX-10719,VM-128,Bangalore,Metro Station,29-07-2025,00:20:00,P-102,Bisleri Water,Drinks,95.36,148.0,146.0,2.0,13922.56,RP-016,Ravi,Low Power,10.3,Card,4.7,83.0,2.56,311.0,0.0,2025-07-29 00:20:00
VMX-10720,VM-103,Chennai,Mall,30-08-2025,22:58:00,P-102,Bisleri Water,Drinks,74.09,81.0,76.0,5.0,5630.84,RP-010,Ravi,Working,13.1,UPI,3.4,87.0,3.41,173.0,0.0,2025-08-30 22:58:00
VMX-10721,VM-237,Delhi,College,19-06-2025,05:15:00,P-107,Colgate Mini,Hygiene,80.03,48.0,29.0,19.0,2320.87,RP-001,Mahesh,Maintenance,20.2,Card,5.0,110.0,2.54,450.0,1.0,2025-06-19 05:15:00
VMX-10722,VM-225,Mumbai,College,01-10-2025,22:01:00,P-104,Red Bull,Drinks,133.67,157.0,154.0,3.0,20585.18,RP-010,Kiran,Maintenance,21.5,UPI,3.2,118.0,3.05,382.0,1.0,2025-10-01 22:01:00
VMX-10723,VM-058,Delhi,Mall,15-05-2025,18:48:00,P-106,Snickers Bar,Snacks,120.24,46.0,42.0,4.0,5050.08,RP-012,Kiran,Maintenance,15.1,Cash,4.4,26.0,2.06,218.0,0.0,2025-05-15 18:48:00
VMX-10724,VM-228,Chennai,Hospital,14-05-2025,10:18:00,P-107,Colgate Mini,Hygiene,135.89,145.0,138.0,7.0,18752.82,RP-009,Rahul,Low Power,18.9,Cash,2.4,36.0,1.1,500.0,1.0,2025-05-14 10:18:00
VMX-10725,VM-157,Mumbai,Hospital,23-03-2025,18:40:00,P-109,Doritos,Snacks,60.78,94.0,85.0,9.0,5166.3,RP-010,Amit,Maintenance,22.1,Cash,2.4,37.0,4.44,181.0,0.0,2025-03-23 18:40:00
VMX-10726,VM-133,Chennai,Metro Station,17-03-2025,18:00:00,P-100,Lays Classic,Snacks,129.13,169.0,160.0,9.0,20660.8,RP-017,Kiran,Low Power,19.3,Cash,4.9,82.0,1.62,486.0,1.0,2025-03-17 18:00:00
VMX-10727,VM-090,Mumbai,Hospital,28-03-2025,16:30:00,P-108,Sprite Bottle,Drinks,62.41,144.0,124.0,20.0,7738.84,RP-001,Ravi,Low Power,13.4,Cash,2.7,35.0,3.43,423.0,0.0,2025-03-28 16:30:00
VMX-10728,VM-269,Bangalore,Mall,07-01-2025,23:54:00,P-103,Oreo Pack,Snacks,59.91,137.0,119.0,18.0,7129.29,RP-012,Mahesh,Low Power,19.4,UPI,3.5,34.0,3.21,323.0,0.0,2025-01-07 23:54:00
VMX-10729,VM-094,Delhi,Mall,06-05-2025,08:51:00,P-100,Lays Classic,Snacks,72.53,153.0,146.0,7.0,10589.38,RP-008,Rajesh,Working,10.6,Card,2.8,35.0,1.37,147.0,0.0,2025-05-06 08:51:00
VMX-10730,VM-298,Mumbai,Hospital,27-04-2025,07:37:00,P-102,Bisleri Water,Drinks,83.16,35.0,29.0,6.0,2411.64,RP-004,Fatima,Working,14.8,Card,2.2,61.0,1.47,92.0,1.0,2025-04-27 07:37:00
VMX-10731,VM-005,Pune,Hospital,07-09-2025,09:36:00,P-103,Oreo Pack,Snacks,23.98,170.0,164.0,6.0,3932.72,RP-004,Rajesh,Maintenance,12.9,Card,3.8,58.0,4.97,178.0,1.0,2025-09-07 09:36:00
VMX-10732,VM-264,Chennai,Office,18-06-2025,16:30:00,P-109,Doritos,Snacks,47.9,181.0,176.0,5.0,8430.4,RP-009,Fatima,Working,15.1,Card,3.7,39.0,3.5,107.0,0.0,2025-06-18 16:30:00
VMX-10733,VM-034,Kolkata,Hospital,11-09-2025,05:11:00,P-107,Colgate Mini,Hygiene,10.91,150.0,135.0,15.0,1472.85,RP-010,Ravi,Low Power,15.1,Card,3.6,23.0,1.77,105.0,0.0,2025-09-11 05:11:00
VMX-10734,VM-154,Pune,Mall,29-09-2025,15:06:00,P-103,Oreo Pack,Snacks,53.01,98.0,88.0,10.0,4664.88,RP-019,Amit,Low Power,12.3,UPI,4.4,109.0,1.63,389.0,0.0,2025-09-29 15:06:00
VMX-10735,VM-118,Chennai,Hospital,02-08-2025,23:17:00,P-105,Dettol Wipe,Hygiene,143.94,141.0,121.0,20.0,17416.74,RP-010,Deepa,Working,14.6,Card,3.1,95.0,2.26,207.0,1.0,2025-08-02 23:17:00
VMX-10736,VM-182,Delhi,Mall,26-07-2025,01:26:00,P-109,Doritos,Snacks,65.1,126.0,126.0,0.0,8202.6,RP-015,Anita,Working,22.3,Cash,2.6,91.0,2.02,476.0,1.0,2025-07-26 01:26:00
VMX-10737,VM-258,Mumbai,Office,13-04-2025,06:39:00,P-100,Lays Classic,Snacks,55.06,117.0,107.0,10.0,5891.42,RP-004,Ravi,Working,12.4,Card,3.4,92.0,3.37,73.0,1.0,2025-04-13 06:39:00
VMX-10738,VM-029,Delhi,Office,12-07-2025,01:06:00,P-107,Colgate Mini,Hygiene,44.98,175.0,157.0,18.0,7061.86,RP-009,Fatima,Low Power,16.6,UPI,2.3,17.0,4.52,87.0,1.0,2025-07-12 01:06:00
VMX-10739,VM-288,Hyderabad,Hospital,03-06-2025,18:12:00,P-106,Snickers Bar,Snacks,125.4,58.0,40.0,18.0,5016.0,RP-008,Deepa,Maintenance,18.2,Card,2.8,67.0,4.27,403.0,0.0,2025-06-03 18:12:00
VMX-10740,VM-110,Bangalore,Office,04-07-2025,14:47:00,P-102,Bisleri Water,Drinks,118.09,37.0,188.0,10.0,3188.43,RP-015,Suresh,Low Power,15.4,Cash,4.0,90.0,2.04,359.0,0.0,2025-07-04 14:47:00
VMX-10741,VM-025,Kolkata,Metro Station,22-07-2025,15:51:00,P-102,Bisleri Water,Drinks,26.69,125.0,112.0,13.0,2989.28,RP-002,Fatima,Low Power,10.2,UPI,5.0,64.0,4.49,217.0,1.0,2025-07-22 15:51:00
VMX-10742,VM-286,Kolkata,College,08-02-2025,18:05:00,P-104,Red Bull,Drinks,90.47,182.0,180.0,2.0,16284.6,RP-018,Amit,Maintenance,22.7,Cash,3.7,59.0,3.44,147.0,0.0,2025-02-08 18:05:00
VMX-10743,VM-038,Bangalore,Metro Station,19-03-2025,20:21:00,P-106,Snickers Bar,Snacks,124.49,139.0,125.0,14.0,15561.25,RP-011,Rajesh,Maintenance,21.7,Card,4.5,55.0,4.56,255.0,1.0,2025-03-19 20:21:00
VMX-10744,VM-219,Bangalore,Office,05-01-2025,07:20:00,P-100,Lays Classic,Snacks,97.32,119.0,119.0,0.0,11581.08,RP-008,Rahul,Maintenance,21.5,Card,3.4,85.0,1.8,470.0,1.0,2025-01-05 07:20:00
VMX-10745,VM-014,Pune,Metro Station,07-06-2025,05:06:00,P-109,Doritos,Snacks,31.36,57.0,51.0,6.0,1599.36,RP-002,Amit,Maintenance,15.2,Cash,3.0,40.0,4.71,386.0,0.0,2025-06-07 05:06:00
VMX-10746,VM-182,Hyderabad,Mall,30-04-2025,06:49:00,P-103,Oreo Pack,Snacks,52.41,128.0,120.0,8.0,6289.2,RP-015,Ravi,Low Power,10.4,Card,4.6,26.0,2.52,278.0,1.0,2025-04-30 06:49:00
VMX-10747,VM-260,Pune,Metro Station,05-03-2025,02:11:00,P-106,Snickers Bar,Snacks,37.81,117.0,99.0,18.0,3743.19,RP-004,Amit,Working,11.8,UPI,4.2,45.0,4.0,212.0,1.0,2025-03-05 02:11:00
VMX-10748,VM-261,Hyderabad,Hospital,04-07-2025,15:16:00,P-103,Oreo Pack,Snacks,39.45,43.0,27.0,16.0,1065.15,RP-001,Mahesh,Low Power,22.1,UPI,4.9,12.0,2.42,208.0,0.0,2025-07-04 15:16:00
VMX-10749,VM-200,Mumbai,College,28-04-2025,22:05:00,P-106,Snickers Bar,Snacks,142.43,186.0,177.0,9.0,25210.11,RP-009,Deepa,Working,12.1,Cash,2.5,1.0,1.51,129.0,0.0,2025-04-28 22:05:00
VMX-10750,VM-151,Chennai,Metro Station,18-04-2025,23:42:00,P-107,Colgate Mini,Hygiene,116.72,35.0,140.0,19.0,1867.52,RP-014,Amit,Low Power,12.6,Card,4.9,94.0,4.24,392.0,0.0,2025-04-18 23:42:00
VMX-10751,VM-157,Mumbai,Office,16-01-2025,15:13:00,P-105,Dettol Wipe,Hygiene,133.07,48.0,43.0,5.0,5722.01,RP-009,Rahul,Low Power,10.4,Cash,3.0,113.0,2.88,426.0,0.0,2025-01-16 15:13:00
VMX-10752,VM-052,Hyderabad,Office,26-09-2025,05:10:00,P-106,Snickers Bar,Snacks,16.51,116.0,97.0,19.0,1601.47,RP-008,Ravi,Low Power,24.8,Cash,4.9,59.0,4.93,488.0,1.0,2025-09-26 05:10:00
VMX-10753,VM-132,Bangalore,Office,09-06-2025,15:30:00,P-102,Bisleri Water,Drinks,129.97,183.0,183.0,0.0,23784.51,RP-018,Deepa,Maintenance,20.0,Cash,3.4,95.0,4.32,342.0,0.0,2025-06-09 15:30:00
VMX-10754,VM-049,Delhi,Hospital,26-04-2025,21:05:00,P-102,Bisleri Water,Drinks,40.7,53.0,49.0,4.0,1994.3,RP-010,Rahul,Working,13.7,UPI,2.6,84.0,2.2,413.0,1.0,2025-04-26 21:05:00
VMX-10755,VM-192,Delhi,Mall,09-03-2025,10:27:00,P-109,Doritos,Snacks,82.79,167.0,159.0,8.0,13163.61,RP-019,Mahesh,Maintenance,23.6,UPI,3.9,101.0,1.79,143.0,0.0,2025-03-09 10:27:00
VMX-10756,VM-293,Mumbai,Hospital,23-07-2025,10:00:00,P-102,Bisleri Water,Drinks,98.85,80.0,75.0,5.0,7413.75,RP-012,Suresh,Maintenance,23.0,Card,3.2,27.0,2.81,184.0,1.0,2025-07-23 10:00:00
VMX-10757,VM-096,Chennai,Office,22-06-2025,10:57:00,P-101,Pepsi Can,Drinks,114.29,187.0,171.0,16.0,19543.59,RP-016,Fatima,Low Power,19.9,Card,4.6,97.0,3.08,82.0,1.0,2025-06-22 10:57:00
VMX-10758,VM-057,Hyderabad,Metro Station,18-02-2025,07:29:00,P-106,Snickers Bar,Snacks,99.92,159.0,155.0,4.0,15487.6,RP-010,Amit,Low Power,14.6,UPI,3.7,120.0,1.33,493.0,0.0,2025-02-18 07:29:00
VMX-10759,VM-009,Bangalore,Office,14-03-2025,21:14:00,P-106,Snickers Bar,Snacks,124.8,150.0,144.0,6.0,17971.2,RP-017,Rahul,Working,18.4,Card,3.6,102.0,3.13,326.0,0.0,2025-03-14 21:14:00
VMX-10760,VM-116,Kolkata,Mall,26-03-2025,20:40:00,P-108,Sprite Bottle,Drinks,33.35,60.0,57.0,3.0,1900.95,RP-018,Rahul,Low Power,22.9,UPI,2.1,51.0,2.19,317.0,1.0,2025-03-26 20:40:00
VMX-10761,VM-285,Delhi,Office,01-01-2025,02:16:00,P-107,Colgate Mini,Hygiene,75.52,54.0,45.0,9.0,3398.4,RP-007,Rahul,Maintenance,24.4,Cash,4.3,17.0,1.58,471.0,0.0,2025-01-01 02:16:00
VMX-10762,VM-100,Bangalore,Office,03-08-2025,12:37:00,P-103,Oreo Pack,Snacks,64.77,60.0,40.0,20.0,2590.8,RP-003,Suresh,Low Power,12.1,UPI,2.4,94.0,3.34,394.0,0.0,2025-08-03 12:37:00
VMX-10763,VM-061,Pune,Office,17-06-2025,00:40:00,P-103,Oreo Pack,Snacks,72.07,192.0,184.0,8.0,13260.88,RP-017,Ravi,Maintenance,19.0,Cash,4.0,38.0,4.29,327.0,1.0,2025-06-17 00:40:00
VMX-10764,VM-131,Hyderabad,Hospital,21-01-2025,12:53:00,P-102,Bisleri Water,Drinks,19.86,107.0,99.0,8.0,1966.14,RP-014,Rahul,Working,23.1,Card,4.6,62.0,4.03,165.0,0.0,2025-01-21 12:53:00
VMX-10765,VM-254,Kolkata,Hospital,05-07-2025,07:55:00,P-101,Pepsi Can,Drinks,149.66,174.0,155.0,19.0,23197.3,RP-014,Mahesh,Maintenance,11.6,UPI,4.5,93.0,2.1,178.0,1.0,2025-07-05 07:55:00
VMX-10766,VM-249,Bangalore,Metro Station,12-02-2025,00:06:00,P-106,Snickers Bar,Snacks,103.38,84.0,73.0,11.0,7546.74,RP-016,Suresh,Maintenance,16.5,UPI,2.3,99.0,4.31,299.0,1.0,2025-02-12 00:06:00
VMX-10767,VM-051,Pune,College,22-01-2025,19:06:00,P-109,Doritos,Snacks,82.66,190.0,178.0,12.0,14713.48,RP-004,Suresh,Low Power,18.7,Card,4.7,53.0,4.26,417.0,0.0,2025-01-22 19:06:00
VMX-10768,VM-222,Delhi,College,25-09-2025,01:25:00,P-105,Dettol Wipe,Hygiene,100.59,132.0,118.0,14.0,11869.62,RP-007,Rahul,Working,10.4,UPI,2.3,117.0,2.65,64.0,1.0,2025-09-25 01:25:00
VMX-10769,VM-229,Kolkata,College,30-06-2025,07:17:00,P-104,Red Bull,Drinks,60.2,194.0,183.0,11.0,11016.6,RP-011,Rajesh,Maintenance,24.9,UPI,4.3,20.0,1.84,444.0,1.0,2025-06-30 07:17:00
VMX-10770,VM-276,Delhi,Mall,15-02-2025,10:22:00,P-106,Snickers Bar,Snacks,115.46,64.0,49.0,15.0,5657.54,RP-011,Anita,Working,23.7,Cash,3.9,40.0,3.49,377.0,0.0,2025-02-15 10:22:00
VMX-10771,VM-186,Kolkata,Mall,22-06-2025,14:57:00,P-106,Snickers Bar,Snacks,38.3,144.0,133.0,11.0,5093.9,RP-006,Deepa,Working,11.7,Card,2.9,64.0,3.8,336.0,1.0,2025-06-22 14:57:00
VMX-10772,VM-047,Delhi,Metro Station,08-02-2025,06:05:00,P-108,Sprite Bottle,Drinks,85.36,121.0,102.0,19.0,8706.72,RP-013,Anita,Working,20.7,Card,3.1,17.0,4.69,103.0,1.0,2025-02-08 06:05:00
VMX-10773,VM-021,Bangalore,Metro Station,26-04-2025,14:52:00,P-109,Doritos,Snacks,89.81,41.0,31.0,10.0,2784.11,RP-005,Anita,Working,17.4,Card,4.9,31.0,4.5,275.0,0.0,2025-04-26 14:52:00
VMX-10774,VM-285,Pune,Metro Station,05-09-2025,14:26:00,P-102,Bisleri Water,Drinks,11.74,82.0,82.0,0.0,962.68,RP-007,Kiran,Working,22.7,Card,3.2,73.0,4.55,248.0,1.0,2025-09-05 14:26:00
VMX-10775,VM-121,Chennai,Metro Station,09-07-2025,11:57:00,P-105,Dettol Wipe,Hygiene,122.48,87.0,74.0,13.0,9063.52,RP-012,Ravi,Maintenance,12.0,Card,2.7,68.0,3.32,99.0,1.0,2025-07-09 11:57:00
VMX-10776,VM-284,Kolkata,Mall,28-06-2025,22:44:00,P-108,Sprite Bottle,Drinks,53.89,174.0,167.0,7.0,8999.63,RP-015,Anita,Maintenance,22.5,UPI,3.9,63.0,3.36,83.0,0.0,2025-06-28 22:44:00
VMX-10777,VM-076,Hyderabad,Office,30-01-2025,11:30:00,P-100,Lays Classic,Snacks,88.39,163.0,143.0,20.0,12639.77,RP-003,Anita,Maintenance,13.8,Card,2.1,76.0,2.96,410.0,0.0,2025-01-30 11:30:00
VMX-10778,VM-156,Chennai,Mall,03-10-2025,22:43:00,P-106,Snickers Bar,Snacks,40.13,135.0,126.0,9.0,5056.38,RP-019,Fatima,Low Power,12.2,Card,4.9,75.0,2.26,53.0,0.0,2025-10-03 22:43:00
VMX-10779,VM-083,Delhi,Mall,02-02-2025,16:26:00,P-105,Dettol Wipe,Hygiene,92.24,38.0,19.0,19.0,1752.56,RP-008,Rahul,Working,22.5,Cash,3.9,63.0,3.91,219.0,0.0,2025-02-02 16:26:00
VMX-10780,VM-243,Bangalore,Office,28-07-2025,12:44:00,P-101,Pepsi Can,Drinks,142.46,166.0,154.0,12.0,21938.84,RP-006,Ravi,Low Power,15.3,Card,3.3,32.0,3.0,144.0,1.0,2025-07-28 12:44:00
VMX-10781,VM-049,Pune,Office,11-02-2025,10:28:00,P-106,Snickers Bar,Snacks,38.09,109.0,89.0,20.0,3390.01,RP-001,Rahul,Working,24.7,Cash,4.0,12.0,1.67,320.0,0.0,2025-02-11 10:28:00
VMX-10782,VM-097,Delhi,Metro Station,11-07-2025,02:11:00,P-100,Lays Classic,Snacks,55.76,98.0,98.0,0.0,5464.48,RP-016,Amit,Maintenance,13.3,UPI,2.3,87.0,4.65,357.0,1.0,2025-07-11 02:11:00
VMX-10783,VM-228,Hyderabad,Metro Station,17-09-2025,04:52:00,P-109,Doritos,Snacks,34.77,132.0,127.0,5.0,4415.79,RP-002,Fatima,Working,22.1,UPI,4.8,13.0,2.4,142.0,0.0,2025-09-17 04:52:00
VMX-10784,VM-281,Kolkata,Hospital,22-06-2025,14:59:00,P-101,Pepsi Can,Drinks,79.67,174.0,170.0,4.0,13543.9,RP-015,Ravi,Maintenance,18.3,UPI,2.7,18.0,1.96,468.0,1.0,2025-06-22 14:59:00
VMX-10785,VM-051,Kolkata,Metro Station,31-01-2025,15:51:00,P-103,Oreo Pack,Snacks,121.17,30.0,19.0,11.0,2302.23,RP-003,Deepa,Maintenance,18.4,Card,3.6,50.0,4.03,379.0,0.0,2025-01-31 15:51:00
VMX-10786,VM-207,Mumbai,Hospital,30-05-2025,20:27:00,P-104,Unknown,Drinks,54.84,134.0,130.0,6.0,7019.52,RP-003,Rajesh,Working,17.4,UPI,3.7,78.0,2.56,304.0,1.0,2025-05-30 20:27:00
VMX-10787,VM-293,Pune,Mall,15-02-2025,09:57:00,P-100,Lays Classic,Snacks,83.86,30.0,24.0,6.0,2012.64,RP-011,Mahesh,Maintenance,10.4,UPI,3.2,45.0,4.86,76.0,1.0,2025-02-15 09:57:00
VMX-10788,VM-023,Bangalore,College,09-07-2025,21:44:00,P-108,Sprite Bottle,Drinks,83.36,65.0,49.0,16.0,4084.64,RP-015,Amit,Working,20.7,Cash,4.1,63.0,1.83,377.0,0.0,2025-07-09 21:44:00
VMX-10789,VM-124,Delhi,Office,29-05-2025,00:57:00,P-100,Lays Classic,Snacks,139.09,72.0,69.0,3.0,9597.21,RP-006,Kiran,Working,15.6,UPI,2.1,18.0,3.4,368.0,1.0,2025-05-29 00:57:00
VMX-10790,VM-140,Mumbai,College,15-04-2025,20:47:00,P-106,Snickers Bar,Snacks,105.26,180.0,171.0,9.0,17999.46,RP-014,Kiran,Low Power,14.2,Cash,4.5,62.0,2.01,55.0,1.0,2025-04-15 20:47:00
VMX-10791,VM-059,Hyderabad,Mall,25-04-2025,02:40:00,P-100,Lays Classic,Snacks,107.44,134.0,130.0,4.0,13967.2,RP-016,Ravi,Working,18.1,Cash,4.8,32.0,4.82,416.0,1.0,2025-04-25 02:40:00
VMX-10792,VM-062,Mumbai,Mall,14-05-2025,03:48:00,P-104,Red Bull,Drinks,85.08,92.0,74.0,18.0,6295.92,RP-003,Fatima,Low Power,13.0,Card,5.0,60.0,2.92,107.0,0.0,2025-05-14 03:48:00
VMX-10793,VM-190,Mumbai,Mall,04-02-2025,07:27:00,P-100,Lays Classic,Snacks,126.63,67.0,65.0,2.0,8230.95,RP-015,Rahul,Working,19.9,Card,4.3,24.0,4.07,421.0,1.0,2025-02-04 07:27:00
VMX-10794,VM-237,Bangalore,College,09-05-2025,05:22:00,P-100,Lays Classic,Snacks,89.63,59.0,0.0,10.0,4391.87,RP-013,Kiran,Working,24.2,Card,2.2,23.0,3.51,221.0,1.0,2025-05-09 05:22:00
VMX-10795,VM-083,Bangalore,Metro Station,28-09-2025,09:35:00,P-100,Lays Classic,Snacks,131.99,37.0,30.0,7.0,3959.7,RP-011,Mahesh,Working,20.3,UPI,3.6,2.0,3.47,136.0,1.0,2025-09-28 09:35:00
VMX-10796,VM-289,Hyderabad,Hospital,04-01-2025,12:00:00,P-105,Dettol Wipe,Hygiene,15.38,46.0,39.0,7.0,599.82,RP-019,Ravi,Working,21.4,Cash,3.7,9.0,1.08,471.0,1.0,2025-01-04 12:00:00
VMX-10797,VM-122,Delhi,Hospital,18-07-2025,14:58:00,P-109,Doritos,Snacks,100.27,92.0,73.0,19.0,7319.71,RP-020,Anita,Low Power,24.7,Card,3.4,117.0,4.59,282.0,1.0,2025-07-18 14:58:00
VMX-10798,VM-083,Chennai,College,18-07-2025,08:56:00,P-103,Oreo Pack,Snacks,30.22,183.0,178.0,5.0,5379.16,RP-014,Anita,Working,10.6,UPI,4.1,69.0,4.41,255.0,0.0,2025-07-18 08:56:00
VMX-10799,VM-232,Mumbai,Hospital,02-08-2025,14:46:00,P-105,Dettol Wipe,Hygiene,39.13,123.0,110.0,13.0,4304.3,RP-015,Deepa,Low Power,14.9,UPI,2.4,67.0,1.82,161.0,0.0,2025-08-02 14:46:00
VMX-10800,VM-210,Chennai,Office,06-07-2025,14:35:00,P-109,Doritos,Snacks,37.24,188.0,169.0,19.0,6293.56,RP-007,Kiran,Working,17.1,Card,4.0,38.0,4.62,446.0,1.0,2025-07-06 14:35:00
VMX-10801,VM-265,Mumbai,Mall,22-03-2025,21:24:00,P-100,Lays Classic,Snacks,37.92,106.0,89.0,17.0,3374.88,RP-015,Mahesh,Maintenance,13.1,Card,4.0,34.0,4.93,398.0,0.0,2025-03-22 21:24:00
VMX-10802,VM-126,Kolkata,Mall,30-07-2025,10:29:00,P-106,Snickers Bar,Snacks,90.51,70.0,66.0,4.0,5973.66,RP-016,Deepa,Maintenance,24.0,Card,3.6,80.0,4.5,396.0,0.0,2025-07-30 10:29:00
VMX-10803,VM-183,Bangalore,Mall,19-06-2025,02:20:00,P-101,Pepsi Can,Drinks,22.01,22.0,21.0,1.0,462.21,RP-007,Anita,Working,15.4,UPI,3.8,106.0,2.79,223.0,0.0,2025-06-19 02:20:00
VMX-10804,VM-061,Pune,Metro Station,19-03-2025,05:26:00,P-104,Red Bull,Drinks,52.45,163.0,158.0,5.0,8287.1,RP-014,Amit,Maintenance,18.3,UPI,4.1,35.0,3.76,177.0,0.0,2025-03-19 05:26:00
VMX-10805,VM-195,Mumbai,Mall,11-03-2025,12:30:00,P-102,Bisleri Water,Drinks,137.29,44.0,43.0,1.0,5903.47,RP-001,Rahul,Maintenance,24.8,UPI,4.8,74.0,3.29,279.0,0.0,2025-03-11 12:30:00
VMX-10806,VM-190,Hyderabad,Mall,23-06-2025,02:56:00,P-107,Colgate Mini,Hygiene,142.52,165.0,154.0,11.0,21948.08,RP-005,Rahul,Low Power,20.2,Cash,2.3,119.0,4.16,392.0,0.0,2025-06-23 02:56:00
VMX-10807,VM-214,Bangalore,Office,11-09-2025,00:39:00,P-105,Dettol Wipe,Hygiene,50.93,41.0,30.0,11.0,1527.9,RP-009,Suresh,Maintenance,14.2,Card,4.7,3.0,2.96,135.0,0.0,2025-09-11 00:39:00
VMX-10808,VM-140,Delhi,Hospital,10-08-2025,10:02:00,P-103,Oreo Pack,Snacks,108.07,87.0,73.0,14.0,7889.11,RP-003,Deepa,Maintenance,10.5,Card,2.0,73.0,1.08,244.0,0.0,2025-08-10 10:02:00
VMX-10809,VM-263,Kolkata,Hospital,12-07-2025,10:23:00,P-107,Colgate Mini,Hygiene,63.2,29.0,21.0,8.0,1327.2,RP-014,Deepa,Working,24.1,Card,2.8,24.0,2.96,186.0,0.0,2025-07-12 10:23:00
VMX-10810,VM-066,Kolkata,College,18-09-2025,03:01:00,P-107,Colgate Mini,Hygiene,138.63,41.0,31.0,10.0,4297.53,RP-008,Ravi,Working,15.6,Cash,3.7,30.0,4.12,492.0,0.0,2025-09-18 03:01:00
VMX-10811,VM-236,Delhi,Office,06-02-2025,04:37:00,P-100,Lays Classic,Snacks,111.23,107.0,88.0,19.0,9788.24,RP-004,Rahul,Working,10.8,Cash,2.6,95.0,4.71,145.0,0.0,2025-02-06 04:37:00
VMX-10812,VM-041,Mumbai,Office,18-04-2025,01:45:00,P-101,Pepsi Can,Drinks,10.54,195.0,188.0,7.0,1981.52,RP-017,Suresh,Low Power,22.3,Card,5.0,77.0,3.83,290.0,1.0,2025-04-18 01:45:00
VMX-10813,VM-041,Bangalore,Mall,05-04-2025,16:00:00,P-109,Doritos,Snacks,131.1,35.0,21.0,14.0,2753.1,RP-009,Amit,Maintenance,18.6,Cash,4.1,89.0,4.05,146.0,0.0,2025-04-05 16:00:00
VMX-10814,VM-152,Pune,Hospital,22-07-2025,20:53:00,P-105,Dettol Wipe,Hygiene,115.88,78.0,73.0,5.0,8459.24,RP-017,Anita,Working,16.4,UPI,4.2,67.0,1.03,399.0,1.0,2025-07-22 20:53:00
VMX-10815,VM-031,Pune,Hospital,02-02-2025,15:22:00,P-104,Red Bull,Drinks,115.6,36.0,35.0,1.0,4046.0,RP-003,Rajesh,Working,24.7,Card,2.3,75.0,4.09,235.0,0.0,2025-02-02 15:22:00
VMX-10816,VM-246,Chennai,Hospital,03-07-2025,23:51:00,P-109,Doritos,Snacks,46.74,101.0,87.0,14.0,4066.38,RP-010,Rajesh,Low Power,18.2,Card,2.6,75.0,1.68,403.0,1.0,2025-07-03 23:51:00
VMX-10817,VM-238,Mumbai,Mall,26-07-2025,14:55:00,P-106,Snickers Bar,Snacks,75.09,138.0,128.0,10.0,9611.52,RP-005,Kiran,Low Power,24.2,Cash,4.4,48.0,4.96,373.0,0.0,2025-07-26 14:55:00
VMX-10818,VM-112,Hyderabad,College,19-03-2025,18:11:00,P-106,Snickers Bar,Snacks,61.2,131.0,31.0,5.0,7711.2,RP-013,Rajesh,Working,14.1,Cash,2.1,50.0,1.63,474.0,1.0,2025-03-19 18:11:00
VMX-10819,VM-082,Mumbai,College,10-08-2025,13:54:00,P-103,Oreo Pack,Snacks,36.59,175.0,160.0,15.0,5854.4,RP-012,Ravi,Working,24.3,Card,3.4,37.0,1.57,315.0,1.0,2025-08-10 13:54:00
VMX-10820,VM-160,Delhi,Metro Station,23-03-2025,10:40:00,P-103,Oreo Pack,Snacks,68.29,23.0,14.0,9.0,956.06,RP-014,Rahul,Working,19.0,Card,2.8,92.0,2.49,402.0,0.0,2025-03-23 10:40:00
VMX-10821,VM-214,Bangalore,Mall,10-01-2025,14:23:00,P-105,Dettol Wipe,Hygiene,89.15,141.0,139.0,2.0,12391.85,RP-011,Suresh,Low Power,19.5,UPI,4.4,71.0,2.36,456.0,1.0,2025-01-10 14:23:00
VMX-10822,VM-122,Kolkata,Mall,28-04-2025,22:37:00,P-103,Oreo Pack,Snacks,136.26,102.0,82.0,20.0,11173.32,RP-016,Rahul,Low Power,23.4,UPI,3.5,12.0,2.54,125.0,1.0,2025-04-28 22:37:00
VMX-10823,VM-200,Kolkata,Mall,17-05-2025,02:28:00,P-101,Pepsi Can,Drinks,84.09,138.0,119.0,19.0,10006.71,RP-009,Amit,Low Power,22.7,Cash,3.4,28.0,3.53,217.0,1.0,2025-05-17 02:28:00
VMX-10824,VM-275,Bangalore,Mall,13-06-2025,15:20:00,P-109,Doritos,Snacks,77.56,57.0,49.0,8.0,3800.44,RP-020,Rahul,Working,14.4,Cash,4.2,24.0,3.09,308.0,1.0,2025-06-13 15:20:00
VMX-10825,VM-074,Chennai,College,02-06-2025,08:13:00,P-103,Oreo Pack,Snacks,120.7,128.0,128.0,0.0,15449.6,RP-001,Kiran,Working,15.5,Cash,3.3,48.0,3.22,354.0,1.0,2025-06-02 08:13:00
VMX-10826,VM-233,Chennai,Mall,22-05-2025,06:45:00,P-105,Dettol Wipe,Hygiene,25.08,90.0,76.0,14.0,1906.08,RP-019,Amit,Low Power,24.3,Cash,2.2,41.0,3.21,238.0,0.0,2025-05-22 06:45:00
VMX-10827,VM-166,Mumbai,Mall,14-01-2025,20:27:00,P-105,Dettol Wipe,Hygiene,126.45,116.0,99.0,17.0,12518.55,RP-011,Rahul,Working,19.7,UPI,3.7,72.0,1.16,311.0,0.0,2025-01-14 20:27:00
VMX-10828,VM-084,Delhi,Mall,19-03-2025,03:33:00,P-102,Bisleri Water,Drinks,79.53,37.0,33.0,4.0,2624.49,RP-003,Deepa,Low Power,15.1,UPI,3.0,8.0,2.97,329.0,0.0,2025-03-19 03:33:00
VMX-10829,VM-107,Mumbai,Mall,08-10-2025,02:52:00,P-108,Sprite Bottle,Drinks,68.29,121.0,117.0,4.0,7989.93,RP-004,Anita,Working,13.6,Card,4.1,3.0,1.21,481.0,0.0,2025-10-08 02:52:00
VMX-10830,VM-164,Chennai,Hospital,20-03-2025,04:32:00,P-107,Colgate Mini,Hygiene,15.94,76.0,69.0,7.0,1099.86,RP-013,Mahesh,Maintenance,21.5,UPI,2.1,91.0,3.79,331.0,0.0,2025-03-20 04:32:00
VMX-10831,VM-004,Chennai,College,28-04-2025,18:31:00,P-100,Lays Classic,Snacks,38.02,29.0,23.0,6.0,874.46,RP-019,Deepa,Maintenance,23.5,Cash,3.2,19.0,3.14,371.0,1.0,2025-04-28 18:31:00
VMX-10832,VM-132,Chennai,Mall,23-03-2025,06:48:00,P-104,Red Bull,Drinks,87.88,150.0,138.0,12.0,12127.44,RP-011,Anita,Low Power,11.8,UPI,3.4,57.0,3.41,383.0,1.0,2025-03-23 06:48:00
VMX-10833,VM-106,Bangalore,Metro Station,24-02-2025,23:59:00,P-103,Oreo Pack,Snacks,35.88,30.0,18.0,12.0,645.84,RP-010,Suresh,Maintenance,22.3,UPI,3.4,82.0,3.5,340.0,1.0,2025-02-24 23:59:00
VMX-10834,VM-171,Bangalore,Hospital,21-04-2025,05:55:00,P-103,Oreo Pack,Snacks,81.55,99.0,99.0,0.0,8073.45,RP-013,Deepa,Low Power,24.8,Card,4.3,117.0,2.97,337.0,1.0,2025-04-21 05:55:00
VMX-10835,VM-006,Chennai,College,16-01-2025,19:03:00,P-103,Oreo Pack,Snacks,20.87,47.0,47.0,0.0,980.89,RP-010,Rajesh,Low Power,20.9,Cash,2.3,47.0,1.86,147.0,1.0,2025-01-16 19:03:00
VMX-10836,VM-018,Hyderabad,Office,12-01-2025,09:49:00,P-105,Dettol Wipe,Hygiene,20.65,126.0,106.0,20.0,2188.9,RP-005,Anita,Low Power,24.0,Cash,2.4,81.0,3.98,399.0,0.0,2025-01-12 09:49:00
VMX-10837,VM-297,Delhi,Metro Station,01-05-2025,14:55:00,P-107,Colgate Mini,Hygiene,34.44,48.0,46.0,2.0,1584.24,RP-009,Anita,Working,20.5,UPI,2.2,88.0,1.61,83.0,1.0,2025-05-01 14:55:00
VMX-10838,VM-007,Pune,College,27-08-2025,13:11:00,P-106,Snickers Bar,Snacks,14.19,147.0,134.0,13.0,1901.46,RP-003,Anita,Maintenance,14.2,UPI,2.6,34.0,1.1,189.0,0.0,2025-08-27 13:11:00
VMX-10839,VM-223,Pune,Hospital,23-01-2025,18:53:00,P-103,Oreo Pack,Snacks,106.55,20.0,0.0,20.0,0.0,RP-008,Mahesh,Low Power,15.5,Card,3.1,105.0,2.89,133.0,1.0,2025-01-23 18:53:00
VMX-10840,VM-178,Mumbai,Mall,14-06-2025,23:40:00,P-105,Dettol Wipe,Hygiene,111.67,158.0,154.0,4.0,17197.18,RP-019,Kiran,Low Power,17.0,UPI,4.3,18.0,4.26,434.0,1.0,2025-06-14 23:40:00
VMX-10841,VM-184,Delhi,Hospital,10-05-2025,04:21:00,P-108,Sprite Bottle,Drinks,67.1,130.0,128.0,2.0,8588.8,RP-015,Fatima,Maintenance,12.5,Cash,3.0,117.0,4.44,370.0,0.0,2025-05-10 04:21:00
VMX-10842,VM-203,Hyderabad,Hospital,13-03-2025,06:52:00,P-109,Doritos,Snacks,57.83,181.0,176.0,5.0,10178.08,RP-004,Fatima,Maintenance,10.6,Cash,3.7,32.0,4.74,390.0,0.0,2025-03-13 06:52:00
VMX-10843,VM-192,Pune,Hospital,01-03-2025,10:46:00,P-103,Oreo Pack,Snacks,105.76,105.0,90.0,15.0,9518.4,RP-017,Kiran,Working,18.7,Card,3.2,96.0,4.95,165.0,1.0,2025-03-01 10:46:00
VMX-10844,VM-074,Hyderabad,Office,16-09-2025,03:31:00,P-102,Bisleri Water,Drinks,126.81,68.0,68.0,0.0,8623.08,RP-008,Kiran,Low Power,22.4,Card,3.9,104.0,1.76,58.0,0.0,2025-09-16 03:31:00
VMX-10845,VM-061,Mumbai,Office,04-02-2025,08:28:00,P-104,Red Bull,Drinks,26.95,67.0,65.0,2.0,1751.75,RP-013,Mahesh,Maintenance,19.0,UPI,3.2,26.0,2.22,367.0,1.0,2025-02-04 08:28:00
VMX-10846,VM-180,Hyderabad,Office,17-01-2025,15:20:00,P-109,Doritos,Snacks,93.07,193.0,178.0,15.0,16566.46,RP-016,Kiran,Maintenance,21.5,UPI,4.1,79.0,4.52,400.0,1.0,2025-01-17 15:20:00
VMX-10847,VM-048,Hyderabad,Mall,01-09-2025,08:34:00,P-100,Lays Classic,Snacks,63.2,144.0,142.0,2.0,8974.4,RP-004,Rajesh,Low Power,21.2,Cash,3.8,60.0,1.14,208.0,1.0,2025-09-01 08:34:00
VMX-10848,VM-015,Pune,Hospital,07-03-2025,18:55:00,P-103,Oreo Pack,Snacks,95.92,44.0,44.0,0.0,4220.48,RP-003,Fatima,Working,16.9,Card,3.7,102.0,4.7,384.0,0.0,2025-03-07 18:55:00
VMX-10849,VM-232,Chennai,Mall,09-09-2025,05:57:00,P-104,Red Bull,Drinks,91.99,198.0,182.0,16.0,16742.18,RP-002,Anita,Maintenance,15.0,Cash,4.1,107.0,1.31,296.0,1.0,2025-09-09 05:57:00
VMX-10850,VM-094,Bangalore,Office,12-07-2025,01:19:00,P-103,Oreo Pack,Snacks,10.8,187.0,182.0,5.0,1965.6,RP-019,Rajesh,Working,20.7,Card,4.8,14.0,1.41,121.0,0.0,2025-07-12 01:19:00
VMX-10851,VM-011,Delhi,Metro Station,07-07-2025,22:27:00,P-109,Doritos,Snacks,88.79,132.0,117.0,15.0,10388.43,RP-012,Fatima,Working,16.3,Cash,2.8,71.0,3.81,84.0,0.0,2025-07-07 22:27:00
VMX-10852,VM-125,Bangalore,College,01-09-2025,12:32:00,P-101,Pepsi Can,Drinks,46.79,190.0,179.0,11.0,8375.41,RP-001,Amit,Working,18.6,Card,2.6,84.0,4.99,241.0,1.0,2025-09-01 12:32:00
VMX-10853,VM-021,Bangalore,Mall,31-07-2025,03:35:00,P-107,Colgate Mini,Hygiene,19.35,188.0,183.0,5.0,3541.05,RP-005,Anita,Working,21.2,UPI,2.0,7.0,3.04,56.0,0.0,2025-07-31 03:35:00
VMX-10854,VM-071,Chennai,Mall,05-01-2025,09:56:00,P-108,Sprite Bottle,Drinks,103.23,169.0,153.0,16.0,15794.19,RP-016,Suresh,Working,20.0,UPI,3.4,12.0,1.69,333.0,0.0,2025-01-05 09:56:00
VMX-10855,VM-038,Pune,Mall,04-02-2025,15:32:00,P-102,Bisleri Water,Drinks,103.39,150.0,146.0,4.0,15094.94,RP-008,Kiran,Maintenance,15.4,Cash,4.5,52.0,1.24,271.0,0.0,2025-02-04 15:32:00
VMX-10856,VM-116,Delhi,Mall,11-07-2025,12:28:00,P-105,Dettol Wipe,Hygiene,119.29,27.0,21.0,6.0,2505.09,RP-016,Rahul,Maintenance,23.3,Card,4.6,81.0,1.63,356.0,1.0,2025-07-11 12:28:00
VMX-10857,VM-288,Hyderabad,Mall,16-01-2025,13:04:00,P-107,Colgate Mini,Hygiene,118.23,130.0,111.0,19.0,13123.53,RP-002,Deepa,Low Power,15.9,UPI,4.0,117.0,2.37,478.0,1.0,2025-01-16 13:04:00
VMX-10858,VM-287,Delhi,Metro Station,07-09-2025,12:48:00,P-104,Red Bull,Drinks,129.75,140.0,124.0,16.0,16089.0,RP-020,Rahul,Working,17.0,Cash,4.1,43.0,3.13,365.0,0.0,2025-09-07 12:48:00
VMX-10859,VM-166,Bangalore,Metro Station,20-09-2025,07:20:00,P-104,Red Bull,Drinks,98.08,89.0,80.0,9.0,7846.4,RP-007,Deepa,Low Power,12.9,UPI,3.6,52.0,2.11,356.0,1.0,2025-09-20 07:20:00
VMX-10860,VM-186,Delhi,Metro Station,08-04-2025,21:43:00,P-103,Oreo Pack,Snacks,117.56,55.0,46.0,9.0,5407.76,RP-018,Deepa,Working,22.0,Card,3.6,15.0,3.9,498.0,1.0,2025-04-08 21:43:00
VMX-10861,VM-255,Chennai,Mall,04-04-2025,20:51:00,P-103,Oreo Pack,Snacks,38.8,182.0,172.0,10.0,6673.6,RP-013,Rajesh,Maintenance,14.1,Card,3.4,43.0,1.59,360.0,0.0,2025-04-04 20:51:00
VMX-10862,VM-097,Kolkata,Office,21-07-2025,00:04:00,P-104,Red Bull,Drinks,27.42,116.0,99.0,17.0,2714.58,RP-016,Rajesh,Maintenance,18.8,UPI,3.5,53.0,1.8,76.0,1.0,2025-07-21 00:04:00
VMX-10863,VM-072,Bangalore,College,18-07-2025,10:07:00,P-107,Colgate Mini,Hygiene,93.34,141.0,128.0,13.0,11947.52,RP-012,Mahesh,Working,22.7,UPI,2.3,68.0,2.07,451.0,0.0,2025-07-18 10:07:00
VMX-10864,VM-173,Pune,Office,31-01-2025,00:07:00,P-106,Snickers Bar,Snacks,38.68,189.0,171.0,18.0,6614.28,RP-010,Kiran,Working,13.5,Card,3.8,96.0,2.07,332.0,1.0,2025-01-31 00:07:00
VMX-10865,VM-197,Bangalore,Metro Station,12-06-2025,07:10:00,P-103,Oreo Pack,Snacks,31.24,161.0,153.0,18.0,4467.32,RP-020,Mahesh,Working,11.4,Card,3.8,34.0,4.24,113.0,0.0,2025-06-12 07:10:00
VMX-10866,VM-089,Bangalore,Office,24-08-2025,19:10:00,P-103,Oreo Pack,Snacks,128.35,76.0,69.0,7.0,8856.15,RP-004,Mahesh,Working,20.1,UPI,3.7,76.0,4.4,278.0,0.0,2025-08-24 19:10:00
VMX-10867,VM-197,Kolkata,Metro Station,16-08-2025,14:09:00,P-103,Oreo Pack,Snacks,24.05,40.0,27.0,13.0,649.35,RP-013,Mahesh,Maintenance,21.5,Cash,4.6,62.0,2.75,498.0,1.0,2025-08-16 14:09:00
VMX-10868,VM-106,Chennai,Mall,18-07-2025,14:38:00,P-105,Dettol Wipe,Hygiene,12.9,149.0,130.0,19.0,1677.0,RP-003,Rahul,Maintenance,20.2,Cash,4.4,26.0,1.87,230.0,1.0,2025-07-18 14:38:00
VMX-10869,VM-241,Hyderabad,Metro Station,14-07-2025,19:56:00,P-104,Red Bull,Drinks,44.83,94.0,87.0,7.0,3900.21,RP-008,Ravi,Low Power,20.7,Cash,3.2,44.0,2.44,60.0,1.0,2025-07-14 19:56:00
VMX-10870,VM-118,Chennai,Office,12-08-2025,08:22:00,P-106,Snickers Bar,Snacks,111.38,128.0,126.0,2.0,14033.88,RP-009,Rajesh,Working,12.5,Card,3.9,76.0,3.12,150.0,0.0,2025-08-12 08:22:00
VMX-10871,VM-284,Hyderabad,Office,23-03-2025,02:39:00,P-106,Snickers Bar,Snacks,61.04,78.0,76.0,2.0,4639.04,RP-003,Fatima,Low Power,16.8,UPI,2.4,55.0,2.11,145.0,0.0,2025-03-23 02:39:00
VMX-10872,VM-027,Pune,Mall,29-04-2025,02:39:00,P-106,Snickers Bar,Snacks,53.62,153.0,151.0,2.0,8096.62,RP-010,Fatima,Low Power,24.1,Cash,2.7,103.0,4.85,358.0,0.0,2025-04-29 02:39:00
VMX-10873,VM-237,Pune,Office,01-10-2025,03:49:00,P-101,Pepsi Can,Drinks,118.2,88.0,83.0,5.0,9810.6,RP-006,Amit,Maintenance,24.0,Cash,4.4,41.0,4.42,442.0,1.0,2025-10-01 03:49:00
VMX-10874,VM-086,Hyderabad,Hospital,30-01-2025,12:08:00,P-108,Sprite Bottle,Drinks,123.86,148.0,132.0,16.0,16349.52,RP-005,Amit,Working,22.9,UPI,3.7,35.0,2.85,282.0,0.0,2025-01-30 12:08:00
VMX-10875,VM-070,Hyderabad,Office,22-01-2025,02:24:00,P-101,Pepsi Can,Drinks,109.88,61.0,41.0,20.0,4505.08,RP-015,Fatima,Low Power,20.2,UPI,3.7,92.0,2.62,318.0,1.0,2025-01-22 02:24:00
VMX-10876,VM-209,Bangalore,Metro Station,27-07-2025,08:33:00,P-108,Sprite Bottle,Drinks,59.55,175.0,157.0,18.0,9349.35,RP-016,Amit,Working,13.1,Card,5.0,107.0,2.19,359.0,1.0,2025-07-27 08:33:00
VMX-10877,VM-009,Bangalore,Hospital,11-06-2025,15:12:00,P-106,Snickers Bar,Snacks,62.63,115.0,115.0,0.0,7202.45,RP-005,Rajesh,Maintenance,21.9,Card,2.4,101.0,2.21,175.0,0.0,2025-06-11 15:12:00
VMX-10878,VM-239,Chennai,Mall,07-09-2025,12:29:00,P-100,Lays Classic,Snacks,136.07,132.0,124.0,8.0,16872.68,RP-015,Amit,Low Power,24.4,Cash,4.8,114.0,3.56,101.0,1.0,2025-09-07 12:29:00
VMX-10879,VM-151,Chennai,Metro Station,10-08-2025,02:38:00,P-105,Dettol Wipe,Hygiene,17.44,139.0,127.0,12.0,2214.88,RP-018,Rajesh,Working,24.0,UPI,2.2,42.0,1.77,309.0,0.0,2025-08-10 02:38:00
VMX-10880,VM-261,Bangalore,Metro Station,19-05-2025,01:01:00,P-100,Lays Classic,Snacks,148.89,57.0,40.0,17.0,5955.6,RP-012,Mahesh,Low Power,16.1,Card,3.4,79.0,2.31,238.0,0.0,2025-05-19 01:01:00
VMX-10881,VM-281,Delhi,Metro Station,10-08-2025,16:02:00,P-108,Sprite Bottle,Drinks,91.99,132.0,117.0,15.0,10762.83,RP-017,Ravi,Working,24.0,UPI,3.0,91.0,2.76,419.0,1.0,2025-08-10 16:02:00
VMX-10882,VM-113,Hyderabad,College,16-07-2025,08:25:00,P-102,Bisleri Water,Drinks,29.91,70.0,68.0,2.0,2033.88,RP-010,Mahesh,Working,12.9,Card,2.6,102.0,4.3,127.0,1.0,2025-07-16 08:25:00
VMX-10883,VM-020,Chennai,Hospital,03-02-2025,05:54:00,P-108,Sprite Bottle,Drinks,89.55,73.0,73.0,0.0,6537.15,RP-003,Suresh,Low Power,23.7,Cash,4.8,63.0,1.46,392.0,1.0,2025-02-03 05:54:00
VMX-10884,VM-281,Kolkata,Office,13-05-2025,18:35:00,P-105,Dettol Wipe,Hygiene,96.35,115.0,100.0,15.0,9635.0,RP-011,Fatima,Working,20.0,Card,3.8,87.0,2.12,354.0,0.0,2025-05-13 18:35:00
VMX-10885,VM-154,Mumbai,Hospital,20-05-2025,10:32:00,P-103,Oreo Pack,Snacks,124.09,131.0,116.0,15.0,14394.44,RP-002,Rahul,Low Power,22.0,UPI,2.3,18.0,3.22,482.0,0.0,2025-05-20 10:32:00
VMX-10886,VM-212,Delhi,Hospital,05-10-2025,16:23:00,P-103,Oreo Pack,Snacks,75.01,59.0,56.0,3.0,4200.56,RP-014,Rahul,Low Power,14.5,Cash,2.5,61.0,4.79,389.0,0.0,2025-10-05 16:23:00
VMX-10887,VM-213,Mumbai,College,27-07-2025,13:09:00,P-105,Dettol Wipe,Hygiene,139.66,34.0,21.0,13.0,2932.86,RP-011,Deepa,Working,14.6,UPI,4.6,62.0,4.71,252.0,0.0,2025-07-27 13:09:00
VMX-10888,VM-085,Chennai,Mall,05-05-2025,19:51:00,P-106,Snickers Bar,Snacks,70.21,80.0,71.0,9.0,4984.91,RP-020,Deepa,Maintenance,15.7,Cash,2.3,10.0,4.18,54.0,0.0,2025-05-05 19:51:00
VMX-10889,VM-242,Bangalore,College,19-03-2025,01:00:00,P-108,Sprite Bottle,Drinks,70,43.0,23.0,20.0,1610.0,RP-005,Anita,Low Power,20.2,Card,3.1,73.0,1.35,134.0,1.0,2025-03-19 01:00:00
VMX-10890,VM-099,Kolkata,Mall,21-01-2025,19:00:00,P-105,Dettol Wipe,Hygiene,24,169.0,167.0,2.0,4008.0,RP-013,Rajesh,Working,14.0,UPI,3.8,67.0,1.29,363.0,1.0,2025-01-21 19:00:00
VMX-10891,VM-264,Hyderabad,Hospital,22-03-2025,20:49:00,P-102,Bisleri Water,Drinks,19.09,175.0,167.0,8.0,3188.03,RP-020,Suresh,Maintenance,14.3,UPI,4.6,85.0,1.65,292.0,1.0,2025-03-22 20:49:00
VMX-10892,VM-121,Kolkata,Office,25-07-2025,13:51:00,P-105,Dettol Wipe,Hygiene,143.24,98.0,89.0,9.0,12748.36,RP-011,Suresh,Working,16.9,Card,2.5,10.0,1.23,498.0,0.0,2025-07-25 13:51:00
VMX-10893,VM-145,Kolkata,Office,18-03-2025,23:04:00,P-102,Bisleri Water,Drinks,25.07,134.0,130.0,4.0,3259.1,RP-011,Rahul,Working,20.8,UPI,3.2,119.0,3.58,393.0,1.0,2025-03-18 23:04:00
VMX-10894,VM-099,Chennai,College,06-07-2025,05:25:00,P-103,Oreo Pack,Snacks,135.38,187.0,186.0,1.0,25180.68,RP-002,Mahesh,Low Power,15.8,UPI,3.4,50.0,4.13,491.0,1.0,2025-07-06 05:25:00
VMX-10895,VM-095,Hyderabad,Mall,11-06-2025,18:55:00,P-107,Colgate Mini,Hygiene,28.61,103.0,90.0,13.0,2574.9,RP-009,Kiran,Working,17.3,UPI,2.4,113.0,1.56,312.0,1.0,2025-06-11 18:55:00
VMX-10896,VM-185,Delhi,Office,20-01-2025,00:40:00,P-104,Red Bull,Drinks,137.02,66.0,53.0,13.0,7262.06,RP-020,Deepa,Low Power,10.0,UPI,4.3,64.0,1.81,125.0,1.0,2025-01-20 00:40:00
VMX-10897,VM-021,Mumbai,Metro Station,11-04-2025,13:49:00,P-108,Sprite Bottle,Drinks,48.28,120.0,104.0,16.0,5021.12,RP-018,Anita,Maintenance,25.0,UPI,2.1,42.0,1.07,351.0,0.0,2025-04-11 13:49:00
VMX-10898,VM-115,Mumbai,Office,29-04-2025,10:53:00,P-107,Colgate Mini,Hygiene,126.14,126.0,112.0,14.0,14127.68,RP-010,Mahesh,Working,20.0,Card,2.8,33.0,1.02,167.0,0.0,2025-04-29 10:53:00
VMX-10899,VM-025,Hyderabad,Office,23-07-2025,00:27:00,P-103,Oreo Pack,Snacks,143.28,0.0,128.0,7.0,18339.84,RP-018,Fatima,Low Power,10.2,Card,4.4,81.0,4.15,443.0,0.0,2025-07-23 00:27:00
VMX-10900,VM-121,Mumbai,Metro Station,28-05-2025,03:54:00,P-107,Colgate Mini,Hygiene,148.44,74.0,57.0,17.0,8461.08,RP-011,Amit,Maintenance,19.8,Cash,4.1,10.0,2.32,175.0,1.0,2025-05-28 03:54:00
VMX-10901,VM-213,Bangalore,Hospital,30-05-2025,21:16:00,P-100,Lays Classic,Snacks,23.92,86.0,81.0,5.0,1937.52,RP-007,Amit,Low Power,11.5,UPI,2.9,69.0,3.77,377.0,0.0,2025-05-30 21:16:00
VMX-10902,VM-139,Bangalore,College,03-05-2025,02:49:00,P-101,Pepsi Can,Drinks,147.59,51.0,51.0,0.0,7527.09,RP-015,Deepa,Working,17.5,Card,3.4,15.0,2.92,364.0,1.0,2025-05-03 02:49:00
VMX-10903,VM-097,Pune,Office,01-04-2025,12:51:00,P-101,Pepsi Can,Drinks,59.88,43.0,32.0,11.0,1916.16,RP-001,Rahul,Working,24.9,Cash,2.4,20.0,3.09,403.0,0.0,2025-04-01 12:51:00
VMX-10904,VM-200,Kolkata,Hospital,16-01-2025,10:54:00,P-107,Colgate Mini,Hygiene,148.76,181.0,170.0,11.0,25289.2,RP-004,Fatima,Low Power,13.2,Cash,3.9,61.0,4.09,432.0,0.0,2025-01-16 10:54:00
VMX-10905,VM-189,Bangalore,College,23-08-2025,12:20:00,P-103,Oreo Pack,Snacks,126.83,146.0,129.0,17.0,16361.07,RP-002,Rajesh,Working,10.1,UPI,2.1,85.0,4.74,382.0,1.0,2025-08-23 12:20:00
VMX-10906,VM-050,Pune,Metro Station,26-08-2025,02:08:00,P-106,Snickers Bar,Snacks,114.96,21.0,11.0,10.0,1264.56,RP-018,Ravi,Maintenance,12.0,UPI,3.7,70.0,3.9,224.0,0.0,2025-08-26 02:08:00
VMX-10907,VM-218,Chennai,College,06-05-2025,09:34:00,P-109,Doritos,Snacks,123.52,183.0,173.0,10.0,21368.96,RP-004,Mahesh,Low Power,20.0,Cash,4.1,104.0,2.52,128.0,1.0,2025-05-06 09:34:00
VMX-10908,VM-158,Delhi,Office,06-07-2025,02:31:00,P-105,Dettol Wipe,Hygiene,128.96,39.0,23.0,16.0,2966.08,RP-014,Mahesh,Working,24.7,UPI,2.6,11.0,4.48,318.0,0.0,2025-07-06 02:31:00
VMX-10909,VM-296,Bangalore,Metro Station,12-06-2025,03:11:00,P-105,Dettol Wipe,Hygiene,25.87,87.0,29.0,10.0,1991.99,RP-003,Suresh,Working,14.1,Card,4.3,116.0,4.44,465.0,1.0,2025-06-12 03:11:00
VMX-10910,VM-216,Hyderabad,Office,21-01-2025,09:58:00,P-108,Sprite Bottle,Drinks,102.11,45.0,33.0,12.0,3369.63,RP-009,Mahesh,Working,11.0,Card,2.0,114.0,2.91,290.0,1.0,2025-01-21 09:58:00
VMX-10911,VM-087,Bangalore,Metro Station,07-05-2025,02:21:00,P-106,Snickers Bar,Snacks,85.88,87.0,82.0,5.0,7042.16,RP-004,Mahesh,Low Power,13.3,Card,2.4,94.0,4.83,492.0,0.0,2025-05-07 02:21:00
VMX-10912,VM-122,Hyderabad,Hospital,07-04-2025,15:35:00,P-106,Snickers Bar,Snacks,10.74,153.0,145.0,8.0,1557.3,RP-007,Rahul,Maintenance,15.8,Card,2.9,17.0,2.62,352.0,1.0,2025-04-07 15:35:00
VMX-10913,VM-131,Delhi,Metro Station,05-03-2025,22:26:00,P-109,Doritos,Snacks,50.27,83.0,64.0,19.0,3217.28,RP-016,Mahesh,Working,16.1,Cash,4.2,88.0,1.51,144.0,0.0,2025-03-05 22:26:00
VMX-10914,VM-037,Delhi,Hospital,08-05-2025,23:02:00,P-103,Oreo Pack,Snacks,28.54,30.0,23.0,7.0,656.42,RP-005,Suresh,Low Power,24.4,Card,2.0,26.0,3.87,474.0,0.0,2025-05-08 23:02:00
VMX-10915,VM-064,Kolkata,Office,15-03-2025,04:46:00,P-106,Snickers Bar,Snacks,24.97,72.0,58.0,14.0,1448.26,RP-011,Kiran,Low Power,19.9,Card,2.8,84.0,1.81,375.0,0.0,2025-03-15 04:46:00
VMX-10916,VM-224,Hyderabad,Office,08-09-2025,15:17:00,P-103,Oreo Pack,Snacks,64.49,68.0,61.0,7.0,3933.89,RP-001,Kiran,Low Power,12.4,Cash,4.2,67.0,2.16,261.0,0.0,2025-09-08 15:17:00
VMX-10917,VM-272,Unknown,Metro Station,07-08-2025,00:30:00,P-104,Red Bull,Drinks,29.7,91.0,86.0,5.0,2554.2,RP-015,Deepa,Low Power,19.7,UPI,2.6,110.0,2.1,294.0,1.0,2025-08-07 00:30:00
VMX-10918,VM-121,Delhi,Hospital,10-03-2025,00:49:00,P-104,Red Bull,Drinks,32.46,76.0,62.0,14.0,2012.52,RP-013,Suresh,Maintenance,17.6,Cash,2.3,92.0,2.48,180.0,0.0,2025-03-10 00:49:00
VMX-10919,VM-291,Hyderabad,Mall,26-07-2025,00:04:00,P-104,Red Bull,Drinks,130.68,152.0,143.0,9.0,18687.24,RP-010,Anita,Working,21.4,Card,4.8,109.0,3.45,459.0,0.0,2025-07-26 00:04:00
VMX-10920,VM-284,Mumbai,Metro Station,11-01-2025,10:49:00,P-107,Colgate Mini,Hygiene,146.84,20.0,16.0,4.0,2349.44,RP-011,Mahesh,Low Power,12.9,Cash,4.2,92.0,4.06,178.0,1.0,2025-01-11 10:49:00
VMX-10921,VM-242,Pune,Mall,02-07-2025,03:24:00,P-109,Doritos,Snacks,37.93,122.0,103.0,19.0,3906.79,RP-008,Deepa,Working,22.9,UPI,3.4,30.0,3.13,302.0,0.0,2025-07-02 03:24:00
VMX-10922,VM-071,Bangalore,Hospital,22-02-2025,18:57:00,P-106,Snickers Bar,Snacks,144.05,24.0,22.0,2.0,3169.1,RP-002,Suresh,Low Power,16.2,Card,2.2,87.0,4.96,330.0,1.0,2025-02-22 18:57:00
VMX-10923,VM-132,Hyderabad,Metro Station,09-07-2025,03:02:00,P-102,Bisleri Water,Drinks,40.9,74.0,68.0,6.0,2781.2,RP-014,Ravi,Low Power,19.6,UPI,4.7,11.0,2.36,171.0,0.0,2025-07-09 03:02:00
VMX-10924,VM-142,Pune,Mall,04-05-2025,01:30:00,P-101,Pepsi Can,Drinks,122.76,173.0,156.0,17.0,19150.56,RP-001,Rajesh,Working,21.9,UPI,2.3,64.0,3.33,344.0,1.0,2025-05-04 01:30:00
VMX-10925,VM-085,Hyderabad,College,20-08-2025,17:44:00,P-100,Lays Classic,Snacks,69.79,109.0,98.0,11.0,6839.42,RP-019,Mahesh,Maintenance,14.1,Cash,4.5,29.0,3.95,425.0,0.0,2025-08-20 17:44:00
VMX-10926,VM-231,Bangalore,Metro Station,01-06-2025,14:03:00,P-103,Oreo Pack,Snacks,125.82,70.0,66.0,4.0,8304.12,RP-005,Mahesh,Working,20.9,Card,2.6,80.0,4.03,439.0,1.0,2025-06-01 14:03:00
VMX-10927,VM-088,Chennai,College,31-08-2025,12:00:00,P-106,Snickers Bar,Snacks,31.55,36.0,31.0,5.0,978.05,RP-018,Amit,Maintenance,22.6,UPI,2.3,97.0,1.63,87.0,0.0,2025-08-31 12:00:00
VMX-10928,VM-285,Delhi,Metro Station,17-05-2025,22:33:00,P-106,Snickers Bar,Snacks,25.18,78.0,73.0,5.0,1838.14,RP-019,Rahul,Low Power,23.3,Cash,4.5,76.0,3.13,340.0,0.0,2025-05-17 22:33:00
VMX-10929,VM-110,Delhi,College,23-05-2025,10:16:00,P-107,Colgate Mini,Hygiene,69.48,176.0,162.0,14.0,11255.76,RP-007,Kiran,Low Power,15.6,Card,3.4,11.0,4.5,109.0,0.0,2025-05-23 10:16:00
VMX-10930,VM-203,Delhi,Metro Station,27-02-2025,17:30:00,P-100,Lays Classic,Snacks,42.16,199.0,182.0,17.0,7673.12,RP-005,Mahesh,Maintenance,12.7,Cash,4.4,30.0,4.63,310.0,0.0,2025-02-27 17:30:00
VMX-10931,VM-133,Chennai,Office,26-09-2025,17:05:00,P-103,Oreo Pack,Snacks,85.46,41.0,31.0,10.0,2649.26,RP-018,Amit,Working,10.7,UPI,4.6,26.0,1.56,454.0,0.0,2025-09-26 17:05:00
VMX-10932,VM-280,Hyderabad,Office,06-02-2025,13:46:00,P-101,Pepsi Can,Drinks,82.51,179.0,165.0,14.0,13614.15,RP-015,Amit,Maintenance,14.1,UPI,2.1,97.0,1.05,63.0,0.0,2025-02-06 13:46:00
VMX-10933,VM-098,Mumbai,College,11-02-2025,02:44:00,P-100,Lays Classic,Snacks,21.71,62.0,42.0,20.0,911.82,RP-015,Fatima,Maintenance,15.6,Card,4.2,77.0,1.1,126.0,1.0,2025-02-11 02:44:00
VMX-10934,VM-082,Hyderabad,Metro Station,29-05-2025,09:16:00,P-105,Dettol Wipe,Hygiene,63.07,49.0,33.0,16.0,2081.31,RP-005,Rahul,Maintenance,18.6,UPI,2.9,66.0,4.64,89.0,0.0,2025-05-29 09:16:00
VMX-10935,VM-241,Hyderabad,Metro Station,22-01-2025,10:24:00,P-102,Bisleri Water,Drinks,125.41,93.0,77.0,16.0,9656.57,RP-014,Rajesh,Working,10.7,Cash,2.0,33.0,4.54,243.0,1.0,2025-01-22 10:24:00
VMX-10936,VM-194,Pune,College,29-09-2025,04:25:00,P-105,Dettol Wipe,Hygiene,22.42,152.0,144.0,8.0,3228.48,RP-008,Kiran,Working,22.0,Card,2.7,41.0,2.48,75.0,1.0,2025-09-29 04:25:00
VMX-10937,VM-021,Delhi,Hospital,22-01-2025,17:45:00,P-104,Red Bull,Drinks,125.02,167.0,155.0,12.0,19378.1,RP-002,Kiran,Working,13.6,Card,4.6,71.0,2.84,231.0,0.0,2025-01-22 17:45:00
VMX-10938,VM-138,Kolkata,College,06-03-2025,02:03:00,P-109,Doritos,Snacks,119.01,154.0,149.0,5.0,17732.49,RP-004,Kiran,Low Power,22.5,Cash,4.7,117.0,3.12,52.0,1.0,2025-03-06 02:03:00
VMX-10939,VM-128,Pune,Mall,08-10-2025,15:31:00,P-104,Red Bull,Drinks,144.7,184.0,179.0,5.0,25901.3,RP-013,Suresh,Maintenance,19.7,UPI,2.8,19.0,3.69,122.0,1.0,2025-10-08 15:31:00
VMX-10940,VM-082,Hyderabad,Mall,07-06-2025,13:19:00,P-109,Doritos,Snacks,104.91,63.0,47.0,16.0,4930.77,RP-014,Amit,Low Power,20.8,Card,3.3,13.0,2.24,448.0,1.0,2025-06-07 13:19:00
VMX-10941,VM-081,Chennai,Office,30-05-2025,20:24:00,P-101,Pepsi Can,Drinks,74.68,30.0,18.0,12.0,1344.24,RP-010,Mahesh,Working,16.0,Cash,4.2,47.0,2.36,399.0,0.0,2025-05-30 20:24:00
VMX-10942,VM-211,Kolkata,Office,29-08-2025,12:19:00,P-104,Red Bull,Drinks,36.83,25.0,23.0,2.0,847.09,RP-010,Fatima,Maintenance,24.4,Card,3.5,117.0,1.09,165.0,0.0,2025-08-29 12:19:00
VMX-10943,VM-142,Chennai,Mall,23-09-2025,05:53:00,P-105,Dettol Wipe,Hygiene,43.8,198.0,182.0,16.0,7971.6,RP-015,Rahul,Maintenance,10.9,Card,3.0,37.0,3.75,79.0,1.0,2025-09-23 05:53:00
VMX-10944,VM-270,Chennai,Metro Station,01-07-2025,06:53:00,P-103,Oreo Pack,Snacks,38.65,75.0,69.0,6.0,2666.85,RP-011,Ravi,Low Power,20.9,Cash,4.4,11.0,1.38,357.0,1.0,2025-07-01 06:53:00
VMX-10945,VM-124,Pune,College,25-01-2025,19:12:00,P-108,Sprite Bottle,Drinks,75.3,51.0,34.0,17.0,2560.2,RP-007,Rajesh,Working,12.0,Card,3.0,28.0,1.16,258.0,0.0,2025-01-25 19:12:00
VMX-10946,VM-049,Mumbai,Metro Station,12-09-2025,10:24:00,P-101,Pepsi Can,Drinks,143.87,176.0,160.0,16.0,23019.2,RP-014,Fatima,Maintenance,23.0,Cash,2.0,23.0,1.83,63.0,0.0,2025-09-12 10:24:00
VMX-10947,VM-007,Bangalore,Hospital,07-03-2025,19:33:00,P-109,Doritos,Snacks,24.94,126.0,123.0,3.0,3067.62,RP-011,Rajesh,Maintenance,20.5,UPI,4.2,105.0,4.92,111.0,1.0,2025-03-07 19:33:00
VMX-10948,VM-178,Bangalore,College,20-07-2025,11:39:00,P-100,Lays Classic,Snacks,133.52,194.0,188.0,6.0,25101.76,RP-003,Anita,Maintenance,11.1,Cash,4.6,81.0,4.09,196.0,0.0,2025-07-20 11:39:00
VMX-10949,VM-014,Pune,Mall,29-09-2025,15:21:00,P-108,Sprite Bottle,Drinks,50.91,79.0,67.0,12.0,3410.97,RP-014,Suresh,Working,22.2,Cash,4.8,77.0,3.41,125.0,0.0,2025-09-29 15:21:00
VMX-10950,VM-131,Hyderabad,Office,03-08-2025,02:05:00,P-103,Oreo Pack,Snacks,73.18,105.0,95.0,10.0,6952.1,RP-005,Fatima,Maintenance,16.1,Card,2.1,46.0,3.52,448.0,1.0,2025-08-03 02:05:00
VMX-10951,VM-266,Delhi,College,11-08-2025,23:02:00,P-103,Oreo Pack,Snacks,78.93,121.0,108.0,13.0,8524.44,RP-004,Amit,Low Power,21.7,Cash,4.8,120.0,1.77,78.0,0.0,2025-08-11 23:02:00
VMX-10952,VM-234,Hyderabad,Office,14-01-2025,12:09:00,P-105,Dettol Wipe,Hygiene,64.68,175.0,173.0,2.0,11189.64,RP-007,Ravi,Working,21.5,UPI,4.7,45.0,1.21,270.0,0.0,2025-01-14 12:09:00
VMX-10953,VM-288,Delhi,Mall,06-09-2025,13:48:00,P-106,Snickers Bar,Snacks,90.09,144.0,124.0,20.0,11171.16,RP-020,Suresh,Maintenance,22.5,UPI,4.2,5.0,1.46,205.0,0.0,2025-09-06 13:48:00
VMX-10954,VM-282,Delhi,Metro Station,02-06-2025,07:30:00,P-108,Sprite Bottle,Drinks,147.92,69.0,59.0,10.0,8727.28,RP-005,Kiran,Working,13.2,Card,3.1,92.0,1.5,102.0,1.0,2025-06-02 07:30:00
VMX-10955,VM-290,Pune,College,25-01-2025,16:23:00,P-107,Colgate Mini,Hygiene,106.76,24.0,5.0,19.0,533.8,RP-010,Anita,Maintenance,12.7,Cash,4.1,57.0,4.97,348.0,0.0,2025-01-25 16:23:00
VMX-10956,VM-193,Kolkata,Office,04-08-2025,19:36:00,P-106,Snickers Bar,Snacks,115.87,200.0,0.0,18.0,21088.34,RP-018,Rahul,Maintenance,21.2,Card,4.0,109.0,2.82,317.0,1.0,2025-08-04 19:36:00
VMX-10957,VM-128,Bangalore,Office,16-07-2025,20:36:00,P-102,Bisleri Water,Drinks,84.94,113.0,95.0,18.0,8069.3,RP-019,Ravi,Low Power,10.3,Card,4.7,72.0,3.48,488.0,0.0,2025-07-16 20:36:00
VMX-10958,VM-073,Kolkata,Hospital,25-04-2025,09:49:00,P-102,Bisleri Water,Drinks,134.68,47.0,42.0,5.0,5656.56,RP-013,Rahul,Maintenance,24.4,Cash,3.2,89.0,1.09,335.0,1.0,2025-04-25 09:49:00
VMX-10959,VM-227,Bangalore,Mall,02-08-2025,00:41:00,P-102,Bisleri Water,Drinks,65.72,50.0,36.0,14.0,2365.92,RP-010,Fatima,Maintenance,13.4,Card,2.7,85.0,3.65,235.0,0.0,2025-08-02 00:41:00
VMX-10960,VM-177,Mumbai,College,26-05-2025,00:57:00,P-108,Sprite Bottle,Drinks,29.39,163.0,163.0,0.0,4790.57,RP-005,Rahul,Maintenance,16.5,Cash,3.6,108.0,4.14,257.0,1.0,2025-05-26 00:57:00
VMX-10961,VM-294,Mumbai,Office,17-02-2025,17:24:00,P-108,Sprite Bottle,Drinks,104.72,131.0,123.0,8.0,12880.56,RP-014,Ravi,Working,10.2,UPI,4.4,12.0,3.69,401.0,0.0,2025-02-17 17:24:00
VMX-10962,VM-099,Kolkata,Office,22-06-2025,03:16:00,P-103,Oreo Pack,Snacks,123.01,100.0,82.0,18.0,10086.82,RP-013,Fatima,Working,13.6,UPI,4.5,34.0,3.5,70.0,0.0,2025-06-22 03:16:00
VMX-10963,VM-264,Mumbai,Metro Station,04-01-2025,21:54:00,P-102,Bisleri Water,Drinks,76.98,77.0,77.0,0.0,5927.46,RP-013,Kiran,Working,25.0,Cash,4.5,97.0,2.55,153.0,0.0,2025-01-04 21:54:00
VMX-10964,VM-193,Pune,College,14-01-2025,01:04:00,P-101,Pepsi Can,Drinks,103.56,176.0,166.0,10.0,17190.96,RP-020,Anita,Working,14.4,Card,2.2,94.0,2.29,282.0,1.0,2025-01-14 01:04:00
VMX-10965,VM-074,Hyderabad,Office,15-08-2025,20:26:00,P-102,Bisleri Water,Drinks,130.81,153.0,147.0,6.0,19229.07,RP-008,Anita,Low Power,10.3,UPI,3.3,76.0,2.13,133.0,0.0,2025-08-15 20:26:00
VMX-10966,VM-177,Hyderabad,Metro Station,08-03-2025,19:08:00,P-107,Colgate Mini,Hygiene,133.96,123.0,110.0,13.0,14735.6,RP-003,Rajesh,Maintenance,19.4,UPI,4.8,118.0,1.19,132.0,0.0,2025-03-08 19:08:00
VMX-10967,VM-102,Bangalore,Hospital,15-05-2025,02:12:00,P-104,Red Bull,Drinks,13.18,154.0,137.0,17.0,1805.66,RP-008,Ravi,Working,24.3,UPI,3.1,119.0,1.68,226.0,1.0,2025-05-15 02:12:00
VMX-10968,VM-085,Delhi,College,06-01-2025,06:54:00,P-101,Pepsi Can,Drinks,75.41,40.0,26.0,14.0,1960.66,RP-003,Rahul,Working,10.0,Cash,2.7,54.0,1.95,312.0,1.0,2025-01-06 06:54:00
VMX-10969,VM-098,Bangalore,Hospital,26-06-2025,12:07:00,P-102,Bisleri Water,Drinks,75.48,159.0,141.0,18.0,10642.68,RP-003,Fatima,Low Power,14.6,Card,2.1,21.0,4.46,215.0,0.0,2025-06-26 12:07:00
VMX-10970,VM-142,Chennai,College,23-01-2025,03:27:00,P-102,Bisleri Water,Drinks,130.98,95.0,79.0,16.0,10347.42,RP-008,Rajesh,Working,20.2,Cash,3.2,68.0,1.43,122.0,1.0,2025-01-23 03:27:00
VMX-10971,VM-083,Delhi,College,08-02-2025,00:53:00,P-107,Colgate Mini,Hygiene,103.42,63.0,58.0,5.0,5998.36,RP-016,Rahul,Maintenance,22.4,Cash,3.9,33.0,3.08,264.0,0.0,2025-02-08 00:53:00
VMX-10972,VM-219,Kolkata,Mall,13-08-2025,07:48:00,P-109,Doritos,Snacks,86.46,145.0,126.0,19.0,10893.96,RP-018,Suresh,Working,22.7,Cash,3.6,40.0,2.63,223.0,0.0,2025-08-13 07:48:00
VMX-10973,VM-220,Mumbai,College,06-10-2025,23:40:00,P-109,Doritos,Snacks,115.04,25.0,10.0,15.0,1150.4,RP-015,Rajesh,Maintenance,10.9,UPI,2.7,51.0,3.07,463.0,0.0,2025-10-06 23:40:00
VMX-10974,VM-088,Bangalore,Mall,04-10-2025,04:05:00,P-100,Lays Classic,Snacks,61.11,20.0,8.0,12.0,488.88,RP-012,Deepa,Maintenance,12.4,UPI,4.0,84.0,2.46,447.0,1.0,2025-10-04 04:05:00
VMX-10975,VM-038,Pune,Mall,27-07-2025,18:09:00,P-108,Sprite Bottle,Drinks,148.44,46.0,38.0,8.0,5640.72,RP-003,Rahul,Working,14.9,UPI,4.9,96.0,3.38,70.0,1.0,2025-07-27 18:09:00
VMX-10976,VM-009,Bangalore,Mall,28-05-2025,17:55:00,P-103,Oreo Pack,Snacks,70.19,175.0,158.0,17.0,11090.02,RP-002,Deepa,Working,24.3,Card,4.2,84.0,4.37,271.0,1.0,2025-05-28 17:55:00
VMX-10977,VM-263,Pune,College,02-06-2025,19:21:00,P-108,Sprite Bottle,Drinks,145.67,185.0,181.0,4.0,26366.27,RP-003,Anita,Low Power,16.8,Card,3.5,103.0,4.0,68.0,1.0,2025-06-02 19:21:00
VMX-10978,VM-200,Mumbai,Mall,06-10-2025,12:28:00,P-101,Pepsi Can,Drinks,59.97,65.0,58.0,7.0,3478.26,RP-018,Amit,Working,24.0,UPI,2.8,99.0,1.31,364.0,0.0,2025-10-06 12:28:00
VMX-10979,VM-295,Mumbai,Metro Station,16-07-2025,17:09:00,P-107,Colgate Mini,Hygiene,79.29,156.0,141.0,15.0,11179.89,RP-016,Amit,Working,14.8,Card,2.6,95.0,1.15,379.0,1.0,2025-07-16 17:09:00
VMX-10980,VM-138,Hyderabad,Office,02-05-2025,11:03:00,P-108,Sprite Bottle,Drinks,10.09,184.0,179.0,5.0,1806.11,RP-013,Kiran,Maintenance,19.3,Card,3.4,4.0,1.12,113.0,0.0,2025-05-02 11:03:00
VMX-10981,VM-094,Pune,Hospital,11-07-2025,08:16:00,P-104,Red Bull,Drinks,135.97,65.0,55.0,10.0,7478.35,RP-015,Rahul,Low Power,12.9,UPI,4.5,78.0,2.18,376.0,0.0,2025-07-11 08:16:00
VMX-10982,VM-100,Pune,Metro Station,20-07-2025,07:55:00,P-102,Bisleri Water,Drinks,105.69,167.0,159.0,8.0,16804.71,RP-004,Deepa,Low Power,12.5,Cash,4.1,117.0,2.31,322.0,1.0,2025-07-20 07:55:00
VMX-10983,VM-207,Pune,Mall,27-03-2025,18:10:00,P-107,Colgate Mini,Hygiene,34.91,107.0,95.0,12.0,3316.45,RP-008,Deepa,Maintenance,19.1,Card,3.1,28.0,4.44,308.0,0.0,2025-03-27 18:10:00
VMX-10984,VM-266,Chennai,Hospital,14-01-2025,20:31:00,P-108,Sprite Bottle,Drinks,109.49,114.0,103.0,11.0,11277.47,RP-018,Deepa,Working,19.1,UPI,4.3,36.0,4.3,164.0,0.0,2025-01-14 20:31:00
VMX-10985,VM-058,Mumbai,Metro Station,20-09-2025,18:04:00,P-103,Oreo Pack,Snacks,52.93,179.0,176.0,3.0,9315.68,RP-016,Amit,Working,13.0,Card,3.0,30.0,2.08,69.0,0.0,2025-09-20 18:04:00
VMX-10986,VM-056,Chennai,Office,16-06-2025,09:29:00,P-105,Dettol Wipe,Hygiene,39.43,98.0,96.0,2.0,3785.28,RP-007,Ravi,Working,20.9,UPI,3.9,27.0,4.27,293.0,0.0,2025-06-16 09:29:00
VMX-10987,VM-137,Kolkata,Mall,24-01-2025,00:39:00,P-103,Oreo Pack,Snacks,121.83,134.0,124.0,10.0,15106.92,RP-004,Anita,Working,10.5,UPI,2.5,49.0,3.46,112.0,1.0,2025-01-24 00:39:00
VMX-10988,VM-067,Bangalore,Metro Station,04-01-2025,08:23:00,P-108,Sprite Bottle,Drinks,18.42,53.0,103.0,15.0,699.96,RP-017,Fatima,Low Power,16.0,Cash,4.8,71.0,4.24,464.0,1.0,2025-01-04 08:23:00
VMX-10989,VM-231,Pune,Hospital,17-09-2025,13:50:00,P-106,Snickers Bar,Snacks,18.17,103.0,85.0,18.0,1544.45,RP-009,Anita,Working,12.1,Card,3.0,43.0,4.93,392.0,1.0,2025-09-17 13:50:00
VMX-10990,VM-148,Bangalore,Metro Station,06-07-2025,10:50:00,P-108,Sprite Bottle,Drinks,98.5,170.0,157.0,13.0,15464.5,RP-005,Anita,Maintenance,23.7,Cash,4.4,54.0,4.94,63.0,0.0,2025-07-06 10:50:00
VMX-10991,VM-118,Pune,Mall,07-06-2025,11:40:00,P-100,Lays Classic,Snacks,133.55,30.0,26.0,4.0,3472.3,RP-003,Suresh,Working,19.6,Cash,4.4,111.0,2.27,156.0,0.0,2025-06-07 11:40:00
VMX-10992,VM-218,Pune,Mall,15-04-2025,20:40:00,P-105,Dettol Wipe,Hygiene,57.59,28.0,12.0,16.0,691.08,RP-004,Anita,Low Power,14.3,Card,3.6,49.0,2.54,367.0,1.0,2025-04-15 20:40:00
VMX-10993,VM-226,Delhi,Office,05-08-2025,14:57:00,P-102,Bisleri Water,Drinks,79.94,196.0,189.0,7.0,15108.66,RP-014,Amit,Maintenance,10.1,UPI,4.5,94.0,3.81,238.0,1.0,2025-08-05 14:57:00
VMX-10994,VM-279,Kolkata,College,22-04-2025,05:45:00,P-103,Oreo Pack,Snacks,142.96,37.0,21.0,16.0,3002.16,RP-005,Suresh,Working,11.9,Card,2.4,107.0,3.58,370.0,1.0,2025-04-22 05:45:00
VMX-10995,VM-213,Chennai,Hospital,16-02-2025,16:15:00,P-109,Doritos,Snacks,22.96,116.0,116.0,0.0,2663.36,RP-006,Suresh,Maintenance,18.3,UPI,2.1,21.0,4.07,256.0,0.0,2025-02-16 16:15:00
VMX-10996,VM-134,Delhi,Office,03-09-2025,14:20:00,P-107,Colgate Mini,Hygiene,34.77,66.0,55.0,11.0,1912.35,RP-018,Anita,Low Power,12.0,Cash,4.6,120.0,1.13,122.0,0.0,2025-09-03 14:20:00
VMX-10997,VM-124,Delhi,College,15-07-2025,21:35:00,P-108,Sprite Bottle,Drinks,124.33,191.0,177.0,14.0,22006.41,RP-013,Mahesh,Maintenance,23.0,Card,3.3,15.0,3.58,139.0,0.0,2025-07-15 21:35:00
VMX-10998,VM-299,Bangalore,College,22-04-2025,18:41:00,P-107,Colgate Mini,Hygiene,106.25,70.0,56.0,14.0,5950.0,RP-011,Amit,Working,12.3,Card,4.7,27.0,3.96,137.0,0.0,2025-04-22 18:41:00
VMX-10999,VM-121,Pune,Metro Station,08-02-2025,20:19:00,P-106,Snickers Bar,Snacks,121.92,188.0,170.0,18.0,20726.4,RP-005,Suresh,Working,14.9,UPI,4.1,31.0,4.16,488.0,0.0,2025-02-08 20:19:00
VMX-11000,VM-238,Delhi,Hospital,02-08-2025,03:31:00,P-105,Dettol Wipe,Hygiene,87.83,98.0,90.0,8.0,7904.7,RP-008,Amit,Low Power,14.3,Cash,3.7,33.0,4.46,345.0,1.0,2025-08-02 03:31:00
VMX-11001,VM-299,Mumbai,College,17-08-2025,19:52:00,P-109,Doritos,Snacks,110.17,49.0,44.0,5.0,4847.48,RP-006,Rahul,Working,16.6,Cash,2.2,31.0,3.67,355.0,1.0,2025-08-17 19:52:00
VMX-11002,VM-168,Bangalore,Metro Station,09-09-2025,22:57:00,P-108,Sprite Bottle,Drinks,137.49,48.0,42.0,6.0,5774.58,RP-018,Fatima,Working,12.0,Cash,4.4,96.0,4.89,118.0,1.0,2025-09-09 22:57:00
VMX-11003,VM-023,Chennai,Metro Station,07-04-2025,05:02:00,P-106,Snickers Bar,Snacks,112.09,33.0,16.0,17.0,1793.44,RP-016,Rahul,Maintenance,23.3,Card,3.5,110.0,3.28,228.0,0.0,2025-04-07 05:02:00
VMX-11004,VM-202,Hyderabad,College,02-05-2025,20:34:00,P-105,Dettol Wipe,Hygiene,103.43,111.0,106.0,5.0,10963.58,RP-007,Mahesh,Low Power,24.7,Cash,4.8,82.0,1.33,343.0,1.0,2025-05-02 20:34:00
VMX-11005,VM-048,Hyderabad,Mall,18-04-2025,23:36:00,P-101,Pepsi Can,Drinks,74.43,108.0,103.0,5.0,7666.29,RP-019,Amit,Maintenance,24.1,Card,3.0,3.0,1.37,151.0,1.0,2025-04-18 23:36:00
VMX-11006,VM-101,Hyderabad,Metro Station,30-01-2025,19:52:00,P-104,Red Bull,Drinks,101.53,150.0,144.0,6.0,14620.32,RP-014,Rajesh,Working,13.2,Card,3.5,77.0,4.87,124.0,1.0,2025-01-30 19:52:00
VMX-11007,VM-236,Mumbai,Hospital,17-04-2025,05:07:00,P-100,Lays Classic,Snacks,98.66,58.0,55.0,3.0,5426.3,RP-005,Mahesh,Working,19.1,Card,4.0,14.0,1.45,256.0,0.0,2025-04-17 05:07:00
VMX-11008,VM-176,Delhi,Metro Station,17-01-2025,14:08:00,P-102,Bisleri Water,Drinks,137.86,30.0,27.0,3.0,3722.22,RP-015,Suresh,Working,23.9,Card,4.2,4.0,2.17,148.0,1.0,2025-01-17 14:08:00
VMX-11009,VM-155,Kolkata,Metro Station,02-04-2025,14:41:00,P-106,Snickers Bar,Snacks,57.22,157.0,157.0,0.0,8983.54,RP-004,Amit,Low Power,12.6,Cash,2.9,101.0,3.23,252.0,0.0,2025-04-02 14:41:00
VMX-11010,VM-147,Mumbai,Mall,10-03-2025,04:38:00,P-105,Dettol Wipe,Hygiene,130.38,167.0,157.0,10.0,20469.66,RP-001,Rahul,Working,20.5,UPI,5.0,44.0,3.89,479.0,0.0,2025-03-10 04:38:00
VMX-11011,VM-299,Mumbai,College,26-06-2025,04:49:00,P-100,Lays Classic,Snacks,122.75,74.0,56.0,18.0,6874.0,RP-004,Suresh,Low Power,11.8,UPI,2.6,119.0,2.44,217.0,1.0,2025-06-26 04:49:00
VMX-11012,VM-080,Hyderabad,Mall,14-01-2025,08:04:00,P-106,Snickers Bar,Snacks,52.97,53.0,47.0,6.0,2489.59,RP-016,Mahesh,Low Power,11.8,Card,2.5,29.0,3.23,192.0,0.0,2025-01-14 08:04:00
VMX-11013,VM-012,Mumbai,Mall,13-02-2025,13:27:00,P-102,Bisleri Water,Drinks,error,35.0,21.0,14.0,1971.27,RP-005,Amit,Low Power,18.0,Cash,3.0,33.0,4.81,131.0,0.0,2025-02-13 13:27:00
VMX-11014,VM-009,Pune,Office,08-05-2025,01:07:00,P-103,Oreo Pack,Snacks,108.17,93.0,92.0,1.0,9951.64,RP-013,Rajesh,Maintenance,23.7,Card,3.4,54.0,4.57,207.0,0.0,2025-05-08 01:07:00
VMX-11015,VM-089,Bangalore,Office,10-07-2025,09:27:00,P-105,Dettol Wipe,Hygiene,71.99,193.0,182.0,11.0,13102.18,RP-016,Ravi,Working,22.6,UPI,3.4,0.0,1.44,334.0,0.0,2025-07-10 09:27:00
VMX-11016,VM-212,Pune,Mall,20-01-2025,06:01:00,P-101,Pepsi Can,Drinks,121.62,151.0,148.0,3.0,17999.76,RP-004,Rajesh,Low Power,14.1,Cash,3.5,54.0,3.07,328.0,0.0,2025-01-20 06:01:00
VMX-11017,VM-016,Kolkata,College,18-08-2025,03:09:00,P-108,Sprite Bottle,Drinks,23.64,191.0,180.0,11.0,4255.2,RP-011,Mahesh,Low Power,11.3,Card,2.1,57.0,1.41,77.0,1.0,2025-08-18 03:09:00
VMX-11018,VM-252,Chennai,Mall,04-07-2025,16:17:00,P-103,Oreo Pack,Snacks,56.5,32.0,23.0,9.0,1299.5,RP-013,Amit,Working,20.6,Cash,2.1,55.0,1.73,322.0,1.0,2025-07-04 16:17:00
VMX-11019,VM-105,Hyderabad,Metro Station,10-05-2025,15:01:00,P-107,Colgate Mini,Hygiene,69.63,129.0,110.0,19.0,7659.3,RP-001,Deepa,Working,25.0,Cash,3.8,20.0,4.29,275.0,1.0,2025-05-10 15:01:00
VMX-11020,VM-033,Pune,Mall,10-02-2025,11:37:00,P-106,Snickers Bar,Snacks,134.55,131.0,127.0,4.0,17087.85,RP-005,Rajesh,Working,10.5,UPI,3.2,54.0,1.4,219.0,0.0,2025-02-10 11:37:00
VMX-11021,VM-064,Chennai,College,06-09-2025,21:29:00,P-101,Pepsi Can,Drinks,121.31,32.0,18.0,14.0,2183.58,RP-001,Anita,Maintenance,13.5,Card,2.2,91.0,3.25,408.0,1.0,2025-09-06 21:29:00
VMX-11022,VM-131,Pune,Metro Station,12-06-2025,05:02:00,P-109,Doritos,Snacks,10.42,83.0,81.0,2.0,844.02,RP-017,Mahesh,Maintenance,14.5,Card,4.5,118.0,4.65,451.0,1.0,2025-06-12 05:02:00
VMX-11023,VM-213,Mumbai,Metro Station,13-08-2025,21:07:00,P-103,Oreo Pack,Snacks,100.72,70.0,56.0,14.0,5640.32,RP-018,Anita,Working,16.2,UPI,4.9,19.0,1.87,196.0,0.0,2025-08-13 21:07:00
VMX-11024,VM-166,Mumbai,Mall,30-04-2025,05:48:00,P-107,Colgate Mini,Hygiene,77.18,88.0,81.0,7.0,6251.58,RP-007,Fatima,Maintenance,18.9,UPI,3.7,116.0,1.46,362.0,1.0,2025-04-30 05:48:00
VMX-11025,VM-014,Bangalore,Hospital,09-08-2025,21:08:00,P-100,Lays Classic,Snacks,19.38,87.0,82.0,5.0,1589.16,RP-002,Fatima,Low Power,22.3,Card,4.5,13.0,1.36,78.0,0.0,2025-08-09 21:08:00
VMX-11026,VM-280,Kolkata,College,13-05-2025,03:54:00,P-100,Lays Classic,Snacks,98.32,189.0,169.0,20.0,16616.08,RP-008,Deepa,Maintenance,20.5,Card,3.7,76.0,3.02,449.0,1.0,2025-05-13 03:54:00
VMX-11027,VM-276,Pune,Metro Station,12-01-2025,23:53:00,P-102,Bisleri Water,Drinks,135.64,41.0,27.0,14.0,3662.28,RP-010,Fatima,Working,22.2,Cash,4.9,118.0,2.6,183.0,1.0,2025-01-12 23:53:00
VMX-11028,VM-120,Pune,Hospital,02-07-2025,16:32:00,P-108,Sprite Bottle,Drinks,29.35,50.0,36.0,14.0,1056.6,RP-017,Deepa,Low Power,24.0,Card,2.5,103.0,1.1,326.0,0.0,2025-07-02 16:32:00
VMX-11029,VM-289,Hyderabad,Office,03-04-2025,06:24:00,P-106,Snickers Bar,Snacks,76.4,141.0,139.0,2.0,10619.6,RP-020,Kiran,Working,21.5,Card,2.3,20.0,3.04,305.0,1.0,2025-04-03 06:24:00
VMX-11030,VM-201,Pune,Hospital,16-09-2025,04:29:00,P-102,Bisleri Water,Drinks,93.99,128.0,111.0,17.0,10432.89,RP-002,Anita,Working,18.8,Cash,4.1,33.0,4.62,95.0,1.0,2025-09-16 04:29:00
VMX-11031,VM-146,Delhi,Metro Station,08-05-2025,05:31:00,P-101,Pepsi Can,Drinks,59.65,31.0,16.0,15.0,954.4,RP-018,Suresh,Low Power,20.8,UPI,2.3,119.0,2.84,458.0,1.0,2025-05-08 05:31:00
VMX-11032,VM-145,Kolkata,Metro Station,04-08-2025,22:40:00,P-102,Bisleri Water,Drinks,51,31.0,12.0,19.0,612.0,RP-013,Kiran,Maintenance,13.7,UPI,4.8,54.0,1.1,281.0,1.0,2025-08-04 22:40:00
VMX-11033,VM-073,Bangalore,Office,23-06-2025,03:24:00,P-102,Bisleri Water,Drinks,19.07,22.0,18.0,4.0,343.26,RP-019,Suresh,Maintenance,16.1,Card,3.6,0.0,3.01,343.0,0.0,2025-06-23 03:24:00
VMX-11034,VM-224,Bangalore,Office,27-04-2025,19:02:00,P-104,Red Bull,Drinks,84.85,156.0,140.0,16.0,11879.0,RP-013,Rajesh,Working,24.9,Card,3.3,73.0,1.27,61.0,0.0,2025-04-27 19:02:00
VMX-11035,VM-084,Kolkata,Mall,08-05-2025,11:42:00,P-101,Pepsi Can,Drinks,51.99,74.0,71.0,3.0,3691.29,RP-014,Ravi,Working,13.2,Card,3.2,0.0,2.37,177.0,0.0,2025-05-08 11:42:00
VMX-11036,VM-012,Bangalore,Office,25-07-2025,10:49:00,P-104,Red Bull,Drinks,54.97,150.0,147.0,3.0,8080.59,RP-009,Anita,Low Power,12.2,Cash,3.8,54.0,2.27,66.0,0.0,2025-07-25 10:49:00
VMX-11037,VM-248,Delhi,College,25-07-2025,02:30:00,P-104,Red Bull,Drinks,48.3,165.0,152.0,13.0,7341.6,RP-017,Amit,Maintenance,13.9,Card,3.7,69.0,3.52,329.0,0.0,2025-07-25 02:30:00
VMX-11038,VM-227,Chennai,Hospital,19-02-2025,08:05:00,P-106,Snickers Bar,Snacks,74.64,161.0,157.0,4.0,11718.48,RP-017,Ravi,Working,22.6,Card,2.6,50.0,3.51,185.0,1.0,2025-02-19 08:05:00
VMX-11039,VM-282,Mumbai,Office,22-07-2025,22:39:00,P-109,Doritos,Snacks,102.84,178.0,171.0,7.0,17585.64,RP-017,Kiran,Maintenance,14.7,Cash,3.0,75.0,2.04,210.0,0.0,2025-07-22 22:39:00
VMX-11040,VM-245,Chennai,Mall,03-04-2025,01:54:00,P-101,Pepsi Can,Drinks,27.38,54.0,35.0,19.0,958.3,RP-013,Mahesh,Low Power,11.7,UPI,2.2,87.0,3.91,166.0,1.0,2025-04-03 01:54:00
VMX-11041,VM-297,Chennai,Office,06-03-2025,03:32:00,P-103,Oreo Pack,Snacks,68.97,83.0,70.0,13.0,4827.9,RP-012,Rahul,Working,15.7,Cash,2.1,76.0,3.62,343.0,1.0,2025-03-06 03:32:00
VMX-11042,VM-193,Mumbai,Office,02-04-2025,01:18:00,P-102,Bisleri Water,Drinks,51.82,168.0,160.0,8.0,8291.2,RP-018,Rahul,Low Power,16.5,UPI,2.2,101.0,2.74,132.0,0.0,2025-04-02 01:18:00
VMX-11043,VM-015,Pune,Hospital,15-08-2025,10:34:00,P-104,Red Bull,Drinks,54.06,113.0,98.0,15.0,5297.88,RP-010,Deepa,Working,12.9,Card,4.4,3.0,2.7,174.0,1.0,2025-08-15 10:34:00
VMX-11044,VM-149,Hyderabad,College,05-04-2025,13:21:00,P-104,Red Bull,Drinks,121.85,117.0,113.0,4.0,13769.05,RP-013,Deepa,Maintenance,19.1,Cash,4.8,1.0,3.78,395.0,1.0,2025-04-05 13:21:00
VMX-11045,VM-232,Mumbai,Hospital,19-03-2025,09:11:00,P-102,Bisleri Water,Drinks,129.78,50.0,45.0,5.0,5840.1,RP-016,Anita,Low Power,12.0,UPI,3.8,49.0,1.11,90.0,0.0,2025-03-19 09:11:00
VMX-11046,VM-129,Pune,Metro Station,10-07-2025,16:52:00,P-104,Red Bull,Drinks,109.28,45.0,43.0,2.0,4699.04,RP-013,Mahesh,Working,21.4,Card,2.0,60.0,3.36,252.0,1.0,2025-07-10 16:52:00
VMX-11047,VM-184,Mumbai,College,10-02-2025,05:36:00,P-107,Colgate Mini,Hygiene,148.83,52.0,46.0,6.0,6846.18,RP-009,Rajesh,Working,24.9,UPI,4.4,109.0,1.66,465.0,1.0,2025-02-10 05:36:00
VMX-11048,VM-129,Bangalore,Hospital,28-01-2025,06:33:00,P-101,Pepsi Can,Drinks,30.62,48.0,43.0,5.0,1316.66,RP-011,Suresh,Low Power,15.2,Card,4.2,110.0,4.01,74.0,1.0,2025-01-28 06:33:00
VMX-11049,VM-090,Chennai,Mall,08-07-2025,08:32:00,P-108,Sprite Bottle,Drinks,59.05,182.0,177.0,5.0,10451.85,RP-004,Fatima,Maintenance,21.3,Card,3.0,32.0,2.45,435.0,1.0,2025-07-08 08:32:00
VMX-11050,VM-147,Delhi,Hospital,06-06-2025,20:23:00,P-100,Lays Classic,Snacks,14.4,129.0,121.0,8.0,1742.4,RP-011,Amit,Working,22.7,Cash,2.3,120.0,1.77,415.0,1.0,2025-06-06 20:23:00
VMX-11051,VM-204,Kolkata,Mall,13-02-2025,14:28:00,P-104,Red Bull,Drinks,117.77,177.0,162.0,15.0,19078.74,RP-008,Anita,Maintenance,19.6,Card,2.5,21.0,1.12,494.0,1.0,2025-02-13 14:28:00
VMX-11052,VM-032,Kolkata,College,07-01-2025,20:34:00,P-102,Bisleri Water,Drinks,124.75,141.0,130.0,11.0,16217.5,RP-020,Kiran,Working,22.4,UPI,3.0,81.0,1.78,247.0,0.0,2025-01-07 20:34:00
VMX-11053,VM-118,Chennai,Mall,17-05-2025,19:57:00,P-105,Dettol Wipe,Hygiene,110.69,148.0,144.0,4.0,15939.36,RP-010,Mahesh,Working,22.9,Card,4.4,94.0,1.42,85.0,1.0,2025-05-17 19:57:00
VMX-11054,VM-089,Chennai,Office,04-02-2025,13:22:00,P-107,Colgate Mini,Hygiene,76.38,93.0,77.0,16.0,5881.26,RP-009,Deepa,Low Power,13.9,Cash,4.5,26.0,4.28,500.0,1.0,2025-02-04 13:22:00
VMX-11055,VM-283,Hyderabad,College,19-08-2025,22:50:00,P-101,Pepsi Can,Drinks,76.52,178.0,172.0,6.0,13161.44,RP-011,Suresh,Maintenance,18.9,Cash,3.6,64.0,3.05,180.0,1.0,2025-08-19 22:50:00
VMX-11056,VM-080,Kolkata,Metro Station,28-09-2025,16:49:00,P-109,Doritos,Snacks,89.51,128.0,110.0,18.0,9846.1,RP-002,Anita,Low Power,17.2,Card,2.4,61.0,1.42,479.0,1.0,2025-09-28 16:49:00
VMX-11057,VM-277,Delhi,Hospital,15-02-2025,23:38:00,P-102,Bisleri Water,Drinks,45.53,79.0,78.0,1.0,3551.34,RP-009,Amit,Low Power,12.0,Cash,4.5,83.0,1.91,280.0,0.0,2025-02-15 23:38:00
VMX-11058,VM-282,Mumbai,College,19-03-2025,03:41:00,Unknown,Sprite Bottle,Drinks,42.97,165.0,162.0,3.0,6961.14,RP-013,Amit,Maintenance,13.2,Cash,3.6,65.0,4.7,414.0,0.0,2025-03-19 03:41:00
VMX-11059,VM-090,Hyderabad,College,08-01-2025,05:14:00,P-102,Bisleri Water,Drinks,30.4,31.0,28.0,3.0,851.2,RP-003,Fatima,Low Power,16.9,UPI,2.3,116.0,1.12,480.0,1.0,2025-01-08 05:14:00
VMX-11060,VM-197,Kolkata,College,01-06-2025,06:23:00,P-106,Snickers Bar,Snacks,27.04,160.0,158.0,2.0,4272.32,RP-010,Mahesh,Maintenance,13.5,Card,2.9,40.0,3.6,378.0,0.0,2025-06-01 06:23:00
VMX-11061,VM-282,Delhi,Mall,22-05-2025,13:50:00,P-109,Doritos,Snacks,81.45,32.0,17.0,15.0,1384.65,RP-007,Deepa,Low Power,16.1,Card,2.9,86.0,4.16,67.0,0.0,2025-05-22 13:50:00
VMX-11062,VM-190,Kolkata,Office,26-07-2025,05:00:00,P-103,Oreo Pack,Snacks,112.67,24.0,10.0,14.0,1126.7,RP-011,Rahul,Low Power,16.6,Cash,3.0,115.0,3.76,273.0,1.0,2025-07-26 05:00:00
VMX-11063,VM-190,Chennai,College,07-01-2025,20:25:00,P-106,Snickers Bar,Snacks,69.09,43.0,41.0,2.0,2832.69,RP-003,Suresh,Low Power,10.0,UPI,3.6,12.0,2.6,468.0,1.0,2025-01-07 20:25:00
VMX-11064,VM-288,Kolkata,Mall,08-01-2025,11:49:00,P-109,Doritos,Snacks,75.72,153.0,134.0,19.0,10146.48,RP-014,Kiran,Maintenance,13.0,Card,2.4,68.0,3.9,339.0,1.0,2025-01-08 11:49:00
VMX-11065,VM-222,Pune,Metro Station,28-09-2025,07:34:00,P-102,Bisleri Water,Drinks,64.38,137.0,137.0,0.0,8820.06,RP-017,Rahul,Working,17.1,Card,4.0,62.0,4.13,87.0,1.0,2025-09-28 07:34:00
VMX-11066,VM-040,Pune,Hospital,03-04-2025,11:29:00,P-100,Lays Classic,Snacks,61.94,171.0,158.0,13.0,9786.52,RP-013,Mahesh,Maintenance,18.9,Cash,2.1,11.0,1.53,409.0,1.0,2025-04-03 11:29:00
VMX-11067,VM-155,Hyderabad,Metro Station,06-04-2025,12:00:00,P-107,Colgate Mini,Hygiene,128.9,181.0,165.0,16.0,21268.5,RP-001,Rahul,Low Power,24.0,Cash,4.4,46.0,2.34,210.0,0.0,2025-04-06 12:00:00
VMX-11068,VM-198,Pune,Mall,12-03-2025,15:18:00,P-107,Colgate Mini,Hygiene,78.13,94.0,92.0,2.0,7187.96,RP-003,Ravi,Maintenance,20.1,Card,3.7,35.0,1.37,414.0,1.0,2025-03-12 15:18:00
VMX-11069,VM-172,Pune,Metro Station,14-03-2025,19:30:00,P-102,Bisleri Water,Drinks,71,65.0,60.0,5.0,4260.0,RP-003,Rajesh,Working,22.2,UPI,4.2,46.0,2.07,117.0,0.0,2025-03-14 19:30:00
VMX-11070,VM-223,Kolkata,Metro Station,06-09-2025,01:20:00,P-108,Sprite Bottle,Drinks,58.53,95.0,84.0,11.0,4916.52,RP-005,Mahesh,Maintenance,12.1,UPI,3.5,0.0,3.84,59.0,0.0,2025-09-06 01:20:00
VMX-11071,VM-236,Bangalore,Mall,29-07-2025,08:03:00,P-101,Pepsi Can,Drinks,98.5,76.0,66.0,10.0,6501.0,RP-005,Anita,Low Power,24.9,Card,2.5,71.0,3.44,419.0,1.0,2025-07-29 08:03:00
VMX-11072,VM-135,Delhi,Hospital,22-09-2025,05:10:00,P-100,Lays Classic,Snacks,18.18,144.0,128.0,16.0,2327.04,RP-008,Ravi,Working,24.9,Cash,3.2,119.0,3.17,456.0,1.0,2025-09-22 05:10:00
VMX-11073,VM-295,Chennai,College,31-01-2025,02:07:00,P-100,Lays Classic,Snacks,77.41,35.0,24.0,11.0,1857.84,RP-020,Amit,Low Power,23.3,Cash,4.9,84.0,1.34,145.0,1.0,2025-01-31 02:07:00
VMX-11074,VM-292,Bangalore,Mall,27-04-2025,14:03:00,P-101,Pepsi Can,Drinks,114.65,31.0,20.0,11.0,2293.0,RP-002,Mahesh,Low Power,11.1,UPI,3.8,87.0,1.06,297.0,1.0,2025-04-27 14:03:00
VMX-11075,VM-117,Kolkata,Mall,17-06-2025,22:18:00,P-101,Pepsi Can,Drinks,132.82,166.0,157.0,9.0,20852.74,RP-019,Fatima,Low Power,16.2,Card,3.7,110.0,4.43,226.0,0.0,2025-06-17 22:18:00
VMX-11076,VM-264,Bangalore,Hospital,31-07-2025,23:05:00,P-109,Doritos,Snacks,45.99,140.0,137.0,0.0,6300.63,RP-007,Anita,Maintenance,11.2,Card,4.3,4.0,2.03,73.0,0.0,2025-07-31 23:05:00
VMX-11077,VM-094,Hyderabad,Hospital,26-07-2025,07:43:00,P-105,Dettol Wipe,Hygiene,118.46,189.0,170.0,19.0,20138.2,RP-010,Suresh,Maintenance,15.4,UPI,3.6,112.0,4.3,222.0,0.0,2025-07-26 07:43:00
VMX-11078,VM-220,Mumbai,Mall,07-10-2025,13:02:00,P-106,Snickers Bar,Snacks,84.19,123.0,115.0,8.0,9681.85,RP-019,Fatima,Working,24.8,UPI,4.7,119.0,3.17,149.0,1.0,2025-10-07 13:02:00
VMX-11079,VM-071,Pune,College,02-06-2025,12:58:00,P-102,Bisleri Water,Drinks,54.51,78.0,66.0,12.0,3597.66,RP-011,Deepa,Working,16.7,UPI,4.8,90.0,1.2,234.0,1.0,2025-06-02 12:58:00
VMX-11080,VM-290,Bangalore,College,23-07-2025,05:13:00,P-109,Doritos,Snacks,56.98,40.0,29.0,11.0,1652.42,RP-020,Mahesh,Maintenance,24.1,UPI,2.3,63.0,3.52,208.0,0.0,2025-07-23 05:13:00
VMX-11081,VM-260,Mumbai,College,12-02-2025,03:29:00,P-109,Doritos,Snacks,24.24,79.0,76.0,3.0,1842.24,RP-020,Mahesh,Working,14.9,UPI,4.1,56.0,3.73,77.0,0.0,2025-02-12 03:29:00
VMX-11082,VM-138,Delhi,College,09-07-2025,07:20:00,P-102,Bisleri Water,Drinks,98.74,123.0,104.0,19.0,10268.96,RP-006,Mahesh,Working,20.0,Cash,3.3,40.0,4.14,339.0,1.0,2025-07-09 07:20:00
VMX-11083,VM-173,Bangalore,Mall,10-02-2025,10:07:00,P-100,Lays Classic,Snacks,11.48,126.0,125.0,1.0,1435.0,RP-012,Rahul,Low Power,16.6,Card,3.0,56.0,2.13,477.0,1.0,2025-02-10 10:07:00
VMX-11084,VM-282,Hyderabad,Office,08-03-2025,14:38:00,P-101,Pepsi Can,Drinks,117.1,200.0,194.0,6.0,22717.4,RP-019,Deepa,Maintenance,10.4,Cash,4.0,106.0,1.26,54.0,1.0,2025-03-08 14:38:00
VMX-11085,VM-105,Delhi,Metro Station,05-06-2025,23:00:00,P-104,Red Bull,Drinks,144.03,179.0,173.0,6.0,24917.19,RP-004,Mahesh,Low Power,15.2,Cash,4.6,54.0,1.18,363.0,1.0,2025-06-05 23:00:00
VMX-11086,VM-173,Pune,Metro Station,18-02-2025,07:41:00,P-101,Pepsi Can,Drinks,20.08,96.0,76.0,20.0,1526.08,RP-006,Fatima,Low Power,15.2,Cash,4.7,87.0,3.27,125.0,0.0,2025-02-18 07:41:00
VMX-11087,VM-296,Hyderabad,College,28-07-2025,15:36:00,P-105,Dettol Wipe,Hygiene,64.31,28.0,27.0,1.0,1736.37,RP-013,Rahul,Low Power,24.1,Card,2.2,69.0,2.55,274.0,1.0,2025-07-28 15:36:00
VMX-11088,VM-065,Delhi,Mall,03-09-2025,16:17:00,P-104,Red Bull,Drinks,16.17,198.0,191.0,7.0,3088.47,RP-007,Rahul,Low Power,14.6,Card,4.9,47.0,4.45,60.0,0.0,2025-09-03 16:17:00
VMX-11089,VM-112,Bangalore,Office,21-06-2025,10:00:00,P-106,Snickers Bar,Snacks,78.71,116.0,111.0,5.0,8736.81,RP-001,Ravi,Low Power,13.2,UPI,2.9,16.0,4.6,144.0,1.0,2025-06-21 10:00:00
VMX-11090,VM-294,Delhi,Mall,01-02-2025,20:11:00,P-101,Pepsi Can,Drinks,74.31,85.0,80.0,5.0,5944.8,RP-008,Suresh,Low Power,15.0,Cash,2.2,94.0,4.15,342.0,0.0,2025-02-01 20:11:00
VMX-11091,VM-277,Pune,Hospital,06-05-2025,00:40:00,P-106,Snickers Bar,Snacks,127.45,31.0,20.0,11.0,2549.0,RP-017,Anita,Working,10.2,Cash,2.3,50.0,2.78,456.0,0.0,2025-05-06 00:40:00
VMX-11092,VM-289,Pune,Metro Station,22-08-2025,10:48:00,P-109,Doritos,Snacks,139.85,92.0,82.0,10.0,11467.7,RP-015,Deepa,Maintenance,22.9,Cash,2.5,94.0,3.37,266.0,1.0,2025-08-22 10:48:00
VMX-11093,VM-092,Kolkata,College,03-08-2025,21:51:00,P-102,Bisleri Water,Drinks,65.33,79.0,72.0,7.0,4703.76,RP-005,Rajesh,Low Power,15.3,Cash,2.2,59.0,4.93,62.0,0.0,2025-08-03 21:51:00
VMX-11094,VM-282,Hyderabad,Mall,26-06-2025,05:14:00,P-100,Lays Classic,Snacks,137.03,49.0,47.0,2.0,6440.41,RP-007,Kiran,Maintenance,24.4,Cash,3.9,77.0,3.9,137.0,0.0,2025-06-26 05:14:00
VMX-11095,VM-251,Delhi,College,25-09-2025,18:58:00,P-105,Dettol Wipe,Hygiene,136.97,154.0,51.0,3.0,20682.47,RP-012,Rahul,Working,16.5,Cash,3.5,27.0,3.14,220.0,0.0,2025-09-25 18:58:00
VMX-11096,VM-049,Mumbai,Metro Station,29-08-2025,05:45:00,P-109,Doritos,Snacks,133.3,165.0,151.0,14.0,20128.3,RP-017,Mahesh,Maintenance,10.8,UPI,4.8,61.0,3.14,463.0,0.0,2025-08-29 05:45:00
VMX-11097,VM-298,Mumbai,Mall,21-03-2025,16:58:00,P-101,Pepsi Can,Drinks,86.65,116.0,97.0,19.0,8405.05,RP-017,Anita,Low Power,24.4,UPI,4.6,84.0,1.38,313.0,0.0,2025-03-21 16:58:00
VMX-11098,VM-283,Bangalore,Metro Station,01-01-2025,01:11:00,P-102,Bisleri Water,Drinks,111.13,142.0,137.0,5.0,15224.81,RP-010,Fatima,Working,19.4,Cash,2.4,19.0,1.24,95.0,1.0,2025-01-01 01:11:00
VMX-11099,VM-269,Delhi,College,19-04-2025,23:08:00,P-104,Red Bull,Drinks,78.22,91.0,71.0,20.0,5553.62,RP-003,Kiran,Low Power,18.7,Card,2.6,1.0,3.69,426.0,0.0,2025-04-19 23:08:00
VMX-11100,VM-077,Bangalore,Mall,22-05-2025,22:44:00,P-102,Bisleri Water,Drinks,15.06,73.0,72.0,1.0,1084.32,RP-005,Rajesh,Low Power,15.4,Cash,4.1,13.0,1.97,417.0,0.0,2025-05-22 22:44:00
VMX-11101,VM-025,Mumbai,Office,17-02-2025,13:21:00,P-100,Lays Classic,Snacks,135.79,53.0,37.0,16.0,5024.23,RP-013,Suresh,Working,20.2,Cash,3.0,101.0,3.38,474.0,1.0,2025-02-17 13:21:00
VMX-11102,VM-115,Bangalore,College,19-02-2025,19:34:00,P-107,Colgate Mini,Hygiene,74.34,121.0,103.0,18.0,7657.02,RP-001,Amit,Maintenance,11.3,Card,4.7,87.0,4.91,87.0,1.0,2025-02-19 19:34:00
VMX-11103,VM-272,Bangalore,College,23-03-2025,18:47:00,P-104,Red Bull,Drinks,62.94,175.0,174.0,1.0,10951.56,RP-001,Anita,Working,22.6,Card,3.6,35.0,1.27,248.0,1.0,2025-03-23 18:47:00
VMX-11104,VM-008,Pune,College,02-03-2025,13:31:00,P-102,Bisleri Water,Drinks,31.12,40.0,34.0,6.0,1058.08,RP-012,Kiran,Maintenance,23.3,UPI,4.5,116.0,2.57,435.0,0.0,2025-03-02 13:31:00
VMX-11105,VM-202,Chennai,Office,13-02-2025,18:32:00,P-106,Snickers Bar,Snacks,42.74,120.0,116.0,4.0,4957.84,RP-002,Anita,Maintenance,14.3,UPI,2.9,4.0,2.76,270.0,1.0,2025-02-13 18:32:00
VMX-11106,VM-177,Hyderabad,Office,26-04-2025,18:26:00,P-103,Oreo Pack,Snacks,105.88,174.0,168.0,6.0,17787.84,RP-020,Kiran,Working,16.8,Cash,4.5,49.0,1.54,477.0,0.0,2025-04-26 18:26:00
VMX-11107,VM-071,Kolkata,Office,21-04-2025,13:42:00,P-101,Pepsi Can,Drinks,51.37,57.0,49.0,8.0,2517.13,RP-018,Deepa,Low Power,20.1,Cash,4.0,108.0,3.05,70.0,1.0,2025-04-21 13:42:00
VMX-11108,VM-123,Delhi,Office,28-07-2025,04:40:00,P-109,Doritos,Snacks,143.05,178.0,175.0,3.0,25033.75,RP-003,Rahul,Maintenance,20.2,UPI,2.7,71.0,2.36,172.0,0.0,2025-07-28 04:40:00
VMX-11109,VM-121,Bangalore,Mall,30-01-2025,11:34:00,P-104,Red Bull,Drinks,142.61,67.0,56.0,11.0,7986.16,RP-009,Suresh,Working,22.1,Cash,2.2,90.0,4.34,484.0,1.0,2025-01-30 11:34:00
VMX-11110,VM-289,Delhi,Office,28-08-2025,23:24:00,P-106,Snickers Bar,Snacks,13.92,88.0,77.0,11.0,1071.84,RP-016,Deepa,Low Power,16.0,Card,4.7,102.0,4.96,419.0,1.0,2025-08-28 23:24:00
VMX-11111,VM-139,Mumbai,Hospital,09-07-2025,18:30:00,P-103,Oreo Pack,Snacks,60.47,81.0,68.0,13.0,4111.96,RP-020,Fatima,Low Power,24.4,Cash,3.3,115.0,2.12,90.0,0.0,2025-07-09 18:30:00
VMX-11112,VM-157,Pune,College,05-01-2025,18:21:00,P-105,Dettol Wipe,Hygiene,49.98,25.0,8.0,17.0,399.84,RP-011,Amit,Low Power,18.9,UPI,4.4,47.0,3.3,253.0,1.0,2025-01-05 18:21:00
VMX-11113,VM-123,Chennai,Metro Station,21-08-2025,08:08:00,P-107,Colgate Mini,Hygiene,35.44,81.0,81.0,0.0,2870.64,RP-004,Anita,Working,15.8,UPI,2.2,85.0,4.81,383.0,0.0,2025-08-21 08:08:00
VMX-11114,VM-163,Chennai,Mall,01-03-2025,09:49:00,P-103,Oreo Pack,Snacks,120.97,60.0,47.0,13.0,5685.59,RP-002,Rajesh,Maintenance,16.2,Card,4.3,28.0,1.42,398.0,0.0,2025-03-01 09:49:00
VMX-11115,VM-183,Bangalore,Mall,11-09-2025,16:52:00,P-100,Lays Classic,Snacks,84.78,195.0,192.0,3.0,16277.76,RP-004,Ravi,Low Power,20.9,UPI,2.3,119.0,3.23,212.0,0.0,2025-09-11 16:52:00
VMX-11116,VM-259,Kolkata,Hospital,01-04-2025,13:56:00,P-103,Oreo Pack,Snacks,60.78,188.0,180.0,8.0,10940.4,RP-009,Anita,Maintenance,19.8,Card,3.5,14.0,2.99,379.0,0.0,2025-04-01 13:56:00
VMX-11117,VM-228,Mumbai,Hospital,17-03-2025,07:57:00,P-100,Lays Classic,Snacks,106.81,125.0,115.0,10.0,12283.15,RP-005,Rahul,Low Power,16.0,UPI,3.2,24.0,2.87,107.0,1.0,2025-03-17 07:57:00
VMX-11118,VM-225,Pune,College,02-07-2025,04:52:00,P-100,Lays Classic,Snacks,100.4,31.0,11.0,20.0,1104.4,RP-001,Deepa,Low Power,19.7,Card,5.0,4.0,1.1,127.0,1.0,2025-07-02 04:52:00
VMX-11119,VM-100,Hyderabad,Hospital,06-04-2025,10:29:00,P-102,Bisleri Water,Drinks,112.13,36.0,27.0,9.0,3027.51,RP-001,Rahul,Low Power,13.4,Card,4.1,15.0,4.08,0.0,1.0,2025-04-06 10:29:00
VMX-11120,VM-018,Bangalore,College,11-09-2025,05:58:00,P-108,Sprite Bottle,Drinks,122.86,197.0,195.0,2.0,23957.7,RP-007,Kiran,Maintenance,15.2,Card,2.5,99.0,2.56,419.0,0.0,2025-09-11 05:58:00
VMX-11121,VM-066,Delhi,Office,06-09-2025,07:22:00,P-109,Doritos,Snacks,100.28,167.0,147.0,20.0,14741.16,RP-020,Deepa,Maintenance,20.2,Cash,2.4,19.0,3.56,444.0,1.0,2025-09-06 07:22:00
VMX-11122,VM-187,Kolkata,Hospital,31-03-2025,00:18:00,P-103,Oreo Pack,Snacks,107.9,68.0,52.0,16.0,5610.8,RP-008,Deepa,Working,11.9,UPI,3.3,64.0,2.4,67.0,1.0,2025-03-31 00:18:00
VMX-11123,VM-096,Mumbai,Metro Station,24-08-2025,01:32:00,P-106,Snickers Bar,Snacks,22.83,32.0,15.0,17.0,342.45,RP-016,Ravi,Maintenance,22.1,Cash,3.1,12.0,1.06,113.0,0.0,2025-08-24 01:32:00
VMX-11124,VM-287,Delhi,Mall,24-04-2025,17:43:00,P-106,Snickers Bar,Snacks,23.97,185.0,168.0,17.0,4026.96,RP-003,Rajesh,Maintenance,21.9,Card,3.3,90.0,4.05,323.0,1.0,2025-04-24 17:43:00
VMX-11125,VM-108,Bangalore,Mall,15-05-2025,04:09:00,P-106,Snickers Bar,Snacks,76.99,103.0,89.0,14.0,6852.11,RP-005,Amit,Maintenance,17.6,Card,2.3,77.0,2.17,128.0,1.0,2025-05-15 04:09:00
VMX-11126,VM-182,Mumbai,College,05-04-2025,05:46:00,P-108,Sprite Bottle,Drinks,148.65,164.0,160.0,4.0,23784.0,RP-013,Amit,Maintenance,24.9,UPI,2.6,83.0,1.2,249.0,0.0,2025-04-05 05:46:00
VMX-11127,VM-140,Mumbai,Hospital,28-02-2025,17:03:00,P-107,Colgate Mini,Hygiene,131.03,82.0,80.0,2.0,10482.4,RP-009,Ravi,Working,10.1,Card,2.9,109.0,3.24,206.0,0.0,2025-02-28 17:03:00
VMX-11128,VM-206,Delhi,College,23-04-2025,12:11:00,P-108,Sprite Bottle,Drinks,55.35,23.0,21.0,2.0,1162.35,RP-017,Anita,Maintenance,16.0,Card,4.5,60.0,3.63,247.0,0.0,2025-04-23 12:11:00
VMX-11129,VM-292,Hyderabad,Mall,05-07-2025,10:16:00,P-105,Dettol Wipe,Hygiene,112.27,141.0,140.0,1.0,15717.8,RP-003,Deepa,Working,16.4,Card,2.8,9.0,3.26,394.0,1.0,2025-07-05 10:16:00
VMX-11130,VM-193,Pune,Mall,16-02-2025,18:46:00,P-105,Dettol Wipe,Hygiene,69.96,24.0,6.0,18.0,419.76,RP-019,Deepa,Low Power,18.2,UPI,4.4,7.0,2.91,50.0,0.0,2025-02-16 18:46:00
VMX-11131,VM-255,Hyderabad,Mall,08-01-2025,02:39:00,P-100,Lays Classic,Snacks,45.51,131.0,126.0,5.0,5734.26,RP-003,Amit,Low Power,11.1,Cash,3.7,96.0,3.87,367.0,1.0,2025-01-08 02:39:00
VMX-11132,VM-268,Mumbai,Mall,27-07-2025,01:36:00,P-107,Colgate Mini,Hygiene,84.48,185.0,171.0,14.0,14446.08,RP-003,Amit,Low Power,17.4,UPI,2.7,102.0,3.41,444.0,0.0,2025-07-27 01:36:00
VMX-11133,VM-296,Pune,Metro Station,24-08-2025,10:44:00,P-102,Bisleri Water,Drinks,71.3,119.0,119.0,0.0,8484.7,RP-020,Rajesh,Maintenance,18.2,UPI,2.7,81.0,4.74,373.0,1.0,2025-08-24 10:44:00
VMX-11134,VM-097,Hyderabad,Metro Station,15-07-2025,10:19:00,P-103,Oreo Pack,Snacks,26.14,43.0,23.0,20.0,601.22,RP-019,Deepa,Working,13.5,Cash,2.1,15.0,3.34,230.0,0.0,2025-07-15 10:19:00
VMX-11135,VM-234,Kolkata,Office,25-05-2025,18:40:00,P-105,Dettol Wipe,Hygiene,78.08,116.0,108.0,8.0,8432.64,RP-016,Mahesh,Maintenance,10.7,Cash,3.3,71.0,2.86,206.0,1.0,2025-05-25 18:40:00
VMX-11136,VM-230,Pune,Hospital,25-07-2025,09:36:00,P-108,Unknown,Drinks,103.15,131.0,116.0,15.0,11965.4,RP-010,Ravi,Low Power,22.2,UPI,4.7,54.0,3.76,67.0,1.0,2025-07-25 09:36:00
VMX-11137,VM-113,Mumbai,Mall,30-06-2025,10:44:00,P-105,Dettol Wipe,Hygiene,14.62,124.0,117.0,7.0,1710.54,RP-002,Rahul,Maintenance,15.8,UPI,3.7,78.0,1.75,287.0,1.0,2025-06-30 10:44:00
VMX-11138,VM-195,Bangalore,Office,03-07-2025,04:36:00,P-101,Pepsi Can,Drinks,25.39,182.0,164.0,18.0,4163.96,RP-007,Mahesh,Maintenance,15.6,UPI,4.2,22.0,2.47,106.0,0.0,2025-07-03 04:36:00
VMX-11139,VM-041,Kolkata,Office,07-08-2025,09:15:00,P-108,Sprite Bottle,Drinks,32.55,125.0,119.0,6.0,3873.45,RP-020,Anita,Maintenance,19.3,Card,4.5,97.0,2.34,251.0,1.0,2025-08-07 09:15:00
VMX-11140,VM-135,Kolkata,Office,02-06-2025,10:48:00,P-104,Red Bull,Drinks,67.95,131.0,124.0,7.0,8425.8,RP-008,Anita,Maintenance,13.9,Cash,4.4,39.0,3.45,252.0,0.0,2025-06-02 10:48:00
VMX-11141,VM-146,Bangalore,Metro Station,22-05-2025,18:28:00,P-109,Doritos,Snacks,43.94,200.0,192.0,8.0,8436.48,RP-009,Kiran,Low Power,10.3,Card,4.5,89.0,3.25,124.0,0.0,2025-05-22 18:28:00
VMX-11142,VM-245,Delhi,Mall,07-03-2025,19:46:00,P-100,Lays Classic,Snacks,93.06,148.0,135.0,13.0,12563.1,RP-019,Fatima,Maintenance,21.6,Card,3.7,119.0,2.08,177.0,0.0,2025-03-07 19:46:00
VMX-11143,VM-089,Hyderabad,Hospital,08-03-2025,01:44:00,P-101,Pepsi Can,Drinks,145.43,166.0,152.0,14.0,22105.36,RP-002,Rajesh,Low Power,14.5,Card,3.0,36.0,3.52,451.0,1.0,2025-03-08 01:44:00
VMX-11144,VM-006,Hyderabad,Office,06-03-2025,01:15:00,P-105,Dettol Wipe,Hygiene,57.13,169.0,165.0,4.0,9426.45,RP-009,Rahul,Low Power,22.7,UPI,4.8,18.0,3.89,164.0,0.0,2025-03-06 01:15:00
VMX-11145,VM-237,Chennai,Hospital,11-03-2025,03:13:00,P-100,Lays Classic,Snacks,29.8,111.0,108.0,3.0,3218.4,RP-012,Fatima,Maintenance,18.9,Cash,3.0,43.0,3.51,479.0,1.0,2025-03-11 03:13:00
VMX-11146,VM-185,Pune,Office,22-04-2025,02:16:00,P-100,Lays Classic,Snacks,87.75,130.0,128.0,2.0,11232.0,RP-007,Anita,Maintenance,14.9,UPI,2.7,9.0,1.89,327.0,1.0,2025-04-22 02:16:00
VMX-11147,VM-070,Hyderabad,Mall,08-04-2025,13:10:00,P-100,Lays Classic,Snacks,133.9,95.0,90.0,5.0,12051.0,RP-007,Anita,Low Power,14.4,UPI,3.2,83.0,1.43,204.0,0.0,2025-04-08 13:10:00
VMX-11148,VM-015,Hyderabad,Metro Station,22-07-2025,17:53:00,P-107,Colgate Mini,Hygiene,109.99,126.0,110.0,16.0,12098.9,RP-011,Amit,Maintenance,22.9,UPI,4.3,6.0,1.61,462.0,0.0,2025-07-22 17:53:00
VMX-11149,VM-020,Chennai,Mall,27-08-2025,08:12:00,P-107,Colgate Mini,Unknown,71.34,93.0,91.0,2.0,6491.94,RP-011,Mahesh,Working,13.4,UPI,4.8,20.0,1.65,336.0,1.0,2025-08-27 08:12:00
VMX-11150,VM-082,Bangalore,Mall,22-06-2025,23:55:00,P-106,Snickers Bar,Snacks,64.72,66.0,52.0,14.0,3365.44,RP-005,Fatima,Working,19.4,Cash,2.0,2.0,1.54,255.0,0.0,2025-06-22 23:55:00
VMX-11151,VM-130,Mumbai,Hospital,12-01-2025,07:12:00,P-103,Oreo Pack,Snacks,38.62,22.0,15.0,7.0,579.3,RP-015,Ravi,Maintenance,20.4,Card,4.7,100.0,2.83,467.0,0.0,2025-01-12 07:12:00
VMX-11152,VM-030,Bangalore,Office,27-06-2025,10:15:00,P-107,Colgate Mini,Hygiene,129.83,56.0,41.0,15.0,5323.03,RP-012,Suresh,Working,11.2,Cash,4.7,94.0,3.33,444.0,1.0,2025-06-27 10:15:00
VMX-11153,VM-068,Hyderabad,Mall,19-05-2025,22:58:00,P-107,Colgate Mini,Hygiene,33.89,27.0,21.0,6.0,711.69,RP-018,Anita,Low Power,11.0,Card,4.4,102.0,5.0,444.0,0.0,2025-05-19 22:58:00
VMX-11154,VM-192,Hyderabad,Hospital,09-03-2025,09:03:00,P-101,Pepsi Can,Drinks,73.59,61.0,56.0,5.0,4121.04,RP-014,Anita,Maintenance,23.2,UPI,4.2,13.0,4.33,293.0,1.0,2025-03-09 09:03:00
VMX-11155,VM-198,Chennai,Metro Station,04-04-2025,08:03:00,P-105,Dettol Wipe,Hygiene,125.48,125.0,122.0,3.0,15308.56,RP-008,Fatima,Low Power,12.3,Card,3.4,18.0,2.36,496.0,0.0,2025-04-04 08:03:00
VMX-11156,VM-274,Chennai,Office,25-06-2025,12:25:00,P-102,Bisleri Water,Drinks,31.78,173.0,172.0,1.0,5466.16,RP-017,Amit,Working,17.3,Card,2.6,73.0,4.08,89.0,0.0,2025-06-25 12:25:00
VMX-11157,VM-263,Hyderabad,Mall,03-03-2025,16:29:00,P-101,Pepsi Can,Drinks,28.2,42.0,41.0,1.0,1156.2,RP-012,Fatima,Low Power,22.1,Card,3.8,85.0,4.67,87.0,1.0,2025-03-03 16:29:00
VMX-11158,VM-116,Pune,Mall,19-01-2025,20:59:00,P-100,Lays Classic,Snacks,130.81,144.0,135.0,9.0,17659.35,RP-012,Ravi,Maintenance,24.6,Card,2.8,45.0,1.71,212.0,0.0,2025-01-19 20:59:00
VMX-11159,VM-131,Bangalore,Mall,10-09-2025,12:47:00,P-107,Colgate Mini,Hygiene,24.28,64.0,60.0,4.0,1456.8,RP-018,Rajesh,Working,12.5,UPI,4.6,19.0,1.58,242.0,0.0,2025-09-10 12:47:00
VMX-11160,VM-100,Delhi,College,15-07-2025,06:58:00,P-106,Snickers Bar,Snacks,105.08,195.0,187.0,8.0,19649.96,RP-018,Suresh,Working,24.6,UPI,2.9,112.0,4.62,59.0,1.0,2025-07-15 06:58:00
VMX-11161,VM-238,Hyderabad,Mall,19-06-2025,00:17:00,P-108,Sprite Bottle,Drinks,127.69,147.0,131.0,16.0,16727.39,RP-001,Deepa,Maintenance,20.2,Card,4.1,9.0,3.45,497.0,1.0,2025-06-19 00:17:00
VMX-11162,VM-094,Mumbai,Hospital,12-05-2025,19:44:00,P-103,Oreo Pack,Snacks,120.32,134.0,119.0,15.0,14318.08,RP-007,Amit,Maintenance,21.1,UPI,2.7,23.0,2.81,304.0,1.0,2025-05-12 19:44:00
VMX-11163,VM-042,Mumbai,Office,20-03-2025,00:26:00,P-105,Dettol Wipe,Hygiene,121.27,60.0,49.0,11.0,5942.23,RP-018,Ravi,Working,22.1,Cash,2.1,47.0,3.29,130.0,0.0,2025-03-20 00:26:00
VMX-11164,VM-078,Pune,Office,30-07-2025,06:02:00,P-109,Doritos,Snacks,50.02,38.0,28.0,10.0,1400.56,RP-011,Rahul,Low Power,13.5,Cash,3.4,92.0,4.25,380.0,1.0,2025-07-30 06:02:00
VMX-11165,VM-039,Chennai,Office,22-01-2025,13:24:00,P-102,Bisleri Water,Drinks,125.73,95.0,90.0,5.0,11315.7,RP-020,Fatima,Working,19.7,Card,3.0,24.0,1.82,104.0,0.0,2025-01-22 13:24:00
VMX-11166,VM-115,Delhi,Mall,20-05-2025,18:34:00,P-108,Sprite Bottle,Drinks,116.44,30.0,29.0,1.0,3376.76,RP-003,Ravi,Working,22.8,Cash,4.8,22.0,4.13,240.0,1.0,2025-05-20 18:34:00
VMX-11167,VM-223,Pune,Hospital,03-10-2025,04:55:00,P-108,Sprite Bottle,Drinks,102.78,48.0,37.0,11.0,3802.86,RP-018,Rajesh,Low Power,14.5,Cash,2.3,74.0,1.44,217.0,1.0,2025-10-03 04:55:00
VMX-11168,VM-001,Hyderabad,Hospital,06-06-2025,04:53:00,P-108,Sprite Bottle,Drinks,85.21,119.0,110.0,9.0,9373.1,RP-006,Rahul,Maintenance,23.7,UPI,3.3,67.0,2.92,475.0,1.0,2025-06-06 04:53:00
VMX-11169,VM-205,Delhi,Office,25-07-2025,09:55:00,P-108,Sprite Bottle,Drinks,55.82,119.0,99.0,20.0,5526.18,RP-004,Rahul,Low Power,20.9,Cash,2.9,23.0,1.45,122.0,1.0,2025-07-25 09:55:00
VMX-11170,VM-033,Hyderabad,Office,09-01-2025,09:44:00,P-102,Bisleri Water,Drinks,35.07,69.0,64.0,5.0,2244.48,RP-006,Rahul,Low Power,18.0,Cash,2.8,62.0,4.75,500.0,0.0,2025-01-09 09:44:00
VMX-11171,VM-143,Pune,Metro Station,20-03-2025,13:37:00,P-101,Pepsi Can,Drinks,75.95,177.0,163.0,14.0,12379.85,RP-004,Amit,Maintenance,20.5,Cash,4.2,2.0,1.23,498.0,1.0,2025-03-20 13:37:00
VMX-11172,VM-179,Bangalore,Mall,02-01-2025,01:00:00,P-106,Snickers Bar,Snacks,67.37,196.0,191.0,5.0,12867.67,RP-018,Deepa,Working,18.2,Cash,4.6,0.0,2.29,73.0,1.0,2025-01-02 01:00:00
VMX-11173,VM-083,Mumbai,Metro Station,01-01-2025,11:35:00,P-102,Bisleri Water,Drinks,47.82,155.0,148.0,7.0,7077.36,RP-006,Rahul,Maintenance,10.9,UPI,3.2,89.0,2.73,471.0,1.0,2025-01-01 11:35:00
VMX-11174,VM-198,Delhi,Mall,16-04-2025,16:39:00,P-106,Snickers Bar,Snacks,140.7,78.0,73.0,5.0,10271.1,RP-007,Rajesh,Low Power,23.5,Cash,3.5,81.0,1.46,373.0,1.0,2025-04-16 16:39:00
VMX-11175,VM-056,Hyderabad,College,11-08-2025,17:19:00,P-102,Bisleri Water,Drinks,65.67,46.0,39.0,7.0,2561.13,RP-007,Amit,Maintenance,17.6,Cash,2.6,28.0,3.87,128.0,0.0,2025-08-11 17:19:00
VMX-11176,VM-033,Pune,Hospital,06-04-2025,14:47:00,P-108,Sprite Bottle,Drinks,128.88,77.0,66.0,11.0,8506.08,RP-011,Mahesh,Low Power,24.3,UPI,3.5,12.0,3.6,266.0,1.0,2025-04-06 14:47:00
VMX-11177,VM-137,Bangalore,College,25-09-2025,03:54:00,P-109,Doritos,Snacks,33.39,182.0,165.0,17.0,5509.35,RP-020,Amit,Low Power,19.1,UPI,2.4,117.0,3.01,106.0,1.0,2025-09-25 03:54:00
VMX-11178,VM-154,Chennai,Hospital,07-05-2025,17:44:00,P-109,Doritos,Snacks,68.66,156.0,136.0,20.0,9337.76,RP-006,Mahesh,Maintenance,22.3,Cash,4.1,48.0,2.47,470.0,1.0,2025-05-07 17:44:00
VMX-11179,VM-049,Bangalore,Office,01-07-2025,18:53:00,P-108,Sprite Bottle,Drinks,63.83,63.0,44.0,19.0,2808.52,RP-015,Suresh,Low Power,19.3,Card,3.7,20.0,2.37,164.0,1.0,2025-07-01 18:53:00
VMX-11180,VM-012,Mumbai,Office,02-06-2025,04:37:00,P-106,Snickers Bar,Snacks,97.96,22.0,8.0,14.0,783.68,RP-016,Amit,Maintenance,16.2,Card,5.0,38.0,1.25,274.0,1.0,2025-06-02 04:37:00
VMX-11181,VM-255,Chennai,Metro Station,23-08-2025,09:43:00,P-107,Colgate Mini,Hygiene,13.02,20.0,3.0,17.0,39.06,RP-012,Rahul,Maintenance,14.3,UPI,2.2,65.0,1.77,361.0,1.0,2025-08-23 09:43:00
VMX-11182,VM-176,Bangalore,Hospital,23-08-2025,16:40:00,P-101,Pepsi Can,Drinks,67.53,82.0,73.0,9.0,4929.69,RP-019,Fatima,Maintenance,11.6,UPI,2.9,74.0,3.13,185.0,1.0,2025-08-23 16:40:00
VMX-11183,VM-006,Chennai,Mall,21-09-2025,12:56:00,P-105,Dettol Wipe,Hygiene,11.38,174.0,169.0,5.0,1923.22,RP-004,Mahesh,Working,16.0,UPI,2.1,51.0,2.16,358.0,0.0,2025-09-21 12:56:00
VMX-11184,VM-267,Hyderabad,Mall,01-10-2025,08:22:00,P-100,Lays Classic,Snacks,127.58,65.0,57.0,8.0,7272.06,RP-001,Fatima,Maintenance,18.6,Cash,4.6,102.0,1.16,297.0,1.0,2025-10-01 08:22:00
VMX-11185,VM-055,Pune,Office,31-08-2025,08:53:00,P-108,Sprite Bottle,Drinks,87.15,178.0,159.0,19.0,13856.85,RP-014,Suresh,Working,12.2,UPI,4.4,117.0,1.05,50.0,0.0,2025-08-31 08:53:00
VMX-11186,VM-183,Delhi,Mall,22-02-2025,18:56:00,P-100,Lays Classic,Snacks,105.15,119.0,107.0,12.0,11251.05,RP-001,Deepa,Low Power,14.4,Card,2.8,72.0,1.77,274.0,1.0,2025-02-22 18:56:00
VMX-11187,VM-010,Delhi,College,03-09-2025,23:58:00,P-106,Snickers Bar,Snacks,72.84,33.0,17.0,16.0,1238.28,RP-017,Rajesh,Working,16.2,Card,4.4,3.0,1.45,434.0,0.0,2025-09-03 23:58:00
VMX-11188,VM-152,Chennai,Office,25-01-2025,07:17:00,P-106,Snickers Bar,Snacks,62.13,196.0,193.0,3.0,11991.09,RP-005,Rahul,Maintenance,24.1,UPI,3.5,85.0,2.37,266.0,1.0,2025-01-25 07:17:00
VMX-11189,VM-166,Chennai,Metro Station,14-03-2025,04:07:00,P-105,Dettol Wipe,Hygiene,33.08,29.0,17.0,12.0,562.36,RP-020,Kiran,Low Power,12.1,UPI,4.3,23.0,4.76,142.0,0.0,2025-03-14 04:07:00
VMX-11190,VM-016,Chennai,Hospital,31-05-2025,14:50:00,P-109,Doritos,Snacks,11.11,80.0,74.0,6.0,822.14,RP-010,Rajesh,Low Power,14.6,UPI,4.1,41.0,2.49,164.0,1.0,2025-05-31 14:50:00
VMX-11191,VM-251,Kolkata,College,26-04-2025,10:00:00,P-105,Dettol Wipe,Hygiene,33.9,79.0,62.0,17.0,2101.8,RP-005,Anita,Low Power,20.9,Cash,2.3,89.0,4.32,355.0,0.0,2025-04-26 10:00:00
VMX-11192,VM-035,Delhi,Hospital,05-04-2025,02:59:00,P-100,Lays Classic,Snacks,113.74,120.0,116.0,4.0,13193.84,RP-008,Amit,Maintenance,24.5,UPI,2.5,98.0,2.08,378.0,0.0,2025-04-05 02:59:00
VMX-11193,VM-300,Delhi,Office,16-06-2025,05:11:00,P-109,Doritos,Snacks,58.51,102.0,92.0,10.0,5382.92,RP-006,Deepa,Working,20.7,UPI,2.3,14.0,4.91,217.0,1.0,2025-06-16 05:11:00
VMX-11194,VM-027,Pune,College,29-01-2025,10:58:00,P-105,Dettol Wipe,Hygiene,96.09,134.0,132.0,2.0,12683.88,RP-012,Anita,Maintenance,11.4,UPI,3.4,34.0,2.89,441.0,1.0,2025-01-29 10:58:00
VMX-11195,VM-152,Hyderabad,Hospital,13-08-2025,16:46:00,P-103,Oreo Pack,Snacks,59.93,56.0,47.0,9.0,2816.71,RP-004,Deepa,Maintenance,14.5,Card,3.4,33.0,2.16,358.0,0.0,2025-08-13 16:46:00
VMX-11196,VM-100,Hyderabad,Metro Station,01-10-2025,00:14:00,P-100,Lays Classic,Snacks,56.67,145.0,129.0,16.0,7310.43,RP-007,Kiran,Working,23.1,Cash,4.1,30.0,4.3,316.0,0.0,2025-10-01 00:14:00
VMX-11197,VM-090,Kolkata,Metro Station,17-09-2025,17:56:00,P-106,Snickers Bar,Snacks,141.09,151.0,136.0,15.0,19188.24,RP-003,Deepa,Working,17.2,UPI,2.6,36.0,4.31,272.0,0.0,2025-09-17 17:56:00
VMX-11198,VM-157,Mumbai,Office,04-03-2025,14:44:00,P-105,Dettol Wipe,Hygiene,105.8,100.0,95.0,5.0,10051.0,RP-007,Deepa,Maintenance,13.4,Card,2.2,65.0,3.26,104.0,1.0,2025-03-04 14:44:00
VMX-11199,VM-045,Delhi,Hospital,23-05-2025,12:31:00,P-106,Snickers Bar,Snacks,105.98,68.0,59.0,9.0,6252.82,RP-015,Kiran,Working,18.9,UPI,3.8,8.0,4.95,164.0,0.0,2025-05-23 12:31:00
VMX-11200,VM-221,Chennai,Office,12-05-2025,12:40:00,P-106,Snickers Bar,Snacks,29.12,174.0,156.0,18.0,4542.72,RP-002,Rahul,Maintenance,18.6,Cash,4.1,14.0,1.19,354.0,1.0,2025-05-12 12:40:00
VMX-11201,VM-175,Bangalore,Unknown,30-04-2025,21:45:00,P-107,Colgate Mini,Hygiene,41.9,24.0,7.0,17.0,293.3,RP-003,Fatima,Maintenance,16.1,Card,2.9,36.0,1.68,200.0,1.0,2025-04-30 21:45:00
VMX-11202,VM-235,Pune,Office,02-06-2025,19:48:00,P-104,Red Bull,Drinks,113.06,151.0,135.0,16.0,15263.1,RP-015,Amit,Maintenance,23.7,UPI,4.5,113.0,2.96,375.0,1.0,2025-06-02 19:48:00
VMX-11203,VM-037,Mumbai,Metro Station,27-01-2025,05:09:00,P-108,Sprite Bottle,Drinks,27.7,152.0,149.0,3.0,4127.3,RP-015,Fatima,Maintenance,19.9,Card,4.5,107.0,1.3,120.0,1.0,2025-01-27 05:09:00
VMX-11204,VM-008,Chennai,Metro Station,20-08-2025,02:29:00,P-108,Sprite Bottle,Drinks,85.66,183.0,164.0,19.0,14048.24,RP-017,Anita,Low Power,23.9,Cash,4.4,101.0,4.7,267.0,1.0,2025-08-20 02:29:00
VMX-11205,VM-112,Delhi,College,23-02-2025,02:11:00,P-102,Bisleri Water,Drinks,83.23,120.0,104.0,16.0,8655.92,RP-007,Fatima,Maintenance,15.1,UPI,4.5,14.0,4.1,345.0,0.0,2025-02-23 02:11:00
VMX-11206,VM-173,Pune,College,10-02-2025,08:58:00,P-109,Doritos,Snacks,148.05,145.0,128.0,17.0,18950.4,RP-001,Rahul,Maintenance,23.8,Card,3.7,108.0,1.67,103.0,1.0,2025-02-10 08:58:00
VMX-11207,VM-218,Mumbai,Metro Station,17-03-2025,17:55:00,P-107,Colgate Mini,Hygiene,90.79,114.0,104.0,10.0,9442.16,RP-007,Suresh,Low Power,11.3,Card,2.9,64.0,3.15,60.0,1.0,2025-03-17 17:55:00
VMX-11208,VM-203,Hyderabad,College,10-04-2025,04:43:00,P-100,Lays Classic,Snacks,117.63,191.0,181.0,10.0,21291.03,RP-004,Rahul,Working,21.8,Cash,2.0,109.0,3.13,486.0,1.0,2025-04-10 04:43:00
VMX-11209,VM-219,Hyderabad,Metro Station,04-03-2025,07:46:00,P-104,Red Bull,Drinks,28.82,100.0,89.0,11.0,2564.98,RP-002,Fatima,Low Power,22.4,Cash,4.6,91.0,1.49,195.0,1.0,2025-03-04 07:46:00
VMX-11210,VM-036,Chennai,Metro Station,25-08-2025,06:25:00,P-100,Lays Classic,Snacks,133.1,96.0,90.0,6.0,11979.0,RP-016,Suresh,Low Power,21.4,Cash,4.7,10.0,1.87,228.0,1.0,2025-08-25 06:25:00
VMX-11211,VM-171,Pune,Office,31-01-2025,22:00:00,P-109,Doritos,Snacks,44.35,110.0,103.0,7.0,4568.05,RP-014,Ravi,Low Power,19.5,UPI,3.4,31.0,1.34,221.0,1.0,2025-01-31 22:00:00
VMX-11212,VM-060,Hyderabad,Hospital,06-04-2025,11:22:00,P-106,Snickers Bar,Snacks,43.52,144.0,126.0,18.0,5483.52,RP-010,Suresh,Low Power,24.3,Card,2.1,17.0,4.35,172.0,1.0,2025-04-06 11:22:00
VMX-11213,VM-194,Mumbai,College,06-10-2025,19:26:00,P-107,Colgate Mini,Hygiene,35.44,27.0,22.0,5.0,779.68,RP-011,Suresh,Low Power,12.7,Cash,3.1,32.0,2.03,468.0,1.0,2025-10-06 19:26:00
VMX-11214,VM-105,Chennai,Metro Station,25-08-2025,10:40:00,P-101,Pepsi Can,Drinks,14.89,46.0,27.0,19.0,402.03,RP-010,Kiran,Low Power,10.6,UPI,4.9,4.0,1.76,336.0,0.0,2025-08-25 10:40:00
VMX-11215,VM-215,Bangalore,Hospital,16-05-2025,04:31:00,P-102,Bisleri Water,Drinks,78.66,74.0,74.0,0.0,5820.84,RP-005,Fatima,Working,13.9,UPI,4.0,58.0,1.46,436.0,0.0,2025-05-16 04:31:00
VMX-11216,VM-023,Mumbai,Hospital,30-07-2025,18:51:00,P-109,Doritos,Snacks,54.38,74.0,74.0,0.0,4024.12,RP-013,Anita,Maintenance,21.3,Card,4.6,80.0,4.86,51.0,0.0,2025-07-30 18:51:00
VMX-11217,VM-139,Kolkata,Office,18-09-2025,14:48:00,P-102,Bisleri Water,Drinks,80.79,91.0,72.0,19.0,5816.88,RP-012,Ravi,Maintenance,13.6,UPI,3.6,114.0,2.81,483.0,1.0,2025-09-18 14:48:00
VMX-11218,VM-062,Kolkata,College,06-08-2025,17:35:00,P-101,Pepsi Can,Drinks,73.49,70.0,70.0,0.0,5144.3,RP-013,Anita,Maintenance,21.5,Cash,2.6,26.0,3.36,439.0,0.0,2025-08-06 17:35:00
VMX-11219,VM-184,Pune,Mall,15-08-2025,20:47:00,P-108,Sprite Bottle,Drinks,79.08,160.0,145.0,15.0,11466.6,RP-008,Suresh,Low Power,14.3,UPI,3.3,106.0,2.0,169.0,0.0,2025-08-15 20:47:00
VMX-11220,VM-215,Hyderabad,Mall,09-04-2025,16:52:00,P-109,Doritos,Snacks,11.74,48.0,37.0,11.0,434.38,RP-018,Amit,Low Power,12.0,UPI,4.4,5.0,4.7,84.0,0.0,2025-04-09 16:52:00
VMX-11221,VM-069,Hyderabad,Office,02-07-2025,14:29:00,P-103,Oreo Pack,Snacks,135.22,176.0,175.0,1.0,23663.5,RP-009,Ravi,Working,10.8,Card,3.5,75.0,4.36,189.0,0.0,2025-07-02 14:29:00
VMX-11222,VM-039,Hyderabad,Metro Station,03-05-2025,17:41:00,P-109,Doritos,Snacks,40.11,89.0,78.0,11.0,3128.58,RP-016,Rahul,Low Power,11.5,Card,4.8,18.0,4.0,328.0,1.0,2025-05-03 17:41:00
VMX-11223,VM-131,Kolkata,Metro Station,19-03-2025,23:24:00,P-100,Lays Classic,Snacks,92.23,162.0,147.0,15.0,13557.81,RP-014,Suresh,Working,12.7,Cash,5.0,107.0,2.19,123.0,0.0,2025-03-19 23:24:00
VMX-11224,VM-052,Hyderabad,Metro Station,20-04-2025,05:26:00,P-104,Red Bull,Drinks,11.96,197.0,177.0,20.0,2116.92,RP-020,Mahesh,Working,12.9,UPI,3.6,12.0,3.75,160.0,0.0,2025-04-20 05:26:00
VMX-11225,VM-087,Hyderabad,Mall,18-08-2025,22:41:00,P-107,Colgate Mini,Hygiene,11.68,159.0,147.0,12.0,1716.96,RP-002,Mahesh,Maintenance,15.0,Cash,3.2,102.0,2.66,119.0,0.0,2025-08-18 22:41:00
VMX-11226,VM-239,Mumbai,Metro Station,16-01-2025,00:21:00,P-109,Doritos,Snacks,60.45,124.0,107.0,17.0,6468.15,RP-011,Mahesh,Working,11.4,Cash,2.4,102.0,3.25,56.0,0.0,2025-01-16 00:21:00
VMX-11227,VM-232,Bangalore,Mall,08-04-2025,01:41:00,P-107,Colgate Mini,Hygiene,40.27,138.0,136.0,2.0,5476.72,RP-003,Ravi,Working,18.1,UPI,3.7,95.0,3.04,88.0,1.0,2025-04-08 01:41:00
VMX-11228,VM-144,Delhi,Hospital,10-05-2025,10:55:00,P-107,Colgate Mini,Hygiene,29.95,50.0,50.0,0.0,1497.5,RP-004,Rajesh,Working,18.5,Card,4.4,8.0,2.9,53.0,1.0,2025-05-10 10:55:00
VMX-11229,VM-155,Chennai,Mall,16-03-2025,07:48:00,P-104,Red Bull,Drinks,52.9,124.0,123.0,1.0,6506.7,RP-006,Deepa,Working,11.4,UPI,2.0,43.0,1.72,350.0,1.0,2025-03-16 07:48:00
VMX-11230,VM-229,Kolkata,Hospital,20-05-2025,09:47:00,P-101,Pepsi Can,Drinks,29.87,190.0,190.0,0.0,5675.3,RP-006,Kiran,Maintenance,10.3,Card,2.5,82.0,3.5,211.0,0.0,2025-05-20 09:47:00
VMX-11231,VM-154,Delhi,Metro Station,10-02-2025,20:29:00,P-103,Oreo Pack,Snacks,139.21,140.0,127.0,13.0,17679.67,RP-001,Amit,Low Power,24.2,Card,3.1,69.0,2.4,245.0,0.0,2025-02-10 20:29:00
VMX-11232,VM-047,Bangalore,Hospital,13-06-2025,17:37:00,P-102,Bisleri Water,Drinks,24.81,167.0,164.0,3.0,4068.84,RP-018,Kiran,Maintenance,14.3,Card,4.4,113.0,2.65,295.0,1.0,2025-06-13 17:37:00
VMX-11233,VM-005,Pune,Metro Station,26-08-2025,12:03:00,P-108,Sprite Bottle,Drinks,104.43,52.0,46.0,6.0,4803.78,RP-009,Anita,Low Power,13.9,Card,4.2,56.0,4.28,335.0,0.0,2025-08-26 12:03:00
VMX-11234,VM-291,Bangalore,College,30-05-2025,19:54:00,P-109,Doritos,Snacks,25.33,28.0,13.0,15.0,329.29,RP-014,Anita,Working,10.8,Card,4.2,97.0,3.12,471.0,0.0,2025-05-30 19:54:00
VMX-11235,VM-143,Pune,Office,12-04-2025,10:14:00,P-106,Snickers Bar,Snacks,95.11,180.0,176.0,4.0,16739.36,RP-017,Kiran,Low Power,16.7,Cash,3.5,15.0,1.9,320.0,1.0,2025-04-12 10:14:00
VMX-11236,VM-086,Bangalore,Hospital,05-01-2025,05:04:00,P-105,Dettol Wipe,Hygiene,48.4,67.0,63.0,4.0,3049.2,RP-005,Mahesh,Low Power,23.5,Cash,4.6,97.0,1.87,81.0,0.0,2025-01-05 05:04:00
VMX-11237,VM-207,Mumbai,Mall,30-05-2025,23:45:00,P-100,Lays Classic,Snacks,86.8,116.0,109.0,7.0,9461.2,RP-019,Ravi,Maintenance,10.1,Card,3.6,98.0,4.11,96.0,0.0,2025-05-30 23:45:00
VMX-11238,VM-078,Kolkata,Mall,17-02-2025,12:36:00,P-104,Red Bull,Drinks,26.68,20.0,20.0,0.0,533.6,RP-005,Rajesh,Working,24.0,Card,4.5,86.0,3.13,445.0,1.0,2025-02-17 12:36:00
VMX-11239,VM-043,Kolkata,Metro Station,22-06-2025,09:34:00,P-109,Doritos,Snacks,16.26,22.0,5.0,17.0,81.3,RP-014,Rajesh,Low Power,15.8,Cash,2.2,117.0,3.39,480.0,1.0,2025-06-22 09:34:00
VMX-11240,VM-050,Pune,College,06-05-2025,14:05:00,P-103,Oreo Pack,Snacks,44.87,50.0,47.0,3.0,2108.89,RP-011,Ravi,Maintenance,19.1,Card,3.1,33.0,2.32,122.0,1.0,2025-05-06 14:05:00
VMX-11241,VM-036,Chennai,Mall,14-05-2025,21:00:00,P-102,Bisleri Water,Drinks,146.19,68.0,48.0,20.0,7017.12,RP-011,Suresh,Low Power,16.2,Cash,3.3,48.0,4.77,360.0,1.0,2025-05-14 21:00:00
VMX-11242,VM-076,Delhi,College,27-07-2025,13:28:00,P-104,Red Bull,Drinks,91.48,200.0,192.0,8.0,17564.16,RP-004,Mahesh,Maintenance,12.1,Card,4.2,103.0,1.56,444.0,0.0,2025-07-27 13:28:00
VMX-11243,VM-148,Hyderabad,Mall,24-04-2025,16:28:00,P-108,Sprite Bottle,Drinks,31.31,55.0,35.0,20.0,1095.85,RP-013,Amit,Working,18.0,Card,4.7,63.0,2.05,216.0,0.0,2025-04-24 16:28:00
VMX-11244,VM-082,Bangalore,Office,09-04-2025,13:19:00,P-107,Colgate Mini,Hygiene,41.84,111.0,91.0,20.0,3807.44,RP-015,Mahesh,Working,14.4,Cash,3.9,98.0,3.24,121.0,1.0,2025-04-09 13:19:00
VMX-11245,VM-168,Chennai,Metro Station,05-02-2025,20:11:00,P-101,Pepsi Can,Drinks,86.85,195.0,182.0,13.0,15806.7,RP-001,Anita,Maintenance,23.0,UPI,2.3,4.0,1.24,358.0,0.0,2025-02-05 20:11:00
VMX-11246,VM-066,Pune,Mall,13-01-2025,01:05:00,P-103,Oreo Pack,Snacks,17.75,129.0,116.0,13.0,2059.0,RP-017,Amit,Low Power,11.3,Cash,4.2,95.0,4.63,152.0,0.0,2025-01-13 01:05:00
VMX-11247,VM-065,Hyderabad,Office,05-02-2025,11:05:00,P-109,Doritos,Snacks,112.9,180.0,167.0,13.0,18854.3,RP-018,Deepa,Working,17.5,UPI,3.3,41.0,1.9,467.0,1.0,2025-02-05 11:05:00
VMX-11248,VM-215,Bangalore,Office,01-04-2025,04:28:00,P-104,Red Bull,Drinks,63.46,31.0,22.0,9.0,1396.12,RP-013,Mahesh,Working,19.3,UPI,2.7,46.0,3.0,430.0,0.0,2025-04-01 04:28:00
VMX-11249,VM-216,Hyderabad,Hospital,01-05-2025,11:35:00,P-104,Red Bull,Drinks,78.85,58.0,50.0,8.0,3942.5,RP-014,Fatima,Working,12.4,UPI,4.3,95.0,3.72,472.0,1.0,2025-05-01 11:35:00
VMX-11250,VM-199,Chennai,Hospital,20-07-2025,13:45:00,P-102,Bisleri Water,Drinks,65.19,20.0,4.0,16.0,260.76,RP-005,Amit,Low Power,24.8,Card,4.6,113.0,4.99,486.0,1.0,2025-07-20 13:45:00
VMX-11251,VM-042,Delhi,Mall,31-05-2025,15:29:00,P-108,Sprite Bottle,Drinks,129.88,89.0,70.0,19.0,9091.6,RP-019,Mahesh,Maintenance,13.1,Cash,2.1,119.0,1.44,311.0,1.0,2025-05-31 15:29:00
VMX-11252,VM-140,Kolkata,Mall,06-03-2025,07:20:00,P-108,Sprite Bottle,Drinks,89.19,0.0,93.0,4.0,8294.67,RP-010,Mahesh,Low Power,20.9,Card,4.3,70.0,1.61,106.0,0.0,2025-03-06 07:20:00
VMX-11253,VM-183,Bangalore,Office,10-05-2025,19:47:00,P-101,Pepsi Can,Drinks,57.08,183.0,170.0,13.0,9703.6,RP-009,Rahul,Working,10.3,UPI,4.0,35.0,4.2,379.0,0.0,2025-05-10 19:47:00
VMX-11254,VM-042,Pune,Mall,11-04-2025,17:35:00,P-101,Pepsi Can,Drinks,24.15,176.0,161.0,15.0,3888.15,RP-015,Suresh,Working,22.9,UPI,2.7,28.0,2.35,350.0,1.0,2025-04-11 17:35:00
VMX-11255,VM-142,Pune,Hospital,03-02-2025,16:33:00,P-108,Sprite Bottle,Drinks,132.42,148.0,143.0,5.0,18936.06,RP-018,Mahesh,Low Power,16.1,Cash,3.0,12.0,4.27,72.0,0.0,2025-02-03 16:33:00
VMX-11256,VM-143,Hyderabad,Mall,11-04-2025,21:47:00,P-101,Pepsi Can,Drinks,32.54,114.0,105.0,9.0,3416.7,RP-008,Mahesh,Working,20.6,Cash,2.9,95.0,4.8,267.0,0.0,2025-04-11 21:47:00
VMX-11257,VM-030,Bangalore,Mall,16-09-2025,12:03:00,P-103,Oreo Pack,Snacks,79.53,45.0,25.0,20.0,1988.25,RP-002,Suresh,Working,18.9,Card,4.5,79.0,3.42,75.0,0.0,2025-09-16 12:03:00
VMX-11258,VM-244,Kolkata,College,18-04-2025,09:58:00,P-101,Pepsi Can,Drinks,123.06,28.0,28.0,0.0,3445.68,RP-008,Ravi,Maintenance,17.4,Cash,3.8,59.0,4.05,334.0,1.0,2025-04-18 09:58:00
VMX-11259,VM-182,Delhi,Metro Station,18-07-2025,04:48:00,P-100,Lays Classic,Snacks,119.29,46.0,26.0,20.0,3101.54,RP-002,Fatima,Low Power,11.5,Card,2.9,81.0,2.87,318.0,1.0,2025-07-18 04:48:00
VMX-11260,VM-175,Bangalore,Office,09-02-2025,06:28:00,P-105,Dettol Wipe,Hygiene,138.98,180.0,177.0,3.0,24599.46,RP-017,Amit,Maintenance,11.8,UPI,4.8,71.0,3.11,494.0,1.0,2025-02-09 06:28:00
VMX-11261,VM-029,Delhi,Mall,28-08-2025,19:48:00,P-108,Sprite Bottle,Drinks,114.25,140.0,136.0,4.0,15538.0,RP-015,Ravi,Low Power,11.6,Cash,3.7,65.0,1.44,365.0,1.0,2025-08-28 19:48:00
VMX-11262,VM-252,Kolkata,College,16-07-2025,08:30:00,P-102,Bisleri Water,Drinks,28.17,71.0,52.0,19.0,1464.84,RP-018,Suresh,Low Power,15.1,Cash,2.1,112.0,2.68,492.0,0.0,2025-07-16 08:30:00
VMX-11263,VM-282,Chennai,Office,08-01-2025,21:46:00,P-100,Lays Classic,Snacks,35.49,93.0,76.0,17.0,2697.24,RP-015,Fatima,Working,10.2,Card,2.8,111.0,2.17,458.0,0.0,2025-01-08 21:46:00
VMX-11264,VM-020,Kolkata,Hospital,04-03-2025,12:37:00,P-103,Oreo Pack,Snacks,132.69,67.0,62.0,5.0,8226.78,RP-020,Kiran,Maintenance,15.3,UPI,2.8,85.0,2.89,249.0,1.0,2025-03-04 12:37:00
VMX-11265,VM-187,Delhi,Mall,06-05-2025,18:54:00,P-105,Dettol Wipe,Hygiene,19.28,178.0,175.0,3.0,3374.0,RP-003,Deepa,Working,21.0,UPI,4.7,105.0,1.58,87.0,0.0,2025-05-06 18:54:00
VMX-11266,VM-268,Kolkata,Office,06-07-2025,01:52:00,P-107,Colgate Mini,Hygiene,139.88,75.0,69.0,6.0,9651.72,RP-006,Anita,Working,20.5,Card,2.3,68.0,4.46,345.0,0.0,2025-07-06 01:52:00
VMX-11267,VM-006,Chennai,College,03-02-2025,07:01:00,P-104,Red Bull,Drinks,85.86,94.0,78.0,16.0,6697.08,RP-014,Rahul,Working,22.2,UPI,4.6,5.0,1.59,238.0,0.0,2025-02-03 07:01:00
VMX-11268,VM-207,Delhi,Mall,18-07-2025,22:18:00,P-106,Snickers Bar,Snacks,76.68,113.0,96.0,17.0,7361.28,RP-008,Rahul,Low Power,13.5,Card,2.3,0.0,2.3,469.0,0.0,2025-07-18 22:18:00
VMX-11269,VM-300,Kolkata,Hospital,21-03-2025,15:32:00,P-104,Red Bull,Drinks,137.69,127.0,119.0,8.0,16385.11,RP-004,Deepa,Low Power,13.7,UPI,3.0,97.0,4.66,106.0,0.0,2025-03-21 15:32:00
VMX-11270,VM-120,Pune,Office,18-06-2025,03:08:00,P-108,Sprite Bottle,Drinks,117.86,134.0,119.0,15.0,14025.34,RP-019,Rajesh,Maintenance,11.5,UPI,2.8,48.0,4.42,377.0,0.0,2025-06-18 03:08:00
VMX-11271,VM-150,Mumbai,Office,10-01-2025,04:18:00,P-109,Doritos,Snacks,74.66,78.0,66.0,12.0,4927.56,RP-009,Kiran,Low Power,17.0,Cash,3.1,56.0,1.41,285.0,0.0,2025-01-10 04:18:00
VMX-11272,VM-135,Kolkata,Hospital,05-07-2025,12:51:00,P-100,Lays Classic,Snacks,125.77,138.0,135.0,3.0,16978.95,RP-018,Suresh,Low Power,20.0,Cash,2.6,62.0,2.27,166.0,0.0,2025-07-05 12:51:00
VMX-11273,VM-167,Delhi,Hospital,04-06-2025,16:54:00,P-102,Bisleri Water,Drinks,134.41,95.0,93.0,2.0,12500.13,RP-006,Kiran,Working,12.4,Cash,3.0,98.0,4.01,400.0,1.0,2025-06-04 16:54:00
VMX-11274,VM-230,Mumbai,Hospital,22-09-2025,09:02:00,P-102,Bisleri Water,Drinks,135.09,67.0,50.0,17.0,6754.5,RP-009,Amit,Working,16.7,UPI,4.0,18.0,2.91,84.0,0.0,2025-09-22 09:02:00
VMX-11275,VM-071,Chennai,Metro Station,01-09-2025,13:44:00,P-105,Dettol Wipe,Hygiene,39.15,160.0,148.0,12.0,5794.2,RP-005,Suresh,Maintenance,16.5,Card,4.5,77.0,1.21,393.0,0.0,2025-09-01 13:44:00
VMX-11276,VM-172,Kolkata,Office,30-04-2025,05:03:00,P-104,Red Bull,Drinks,82.38,153.0,141.0,12.0,11615.58,RP-008,Anita,Working,15.2,Cash,4.1,120.0,4.34,445.0,0.0,2025-04-30 05:03:00
VMX-11277,VM-231,Mumbai,Office,17-06-2025,19:54:00,P-107,Colgate Mini,Hygiene,38,127.0,125.0,2.0,4750.0,RP-001,Deepa,Working,20.2,Card,3.0,57.0,1.23,292.0,1.0,2025-06-17 19:54:00
VMX-11278,VM-040,Pune,College,23-03-2025,13:54:00,P-107,Colgate Mini,Hygiene,109.5,108.0,100.0,8.0,10950.0,RP-008,Fatima,Low Power,12.2,Cash,3.4,110.0,2.61,478.0,0.0,2025-03-23 13:54:00
VMX-11279,VM-076,Mumbai,College,01-04-2025,05:41:00,P-107,Colgate Mini,Hygiene,112.01,66.0,65.0,1.0,7280.65,RP-004,Ravi,Low Power,22.5,Card,4.7,54.0,3.43,301.0,0.0,2025-04-01 05:41:00
VMX-11280,VM-148,Chennai,Metro Station,06-10-2025,11:07:00,P-106,Snickers Bar,Snacks,33.01,95.0,90.0,5.0,2970.9,RP-013,Rahul,Maintenance,13.5,UPI,2.5,13.0,4.34,346.0,0.0,2025-10-06 11:07:00
VMX-11281,VM-212,Pune,Metro Station,16-01-2025,05:47:00,P-103,Oreo Pack,Snacks,91.83,65.0,60.0,5.0,5509.8,RP-001,Ravi,Low Power,12.8,UPI,2.8,106.0,1.31,266.0,0.0,2025-01-16 05:47:00
VMX-11282,VM-100,Mumbai,College,11-02-2025,12:59:00,P-101,Pepsi Can,Drinks,73.08,24.0,18.0,6.0,1315.44,RP-011,Mahesh,Working,14.4,Cash,2.6,52.0,4.34,143.0,1.0,2025-02-11 12:59:00
VMX-11283,VM-143,Kolkata,Hospital,14-08-2025,05:36:00,P-104,Red Bull,Drinks,62.74,77.0,74.0,3.0,4642.76,RP-014,Suresh,Maintenance,10.1,Cash,4.9,4.0,3.97,437.0,1.0,2025-08-14 05:36:00
VMX-11284,VM-113,Delhi,Metro Station,16-06-2025,03:44:00,P-104,Red Bull,Drinks,18.52,109.0,90.0,19.0,1666.8,RP-008,Amit,Low Power,20.5,UPI,2.5,110.0,1.35,343.0,0.0,2025-06-16 03:44:00
VMX-11285,VM-220,Hyderabad,Mall,02-06-2025,18:52:00,P-106,Snickers Bar,Snacks,41.11,186.0,185.0,1.0,7605.35,RP-014,Kiran,Low Power,15.9,UPI,4.5,58.0,4.45,333.0,1.0,2025-06-02 18:52:00
VMX-11286,VM-192,Hyderabad,Hospital,16-05-2025,19:47:00,P-105,Dettol Wipe,Hygiene,146.81,170.0,155.0,15.0,22755.55,RP-001,Fatima,Maintenance,16.5,Cash,3.3,63.0,4.97,435.0,1.0,2025-05-16 19:47:00
VMX-11287,VM-088,Pune,College,22-02-2025,18:53:00,P-100,Lays Classic,Snacks,33.75,159.0,159.0,0.0,5366.25,RP-006,Amit,Working,23.6,UPI,4.6,30.0,3.48,193.0,1.0,2025-02-22 18:53:00
VMX-11288,VM-081,Chennai,Mall,26-04-2025,05:57:00,P-108,Sprite Bottle,Drinks,90.14,28.0,10.0,18.0,901.4,RP-008,Suresh,Working,10.1,Cash,2.7,8.0,1.16,464.0,1.0,2025-04-26 05:57:00
VMX-11289,VM-169,Kolkata,College,26-04-2025,10:18:00,P-105,Dettol Wipe,Hygiene,58.17,35.0,32.0,3.0,1861.44,RP-008,Kiran,Maintenance,17.6,Card,4.4,36.0,3.78,156.0,0.0,2025-04-26 10:18:00
VMX-11290,VM-084,Pune,Hospital,07-05-2025,12:58:00,P-103,Oreo Pack,Snacks,36.98,61.0,52.0,9.0,1922.96,RP-005,Mahesh,Maintenance,10.4,Card,4.2,68.0,5.0,168.0,0.0,2025-05-07 12:58:00
VMX-11291,VM-297,Hyderabad,Hospital,16-02-2025,05:56:00,P-102,Bisleri Water,Drinks,126.43,88.0,80.0,8.0,10114.4,RP-011,Rahul,Low Power,14.7,Card,3.8,17.0,4.81,110.0,0.0,2025-02-16 05:56:00
VMX-11292,VM-159,Pune,Office,08-02-2025,15:29:00,P-103,Oreo Pack,Snacks,145.38,122.0,116.0,6.0,16864.08,RP-009,Amit,Working,23.6,UPI,2.5,99.0,4.47,378.0,0.0,2025-02-08 15:29:00
VMX-11293,VM-093,Mumbai,Hospital,20-02-2025,18:08:00,P-109,Doritos,Snacks,38.44,134.0,124.0,10.0,4766.56,RP-003,Suresh,Working,17.2,Cash,4.2,16.0,4.78,487.0,1.0,2025-02-20 18:08:00
VMX-11294,VM-053,Bangalore,College,24-07-2025,08:24:00,P-107,Colgate Mini,Hygiene,54.59,190.0,174.0,16.0,9498.66,RP-020,Kiran,Working,16.7,Cash,2.1,73.0,3.37,387.0,1.0,2025-07-24 08:24:00
VMX-11295,VM-055,Hyderabad,Office,08-04-2025,05:45:00,P-105,Dettol Wipe,Hygiene,132.44,89.0,88.0,1.0,11654.72,RP-008,Deepa,Low Power,10.1,Cash,2.8,92.0,4.09,101.0,0.0,2025-04-08 05:45:00
VMX-11296,Unknown,Delhi,Mall,15-08-2025,15:58:00,P-104,Red Bull,Drinks,43.29,32.0,16.0,16.0,692.64,RP-009,Rajesh,Maintenance,24.6,UPI,4.1,32.0,4.44,128.0,0.0,2025-08-15 15:58:00
VMX-11297,VM-277,Kolkata,College,14-06-2025,22:59:00,P-108,Sprite Bottle,Drinks,86.34,85.0,65.0,20.0,5612.1,RP-019,Amit,Maintenance,23.9,Cash,2.9,69.0,2.93,71.0,1.0,2025-06-14 22:59:00
VMX-11298,VM-088,Pune,Metro Station,17-04-2025,07:48:00,P-107,Colgate Mini,Hygiene,98.77,167.0,161.0,6.0,15901.97,RP-018,Kiran,Low Power,11.4,Card,4.8,21.0,2.36,416.0,1.0,2025-04-17 07:48:00
VMX-11299,VM-270,Pune,Mall,15-09-2025,11:47:00,P-106,Snickers Bar,Snacks,48.49,153.0,143.0,10.0,6934.07,RP-018,Amit,Low Power,20.5,Card,4.4,17.0,2.62,138.0,0.0,2025-09-15 11:47:00
VMX-11300,VM-111,Kolkata,Office,28-03-2025,11:19:00,P-108,Sprite Bottle,Drinks,47.26,143.0,139.0,4.0,6569.14,RP-012,Ravi,Maintenance,15.9,Card,2.5,23.0,4.48,54.0,0.0,2025-03-28 11:19:00
VMX-11301,VM-154,Mumbai,Mall,27-07-2025,05:48:00,P-108,Sprite Bottle,Drinks,35.67,189.0,169.0,20.0,6028.23,RP-018,Kiran,Working,18.8,UPI,4.6,82.0,1.05,485.0,0.0,2025-07-27 05:48:00
VMX-11302,VM-090,Pune,College,28-05-2025,18:36:00,P-102,Bisleri Water,Drinks,44.4,90.0,88.0,2.0,3907.2,RP-001,Rahul,Maintenance,19.8,UPI,2.5,88.0,2.77,118.0,1.0,2025-05-28 18:36:00
VMX-11303,VM-095,Hyderabad,Hospital,04-07-2025,13:12:00,P-106,Snickers Bar,Snacks,10.03,107.0,106.0,1.0,1063.18,RP-010,Mahesh,Working,20.8,Card,2.2,94.0,4.04,344.0,0.0,2025-07-04 13:12:00
VMX-11304,VM-153,Kolkata,Hospital,01-04-2025,04:10:00,P-103,Oreo Pack,Snacks,61.9,71.0,54.0,17.0,3342.6,RP-003,Ravi,Maintenance,13.3,Cash,4.1,53.0,4.86,320.0,0.0,2025-04-01 04:10:00
VMX-11305,VM-057,Delhi,Hospital,24-07-2025,08:25:00,P-107,Colgate Mini,Hygiene,78.02,29.0,19.0,10.0,1482.38,RP-002,Rajesh,Low Power,23.1,UPI,2.8,90.0,3.1,231.0,0.0,2025-07-24 08:25:00
VMX-11306,VM-217,Hyderabad,Hospital,30-03-2025,06:17:00,P-100,Lays Classic,Snacks,90.14,78.0,64.0,14.0,5768.96,RP-014,Amit,Working,20.1,Cash,4.9,113.0,1.79,260.0,0.0,2025-03-30 06:17:00
VMX-11307,VM-223,Chennai,Mall,25-05-2025,22:05:00,P-100,Lays Classic,Snacks,100.01,178.0,170.0,8.0,17001.7,RP-007,Ravi,Low Power,15.2,UPI,2.3,95.0,1.79,141.0,1.0,2025-05-25 22:05:00
VMX-11308,VM-017,Mumbai,Mall,05-07-2025,15:26:00,P-107,Colgate Mini,Hygiene,102.19,119.0,103.0,16.0,10525.57,RP-009,Rahul,Low Power,12.7,Cash,4.5,112.0,2.71,85.0,1.0,2025-07-05 15:26:00
VMX-11309,VM-254,Pune,Metro Station,14-08-2025,00:05:00,P-105,Dettol Wipe,Hygiene,130.17,45.0,29.0,16.0,3774.93,RP-019,Suresh,Working,14.5,Cash,2.1,21.0,2.15,162.0,1.0,2025-08-14 00:05:00
VMX-11310,VM-138,Chennai,Hospital,12-09-2025,05:14:00,P-104,Red Bull,Drinks,47.33,88.0,86.0,2.0,4070.38,RP-011,Suresh,Maintenance,22.4,Card,2.8,72.0,4.04,55.0,0.0,2025-09-12 05:14:00
VMX-11311,VM-071,Mumbai,Metro Station,26-04-2025,12:53:00,P-105,Dettol Wipe,Hygiene,132.38,157.0,146.0,11.0,19327.48,RP-019,Mahesh,Low Power,20.3,Cash,2.6,55.0,3.94,186.0,0.0,2025-04-26 12:53:00
VMX-11312,VM-173,Delhi,Office,23-06-2025,07:32:00,P-100,Lays Classic,Snacks,147.1,20.0,1.0,19.0,147.1,RP-016,Anita,Working,11.4,Card,2.8,41.0,4.12,358.0,0.0,2025-06-23 07:32:00
VMX-11313,VM-219,Hyderabad,Office,01-10-2025,02:16:00,P-100,Lays Classic,Snacks,91.42,76.0,61.0,15.0,5576.62,RP-016,Kiran,Maintenance,11.4,Cash,3.4,116.0,3.09,191.0,0.0,2025-10-01 02:16:00
VMX-11314,VM-180,Mumbai,Office,05-10-2025,14:53:00,P-107,Colgate Mini,Hygiene,17.17,116.0,114.0,2.0,1957.38,RP-014,Rajesh,Working,20.2,UPI,4.3,51.0,3.21,464.0,0.0,2025-10-05 14:53:00
VMX-11315,VM-265,Delhi,Metro Station,23-09-2025,11:52:00,P-105,Dettol Wipe,Hygiene,102.28,197.0,195.0,2.0,19944.6,RP-019,Mahesh,Working,12.2,UPI,4.8,21.0,3.31,106.0,0.0,2025-09-23 11:52:00
VMX-11316,VM-121,Chennai,Hospital,17-07-2025,00:18:00,P-108,Sprite Bottle,Drinks,53.13,30.0,16.0,14.0,850.08,RP-014,Mahesh,Low Power,23.5,Cash,4.1,56.0,2.07,267.0,0.0,2025-07-17 00:18:00
VMX-11317,VM-012,Kolkata,Hospital,14-08-2025,21:13:00,P-103,Oreo Pack,Snacks,13.79,143.0,123.0,20.0,1696.17,RP-016,Ravi,Maintenance,24.0,Cash,4.2,53.0,2.64,489.0,1.0,2025-08-14 21:13:00
VMX-11318,VM-261,Delhi,Metro Station,09-01-2025,16:28:00,P-109,Doritos,Snacks,99.93,40.0,21.0,19.0,2098.53,RP-014,Deepa,Working,17.5,UPI,4.0,103.0,4.31,248.0,1.0,2025-01-09 16:28:00
VMX-11319,VM-258,Kolkata,Hospital,28-03-2025,22:32:00,P-103,Oreo Pack,Snacks,90.17,72.0,63.0,9.0,5680.71,RP-013,Mahesh,Maintenance,22.7,Card,3.0,2.0,4.38,376.0,1.0,2025-03-28 22:32:00
VMX-11320,VM-288,Mumbai,College,31-01-2025,08:41:00,P-109,Doritos,Snacks,29.33,50.0,36.0,14.0,1055.88,RP-018,Kiran,Maintenance,20.8,Cash,3.2,26.0,1.75,81.0,0.0,2025-01-31 08:41:00
VMX-11321,VM-298,Pune,Mall,31-08-2025,06:51:00,P-106,Snickers Bar,Snacks,116.82,167.0,167.0,0.0,19508.94,RP-017,Rahul,Working,20.1,Card,4.4,119.0,1.64,111.0,0.0,2025-08-31 06:51:00
VMX-11322,VM-004,Pune,Hospital,26-08-2025,02:29:00,P-106,Snickers Bar,Snacks,108.34,72.0,65.0,7.0,7042.1,RP-010,Rahul,Low Power,12.6,Card,2.9,3.0,1.82,406.0,0.0,2025-08-26 02:29:00
VMX-11323,VM-010,Hyderabad,Office,04-06-2025,21:40:00,P-101,Pepsi Can,Drinks,104.44,80.0,70.0,10.0,7310.8,RP-012,Rahul,Maintenance,24.7,UPI,2.1,48.0,3.4,82.0,1.0,2025-06-04 21:40:00
VMX-11324,VM-084,Chennai,Mall,13-05-2025,19:33:00,P-108,Sprite Bottle,Drinks,71.49,20.0,9.0,11.0,643.41,RP-018,Fatima,Maintenance,21.6,Card,4.4,103.0,1.22,125.0,0.0,2025-05-13 19:33:00
VMX-11325,VM-003,Mumbai,Hospital,30-08-2025,16:55:00,P-107,Colgate Mini,Hygiene,111.46,48.0,35.0,13.0,3901.1,RP-009,Suresh,Maintenance,11.7,Card,3.6,110.0,4.02,76.0,0.0,2025-08-30 16:55:00
VMX-11326,VM-048,Chennai,College,14-03-2025,20:32:00,P-106,Snickers Bar,Snacks,101.07,84.0,66.0,18.0,6670.62,RP-007,Rajesh,Working,11.7,Cash,4.8,19.0,2.65,202.0,0.0,2025-03-14 20:32:00
VMX-11327,VM-017,Pune,College,20-09-2025,20:34:00,P-107,Colgate Mini,Hygiene,133.18,72.0,72.0,0.0,9588.96,RP-015,Amit,Low Power,12.3,Cash,3.8,53.0,3.2,383.0,1.0,2025-09-20 20:34:00
VMX-11328,VM-265,Pune,Metro Station,10-01-2025,14:09:00,P-104,Red Bull,Drinks,127.94,103.0,103.0,0.0,13177.82,RP-011,Rahul,Working,19.6,UPI,3.9,11.0,1.3,326.0,0.0,2025-01-10 14:09:00
VMX-11329,VM-242,Mumbai,Hospital,17-07-2025,03:10:00,P-106,Snickers Bar,Snacks,141.19,195.0,192.0,3.0,27108.48,RP-005,Mahesh,Maintenance,10.5,Cash,4.5,30.0,3.5,283.0,0.0,2025-07-17 03:10:00
VMX-11330,VM-112,Chennai,Metro Station,16-05-2025,08:17:00,P-102,Bisleri Water,Drinks,149.2,127.0,121.0,6.0,18053.2,RP-013,Amit,Maintenance,13.8,Card,4.0,112.0,2.94,53.0,0.0,2025-05-16 08:17:00
VMX-11331,VM-192,Bangalore,Hospital,02-06-2025,05:42:00,P-102,Bisleri Water,Drinks,11.53,95.0,91.0,4.0,1049.23,RP-020,Mahesh,Maintenance,11.4,Cash,4.9,58.0,2.46,54.0,0.0,2025-06-02 05:42:00
VMX-11332,VM-128,Pune,Hospital,27-07-2025,22:03:00,P-108,Sprite Bottle,Drinks,137.33,165.0,151.0,14.0,20736.83,RP-015,Mahesh,Working,23.8,UPI,2.7,40.0,1.53,441.0,1.0,2025-07-27 22:03:00
VMX-11333,VM-041,Delhi,Metro Station,11-05-2025,16:48:00,P-100,Lays Classic,Snacks,59.27,76.0,63.0,13.0,3734.01,RP-015,Deepa,Low Power,20.2,Cash,4.6,105.0,3.81,480.0,0.0,2025-05-11 16:48:00
VMX-11334,VM-190,Chennai,Hospital,13-09-2025,07:33:00,P-101,Pepsi Can,Drinks,59.32,165.0,151.0,14.0,8957.32,RP-014,Amit,Working,24.4,Cash,3.3,48.0,2.61,287.0,1.0,2025-09-13 07:33:00
VMX-11335,VM-249,Kolkata,Mall,08-06-2025,18:52:00,P-104,Red Bull,Drinks,91.94,53.0,42.0,11.0,3861.48,RP-005,Mahesh,Low Power,12.8,Card,3.2,21.0,4.84,338.0,0.0,2025-06-08 18:52:00
VMX-11336,VM-209,Bangalore,Mall,21-08-2025,18:37:00,P-100,Lays Classic,Snacks,63.74,121.0,119.0,2.0,7585.06,RP-012,Kiran,Maintenance,24.8,Card,4.0,19.0,3.35,427.0,0.0,2025-08-21 18:37:00
VMX-11337,VM-238,Delhi,Hospital,24-07-2025,17:32:00,P-103,Oreo Pack,Snacks,54.89,161.0,146.0,15.0,8013.94,RP-015,Rahul,Working,15.6,UPI,2.0,15.0,1.99,318.0,0.0,2025-07-24 17:32:00
VMX-11338,VM-103,Pune,Metro Station,07-05-2025,03:20:00,P-100,Lays Classic,Snacks,83.26,84.0,65.0,19.0,5411.9,RP-007,Rahul,Working,12.3,Cash,3.2,3.0,1.02,84.0,1.0,2025-05-07 03:20:00
VMX-11339,VM-035,Kolkata,Office,24-07-2025,04:53:00,P-104,Red Bull,Drinks,16.95,188.0,174.0,14.0,2949.3,RP-008,Mahesh,Low Power,21.0,Card,2.2,38.0,1.47,154.0,1.0,2025-07-24 04:53:00
VMX-11340,VM-277,Mumbai,Office,29-08-2025,04:02:00,P-105,Dettol Wipe,Hygiene,31.32,182.0,165.0,17.0,5167.8,RP-013,Anita,Working,21.1,Card,4.8,17.0,2.19,55.0,1.0,2025-08-29 04:02:00
VMX-11341,VM-120,Chennai,Mall,29-01-2025,16:11:00,P-109,Doritos,Snacks,145.75,186.0,182.0,4.0,26526.5,RP-001,Rahul,Low Power,24.9,UPI,3.8,102.0,1.41,183.0,1.0,2025-01-29 16:11:00
VMX-11342,VM-190,Mumbai,Metro Station,18-01-2025,20:54:00,P-102,Bisleri Water,Drinks,138.15,165.0,148.0,17.0,20446.2,RP-005,Mahesh,Working,17.1,UPI,2.7,119.0,1.01,365.0,1.0,2025-01-18 20:54:00
VMX-11343,VM-149,Kolkata,College,20-06-2025,15:09:00,P-106,Snickers Bar,Snacks,24.07,154.0,141.0,13.0,3393.87,RP-010,Suresh,Low Power,17.4,Cash,4.1,40.0,1.9,87.0,0.0,2025-06-20 15:09:00
VMX-11344,VM-255,Mumbai,Hospital,19-02-2025,00:03:00,P-107,Colgate Mini,Hygiene,102.47,100.0,88.0,12.0,9017.36,RP-007,Amit,Working,17.4,UPI,2.2,53.0,1.34,344.0,0.0,2025-02-19 00:03:00
VMX-11345,VM-265,Mumbai,Mall,06-02-2025,18:12:00,P-100,Lays Classic,Snacks,30.53,105.0,86.0,19.0,2625.58,RP-007,Rajesh,Working,12.8,Card,2.6,37.0,4.41,208.0,1.0,2025-02-06 18:12:00
VMX-11346,VM-014,Mumbai,Metro Station,19-05-2025,15:27:00,P-107,Colgate Mini,Hygiene,50.13,175.0,175.0,0.0,8772.75,RP-014,Amit,Working,14.7,Cash,4.8,113.0,1.02,478.0,1.0,2025-05-19 15:27:00
VMX-11347,VM-286,Kolkata,Office,30-08-2025,20:02:00,P-106,Snickers Bar,Snacks,54.99,175.0,173.0,2.0,9513.27,RP-003,Rajesh,Maintenance,13.6,Card,2.5,68.0,3.37,90.0,1.0,2025-08-30 20:02:00
VMX-11348,VM-182,Pune,College,07-02-2025,17:50:00,P-105,Dettol Wipe,Hygiene,63.69,85.0,84.0,1.0,5349.96,RP-012,Deepa,Maintenance,21.1,Card,4.2,12.0,2.28,477.0,1.0,2025-02-07 17:50:00
VMX-11349,VM-060,Mumbai,College,07-07-2025,07:38:00,P-104,Red Bull,Drinks,47.97,178.0,166.0,12.0,7963.02,RP-016,Rajesh,Working,10.8,Cash,3.8,114.0,4.32,56.0,1.0,2025-07-07 07:38:00
VMX-11350,VM-128,Pune,Metro Station,22-05-2025,00:48:00,P-105,Dettol Wipe,Hygiene,134.99,50.0,33.0,17.0,4454.67,RP-005,Amit,Working,22.1,Cash,4.0,75.0,2.53,443.0,0.0,2025-05-22 00:48:00
VMX-11351,VM-011,Delhi,Hospital,24-07-2025,21:17:00,P-100,Lays Classic,Snacks,43.4,115.0,98.0,17.0,4253.2,RP-018,Fatima,Working,12.3,UPI,2.5,89.0,2.35,245.0,1.0,2025-07-24 21:17:00
VMX-11352,VM-214,Bangalore,Mall,02-05-2025,10:46:00,P-106,Snickers Bar,Snacks,109.3,72.0,66.0,6.0,7213.8,RP-002,Suresh,Maintenance,24.8,UPI,2.8,2.0,3.01,309.0,0.0,2025-05-02 10:46:00
VMX-11353,VM-087,Hyderabad,College,05-09-2025,01:38:00,P-106,Snickers Bar,Snacks,78.23,149.0,130.0,19.0,10169.9,RP-020,Rahul,Working,18.1,Card,4.5,80.0,4.54,194.0,0.0,2025-09-05 01:38:00
VMX-11354,VM-050,Chennai,Metro Station,19-07-2025,12:06:00,P-101,Pepsi Can,Drinks,22.86,194.0,190.0,4.0,4343.4,RP-009,Fatima,Low Power,18.4,UPI,2.5,51.0,1.96,386.0,0.0,2025-07-19 12:06:00
VMX-11355,VM-082,Bangalore,College,01-06-2025,14:51:00,P-101,Pepsi Can,Drinks,93.16,123.0,122.0,1.0,11365.52,RP-011,Suresh,Maintenance,23.6,Card,2.0,61.0,4.81,236.0,1.0,2025-06-01 14:51:00
VMX-11356,VM-071,Delhi,Mall,30-09-2025,21:57:00,P-104,Red Bull,Drinks,77.23,198.0,197.0,1.0,15214.31,RP-003,Rajesh,Working,14.3,Card,2.2,79.0,3.29,423.0,0.0,2025-09-30 21:57:00
VMX-11357,VM-209,Bangalore,Mall,28-07-2025,04:55:00,P-109,Doritos,Snacks,48.12,144.0,132.0,12.0,6351.84,RP-011,Rahul,Low Power,23.8,UPI,2.7,1.0,1.55,246.0,0.0,2025-07-28 04:55:00
VMX-11358,VM-230,Hyderabad,Mall,06-09-2025,17:58:00,P-108,Sprite Bottle,Drinks,52.17,53.0,42.0,11.0,2191.14,RP-013,Fatima,Low Power,10.7,Cash,3.2,5.0,2.58,172.0,1.0,2025-09-06 17:58:00
VMX-11359,VM-220,Chennai,College,14-02-2025,20:40:00,P-100,Lays Classic,Snacks,61.94,53.0,37.0,16.0,2291.78,RP-020,Fatima,Maintenance,11.8,Cash,3.8,75.0,1.47,134.0,0.0,2025-02-14 20:40:00
VMX-11360,VM-135,Chennai,Mall,11-03-2025,00:38:00,P-103,Oreo Pack,Snacks,99.47,56.0,45.0,11.0,4476.15,RP-007,Rajesh,Low Power,18.5,Card,3.8,29.0,4.43,344.0,0.0,2025-03-11 00:38:00
VMX-11361,VM-238,Chennai,Hospital,09-08-2025,01:08:00,P-106,Snickers Bar,Snacks,15.83,179.0,162.0,17.0,2564.46,RP-010,Deepa,Low Power,22.2,Card,3.8,17.0,1.18,196.0,1.0,2025-08-09 01:08:00
VMX-11362,VM-009,Delhi,Metro Station,16-02-2025,03:35:00,P-104,Red Bull,Drinks,139.6,77.0,61.0,16.0,8515.6,RP-004,Fatima,Maintenance,15.8,Card,3.1,27.0,2.13,479.0,1.0,2025-02-16 03:35:00
VMX-11363,VM-190,Bangalore,College,27-03-2025,19:50:00,P-105,Dettol Wipe,Hygiene,65.74,123.0,118.0,5.0,7757.32,RP-016,Rahul,Low Power,10.8,Card,3.2,1.0,1.94,465.0,1.0,2025-03-27 19:50:00
VMX-11364,VM-230,Hyderabad,Office,05-10-2025,13:01:00,P-101,Pepsi Can,Drinks,error,55.0,46.0,9.0,5681.92,RP-015,Amit,Low Power,23.5,UPI,2.0,25.0,2.41,82.0,1.0,2025-10-05 13:01:00
VMX-11365,VM-035,Mumbai,Mall,12-04-2025,21:00:00,P-108,Sprite Bottle,Drinks,61.12,38.0,27.0,11.0,1650.24,RP-003,Kiran,Low Power,22.1,UPI,3.3,44.0,3.11,342.0,0.0,2025-04-12 21:00:00
VMX-11366,VM-168,Chennai,Hospital,08-02-2025,06:15:00,P-105,Dettol Wipe,Hygiene,28.05,85.0,76.0,9.0,2131.8,RP-019,Anita,Working,20.6,UPI,4.2,46.0,1.86,398.0,1.0,2025-02-08 06:15:00
VMX-11367,VM-041,Kolkata,Metro Station,05-03-2025,18:59:00,P-107,Colgate Mini,Hygiene,91.69,101.0,87.0,14.0,7977.03,RP-019,Fatima,Low Power,16.5,Card,4.8,108.0,3.87,347.0,0.0,2025-03-05 18:59:00
VMX-11368,VM-166,Delhi,Metro Station,01-05-2025,06:56:00,P-106,Snickers Bar,Snacks,56.21,51.0,34.0,17.0,1911.14,RP-016,Anita,Maintenance,20.1,UPI,3.2,0.0,2.5,289.0,0.0,2025-05-01 06:56:00
VMX-11369,VM-278,Chennai,Mall,31-08-2025,23:05:00,P-102,Bisleri Water,Drinks,145.88,197.0,182.0,15.0,26550.16,RP-001,Ravi,Maintenance,12.8,Cash,3.8,55.0,2.96,161.0,0.0,2025-08-31 23:05:00
VMX-11370,VM-108,Pune,Hospital,19-04-2025,21:08:00,P-102,Bisleri Water,Drinks,106.63,174.0,159.0,15.0,16954.17,RP-010,Anita,Working,12.8,Card,4.8,41.0,1.96,133.0,1.0,2025-04-19 21:08:00
VMX-11371,VM-225,Mumbai,Mall,06-04-2025,08:10:00,P-107,Colgate Mini,Hygiene,62.65,171.0,151.0,20.0,9460.15,RP-020,Amit,Working,20.8,UPI,4.0,5.0,1.55,401.0,0.0,2025-04-06 08:10:00
VMX-11372,VM-097,Bangalore,Mall,03-02-2025,13:39:00,P-100,Lays Classic,Snacks,90.53,84.0,84.0,0.0,7604.52,RP-017,Anita,Low Power,12.1,UPI,3.5,9.0,3.42,318.0,0.0,2025-02-03 13:39:00
VMX-11373,VM-044,Chennai,Office,19-06-2025,10:55:00,P-109,Doritos,Snacks,11.27,192.0,177.0,15.0,1994.79,RP-011,Amit,Low Power,10.9,UPI,3.0,72.0,3.76,368.0,0.0,2025-06-19 10:55:00
VMX-11374,VM-202,Kolkata,Office,16-01-2025,00:45:00,P-103,Oreo Pack,Snacks,87.16,76.0,73.0,3.0,6362.68,RP-008,Suresh,Maintenance,12.3,UPI,5.0,92.0,4.12,115.0,1.0,2025-01-16 00:45:00
VMX-11375,VM-260,Delhi,College,08-02-2025,13:56:00,P-107,Colgate Mini,Hygiene,75.44,75.0,69.0,6.0,5205.36,RP-013,Kiran,Low Power,21.0,Cash,4.8,56.0,1.01,335.0,1.0,2025-02-08 13:56:00
VMX-11376,VM-258,Kolkata,Office,10-06-2025,05:39:00,P-100,Lays Classic,Snacks,43.33,28.0,18.0,10.0,779.94,RP-005,Anita,Working,20.9,Cash,3.9,101.0,3.83,422.0,0.0,2025-06-10 05:39:00
VMX-11377,VM-188,Pune,Mall,11-08-2025,15:50:00,P-102,Bisleri Water,Drinks,135.69,89.0,89.0,0.0,12076.41,RP-014,Rajesh,Low Power,12.1,Card,4.8,107.0,4.7,475.0,0.0,2025-08-11 15:50:00
VMX-11378,VM-183,Delhi,Hospital,08-04-2025,16:42:00,P-100,Lays Classic,Snacks,127.99,82.0,70.0,12.0,8959.3,RP-009,Kiran,Maintenance,11.1,Card,3.3,40.0,3.38,380.0,0.0,2025-04-08 16:42:00
VMX-11379,VM-278,Delhi,Office,06-09-2025,23:36:00,P-101,Pepsi Can,Drinks,83.18,75.0,57.0,18.0,4741.26,RP-020,Ravi,Low Power,19.0,Card,3.5,4.0,3.36,367.0,1.0,2025-09-06 23:36:00
VMX-11380,VM-214,Kolkata,Hospital,17-04-2025,04:52:00,P-105,Dettol Wipe,Hygiene,11.99,92.0,73.0,19.0,875.27,RP-010,Suresh,Working,12.0,Cash,4.9,32.0,4.57,101.0,0.0,2025-04-17 04:52:00
VMX-11381,VM-054,Chennai,Metro Station,01-10-2025,20:04:00,P-101,Pepsi Can,Drinks,31.97,160.0,142.0,18.0,4539.74,RP-010,Fatima,Low Power,13.4,Cash,2.0,9.0,1.73,280.0,1.0,2025-10-01 20:04:00
VMX-11382,VM-156,Mumbai,Office,29-09-2025,22:58:00,P-102,Bisleri Water,Drinks,29.25,69.0,51.0,18.0,1491.75,RP-006,Amit,Low Power,16.0,UPI,4.2,89.0,2.97,483.0,0.0,2025-09-29 22:58:00
VMX-11383,VM-030,Chennai,Metro Station,07-10-2025,20:30:00,P-102,Bisleri Water,Drinks,38.7,154.0,134.0,20.0,5185.8,RP-010,Ravi,Low Power,17.8,UPI,4.1,93.0,1.8,420.0,1.0,2025-10-07 20:30:00
VMX-11384,VM-275,Kolkata,Office,28-08-2025,23:36:00,P-109,Doritos,Snacks,99.94,122.0,113.0,9.0,11293.22,RP-013,Mahesh,Maintenance,14.9,UPI,4.1,79.0,2.08,446.0,1.0,2025-08-28 23:36:00
VMX-11385,VM-228,Bangalore,Mall,02-01-2025,19:54:00,P-103,Oreo Pack,Snacks,133.7,158.0,151.0,7.0,20188.7,RP-013,Ravi,Working,22.6,Cash,3.7,18.0,2.67,246.0,1.0,2025-01-02 19:54:00
VMX-11386,VM-231,Delhi,Metro Station,02-07-2025,10:46:00,P-102,Bisleri Water,Drinks,11.04,127.0,117.0,10.0,1291.68,RP-014,Anita,Low Power,17.5,Card,4.8,41.0,2.31,438.0,1.0,2025-07-02 10:46:00
VMX-11387,VM-003,Hyderabad,College,29-08-2025,13:17:00,P-107,Colgate Mini,Hygiene,59.29,64.0,56.0,8.0,3320.24,RP-013,Fatima,Low Power,15.1,UPI,4.4,109.0,1.53,399.0,0.0,2025-08-29 13:17:00
VMX-11388,VM-079,Bangalore,Office,11-05-2025,10:06:00,P-105,Dettol Wipe,Hygiene,19.98,117.0,106.0,11.0,2117.88,RP-010,Anita,Working,21.5,Card,3.8,119.0,2.18,123.0,0.0,2025-05-11 10:06:00
VMX-11389,VM-120,Kolkata,Office,09-01-2025,16:49:00,P-103,Oreo Pack,Snacks,84.1,156.0,126.0,13.0,12026.3,RP-016,Mahesh,Maintenance,11.0,Cash,4.9,52.0,1.78,368.0,1.0,2025-01-09 16:49:00
VMX-11390,VM-024,Kolkata,Office,30-07-2025,01:11:00,P-104,Red Bull,Drinks,31.54,74.0,58.0,16.0,1829.32,RP-002,Fatima,Maintenance,21.0,Cash,2.1,77.0,4.11,192.0,0.0,2025-07-30 01:11:00
VMX-11391,VM-244,Pune,Hospital,10-08-2025,20:04:00,P-103,Oreo Pack,Snacks,47.68,168.0,168.0,0.0,8010.24,RP-019,Rajesh,Working,22.6,UPI,5.0,71.0,2.07,157.0,1.0,2025-08-10 20:04:00
VMX-11392,VM-022,Mumbai,Mall,02-06-2025,10:58:00,P-106,Snickers Bar,Snacks,95.32,154.0,154.0,0.0,14679.28,RP-012,Kiran,Maintenance,17.4,Card,4.9,1.0,3.29,305.0,0.0,2025-06-02 10:58:00
VMX-11393,VM-222,Hyderabad,Mall,08-10-2025,01:08:00,P-109,Doritos,Snacks,45.17,24.0,14.0,10.0,632.38,RP-020,Anita,Low Power,12.2,Cash,4.4,11.0,2.42,321.0,0.0,2025-10-08 01:08:00
VMX-11394,VM-160,Bangalore,College,28-08-2025,06:54:00,P-105,Dettol Wipe,Hygiene,82.88,176.0,176.0,0.0,14586.88,RP-008,Ravi,Maintenance,21.2,Card,3.4,36.0,3.13,285.0,1.0,2025-08-28 06:54:00
VMX-11395,VM-218,Delhi,Office,04-02-2025,16:57:00,P-109,Doritos,Snacks,61.14,49.0,40.0,9.0,2445.6,RP-017,Amit,Working,10.1,Card,4.3,16.0,4.36,213.0,1.0,2025-02-04 16:57:00
VMX-11396,VM-113,Bangalore,Hospital,04-08-2025,05:15:00,P-108,Sprite Bottle,Drinks,122.84,90.0,87.0,3.0,10687.08,RP-001,Deepa,Maintenance,18.2,Card,3.9,35.0,1.66,265.0,1.0,2025-08-04 05:15:00
VMX-11397,VM-002,Mumbai,Hospital,16-08-2025,06:44:00,P-104,Red Bull,Unknown,139.93,73.0,70.0,3.0,9795.1,RP-006,Rahul,Working,19.9,Card,4.7,11.0,2.49,465.0,0.0,2025-08-16 06:44:00
VMX-11398,VM-186,Kolkata,Office,17-03-2025,12:52:00,P-107,Colgate Mini,Hygiene,85.72,58.0,49.0,9.0,4200.28,RP-019,Anita,Low Power,19.3,Card,4.5,119.0,2.68,128.0,0.0,2025-03-17 12:52:00
VMX-11399,VM-258,Pune,College,31-08-2025,03:28:00,P-102,Bisleri Water,Drinks,74.42,56.0,49.0,7.0,3646.58,RP-005,Amit,Working,17.1,Card,2.2,90.0,4.25,440.0,1.0,2025-08-31 03:28:00
VMX-11400,VM-283,Chennai,Hospital,18-08-2025,01:42:00,P-105,Dettol Wipe,Hygiene,125.35,158.0,138.0,20.0,17298.3,RP-015,Rahul,Low Power,20.5,Cash,3.9,56.0,2.68,210.0,1.0,2025-08-18 01:42:00
VMX-11401,VM-021,Kolkata,Hospital,04-10-2025,19:43:00,P-103,Oreo Pack,Snacks,93.07,39.0,22.0,17.0,2047.54,RP-007,Rajesh,Maintenance,11.0,Card,2.2,63.0,3.41,335.0,1.0,2025-10-04 19:43:00
VMX-11402,VM-282,Bangalore,Metro Station,19-07-2025,05:25:00,P-105,Dettol Wipe,Hygiene,81.39,175.0,155.0,20.0,12615.45,RP-009,Fatima,Maintenance,16.6,Cash,3.6,110.0,1.62,58.0,1.0,2025-07-19 05:25:00
VMX-11403,VM-093,Hyderabad,Metro Station,24-07-2025,21:06:00,P-106,Snickers Bar,Snacks,21.1,80.0,62.0,18.0,1308.2,RP-001,Deepa,Maintenance,11.3,Card,2.3,118.0,3.27,454.0,1.0,2025-07-24 21:06:00
VMX-11404,VM-206,Mumbai,Metro Station,08-09-2025,00:58:00,P-101,Pepsi Can,Drinks,81.5,54.0,54.0,0.0,4401.0,RP-002,Ravi,Working,16.8,Cash,2.7,99.0,1.59,334.0,0.0,2025-09-08 00:58:00
VMX-11405,VM-224,Delhi,Office,21-05-2025,22:32:00,P-106,Snickers Bar,Snacks,87.46,79.0,72.0,7.0,6297.12,RP-020,Rajesh,Working,13.6,UPI,2.1,62.0,2.31,311.0,1.0,2025-05-21 22:32:00
VMX-11406,VM-229,Hyderabad,Hospital,23-06-2025,11:44:00,P-108,Sprite Bottle,Drinks,119.61,77.0,71.0,6.0,8492.31,RP-015,Suresh,Maintenance,11.5,Cash,4.5,84.0,4.6,161.0,0.0,2025-06-23 11:44:00
VMX-11407,VM-017,Chennai,Mall,12-06-2025,14:43:00,P-105,Dettol Wipe,Hygiene,56.1,181.0,180.0,1.0,10098.0,RP-003,Fatima,Low Power,19.3,Card,4.6,28.0,3.07,413.0,1.0,2025-06-12 14:43:00
VMX-11408,VM-040,Chennai,College,03-10-2025,06:06:00,P-104,Red Bull,Drinks,16.26,114.0,98.0,16.0,1593.48,RP-010,Rajesh,Working,19.8,Card,2.3,19.0,4.74,381.0,1.0,2025-10-03 06:06:00
VMX-11409,VM-202,Kolkata,Metro Station,28-02-2025,10:40:00,P-100,Lays Classic,Snacks,37.78,157.0,143.0,14.0,5402.54,RP-020,Ravi,Maintenance,10.6,Card,3.3,111.0,2.8,278.0,0.0,2025-02-28 10:40:00
VMX-11410,VM-263,Chennai,Office,17-05-2025,11:27:00,P-102,Bisleri Water,Drinks,42.5,97.0,77.0,20.0,3272.5,RP-014,Rajesh,Maintenance,22.2,Cash,4.7,29.0,4.28,266.0,1.0,2025-05-17 11:27:00
VMX-11411,VM-164,Mumbai,Mall,22-04-2025,04:39:00,P-104,Red Bull,Drinks,124.02,36.0,23.0,13.0,2852.46,RP-016,Fatima,Maintenance,13.1,Cash,3.1,120.0,2.99,281.0,0.0,2025-04-22 04:39:00
VMX-11412,VM-261,Mumbai,Metro Station,13-08-2025,07:06:00,P-109,Doritos,Snacks,137.4,191.0,187.0,4.0,25693.8,RP-007,Mahesh,Working,18.5,Cash,3.0,47.0,4.69,388.0,1.0,2025-08-13 07:06:00
VMX-11413,VM-193,Kolkata,Office,31-03-2025,09:05:00,P-102,Bisleri Water,Drinks,149.43,78.0,71.0,7.0,10609.53,RP-003,Fatima,Low Power,19.4,UPI,3.6,74.0,2.73,249.0,0.0,2025-03-31 09:05:00
VMX-11414,VM-131,Mumbai,Mall,16-07-2025,15:45:00,P-107,Colgate Mini,Hygiene,137.45,96.0,87.0,9.0,11958.15,RP-004,Deepa,Maintenance,19.5,UPI,3.6,83.0,1.33,371.0,1.0,2025-07-16 15:45:00
VMX-11415,VM-002,Chennai,College,06-08-2025,02:28:00,P-104,Red Bull,Drinks,113.7,176.0,173.0,3.0,19670.1,RP-006,Amit,Working,17.7,Cash,3.2,70.0,1.29,477.0,1.0,2025-08-06 02:28:00
VMX-11416,VM-030,Delhi,Metro Station,03-09-2025,12:44:00,P-101,Pepsi Can,Drinks,41.91,96.0,88.0,8.0,3688.08,RP-009,Fatima,Working,20.4,UPI,2.9,94.0,4.98,352.0,0.0,2025-09-03 12:44:00
VMX-11417,VM-015,Kolkata,Mall,04-05-2025,06:49:00,P-108,Sprite Bottle,Drinks,66.71,190.0,170.0,20.0,11340.7,RP-014,Deepa,Maintenance,10.4,Card,3.9,49.0,3.83,145.0,0.0,2025-05-04 06:49:00
VMX-11418,VM-194,Mumbai,Hospital,20-08-2025,14:07:00,P-108,Sprite Bottle,Drinks,134.7,126.0,114.0,12.0,15355.8,RP-014,Ravi,Working,12.1,UPI,4.2,117.0,1.96,139.0,0.0,2025-08-20 14:07:00
VMX-11419,Unknown,Hyderabad,College,23-04-2025,08:39:00,P-102,Bisleri Water,Drinks,121.08,52.0,48.0,4.0,5811.84,RP-007,Rajesh,Low Power,18.3,UPI,3.5,79.0,3.96,98.0,1.0,2025-04-23 08:39:00
VMX-11420,VM-207,Hyderabad,Office,05-06-2025,08:52:00,P-107,Colgate Mini,Hygiene,96,103.0,99.0,4.0,9504.0,RP-010,Mahesh,Maintenance,12.5,Cash,4.3,44.0,1.25,205.0,1.0,2025-06-05 08:52:00
VMX-11421,VM-282,Mumbai,Mall,12-07-2025,01:07:00,P-105,Dettol Wipe,Hygiene,70.8,98.0,94.0,4.0,6655.2,RP-016,Amit,Low Power,13.3,Card,3.8,96.0,2.43,379.0,1.0,2025-07-12 01:07:00
VMX-11422,VM-249,Delhi,Hospital,22-03-2025,20:11:00,P-109,Doritos,Snacks,98.72,111.0,93.0,18.0,9180.96,RP-013,Anita,Working,14.5,Cash,2.1,118.0,4.43,455.0,1.0,2025-03-22 20:11:00
VMX-11423,VM-107,Kolkata,Office,02-02-2025,23:46:00,P-100,Lays Classic,Snacks,146.19,105.0,95.0,10.0,13888.05,RP-010,Anita,Maintenance,16.0,Cash,2.5,116.0,0.0,343.0,0.0,2025-02-02 23:46:00
VMX-11424,VM-185,Chennai,Hospital,03-02-2025,08:59:00,P-104,Red Bull,Drinks,75.64,81.0,74.0,7.0,5597.36,RP-003,Deepa,Maintenance,17.2,Card,4.5,19.0,2.43,108.0,1.0,2025-02-03 08:59:00
VMX-11425,VM-069,Kolkata,College,12-06-2025,06:04:00,P-109,Doritos,Snacks,74.12,152.0,138.0,14.0,10228.56,RP-010,Mahesh,Maintenance,14.8,Cash,3.3,83.0,2.74,98.0,0.0,2025-06-12 06:04:00
VMX-11426,VM-275,Mumbai,Mall,27-01-2025,01:06:00,P-100,Lays Classic,Snacks,107.77,115.0,99.0,16.0,10669.23,RP-003,Anita,Working,18.7,UPI,2.3,8.0,2.0,271.0,1.0,2025-01-27 01:06:00
VMX-11427,VM-281,Hyderabad,Metro Station,08-01-2025,15:51:00,P-108,Sprite Bottle,Drinks,error,181.0,178.0,3.0,12061.28,RP-015,Ravi,Working,19.2,UPI,3.9,40.0,2.69,115.0,1.0,2025-01-08 15:51:00
VMX-11428,VM-002,Bangalore,Hospital,08-10-2025,20:53:00,P-107,Colgate Mini,Hygiene,127.45,124.0,104.0,20.0,13254.8,RP-019,Suresh,Working,23.9,Card,2.2,120.0,2.05,411.0,0.0,2025-10-08 20:53:00
VMX-11429,VM-258,Mumbai,Office,10-04-2025,01:11:00,P-100,Lays Classic,Snacks,66.59,33.0,28.0,5.0,1864.52,RP-011,Mahesh,Maintenance,14.9,Cash,2.5,94.0,1.38,198.0,0.0,2025-04-10 01:11:00
VMX-11430,VM-132,Chennai,Metro Station,22-02-2025,10:04:00,P-100,Lays Classic,Snacks,66.52,142.0,141.0,1.0,9379.32,RP-019,Amit,Working,11.4,UPI,3.3,31.0,1.82,428.0,0.0,2025-02-22 10:04:00
VMX-11431,VM-119,Kolkata,Metro Station,20-01-2025,01:20:00,P-102,Bisleri Water,Drinks,29,54.0,46.0,8.0,1334.0,RP-005,Amit,Maintenance,12.6,UPI,3.1,83.0,1.11,389.0,0.0,2025-01-20 01:20:00
VMX-11432,VM-115,Pune,College,01-10-2025,09:13:00,P-101,Pepsi Can,Drinks,25.94,73.0,65.0,8.0,1686.1,RP-007,Suresh,Maintenance,12.6,Cash,3.6,14.0,4.19,131.0,0.0,2025-10-01 09:13:00
VMX-11433,VM-156,Bangalore,Metro Station,20-06-2025,04:13:00,P-109,Doritos,Snacks,45.58,125.0,116.0,9.0,5287.28,RP-013,Anita,Low Power,19.1,UPI,4.4,22.0,2.05,312.0,1.0,2025-06-20 04:13:00
VMX-11434,VM-233,Delhi,Hospital,02-07-2025,07:27:00,P-106,Snickers Bar,Snacks,37.07,64.0,63.0,1.0,2335.41,RP-008,Anita,Maintenance,18.6,Card,3.9,22.0,3.49,475.0,0.0,2025-07-02 07:27:00
VMX-11435,VM-190,Kolkata,Office,01-04-2025,12:25:00,P-105,Dettol Wipe,Hygiene,66.67,43.0,33.0,10.0,2200.11,RP-019,Ravi,Low Power,17.3,UPI,4.9,47.0,4.15,496.0,0.0,2025-04-01 12:25:00
VMX-11436,VM-190,Bangalore,Mall,23-02-2025,08:30:00,P-109,Doritos,Snacks,error,126.0,117.0,9.0,16176.42,RP-013,Rahul,Maintenance,15.6,UPI,4.6,99.0,4.97,188.0,1.0,2025-02-23 08:30:00
VMX-11437,VM-298,Delhi,Hospital,23-06-2025,06:35:00,P-106,Snickers Bar,Snacks,110.76,190.0,183.0,7.0,20269.08,RP-005,Rahul,Maintenance,23.3,Card,2.7,37.0,1.81,412.0,1.0,2025-06-23 06:35:00
VMX-11438,VM-042,Bangalore,Hospital,22-02-2025,10:30:00,P-107,Colgate Mini,Hygiene,139.33,58.0,49.0,9.0,6827.17,RP-014,Suresh,Maintenance,19.4,Cash,3.0,27.0,4.76,196.0,1.0,2025-02-22 10:30:00
VMX-11439,VM-052,Mumbai,Metro Station,14-01-2025,13:50:00,P-108,Sprite Bottle,Drinks,55.99,129.0,122.0,7.0,6830.78,RP-005,Anita,Maintenance,17.1,Card,2.7,77.0,4.01,438.0,0.0,2025-01-14 13:50:00
VMX-11440,VM-264,Delhi,Mall,12-02-2025,03:25:00,P-106,Snickers Bar,Snacks,23.47,77.0,61.0,16.0,1431.67,RP-015,Ravi,Working,13.7,UPI,4.4,60.0,1.52,80.0,1.0,2025-02-12 03:25:00
VMX-11441,VM-217,Kolkata,Hospital,21-05-2025,17:39:00,P-102,Bisleri Water,Drinks,118.5,21.0,18.0,3.0,2133.0,RP-018,Mahesh,Maintenance,23.4,UPI,4.2,73.0,1.83,117.0,0.0,2025-05-21 17:39:00
VMX-11442,VM-095,Chennai,Office,02-06-2025,14:25:00,P-104,Red Bull,Drinks,65.75,70.0,52.0,18.0,3419.0,RP-005,Rahul,Maintenance,12.5,Card,2.9,96.0,2.62,467.0,0.0,2025-06-02 14:25:00
VMX-11443,VM-203,Kolkata,Metro Station,03-06-2025,00:13:00,P-109,Doritos,Snacks,25.24,55.0,37.0,18.0,933.88,RP-009,Fatima,Maintenance,11.2,Card,2.3,82.0,2.65,246.0,1.0,2025-06-03 00:13:00
VMX-11444,VM-211,Delhi,Metro Station,20-08-2025,21:01:00,P-109,Doritos,Snacks,74.42,178.0,165.0,13.0,12279.3,RP-008,Suresh,Low Power,13.3,Cash,2.1,49.0,1.43,229.0,0.0,2025-08-20 21:01:00
VMX-11445,VM-018,Kolkata,College,20-05-2025,23:37:00,P-101,Pepsi Can,Drinks,66.19,83.0,65.0,18.0,4302.35,RP-007,Suresh,Working,14.1,UPI,2.6,117.0,3.66,476.0,1.0,2025-05-20 23:37:00
VMX-11446,VM-289,Pune,Office,21-02-2025,09:02:00,P-103,Oreo Pack,Snacks,143.98,90.0,73.0,17.0,10510.54,RP-003,Mahesh,Working,23.0,UPI,3.8,4.0,1.3,178.0,0.0,2025-02-21 09:02:00
VMX-11447,VM-160,Delhi,Mall,12-02-2025,00:03:00,P-101,Pepsi Can,Drinks,66.06,92.0,74.0,18.0,4888.44,RP-002,Amit,Maintenance,18.4,UPI,4.6,118.0,1.48,328.0,0.0,2025-02-12 00:03:00
VMX-11448,VM-063,Kolkata,Mall,07-05-2025,09:09:00,P-101,Pepsi Can,Drinks,132.66,174.0,173.0,1.0,22950.18,RP-009,Fatima,Maintenance,24.0,UPI,3.7,113.0,1.62,80.0,0.0,2025-05-07 09:09:00
VMX-11449,VM-050,Mumbai,Metro Station,02-09-2025,18:42:00,P-105,Dettol Wipe,Hygiene,37.65,128.0,127.0,1.0,4781.55,RP-004,Suresh,Maintenance,15.7,Cash,3.0,61.0,1.4,409.0,0.0,2025-09-02 18:42:00
VMX-11450,VM-156,Mumbai,College,08-06-2025,00:08:00,P-107,Colgate Mini,Hygiene,26.24,54.0,51.0,3.0,1338.24,RP-006,Fatima,Maintenance,22.0,Cash,2.9,15.0,1.53,323.0,1.0,2025-06-08 00:08:00
VMX-11451,VM-262,Chennai,Hospital,20-04-2025,13:30:00,P-104,Red Bull,Drinks,54.4,144.0,142.0,2.0,7724.8,RP-013,Anita,Low Power,12.8,Cash,2.7,100.0,4.86,69.0,1.0,2025-04-20 13:30:00
VMX-11452,VM-087,Bangalore,Mall,04-03-2025,18:18:00,P-104,Red Bull,Drinks,96.05,48.0,36.0,12.0,3457.8,RP-004,Deepa,Low Power,23.2,Cash,4.1,10.0,4.68,161.0,1.0,2025-03-04 18:18:00
VMX-11453,VM-209,Pune,Office,05-04-2025,12:04:00,P-100,Lays Classic,Snacks,67.54,189.0,176.0,13.0,11887.04,RP-012,Deepa,Working,25.0,Cash,4.3,63.0,3.96,88.0,0.0,2025-04-05 12:04:00
VMX-11454,VM-299,Pune,Metro Station,03-02-2025,22:29:00,P-102,Bisleri Water,Drinks,98.62,92.0,77.0,15.0,7593.74,RP-020,Anita,Maintenance,17.9,UPI,3.3,77.0,2.13,341.0,0.0,2025-02-03 22:29:00
VMX-11455,VM-179,Delhi,Hospital,24-06-2025,13:28:00,P-100,Lays Classic,Snacks,14.29,47.0,29.0,18.0,414.41,RP-007,Deepa,Low Power,21.7,UPI,4.7,109.0,4.96,279.0,0.0,2025-06-24 13:28:00
VMX-11456,VM-014,Chennai,Hospital,05-07-2025,12:23:00,P-107,Colgate Mini,Hygiene,31.85,123.0,119.0,4.0,3790.15,RP-001,Rajesh,Working,20.0,Cash,2.9,83.0,4.68,106.0,0.0,2025-07-05 12:23:00
VMX-11457,VM-021,Kolkata,Metro Station,04-08-2025,05:16:00,P-100,Lays Classic,Snacks,148.16,116.0,100.0,16.0,14816.0,RP-015,Ravi,Working,10.1,Card,4.9,52.0,2.64,356.0,0.0,2025-08-04 05:16:00
VMX-11458,VM-004,Mumbai,Hospital,11-03-2025,17:09:00,P-104,Red Bull,Drinks,148.36,45.0,30.0,15.0,4450.8,RP-006,Suresh,Maintenance,20.8,Cash,3.1,101.0,3.64,121.0,0.0,2025-03-11 17:09:00
VMX-11459,VM-275,Chennai,Hospital,21-03-2025,09:00:00,P-102,Bisleri Water,Drinks,87.31,66.0,61.0,5.0,5325.91,RP-011,Amit,Maintenance,12.9,Card,3.8,38.0,1.13,189.0,0.0,2025-03-21 09:00:00
VMX-11460,VM-060,Bangalore,Office,20-08-2025,19:51:00,P-100,Lays Classic,Snacks,111.68,161.0,153.0,8.0,17087.04,RP-004,Ravi,Working,15.2,Cash,4.5,99.0,2.26,213.0,1.0,2025-08-20 19:51:00
VMX-11461,Unknown,Chennai,College,09-03-2025,00:50:00,P-102,Bisleri Water,Drinks,33.06,184.0,168.0,16.0,5554.08,RP-012,Rajesh,Maintenance,24.7,Card,4.3,67.0,1.96,115.0,0.0,2025-03-09 00:50:00
VMX-11462,VM-125,Chennai,College,28-05-2025,22:21:00,P-101,Pepsi Can,Drinks,13.32,96.0,93.0,3.0,1238.76,RP-020,Deepa,Working,21.8,Card,4.3,12.0,4.72,184.0,1.0,2025-05-28 22:21:00
VMX-11463,VM-090,Hyderabad,Metro Station,07-03-2025,17:02:00,P-107,Colgate Mini,Hygiene,87.79,136.0,127.0,9.0,11149.33,RP-018,Rahul,Working,10.3,Cash,4.3,63.0,4.93,336.0,0.0,2025-03-07 17:02:00
VMX-11464,VM-228,Chennai,Mall,16-03-2025,03:14:00,P-103,Oreo Pack,Snacks,75.05,169.0,166.0,3.0,12458.3,RP-013,Rahul,Maintenance,10.2,UPI,3.7,44.0,4.66,451.0,1.0,2025-03-16 03:14:00
VMX-11465,VM-295,Delhi,College,06-10-2025,08:11:00,P-109,Doritos,Snacks,90.1,198.0,198.0,0.0,17839.8,RP-014,Rahul,Low Power,18.5,Cash,4.1,45.0,4.58,316.0,1.0,2025-10-06 08:11:00
VMX-11466,VM-124,Bangalore,Hospital,19-06-2025,13:29:00,P-100,Lays Classic,Snacks,62.82,32.0,20.0,12.0,1256.4,RP-009,Deepa,Low Power,23.4,Cash,3.2,18.0,2.78,97.0,0.0,2025-06-19 13:29:00
VMX-11467,VM-113,Delhi,College,30-01-2025,04:22:00,P-106,Snickers Bar,Snacks,102.94,37.0,28.0,9.0,2882.32,RP-017,Anita,Working,17.2,UPI,3.8,20.0,3.56,484.0,1.0,2025-01-30 04:22:00
VMX-11468,VM-005,Pune,Office,03-04-2025,10:51:00,P-104,Red Bull,Drinks,47.71,137.0,122.0,15.0,5820.62,RP-006,Suresh,Maintenance,12.1,UPI,2.5,38.0,3.05,442.0,0.0,2025-04-03 10:51:00
VMX-11469,VM-176,Bangalore,Hospital,26-02-2025,23:21:00,P-104,Red Bull,Drinks,21.2,52.0,43.0,9.0,911.6,RP-020,Ravi,Low Power,18.0,UPI,3.4,108.0,4.83,64.0,1.0,2025-02-26 23:21:00
VMX-11470,VM-085,Chennai,Hospital,08-01-2025,05:17:00,P-102,Bisleri Water,Drinks,126.77,164.0,152.0,12.0,19269.04,RP-002,Suresh,Working,13.3,Cash,3.9,43.0,3.7,199.0,1.0,2025-01-08 05:17:00
VMX-11471,VM-199,Bangalore,College,03-10-2025,04:33:00,P-102,Bisleri Water,Drinks,140.33,41.0,31.0,10.0,4350.23,RP-009,Mahesh,Working,19.1,UPI,2.6,112.0,3.76,357.0,0.0,2025-10-03 04:33:00
VMX-11472,VM-068,Hyderabad,Office,22-03-2025,19:08:00,P-107,Colgate Mini,Hygiene,32.11,144.0,135.0,9.0,4334.85,RP-003,Kiran,Low Power,18.1,Cash,4.7,45.0,3.74,352.0,0.0,2025-03-22 19:08:00
VMX-11473,VM-065,Kolkata,Office,03-01-2025,12:14:00,P-106,Snickers Bar,Snacks,error,73.0,58.0,15.0,3685.32,RP-002,Suresh,Working,22.6,Card,2.5,5.0,2.21,449.0,1.0,2025-01-03 12:14:00
VMX-11474,VM-025,Hyderabad,Metro Station,18-02-2025,21:37:00,P-100,Lays Classic,Snacks,35.89,31.0,18.0,13.0,646.02,RP-008,Suresh,Working,15.6,Cash,3.5,62.0,1.34,81.0,0.0,2025-02-18 21:37:00
VMX-11475,VM-193,Bangalore,Mall,24-06-2025,13:06:00,P-100,Lays Classic,Snacks,100.46,67.0,49.0,18.0,4922.54,RP-011,Kiran,Maintenance,20.8,UPI,4.1,8.0,3.06,238.0,1.0,2025-06-24 13:06:00
VMX-11476,VM-147,Kolkata,Office,15-03-2025,07:00:00,P-109,Doritos,Snacks,53.27,135.0,117.0,18.0,6232.59,RP-007,Amit,Maintenance,13.5,UPI,4.0,59.0,2.86,450.0,0.0,2025-03-15 07:00:00
VMX-11477,VM-007,Kolkata,College,28-05-2025,07:28:00,P-104,Red Bull,Drinks,56.41,94.0,80.0,14.0,4512.8,RP-020,Anita,Low Power,12.9,Card,4.1,13.0,4.68,393.0,1.0,2025-05-28 07:28:00
VMX-11478,VM-091,Delhi,Hospital,24-06-2025,01:22:00,P-107,Colgate Mini,Hygiene,69.91,127.0,114.0,13.0,7969.74,RP-014,Ravi,Working,10.4,Card,2.5,11.0,4.29,381.0,1.0,2025-06-24 01:22:00
VMX-11479,VM-126,Hyderabad,College,31-01-2025,04:08:00,P-107,Colgate Mini,Hygiene,86.64,124.0,122.0,2.0,10570.08,RP-013,Rajesh,Maintenance,18.2,UPI,2.1,80.0,4.3,373.0,1.0,2025-01-31 04:08:00
VMX-11480,VM-064,Pune,Office,12-04-2025,21:31:00,P-103,Oreo Pack,Snacks,56.94,54.0,50.0,4.0,2847.0,RP-019,Amit,Working,23.0,UPI,4.5,66.0,3.88,381.0,1.0,2025-04-12 21:31:00
VMX-11481,VM-078,Pune,Office,12-02-2025,09:54:00,P-106,Snickers Bar,Snacks,40.89,147.0,145.0,2.0,5929.05,RP-007,Mahesh,Working,10.4,Card,2.7,106.0,2.35,175.0,0.0,2025-02-12 09:54:00
VMX-11482,VM-177,Pune,Metro Station,15-03-2025,08:27:00,P-103,Oreo Pack,Snacks,108.43,38.0,32.0,6.0,3469.76,RP-013,Kiran,Maintenance,13.1,UPI,4.3,68.0,3.85,102.0,1.0,2025-03-15 08:27:00
VMX-11483,VM-037,Chennai,Mall,31-07-2025,10:36:00,P-108,Sprite Bottle,Drinks,38.24,194.0,179.0,15.0,6844.96,RP-017,Amit,Working,11.4,UPI,4.0,3.0,4.26,461.0,1.0,2025-07-31 10:36:00
VMX-11484,VM-113,Kolkata,Office,05-04-2025,13:28:00,P-102,Bisleri Water,Drinks,108.05,120.0,111.0,9.0,11993.55,RP-003,Amit,Low Power,12.7,UPI,2.9,44.0,1.88,463.0,0.0,2025-04-05 13:28:00
VMX-11485,VM-241,Mumbai,Office,10-06-2025,12:39:00,P-107,Colgate Mini,Hygiene,143.03,113.0,101.0,12.0,14446.03,RP-017,Rajesh,Maintenance,14.4,UPI,2.5,35.0,4.26,345.0,1.0,2025-06-10 12:39:00
VMX-11486,VM-162,Hyderabad,Hospital,28-07-2025,20:08:00,P-105,Dettol Wipe,Hygiene,126.26,25.0,16.0,9.0,2020.16,RP-019,Amit,Maintenance,16.3,UPI,3.6,42.0,4.43,123.0,0.0,2025-07-28 20:08:00
VMX-11487,VM-119,Delhi,Office,10-09-2025,05:38:00,P-106,Snickers Bar,Snacks,117.23,134.0,121.0,13.0,14184.83,RP-001,Rahul,Low Power,18.8,Cash,2.8,112.0,2.08,120.0,0.0,2025-09-10 05:38:00
VMX-11488,VM-076,Kolkata,Mall,10-07-2025,00:11:00,P-102,Bisleri Water,Drinks,90.57,97.0,84.0,13.0,7607.88,RP-010,Rajesh,Low Power,18.3,Card,4.8,89.0,3.67,407.0,0.0,2025-07-10 00:11:00
VMX-11489,VM-060,Kolkata,Metro Station,26-08-2025,04:23:00,P-104,Red Bull,Drinks,137.5,146.0,128.0,18.0,17600.0,RP-010,Mahesh,Low Power,10.4,Cash,3.9,67.0,1.54,199.0,1.0,2025-08-26 04:23:00
VMX-11490,VM-080,Delhi,College,09-04-2025,14:41:00,P-108,Sprite Bottle,Drinks,105.29,56.0,49.0,7.0,5159.21,RP-019,Anita,Low Power,11.0,UPI,3.5,98.0,3.92,56.0,1.0,2025-04-09 14:41:00
VMX-11491,VM-003,Hyderabad,College,24-09-2025,13:12:00,P-103,Oreo Pack,Snacks,66.98,76.0,72.0,4.0,4822.56,RP-005,Amit,Working,22.3,Cash,4.7,92.0,3.7,199.0,1.0,2025-09-24 13:12:00
VMX-11492,VM-109,Mumbai,Hospital,15-04-2025,06:48:00,P-102,Bisleri Water,Drinks,64.28,84.0,67.0,17.0,4306.76,RP-019,Kiran,Working,24.2,Card,2.5,88.0,3.16,257.0,1.0,2025-04-15 06:48:00
VMX-11493,VM-130,Pune,Office,21-06-2025,20:43:00,P-101,Pepsi Can,Drinks,107.62,117.0,117.0,0.0,12591.54,RP-014,Rahul,Working,10.4,UPI,4.8,35.0,3.27,476.0,0.0,2025-06-21 20:43:00
VMX-11494,VM-289,Bangalore,Office,09-07-2025,02:58:00,P-101,Pepsi Can,Drinks,131.39,57.0,49.0,8.0,6438.11,RP-002,Mahesh,Working,11.6,UPI,2.9,14.0,2.9,452.0,0.0,2025-07-09 02:58:00
VMX-11495,VM-019,Chennai,Office,18-09-2025,18:40:00,P-108,Sprite Bottle,Drinks,132.89,75.0,59.0,16.0,7840.51,RP-003,Mahesh,Low Power,10.9,Cash,2.2,51.0,2.54,310.0,1.0,2025-09-18 18:40:00
VMX-11496,VM-053,Chennai,Metro Station,25-09-2025,20:41:00,P-101,Pepsi Can,Drinks,106.19,104.0,98.0,6.0,10406.62,RP-007,Rajesh,Low Power,16.9,UPI,3.5,25.0,1.17,377.0,0.0,2025-09-25 20:41:00
VMX-11497,VM-057,Mumbai,Hospital,15-07-2025,09:28:00,P-101,Pepsi Can,Drinks,139.1,152.0,142.0,10.0,19752.2,RP-018,Anita,Working,11.4,Card,2.1,113.0,2.85,386.0,0.0,2025-07-15 09:28:00
VMX-11498,VM-053,Mumbai,College,15-04-2025,15:44:00,P-106,Snickers Bar,Snacks,135.64,154.0,137.0,17.0,18582.68,RP-004,Deepa,Maintenance,23.9,UPI,4.9,66.0,4.91,107.0,0.0,2025-04-15 15:44:00
VMX-11499,VM-267,Bangalore,Mall,02-07-2025,18:47:00,P-109,Doritos,Snacks,89.98,118.0,14.0,14.0,9357.92,RP-006,Kiran,Working,17.1,Cash,4.2,110.0,1.11,324.0,0.0,2025-07-02 18:47:00
VMX-11500,VM-179,Mumbai,Office,04-10-2025,02:37:00,P-105,Dettol Wipe,Hygiene,36.54,111.0,91.0,20.0,3325.14,RP-015,Amit,Maintenance,15.5,UPI,4.9,31.0,3.31,353.0,0.0,2025-10-04 02:37:00
VMX-11501,VM-247,Chennai,Metro Station,18-02-2025,14:57:00,P-104,Red Bull,Drinks,32.29,122.0,118.0,4.0,3810.22,RP-002,Ravi,Maintenance,15.0,UPI,4.8,54.0,3.19,359.0,0.0,2025-02-18 14:57:00
VMX-11502,VM-105,Bangalore,Hospital,19-03-2025,00:00:00,P-100,Lays Classic,Snacks,124.07,71.0,71.0,0.0,8808.97,RP-006,Rajesh,Low Power,16.4,Card,4.4,28.0,2.02,85.0,1.0,2025-03-19 00:00:00
VMX-11503,VM-055,Bangalore,College,09-07-2025,09:27:00,P-100,Lays Classic,Snacks,33.04,52.0,36.0,16.0,1189.44,RP-018,Rajesh,Working,24.1,Cash,3.6,72.0,4.7,114.0,0.0,2025-07-09 09:27:00
VMX-11504,VM-244,Mumbai,Hospital,27-03-2025,15:50:00,P-107,Colgate Mini,Hygiene,117.17,77.0,60.0,17.0,7030.2,RP-004,Ravi,Maintenance,14.4,UPI,2.4,93.0,2.92,308.0,1.0,2025-03-27 15:50:00
VMX-11505,VM-043,Bangalore,College,05-01-2025,14:58:00,P-103,Oreo Pack,Snacks,10.15,174.0,173.0,1.0,1755.95,RP-002,Amit,Maintenance,22.9,Cash,2.6,86.0,2.16,160.0,0.0,2025-01-05 14:58:00
VMX-11506,VM-219,Hyderabad,Metro Station,29-08-2025,03:48:00,P-105,Dettol Wipe,Hygiene,113.44,143.0,129.0,14.0,14633.76,RP-019,Rajesh,Working,15.6,Card,3.8,44.0,4.09,256.0,1.0,2025-08-29 03:48:00
VMX-11507,VM-121,Bangalore,Office,13-07-2025,16:54:00,P-106,Snickers Bar,Snacks,51.44,175.0,156.0,19.0,8024.64,RP-009,Mahesh,Working,19.2,UPI,2.5,119.0,4.3,194.0,0.0,2025-07-13 16:54:00
VMX-11508,VM-094,Bangalore,College,23-08-2025,19:12:00,P-106,Snickers Bar,Snacks,105.5,113.0,107.0,6.0,11288.5,RP-019,Ravi,Low Power,13.7,Card,4.1,58.0,1.09,404.0,1.0,2025-08-23 19:12:00
VMX-11509,VM-059,Hyderabad,Office,28-02-2025,10:31:00,P-107,Colgate Mini,Hygiene,104.05,127.0,126.0,1.0,13110.3,RP-002,Ravi,Working,11.0,Card,4.5,0.0,2.68,65.0,0.0,2025-02-28 10:31:00
VMX-11510,VM-240,Chennai,Metro Station,17-04-2025,21:16:00,P-102,Bisleri Water,Drinks,66.19,163.0,145.0,18.0,9597.55,RP-015,Fatima,Working,13.3,UPI,3.5,91.0,1.83,301.0,0.0,2025-04-17 21:16:00
VMX-11511,VM-047,Kolkata,Office,26-07-2025,15:36:00,P-109,Doritos,Snacks,36.16,92.0,74.0,18.0,2675.84,RP-013,Suresh,Maintenance,17.6,UPI,5.0,49.0,4.41,397.0,0.0,2025-07-26 15:36:00
VMX-11512,VM-209,Mumbai,Office,11-09-2025,22:08:00,P-102,Bisleri Water,Drinks,13.21,73.0,71.0,2.0,937.91,RP-005,Fatima,Working,14.7,Card,3.0,109.0,4.56,135.0,1.0,2025-09-11 22:08:00
VMX-11513,VM-201,Delhi,College,14-03-2025,00:34:00,P-102,Bisleri Water,Drinks,50.61,30.0,29.0,1.0,1467.69,RP-003,Anita,Maintenance,21.2,Cash,3.0,75.0,1.1,442.0,1.0,2025-03-14 00:34:00
VMX-11514,VM-104,Delhi,College,28-02-2025,12:41:00,P-104,Red Bull,Drinks,39.19,56.0,41.0,15.0,1606.79,RP-007,Suresh,Low Power,23.5,Card,4.7,48.0,3.39,440.0,0.0,2025-02-28 12:41:00
VMX-11515,VM-270,Kolkata,Metro Station,20-01-2025,18:03:00,P-100,Lays Classic,Snacks,22.52,34.0,33.0,1.0,743.16,RP-019,Suresh,Working,18.3,Card,2.3,0.0,4.24,208.0,0.0,2025-01-20 18:03:00
VMX-11516,VM-279,Pune,Mall,23-05-2025,02:21:00,P-102,Bisleri Water,Drinks,83.74,79.0,69.0,10.0,5778.06,RP-020,Mahesh,Maintenance,21.1,Cash,4.8,90.0,1.88,277.0,1.0,2025-05-23 02:21:00
VMX-11517,VM-013,Pune,College,29-03-2025,17:58:00,P-106,Snickers Bar,Snacks,22.39,126.0,114.0,12.0,2552.46,RP-005,Amit,Maintenance,19.5,Card,2.2,109.0,4.94,439.0,1.0,2025-03-29 17:58:00
VMX-11518,VM-113,Hyderabad,College,02-01-2025,11:58:00,P-107,Colgate Mini,Hygiene,135.18,85.0,71.0,14.0,9597.78,RP-002,Deepa,Maintenance,18.2,Cash,4.0,94.0,1.98,491.0,1.0,2025-01-02 11:58:00
VMX-11519,VM-049,Pune,Metro Station,15-09-2025,09:08:00,P-107,Colgate Mini,Hygiene,140.18,174.0,160.0,14.0,22428.8,RP-004,Anita,Working,20.0,Card,2.7,52.0,3.93,232.0,0.0,2025-09-15 09:08:00
VMX-11520,VM-051,Pune,Hospital,03-09-2025,22:55:00,P-101,Pepsi Can,Drinks,66.78,144.0,131.0,13.0,8748.18,RP-016,Kiran,Working,19.9,Card,4.4,27.0,2.64,170.0,1.0,2025-09-03 22:55:00
VMX-11521,VM-204,Kolkata,Mall,13-01-2025,02:46:00,P-108,Sprite Bottle,Drinks,83.64,190.0,179.0,11.0,14971.56,RP-015,Kiran,Working,18.9,Cash,3.3,55.0,2.78,475.0,0.0,2025-01-13 02:46:00
VMX-11522,VM-167,Bangalore,Mall,23-07-2025,02:25:00,P-109,Doritos,Snacks,107.89,69.0,55.0,14.0,5933.95,RP-018,Rahul,Maintenance,23.4,Card,4.9,0.0,2.86,347.0,0.0,2025-07-23 02:25:00
VMX-11523,VM-245,Mumbai,Hospital,15-06-2025,10:39:00,P-105,Dettol Wipe,Hygiene,89.18,47.0,43.0,4.0,3834.74,RP-005,Kiran,Low Power,24.6,UPI,3.1,3.0,3.2,146.0,1.0,2025-06-15 10:39:00
VMX-11524,VM-226,Hyderabad,Hospital,29-05-2025,03:49:00,P-108,Sprite Bottle,Drinks,13.45,27.0,25.0,2.0,336.25,RP-011,Rajesh,Maintenance,18.7,Card,2.2,105.0,1.56,491.0,1.0,2025-05-29 03:49:00
VMX-11525,VM-059,Kolkata,Office,30-09-2025,14:05:00,P-106,Snickers Bar,Snacks,59.13,43.0,26.0,17.0,1537.38,RP-017,Kiran,Working,10.8,Card,3.1,5.0,1.02,358.0,0.0,2025-09-30 14:05:00
VMX-11526,VM-288,Kolkata,Hospital,03-04-2025,16:28:00,P-104,Red Bull,Drinks,47.77,200.0,180.0,20.0,8598.6,RP-012,Rajesh,Working,19.4,Card,2.0,18.0,3.36,59.0,0.0,2025-04-03 16:28:00
VMX-11527,VM-260,Mumbai,College,07-01-2025,02:41:00,P-101,Pepsi Can,Drinks,112.35,58.0,48.0,10.0,5392.8,RP-016,Anita,Working,18.6,Cash,3.2,82.0,3.4,126.0,0.0,2025-01-07 02:41:00
VMX-11528,VM-288,Hyderabad,Hospital,18-04-2025,03:40:00,P-102,Bisleri Water,Drinks,41.79,68.0,55.0,13.0,2298.45,RP-006,Mahesh,Working,21.7,UPI,3.9,2.0,4.76,465.0,1.0,2025-04-18 03:40:00
VMX-11529,VM-294,Mumbai,Office,13-03-2025,08:44:00,P-102,Bisleri Water,Drinks,136.66,186.0,173.0,13.0,23642.18,RP-008,Rajesh,Maintenance,19.5,Cash,4.1,41.0,2.98,450.0,0.0,2025-03-13 08:44:00
VMX-11530,VM-254,Chennai,College,08-07-2025,13:43:00,P-104,Red Bull,Drinks,52.71,189.0,170.0,19.0,8960.7,RP-013,Fatima,Low Power,21.8,UPI,3.9,32.0,4.76,162.0,1.0,2025-07-08 13:43:00
VMX-11531,VM-215,Chennai,Metro Station,08-08-2025,17:34:00,P-105,Dettol Wipe,Hygiene,111.44,91.0,79.0,12.0,8803.76,RP-007,Anita,Maintenance,13.0,UPI,3.7,109.0,1.91,230.0,1.0,2025-08-08 17:34:00
VMX-11532,VM-154,Pune,Office,11-08-2025,12:53:00,P-102,Bisleri Water,Drinks,129.65,146.0,140.0,6.0,18151.0,RP-008,Amit,Working,22.9,UPI,3.4,67.0,2.88,310.0,1.0,2025-08-11 12:53:00
VMX-11533,VM-129,Chennai,Mall,22-04-2025,21:53:00,P-103,Oreo Pack,Snacks,32.27,186.0,173.0,13.0,5582.71,RP-014,Rahul,Maintenance,15.1,Card,2.1,3.0,4.05,454.0,1.0,2025-04-22 21:53:00
VMX-11534,VM-206,Mumbai,Mall,31-03-2025,17:17:00,P-105,Dettol Wipe,Hygiene,121.96,112.0,111.0,1.0,13537.56,RP-001,Mahesh,Low Power,13.0,Cash,4.8,97.0,3.41,150.0,0.0,2025-03-31 17:17:00
VMX-11535,VM-177,Delhi,College,11-06-2025,08:40:00,P-107,Colgate Mini,Hygiene,72.56,145.0,141.0,4.0,10230.96,RP-008,Fatima,Working,11.0,Cash,3.0,44.0,1.44,69.0,0.0,2025-06-11 08:40:00
VMX-11536,VM-160,Bangalore,Office,05-04-2025,17:06:00,P-100,Lays Classic,Snacks,51.99,107.0,107.0,0.0,5562.93,RP-008,Ravi,Working,23.6,Card,2.8,87.0,3.75,400.0,0.0,2025-04-05 17:06:00
VMX-11537,VM-052,Hyderabad,Mall,07-04-2025,02:51:00,P-103,Oreo Pack,Snacks,115.08,178.0,168.0,10.0,19333.44,RP-008,Deepa,Maintenance,10.4,Cash,3.2,23.0,4.54,468.0,1.0,2025-04-07 02:51:00
VMX-11538,VM-057,Delhi,College,04-04-2025,21:22:00,P-102,Bisleri Water,Drinks,87.19,192.0,180.0,12.0,15694.2,RP-017,Deepa,Low Power,13.4,Cash,3.7,86.0,2.4,199.0,1.0,2025-04-04 21:22:00
VMX-11539,VM-166,Hyderabad,College,11-02-2025,18:14:00,P-101,Pepsi Can,Drinks,46.34,130.0,129.0,1.0,5977.86,RP-016,Anita,Low Power,22.4,UPI,4.3,28.0,3.75,407.0,0.0,2025-02-11 18:14:00
VMX-11540,VM-103,Bangalore,Hospital,25-02-2025,13:29:00,P-106,Snickers Bar,Snacks,29,67.0,50.0,17.0,1450.0,RP-009,Kiran,Working,25.0,Cash,4.5,85.0,2.27,293.0,1.0,2025-02-25 13:29:00
VMX-11541,VM-218,Hyderabad,Metro Station,12-05-2025,03:11:00,P-106,Snickers Bar,Snacks,110.68,62.0,49.0,13.0,5423.32,RP-009,Fatima,Working,17.7,Card,3.3,20.0,1.06,368.0,0.0,2025-05-12 03:11:00
VMX-11542,VM-121,Pune,Metro Station,09-08-2025,07:01:00,P-106,Snickers Bar,Snacks,89.94,41.0,22.0,19.0,1978.68,RP-011,Ravi,Low Power,21.2,Cash,2.9,4.0,3.85,419.0,0.0,2025-08-09 07:01:00
VMX-11543,VM-052,Bangalore,Mall,14-08-2025,07:43:00,P-102,Bisleri Water,Drinks,138.01,200.0,187.0,13.0,25807.87,RP-009,Suresh,Maintenance,23.8,Card,4.9,39.0,3.01,485.0,0.0,2025-08-14 07:43:00
VMX-11544,VM-125,Mumbai,Office,09-07-2025,19:52:00,P-104,Red Bull,Drinks,101.03,34.0,30.0,4.0,3030.9,RP-012,Mahesh,Maintenance,12.2,Cash,4.4,30.0,1.43,180.0,0.0,2025-07-09 19:52:00
VMX-11545,VM-033,Hyderabad,Office,13-07-2025,14:11:00,P-107,Colgate Mini,Hygiene,60.65,114.0,100.0,14.0,6065.0,RP-010,Rahul,Working,21.2,Card,2.8,114.0,1.34,485.0,0.0,2025-07-13 14:11:00
VMX-11546,VM-020,Delhi,Mall,26-04-2025,02:56:00,P-104,Red Bull,Drinks,44.82,177.0,166.0,11.0,7440.12,RP-019,Rajesh,Low Power,11.8,Card,2.3,2.0,2.63,399.0,0.0,2025-04-26 02:56:00
VMX-11547,VM-083,Pune,College,02-02-2025,14:13:00,P-107,Colgate Mini,Hygiene,94.69,119.0,109.0,10.0,10321.21,RP-014,Amit,Maintenance,19.2,Card,2.2,64.0,2.96,469.0,0.0,2025-02-02 14:13:00
VMX-11548,VM-039,Kolkata,Office,23-07-2025,18:57:00,P-102,Bisleri Water,Drinks,23.71,160.0,153.0,7.0,3627.63,RP-015,Suresh,Maintenance,16.9,UPI,2.3,3.0,2.44,339.0,1.0,2025-07-23 18:57:00
VMX-11549,VM-042,Chennai,Mall,27-06-2025,19:47:00,P-107,Colgate Mini,Hygiene,10.14,184.0,175.0,9.0,1774.5,RP-002,Anita,Low Power,14.8,Cash,4.4,22.0,1.02,447.0,1.0,2025-06-27 19:47:00
VMX-11550,VM-159,Delhi,Office,18-01-2025,06:47:00,P-108,Sprite Bottle,Drinks,44.17,146.0,129.0,17.0,5697.93,RP-002,Amit,Maintenance,14.7,UPI,3.4,50.0,1.19,382.0,0.0,2025-01-18 06:47:00
VMX-11551,VM-236,Delhi,Office,28-07-2025,21:44:00,P-104,Red Bull,Drinks,11.19,72.0,64.0,8.0,716.16,RP-010,Ravi,Maintenance,20.7,Cash,2.7,54.0,3.17,99.0,0.0,2025-07-28 21:44:00
VMX-11552,VM-025,Kolkata,Office,17-08-2025,05:04:00,P-101,Pepsi Can,Drinks,134.41,160.0,156.0,4.0,20967.96,RP-004,Suresh,Working,14.2,Cash,2.3,39.0,1.64,51.0,0.0,2025-08-17 05:04:00
VMX-11553,VM-017,Kolkata,Metro Station,05-07-2025,07:11:00,P-103,Oreo Pack,Snacks,84.96,160.0,155.0,5.0,13168.8,RP-007,Ravi,Maintenance,15.8,Cash,4.2,81.0,2.64,262.0,0.0,2025-07-05 07:11:00
VMX-11554,VM-195,Pune,College,03-09-2025,07:47:00,P-103,Oreo Pack,Snacks,85.25,193.0,191.0,2.0,16282.75,RP-015,Fatima,Maintenance,20.6,Card,3.5,61.0,1.74,71.0,0.0,2025-09-03 07:47:00
VMX-11555,VM-005,Mumbai,College,26-01-2025,15:58:00,P-105,Dettol Wipe,Hygiene,28.12,85.0,82.0,3.0,2305.84,RP-014,Suresh,Low Power,18.4,Cash,4.4,85.0,3.13,360.0,1.0,2025-01-26 15:58:00
VMX-11556,VM-057,Kolkata,Metro Station,28-09-2025,11:05:00,P-101,Pepsi Can,Drinks,35.24,137.0,137.0,0.0,4827.88,RP-003,Rahul,Low Power,22.0,UPI,3.1,119.0,2.45,360.0,1.0,2025-09-28 11:05:00
VMX-11557,VM-096,Mumbai,Hospital,19-07-2025,03:38:00,P-102,Bisleri Water,Drinks,96.36,108.0,98.0,10.0,9443.28,RP-016,Ravi,Working,16.6,Card,4.1,14.0,3.75,395.0,1.0,2025-07-19 03:38:00
VMX-11558,VM-069,Delhi,Hospital,01-07-2025,12:06:00,P-102,Bisleri Water,Drinks,128.5,81.0,63.0,18.0,8095.5,RP-013,Rajesh,Maintenance,13.3,Cash,3.1,63.0,1.83,100.0,0.0,2025-07-01 12:06:00
VMX-11559,VM-072,Bangalore,Office,27-05-2025,01:10:00,P-108,Sprite Bottle,Drinks,128.45,154.0,139.0,15.0,17854.55,RP-013,Ravi,Low Power,14.5,UPI,4.7,22.0,2.98,154.0,0.0,2025-05-27 01:10:00
VMX-11560,VM-050,Delhi,Office,06-02-2025,14:26:00,P-100,Lays Classic,Snacks,51.56,194.0,191.0,3.0,9847.96,RP-006,Ravi,Low Power,12.8,Card,2.7,76.0,2.59,322.0,1.0,2025-02-06 14:26:00
VMX-11561,VM-129,Mumbai,Office,03-09-2025,00:53:00,P-103,Oreo Pack,Snacks,134.2,126.0,118.0,8.0,15835.6,RP-013,Fatima,Maintenance,15.8,Card,4.7,118.0,1.09,243.0,0.0,2025-09-03 00:53:00
VMX-11562,VM-117,Mumbai,Mall,07-09-2025,21:38:00,P-100,Lays Classic,Snacks,13.96,158.0,151.0,7.0,2107.96,RP-003,Deepa,Maintenance,24.6,Card,4.9,99.0,4.82,354.0,0.0,2025-09-07 21:38:00
VMX-11563,VM-144,Hyderabad,College,18-06-2025,19:14:00,P-102,Bisleri Water,Drinks,77.56,34.0,22.0,12.0,1706.32,RP-009,Mahesh,Low Power,21.1,Card,2.4,12.0,1.33,281.0,0.0,2025-06-18 19:14:00
VMX-11564,VM-011,Hyderabad,Metro Station,05-03-2025,16:12:00,P-102,Bisleri Water,Drinks,81.9,91.0,76.0,15.0,6224.4,RP-004,Rajesh,Maintenance,18.8,UPI,4.0,108.0,4.31,221.0,1.0,2025-03-05 16:12:00
VMX-11565,VM-146,Pune,Metro Station,10-05-2025,18:30:00,P-108,Sprite Bottle,Drinks,95.8,153.0,133.0,20.0,12741.4,RP-015,Rahul,Maintenance,10.9,Cash,4.8,17.0,1.43,113.0,0.0,2025-05-10 18:30:00
VMX-11566,VM-049,Pune,Metro Station,02-08-2025,11:33:00,P-104,Red Bull,Drinks,86.48,124.0,114.0,10.0,9858.72,RP-018,Ravi,Working,16.5,UPI,2.6,102.0,3.74,493.0,1.0,2025-08-02 11:33:00
VMX-11567,VM-237,Chennai,Office,13-04-2025,03:10:00,P-106,Snickers Bar,Snacks,130.62,44.0,31.0,13.0,4049.22,RP-015,Amit,Maintenance,23.0,UPI,2.3,76.0,2.22,260.0,0.0,2025-04-13 03:10:00
VMX-11568,VM-109,Pune,Metro Station,15-02-2025,18:53:00,P-107,Colgate Mini,Hygiene,137.94,149.0,147.0,2.0,20277.18,RP-019,Rahul,Working,15.9,Cash,4.1,14.0,4.05,379.0,0.0,2025-02-15 18:53:00
VMX-11569,VM-088,Hyderabad,Hospital,07-04-2025,21:44:00,P-107,Colgate Mini,Hygiene,20.76,146.0,135.0,11.0,2802.6,RP-008,Suresh,Low Power,23.8,Cash,2.2,78.0,4.44,218.0,1.0,2025-04-07 21:44:00
VMX-11570,VM-084,Pune,Office,29-01-2025,07:30:00,P-109,Doritos,Snacks,15.13,31.0,22.0,9.0,332.86,RP-010,Deepa,Maintenance,21.6,Card,2.7,88.0,2.68,470.0,0.0,2025-01-29 07:30:00
VMX-11571,VM-143,Delhi,Mall,20-03-2025,15:54:00,P-109,Doritos,Snacks,138.39,160.0,157.0,3.0,21727.23,RP-020,Amit,Working,23.7,UPI,2.3,103.0,2.09,476.0,0.0,2025-03-20 15:54:00
VMX-11572,VM-216,Bangalore,College,11-05-2025,15:55:00,P-105,Dettol Wipe,Hygiene,88.07,37.0,17.0,20.0,1497.19,RP-006,Suresh,Low Power,22.2,Cash,4.1,50.0,1.93,356.0,1.0,2025-05-11 15:55:00
VMX-11573,VM-049,Chennai,Hospital,09-05-2025,10:14:00,P-105,Dettol Wipe,Hygiene,46.15,73.0,56.0,17.0,2584.4,RP-007,Mahesh,Maintenance,13.6,UPI,3.8,66.0,3.65,222.0,0.0,2025-05-09 10:14:00
VMX-11574,VM-238,Bangalore,Office,05-07-2025,18:34:00,P-109,Doritos,Snacks,70.01,189.0,180.0,9.0,12601.8,RP-002,Fatima,Maintenance,19.2,Cash,4.1,58.0,2.93,447.0,0.0,2025-07-05 18:34:00
VMX-11575,VM-035,Bangalore,Mall,25-07-2025,16:04:00,P-105,Dettol Wipe,Hygiene,101.12,43.0,30.0,13.0,3033.6,RP-020,Rajesh,Working,24.0,UPI,2.1,88.0,1.54,295.0,0.0,2025-07-25 16:04:00
VMX-11576,VM-088,Delhi,Mall,06-06-2025,04:41:00,P-104,Red Bull,Drinks,146.45,200.0,101.0,5.0,28557.75,RP-009,Ravi,Maintenance,19.3,Card,2.7,103.0,1.25,394.0,0.0,2025-06-06 04:41:00
VMX-11577,VM-279,Hyderabad,Office,07-06-2025,00:06:00,P-102,Bisleri Water,Drinks,112.69,131.0,121.0,10.0,13635.49,RP-010,Anita,Working,14.4,Card,4.6,34.0,1.62,392.0,0.0,2025-06-07 00:06:00
VMX-11578,VM-158,Mumbai,Hospital,04-01-2025,22:38:00,P-102,Bisleri Water,Drinks,107.04,82.0,71.0,11.0,7599.84,RP-012,Ravi,Working,20.0,Card,3.3,8.0,4.92,263.0,1.0,2025-01-04 22:38:00
VMX-11579,VM-180,Bangalore,Metro Station,22-02-2025,09:31:00,P-100,Lays Classic,Snacks,95.78,167.0,158.0,9.0,15133.24,RP-018,Rahul,Maintenance,11.0,Cash,3.4,40.0,2.24,375.0,0.0,2025-02-22 09:31:00
VMX-11580,VM-092,Mumbai,College,29-01-2025,16:58:00,P-104,Red Bull,Drinks,127.43,43.0,23.0,20.0,2930.89,RP-003,Mahesh,Maintenance,13.0,UPI,3.0,34.0,1.72,345.0,0.0,2025-01-29 16:58:00
VMX-11581,VM-196,Mumbai,Metro Station,03-09-2025,12:45:00,P-100,Lays Classic,Snacks,98.78,64.0,57.0,7.0,5630.46,RP-014,Rahul,Working,21.6,Card,3.0,29.0,3.15,97.0,1.0,2025-09-03 12:45:00
VMX-11582,VM-009,Kolkata,Metro Station,09-04-2025,19:43:00,P-101,Pepsi Can,Drinks,126.87,180.0,163.0,17.0,20679.81,RP-008,Anita,Working,14.2,Card,4.6,37.0,1.01,267.0,0.0,2025-04-09 19:43:00
VMX-11583,VM-154,Delhi,Metro Station,08-04-2025,06:51:00,P-108,Sprite Bottle,Drinks,114.26,89.0,76.0,13.0,8683.76,RP-018,Rahul,Working,24.3,UPI,2.6,47.0,1.41,427.0,1.0,2025-04-08 06:51:00
VMX-11584,VM-186,Kolkata,Office,17-09-2025,13:49:00,P-106,Snickers Bar,Snacks,136.35,85.0,84.0,1.0,11453.4,RP-006,Anita,Working,20.9,Cash,3.2,79.0,4.78,333.0,1.0,2025-09-17 13:49:00
VMX-11585,VM-178,Bangalore,Metro Station,24-06-2025,00:36:00,P-105,Dettol Wipe,Hygiene,12.92,88.0,82.0,6.0,1059.44,RP-017,Rahul,Low Power,19.1,UPI,4.5,110.0,1.03,341.0,1.0,2025-06-24 00:36:00
VMX-11586,VM-050,Kolkata,Hospital,17-06-2025,06:20:00,P-109,Doritos,Snacks,132.31,128.0,119.0,9.0,15744.89,RP-013,Deepa,Working,13.9,Cash,4.4,66.0,1.81,69.0,1.0,2025-06-17 06:20:00
VMX-11587,VM-206,Delhi,Hospital,19-04-2025,08:18:00,P-104,Red Bull,Drinks,29.09,150.0,136.0,14.0,3956.24,RP-017,Kiran,Low Power,16.7,Card,3.8,33.0,2.83,259.0,0.0,2025-04-19 08:18:00
VMX-11588,VM-044,Kolkata,Office,10-08-2025,18:03:00,P-107,Colgate Mini,Hygiene,108.04,184.0,184.0,0.0,19879.36,RP-020,Rajesh,Working,11.2,Cash,4.4,33.0,4.18,416.0,1.0,2025-08-10 18:03:00
VMX-11589,VM-167,Hyderabad,Office,03-08-2025,13:46:00,P-101,Pepsi Can,Drinks,57.14,142.0,131.0,11.0,7485.34,RP-003,Fatima,Maintenance,17.6,Cash,4.1,49.0,2.97,199.0,1.0,2025-08-03 13:46:00
VMX-11590,VM-107,Chennai,Metro Station,15-04-2025,09:44:00,P-109,Doritos,Snacks,134.15,194.0,189.0,5.0,25354.35,RP-014,Rahul,Maintenance,14.9,UPI,3.0,116.0,1.07,221.0,1.0,2025-04-15 09:44:00
VMX-11591,VM-024,Bangalore,Office,06-09-2025,10:19:00,P-106,Snickers Bar,Snacks,129.96,167.0,160.0,7.0,20793.6,RP-006,Fatima,Low Power,11.1,Card,3.6,21.0,4.6,460.0,1.0,2025-09-06 10:19:00
VMX-11592,VM-124,Pune,Office,19-06-2025,01:55:00,P-101,Pepsi Can,Drinks,52.09,28.0,24.0,4.0,1250.16,RP-016,Kiran,Maintenance,12.6,UPI,4.6,38.0,3.06,454.0,0.0,2025-06-19 01:55:00
VMX-11593,VM-209,Kolkata,Unknown,28-05-2025,18:15:00,P-106,Snickers Bar,Snacks,116.48,83.0,67.0,16.0,7804.16,RP-002,Kiran,Working,14.8,UPI,2.7,92.0,4.36,61.0,0.0,2025-05-28 18:15:00
VMX-11594,VM-107,Hyderabad,Office,20-06-2025,02:51:00,P-102,Bisleri Water,Drinks,71.5,167.0,155.0,12.0,11082.5,RP-017,Deepa,Working,23.6,Card,3.5,44.0,3.1,438.0,1.0,2025-06-20 02:51:00
VMX-11595,VM-100,Delhi,Hospital,01-08-2025,04:03:00,P-100,Lays Classic,Snacks,134.81,119.0,109.0,10.0,14694.29,RP-007,Anita,Low Power,20.2,Cash,3.9,33.0,2.61,449.0,1.0,2025-08-01 04:03:00
VMX-11596,VM-190,Mumbai,Hospital,19-03-2025,06:14:00,P-103,Oreo Pack,Snacks,42.57,157.0,155.0,2.0,6598.35,RP-003,Rajesh,Maintenance,22.6,Cash,3.3,28.0,4.35,278.0,1.0,2025-03-19 06:14:00
VMX-11597,VM-212,Bangalore,Hospital,08-08-2025,05:43:00,P-104,Red Bull,Drinks,131.29,138.0,124.0,14.0,16279.96,RP-008,Kiran,Low Power,18.1,Card,2.1,78.0,4.61,333.0,1.0,2025-08-08 05:43:00
VMX-11598,VM-123,Chennai,Metro Station,20-05-2025,21:18:00,P-107,Colgate Mini,Hygiene,47.1,146.0,135.0,11.0,6358.5,RP-011,Amit,Maintenance,15.3,Cash,3.3,58.0,4.15,499.0,0.0,2025-05-20 21:18:00
VMX-11599,VM-136,Kolkata,Mall,01-09-2025,09:01:00,P-103,Oreo Pack,Snacks,76.67,139.0,126.0,13.0,9660.42,RP-001,Rajesh,Low Power,17.0,Cash,2.9,56.0,2.4,202.0,0.0,2025-09-01 09:01:00
VMX-11600,VM-030,Kolkata,College,17-04-2025,01:39:00,P-101,Pepsi Can,Drinks,54.39,140.0,134.0,6.0,7288.26,RP-002,Rahul,Low Power,21.1,UPI,3.1,45.0,3.9,126.0,0.0,2025-04-17 01:39:00
VMX-11601,VM-217,Chennai,Mall,26-09-2025,10:41:00,P-104,Red Bull,Drinks,111.13,107.0,100.0,7.0,11113.0,RP-011,Amit,Working,23.0,Cash,4.8,55.0,4.94,373.0,0.0,2025-09-26 10:41:00
VMX-11602,VM-126,Kolkata,Office,10-02-2025,02:03:00,P-100,Lays Classic,Snacks,46.43,27.0,9.0,18.0,417.87,RP-019,Deepa,Low Power,11.2,Card,4.1,76.0,3.01,352.0,1.0,2025-02-10 02:03:00
VMX-11603,VM-163,Pune,Mall,22-02-2025,21:56:00,P-105,Dettol Wipe,Hygiene,149.11,42.0,25.0,17.0,3727.75,RP-015,Anita,Low Power,16.4,UPI,4.2,60.0,2.79,97.0,1.0,2025-02-22 21:56:00
VMX-11604,VM-211,Mumbai,Hospital,25-08-2025,23:37:00,P-108,Sprite Bottle,Drinks,78.16,20.0,12.0,8.0,937.92,RP-018,Amit,Maintenance,19.2,Card,3.1,17.0,2.48,225.0,1.0,2025-08-25 23:37:00
VMX-11605,VM-120,Delhi,Mall,22-05-2025,22:10:00,P-100,Lays Classic,Snacks,83.75,178.0,176.0,2.0,14740.0,RP-001,Amit,Maintenance,20.6,UPI,3.3,36.0,4.42,211.0,1.0,2025-05-22 22:10:00
VMX-11606,VM-080,Hyderabad,Office,05-08-2025,05:58:00,P-107,Colgate Mini,Hygiene,105.26,179.0,162.0,17.0,17052.12,RP-002,Deepa,Working,13.2,Cash,3.6,48.0,1.13,298.0,1.0,2025-08-05 05:58:00
VMX-11607,VM-257,Chennai,Mall,16-02-2025,08:29:00,P-107,Colgate Mini,Hygiene,131.47,74.0,57.0,17.0,7493.79,RP-009,Rajesh,Low Power,23.0,Cash,2.0,41.0,3.42,194.0,0.0,2025-02-16 08:29:00
VMX-11608,VM-116,Kolkata,Office,26-04-2025,16:30:00,P-100,Lays Classic,Snacks,140.2,192.0,187.0,5.0,26217.4,RP-003,Fatima,Maintenance,20.2,UPI,3.2,118.0,4.47,304.0,1.0,2025-04-26 16:30:00
VMX-11609,VM-097,Hyderabad,Mall,07-07-2025,02:32:00,P-104,Red Bull,Drinks,23.37,43.0,37.0,6.0,864.69,RP-012,Fatima,Low Power,12.9,UPI,4.3,68.0,4.26,228.0,0.0,2025-07-07 02:32:00
VMX-11610,VM-251,Pune,Metro Station,27-03-2025,22:07:00,P-109,Doritos,Snacks,140.99,157.0,146.0,11.0,20584.54,RP-011,Deepa,Maintenance,22.1,Cash,4.4,66.0,2.21,396.0,0.0,2025-03-27 22:07:00
VMX-11611,VM-266,Kolkata,College,19-06-2025,11:51:00,P-102,Bisleri Water,Drinks,145.96,161.0,149.0,12.0,21748.04,RP-013,Rajesh,Low Power,21.4,Cash,2.6,26.0,4.77,99.0,0.0,2025-06-19 11:51:00
VMX-11612,VM-022,Delhi,College,08-10-2025,22:48:00,P-104,Red Bull,Drinks,84.55,166.0,164.0,2.0,13866.2,RP-007,Fatima,Working,22.3,UPI,2.6,16.0,3.81,468.0,0.0,2025-10-08 22:48:00
VMX-11613,VM-124,Kolkata,College,09-07-2025,18:29:00,P-104,Red Bull,Drinks,138.06,46.0,27.0,19.0,3727.62,RP-019,Ravi,Working,10.9,UPI,2.5,115.0,1.77,96.0,0.0,2025-07-09 18:29:00
VMX-11614,VM-183,Chennai,Mall,08-05-2025,02:21:00,P-104,Red Bull,Drinks,111.32,42.0,36.0,6.0,4007.52,RP-002,Ravi,Low Power,13.4,Cash,2.2,39.0,2.19,280.0,1.0,2025-05-08 02:21:00
VMX-11615,VM-282,Chennai,Office,28-07-2025,11:39:00,P-108,Sprite Bottle,Drinks,22.31,45.0,44.0,1.0,981.64,RP-011,Rajesh,Low Power,21.1,Card,3.3,95.0,4.2,216.0,1.0,2025-07-28 11:39:00
VMX-11616,VM-137,Chennai,Mall,20-02-2025,04:26:00,P-101,Pepsi Can,Drinks,119.63,67.0,48.0,19.0,5742.24,RP-002,Kiran,Low Power,20.3,Card,4.8,102.0,1.41,264.0,0.0,2025-02-20 04:26:00
VMX-11617,VM-270,Delhi,Mall,17-02-2025,00:03:00,P-106,Unknown,Snacks,147.51,117.0,98.0,19.0,14455.98,RP-006,Anita,Working,22.0,Cash,3.2,18.0,2.67,307.0,0.0,2025-02-17 00:03:00
VMX-11618,VM-088,Delhi,Hospital,02-07-2025,20:25:00,P-102,Bisleri Water,Drinks,106.18,182.0,167.0,15.0,17732.06,RP-020,Rahul,Low Power,24.3,Cash,3.6,80.0,2.08,343.0,0.0,2025-07-02 20:25:00
VMX-11619,VM-181,Mumbai,Mall,13-03-2025,21:51:00,P-100,Lays Classic,Snacks,11.56,165.0,158.0,7.0,1826.48,RP-005,Fatima,Maintenance,16.8,Card,2.6,18.0,1.12,380.0,1.0,2025-03-13 21:51:00
VMX-11620,VM-098,Pune,Hospital,07-03-2025,08:51:00,P-104,Red Bull,Drinks,88.24,177.0,162.0,15.0,14294.88,RP-004,Amit,Maintenance,15.2,UPI,3.0,115.0,3.87,72.0,1.0,2025-03-07 08:51:00
VMX-11621,VM-205,Hyderabad,Hospital,17-03-2025,20:33:00,P-108,Sprite Bottle,Drinks,133.84,184.0,184.0,0.0,24626.56,RP-002,Anita,Maintenance,10.4,Cash,2.8,53.0,4.13,483.0,1.0,2025-03-17 20:33:00
VMX-11622,VM-297,Hyderabad,Office,24-06-2025,01:45:00,P-107,Colgate Mini,Hygiene,46.89,122.0,103.0,19.0,4829.67,RP-003,Fatima,Maintenance,18.8,UPI,3.3,88.0,2.04,68.0,0.0,2025-06-24 01:45:00
VMX-11623,VM-287,Mumbai,Metro Station,10-03-2025,07:32:00,P-106,Snickers Bar,Snacks,56.09,0.0,97.0,13.0,5440.73,RP-017,Fatima,Low Power,20.9,UPI,3.0,89.0,4.93,364.0,0.0,2025-03-10 07:32:00
VMX-11624,VM-071,Kolkata,Metro Station,02-08-2025,20:08:00,P-101,Pepsi Can,Drinks,38.84,188.0,187.0,1.0,7263.08,RP-001,Ravi,Working,22.0,Cash,3.7,1.0,4.69,296.0,1.0,2025-08-02 20:08:00
VMX-11625,VM-009,Bangalore,Office,08-01-2025,06:32:00,P-107,Colgate Mini,Hygiene,136.36,40.0,22.0,18.0,2999.92,RP-004,Anita,Maintenance,18.8,UPI,4.2,71.0,1.67,417.0,1.0,2025-01-08 06:32:00
VMX-11626,VM-025,Chennai,Mall,24-08-2025,18:46:00,P-104,Red Bull,Drinks,20.28,51.0,43.0,8.0,872.04,RP-010,Rajesh,Working,18.4,Card,3.1,11.0,4.83,259.0,1.0,2025-08-24 18:46:00
VMX-11627,VM-202,Mumbai,College,24-04-2025,04:42:00,P-103,Oreo Pack,Snacks,99.54,164.0,154.0,10.0,15329.16,RP-018,Anita,Maintenance,21.4,UPI,4.4,67.0,3.99,261.0,1.0,2025-04-24 04:42:00
VMX-11628,VM-274,Delhi,Mall,27-03-2025,11:49:00,P-106,Snickers Bar,Snacks,106.43,58.0,40.0,18.0,4257.2,RP-006,Fatima,Working,20.8,Cash,4.3,14.0,3.11,128.0,0.0,2025-03-27 11:49:00
VMX-11629,VM-275,Delhi,Office,21-09-2025,10:27:00,P-105,Dettol Wipe,Hygiene,39.35,131.0,115.0,16.0,4525.25,RP-014,Rajesh,Low Power,19.6,Card,2.1,51.0,2.11,460.0,0.0,2025-09-21 10:27:00
VMX-11630,VM-172,Bangalore,College,16-06-2025,18:30:00,P-107,Colgate Mini,Hygiene,146.3,91.0,73.0,18.0,10679.9,RP-008,Deepa,Maintenance,13.0,UPI,3.0,44.0,3.73,413.0,1.0,2025-06-16 18:30:00
VMX-11631,VM-235,Chennai,College,08-09-2025,08:34:00,P-109,Doritos,Snacks,97.99,148.0,129.0,19.0,12640.71,RP-003,Anita,Maintenance,15.8,Cash,3.3,41.0,4.04,479.0,0.0,2025-09-08 08:34:00
VMX-11632,VM-209,Chennai,Office,21-06-2025,07:17:00,P-109,Doritos,Snacks,96.63,128.0,120.0,8.0,11595.6,RP-003,Deepa,Maintenance,16.5,Cash,3.8,56.0,3.12,268.0,0.0,2025-06-21 07:17:00
VMX-11633,VM-259,Kolkata,Mall,16-04-2025,11:47:00,P-100,Lays Classic,Snacks,137.89,32.0,14.0,18.0,1930.46,RP-002,Ravi,Low Power,21.8,Cash,2.3,94.0,2.31,293.0,0.0,2025-04-16 11:47:00
VMX-11634,VM-278,Kolkata,Mall,26-09-2025,08:48:00,P-102,Bisleri Water,Drinks,139.08,57.0,53.0,4.0,7371.24,RP-010,Rahul,Working,17.2,UPI,3.7,72.0,3.51,442.0,1.0,2025-09-26 08:48:00
VMX-11635,VM-005,Kolkata,Mall,17-09-2025,01:17:00,P-106,Snickers Bar,Snacks,101.69,32.0,30.0,2.0,3050.7,RP-007,Anita,Maintenance,10.1,UPI,4.6,56.0,3.99,241.0,1.0,2025-09-17 01:17:00
VMX-11636,VM-140,Mumbai,College,27-06-2025,10:16:00,P-106,Snickers Bar,Snacks,148.15,144.0,141.0,3.0,20889.15,RP-012,Suresh,Maintenance,12.3,UPI,2.1,113.0,2.75,488.0,1.0,2025-06-27 10:16:00
VMX-11637,VM-171,Delhi,Mall,11-03-2025,01:40:00,P-106,Snickers Bar,Snacks,98.62,55.0,40.0,15.0,3944.8,RP-013,Anita,Maintenance,18.6,Cash,3.8,19.0,3.84,470.0,1.0,2025-03-11 01:40:00
VMX-11638,VM-022,Bangalore,College,14-09-2025,11:47:00,P-106,Snickers Bar,Snacks,72.22,180.0,176.0,4.0,12710.72,RP-012,Deepa,Maintenance,23.3,Card,4.5,27.0,3.23,490.0,0.0,2025-09-14 11:47:00
VMX-11639,VM-082,Mumbai,Mall,13-03-2025,02:58:00,P-107,Colgate Mini,Hygiene,73.56,101.0,84.0,17.0,6179.04,RP-014,Anita,Working,24.1,UPI,3.2,82.0,3.05,197.0,1.0,2025-03-13 02:58:00
VMX-11640,VM-289,Delhi,Metro Station,04-09-2025,10:05:00,P-100,Lays Classic,Snacks,72.41,176.0,176.0,0.0,12744.16,RP-004,Rahul,Maintenance,11.0,UPI,3.1,8.0,1.61,396.0,1.0,2025-09-04 10:05:00
VMX-11641,VM-052,Mumbai,Office,26-03-2025,10:13:00,P-104,Red Bull,Drinks,23.44,98.0,79.0,19.0,1851.76,RP-020,Fatima,Working,17.8,Card,4.3,66.0,4.12,222.0,1.0,2025-03-26 10:13:00
VMX-11642,VM-019,Mumbai,College,14-07-2025,10:37:00,P-104,Red Bull,Drinks,71.6,131.0,120.0,11.0,8592.0,RP-012,Deepa,Low Power,20.9,UPI,3.9,90.0,1.84,477.0,1.0,2025-07-14 10:37:00
VMX-11643,VM-053,Chennai,Hospital,30-08-2025,21:31:00,P-103,Oreo Pack,Snacks,147.76,130.0,113.0,17.0,16696.88,RP-019,Amit,Working,20.9,Card,2.8,78.0,4.43,77.0,1.0,2025-08-30 21:31:00
VMX-11644,VM-108,Chennai,Metro Station,02-06-2025,03:22:00,P-106,Snickers Bar,Snacks,142.53,197.0,190.0,7.0,27080.7,RP-015,Rajesh,Working,24.9,Card,2.1,15.0,4.8,379.0,1.0,2025-06-02 03:22:00
VMX-11645,VM-037,Kolkata,Office,15-05-2025,07:42:00,P-107,Colgate Mini,Hygiene,73.68,78.0,69.0,9.0,5083.92,RP-018,Rajesh,Working,12.6,UPI,3.4,64.0,2.35,180.0,0.0,2025-05-15 07:42:00
VMX-11646,VM-202,Pune,Office,07-09-2025,09:06:00,P-103,Oreo Pack,Snacks,57.97,185.0,165.0,20.0,9565.05,RP-012,Rajesh,Working,19.3,UPI,2.5,110.0,1.58,237.0,1.0,2025-09-07 09:06:00
VMX-11647,VM-155,Kolkata,Hospital,26-06-2025,15:47:00,P-105,Dettol Wipe,Hygiene,87.38,192.0,174.0,18.0,15204.12,RP-012,Fatima,Working,19.8,UPI,2.1,100.0,4.59,321.0,1.0,2025-06-26 15:47:00
VMX-11648,VM-155,Mumbai,College,03-05-2025,06:47:00,P-101,Pepsi Can,Drinks,118.74,125.0,120.0,5.0,14248.8,RP-010,Mahesh,Low Power,11.5,UPI,4.4,56.0,3.53,99.0,1.0,2025-05-03 06:47:00
VMX-11649,VM-179,Delhi,Office,29-05-2025,03:35:00,P-107,Colgate Mini,Hygiene,103.72,145.0,138.0,7.0,14313.36,RP-019,Deepa,Working,17.8,Cash,3.5,36.0,2.49,442.0,1.0,2025-05-29 03:35:00
VMX-11650,VM-040,Mumbai,Office,18-07-2025,03:01:00,P-100,Lays Classic,Snacks,27.17,26.0,20.0,6.0,543.4,RP-020,Mahesh,Maintenance,22.7,Cash,3.3,4.0,4.76,285.0,1.0,2025-07-18 03:01:00
VMX-11651,VM-161,Delhi,College,02-04-2025,16:20:00,P-109,Doritos,Snacks,14.68,159.0,146.0,13.0,2143.28,RP-013,Amit,Working,21.2,UPI,3.7,99.0,1.95,331.0,1.0,2025-04-02 16:20:00
VMX-11652,VM-123,Chennai,Office,12-04-2025,13:31:00,P-107,Colgate Mini,Hygiene,66.25,83.0,72.0,11.0,4770.0,RP-017,Rahul,Low Power,10.7,Cash,3.4,17.0,3.14,159.0,1.0,2025-04-12 13:31:00
VMX-11653,VM-004,Hyderabad,Office,24-02-2025,06:39:00,P-101,Pepsi Can,Drinks,145.39,79.0,68.0,11.0,9886.52,RP-007,Mahesh,Maintenance,17.0,UPI,2.5,81.0,2.24,364.0,0.0,2025-02-24 06:39:00
VMX-11654,VM-291,Mumbai,Hospital,10-06-2025,15:45:00,P-106,Snickers Bar,Snacks,66.73,192.0,185.0,7.0,12345.05,RP-003,Anita,Maintenance,24.4,Cash,4.1,109.0,4.89,391.0,0.0,2025-06-10 15:45:00
VMX-11655,VM-187,Pune,Mall,06-07-2025,20:27:00,P-100,Lays Classic,Snacks,137.98,192.0,185.0,7.0,25526.3,RP-013,Mahesh,Maintenance,12.6,UPI,2.5,85.0,2.66,423.0,1.0,2025-07-06 20:27:00
VMX-11656,VM-220,Pune,College,17-09-2025,16:24:00,P-109,Doritos,Snacks,142.44,37.0,33.0,4.0,4700.52,RP-003,Amit,Maintenance,11.9,Cash,4.4,21.0,1.3,370.0,0.0,2025-09-17 16:24:00
VMX-11657,VM-280,Pune,Mall,25-02-2025,18:31:00,P-105,Dettol Wipe,Hygiene,131.34,116.0,114.0,2.0,14972.76,RP-011,Rahul,Low Power,15.9,UPI,3.4,33.0,3.52,189.0,1.0,2025-02-25 18:31:00
VMX-11658,VM-040,Hyderabad,Metro Station,12-06-2025,08:18:00,P-105,Dettol Wipe,Hygiene,108.01,66.0,55.0,11.0,5940.55,RP-004,Fatima,Maintenance,22.8,Card,3.0,27.0,2.53,280.0,0.0,2025-06-12 08:18:00
VMX-11659,VM-283,Kolkata,Metro Station,15-03-2025,01:13:00,P-108,Sprite Bottle,Drinks,145.29,195.0,185.0,10.0,26878.65,RP-004,Rahul,Working,16.7,Card,3.3,38.0,4.12,324.0,1.0,2025-03-15 01:13:00
VMX-11660,VM-039,Chennai,Metro Station,10-03-2025,05:01:00,P-107,Colgate Mini,Hygiene,141.47,86.0,74.0,12.0,10468.78,RP-008,Suresh,Working,14.9,Cash,4.7,14.0,1.74,136.0,0.0,2025-03-10 05:01:00
VMX-11661,VM-150,Mumbai,Hospital,04-09-2025,12:58:00,P-106,Snickers Bar,Snacks,11.6,20.0,4.0,16.0,46.4,RP-002,Rahul,Working,24.9,Card,4.0,55.0,1.43,328.0,0.0,2025-09-04 12:58:00
VMX-11662,VM-248,Delhi,College,02-01-2025,15:26:00,P-107,Colgate Mini,Hygiene,62.81,174.0,163.0,11.0,10238.03,RP-014,Amit,Working,17.5,Cash,2.8,67.0,4.38,252.0,0.0,2025-01-02 15:26:00
VMX-11663,VM-083,Mumbai,Office,24-04-2025,01:14:00,P-104,Red Bull,Drinks,24.42,119.0,101.0,18.0,2466.42,RP-011,Kiran,Low Power,19.2,UPI,2.9,75.0,3.45,255.0,0.0,2025-04-24 01:14:00
VMX-11664,VM-129,Kolkata,Metro Station,11-01-2025,12:50:00,P-105,Dettol Wipe,Hygiene,110.51,195.0,188.0,7.0,20775.88,RP-002,Rahul,Maintenance,20.6,UPI,3.9,29.0,2.19,222.0,0.0,2025-01-11 12:50:00
VMX-11665,VM-192,Pune,Metro Station,05-02-2025,23:55:00,P-109,Doritos,Snacks,73.09,33.0,30.0,3.0,2192.7,RP-004,Suresh,Low Power,24.9,Cash,3.7,59.0,4.82,286.0,1.0,2025-02-05 23:55:00
VMX-11666,VM-204,Delhi,Mall,04-02-2025,19:15:00,P-102,Bisleri Water,Drinks,26.5,105.0,98.0,7.0,2597.0,RP-011,Amit,Low Power,21.9,Cash,2.5,54.0,3.29,437.0,0.0,2025-02-04 19:15:00
VMX-11667,VM-073,Kolkata,Metro Station,22-05-2025,16:00:00,P-108,Sprite Bottle,Drinks,109.1,136.0,125.0,11.0,13637.5,RP-008,Suresh,Low Power,18.2,Card,4.5,24.0,3.73,368.0,0.0,2025-05-22 16:00:00
VMX-11668,VM-160,Chennai,Office,17-06-2025,02:30:00,P-100,Lays Classic,Snacks,67.16,134.0,127.0,7.0,8529.32,RP-013,Unknown,Working,21.6,Card,3.0,3.0,4.5,426.0,0.0,2025-06-17 02:30:00
VMX-11669,VM-045,Pune,Office,06-10-2025,07:12:00,P-104,Red Bull,Drinks,16.59,42.0,38.0,4.0,630.42,RP-012,Fatima,Maintenance,18.7,UPI,3.7,1.0,4.73,223.0,1.0,2025-10-06 07:12:00
VMX-11670,VM-099,Hyderabad,Office,06-09-2025,22:01:00,P-101,Pepsi Can,Drinks,78.99,146.0,144.0,2.0,11374.56,RP-014,Fatima,Low Power,23.6,Card,2.9,16.0,2.01,407.0,1.0,2025-09-06 22:01:00
VMX-11671,VM-285,Pune,Office,04-10-2025,07:48:00,P-100,Lays Classic,Snacks,56.19,120.0,112.0,8.0,6293.28,RP-007,Suresh,Low Power,15.8,UPI,2.3,71.0,2.81,476.0,1.0,2025-10-04 07:48:00
VMX-11672,VM-144,Bangalore,Office,01-02-2025,00:24:00,P-107,Colgate Mini,Hygiene,75.07,190.0,177.0,13.0,13287.39,RP-011,Rahul,Maintenance,16.8,Card,4.0,29.0,4.37,377.0,1.0,2025-02-01 00:24:00
VMX-11673,VM-216,Delhi,Hospital,16-05-2025,18:50:00,P-103,Oreo Pack,Snacks,16.25,77.0,72.0,5.0,1170.0,RP-011,Rajesh,Low Power,24.9,UPI,2.3,0.0,2.21,193.0,0.0,2025-05-16 18:50:00
VMX-11674,VM-177,Mumbai,College,01-03-2025,17:05:00,P-109,Doritos,Snacks,52.49,132.0,126.0,6.0,6613.74,RP-011,Anita,Working,17.3,UPI,3.8,108.0,3.33,234.0,1.0,2025-03-01 17:05:00
VMX-11675,VM-295,Mumbai,Hospital,25-02-2025,01:30:00,P-107,Colgate Mini,Hygiene,67.9,50.0,47.0,3.0,3191.3,RP-010,Rajesh,Low Power,14.3,Card,3.1,43.0,2.85,312.0,1.0,2025-02-25 01:30:00
VMX-11676,VM-173,Chennai,College,18-04-2025,09:32:00,P-102,Bisleri Water,Drinks,33.3,194.0,176.0,18.0,5860.8,RP-007,Rahul,Working,19.1,UPI,4.9,48.0,3.11,228.0,1.0,2025-04-18 09:32:00
VMX-11677,VM-209,Hyderabad,Mall,04-04-2025,20:45:00,P-100,Lays Classic,Snacks,128,117.0,99.0,18.0,12672.0,RP-017,Amit,Low Power,21.7,UPI,2.1,98.0,4.45,275.0,1.0,2025-04-04 20:45:00
VMX-11678,VM-209,Bangalore,Hospital,16-04-2025,18:36:00,P-107,Colgate Mini,Hygiene,93.46,139.0,138.0,1.0,12897.48,RP-008,Rajesh,Low Power,18.8,Card,4.4,118.0,2.78,393.0,0.0,2025-04-16 18:36:00
VMX-11679,VM-215,Bangalore,Mall,05-03-2025,04:35:00,P-100,Lays Classic,Snacks,142.49,81.0,105.0,11.0,9974.3,RP-002,Kiran,Maintenance,24.5,Card,4.7,36.0,1.81,168.0,0.0,2025-03-05 04:35:00
VMX-11680,VM-195,Hyderabad,Hospital,28-04-2025,08:17:00,P-103,Oreo Pack,Snacks,17.26,56.0,50.0,6.0,863.0,RP-001,Kiran,Maintenance,24.8,UPI,4.1,87.0,4.67,254.0,1.0,2025-04-28 08:17:00
VMX-11681,VM-072,Pune,Office,20-07-2025,10:49:00,P-102,Bisleri Water,Drinks,36.7,132.0,115.0,17.0,4220.5,RP-003,Amit,Maintenance,15.2,UPI,4.1,6.0,1.13,245.0,1.0,2025-07-20 10:49:00
VMX-11682,VM-175,Bangalore,College,28-05-2025,17:30:00,P-104,Red Bull,Drinks,84.35,162.0,152.0,10.0,12821.2,RP-004,Rahul,Maintenance,21.3,Card,4.3,32.0,1.67,229.0,1.0,2025-05-28 17:30:00
VMX-11683,VM-155,Bangalore,Office,07-05-2025,14:26:00,P-102,Bisleri Water,Drinks,84.12,21.0,11.0,10.0,925.32,RP-011,Mahesh,Low Power,18.4,UPI,3.7,81.0,4.84,328.0,1.0,2025-05-07 14:26:00
VMX-11684,VM-128,Hyderabad,Hospital,08-03-2025,05:07:00,P-100,Lays Classic,Snacks,105.02,30.0,23.0,7.0,2415.46,RP-002,Ravi,Maintenance,24.5,UPI,3.7,53.0,4.69,353.0,0.0,2025-03-08 05:07:00
VMX-11685,VM-266,Mumbai,Mall,05-09-2025,05:58:00,P-108,Sprite Bottle,Drinks,123.56,164.0,148.0,16.0,18286.88,RP-003,Anita,Working,22.1,Card,3.1,52.0,1.69,468.0,0.0,2025-09-05 05:58:00
VMX-11686,VM-219,Hyderabad,Mall,08-06-2025,09:07:00,P-107,Colgate Mini,Hygiene,138.2,167.0,155.0,12.0,21421.0,RP-007,Amit,Maintenance,18.4,Cash,3.4,2.0,2.3,409.0,0.0,2025-06-08 09:07:00
VMX-11687,VM-076,Delhi,Mall,10-02-2025,04:01:00,P-102,Bisleri Water,Drinks,83.79,99.0,89.0,10.0,7457.31,RP-001,Ravi,Maintenance,23.3,UPI,2.9,34.0,1.27,191.0,1.0,2025-02-10 04:01:00
VMX-11688,VM-213,Bangalore,Hospital,29-01-2025,08:25:00,P-109,Doritos,Snacks,29.25,198.0,196.0,2.0,5733.0,RP-011,Mahesh,Working,15.3,UPI,4.0,73.0,2.79,191.0,0.0,2025-01-29 08:25:00
VMX-11689,VM-175,Chennai,Metro Station,04-09-2025,17:58:00,P-100,Lays Classic,Snacks,42.17,121.0,120.0,1.0,5060.4,RP-007,Suresh,Working,18.6,UPI,3.5,63.0,1.57,171.0,0.0,2025-09-04 17:58:00
VMX-11690,VM-046,Kolkata,Office,07-08-2025,01:50:00,P-106,Snickers Bar,Snacks,84.89,184.0,184.0,0.0,15619.76,RP-011,Rajesh,Maintenance,12.3,Cash,3.2,9.0,2.07,389.0,1.0,2025-08-07 01:50:00
VMX-11691,VM-187,Hyderabad,College,24-08-2025,00:06:00,P-108,Sprite Bottle,Drinks,108.52,178.0,158.0,20.0,17146.16,RP-019,Kiran,Low Power,19.1,UPI,4.0,3.0,3.47,229.0,0.0,2025-08-24 00:06:00
VMX-11692,VM-181,Bangalore,Mall,21-03-2025,17:46:00,P-109,Doritos,Snacks,28.3,50.0,33.0,17.0,933.9,RP-008,Amit,Maintenance,16.7,Cash,4.5,73.0,3.59,151.0,1.0,2025-03-21 17:46:00
VMX-11693,VM-191,Chennai,College,22-02-2025,10:34:00,P-109,Doritos,Snacks,57.67,61.0,43.0,18.0,2479.81,RP-003,Kiran,Working,22.0,Card,3.3,36.0,3.41,59.0,1.0,2025-02-22 10:34:00
VMX-11694,VM-094,Chennai,Metro Station,26-02-2025,09:58:00,P-105,Dettol Wipe,Hygiene,126.27,137.0,128.0,9.0,16162.56,RP-015,Suresh,Maintenance,16.2,UPI,2.4,76.0,1.32,329.0,0.0,2025-02-26 09:58:00
VMX-11695,VM-121,Kolkata,Hospital,29-08-2025,23:28:00,P-101,Pepsi Can,Drinks,34.89,187.0,169.0,18.0,5896.41,RP-015,Rajesh,Working,23.2,UPI,2.9,81.0,2.22,372.0,1.0,2025-08-29 23:28:00
VMX-11696,VM-193,Chennai,Hospital,11-09-2025,05:38:00,P-104,Red Bull,Drinks,97.17,138.0,122.0,16.0,11854.74,RP-004,Deepa,Low Power,21.3,UPI,2.7,66.0,4.47,381.0,0.0,2025-09-11 05:38:00
VMX-11697,VM-274,Delhi,College,26-04-2025,08:59:00,P-102,Bisleri Water,Drinks,95.87,166.0,165.0,1.0,15818.55,RP-010,Amit,Low Power,17.1,UPI,4.9,80.0,1.12,75.0,1.0,2025-04-26 08:59:00
VMX-11698,VM-213,Bangalore,Office,05-09-2025,07:30:00,P-100,Lays Classic,Snacks,94.2,127.0,116.0,11.0,10927.2,RP-006,Kiran,Low Power,20.4,Card,4.5,16.0,2.46,354.0,0.0,2025-09-05 07:30:00
VMX-11699,VM-044,Delhi,Office,28-01-2025,19:48:00,P-100,Lays Classic,Snacks,40.92,173.0,166.0,7.0,6792.72,RP-002,Ravi,Maintenance,15.0,UPI,2.7,120.0,3.84,435.0,1.0,2025-01-28 19:48:00
VMX-11700,VM-169,Mumbai,Metro Station,03-02-2025,08:31:00,P-102,Bisleri Water,Drinks,124.74,121.0,112.0,9.0,13970.88,RP-001,Mahesh,Maintenance,11.0,UPI,2.4,78.0,4.19,161.0,1.0,2025-02-03 08:31:00
VMX-11701,VM-295,Pune,Mall,06-06-2025,05:10:00,P-109,Doritos,Snacks,83.85,89.0,75.0,14.0,6288.75,RP-011,Rahul,Low Power,20.3,Card,3.4,61.0,4.19,92.0,1.0,2025-06-06 05:10:00
VMX-11702,VM-084,Delhi,Office,27-03-2025,13:49:00,P-103,Oreo Pack,Snacks,130.83,25.0,20.0,5.0,2616.6,RP-015,Suresh,Low Power,14.9,Cash,4.2,18.0,3.42,58.0,0.0,2025-03-27 13:49:00
VMX-11703,VM-155,Bangalore,Hospital,04-02-2025,20:19:00,P-100,Lays Classic,Snacks,70.53,136.0,123.0,13.0,8675.19,RP-017,Rajesh,Working,22.6,Card,3.0,33.0,3.63,76.0,1.0,2025-02-04 20:19:00
VMX-11704,VM-032,Delhi,Hospital,10-09-2025,19:09:00,P-102,Bisleri Water,Drinks,99.78,51.0,39.0,12.0,3891.42,RP-015,Deepa,Low Power,24.2,Cash,3.9,39.0,4.82,400.0,1.0,2025-09-10 19:09:00
VMX-11705,VM-090,Pune,Hospital,04-04-2025,22:22:00,P-109,Doritos,Snacks,12.69,101.0,95.0,6.0,1205.55,RP-018,Suresh,Low Power,16.9,Cash,4.5,105.0,3.04,163.0,0.0,2025-04-04 22:22:00
VMX-11706,VM-107,Hyderabad,Mall,24-06-2025,07:40:00,P-100,Lays Classic,Snacks,140.8,79.0,71.0,8.0,9996.8,RP-008,Kiran,Low Power,11.5,Cash,2.5,97.0,2.9,179.0,0.0,2025-06-24 07:40:00
VMX-11707,VM-118,Chennai,College,22-03-2025,01:15:00,P-109,Doritos,Snacks,85.42,68.0,54.0,14.0,4612.68,RP-011,Ravi,Low Power,10.7,Cash,4.5,41.0,1.38,64.0,1.0,2025-03-22 01:15:00
VMX-11708,VM-137,Delhi,College,01-10-2025,15:03:00,P-101,Pepsi Can,Drinks,61.19,111.0,101.0,10.0,6180.19,RP-009,Amit,Working,23.4,Card,4.0,43.0,2.57,86.0,0.0,2025-10-01 15:03:00
VMX-11709,VM-120,Pune,College,14-02-2025,04:20:00,P-109,Doritos,Snacks,96.89,115.0,104.0,11.0,10076.56,RP-016,Fatima,Working,18.8,Cash,4.5,93.0,4.89,226.0,0.0,2025-02-14 04:20:00
VMX-11710,VM-241,Hyderabad,Office,11-05-2025,02:39:00,P-105,Dettol Wipe,Hygiene,110.17,77.0,68.0,9.0,7491.56,RP-016,Deepa,Low Power,17.4,Cash,4.7,50.0,2.73,168.0,0.0,2025-05-11 02:39:00
VMX-11711,VM-221,Hyderabad,Hospital,29-07-2025,07:01:00,P-108,Sprite Bottle,Drinks,98.45,53.0,45.0,8.0,4430.25,RP-005,Ravi,Maintenance,20.0,Card,4.0,114.0,4.79,271.0,0.0,2025-07-29 07:01:00
VMX-11712,VM-022,Chennai,Mall,12-08-2025,02:20:00,P-105,Dettol Wipe,Hygiene,28.4,20.0,6.0,14.0,170.4,RP-002,Deepa,Maintenance,18.4,UPI,3.5,45.0,3.67,265.0,1.0,2025-08-12 02:20:00
VMX-11713,VM-013,Pune,College,21-04-2025,22:27:00,P-107,Colgate Mini,Hygiene,132.82,98.0,0.0,6.0,12219.44,RP-019,Mahesh,Working,10.7,UPI,4.3,53.0,3.93,484.0,0.0,2025-04-21 22:27:00
VMX-11714,VM-051,Pune,Metro Station,26-09-2025,16:35:00,P-103,Oreo Pack,Snacks,93.99,144.0,128.0,16.0,12030.72,RP-007,Mahesh,Low Power,22.0,UPI,4.0,49.0,4.75,334.0,0.0,2025-09-26 16:35:00
VMX-11715,VM-181,Mumbai,Metro Station,30-06-2025,02:33:00,P-106,Snickers Bar,Snacks,145.36,141.0,124.0,17.0,18024.64,RP-002,Deepa,Maintenance,10.5,Card,3.1,51.0,4.03,324.0,0.0,2025-06-30 02:33:00
VMX-11716,VM-250,Bangalore,College,07-01-2025,15:09:00,P-106,Snickers Bar,Snacks,77.01,154.0,153.0,1.0,11782.53,RP-018,Ravi,Maintenance,20.0,UPI,3.3,80.0,1.77,157.0,1.0,2025-01-07 15:09:00
VMX-11717,VM-015,Pune,Mall,25-04-2025,23:46:00,P-106,Snickers Bar,Snacks,49.58,139.0,123.0,16.0,6098.34,RP-002,Kiran,Maintenance,16.7,Card,4.3,74.0,3.52,341.0,1.0,2025-04-25 23:46:00
VMX-11718,VM-237,Hyderabad,Office,08-10-2025,06:26:00,P-101,Pepsi Can,Drinks,99.82,108.0,99.0,9.0,9882.18,RP-013,Rajesh,Low Power,18.5,UPI,3.1,65.0,3.89,280.0,1.0,2025-10-08 06:26:00
VMX-11719,VM-156,Chennai,Hospital,21-02-2025,02:27:00,P-101,Pepsi Can,Drinks,131.58,106.0,91.0,15.0,11973.78,RP-002,Deepa,Maintenance,19.1,UPI,4.5,26.0,4.99,177.0,0.0,2025-02-21 02:27:00
VMX-11720,VM-076,Hyderabad,College,13-08-2025,06:37:00,P-108,Sprite Bottle,Drinks,16.83,180.0,160.0,20.0,2692.8,RP-005,Deepa,Maintenance,22.5,UPI,3.3,97.0,4.16,172.0,1.0,2025-08-13 06:37:00
VMX-11721,VM-254,Delhi,Metro Station,13-04-2025,03:24:00,P-107,Colgate Mini,Hygiene,77.5,81.0,81.0,0.0,6277.5,RP-016,Ravi,Maintenance,21.7,UPI,2.3,36.0,3.19,394.0,0.0,2025-04-13 03:24:00
VMX-11722,VM-149,Chennai,Office,30-01-2025,04:23:00,P-100,Lays Classic,Snacks,129.3,56.0,48.0,8.0,6206.4,RP-001,Mahesh,Low Power,14.4,Cash,3.5,95.0,3.88,390.0,0.0,2025-01-30 04:23:00
VMX-11723,VM-262,Mumbai,Mall,23-08-2025,07:33:00,P-109,Doritos,Snacks,128.53,122.0,102.0,20.0,13110.06,RP-010,Kiran,Working,15.9,Cash,2.6,101.0,4.09,177.0,0.0,2025-08-23 07:33:00
VMX-11724,VM-081,Pune,Office,30-05-2025,07:20:00,P-100,Lays Classic,Snacks,13.85,168.0,166.0,2.0,2299.1,RP-020,Suresh,Working,17.4,Card,2.8,56.0,4.97,339.0,1.0,2025-05-30 07:20:00
VMX-11725,VM-255,Delhi,Mall,20-03-2025,16:39:00,P-105,Dettol Wipe,Hygiene,148.65,125.0,113.0,12.0,16797.45,RP-012,Ravi,Maintenance,19.1,UPI,2.5,43.0,1.62,448.0,1.0,2025-03-20 16:39:00
VMX-11726,VM-115,Chennai,College,08-05-2025,01:08:00,P-106,Snickers Bar,Snacks,17.8,62.0,58.0,4.0,1032.4,RP-012,Kiran,Maintenance,17.0,Cash,2.6,10.0,3.64,315.0,0.0,2025-05-08 01:08:00
VMX-11727,VM-007,Chennai,College,26-03-2025,16:56:00,P-104,Red Bull,Drinks,24.32,152.0,132.0,20.0,3210.24,RP-014,Kiran,Low Power,10.7,Card,4.4,108.0,1.72,346.0,0.0,2025-03-26 16:56:00
VMX-11728,VM-018,Pune,Metro Station,06-09-2025,20:39:00,P-107,Colgate Mini,Hygiene,83.81,95.0,87.0,8.0,7291.47,RP-013,Suresh,Low Power,11.2,Cash,3.4,78.0,2.29,332.0,1.0,2025-09-06 20:39:00
VMX-11729,VM-285,Bangalore,Office,23-03-2025,08:44:00,P-104,Red Bull,Drinks,52.41,23.0,19.0,4.0,995.79,RP-018,Fatima,Low Power,12.9,Cash,2.7,59.0,1.94,89.0,1.0,2025-03-23 08:44:00
VMX-11730,VM-079,Mumbai,Hospital,30-09-2025,01:44:00,P-105,Dettol Wipe,Hygiene,15.82,38.0,35.0,3.0,553.7,RP-019,Ravi,Low Power,21.8,Card,4.3,85.0,3.3,53.0,1.0,2025-09-30 01:44:00
VMX-11731,VM-064,Kolkata,College,14-09-2025,18:53:00,P-101,Pepsi Can,Drinks,13.43,136.0,134.0,2.0,1799.62,RP-019,Rahul,Working,21.0,UPI,4.9,86.0,3.4,205.0,1.0,2025-09-14 18:53:00
VMX-11732,VM-113,Chennai,College,29-05-2025,02:02:00,P-106,Snickers Bar,Snacks,88.43,191.0,185.0,6.0,16359.55,RP-009,Ravi,Working,21.3,Card,2.3,120.0,4.43,487.0,0.0,2025-05-29 02:02:00
VMX-11733,VM-060,Mumbai,Metro Station,29-04-2025,05:20:00,P-104,Red Bull,Drinks,11.36,107.0,105.0,2.0,1192.8,RP-001,Anita,Low Power,16.8,Card,3.1,0.0,3.29,190.0,0.0,2025-04-29 05:20:00
VMX-11734,VM-036,Hyderabad,Mall,23-08-2025,16:13:00,P-106,Snickers Bar,Snacks,73.45,95.0,79.0,16.0,5802.55,RP-004,Anita,Low Power,21.4,UPI,2.8,60.0,1.5,441.0,0.0,2025-08-23 16:13:00
VMX-11735,VM-138,Hyderabad,Mall,18-05-2025,01:29:00,P-107,Colgate Mini,Hygiene,55.94,140.0,121.0,19.0,6768.74,RP-007,Rajesh,Low Power,13.9,Card,3.7,117.0,4.88,280.0,0.0,2025-05-18 01:29:00
VMX-11736,VM-202,Delhi,Metro Station,24-02-2025,22:14:00,P-109,Doritos,Snacks,141.96,83.0,64.0,19.0,9085.44,RP-010,Ravi,Working,22.2,UPI,4.9,9.0,1.02,247.0,0.0,2025-02-24 22:14:00
VMX-11737,VM-285,Hyderabad,Office,30-04-2025,02:44:00,P-103,Oreo Pack,Snacks,33.5,135.0,124.0,11.0,4154.0,RP-016,Kiran,Working,11.3,Cash,2.2,68.0,3.41,379.0,1.0,2025-04-30 02:44:00
VMX-11738,VM-020,Mumbai,Office,14-06-2025,07:25:00,P-104,Red Bull,Drinks,66.98,44.0,39.0,5.0,2612.22,RP-001,Mahesh,Low Power,16.6,Card,3.2,76.0,2.2,337.0,1.0,2025-06-14 07:25:00
VMX-11739,VM-036,Mumbai,College,18-09-2025,08:33:00,P-109,Doritos,Snacks,124.28,171.0,163.0,8.0,20257.64,RP-008,Kiran,Working,10.4,Cash,4.8,58.0,4.19,52.0,0.0,2025-09-18 08:33:00
VMX-11740,VM-159,Pune,Mall,04-09-2025,10:36:00,P-107,Colgate Mini,Hygiene,78.08,76.0,56.0,20.0,4372.48,RP-007,Mahesh,Low Power,17.9,Cash,4.8,9.0,2.77,343.0,1.0,2025-09-04 10:36:00
VMX-11741,VM-048,Chennai,Office,13-01-2025,05:59:00,P-100,Lays Classic,Snacks,148.98,91.0,72.0,19.0,10726.56,RP-010,Ravi,Low Power,15.0,Card,3.3,35.0,1.91,169.0,1.0,2025-01-13 05:59:00
VMX-11742,VM-291,Hyderabad,Hospital,11-07-2025,05:14:00,P-109,Doritos,Snacks,112.26,199.0,189.0,10.0,21217.14,RP-001,Suresh,Maintenance,13.5,Cash,4.7,112.0,4.75,78.0,1.0,2025-07-11 05:14:00
VMX-11743,VM-207,Chennai,Mall,03-04-2025,12:40:00,P-109,Doritos,Snacks,107.26,169.0,151.0,18.0,16196.26,RP-013,Ravi,Maintenance,19.2,Card,4.5,30.0,1.42,282.0,0.0,2025-04-03 12:40:00
VMX-11744,VM-078,Bangalore,Metro Station,20-05-2025,16:31:00,P-109,Doritos,Snacks,131.67,129.0,125.0,4.0,16458.75,RP-012,Fatima,Low Power,22.9,Card,2.7,79.0,1.61,295.0,1.0,2025-05-20 16:31:00
VMX-11745,VM-296,Bangalore,College,10-02-2025,07:17:00,P-108,Sprite Bottle,Drinks,73.45,43.0,35.0,8.0,2570.75,RP-016,Rahul,Low Power,16.6,Cash,3.3,46.0,2.46,378.0,0.0,2025-02-10 07:17:00
VMX-11746,VM-063,Mumbai,Mall,06-03-2025,03:56:00,P-107,Colgate Mini,Hygiene,132.18,101.0,87.0,14.0,11499.66,RP-011,Mahesh,Low Power,20.5,Card,3.7,24.0,4.74,239.0,1.0,2025-03-06 03:56:00
VMX-11747,VM-230,Hyderabad,College,01-10-2025,22:38:00,P-106,Snickers Bar,Snacks,52.32,73.0,0.0,18.0,2877.6,RP-010,Deepa,Low Power,17.3,Cash,3.8,30.0,2.0,117.0,1.0,2025-10-01 22:38:00
VMX-11748,VM-065,Pune,College,19-03-2025,11:20:00,P-101,Pepsi Can,Drinks,111.4,121.0,109.0,12.0,12142.6,RP-011,Mahesh,Maintenance,23.9,UPI,5.0,0.0,1.19,91.0,0.0,2025-03-19 11:20:00
VMX-11749,VM-300,Mumbai,Mall,07-02-2025,13:04:00,P-100,Lays Classic,Snacks,21.64,103.0,90.0,13.0,1947.6,RP-018,Anita,Low Power,24.5,Card,3.9,65.0,1.33,94.0,0.0,2025-02-07 13:04:00
VMX-11750,VM-099,Pune,Office,13-03-2025,20:48:00,P-100,Lays Classic,Snacks,16.56,162.0,146.0,16.0,2417.76,RP-013,Rahul,Maintenance,10.8,Card,4.1,113.0,4.65,469.0,1.0,2025-03-13 20:48:00
VMX-11751,VM-135,Pune,College,07-02-2025,01:16:00,P-107,Colgate Mini,Hygiene,27.9,192.0,186.0,6.0,5189.4,RP-016,Rajesh,Maintenance,13.7,UPI,4.6,120.0,2.45,212.0,1.0,2025-02-07 01:16:00
VMX-11752,VM-072,Hyderabad,Hospital,29-09-2025,17:08:00,P-101,Pepsi Can,Drinks,94.83,52.0,50.0,2.0,4741.5,RP-007,Ravi,Maintenance,20.9,UPI,4.5,15.0,2.92,82.0,0.0,2025-09-29 17:08:00
VMX-11753,VM-224,Pune,Mall,01-03-2025,22:40:00,P-100,Lays Classic,Snacks,31.78,125.0,117.0,8.0,3718.26,RP-014,Fatima,Working,14.8,Card,3.8,8.0,2.66,286.0,1.0,2025-03-01 22:40:00
VMX-11754,VM-035,Delhi,Metro Station,26-04-2025,18:42:00,P-104,Red Bull,Drinks,12.09,82.0,78.0,4.0,943.02,RP-008,Amit,Low Power,12.1,Card,2.4,113.0,3.54,255.0,1.0,2025-04-26 18:42:00
VMX-11755,VM-291,Chennai,Mall,25-08-2025,18:16:00,P-101,Pepsi Can,Drinks,34.47,174.0,167.0,7.0,5756.49,RP-006,Deepa,Working,23.6,UPI,4.3,33.0,2.21,316.0,1.0,2025-08-25 18:16:00
VMX-11756,VM-058,Kolkata,College,05-10-2025,13:32:00,P-103,Oreo Pack,Snacks,122.2,181.0,168.0,13.0,20529.6,RP-003,Anita,Working,13.3,UPI,2.8,77.0,3.83,62.0,1.0,2025-10-05 13:32:00
VMX-11757,VM-029,Kolkata,Hospital,12-06-2025,22:22:00,P-108,Sprite Bottle,Drinks,79.96,41.0,31.0,10.0,2478.76,RP-006,Rajesh,Maintenance,17.2,Card,2.2,118.0,2.43,100.0,0.0,2025-06-12 22:22:00
VMX-11758,VM-060,Mumbai,Mall,01-05-2025,14:10:00,P-100,Lays Classic,Snacks,109.85,88.0,76.0,12.0,8348.6,RP-013,Kiran,Maintenance,10.3,Cash,2.6,65.0,2.19,324.0,0.0,2025-05-01 14:10:00
VMX-11759,VM-117,Delhi,Hospital,08-09-2025,14:49:00,P-102,Bisleri Water,Drinks,97.15,108.0,89.0,19.0,8646.35,RP-019,Suresh,Maintenance,22.5,UPI,4.6,40.0,4.05,84.0,0.0,2025-09-08 14:49:00
VMX-11760,VM-111,Mumbai,Hospital,07-02-2025,02:30:00,P-104,Red Bull,Drinks,110.77,88.0,86.0,2.0,9526.22,RP-001,Suresh,Maintenance,17.9,Cash,4.9,50.0,4.83,287.0,1.0,2025-02-07 02:30:00
VMX-11761,VM-083,Bangalore,Mall,30-05-2025,23:54:00,P-101,Pepsi Can,Drinks,24.48,113.0,96.0,17.0,2350.08,RP-001,Mahesh,Maintenance,10.6,UPI,4.9,4.0,3.97,310.0,0.0,2025-05-30 23:54:00
VMX-11762,VM-115,Kolkata,Mall,13-03-2025,16:29:00,P-109,Doritos,Snacks,144.96,180.0,172.0,8.0,24933.12,RP-004,Mahesh,Low Power,20.2,Card,3.6,10.0,1.69,275.0,0.0,2025-03-13 16:29:00
VMX-11763,VM-002,Mumbai,Mall,28-06-2025,04:11:00,P-106,Snickers Bar,Snacks,147.42,94.0,77.0,17.0,11351.34,RP-001,Ravi,Maintenance,16.7,Cash,3.7,17.0,3.18,179.0,0.0,2025-06-28 04:11:00
VMX-11764,VM-203,Chennai,College,09-08-2025,06:40:00,P-106,Snickers Bar,Snacks,105.46,61.0,46.0,15.0,4851.16,RP-006,Rahul,Maintenance,21.0,UPI,3.0,87.0,3.84,59.0,1.0,2025-08-09 06:40:00
VMX-11765,VM-132,Delhi,Mall,05-06-2025,22:34:00,P-101,Pepsi Can,Drinks,14.53,49.0,30.0,19.0,435.9,RP-005,Kiran,Working,13.1,Cash,2.0,53.0,1.04,281.0,0.0,2025-06-05 22:34:00
VMX-11766,VM-098,Delhi,Office,28-09-2025,07:00:00,P-102,Bisleri Water,Drinks,43.69,29.0,25.0,4.0,1092.25,RP-005,Anita,Working,24.9,UPI,4.4,73.0,1.46,272.0,0.0,2025-09-28 07:00:00
VMX-11767,VM-114,Hyderabad,Hospital,01-08-2025,22:25:00,P-108,Sprite Bottle,Drinks,14.22,175.0,172.0,3.0,2445.84,RP-014,Rahul,Low Power,22.5,UPI,4.2,39.0,1.04,155.0,0.0,2025-08-01 22:25:00
VMX-11768,VM-224,Mumbai,Office,10-01-2025,12:06:00,P-104,Red Bull,Drinks,62.33,84.0,82.0,2.0,5111.06,RP-019,Rajesh,Working,10.5,Card,2.9,100.0,3.94,332.0,0.0,2025-01-10 12:06:00
VMX-11769,VM-074,Pune,Hospital,08-09-2025,13:19:00,P-101,Pepsi Can,Drinks,56.09,187.0,184.0,3.0,10320.56,RP-006,Fatima,Working,18.8,UPI,2.3,45.0,1.02,468.0,0.0,2025-09-08 13:19:00
VMX-11770,VM-100,Hyderabad,Office,01-08-2025,03:46:00,P-109,Doritos,Snacks,145.01,124.0,105.0,19.0,15226.05,RP-006,Deepa,Low Power,12.4,Cash,4.1,17.0,3.64,332.0,0.0,2025-08-01 03:46:00
VMX-11771,VM-156,Bangalore,Office,22-08-2025,20:28:00,P-105,Dettol Wipe,Hygiene,80.45,160.0,154.0,6.0,12389.3,RP-009,Mahesh,Maintenance,22.8,UPI,3.5,51.0,1.7,224.0,0.0,2025-08-22 20:28:00
VMX-11772,VM-082,Kolkata,Office,01-03-2025,10:49:00,P-109,Doritos,Snacks,60.98,47.0,45.0,2.0,2744.1,RP-011,Fatima,Maintenance,16.5,Cash,3.4,90.0,3.17,325.0,0.0,2025-03-01 10:49:00
VMX-11773,VM-010,Bangalore,College,22-05-2025,17:37:00,P-106,Snickers Bar,Snacks,15.65,41.0,27.0,14.0,422.55,RP-009,Deepa,Maintenance,23.4,Card,2.0,97.0,3.37,110.0,1.0,2025-05-22 17:37:00
VMX-11774,VM-113,Chennai,Office,02-04-2025,19:57:00,P-101,Pepsi Can,Drinks,121.9,99.0,95.0,4.0,11580.5,RP-010,Deepa,Maintenance,23.2,Cash,3.0,101.0,2.41,258.0,1.0,2025-04-02 19:57:00
VMX-11775,VM-097,Kolkata,Hospital,15-02-2025,03:43:00,P-105,Dettol Wipe,Hygiene,72.29,173.0,154.0,19.0,11132.66,RP-019,Fatima,Working,10.3,UPI,4.3,59.0,2.65,123.0,1.0,2025-02-15 03:43:00
VMX-11776,VM-282,Pune,Office,14-02-2025,12:00:00,P-104,Red Bull,Drinks,55.52,194.0,191.0,3.0,10604.32,RP-017,Rahul,Low Power,23.7,Cash,4.4,13.0,4.51,387.0,0.0,2025-02-14 12:00:00
VMX-11777,VM-193,Hyderabad,College,14-07-2025,22:33:00,P-102,Bisleri Water,Drinks,26.28,72.0,66.0,6.0,1734.48,RP-017,Suresh,Low Power,16.9,Card,4.2,16.0,3.69,375.0,0.0,2025-07-14 22:33:00
VMX-11778,VM-060,Delhi,Mall,19-07-2025,03:47:00,P-100,Lays Classic,Snacks,106.16,146.0,138.0,8.0,14650.08,RP-019,Rahul,Maintenance,17.2,Card,2.4,13.0,3.53,218.0,1.0,2025-07-19 03:47:00
VMX-11779,VM-277,Pune,Office,24-09-2025,21:31:00,P-100,Lays Classic,Snacks,137.73,76.0,70.0,6.0,9641.1,RP-005,Fatima,Low Power,21.0,Card,4.6,65.0,2.59,383.0,0.0,2025-09-24 21:31:00
VMX-11780,VM-125,Hyderabad,Metro Station,28-08-2025,12:44:00,P-108,Sprite Bottle,Drinks,118.22,86.0,79.0,7.0,9339.38,RP-001,Mahesh,Low Power,13.6,Card,2.9,74.0,4.92,485.0,1.0,2025-08-28 12:44:00
VMX-11781,VM-057,Kolkata,College,10-05-2025,09:17:00,P-104,Red Bull,Drinks,53.77,195.0,175.0,20.0,9409.75,RP-015,Kiran,Maintenance,23.6,Cash,4.2,17.0,2.54,444.0,1.0,2025-05-10 09:17:00
VMX-11782,VM-201,Hyderabad,Office,01-07-2025,18:06:00,P-104,Red Bull,Drinks,101.59,96.0,82.0,14.0,8330.38,RP-008,Deepa,Maintenance,19.8,Card,2.6,78.0,3.06,370.0,0.0,2025-07-01 18:06:00
VMX-11783,VM-161,Mumbai,Metro Station,08-08-2025,11:32:00,P-107,Colgate Mini,Hygiene,123.73,200.0,182.0,18.0,22518.86,RP-008,Rajesh,Low Power,16.2,Card,2.2,61.0,3.1,471.0,0.0,2025-08-08 11:32:00
VMX-11784,VM-051,Kolkata,Hospital,30-01-2025,14:41:00,P-104,Red Bull,Drinks,104.81,145.0,139.0,6.0,14568.59,RP-015,Kiran,Working,23.2,Card,3.9,24.0,2.27,63.0,0.0,2025-01-30 14:41:00
VMX-11785,VM-102,Delhi,Metro Station,22-03-2025,04:12:00,P-107,Colgate Mini,Hygiene,81.1,75.0,63.0,12.0,5109.3,RP-011,Anita,Working,13.5,Cash,3.2,75.0,3.42,116.0,1.0,2025-03-22 04:12:00
VMX-11786,VM-202,Chennai,Mall,12-03-2025,21:51:00,P-100,Lays Classic,Snacks,111.93,77.0,75.0,2.0,8394.75,RP-006,Rajesh,Working,14.7,Card,4.1,103.0,1.48,369.0,1.0,2025-03-12 21:51:00
VMX-11787,VM-126,Chennai,Hospital,07-04-2025,04:08:00,P-102,Bisleri Water,Drinks,46.75,196.0,195.0,1.0,9116.25,RP-016,Ravi,Low Power,16.4,Card,3.0,4.0,3.34,413.0,1.0,2025-04-07 04:08:00
VMX-11788,VM-021,Mumbai,College,22-01-2025,04:02:00,P-105,Dettol Wipe,Hygiene,61.54,197.0,183.0,14.0,11261.82,RP-016,Anita,Working,12.9,UPI,2.8,119.0,4.17,338.0,1.0,2025-01-22 04:02:00
VMX-11789,VM-128,Delhi,Metro Station,25-02-2025,17:36:00,P-107,Colgate Mini,Hygiene,121.89,48.0,43.0,5.0,5241.27,RP-003,Amit,Low Power,20.2,Cash,4.5,41.0,1.12,426.0,1.0,2025-02-25 17:36:00
VMX-11790,VM-014,Chennai,Hospital,05-10-2025,20:15:00,P-101,Pepsi Can,Drinks,136.86,63.0,59.0,4.0,8074.74,RP-010,Anita,Low Power,18.4,UPI,2.7,0.0,4.75,239.0,1.0,2025-10-05 20:15:00
VMX-11791,VM-209,Bangalore,Office,20-06-2025,01:08:00,P-105,Dettol Wipe,Hygiene,123.58,107.0,89.0,18.0,10998.62,RP-014,Mahesh,Low Power,17.5,Card,3.8,86.0,2.25,456.0,0.0,2025-06-20 01:08:00
VMX-11792,VM-032,Chennai,Hospital,09-04-2025,18:46:00,P-103,Oreo Pack,Snacks,100.46,144.0,131.0,13.0,13160.26,RP-002,Mahesh,Maintenance,12.7,Card,4.5,51.0,3.26,419.0,0.0,2025-04-09 18:46:00
VMX-11793,VM-077,Hyderabad,Metro Station,05-04-2025,21:11:00,P-106,Snickers Bar,Snacks,134.57,164.0,164.0,0.0,22069.48,RP-015,Deepa,Low Power,20.1,UPI,2.3,98.0,3.42,271.0,1.0,2025-04-05 21:11:00
VMX-11794,VM-029,Bangalore,Metro Station,25-02-2025,05:02:00,P-100,Lays Classic,Snacks,138.48,37.0,27.0,10.0,3738.96,RP-007,Anita,Low Power,19.2,UPI,3.3,60.0,4.58,108.0,1.0,2025-02-25 05:02:00
VMX-11795,VM-119,Pune,College,10-04-2025,21:15:00,P-102,Bisleri Water,Drinks,111.94,161.0,141.0,20.0,15783.54,RP-020,Amit,Maintenance,23.8,Card,3.8,14.0,1.01,222.0,0.0,2025-04-10 21:15:00
VMX-11796,VM-029,Pune,Mall,02-08-2025,01:55:00,P-100,Lays Classic,Snacks,77.25,60.0,55.0,5.0,4248.75,RP-005,Fatima,Working,19.8,UPI,4.2,23.0,2.82,77.0,1.0,2025-08-02 01:55:00
VMX-11797,VM-228,Kolkata,Mall,05-10-2025,17:56:00,P-104,Red Bull,Drinks,96.86,102.0,87.0,15.0,8426.82,RP-018,Amit,Working,16.0,Cash,2.5,84.0,3.07,405.0,0.0,2025-10-05 17:56:00
VMX-11798,VM-213,Delhi,Hospital,28-01-2025,09:16:00,P-101,Pepsi Can,Drinks,147.32,62.0,49.0,13.0,7218.68,RP-012,Fatima,Maintenance,14.9,Card,4.6,62.0,2.63,482.0,1.0,2025-01-28 09:16:00
VMX-11799,VM-132,Kolkata,Office,21-03-2025,22:40:00,P-100,Lays Classic,Snacks,100.54,87.0,73.0,14.0,7339.42,RP-006,Deepa,Low Power,13.3,Card,3.4,32.0,2.88,330.0,1.0,2025-03-21 22:40:00
VMX-11800,VM-246,Mumbai,Hospital,20-05-2025,13:20:00,P-100,Lays Classic,Snacks,71.81,198.0,179.0,19.0,12853.99,RP-002,Kiran,Working,12.1,Card,3.5,77.0,2.82,128.0,1.0,2025-05-20 13:20:00
VMX-11801,VM-076,Mumbai,College,11-03-2025,16:50:00,P-102,Bisleri Water,Drinks,65.84,35.0,16.0,19.0,1053.44,RP-013,Anita,Working,16.6,Cash,3.0,110.0,2.97,380.0,1.0,2025-03-11 16:50:00
VMX-11802,VM-104,Hyderabad,Hospital,21-09-2025,00:50:00,P-100,Lays Classic,Snacks,56.86,121.0,104.0,17.0,5913.44,RP-013,Anita,Low Power,24.5,Card,4.5,81.0,1.26,288.0,0.0,2025-09-21 00:50:00
VMX-11803,VM-139,Hyderabad,Hospital,04-07-2025,07:23:00,P-101,Pepsi Can,Drinks,133.22,87.0,83.0,4.0,11057.26,RP-001,Ravi,Maintenance,19.1,Card,3.7,33.0,3.22,317.0,1.0,2025-07-04 07:23:00
VMX-11804,VM-205,Mumbai,College,01-01-2025,22:32:00,P-100,Lays Classic,Snacks,140.33,50.0,35.0,15.0,4911.55,RP-012,Amit,Working,17.2,Card,2.3,7.0,2.89,196.0,0.0,2025-01-01 22:32:00
VMX-11805,VM-195,Mumbai,Mall,10-07-2025,23:28:00,P-104,Red Bull,Drinks,41.65,128.0,111.0,17.0,4623.15,RP-010,Kiran,Working,20.0,UPI,4.9,11.0,1.14,474.0,0.0,2025-07-10 23:28:00
VMX-11806,VM-186,Hyderabad,Mall,12-09-2025,17:47:00,P-100,Lays Classic,Snacks,104.68,33.0,30.0,3.0,3140.4,RP-001,Deepa,Working,12.2,Card,2.9,60.0,1.65,440.0,0.0,2025-09-12 17:47:00
VMX-11807,VM-241,Chennai,Metro Station,30-03-2025,19:57:00,P-109,Doritos,Snacks,34.59,40.0,40.0,0.0,1383.6,RP-020,Rajesh,Low Power,19.7,Card,4.1,84.0,4.44,220.0,0.0,2025-03-30 19:57:00
VMX-11808,VM-086,Chennai,Mall,08-06-2025,08:53:00,P-109,Doritos,Snacks,69.12,172.0,158.0,14.0,10920.96,RP-013,Rahul,Maintenance,13.9,Card,2.5,36.0,1.33,195.0,0.0,2025-06-08 08:53:00
VMX-11809,VM-188,Hyderabad,Mall,30-05-2025,01:50:00,P-105,Dettol Wipe,Hygiene,119,74.0,60.0,14.0,7140.0,RP-008,Rajesh,Maintenance,21.5,UPI,4.4,101.0,4.01,429.0,1.0,2025-05-30 01:50:00
VMX-11810,VM-176,Mumbai,College,03-01-2025,16:20:00,P-106,Snickers Bar,Snacks,84.7,193.0,181.0,12.0,15330.7,RP-015,Anita,Maintenance,19.9,UPI,3.6,78.0,3.89,314.0,0.0,2025-01-03 16:20:00
VMX-11811,VM-173,Pune,Hospital,21-09-2025,01:13:00,P-104,Red Bull,Drinks,48.2,176.0,175.0,1.0,8435.0,RP-006,Anita,Maintenance,10.7,UPI,3.3,33.0,2.32,339.0,1.0,2025-09-21 01:13:00
VMX-11812,VM-056,Hyderabad,College,12-06-2025,04:28:00,P-103,Oreo Pack,Snacks,35.57,115.0,108.0,7.0,3841.56,Unknown,Mahesh,Maintenance,17.8,Card,4.6,68.0,2.0,396.0,1.0,2025-06-12 04:28:00
VMX-11813,VM-125,Chennai,Metro Station,24-04-2025,05:04:00,P-108,Sprite Bottle,Drinks,95.36,191.0,181.0,10.0,17260.16,RP-014,Ravi,Maintenance,20.0,Cash,4.5,58.0,3.89,151.0,1.0,2025-04-24 05:04:00
VMX-11814,VM-215,Chennai,Mall,17-03-2025,21:54:00,P-108,Sprite Bottle,Drinks,11.16,30.0,26.0,4.0,290.16,RP-012,Rahul,Low Power,19.9,Cash,2.0,108.0,2.33,329.0,0.0,2025-03-17 21:54:00
VMX-11815,VM-073,Hyderabad,Office,22-02-2025,22:39:00,P-109,Doritos,Snacks,82.39,143.0,126.0,17.0,10381.14,RP-016,Anita,Maintenance,20.9,UPI,3.3,49.0,1.02,139.0,0.0,2025-02-22 22:39:00
VMX-11816,VM-093,Hyderabad,Office,10-05-2025,21:30:00,P-107,Colgate Mini,Hygiene,144.18,143.0,126.0,17.0,18166.68,RP-014,Ravi,Low Power,12.7,UPI,3.6,103.0,2.09,459.0,0.0,2025-05-10 21:30:00
VMX-11817,VM-258,Pune,Metro Station,17-08-2025,13:39:00,P-109,Doritos,Snacks,126.51,66.0,53.0,13.0,6705.03,RP-015,Rahul,Maintenance,17.9,UPI,3.0,35.0,2.32,182.0,1.0,2025-08-17 13:39:00
VMX-11818,VM-070,Delhi,Metro Station,03-01-2025,03:58:00,P-104,Red Bull,Drinks,145.31,80.0,72.0,8.0,10462.32,RP-007,Kiran,Working,20.4,Card,3.3,89.0,2.81,389.0,0.0,2025-01-03 03:58:00
VMX-11819,VM-057,Bangalore,Office,22-09-2025,19:01:00,P-109,Doritos,Snacks,39.23,116.0,109.0,7.0,4276.07,RP-017,Anita,Low Power,17.2,Cash,3.3,100.0,3.68,258.0,0.0,2025-09-22 19:01:00
VMX-11820,VM-068,Delhi,Mall,25-07-2025,04:45:00,P-101,Pepsi Can,Drinks,147.37,124.0,107.0,17.0,15768.59,RP-002,Rajesh,Working,19.9,UPI,3.8,66.0,1.12,211.0,0.0,2025-07-25 04:45:00
VMX-11821,VM-154,Bangalore,Mall,19-08-2025,20:59:00,P-101,Pepsi Can,Drinks,63.03,53.0,49.0,4.0,3088.47,RP-002,Suresh,Low Power,24.4,Cash,4.4,116.0,3.6,434.0,1.0,2025-08-19 20:59:00
VMX-11822,VM-234,Kolkata,Office,24-03-2025,09:19:00,P-101,Pepsi Can,Drinks,85.17,182.0,162.0,20.0,13797.54,RP-014,Suresh,Working,22.0,Cash,2.4,9.0,1.84,407.0,0.0,2025-03-24 09:19:00
VMX-11823,VM-025,Mumbai,Hospital,07-09-2025,17:48:00,P-107,Colgate Mini,Hygiene,86.23,67.0,50.0,17.0,4311.5,RP-003,Deepa,Maintenance,23.2,UPI,3.9,65.0,2.33,255.0,1.0,2025-09-07 17:48:00
VMX-11824,VM-015,Bangalore,Metro Station,10-02-2025,16:59:00,P-103,Oreo Pack,Snacks,59.51,103.0,94.0,9.0,5593.94,RP-017,Amit,Low Power,12.1,Cash,4.7,66.0,3.82,245.0,1.0,2025-02-10 16:59:00
VMX-11825,VM-270,Kolkata,Office,20-05-2025,12:37:00,P-109,Doritos,Snacks,15.81,100.0,81.0,19.0,1280.61,RP-006,Fatima,Maintenance,23.4,Card,4.5,36.0,2.8,68.0,1.0,2025-05-20 12:37:00
VMX-11826,VM-285,Kolkata,Hospital,27-03-2025,19:34:00,P-102,Bisleri Water,Drinks,16.22,40.0,33.0,7.0,535.26,RP-003,Amit,Working,21.2,Cash,2.6,55.0,4.78,317.0,1.0,2025-03-27 19:34:00
VMX-11827,VM-219,Pune,Office,07-10-2025,12:08:00,P-104,Red Bull,Drinks,27.75,133.0,118.0,15.0,3274.5,RP-006,Rajesh,Working,17.9,Card,3.1,3.0,3.89,126.0,0.0,2025-10-07 12:08:00
VMX-11828,VM-041,Delhi,College,26-04-2025,08:28:00,P-108,Sprite Bottle,Drinks,149.15,143.0,129.0,14.0,19240.35,RP-014,Amit,Maintenance,18.1,Cash,2.8,81.0,2.39,495.0,1.0,2025-04-26 08:28:00
VMX-11829,VM-232,Mumbai,College,09-04-2025,20:08:00,P-107,Colgate Mini,Hygiene,43.98,128.0,123.0,5.0,5409.54,RP-002,Anita,Low Power,13.2,Card,3.1,74.0,2.88,81.0,0.0,2025-04-09 20:08:00
VMX-11830,VM-230,Hyderabad,Office,29-03-2025,17:22:00,P-107,Colgate Mini,Hygiene,40.89,182.0,178.0,4.0,7278.42,RP-006,Anita,Working,21.4,Cash,3.0,43.0,2.16,260.0,0.0,2025-03-29 17:22:00
VMX-11831,VM-054,Mumbai,Hospital,20-01-2025,09:06:00,P-109,Doritos,Snacks,121.41,137.0,117.0,20.0,14204.97,RP-018,Fatima,Working,15.4,Card,3.3,100.0,4.46,254.0,1.0,2025-01-20 09:06:00
VMX-11832,VM-264,Delhi,Office,06-01-2025,09:17:00,P-103,Oreo Pack,Snacks,83.87,107.0,95.0,12.0,7967.65,RP-014,Rajesh,Maintenance,13.4,Cash,4.1,79.0,4.39,403.0,0.0,2025-01-06 09:17:00
VMX-11833,VM-225,Hyderabad,College,01-10-2025,14:58:00,P-104,Red Bull,Drinks,86.21,104.0,93.0,11.0,8017.53,RP-014,Amit,Working,20.2,UPI,4.8,74.0,4.36,396.0,1.0,2025-10-01 14:58:00
VMX-11834,VM-285,Pune,Office,31-07-2025,00:40:00,P-102,Bisleri Water,Drinks,69.04,28.0,13.0,15.0,897.52,RP-007,Mahesh,Working,11.9,Card,2.1,110.0,4.82,344.0,0.0,2025-07-31 00:40:00
VMX-11835,VM-279,Bangalore,Mall,16-02-2025,12:09:00,P-101,Pepsi Can,Drinks,43.79,149.0,134.0,15.0,5867.86,RP-012,Kiran,Maintenance,19.4,UPI,4.7,70.0,4.1,88.0,0.0,2025-02-16 12:09:00
VMX-11836,VM-144,Kolkata,Mall,22-04-2025,06:29:00,P-108,Sprite Bottle,Drinks,104.31,49.0,38.0,11.0,3963.78,RP-011,Kiran,Low Power,10.3,Card,4.0,62.0,1.66,442.0,1.0,2025-04-22 06:29:00
VMX-11837,VM-189,Mumbai,Metro Station,09-08-2025,21:39:00,P-101,Pepsi Can,Drinks,149.72,117.0,106.0,11.0,15870.32,RP-010,Deepa,Low Power,15.1,UPI,3.8,47.0,4.91,63.0,1.0,2025-08-09 21:39:00
VMX-11838,VM-043,Mumbai,College,18-07-2025,04:36:00,P-105,Dettol Wipe,Hygiene,135.52,81.0,61.0,20.0,8266.72,RP-010,Fatima,Low Power,23.1,UPI,4.7,71.0,1.9,226.0,0.0,2025-07-18 04:36:00
VMX-11839,VM-272,Delhi,Metro Station,15-03-2025,01:29:00,P-105,Dettol Wipe,Hygiene,28.34,189.0,178.0,11.0,5044.52,RP-006,Ravi,Low Power,19.8,Cash,4.6,78.0,3.52,144.0,0.0,2025-03-15 01:29:00
VMX-11840,VM-164,Bangalore,College,01-06-2025,22:18:00,P-104,Red Bull,Drinks,126.51,115.0,100.0,15.0,12651.0,RP-007,Mahesh,Maintenance,12.0,Card,3.2,79.0,4.53,287.0,0.0,2025-06-01 22:18:00
VMX-11841,VM-186,Delhi,Mall,03-06-2025,01:12:00,P-100,Lays Classic,Snacks,81.8,160.0,156.0,4.0,12760.8,RP-006,Ravi,Working,21.1,UPI,4.6,36.0,1.04,409.0,0.0,2025-06-03 01:12:00
VMX-11842,VM-012,Pune,Office,29-05-2025,20:53:00,P-109,Doritos,Snacks,38.04,131.0,124.0,7.0,4716.96,RP-003,Amit,Maintenance,11.3,Card,4.7,46.0,3.87,387.0,0.0,2025-05-29 20:53:00
VMX-11843,VM-145,Kolkata,Hospital,01-02-2025,22:01:00,P-105,Dettol Wipe,Hygiene,76.95,101.0,83.0,18.0,6386.85,RP-020,Anita,Working,12.0,Card,2.7,19.0,2.3,258.0,0.0,2025-02-01 22:01:00
VMX-11844,VM-155,Delhi,Mall,28-02-2025,06:51:00,P-101,Pepsi Can,Drinks,87.52,172.0,170.0,2.0,14878.4,RP-009,Fatima,Maintenance,15.5,Cash,2.6,76.0,4.07,369.0,1.0,2025-02-28 06:51:00
VMX-11845,VM-253,Bangalore,Office,01-08-2025,02:11:00,P-102,Bisleri Water,Drinks,134.95,129.0,112.0,17.0,15114.4,RP-005,Ravi,Working,12.3,Cash,3.9,113.0,3.78,154.0,0.0,2025-08-01 02:11:00
VMX-11846,VM-084,Pune,Metro Station,06-06-2025,17:02:00,P-103,Oreo Pack,Snacks,15.52,94.0,76.0,18.0,1179.52,RP-020,Mahesh,Maintenance,18.2,Card,4.1,74.0,2.52,261.0,1.0,2025-06-06 17:02:00
VMX-11847,VM-019,Pune,Mall,25-02-2025,21:36:00,P-105,Dettol Wipe,Hygiene,32.09,49.0,31.0,18.0,994.79,RP-003,Suresh,Working,14.8,Card,4.2,89.0,1.83,276.0,0.0,2025-02-25 21:36:00
VMX-11848,VM-036,Mumbai,College,08-09-2025,01:19:00,P-103,Oreo Pack,Snacks,116.45,180.0,168.0,12.0,19563.6,RP-001,Suresh,Maintenance,18.2,Card,2.3,14.0,4.55,456.0,1.0,2025-09-08 01:19:00
VMX-11849,VM-082,Hyderabad,Mall,03-05-2025,23:13:00,P-104,Red Bull,Drinks,15.01,27.0,24.0,3.0,360.24,RP-009,Anita,Maintenance,15.5,Cash,4.9,9.0,2.02,315.0,1.0,2025-05-03 23:13:00
VMX-11850,VM-184,Delhi,Hospital,27-06-2025,22:09:00,P-106,Snickers Bar,Snacks,58.29,146.0,132.0,14.0,7694.28,RP-005,Suresh,Working,22.4,Card,2.6,50.0,1.1,150.0,1.0,2025-06-27 22:09:00
VMX-11851,VM-226,Kolkata,College,29-01-2025,10:49:00,P-108,Sprite Bottle,Drinks,111.93,43.0,23.0,20.0,2574.39,RP-007,Rahul,Maintenance,15.7,Cash,2.2,51.0,4.48,61.0,0.0,2025-01-29 10:49:00
VMX-11852,VM-126,Kolkata,Mall,23-07-2025,12:43:00,P-105,Dettol Wipe,Hygiene,93.13,91.0,79.0,12.0,7357.27,RP-008,Suresh,Maintenance,16.9,Cash,3.5,95.0,3.72,317.0,0.0,2025-07-23 12:43:00
VMX-11853,VM-102,Bangalore,Mall,25-01-2025,17:26:00,P-100,Lays Classic,Snacks,91.2,36.0,28.0,8.0,2553.6,RP-007,Anita,Working,22.7,UPI,3.0,68.0,4.11,200.0,1.0,2025-01-25 17:26:00
VMX-11854,VM-172,Pune,College,29-03-2025,07:29:00,P-108,Sprite Bottle,Drinks,107.09,161.0,155.0,6.0,16598.95,RP-019,Rajesh,Working,12.1,UPI,4.7,107.0,3.77,401.0,1.0,2025-03-29 07:29:00
VMX-11855,VM-059,Pune,Hospital,11-06-2025,03:13:00,P-108,Sprite Bottle,Drinks,142.38,90.0,79.0,11.0,11248.02,RP-001,Suresh,Low Power,17.8,Cash,4.3,30.0,2.71,327.0,0.0,2025-06-11 03:13:00
VMX-11856,VM-273,Hyderabad,College,09-04-2025,04:15:00,P-108,Sprite Bottle,Drinks,109.46,70.0,58.0,12.0,6348.68,RP-009,Suresh,Low Power,13.8,UPI,3.6,52.0,2.68,459.0,1.0,2025-04-09 04:15:00
VMX-11857,VM-252,Kolkata,College,20-02-2025,12:14:00,P-108,Sprite Bottle,Drinks,70.3,142.0,134.0,8.0,9420.2,RP-005,Mahesh,Low Power,13.4,UPI,3.0,113.0,1.67,276.0,1.0,2025-02-20 12:14:00
VMX-11858,VM-263,Hyderabad,College,20-09-2025,09:00:00,P-106,Snickers Bar,Snacks,15.22,86.0,75.0,11.0,1141.5,RP-009,Anita,Working,15.5,Cash,3.6,90.0,2.25,159.0,1.0,2025-09-20 09:00:00
VMX-11859,VM-198,Hyderabad,Mall,02-03-2025,03:19:00,P-101,Pepsi Can,Drinks,20.18,157.0,145.0,12.0,2926.1,RP-013,Ravi,Working,17.7,Cash,3.2,95.0,1.09,220.0,1.0,2025-03-02 03:19:00
VMX-11860,VM-204,Pune,Mall,29-06-2025,08:11:00,P-105,Dettol Wipe,Hygiene,109.3,89.0,77.0,12.0,8416.1,RP-013,Fatima,Low Power,23.9,Cash,3.5,11.0,4.95,463.0,0.0,2025-06-29 08:11:00
VMX-11861,VM-291,Chennai,Hospital,11-06-2025,08:21:00,P-103,Oreo Pack,Snacks,50.61,193.0,185.0,8.0,9362.85,RP-014,Mahesh,Working,13.5,Cash,4.6,11.0,3.4,261.0,0.0,2025-06-11 08:21:00
VMX-11862,VM-242,Chennai,Mall,25-09-2025,12:51:00,P-102,Bisleri Water,Drinks,79.52,58.0,51.0,7.0,4055.52,RP-004,Rajesh,Maintenance,23.1,Cash,3.2,67.0,1.93,238.0,0.0,2025-09-25 12:51:00
VMX-11863,VM-300,Bangalore,Office,19-08-2025,00:50:00,P-109,Doritos,Snacks,55.48,193.0,173.0,20.0,9598.04,RP-001,Rahul,Maintenance,11.3,Card,4.8,46.0,1.13,108.0,0.0,2025-08-19 00:50:00
VMX-11864,VM-271,Delhi,Office,10-01-2025,07:17:00,P-103,Oreo Pack,Snacks,67.66,197.0,189.0,8.0,12787.74,RP-018,Anita,Working,23.1,UPI,4.4,4.0,1.06,265.0,0.0,2025-01-10 07:17:00
VMX-11865,VM-157,Kolkata,Mall,21-06-2025,22:07:00,P-107,Colgate Mini,Hygiene,139.91,104.0,86.0,18.0,12032.26,RP-020,Deepa,Low Power,14.3,Card,3.2,73.0,2.32,120.0,0.0,2025-06-21 22:07:00
VMX-11866,VM-176,Bangalore,Metro Station,11-08-2025,04:30:00,P-107,Colgate Mini,Hygiene,127.96,198.0,187.0,11.0,23928.52,RP-001,Mahesh,Working,16.2,Card,4.7,113.0,4.72,492.0,0.0,2025-08-11 04:30:00
VMX-11867,VM-164,Pune,Mall,26-05-2025,22:48:00,P-107,Colgate Mini,Hygiene,38.66,98.0,84.0,14.0,3247.44,RP-008,Deepa,Maintenance,11.8,UPI,4.1,70.0,1.91,133.0,1.0,2025-05-26 22:48:00
VMX-11868,VM-024,Hyderabad,College,07-09-2025,22:05:00,P-104,Red Bull,Drinks,137.32,151.0,132.0,19.0,18126.24,RP-015,Mahesh,Low Power,18.3,Cash,2.4,91.0,3.49,375.0,1.0,2025-09-07 22:05:00
VMX-11869,VM-290,Chennai,Metro Station,21-01-2025,08:55:00,P-107,Colgate Mini,Hygiene,66.7,39.0,32.0,7.0,2134.4,RP-010,Ravi,Maintenance,23.8,UPI,2.5,90.0,4.56,484.0,0.0,2025-01-21 08:55:00
VMX-11870,VM-248,Bangalore,Metro Station,14-04-2025,20:13:00,P-105,Dettol Wipe,Hygiene,109.91,58.0,41.0,17.0,4506.31,RP-016,Deepa,Low Power,19.9,Card,5.0,15.0,3.64,74.0,0.0,2025-04-14 20:13:00
VMX-11871,VM-050,Kolkata,College,22-08-2025,22:30:00,P-106,Snickers Bar,Snacks,133.94,116.0,108.0,8.0,14465.52,RP-011,Fatima,Maintenance,11.9,Card,4.2,8.0,4.34,493.0,1.0,2025-08-22 22:30:00
VMX-11872,VM-002,Mumbai,Metro Station,23-05-2025,02:59:00,P-100,Lays Classic,Snacks,104.52,153.0,134.0,19.0,14005.68,RP-004,Ravi,Low Power,11.8,UPI,4.8,32.0,2.02,414.0,0.0,2025-05-23 02:59:00
VMX-11873,VM-186,Kolkata,Office,31-01-2025,18:29:00,P-101,Pepsi Can,Drinks,149.91,149.0,142.0,7.0,21287.22,RP-006,Anita,Low Power,13.2,Card,4.4,85.0,3.06,329.0,1.0,2025-01-31 18:29:00
VMX-11874,VM-254,Mumbai,College,30-05-2025,17:43:00,P-102,Bisleri Water,Drinks,43.76,191.0,176.0,15.0,7701.76,RP-002,Rajesh,Maintenance,18.4,Cash,3.9,43.0,1.97,221.0,0.0,2025-05-30 17:43:00
VMX-11875,VM-085,Mumbai,Hospital,16-01-2025,17:10:00,P-102,Bisleri Water,Drinks,22.12,186.0,169.0,17.0,3738.28,RP-019,Rahul,Working,19.2,Card,3.2,93.0,1.08,327.0,1.0,2025-01-16 17:10:00
VMX-11876,VM-185,Mumbai,College,21-04-2025,18:41:00,P-105,Dettol Wipe,Hygiene,137.48,72.0,55.0,17.0,7561.4,RP-014,Anita,Low Power,21.4,Card,3.6,13.0,4.07,50.0,0.0,2025-04-21 18:41:00
VMX-11877,VM-126,Mumbai,Metro Station,11-01-2025,14:02:00,P-103,Oreo Pack,Snacks,105.6,140.0,140.0,0.0,14784.0,RP-002,Fatima,Maintenance,17.7,Card,3.3,91.0,3.82,272.0,0.0,2025-01-11 14:02:00
VMX-11878,VM-259,Chennai,Metro Station,Unknown,07:17:00,P-102,Bisleri Water,Drinks,15.12,200.0,199.0,1.0,3008.88,RP-005,Kiran,Low Power,20.8,Card,3.3,52.0,4.74,140.0,1.0,
VMX-11879,VM-163,Mumbai,Mall,18-05-2025,10:25:00,P-105,Dettol Wipe,Hygiene,18.3,141.0,132.0,9.0,2415.6,RP-014,Rajesh,Low Power,15.4,UPI,2.3,76.0,3.04,307.0,0.0,2025-05-18 10:25:00
VMX-11880,VM-002,Kolkata,College,02-09-2025,18:22:00,P-107,Colgate Mini,Hygiene,149.71,89.0,74.0,15.0,11078.54,RP-007,Anita,Low Power,21.5,Cash,2.2,55.0,4.9,253.0,0.0,2025-09-02 18:22:00
VMX-11881,VM-191,Mumbai,Mall,26-06-2025,05:59:00,P-100,Lays Classic,Snacks,40.34,119.0,111.0,8.0,4477.74,RP-008,Mahesh,Maintenance,23.7,Cash,5.0,59.0,4.01,469.0,1.0,2025-06-26 05:59:00
VMX-11882,VM-176,Bangalore,Mall,14-02-2025,13:32:00,P-100,Lays Classic,Snacks,112.54,78.0,68.0,10.0,7652.72,RP-009,Rajesh,Low Power,21.2,UPI,2.4,43.0,3.83,152.0,1.0,2025-02-14 13:32:00
VMX-11883,VM-209,Pune,Mall,03-07-2025,06:25:00,P-109,Doritos,Snacks,93.1,26.0,25.0,1.0,2327.5,RP-007,Amit,Low Power,16.5,Cash,5.0,16.0,1.6,231.0,1.0,2025-07-03 06:25:00
VMX-11884,VM-113,Mumbai,Mall,27-08-2025,04:57:00,P-102,Bisleri Water,Drinks,118.27,153.0,146.0,7.0,17267.42,RP-006,Deepa,Maintenance,13.1,Cash,2.7,29.0,3.87,472.0,0.0,2025-08-27 04:57:00
VMX-11885,VM-129,Hyderabad,Mall,14-03-2025,20:13:00,P-100,Lays Classic,Snacks,86.05,169.0,160.0,9.0,13768.0,RP-015,Mahesh,Low Power,13.0,Cash,4.7,25.0,3.73,373.0,0.0,2025-03-14 20:13:00
VMX-11886,VM-250,Pune,College,12-02-2025,04:23:00,P-108,Sprite Bottle,Drinks,49.33,122.0,102.0,20.0,5031.66,RP-009,Rajesh,Working,16.6,Card,3.6,90.0,3.57,240.0,0.0,2025-02-12 04:23:00
VMX-11887,VM-198,Chennai,Office,04-10-2025,00:57:00,P-107,Colgate Mini,Hygiene,142.93,166.0,154.0,12.0,22011.22,RP-012,Anita,Low Power,20.9,Card,2.4,47.0,2.96,406.0,0.0,2025-10-04 00:57:00
VMX-11888,VM-106,Delhi,Mall,29-05-2025,00:20:00,P-107,Colgate Mini,Hygiene,96.9,60.0,47.0,13.0,4554.3,RP-015,Suresh,Maintenance,24.5,Card,3.3,67.0,2.45,154.0,1.0,2025-05-29 00:20:00
VMX-11889,VM-234,Pune,Metro Station,20-01-2025,07:38:00,P-102,Bisleri Water,Drinks,83.66,162.0,156.0,6.0,13050.96,RP-015,Fatima,Working,20.2,Cash,4.1,2.0,1.95,98.0,1.0,2025-01-20 07:38:00
VMX-11890,VM-016,Bangalore,Office,05-07-2025,02:43:00,P-109,Doritos,Snacks,125.4,127.0,116.0,11.0,14546.4,RP-001,Kiran,Low Power,16.5,Card,3.9,51.0,3.55,442.0,0.0,2025-07-05 02:43:00
VMX-11891,VM-048,Kolkata,Office,11-09-2025,13:30:00,P-106,Snickers Bar,Snacks,100.47,77.0,68.0,9.0,6831.96,RP-019,Rahul,Maintenance,18.0,Cash,2.4,74.0,2.43,365.0,0.0,2025-09-11 13:30:00
VMX-11892,VM-241,Mumbai,Mall,08-06-2025,04:54:00,P-100,Lays Classic,Snacks,42.36,105.0,100.0,5.0,4236.0,RP-005,Ravi,Low Power,15.3,UPI,2.7,86.0,2.77,155.0,1.0,2025-06-08 04:54:00
VMX-11893,VM-004,Bangalore,Metro Station,22-06-2025,19:18:00,P-103,Oreo Pack,Snacks,93.52,85.0,66.0,19.0,6172.32,RP-019,Deepa,Low Power,21.8,UPI,3.2,55.0,4.11,384.0,1.0,2025-06-22 19:18:00
VMX-11894,VM-028,Bangalore,College,09-09-2025,06:02:00,P-103,Oreo Pack,Snacks,20.43,34.0,18.0,16.0,367.74,RP-001,Amit,Maintenance,22.1,UPI,4.8,48.0,3.69,163.0,0.0,2025-09-09 06:02:00
VMX-11895,VM-096,Bangalore,Mall,15-04-2025,23:45:00,P-105,Dettol Wipe,Hygiene,113.02,188.0,174.0,14.0,19665.48,RP-010,Fatima,Low Power,14.0,Cash,3.8,8.0,2.7,250.0,0.0,2025-04-15 23:45:00
VMX-11896,VM-266,Mumbai,Hospital,06-01-2025,09:35:00,P-101,Pepsi Can,Drinks,91.24,28.0,9.0,19.0,821.16,RP-001,Rajesh,Working,24.6,Card,2.5,39.0,2.22,436.0,1.0,2025-01-06 09:35:00
VMX-11897,VM-186,Delhi,Office,29-08-2025,16:22:00,P-108,Sprite Bottle,Drinks,134.12,180.0,174.0,6.0,23336.88,RP-003,Rajesh,Low Power,21.9,Card,4.0,76.0,1.79,99.0,1.0,2025-08-29 16:22:00
VMX-11898,VM-180,Kolkata,Hospital,25-02-2025,00:18:00,P-104,Red Bull,Drinks,138.14,188.0,177.0,11.0,24450.78,RP-008,Anita,Low Power,16.5,Card,4.5,32.0,4.66,455.0,0.0,2025-02-25 00:18:00
VMX-11899,VM-294,Hyderabad,Office,16-06-2025,04:32:00,P-103,Oreo Pack,Snacks,85.54,160.0,159.0,1.0,13600.86,RP-013,Kiran,Low Power,23.8,Cash,3.7,56.0,3.17,205.0,1.0,2025-06-16 04:32:00
VMX-11900,VM-141,Bangalore,Office,15-09-2025,07:28:00,P-107,Colgate Mini,Hygiene,22.68,155.0,138.0,17.0,3129.84,RP-012,Mahesh,Maintenance,22.3,Card,3.0,27.0,3.01,252.0,0.0,2025-09-15 07:28:00
VMX-11901,VM-200,Chennai,Hospital,19-09-2025,18:41:00,P-105,Dettol Wipe,Hygiene,18.09,81.0,80.0,1.0,1447.2,RP-020,Amit,Low Power,24.0,UPI,4.3,29.0,2.43,320.0,1.0,2025-09-19 18:41:00
VMX-11902,VM-200,Hyderabad,Mall,22-02-2025,21:22:00,P-109,Doritos,Snacks,56.2,48.0,43.0,5.0,2416.6,RP-017,Rajesh,Working,10.1,Card,2.1,42.0,4.47,264.0,1.0,2025-02-22 21:22:00
VMX-11903,VM-207,Chennai,Hospital,31-01-2025,06:30:00,P-106,Snickers Bar,Snacks,69.8,96.0,78.0,18.0,5444.4,RP-009,Rajesh,Low Power,21.0,Card,2.4,94.0,4.53,268.0,0.0,2025-01-31 06:30:00
VMX-11904,VM-208,Delhi,Office,02-05-2025,23:36:00,P-102,Bisleri Water,Drinks,34.84,106.0,105.0,1.0,3658.2,RP-012,Fatima,Low Power,20.7,Card,4.8,8.0,3.55,377.0,0.0,2025-05-02 23:36:00
VMX-11905,VM-114,Bangalore,Mall,10-06-2025,16:38:00,P-100,Lays Classic,Snacks,120.3,97.0,94.0,3.0,11308.2,RP-012,Amit,Maintenance,16.2,Card,4.0,0.0,1.4,164.0,1.0,2025-06-10 16:38:00
VMX-11906,VM-266,Hyderabad,College,23-06-2025,15:12:00,P-105,Dettol Wipe,Hygiene,114.89,26.0,21.0,5.0,2412.69,RP-001,Ravi,Working,22.8,UPI,4.6,12.0,4.85,97.0,1.0,2025-06-23 15:12:00
VMX-11907,VM-297,Hyderabad,Mall,01-06-2025,19:36:00,P-108,Sprite Bottle,Drinks,17.67,187.0,185.0,2.0,3268.95,RP-013,Deepa,Working,23.2,UPI,2.4,12.0,3.69,428.0,0.0,2025-06-01 19:36:00
VMX-11908,VM-253,Hyderabad,Hospital,14-09-2025,13:50:00,P-109,Doritos,Snacks,67.65,132.0,130.0,2.0,8794.5,RP-001,Fatima,Working,19.6,Card,4.8,76.0,4.4,412.0,0.0,2025-09-14 13:50:00
VMX-11909,VM-217,Hyderabad,Mall,09-09-2025,22:06:00,P-108,Sprite Bottle,Drinks,137,113.0,113.0,0.0,15481.0,RP-019,Suresh,Working,22.2,Cash,4.3,35.0,3.31,133.0,0.0,2025-09-09 22:06:00
VMX-11910,VM-038,Mumbai,Hospital,27-01-2025,06:30:00,P-100,Lays Classic,Snacks,88.76,87.0,86.0,1.0,7633.36,RP-012,Fatima,Maintenance,15.2,Cash,4.1,32.0,3.16,248.0,1.0,2025-01-27 06:30:00
VMX-11911,VM-118,Hyderabad,Hospital,09-03-2025,23:02:00,P-101,Pepsi Can,Drinks,19.56,66.0,53.0,13.0,1036.68,RP-019,Deepa,Working,16.4,UPI,4.0,21.0,1.44,333.0,1.0,2025-03-09 23:02:00
VMX-11912,VM-068,Kolkata,Mall,11-02-2025,03:42:00,P-100,Lays Classic,Snacks,126.4,36.0,19.0,17.0,2401.6,RP-020,Rahul,Working,12.9,Cash,3.0,74.0,4.5,310.0,1.0,2025-02-11 03:42:00
VMX-11913,VM-059,Kolkata,Office,08-08-2025,04:14:00,P-109,Doritos,Snacks,110.89,54.0,53.0,1.0,5877.17,RP-011,Rahul,Low Power,18.3,Card,3.5,77.0,4.99,467.0,0.0,2025-08-08 04:14:00
VMX-11914,VM-208,Kolkata,Metro Station,25-02-2025,18:48:00,P-100,Lays Classic,Snacks,133.41,200.0,188.0,12.0,25081.08,RP-002,Anita,Low Power,10.5,Cash,2.3,18.0,4.02,481.0,0.0,2025-02-25 18:48:00
VMX-11915,VM-286,Kolkata,College,21-05-2025,03:44:00,P-106,Snickers Bar,Snacks,10.82,51.0,39.0,12.0,421.98,RP-009,Anita,Maintenance,21.9,UPI,4.5,112.0,3.16,88.0,1.0,2025-05-21 03:44:00
VMX-11916,VM-167,Chennai,Office,20-05-2025,13:36:00,P-101,Pepsi Can,Drinks,45.93,161.0,154.0,7.0,7073.22,RP-019,Deepa,Working,22.3,Cash,3.8,103.0,4.4,220.0,0.0,2025-05-20 13:36:00
VMX-11917,VM-222,Pune,Metro Station,15-05-2025,10:25:00,P-106,Snickers Bar,Snacks,125.88,197.0,183.0,14.0,23036.04,RP-008,Rahul,Maintenance,18.2,UPI,3.7,5.0,2.95,122.0,1.0,2025-05-15 10:25:00
VMX-11918,VM-184,Mumbai,Hospital,09-01-2025,09:39:00,P-101,Pepsi Can,Drinks,52.71,190.0,171.0,19.0,9013.41,RP-014,Amit,Low Power,22.7,Card,4.3,68.0,2.15,257.0,1.0,2025-01-09 09:39:00
VMX-11919,VM-201,Kolkata,Office,10-04-2025,01:06:00,P-109,Doritos,Snacks,21.98,173.0,162.0,11.0,3560.76,RP-016,Amit,Maintenance,24.7,UPI,2.4,37.0,3.69,242.0,1.0,2025-04-10 01:06:00
VMX-11920,VM-229,Mumbai,College,08-03-2025,19:51:00,P-109,Doritos,Snacks,136.93,54.0,42.0,12.0,5751.06,RP-004,Kiran,Low Power,12.1,Card,3.6,55.0,1.03,147.0,1.0,2025-03-08 19:51:00
VMX-11921,VM-212,Mumbai,College,08-10-2025,19:58:00,P-109,Doritos,Snacks,83.09,89.0,77.0,12.0,6397.93,RP-004,Kiran,Low Power,15.7,UPI,4.2,105.0,3.74,72.0,0.0,2025-10-08 19:58:00
VMX-11922,VM-076,Chennai,Mall,16-04-2025,02:45:00,P-101,Pepsi Can,Drinks,135.56,147.0,143.0,4.0,19385.08,RP-009,Amit,Working,15.1,UPI,4.5,49.0,4.32,50.0,1.0,2025-04-16 02:45:00
VMX-11923,VM-093,Hyderabad,Office,19-07-2025,02:28:00,P-108,Sprite Bottle,Drinks,127.28,99.0,80.0,19.0,10182.4,RP-002,Deepa,Working,10.1,UPI,4.7,114.0,1.91,151.0,0.0,2025-07-19 02:28:00
VMX-11924,VM-169,Pune,Metro Station,10-07-2025,13:01:00,P-103,Oreo Pack,Snacks,110.66,151.0,143.0,8.0,15824.38,RP-008,Anita,Maintenance,12.2,Cash,2.4,91.0,3.84,53.0,0.0,2025-07-10 13:01:00
VMX-11925,VM-056,Kolkata,Office,13-05-2025,23:14:00,P-102,Bisleri Water,Drinks,138.99,168.0,160.0,8.0,22238.4,RP-003,Anita,Working,22.1,Card,4.8,62.0,3.05,185.0,0.0,2025-05-13 23:14:00
VMX-11926,VM-156,Hyderabad,Mall,06-10-2025,04:44:00,P-107,Colgate Mini,Hygiene,132.63,143.0,125.0,18.0,16578.75,RP-004,Ravi,Low Power,24.0,Cash,2.7,27.0,2.97,339.0,0.0,2025-10-06 04:44:00
VMX-11927,VM-160,Bangalore,Hospital,16-07-2025,04:55:00,P-108,Sprite Bottle,Drinks,25.27,23.0,22.0,1.0,555.94,RP-012,Rajesh,Maintenance,21.6,UPI,4.4,86.0,2.33,308.0,1.0,2025-07-16 04:55:00
VMX-11928,VM-154,Pune,Metro Station,02-08-2025,06:49:00,P-107,Colgate Mini,Hygiene,146.14,108.0,104.0,4.0,15198.56,RP-018,Amit,Working,21.2,UPI,4.5,19.0,2.26,201.0,0.0,2025-08-02 06:49:00
VMX-11929,VM-239,Pune,Metro Station,01-03-2025,02:57:00,P-102,Bisleri Water,Drinks,99.52,71.0,61.0,10.0,6070.72,RP-006,Fatima,Working,15.0,Cash,2.8,46.0,1.92,426.0,0.0,2025-03-01 02:57:00
VMX-11930,VM-243,Mumbai,Hospital,15-05-2025,14:25:00,P-108,Sprite Bottle,Drinks,144.71,60.0,60.0,0.0,8682.6,RP-013,Mahesh,Maintenance,11.9,Card,4.9,38.0,2.28,406.0,1.0,2025-05-15 14:25:00
VMX-11931,VM-037,Delhi,Mall,30-08-2025,10:13:00,P-101,Pepsi Can,Drinks,111.21,53.0,52.0,1.0,5782.92,RP-013,Fatima,Low Power,19.1,Cash,3.1,96.0,3.84,252.0,0.0,2025-08-30 10:13:00
VMX-11932,VM-043,Chennai,Office,01-06-2025,22:57:00,P-101,Pepsi Can,Drinks,101.93,28.0,13.0,15.0,1325.09,RP-008,Mahesh,Maintenance,22.3,Cash,4.4,10.0,2.11,196.0,1.0,2025-06-01 22:57:00
VMX-11933,VM-237,Chennai,Office,06-06-2025,11:45:00,P-102,Bisleri Water,Drinks,error,172.0,160.0,12.0,14835.2,RP-007,Suresh,Working,18.9,Card,4.6,12.0,4.24,399.0,1.0,2025-06-06 11:45:00
VMX-11934,VM-222,Kolkata,Metro Station,19-08-2025,05:39:00,P-103,Oreo Pack,Snacks,41.79,82.0,74.0,8.0,3092.46,RP-015,Mahesh,Working,10.4,Cash,4.2,101.0,3.53,165.0,1.0,2025-08-19 05:39:00
VMX-11935,VM-283,Delhi,Hospital,05-10-2025,22:22:00,P-104,Red Bull,Drinks,93.97,147.0,136.0,11.0,12779.92,RP-003,Fatima,Maintenance,17.6,UPI,3.5,6.0,4.79,464.0,0.0,2025-10-05 22:22:00
VMX-11936,VM-112,Mumbai,Hospital,13-09-2025,19:16:00,P-101,Pepsi Can,Drinks,61.29,171.0,167.0,4.0,10235.43,RP-008,Fatima,Working,17.4,UPI,3.8,5.0,4.81,157.0,0.0,2025-09-13 19:16:00
VMX-11937,VM-021,Mumbai,College,14-06-2025,08:35:00,P-101,Pepsi Can,Drinks,32.42,67.0,60.0,7.0,1945.2,RP-010,Rajesh,Working,20.3,UPI,4.2,112.0,3.95,318.0,0.0,2025-06-14 08:35:00
VMX-11938,VM-255,Chennai,College,30-08-2025,23:54:00,P-106,Snickers Bar,Snacks,87.78,99.0,85.0,14.0,7461.3,RP-015,Mahesh,Working,16.0,UPI,4.6,97.0,2.41,56.0,0.0,2025-08-30 23:54:00
VMX-11939,VM-093,Kolkata,Metro Station,21-03-2025,03:55:00,P-107,Colgate Mini,Hygiene,62.87,55.0,50.0,5.0,3143.5,RP-005,Ravi,Maintenance,22.4,Cash,4.6,64.0,2.66,325.0,0.0,2025-03-21 03:55:00
VMX-11940,VM-111,Pune,Mall,10-03-2025,13:16:00,P-107,Colgate Mini,Hygiene,87.78,86.0,72.0,14.0,6320.16,RP-007,Mahesh,Low Power,20.8,UPI,3.9,107.0,2.72,135.0,0.0,2025-03-10 13:16:00
VMX-11941,VM-119,Hyderabad,Mall,20-05-2025,17:22:00,P-106,Snickers Bar,Snacks,66.12,121.0,120.0,1.0,7934.4,RP-007,Anita,Maintenance,23.7,Cash,5.0,66.0,4.25,191.0,0.0,2025-05-20 17:22:00
VMX-11942,VM-079,Chennai,Mall,10-08-2025,11:06:00,P-101,Pepsi Can,Drinks,145.32,188.0,179.0,9.0,26012.28,RP-004,Mahesh,Low Power,21.2,UPI,3.7,11.0,2.9,412.0,0.0,2025-08-10 11:06:00
VMX-11943,VM-049,Hyderabad,Hospital,10-05-2025,20:33:00,P-104,Red Bull,Drinks,88.28,77.0,65.0,12.0,5738.2,RP-011,Rahul,Low Power,23.9,Card,5.0,70.0,4.23,413.0,1.0,2025-05-10 20:33:00
VMX-11944,VM-102,Hyderabad,Mall,07-05-2025,15:36:00,P-109,Doritos,Snacks,140.49,62.0,60.0,2.0,8429.4,RP-014,Suresh,Maintenance,15.9,Card,3.5,62.0,2.6,268.0,1.0,2025-05-07 15:36:00
VMX-11945,VM-037,Bangalore,Office,04-07-2025,17:27:00,P-107,Colgate Mini,Hygiene,78.34,165.0,159.0,6.0,12456.06,RP-003,Rajesh,Low Power,25.0,Cash,3.8,28.0,4.1,334.0,0.0,2025-07-04 17:27:00
VMX-11946,VM-067,Bangalore,Mall,10-08-2025,15:54:00,P-108,Sprite Bottle,Drinks,101.33,96.0,91.0,5.0,9221.03,RP-020,Rahul,Working,20.2,UPI,4.5,14.0,2.45,64.0,0.0,2025-08-10 15:54:00
VMX-11947,VM-270,Hyderabad,Office,24-02-2025,10:19:00,P-101,Pepsi Can,Drinks,20.5,77.0,58.0,19.0,1189.0,RP-010,Amit,Maintenance,13.0,UPI,3.5,20.0,4.03,183.0,0.0,2025-02-24 10:19:00
VMX-11948,VM-129,Kolkata,Hospital,19-02-2025,12:49:00,P-101,Pepsi Can,Drinks,10.36,154.0,142.0,12.0,1471.12,RP-020,Mahesh,Low Power,22.6,Card,3.8,11.0,2.37,296.0,0.0,2025-02-19 12:49:00
VMX-11949,VM-196,Mumbai,Mall,21-08-2025,19:36:00,P-108,Sprite Bottle,Drinks,102.61,26.0,14.0,12.0,1436.54,RP-013,Rajesh,Working,24.7,Card,4.0,15.0,1.18,142.0,0.0,2025-08-21 19:36:00
VMX-11950,VM-261,Kolkata,Hospital,30-03-2025,01:23:00,P-107,Colgate Mini,Hygiene,35.37,98.0,91.0,7.0,3218.67,RP-019,Rahul,Low Power,24.7,UPI,4.7,79.0,4.94,103.0,1.0,2025-03-30 01:23:00
VMX-11951,VM-251,Mumbai,College,11-04-2025,05:49:00,P-105,Dettol Wipe,Hygiene,138.1,133.0,114.0,19.0,15743.4,RP-004,Ravi,Maintenance,15.0,Card,3.9,106.0,4.86,396.0,1.0,2025-04-11 05:49:00
VMX-11952,VM-261,Chennai,Hospital,03-01-2025,18:27:00,P-103,Oreo Pack,Snacks,97.55,66.0,53.0,13.0,5170.15,RP-017,Fatima,Maintenance,18.0,Card,4.1,53.0,4.02,67.0,1.0,2025-01-03 18:27:00
VMX-11953,VM-151,Kolkata,Mall,13-07-2025,15:55:00,P-109,Doritos,Snacks,76.4,108.0,92.0,16.0,7028.8,RP-007,Kiran,Low Power,14.1,UPI,2.2,48.0,1.8,300.0,1.0,2025-07-13 15:55:00
VMX-11954,VM-172,Pune,Hospital,21-07-2025,08:47:00,P-107,Colgate Mini,Hygiene,102.1,109.0,90.0,19.0,9189.0,RP-013,Kiran,Maintenance,13.9,Card,3.9,56.0,3.98,228.0,1.0,2025-07-21 08:47:00
VMX-11955,VM-067,Chennai,College,13-06-2025,20:02:00,P-103,Oreo Pack,Snacks,48.51,133.0,125.0,8.0,6063.75,RP-012,Suresh,Low Power,17.4,Card,3.9,71.0,3.9,397.0,1.0,2025-06-13 20:02:00
VMX-11956,VM-014,Bangalore,Hospital,13-05-2025,10:56:00,P-105,Dettol Wipe,Hygiene,132.99,184.0,165.0,19.0,21943.35,RP-012,Anita,Maintenance,23.0,Cash,4.3,61.0,3.1,241.0,0.0,2025-05-13 10:56:00
VMX-11957,VM-096,Delhi,Metro Station,26-07-2025,18:12:00,P-108,Sprite Bottle,Drinks,40.23,156.0,145.0,11.0,5833.35,RP-004,Suresh,Low Power,19.0,UPI,4.9,67.0,1.17,191.0,0.0,2025-07-26 18:12:00
VMX-11958,VM-001,Delhi,Hospital,21-05-2025,02:22:00,P-107,Colgate Mini,Hygiene,error,73.0,72.0,1.0,2952.0,RP-007,Amit,Maintenance,13.9,Cash,2.9,5.0,4.21,500.0,0.0,2025-05-21 02:22:00
VMX-11959,VM-222,Bangalore,Mall,20-08-2025,20:37:00,P-106,Snickers Bar,Snacks,60.53,78.0,61.0,17.0,3692.33,RP-010,Kiran,Low Power,14.2,UPI,2.8,100.0,4.82,251.0,1.0,2025-08-20 20:37:00
VMX-11960,VM-243,Chennai,College,11-04-2025,18:39:00,P-100,Lays Classic,Snacks,44.67,54.0,39.0,15.0,1742.13,RP-011,Rahul,Working,21.7,Card,4.9,73.0,2.13,467.0,0.0,2025-04-11 18:39:00
VMX-11961,VM-248,Kolkata,Metro Station,08-09-2025,13:02:00,P-100,Lays Classic,Snacks,132.8,25.0,20.0,5.0,2656.0,RP-004,Rahul,Low Power,11.7,UPI,4.9,33.0,3.37,286.0,1.0,2025-09-08 13:02:00
VMX-11962,VM-012,Mumbai,College,11-04-2025,07:55:00,P-109,Doritos,Snacks,98.74,71.0,35.0,16.0,5430.7,RP-009,Anita,Working,23.3,UPI,4.6,47.0,2.08,292.0,0.0,2025-04-11 07:55:00
VMX-11963,VM-096,Kolkata,Hospital,04-04-2025,13:02:00,P-105,Dettol Wipe,Hygiene,13.21,108.0,88.0,20.0,1162.48,RP-001,Kiran,Maintenance,17.1,UPI,4.3,7.0,2.92,375.0,0.0,2025-04-04 13:02:00
VMX-11964,VM-057,Bangalore,Mall,18-02-2025,06:36:00,P-102,Bisleri Water,Drinks,93.96,81.0,69.0,12.0,6483.24,RP-016,Rajesh,Low Power,15.5,Card,3.8,38.0,4.84,102.0,0.0,2025-02-18 06:36:00
VMX-11965,VM-259,Kolkata,College,05-01-2025,10:58:00,P-103,Oreo Pack,Snacks,79.75,148.0,134.0,14.0,10686.5,RP-016,Rahul,Working,21.4,Card,4.4,51.0,4.38,236.0,0.0,2025-01-05 10:58:00
VMX-11966,VM-271,Bangalore,Metro Station,11-09-2025,01:29:00,P-100,Lays Classic,Snacks,124.61,88.0,87.0,1.0,10841.07,RP-010,Rajesh,Maintenance,21.0,Card,4.9,103.0,1.04,180.0,1.0,2025-09-11 01:29:00
VMX-11967,VM-135,Pune,Mall,04-01-2025,09:56:00,P-107,Colgate Mini,Hygiene,39.83,104.0,95.0,9.0,3783.85,RP-016,Amit,Maintenance,10.9,Cash,2.6,110.0,2.81,494.0,0.0,2025-01-04 09:56:00
VMX-11968,VM-266,Chennai,Metro Station,12-02-2025,13:31:00,P-106,Snickers Bar,Snacks,122.5,85.0,78.0,7.0,9555.0,RP-017,Anita,Low Power,24.9,Cash,3.7,84.0,3.29,211.0,0.0,2025-02-12 13:31:00
VMX-11969,VM-191,Mumbai,College,18-01-2025,14:40:00,P-100,Lays Classic,Snacks,37.99,67.0,47.0,20.0,1785.53,RP-011,Amit,Low Power,19.3,Cash,2.4,46.0,1.64,476.0,0.0,2025-01-18 14:40:00
VMX-11970,VM-113,Hyderabad,Metro Station,25-07-2025,12:12:00,P-102,Bisleri Water,Drinks,94.99,173.0,154.0,19.0,14628.46,RP-006,Suresh,Low Power,22.7,UPI,3.1,0.0,4.91,65.0,1.0,2025-07-25 12:12:00
VMX-11971,VM-093,Delhi,Hospital,21-05-2025,01:51:00,P-109,Doritos,Snacks,99.97,50.0,39.0,11.0,3898.83,RP-007,Amit,Working,11.8,Card,3.8,27.0,1.37,217.0,0.0,2025-05-21 01:51:00
VMX-11972,VM-020,Kolkata,Hospital,30-09-2025,04:44:00,P-100,Lays Classic,Snacks,50.91,71.0,69.0,2.0,3512.79,RP-017,Amit,Working,14.5,Cash,4.3,4.0,3.27,78.0,1.0,2025-09-30 04:44:00
VMX-11973,VM-249,Pune,Hospital,22-09-2025,11:28:00,P-104,Red Bull,Drinks,84.3,134.0,128.0,6.0,10790.4,RP-007,Rahul,Maintenance,24.1,Cash,2.8,91.0,2.32,398.0,1.0,2025-09-22 11:28:00
VMX-11974,VM-249,Bangalore,Mall,13-02-2025,17:10:00,P-103,Oreo Pack,Snacks,83.68,46.0,35.0,11.0,2928.8,RP-017,Amit,Low Power,24.0,Cash,3.8,111.0,4.83,308.0,1.0,2025-02-13 17:10:00
VMX-11975,VM-271,Kolkata,Metro Station,28-08-2025,21:26:00,P-102,Bisleri Water,Drinks,131.92,113.0,93.0,20.0,12268.56,RP-003,Deepa,Low Power,18.9,Cash,2.2,65.0,1.5,266.0,1.0,2025-08-28 21:26:00
VMX-11976,VM-174,Hyderabad,Office,18-07-2025,03:43:00,P-104,Red Bull,Drinks,46.65,148.0,134.0,14.0,6251.1,RP-017,Fatima,Low Power,18.8,Cash,4.7,108.0,2.3,65.0,0.0,2025-07-18 03:43:00
VMX-11977,VM-228,Kolkata,Hospital,02-05-2025,10:01:00,P-104,Red Bull,Drinks,50.33,94.0,93.0,1.0,4680.69,RP-020,Deepa,Low Power,21.8,Card,4.1,99.0,4.74,238.0,1.0,2025-05-02 10:01:00
VMX-11978,VM-229,Mumbai,Office,10-03-2025,21:09:00,P-108,Sprite Bottle,Drinks,81.51,35.0,19.0,16.0,1548.69,RP-010,Rajesh,Low Power,19.4,UPI,2.8,73.0,4.5,239.0,1.0,2025-03-10 21:09:00
VMX-11979,VM-128,Mumbai,Metro Station,17-03-2025,09:47:00,P-101,Pepsi Can,Drinks,27.67,151.0,137.0,14.0,3790.79,RP-016,Rahul,Working,10.3,Cash,4.1,111.0,2.32,236.0,1.0,2025-03-17 09:47:00
VMX-11980,VM-055,Mumbai,Hospital,25-08-2025,08:59:00,P-108,Sprite Bottle,Drinks,126.5,165.0,152.0,13.0,19228.0,RP-005,Suresh,Maintenance,18.5,UPI,4.0,62.0,1.47,218.0,1.0,2025-08-25 08:59:00
VMX-11981,VM-135,Pune,College,19-08-2025,13:28:00,P-109,Doritos,Snacks,40.94,27.0,22.0,5.0,900.68,RP-013,Anita,Working,21.7,Cash,3.5,86.0,2.93,234.0,0.0,2025-08-19 13:28:00
VMX-11982,VM-255,Delhi,College,14-04-2025,08:06:00,P-101,Pepsi Can,Drinks,141.87,114.0,111.0,3.0,15747.57,RP-002,Deepa,Low Power,24.4,UPI,3.7,101.0,2.16,232.0,1.0,2025-04-14 08:06:00
VMX-11983,VM-110,Bangalore,Office,06-08-2025,17:42:00,P-105,Dettol Wipe,Hygiene,139.31,67.0,64.0,3.0,8915.84,RP-016,Kiran,Low Power,17.6,Card,4.5,78.0,2.42,53.0,1.0,2025-08-06 17:42:00
VMX-11984,VM-041,Mumbai,College,27-01-2025,09:12:00,P-109,Doritos,Snacks,22.83,148.0,135.0,13.0,3082.05,RP-012,Deepa,Maintenance,17.1,UPI,4.3,11.0,3.5,346.0,1.0,2025-01-27 09:12:00
VMX-11985,VM-125,Kolkata,College,16-07-2025,01:49:00,P-109,Doritos,Snacks,42.41,120.0,103.0,17.0,4368.23,RP-014,Mahesh,Maintenance,18.6,Card,4.9,69.0,2.4,397.0,0.0,2025-07-16 01:49:00
VMX-11986,VM-048,Hyderabad,Office,11-04-2025,19:05:00,P-101,Pepsi Can,Drinks,14.68,115.0,98.0,17.0,1438.64,RP-007,Amit,Working,12.4,UPI,2.1,78.0,3.83,401.0,0.0,2025-04-11 19:05:00
VMX-11987,VM-095,Hyderabad,Mall,13-09-2025,18:02:00,P-103,Oreo Pack,Snacks,141.66,130.0,123.0,7.0,17424.18,RP-018,Fatima,Maintenance,16.7,Cash,4.8,8.0,3.24,364.0,0.0,2025-09-13 18:02:00
VMX-11988,VM-232,Mumbai,Hospital,20-02-2025,13:49:00,P-108,Sprite Bottle,Drinks,51.6,135.0,119.0,16.0,6140.4,RP-008,Anita,Working,21.1,Card,2.7,65.0,3.8,145.0,1.0,2025-02-20 13:49:00
VMX-11989,VM-077,Delhi,Hospital,30-05-2025,15:17:00,P-102,Bisleri Water,Drinks,114,123.0,157.0,13.0,12540.0,RP-010,Anita,Working,13.9,Card,3.7,98.0,3.74,135.0,1.0,2025-05-30 15:17:00
VMX-11990,VM-168,Pune,College,15-08-2025,19:50:00,P-109,Doritos,Snacks,124.86,124.0,117.0,7.0,14608.62,RP-018,Rajesh,Low Power,22.4,UPI,2.8,72.0,1.68,248.0,1.0,2025-08-15 19:50:00
VMX-11991,VM-172,Bangalore,College,22-04-2025,18:39:00,P-101,Pepsi Can,Drinks,52.83,85.0,73.0,12.0,3856.59,RP-011,Deepa,Low Power,16.1,Card,2.4,78.0,2.12,128.0,1.0,2025-04-22 18:39:00
VMX-11992,VM-199,Mumbai,Hospital,12-07-2025,08:49:00,P-109,Doritos,Snacks,116.26,162.0,144.0,18.0,16741.44,RP-017,Ravi,Working,19.9,Card,2.5,17.0,3.31,454.0,0.0,2025-07-12 08:49:00
VMX-11993,VM-287,Mumbai,Mall,11-03-2025,08:24:00,P-103,Oreo Pack,Snacks,103.1,186.0,166.0,20.0,17114.6,RP-006,Mahesh,Working,17.0,Cash,3.5,71.0,4.09,77.0,1.0,2025-03-11 08:24:00
VMX-11994,VM-267,Chennai,Hospital,04-06-2025,22:56:00,P-101,Pepsi Can,Drinks,38.53,125.0,110.0,15.0,4238.3,RP-017,Suresh,Working,23.9,UPI,3.0,49.0,3.75,216.0,1.0,2025-06-04 22:56:00
VMX-11995,VM-288,Delhi,College,24-08-2025,16:24:00,P-106,Snickers Bar,Snacks,101.24,190.0,179.0,11.0,18121.96,RP-002,Deepa,Low Power,11.0,Card,2.4,50.0,3.55,295.0,1.0,2025-08-24 16:24:00
VMX-11996,VM-115,Bangalore,Hospital,20-04-2025,13:58:00,P-104,Red Bull,Drinks,99.48,174.0,166.0,8.0,16513.68,RP-002,Deepa,Low Power,11.6,UPI,3.1,112.0,2.01,179.0,0.0,2025-04-20 13:58:00
VMX-11997,VM-129,Mumbai,College,19-09-2025,13:28:00,P-100,Lays Classic,Snacks,18.6,58.0,56.0,2.0,1041.6,RP-012,Amit,Working,13.7,Cash,3.9,11.0,3.29,320.0,1.0,2025-09-19 13:28:00
VMX-11998,VM-163,Kolkata,Metro Station,21-02-2025,07:14:00,P-100,Lays Classic,Snacks,122.63,124.0,113.0,11.0,13857.19,RP-011,Mahesh,Maintenance,11.3,UPI,5.0,116.0,1.74,145.0,1.0,2025-02-21 07:14:00
VMX-11999,VM-025,Kolkata,Office,08-09-2025,21:37:00,P-106,Snickers Bar,Snacks,67.51,72.0,67.0,5.0,4523.17,RP-005,Suresh,Working,18.2,Cash,3.2,117.0,4.93,459.0,0.0,2025-09-08 21:37:00
VMX-12000,VM-271,Chennai,Office,06-03-2025,19:05:00,P-107,Colgate Mini,Hygiene,16.05,113.0,109.0,4.0,1749.45,RP-015,Anita,Maintenance,22.5,UPI,3.1,76.0,1.08,483.0,0.0,2025-03-06 19:05:00
VMX-12001,VM-149,Bangalore,Office,08-08-2025,03:07:00,P-107,Colgate Mini,Hygiene,error,66.0,55.0,11.0,695.75,RP-017,Suresh,Working,14.7,Cash,3.9,61.0,3.93,429.0,1.0,2025-08-08 03:07:00
VMX-12002,VM-079,Bangalore,College,06-01-2025,19:48:00,P-101,Pepsi Can,Drinks,40.92,129.0,127.0,2.0,5196.84,RP-013,Fatima,Maintenance,16.8,UPI,4.4,25.0,4.29,106.0,1.0,2025-01-06 19:48:00
VMX-12003,VM-065,Mumbai,Office,26-05-2025,07:05:00,P-107,Colgate Mini,Hygiene,43.49,59.0,58.0,1.0,2522.42,RP-008,Ravi,Working,16.2,UPI,3.1,109.0,1.17,163.0,0.0,2025-05-26 07:05:00
VMX-12004,VM-215,Kolkata,Mall,23-06-2025,16:01:00,P-106,Snickers Bar,Snacks,22.1,125.0,114.0,11.0,2519.4,RP-009,Rajesh,Low Power,15.0,Cash,3.3,120.0,1.56,77.0,0.0,2025-06-23 16:01:00
VMX-12005,VM-161,Hyderabad,College,15-03-2025,14:46:00,P-106,Snickers Bar,Snacks,98.07,141.0,140.0,1.0,13729.8,RP-001,Deepa,Maintenance,22.7,Card,4.8,70.0,2.95,268.0,0.0,2025-03-15 14:46:00
VMX-12006,VM-268,Hyderabad,Hospital,02-04-2025,02:44:00,P-105,Dettol Wipe,Hygiene,74.73,39.0,37.0,2.0,2765.01,RP-015,Rahul,Working,22.2,Cash,3.1,101.0,1.75,461.0,0.0,2025-04-02 02:44:00
VMX-12007,VM-299,Delhi,Office,29-09-2025,09:46:00,P-103,Oreo Pack,Snacks,12.34,114.0,106.0,8.0,1308.04,RP-003,Kiran,Low Power,17.1,Cash,4.7,74.0,2.19,124.0,0.0,2025-09-29 09:46:00
VMX-12008,VM-136,Mumbai,Metro Station,01-04-2025,12:43:00,P-108,Sprite Bottle,Drinks,41.81,57.0,49.0,8.0,2048.69,RP-011,Deepa,Maintenance,11.7,Cash,2.4,4.0,2.22,488.0,0.0,2025-04-01 12:43:00
VMX-12009,VM-026,Pune,Mall,17-01-2025,10:06:00,P-105,Dettol Wipe,Hygiene,109.41,159.0,143.0,16.0,15645.63,RP-007,Anita,Low Power,21.6,Card,2.7,53.0,1.81,171.0,0.0,2025-01-17 10:06:00
VMX-12010,VM-028,Hyderabad,Metro Station,10-04-2025,14:44:00,P-105,Dettol Wipe,Hygiene,77.48,114.0,105.0,9.0,8135.4,RP-018,Anita,Working,16.1,UPI,2.7,118.0,2.8,377.0,0.0,2025-04-10 14:44:00
VMX-12011,VM-095,Chennai,Metro Station,14-08-2025,01:07:00,P-101,Pepsi Can,Drinks,120.08,22.0,14.0,8.0,1681.12,RP-006,Fatima,Maintenance,22.5,Cash,4.6,117.0,4.64,469.0,1.0,2025-08-14 01:07:00
VMX-12012,VM-233,Mumbai,Metro Station,14-07-2025,16:06:00,P-101,Pepsi Can,Drinks,72.87,158.0,147.0,11.0,10711.89,RP-015,Deepa,Working,15.3,Cash,3.5,94.0,1.95,402.0,0.0,2025-07-14 16:06:00
VMX-12013,VM-043,Kolkata,Hospital,27-06-2025,23:23:00,P-100,Lays Classic,Snacks,116.89,37.0,36.0,1.0,4208.04,RP-020,Fatima,Working,13.7,Card,2.2,75.0,1.85,242.0,1.0,2025-06-27 23:23:00
VMX-12014,VM-180,Delhi,Office,03-06-2025,01:24:00,P-107,Colgate Mini,Hygiene,13.91,174.0,166.0,8.0,2309.06,RP-012,Amit,Maintenance,15.0,Cash,4.8,47.0,2.87,389.0,1.0,2025-06-03 01:24:00
VMX-12015,VM-007,Mumbai,Metro Station,14-05-2025,12:11:00,P-106,Snickers Bar,Snacks,131.1,21.0,3.0,18.0,393.3,RP-011,Kiran,Working,19.8,Card,2.5,14.0,3.32,469.0,0.0,2025-05-14 12:11:00
VMX-12016,VM-034,Hyderabad,Metro Station,16-07-2025,23:52:00,P-106,Snickers Bar,Snacks,13.65,52.0,32.0,20.0,436.8,RP-014,Fatima,Working,21.1,Cash,5.0,113.0,4.76,162.0,1.0,2025-07-16 23:52:00
VMX-12017,VM-285,Hyderabad,Hospital,23-05-2025,18:00:00,P-100,Lays Classic,Snacks,92.27,37.0,19.0,18.0,1753.13,RP-002,Mahesh,Working,24.9,UPI,4.1,85.0,1.67,62.0,1.0,2025-05-23 18:00:00
VMX-12018,VM-238,Bangalore,Hospital,26-01-2025,02:17:00,P-108,Sprite Bottle,Drinks,74.66,145.0,130.0,15.0,9705.8,RP-017,Amit,Working,11.6,UPI,3.3,83.0,4.09,357.0,1.0,2025-01-26 02:17:00
VMX-12019,VM-186,Mumbai,Metro Station,14-04-2025,20:20:00,P-104,Red Bull,Drinks,70.76,145.0,131.0,14.0,9269.56,RP-004,Rahul,Working,12.2,UPI,4.6,115.0,4.38,154.0,1.0,2025-04-14 20:20:00
VMX-12020,VM-090,Chennai,College,25-05-2025,23:33:00,P-106,Snickers Bar,Snacks,43.62,165.0,151.0,14.0,6586.62,RP-002,Rajesh,Low Power,11.6,UPI,4.2,112.0,4.24,318.0,1.0,2025-05-25 23:33:00
VMX-12021,VM-251,Delhi,Hospital,08-03-2025,23:07:00,P-107,Colgate Mini,Hygiene,36.48,158.0,155.0,3.0,5654.4,RP-009,Fatima,Low Power,24.2,UPI,3.5,77.0,1.96,492.0,1.0,2025-03-08 23:07:00
VMX-12022,VM-297,Pune,Hospital,10-07-2025,12:38:00,P-108,Sprite Bottle,Drinks,52.97,157.0,150.0,7.0,7945.5,RP-004,Amit,Low Power,12.2,Cash,4.5,78.0,1.8,406.0,1.0,2025-07-10 12:38:00
VMX-12023,VM-252,Hyderabad,Metro Station,18-03-2025,12:51:00,P-104,Red Bull,Drinks,69.61,167.0,164.0,3.0,11416.04,RP-003,Rahul,Low Power,24.4,Card,2.6,47.0,1.96,69.0,0.0,2025-03-18 12:51:00
VMX-12024,VM-202,Pune,Mall,21-04-2025,01:20:00,P-101,Pepsi Can,Drinks,44.34,162.0,147.0,15.0,6517.98,RP-017,Rajesh,Low Power,13.5,UPI,4.5,22.0,2.69,137.0,0.0,2025-04-21 01:20:00
VMX-12025,VM-259,Hyderabad,College,09-09-2025,08:30:00,P-102,Bisleri Water,Drinks,93.75,90.0,73.0,17.0,6843.75,RP-006,Fatima,Working,16.0,Card,3.8,37.0,3.98,112.0,1.0,2025-09-09 08:30:00
VMX-12026,VM-043,Mumbai,Hospital,12-03-2025,18:14:00,P-103,Oreo Pack,Snacks,89.88,62.0,58.0,4.0,5213.04,RP-017,Kiran,Low Power,23.6,Cash,4.4,72.0,3.6,401.0,1.0,2025-03-12 18:14:00
VMX-12027,VM-247,Delhi,Hospital,29-01-2025,10:20:00,P-105,Dettol Wipe,Hygiene,127.11,184.0,164.0,20.0,20846.04,RP-016,Rahul,Working,16.9,Cash,2.2,16.0,3.68,158.0,1.0,2025-01-29 10:20:00
VMX-12028,VM-170,Mumbai,Office,09-02-2025,02:44:00,P-105,Dettol Wipe,Hygiene,38.9,83.0,67.0,16.0,2606.3,RP-002,Rahul,Working,23.5,UPI,2.5,79.0,2.09,67.0,0.0,2025-02-09 02:44:00
VMX-12029,VM-132,Bangalore,Mall,30-06-2025,13:11:00,P-106,Snickers Bar,Snacks,92.81,115.0,101.0,14.0,9373.81,RP-019,Ravi,Low Power,18.0,UPI,4.9,103.0,3.08,211.0,1.0,2025-06-30 13:11:00
VMX-12030,VM-055,Hyderabad,College,20-05-2025,08:51:00,P-100,Lays Classic,Snacks,65.96,89.0,82.0,7.0,5408.72,RP-001,Anita,Working,22.9,Card,3.8,33.0,3.49,228.0,1.0,2025-05-20 08:51:00
VMX-12031,VM-280,Delhi,Metro Station,26-09-2025,02:32:00,P-109,Doritos,Snacks,31.04,20.0,17.0,3.0,527.68,RP-014,Rahul,Maintenance,19.6,Cash,4.9,97.0,4.39,371.0,0.0,2025-09-26 02:32:00
VMX-12032,VM-258,Unknown,College,28-09-2025,09:50:00,P-105,Dettol Wipe,Hygiene,72.76,102.0,96.0,6.0,6984.96,RP-004,Ravi,Low Power,20.7,Cash,4.6,38.0,2.83,252.0,0.0,2025-09-28 09:50:00
VMX-12033,VM-155,Kolkata,Office,24-03-2025,12:11:00,P-101,Pepsi Can,Drinks,131.89,125.0,116.0,9.0,15299.24,RP-011,Anita,Low Power,24.8,Cash,4.7,15.0,4.32,224.0,1.0,2025-03-24 12:11:00
VMX-12034,VM-292,Chennai,College,15-03-2025,21:15:00,P-106,Snickers Bar,Snacks,97.22,198.0,193.0,5.0,18763.46,RP-016,Ravi,Low Power,13.7,UPI,2.7,49.0,2.53,81.0,1.0,2025-03-15 21:15:00
VMX-12035,VM-128,Pune,Metro Station,02-08-2025,01:50:00,P-104,Red Bull,Drinks,76.12,32.0,31.0,1.0,2359.72,RP-003,Mahesh,Low Power,18.7,UPI,2.3,24.0,2.35,88.0,1.0,2025-08-02 01:50:00
VMX-12036,VM-055,Mumbai,Office,26-03-2025,09:40:00,P-101,Pepsi Can,Drinks,113.63,20.0,15.0,5.0,1704.45,RP-013,Ravi,Low Power,17.7,Card,3.0,32.0,3.66,93.0,1.0,2025-03-26 09:40:00
VMX-12037,VM-007,Bangalore,Metro Station,11-08-2025,12:23:00,P-104,Red Bull,Drinks,27.06,75.0,69.0,6.0,1867.14,RP-011,Rahul,Working,14.9,UPI,4.1,112.0,2.28,109.0,1.0,2025-08-11 12:23:00
VMX-12038,VM-031,Delhi,Office,08-10-2025,05:36:00,P-109,Doritos,Snacks,23.85,115.0,100.0,15.0,2385.0,RP-006,Anita,Maintenance,12.7,Cash,4.4,110.0,1.46,401.0,0.0,2025-10-08 05:36:00
VMX-12039,VM-149,Hyderabad,Office,19-05-2025,16:07:00,P-104,Red Bull,Drinks,32.4,169.0,150.0,19.0,4860.0,RP-001,Ravi,Working,22.2,UPI,4.1,50.0,4.61,347.0,0.0,2025-05-19 16:07:00
VMX-12040,VM-062,Kolkata,Mall,14-06-2025,04:00:00,P-109,Doritos,Snacks,26.94,63.0,50.0,13.0,1347.0,RP-001,Ravi,Low Power,14.5,Cash,2.5,79.0,4.61,381.0,1.0,2025-06-14 04:00:00
VMX-12041,VM-187,Pune,Office,24-09-2025,12:25:00,P-104,Red Bull,Drinks,71.02,148.0,132.0,16.0,9374.64,RP-018,Ravi,Maintenance,18.1,UPI,2.6,102.0,3.4,176.0,1.0,2025-09-24 12:25:00
VMX-12042,VM-140,Delhi,Metro Station,22-02-2025,13:19:00,P-107,Colgate Mini,Hygiene,134.17,103.0,84.0,19.0,11270.28,RP-004,Deepa,Working,21.9,Card,2.3,83.0,1.1,98.0,0.0,2025-02-22 13:19:00
VMX-12043,VM-207,Kolkata,Metro Station,22-04-2025,03:22:00,P-103,Oreo Pack,Snacks,18.63,100.0,96.0,4.0,1788.48,RP-006,Suresh,Low Power,12.7,UPI,4.8,1.0,3.91,125.0,1.0,2025-04-22 03:22:00
VMX-12044,VM-081,Hyderabad,Mall,11-02-2025,20:15:00,P-106,Snickers Bar,Snacks,34.38,120.0,105.0,15.0,3609.9,RP-011,Suresh,Low Power,12.4,Card,3.3,102.0,1.16,279.0,0.0,2025-02-11 20:15:00
VMX-12045,VM-275,Mumbai,Hospital,12-04-2025,20:40:00,P-106,Snickers Bar,Snacks,14.15,54.0,35.0,19.0,495.25,RP-013,Rajesh,Low Power,10.8,Card,4.1,114.0,4.46,299.0,0.0,2025-04-12 20:40:00
VMX-12046,VM-027,Hyderabad,Mall,02-04-2025,09:53:00,P-101,Pepsi Can,Drinks,15.56,186.0,176.0,10.0,2738.56,RP-007,Mahesh,Low Power,22.8,Cash,4.1,104.0,4.22,356.0,1.0,2025-04-02 09:53:00
VMX-12047,VM-222,Chennai,Office,26-06-2025,08:11:00,P-102,Bisleri Water,Drinks,49.71,138.0,134.0,4.0,6661.14,RP-003,Kiran,Maintenance,22.2,Card,3.8,26.0,3.37,298.0,1.0,2025-06-26 08:11:00
VMX-12048,VM-053,Kolkata,Metro Station,23-04-2025,17:42:00,P-103,Oreo Pack,Snacks,91.33,101.0,96.0,5.0,8767.68,RP-006,Fatima,Maintenance,12.9,UPI,3.9,85.0,3.51,447.0,1.0,2025-04-23 17:42:00
VMX-12049,VM-021,Chennai,Mall,02-09-2025,23:58:00,P-108,Sprite Bottle,Drinks,101.13,152.0,152.0,0.0,15371.76,RP-008,Deepa,Low Power,21.6,Cash,2.2,78.0,3.41,346.0,0.0,2025-09-02 23:58:00
VMX-12050,VM-098,Chennai,Mall,06-04-2025,21:05:00,P-101,Pepsi Can,Drinks,124.89,129.0,111.0,18.0,13862.79,RP-010,Rajesh,Maintenance,10.9,Cash,4.4,109.0,4.99,51.0,1.0,2025-04-06 21:05:00
VMX-12051,VM-296,Pune,Metro Station,02-06-2025,18:18:00,P-107,Colgate Mini,Hygiene,62.49,162.0,145.0,17.0,9061.05,RP-013,Suresh,Low Power,16.8,Card,3.2,53.0,1.5,86.0,0.0,2025-06-02 18:18:00
VMX-12052,VM-132,Pune,Office,03-07-2025,02:39:00,P-108,Sprite Bottle,Drinks,140.81,103.0,85.0,18.0,11968.85,RP-012,Anita,Maintenance,12.6,UPI,3.7,43.0,1.4,468.0,0.0,2025-07-03 02:39:00
VMX-12053,VM-298,Mumbai,Mall,29-06-2025,09:06:00,P-100,Lays Classic,Snacks,113.95,176.0,174.0,2.0,19827.3,RP-012,Ravi,Maintenance,20.6,Cash,2.1,52.0,2.99,225.0,0.0,2025-06-29 09:06:00
VMX-12054,VM-006,Kolkata,Office,25-07-2025,11:46:00,P-103,Oreo Pack,Snacks,146.83,129.0,122.0,7.0,17913.26,RP-001,Anita,Working,17.4,UPI,4.6,115.0,1.57,171.0,1.0,2025-07-25 11:46:00
VMX-12055,VM-021,Delhi,Mall,15-09-2025,14:55:00,P-102,Bisleri Water,Drinks,68.77,199.0,184.0,15.0,12653.68,RP-006,Suresh,Maintenance,22.4,Cash,2.4,10.0,2.77,455.0,0.0,2025-09-15 14:55:00
VMX-12056,VM-062,Hyderabad,Mall,13-06-2025,04:52:00,P-105,Dettol Wipe,Hygiene,142.23,98.0,84.0,14.0,11947.32,RP-015,Deepa,Maintenance,16.3,UPI,4.7,27.0,1.28,206.0,0.0,2025-06-13 04:52:00
VMX-12057,VM-083,Bangalore,College,01-10-2025,16:25:00,P-103,Oreo Pack,Snacks,148.67,46.0,46.0,0.0,6838.82,RP-014,Deepa,Maintenance,23.3,Card,4.5,3.0,1.94,322.0,0.0,2025-10-01 16:25:00
VMX-12058,VM-048,Delhi,College,02-06-2025,17:23:00,P-108,Sprite Bottle,Drinks,122.16,82.0,69.0,13.0,8429.04,RP-002,Amit,Working,17.5,UPI,2.2,32.0,1.09,94.0,1.0,2025-06-02 17:23:00
VMX-12059,VM-282,Mumbai,Metro Station,02-02-2025,13:40:00,P-100,Lays Classic,Snacks,28.86,87.0,74.0,13.0,2135.64,RP-015,Suresh,Working,21.4,UPI,3.7,73.0,2.91,487.0,0.0,2025-02-02 13:40:00
VMX-12060,VM-254,Chennai,Mall,07-04-2025,20:19:00,P-103,Oreo Pack,Snacks,103.06,25.0,17.0,8.0,1752.02,RP-007,Anita,Low Power,11.9,Cash,3.2,8.0,4.48,462.0,0.0,2025-04-07 20:19:00
VMX-12061,VM-057,Bangalore,College,07-01-2025,20:18:00,P-104,Red Bull,Drinks,128.08,20.0,55.0,2.0,2305.44,RP-008,Deepa,Low Power,15.0,Card,3.4,38.0,1.53,419.0,1.0,2025-01-07 20:18:00
VMX-12062,VM-238,Bangalore,College,02-07-2025,13:48:00,P-102,Bisleri Water,Drinks,105.85,52.0,45.0,7.0,4763.25,RP-016,Kiran,Working,20.7,Card,4.7,71.0,4.76,333.0,1.0,2025-07-02 13:48:00
VMX-12063,VM-225,Chennai,College,05-08-2025,15:47:00,P-108,Sprite Bottle,Drinks,136.87,136.0,121.0,15.0,16561.27,RP-007,Fatima,Low Power,17.0,Cash,2.4,27.0,3.43,93.0,0.0,2025-08-05 15:47:00
VMX-12064,VM-244,Bangalore,College,22-01-2025,08:32:00,P-109,Doritos,Snacks,73.91,182.0,177.0,5.0,13082.07,RP-009,Deepa,Working,18.8,UPI,3.0,64.0,2.64,311.0,0.0,2025-01-22 08:32:00
VMX-12065,VM-016,Mumbai,Metro Station,28-02-2025,17:35:00,P-107,Colgate Mini,Hygiene,125.96,77.0,69.0,8.0,8691.24,RP-013,Anita,Maintenance,20.2,Cash,3.9,101.0,1.43,498.0,1.0,2025-02-28 17:35:00
VMX-12066,VM-167,Bangalore,Hospital,24-02-2025,17:40:00,P-105,Dettol Wipe,Hygiene,81.4,178.0,172.0,6.0,14000.8,RP-005,Mahesh,Low Power,23.5,UPI,3.8,98.0,1.94,143.0,1.0,2025-02-24 17:40:00
VMX-12067,VM-265,Chennai,Hospital,16-01-2025,13:14:00,P-101,Pepsi Can,Drinks,104.4,100.0,92.0,8.0,9604.8,RP-015,Mahesh,Working,24.7,Card,3.4,81.0,1.3,231.0,0.0,2025-01-16 13:14:00
VMX-12068,VM-178,Chennai,Office,29-01-2025,21:57:00,P-107,Colgate Mini,Hygiene,88.25,91.0,86.0,5.0,7589.5,RP-011,Suresh,Maintenance,14.8,UPI,4.8,108.0,1.14,438.0,1.0,2025-01-29 21:57:00
VMX-12069,VM-085,Delhi,Mall,03-10-2025,18:59:00,P-107,Colgate Mini,Hygiene,75.52,148.0,132.0,16.0,9968.64,RP-004,Mahesh,Maintenance,10.6,Cash,4.0,1.0,4.7,61.0,1.0,2025-10-03 18:59:00
VMX-12070,VM-055,Delhi,Hospital,30-03-2025,09:25:00,P-107,Colgate Mini,Hygiene,116.37,37.0,34.0,3.0,3956.58,RP-012,Rajesh,Maintenance,20.4,UPI,2.3,113.0,1.09,405.0,1.0,2025-03-30 09:25:00
VMX-12071,VM-140,Bangalore,Hospital,25-09-2025,13:16:00,P-108,Sprite Bottle,Drinks,69.85,143.0,141.0,2.0,9848.85,RP-005,Anita,Low Power,22.4,UPI,2.2,33.0,3.25,262.0,1.0,2025-09-25 13:16:00
VMX-12072,VM-008,Bangalore,Mall,15-09-2025,14:29:00,P-101,Pepsi Can,Drinks,26.1,24.0,21.0,3.0,548.1,RP-006,Deepa,Low Power,21.6,Card,2.9,37.0,1.9,436.0,0.0,2025-09-15 14:29:00
VMX-12073,VM-248,Delhi,Office,05-08-2025,16:36:00,P-107,Colgate Mini,Hygiene,44.2,98.0,86.0,12.0,3801.2,RP-020,Mahesh,Working,19.6,Cash,2.8,29.0,3.05,101.0,1.0,2025-08-05 16:36:00
VMX-12074,VM-294,Bangalore,Office,15-03-2025,08:25:00,P-107,Colgate Mini,Hygiene,97.41,148.0,130.0,18.0,12663.3,RP-015,Mahesh,Low Power,22.8,Cash,2.3,119.0,3.72,80.0,0.0,2025-03-15 08:25:00
VMX-12075,VM-136,Chennai,Hospital,11-03-2025,07:05:00,P-108,Sprite Bottle,Drinks,69.64,93.0,86.0,7.0,5989.04,RP-012,Ravi,Maintenance,21.8,Cash,3.4,76.0,1.32,468.0,1.0,2025-03-11 07:05:00
VMX-12076,VM-080,Chennai,Hospital,24-08-2025,08:12:00,P-100,Lays Classic,Snacks,13.02,89.0,82.0,7.0,1067.64,RP-016,Anita,Working,24.6,Card,3.0,48.0,1.55,96.0,0.0,2025-08-24 08:12:00
VMX-12077,VM-059,Pune,College,25-02-2025,20:04:00,P-103,Oreo Pack,Snacks,27.29,106.0,98.0,8.0,2674.42,RP-005,Mahesh,Low Power,10.2,Cash,2.7,51.0,3.6,154.0,0.0,2025-02-25 20:04:00
VMX-12078,VM-136,Bangalore,Hospital,08-02-2025,21:19:00,P-100,Lays Classic,Snacks,60.47,52.0,47.0,5.0,2842.09,RP-015,Suresh,Maintenance,21.3,Cash,3.7,85.0,1.54,446.0,1.0,2025-02-08 21:19:00
VMX-12079,VM-293,Delhi,Metro Station,10-06-2025,21:48:00,P-101,Pepsi Can,Drinks,27.32,124.0,121.0,3.0,3305.72,RP-010,Anita,Maintenance,12.1,Card,2.3,35.0,4.4,218.0,1.0,2025-06-10 21:48:00
VMX-12080,VM-066,Delhi,Metro Station,20-03-2025,12:33:00,P-103,Oreo Pack,Snacks,71.4,101.0,84.0,17.0,5997.6,RP-012,Mahesh,Maintenance,11.6,Card,3.7,109.0,3.63,66.0,0.0,2025-03-20 12:33:00
VMX-12081,VM-179,Pune,College,09-07-2025,18:14:00,P-103,Oreo Pack,Snacks,28.7,108.0,91.0,17.0,2611.7,RP-007,Deepa,Maintenance,12.6,Card,2.1,3.0,4.7,303.0,1.0,2025-07-09 18:14:00
VMX-12082,VM-231,Kolkata,Mall,15-02-2025,18:43:00,P-100,Lays Classic,Snacks,132.2,190.0,174.0,16.0,23002.8,RP-012,Anita,Low Power,23.7,UPI,2.5,90.0,3.8,302.0,1.0,2025-02-15 18:43:00
VMX-12083,VM-126,Hyderabad,Office,19-07-2025,08:50:00,P-107,Colgate Mini,Hygiene,45.44,90.0,72.0,18.0,3271.68,RP-014,Anita,Working,10.7,Cash,3.2,68.0,4.5,119.0,1.0,2025-07-19 08:50:00
VMX-12084,VM-107,Mumbai,Hospital,06-07-2025,11:51:00,P-104,Red Bull,Drinks,86.49,52.0,38.0,14.0,3286.62,RP-019,Suresh,Maintenance,15.3,Card,4.6,83.0,4.22,60.0,0.0,2025-07-06 11:51:00
VMX-12085,VM-185,Chennai,Office,28-08-2025,05:55:00,P-102,Bisleri Water,Drinks,26.98,85.0,85.0,0.0,2293.3,RP-007,Rahul,Low Power,10.7,UPI,2.2,106.0,4.97,487.0,0.0,2025-08-28 05:55:00
VMX-12086,VM-074,Mumbai,Mall,16-01-2025,14:36:00,P-102,Bisleri Water,Drinks,127.94,84.0,70.0,14.0,8955.8,RP-012,Ravi,Maintenance,17.2,Cash,2.4,50.0,4.1,161.0,0.0,2025-01-16 14:36:00
VMX-12087,VM-261,Pune,Office,02-06-2025,07:43:00,P-105,Dettol Wipe,Hygiene,18.22,79.0,61.0,18.0,1111.42,RP-009,Amit,Low Power,18.4,UPI,2.5,118.0,1.97,96.0,1.0,2025-06-02 07:43:00
VMX-12088,VM-157,Pune,Office,15-05-2025,10:59:00,P-109,Doritos,Snacks,137.45,165.0,152.0,13.0,20892.4,RP-020,Deepa,Low Power,21.0,Cash,2.5,92.0,1.77,105.0,1.0,2025-05-15 10:59:00
VMX-12089,VM-271,Bangalore,Mall,13-08-2025,23:06:00,P-104,Red Bull,Drinks,105.35,188.0,184.0,4.0,19384.4,RP-005,Anita,Working,12.4,Card,4.9,50.0,4.45,116.0,1.0,2025-08-13 23:06:00
VMX-12090,VM-021,Chennai,Hospital,16-01-2025,21:17:00,P-106,Snickers Bar,Snacks,24.33,124.0,116.0,8.0,2822.28,RP-011,Deepa,Working,11.2,Card,3.1,64.0,1.32,112.0,0.0,2025-01-16 21:17:00
VMX-12091,VM-083,Hyderabad,Hospital,30-09-2025,22:38:00,P-105,Dettol Wipe,Hygiene,10.92,54.0,50.0,4.0,546.0,RP-010,Deepa,Maintenance,15.3,Card,4.9,17.0,2.77,265.0,1.0,2025-09-30 22:38:00
VMX-12092,VM-136,Bangalore,Mall,18-04-2025,10:44:00,P-107,Colgate Mini,Hygiene,121.24,66.0,60.0,6.0,7274.4,RP-015,Suresh,Maintenance,21.8,Card,3.3,27.0,3.43,444.0,0.0,2025-04-18 10:44:00
VMX-12093,VM-195,Hyderabad,Hospital,22-01-2025,00:08:00,P-101,Pepsi Can,Drinks,125.48,108.0,105.0,3.0,13175.4,RP-015,Amit,Working,13.9,Card,3.9,89.0,3.09,499.0,1.0,2025-01-22 00:08:00
VMX-12094,VM-128,Hyderabad,College,04-07-2025,11:30:00,P-105,Dettol Wipe,Hygiene,40.32,147.0,145.0,2.0,5846.4,RP-012,Amit,Working,18.4,Card,2.6,71.0,2.81,65.0,1.0,2025-07-04 11:30:00
VMX-12095,VM-117,Hyderabad,Mall,28-08-2025,14:54:00,P-100,Lays Classic,Snacks,76.68,73.0,66.0,7.0,5060.88,RP-020,Rajesh,Working,23.3,UPI,4.8,94.0,2.25,224.0,0.0,2025-08-28 14:54:00
VMX-12096,VM-211,Pune,College,14-01-2025,16:09:00,P-102,Bisleri Water,Drinks,105.81,136.0,125.0,11.0,13226.25,RP-001,Rahul,Working,17.1,Cash,2.1,83.0,3.51,93.0,0.0,2025-01-14 16:09:00
VMX-12097,VM-166,Pune,Hospital,03-04-2025,07:38:00,P-101,Pepsi Can,Drinks,83.14,91.0,80.0,11.0,6651.2,RP-002,Amit,Working,13.1,UPI,4.4,116.0,4.12,369.0,1.0,2025-04-03 07:38:00
VMX-12098,VM-101,Hyderabad,Metro Station,16-01-2025,06:10:00,P-105,Dettol Wipe,Hygiene,26.1,112.0,98.0,14.0,2557.8,RP-017,Fatima,Working,21.9,Cash,4.7,36.0,4.76,288.0,1.0,2025-01-16 06:10:00
VMX-12099,VM-228,Pune,Metro Station,24-04-2025,00:03:00,P-100,Lays Classic,Snacks,33.7,91.0,88.0,3.0,2965.6,RP-014,Rajesh,Maintenance,15.2,Card,4.3,41.0,2.36,327.0,1.0,2025-04-24 00:03:00
VMX-12100,VM-152,Pune,Hospital,05-06-2025,10:02:00,P-100,Lays Classic,Snacks,92.28,167.0,164.0,3.0,15133.92,RP-006,Suresh,Low Power,16.2,UPI,4.0,16.0,2.78,306.0,1.0,2025-06-05 10:02:00
VMX-12101,VM-116,Delhi,Metro Station,10-03-2025,01:19:00,P-105,Dettol Wipe,Hygiene,24.61,51.0,42.0,9.0,1033.62,RP-009,Deepa,Working,20.2,Card,2.8,51.0,1.58,299.0,1.0,2025-03-10 01:19:00
VMX-12102,VM-147,Hyderabad,Hospital,14-04-2025,18:57:00,P-104,Red Bull,Drinks,102.74,95.0,76.0,19.0,7808.24,RP-013,Rajesh,Low Power,24.5,UPI,3.7,86.0,3.24,499.0,1.0,2025-04-14 18:57:00
VMX-12103,VM-139,Pune,College,30-09-2025,10:28:00,P-109,Doritos,Snacks,81.5,198.0,187.0,11.0,15240.5,RP-003,Mahesh,Low Power,19.7,UPI,3.4,19.0,4.91,198.0,0.0,2025-09-30 10:28:00
VMX-12104,VM-163,Bangalore,Hospital,19-08-2025,17:39:00,P-108,Sprite Bottle,Drinks,72.66,80.0,60.0,20.0,4359.6,RP-016,Mahesh,Working,24.5,UPI,3.7,112.0,4.37,270.0,1.0,2025-08-19 17:39:00
VMX-12105,VM-225,Pune,College,17-03-2025,08:15:00,P-105,Dettol Wipe,Hygiene,104.61,172.0,156.0,16.0,16319.16,RP-009,Rajesh,Working,14.4,UPI,3.9,25.0,2.56,84.0,1.0,2025-03-17 08:15:00
VMX-12106,VM-072,Kolkata,College,10-08-2025,22:57:00,P-105,Dettol Wipe,Hygiene,65.15,168.0,163.0,5.0,10619.45,RP-008,Amit,Low Power,24.3,UPI,4.3,15.0,1.56,249.0,1.0,2025-08-10 22:57:00
VMX-12107,VM-175,Mumbai,Metro Station,03-01-2025,00:35:00,P-102,Bisleri Water,Drinks,148.46,59.0,52.0,7.0,7719.92,RP-019,Deepa,Maintenance,11.7,Cash,2.4,39.0,1.73,447.0,1.0,2025-01-03 00:35:00
VMX-12108,VM-252,Kolkata,Metro Station,01-01-2025,10:58:00,P-106,Snickers Bar,Snacks,12.76,168.0,151.0,17.0,1926.76,RP-007,Kiran,Maintenance,19.1,Card,4.9,3.0,1.81,187.0,0.0,2025-01-01 10:58:00
VMX-12109,VM-264,Chennai,Hospital,07-04-2025,04:37:00,P-103,Oreo Pack,Snacks,125.05,123.0,113.0,10.0,14130.65,RP-018,Anita,Maintenance,23.4,Card,5.0,56.0,4.46,460.0,1.0,2025-04-07 04:37:00
VMX-12110,VM-140,Mumbai,College,23-01-2025,00:31:00,P-100,Lays Classic,Snacks,113.09,31.0,18.0,13.0,2035.62,RP-009,Suresh,Working,23.1,Cash,5.0,100.0,2.11,352.0,0.0,2025-01-23 00:31:00
VMX-12111,VM-043,Delhi,Hospital,18-07-2025,17:28:00,P-107,Colgate Mini,Hygiene,148.86,92.0,86.0,6.0,12801.96,RP-008,Fatima,Maintenance,16.9,Cash,4.6,116.0,2.43,294.0,1.0,2025-07-18 17:28:00
VMX-12112,VM-220,Hyderabad,Metro Station,11-07-2025,16:27:00,P-104,Red Bull,Drinks,126.54,103.0,95.0,8.0,12021.3,RP-005,Anita,Maintenance,20.9,UPI,2.2,21.0,2.96,235.0,0.0,2025-07-11 16:27:00
VMX-12113,VM-215,Bangalore,Office,14-09-2025,15:11:00,P-101,Pepsi Can,Drinks,45.1,174.0,158.0,16.0,7125.8,RP-019,Amit,Working,19.5,Cash,2.6,28.0,3.3,349.0,0.0,2025-09-14 15:11:00
VMX-12114,VM-063,Bangalore,Mall,25-08-2025,22:52:00,P-101,Pepsi Can,Drinks,53.97,26.0,26.0,0.0,1403.22,RP-001,Anita,Maintenance,14.1,Card,2.8,99.0,2.4,282.0,1.0,2025-08-25 22:52:00
VMX-12115,VM-195,Mumbai,College,26-02-2025,23:29:00,P-101,Pepsi Can,Drinks,60.87,190.0,182.0,8.0,11078.34,RP-010,Deepa,Low Power,18.2,Cash,3.7,114.0,1.39,401.0,1.0,2025-02-26 23:29:00
VMX-12116,VM-191,Kolkata,Hospital,19-08-2025,12:59:00,P-105,Dettol Wipe,Hygiene,71.62,122.0,122.0,15.0,7663.34,RP-014,Kiran,Low Power,22.9,UPI,4.9,5.0,3.25,114.0,0.0,2025-08-19 12:59:00
VMX-12117,VM-160,Chennai,Office,13-03-2025,18:27:00,P-108,Sprite Bottle,Drinks,103.97,107.0,87.0,20.0,9045.39,RP-006,Ravi,Low Power,15.5,UPI,3.7,68.0,3.08,320.0,0.0,2025-03-13 18:27:00
VMX-12118,VM-142,Bangalore,Mall,28-08-2025,11:19:00,P-109,Doritos,Snacks,88.16,144.0,140.0,4.0,12342.4,RP-001,Kiran,Working,20.3,Card,3.1,5.0,2.66,360.0,0.0,2025-08-28 11:19:00
VMX-12119,VM-142,Hyderabad,College,27-09-2025,13:50:00,P-109,Doritos,Snacks,125.76,139.0,132.0,7.0,16600.32,RP-013,Rajesh,Working,14.6,UPI,2.6,4.0,1.98,459.0,0.0,2025-09-27 13:50:00
VMX-12120,VM-291,Kolkata,Mall,06-10-2025,22:12:00,P-104,Red Bull,Drinks,44.6,69.0,67.0,2.0,2988.2,RP-008,Mahesh,Working,11.6,Cash,4.4,65.0,2.05,60.0,1.0,2025-10-06 22:12:00
VMX-12121,VM-164,Chennai,Mall,25-06-2025,16:31:00,P-105,Dettol Wipe,Hygiene,45.22,156.0,146.0,10.0,6602.12,RP-010,Deepa,Working,18.5,Cash,3.0,35.0,1.77,361.0,1.0,2025-06-25 16:31:00
VMX-12122,VM-232,Pune,Metro Station,12-06-2025,02:59:00,P-104,Red Bull,Drinks,58.5,153.0,147.0,6.0,8599.5,RP-007,Fatima,Low Power,20.7,Cash,4.0,42.0,2.4,253.0,1.0,2025-06-12 02:59:00
VMX-12123,VM-295,Chennai,Metro Station,05-10-2025,22:51:00,P-109,Doritos,Snacks,70.48,83.0,77.0,6.0,5426.96,RP-014,Anita,Working,17.0,Card,4.8,41.0,4.78,248.0,0.0,2025-10-05 22:51:00
VMX-12124,VM-218,Pune,Office,10-08-2025,04:16:00,P-101,Pepsi Can,Drinks,94,169.0,166.0,3.0,15604.0,RP-016,Kiran,Maintenance,24.2,Card,2.6,102.0,4.54,324.0,1.0,2025-08-10 04:16:00
VMX-12125,VM-098,Mumbai,Hospital,06-09-2025,18:29:00,P-102,Bisleri Water,Drinks,70.43,112.0,109.0,3.0,7676.87,RP-019,Rahul,Working,11.4,Cash,2.4,119.0,4.27,303.0,0.0,2025-09-06 18:29:00
VMX-12126,VM-066,Kolkata,College,10-06-2025,23:47:00,P-109,Doritos,Snacks,116.26,193.0,174.0,19.0,20229.24,RP-007,Fatima,Maintenance,16.8,Cash,4.7,15.0,4.1,460.0,1.0,2025-06-10 23:47:00
VMX-12127,VM-196,Bangalore,Office,30-06-2025,23:50:00,P-101,Pepsi Can,Drinks,90.1,182.0,174.0,8.0,15677.4,RP-009,Kiran,Maintenance,12.7,Cash,2.3,43.0,2.7,161.0,0.0,2025-06-30 23:50:00
VMX-12128,VM-148,Bangalore,Mall,19-01-2025,16:09:00,P-109,Doritos,Snacks,39.7,193.0,182.0,11.0,7225.4,RP-013,Amit,Low Power,13.6,Card,2.3,35.0,1.06,77.0,1.0,2025-01-19 16:09:00
VMX-12129,VM-141,Bangalore,College,26-05-2025,02:43:00,P-105,Dettol Wipe,Hygiene,53.87,172.0,156.0,16.0,8403.72,RP-005,Anita,Maintenance,14.5,UPI,2.1,35.0,2.48,439.0,0.0,2025-05-26 02:43:00
VMX-12130,VM-136,Chennai,College,27-08-2025,00:08:00,P-103,Oreo Pack,Snacks,141.83,151.0,150.0,1.0,21274.5,RP-010,Suresh,Working,10.4,Card,2.0,61.0,1.38,335.0,0.0,2025-08-27 00:08:00
VMX-12131,VM-113,Mumbai,Hospital,08-03-2025,15:30:00,P-103,Oreo Pack,Snacks,104.87,199.0,192.0,7.0,20135.04,RP-012,Deepa,Low Power,16.6,Cash,3.3,56.0,2.43,165.0,1.0,2025-03-08 15:30:00
VMX-12132,VM-200,Mumbai,Hospital,28-08-2025,03:11:00,P-105,Dettol Wipe,Hygiene,53.4,47.0,38.0,9.0,2029.2,RP-004,Deepa,Maintenance,13.7,Cash,4.4,73.0,3.98,115.0,1.0,2025-08-28 03:11:00
VMX-12133,VM-051,Bangalore,Office,05-02-2025,11:03:00,P-102,Bisleri Water,Drinks,74.77,33.0,29.0,4.0,2168.33,RP-008,Suresh,Maintenance,10.8,Cash,3.4,109.0,3.96,363.0,1.0,2025-02-05 11:03:00
VMX-12134,VM-290,Hyderabad,Mall,31-08-2025,06:13:00,P-108,Sprite Bottle,Drinks,35.33,93.0,79.0,14.0,2791.07,RP-020,Rahul,Working,13.3,Cash,4.1,14.0,1.59,276.0,1.0,2025-08-31 06:13:00
VMX-12135,VM-045,Chennai,Mall,11-06-2025,14:42:00,P-109,Doritos,Snacks,43.94,198.0,187.0,11.0,8216.78,RP-003,Ravi,Low Power,24.1,Cash,4.9,4.0,4.33,411.0,1.0,2025-06-11 14:42:00
VMX-12136,VM-202,Chennai,Mall,22-05-2025,08:12:00,P-105,Dettol Wipe,Hygiene,93.73,31.0,31.0,0.0,2905.63,RP-013,Anita,Low Power,13.8,Cash,4.2,72.0,4.23,264.0,0.0,2025-05-22 08:12:00
VMX-12137,VM-077,Bangalore,Hospital,29-01-2025,14:40:00,P-104,Red Bull,Drinks,30.63,196.0,196.0,0.0,6003.48,RP-013,Fatima,Working,14.8,UPI,3.5,108.0,3.51,278.0,1.0,2025-01-29 14:40:00
VMX-12138,VM-191,Bangalore,College,07-04-2025,17:48:00,P-107,Colgate Mini,Hygiene,24.9,174.0,168.0,6.0,4183.2,RP-001,Mahesh,Maintenance,10.7,Cash,4.0,27.0,3.54,121.0,1.0,2025-04-07 17:48:00
VMX-12139,VM-170,Chennai,Hospital,01-09-2025,14:56:00,P-108,Sprite Bottle,Drinks,112.32,128.0,108.0,20.0,12130.56,RP-012,Fatima,Low Power,11.8,Cash,3.7,39.0,4.86,384.0,0.0,2025-09-01 14:56:00
VMX-12140,VM-147,Kolkata,Hospital,21-04-2025,07:11:00,P-103,Oreo Pack,Snacks,50.5,127.0,107.0,20.0,5403.5,RP-012,Kiran,Maintenance,14.3,Cash,3.0,95.0,2.64,152.0,1.0,2025-04-21 07:11:00
VMX-12141,VM-264,Chennai,College,10-06-2025,02:52:00,P-101,Pepsi Can,Drinks,75.18,146.0,140.0,6.0,10525.2,RP-016,Kiran,Maintenance,20.1,UPI,4.1,72.0,2.44,346.0,1.0,2025-06-10 02:52:00
VMX-12142,VM-230,Delhi,Office,28-04-2025,22:14:00,P-105,Dettol Wipe,Hygiene,120.47,23.0,22.0,1.0,2650.34,RP-005,Amit,Maintenance,22.6,Card,2.8,32.0,3.55,95.0,0.0,2025-04-28 22:14:00
VMX-12143,VM-174,Chennai,Hospital,17-02-2025,23:16:00,P-109,Doritos,Snacks,32.37,52.0,42.0,10.0,1359.54,RP-019,Deepa,Maintenance,13.0,Card,2.4,62.0,2.59,73.0,1.0,2025-02-17 23:16:00
VMX-12144,VM-242,Hyderabad,Metro Station,20-04-2025,01:11:00,P-101,Pepsi Can,Drinks,49.86,129.0,120.0,9.0,5983.2,RP-003,Suresh,Low Power,12.3,Card,3.7,15.0,1.06,448.0,0.0,2025-04-20 01:11:00
VMX-12145,VM-086,Pune,Office,08-04-2025,19:09:00,P-105,Dettol Wipe,Hygiene,99.37,58.0,49.0,9.0,4869.13,RP-002,Ravi,Maintenance,24.8,Card,4.8,39.0,3.27,118.0,1.0,2025-04-08 19:09:00
VMX-12146,VM-028,Pune,Hospital,18-06-2025,06:38:00,P-100,Lays Classic,Snacks,74.52,130.0,110.0,20.0,8197.2,RP-018,Suresh,Maintenance,25.0,UPI,4.3,51.0,2.83,369.0,0.0,2025-06-18 06:38:00
VMX-12147,VM-205,Mumbai,Hospital,21-03-2025,09:19:00,P-100,Lays Classic,Snacks,143.12,132.0,116.0,16.0,16601.92,RP-013,Rahul,Low Power,20.3,Cash,3.3,87.0,4.28,398.0,1.0,2025-03-21 09:19:00
VMX-12148,VM-272,Chennai,Office,02-07-2025,23:01:00,P-103,Oreo Pack,Snacks,82.53,149.0,144.0,5.0,11884.32,RP-019,Amit,Low Power,21.8,UPI,2.5,61.0,4.17,243.0,1.0,2025-07-02 23:01:00
VMX-12149,VM-082,Mumbai,Mall,15-03-2025,10:28:00,P-109,Doritos,Snacks,115.11,57.0,51.0,6.0,5870.61,RP-010,Kiran,Maintenance,22.3,Card,4.1,60.0,4.84,422.0,1.0,2025-03-15 10:28:00
VMX-12150,VM-221,Mumbai,Hospital,10-05-2025,20:16:00,P-107,Colgate Mini,Hygiene,34.76,192.0,185.0,7.0,6430.6,RP-004,Mahesh,Low Power,11.5,UPI,3.8,95.0,2.55,329.0,0.0,2025-05-10 20:16:00
VMX-12151,VM-267,Delhi,Metro Station,15-09-2025,17:24:00,P-106,Snickers Bar,Snacks,131.81,121.0,116.0,5.0,15289.96,RP-016,Rahul,Working,14.1,UPI,3.8,32.0,4.56,436.0,0.0,2025-09-15 17:24:00
VMX-12152,VM-045,Bangalore,Office,15-06-2025,13:51:00,P-109,Doritos,Snacks,60.43,153.0,140.0,13.0,8460.2,RP-009,Mahesh,Maintenance,24.6,Cash,4.1,30.0,4.48,328.0,0.0,2025-06-15 13:51:00
VMX-12153,VM-216,Pune,College,08-04-2025,08:30:00,P-108,Sprite Bottle,Drinks,13.87,121.0,103.0,18.0,1428.61,RP-005,Suresh,Low Power,24.5,Card,4.9,31.0,3.53,362.0,0.0,2025-04-08 08:30:00
VMX-12154,VM-111,Hyderabad,Metro Station,15-01-2025,02:24:00,P-101,Pepsi Can,Drinks,118.63,60.0,55.0,5.0,6524.65,RP-012,Amit,Working,10.1,Cash,2.7,12.0,2.46,160.0,0.0,2025-01-15 02:24:00
VMX-12155,VM-150,Kolkata,College,22-04-2025,21:04:00,P-103,Oreo Pack,Snacks,43.93,121.0,101.0,20.0,4436.93,RP-019,Fatima,Working,11.2,UPI,2.1,31.0,1.49,354.0,1.0,2025-04-22 21:04:00
VMX-12156,VM-126,Hyderabad,Hospital,28-06-2025,19:01:00,P-107,Colgate Mini,Hygiene,36.22,48.0,43.0,5.0,1557.46,RP-016,Deepa,Low Power,23.6,Card,4.1,0.0,3.8,403.0,0.0,2025-06-28 19:01:00
VMX-12157,VM-109,Kolkata,Mall,12-07-2025,10:53:00,P-109,Doritos,Snacks,99.44,40.0,26.0,14.0,2585.44,RP-010,Anita,Maintenance,13.6,Cash,4.4,65.0,4.64,296.0,0.0,2025-07-12 10:53:00
VMX-12158,VM-060,Hyderabad,Hospital,10-09-2025,09:27:00,P-105,Dettol Wipe,Hygiene,137.84,100.0,91.0,9.0,12543.44,RP-002,Fatima,Low Power,10.2,UPI,2.4,23.0,4.62,482.0,1.0,2025-09-10 09:27:00
VMX-12159,VM-104,Chennai,Metro Station,05-01-2025,17:59:00,P-100,Lays Classic,Snacks,16.52,80.0,64.0,16.0,1057.28,RP-004,Amit,Working,12.5,UPI,4.0,1.0,1.1,490.0,0.0,2025-01-05 17:59:00
VMX-12160,VM-180,Bangalore,Hospital,30-04-2025,04:43:00,P-102,Bisleri Water,Drinks,47.14,39.0,22.0,17.0,1037.08,RP-013,Amit,Low Power,12.2,Cash,4.7,11.0,1.88,100.0,1.0,2025-04-30 04:43:00
VMX-12161,VM-086,Mumbai,Hospital,28-09-2025,23:13:00,P-107,Colgate Mini,Hygiene,88.96,94.0,89.0,5.0,7917.44,RP-001,Ravi,Maintenance,21.4,UPI,3.3,14.0,1.45,271.0,1.0,2025-09-28 23:13:00
VMX-12162,VM-050,Chennai,Mall,04-01-2025,05:20:00,P-108,Sprite Bottle,Drinks,67.6,54.0,35.0,19.0,2366.0,RP-017,Kiran,Low Power,21.3,UPI,3.3,99.0,1.06,137.0,0.0,2025-01-04 05:20:00
VMX-12163,VM-012,Chennai,College,23-06-2025,06:41:00,P-109,Doritos,Snacks,90.27,41.0,26.0,15.0,2347.02,RP-012,Suresh,Working,19.1,UPI,4.3,7.0,3.66,64.0,1.0,2025-06-23 06:41:00
VMX-12164,VM-084,Pune,Office,13-05-2025,16:20:00,P-105,Dettol Wipe,Hygiene,121.35,20.0,4.0,16.0,485.4,RP-014,Rajesh,Low Power,10.9,UPI,3.5,55.0,2.81,301.0,0.0,2025-05-13 16:20:00
VMX-12165,VM-151,Kolkata,College,19-08-2025,12:17:00,P-100,Lays Classic,Snacks,88.28,78.0,78.0,0.0,6885.84,RP-011,Fatima,Working,14.8,Card,4.7,10.0,2.99,133.0,1.0,2025-08-19 12:17:00
VMX-12166,VM-281,Bangalore,Metro Station,05-05-2025,23:08:00,P-102,Bisleri Water,Drinks,73.64,172.0,158.0,14.0,11635.12,RP-001,Ravi,Maintenance,18.2,Cash,2.4,46.0,1.43,434.0,0.0,2025-05-05 23:08:00
VMX-12167,VM-197,Pune,College,07-08-2025,06:54:00,P-101,Pepsi Can,Drinks,125.7,85.0,85.0,0.0,10684.5,RP-003,Rahul,Maintenance,10.6,Cash,2.5,5.0,2.6,82.0,0.0,2025-08-07 06:54:00
VMX-12168,VM-236,Hyderabad,Hospital,09-02-2025,23:05:00,P-107,Colgate Mini,Hygiene,99.33,89.0,74.0,15.0,7350.42,RP-009,Fatima,Low Power,24.1,UPI,3.7,116.0,3.04,257.0,0.0,2025-02-09 23:05:00
VMX-12169,VM-013,Chennai,Office,18-08-2025,23:42:00,P-101,Pepsi Can,Drinks,32.89,85.0,84.0,1.0,2762.76,RP-018,Ravi,Working,18.1,Card,3.6,73.0,1.25,113.0,0.0,2025-08-18 23:42:00
VMX-12170,VM-238,Mumbai,Hospital,13-09-2025,22:25:00,P-104,Red Bull,Drinks,124.93,105.0,92.0,13.0,11493.56,RP-003,Rahul,Low Power,11.9,Card,3.2,3.0,1.39,69.0,0.0,2025-09-13 22:25:00
VMX-12171,VM-239,Kolkata,College,08-02-2025,15:55:00,P-101,Pepsi Can,Drinks,72.98,98.0,88.0,10.0,6422.24,RP-005,Amit,Maintenance,13.1,Cash,2.8,44.0,4.83,206.0,1.0,2025-02-08 15:55:00
VMX-12172,VM-098,Delhi,Mall,11-03-2025,10:55:00,P-108,Sprite Bottle,Drinks,132.36,132.0,118.0,14.0,15618.48,RP-002,Rahul,Low Power,19.5,Card,4.1,68.0,2.07,338.0,1.0,2025-03-11 10:55:00
VMX-12173,VM-098,Bangalore,Office,31-03-2025,14:10:00,P-103,Oreo Pack,Snacks,60.51,148.0,133.0,15.0,8047.83,RP-016,Mahesh,Working,20.5,UPI,2.1,104.0,3.45,344.0,1.0,2025-03-31 14:10:00
VMX-12174,VM-274,Chennai,Office,07-06-2025,12:18:00,P-106,Snickers Bar,Snacks,37.36,175.0,159.0,16.0,5940.24,RP-005,Rajesh,Working,18.8,Cash,3.0,97.0,2.57,396.0,1.0,2025-06-07 12:18:00
VMX-12175,VM-208,Bangalore,Mall,02-08-2025,21:29:00,P-102,Bisleri Water,Drinks,109.42,174.0,172.0,2.0,18820.24,RP-016,Suresh,Low Power,24.6,Cash,4.5,109.0,2.25,51.0,1.0,2025-08-02 21:29:00
VMX-12176,VM-139,Kolkata,College,06-08-2025,06:15:00,P-102,Bisleri Water,Drinks,17.91,46.0,33.0,13.0,591.03,RP-004,Anita,Maintenance,23.2,Cash,3.1,88.0,1.78,402.0,1.0,2025-08-06 06:15:00
VMX-12177,VM-271,Pune,Hospital,25-07-2025,05:51:00,P-102,Bisleri Water,Drinks,146.12,126.0,120.0,6.0,17534.4,RP-006,Suresh,Working,15.5,Cash,2.8,34.0,2.46,459.0,0.0,2025-07-25 05:51:00
VMX-12178,VM-240,Chennai,Office,13-02-2025,02:06:00,P-104,Red Bull,Drinks,38.47,94.0,90.0,4.0,3462.3,RP-019,Anita,Low Power,24.9,UPI,3.4,36.0,1.67,466.0,0.0,2025-02-13 02:06:00
VMX-12179,VM-259,Hyderabad,Office,03-06-2025,12:15:00,P-108,Sprite Bottle,Drinks,84.41,96.0,91.0,5.0,7681.31,RP-003,Amit,Maintenance,11.7,UPI,2.8,62.0,3.57,138.0,1.0,2025-06-03 12:15:00
VMX-12180,VM-130,Mumbai,Mall,14-09-2025,14:11:00,P-106,Snickers Bar,Snacks,50.36,170.0,151.0,19.0,7604.36,RP-011,Suresh,Maintenance,23.6,Card,3.6,63.0,2.5,380.0,0.0,2025-09-14 14:11:00
VMX-12181,VM-062,Chennai,Office,26-08-2025,10:51:00,P-105,Dettol Wipe,Hygiene,43.58,20.0,19.0,1.0,828.02,RP-003,Fatima,Working,22.8,UPI,4.7,22.0,4.67,170.0,0.0,2025-08-26 10:51:00
VMX-12182,VM-101,Hyderabad,College,14-05-2025,10:47:00,P-105,Dettol Wipe,Hygiene,144.1,162.0,157.0,5.0,22623.7,RP-017,Ravi,Working,13.8,UPI,4.7,30.0,3.97,323.0,1.0,2025-05-14 10:47:00
VMX-12183,VM-213,Hyderabad,Hospital,06-02-2025,08:40:00,P-102,Bisleri Water,Drinks,53.2,32.0,12.0,20.0,638.4,RP-014,Rahul,Low Power,11.7,Cash,3.1,110.0,3.38,261.0,0.0,2025-02-06 08:40:00
VMX-12184,VM-252,Pune,College,17-03-2025,02:33:00,P-107,Colgate Mini,Hygiene,137.84,175.0,172.0,3.0,23708.48,RP-013,Deepa,Working,16.4,UPI,3.3,44.0,3.33,102.0,0.0,2025-03-17 02:33:00
VMX-12185,VM-001,Chennai,College,11-02-2025,13:02:00,P-102,Bisleri Water,Drinks,54.58,55.0,49.0,6.0,2674.42,RP-006,Rajesh,Working,18.4,Card,3.6,101.0,4.98,490.0,0.0,2025-02-11 13:02:00
VMX-12186,VM-281,Chennai,Mall,20-07-2025,02:16:00,P-102,Bisleri Water,Drinks,25.79,64.0,63.0,1.0,1624.77,RP-012,Mahesh,Low Power,19.3,UPI,3.9,104.0,3.55,281.0,1.0,2025-07-20 02:16:00
VMX-12187,VM-143,Kolkata,Office,04-02-2025,09:05:00,P-102,Bisleri Water,Drinks,14.54,35.0,15.0,20.0,218.1,RP-005,Anita,Low Power,10.2,UPI,2.7,62.0,1.68,411.0,1.0,2025-02-04 09:05:00
VMX-12188,VM-165,Delhi,Metro Station,08-07-2025,05:33:00,P-101,Pepsi Can,Drinks,110.58,110.0,92.0,18.0,10173.36,RP-020,Anita,Low Power,24.6,Card,3.4,55.0,1.85,435.0,1.0,2025-07-08 05:33:00
VMX-12189,VM-256,Mumbai,Metro Station,15-01-2025,10:20:00,P-109,Doritos,Snacks,80.54,171.0,164.0,7.0,13208.56,RP-016,Rahul,Maintenance,18.0,Cash,3.2,55.0,1.06,209.0,0.0,2025-01-15 10:20:00
VMX-12190,VM-275,Hyderabad,Office,20-05-2025,23:43:00,P-100,Lays Classic,Snacks,61.66,75.0,56.0,19.0,3452.96,RP-001,Anita,Working,18.5,Cash,3.0,103.0,2.73,63.0,0.0,2025-05-20 23:43:00
VMX-12191,VM-197,Mumbai,College,29-07-2025,19:40:00,P-108,Sprite Bottle,Drinks,59.78,161.0,141.0,20.0,8428.98,RP-020,Kiran,Working,15.4,Card,3.4,117.0,2.57,298.0,1.0,2025-07-29 19:40:00
VMX-12192,VM-067,Mumbai,Mall,15-02-2025,16:18:00,P-101,Pepsi Can,Drinks,121.61,42.0,41.0,1.0,4986.01,RP-005,Kiran,Low Power,22.6,UPI,4.7,67.0,1.09,451.0,0.0,2025-02-15 16:18:00
VMX-12193,VM-120,Chennai,Hospital,14-09-2025,11:50:00,P-104,Red Bull,Drinks,58.33,95.0,94.0,1.0,5483.02,RP-012,Suresh,Low Power,12.4,UPI,3.9,60.0,4.09,441.0,1.0,2025-09-14 11:50:00
VMX-12194,VM-115,Mumbai,Office,15-06-2025,14:57:00,P-100,Lays Classic,Snacks,125.21,126.0,115.0,11.0,14399.15,RP-018,Deepa,Maintenance,23.8,Cash,3.0,21.0,1.68,219.0,1.0,2025-06-15 14:57:00
VMX-12195,VM-252,Kolkata,Office,27-01-2025,02:42:00,P-106,Snickers Bar,Snacks,74.12,171.0,151.0,20.0,11192.12,RP-006,Amit,Low Power,18.8,Card,4.7,79.0,2.1,401.0,1.0,2025-01-27 02:42:00
VMX-12196,VM-300,Pune,Metro Station,23-07-2025,15:16:00,P-105,Dettol Wipe,Hygiene,132.83,73.0,54.0,19.0,7172.82,RP-002,Amit,Working,22.3,Card,3.6,34.0,1.15,50.0,0.0,2025-07-23 15:16:00
VMX-12197,VM-074,Mumbai,Metro Station,12-02-2025,04:18:00,P-108,Sprite Bottle,Drinks,46.71,42.0,32.0,10.0,1494.72,RP-011,Rajesh,Low Power,13.3,Card,3.6,8.0,3.83,153.0,1.0,2025-02-12 04:18:00
VMX-12198,VM-160,Bangalore,Hospital,26-05-2025,13:04:00,P-106,Snickers Bar,Snacks,108.76,105.0,100.0,5.0,10876.0,RP-006,Mahesh,Low Power,10.9,UPI,2.4,50.0,4.16,154.0,1.0,2025-05-26 13:04:00
VMX-12199,VM-097,Mumbai,Mall,13-09-2025,16:31:00,P-106,Snickers Bar,Snacks,20.67,154.0,135.0,19.0,2790.45,RP-017,Amit,Maintenance,15.7,UPI,5.0,114.0,4.32,387.0,0.0,2025-09-13 16:31:00
VMX-12200,VM-197,Hyderabad,Mall,03-02-2025,15:05:00,P-108,Sprite Bottle,Drinks,15.75,46.0,27.0,19.0,425.25,RP-007,Suresh,Working,17.6,UPI,2.9,11.0,3.12,204.0,0.0,2025-02-03 15:05:00
VMX-12201,VM-102,Hyderabad,Mall,03-04-2025,21:01:00,P-106,Snickers Bar,Snacks,101.38,130.0,129.0,1.0,13078.02,RP-016,Fatima,Maintenance,10.7,Cash,4.1,8.0,1.13,173.0,1.0,2025-04-03 21:01:00
VMX-12202,VM-123,Kolkata,Hospital,23-08-2025,14:29:00,P-107,Colgate Mini,Hygiene,111.48,125.0,110.0,15.0,12262.8,RP-011,Rajesh,Low Power,14.7,UPI,2.9,79.0,4.54,156.0,1.0,2025-08-23 14:29:00
VMX-12203,VM-057,Hyderabad,College,14-04-2025,11:49:00,P-108,Sprite Bottle,Drinks,25.52,104.0,96.0,8.0,2449.92,RP-005,Kiran,Maintenance,13.1,UPI,3.1,30.0,4.29,325.0,0.0,2025-04-14 11:49:00
VMX-12204,VM-036,Chennai,Metro Station,12-02-2025,06:23:00,P-103,Oreo Pack,Snacks,106.76,68.0,48.0,20.0,5124.48,RP-011,Deepa,Maintenance,21.8,UPI,2.1,48.0,2.0,271.0,0.0,2025-02-12 06:23:00
VMX-12205,VM-064,Delhi,Office,24-02-2025,10:40:00,P-106,Snickers Bar,Snacks,11.99,132.0,123.0,9.0,1474.77,RP-010,Fatima,Low Power,16.6,Cash,4.8,115.0,4.91,196.0,0.0,2025-02-24 10:40:00
VMX-12206,VM-090,Pune,Office,21-08-2025,07:03:00,P-104,Red Bull,Drinks,102.53,136.0,118.0,18.0,12098.54,RP-002,Kiran,Maintenance,14.9,UPI,4.8,44.0,1.67,67.0,0.0,2025-08-21 07:03:00
VMX-12207,VM-058,Bangalore,Office,16-04-2025,14:29:00,P-103,Oreo Pack,Snacks,113.67,112.0,96.0,16.0,10912.32,RP-018,Amit,Maintenance,14.0,Card,3.8,10.0,3.37,473.0,1.0,2025-04-16 14:29:00
VMX-12208,VM-035,Delhi,Metro Station,20-06-2025,19:37:00,P-109,Doritos,Snacks,60.15,41.0,29.0,12.0,1744.35,RP-009,Deepa,Low Power,19.9,UPI,5.0,55.0,2.01,214.0,0.0,2025-06-20 19:37:00
VMX-12209,VM-087,Chennai,Mall,13-05-2025,02:23:00,Unknown,Oreo Pack,Snacks,125.45,21.0,21.0,0.0,2634.45,RP-017,Kiran,Low Power,18.1,UPI,2.8,113.0,1.04,85.0,1.0,2025-05-13 02:23:00
VMX-12210,VM-193,Mumbai,College,05-03-2025,21:19:00,P-107,Colgate Mini,Hygiene,93.88,108.0,107.0,1.0,10045.16,RP-020,Suresh,Low Power,17.4,Card,4.9,115.0,1.18,115.0,0.0,2025-03-05 21:19:00
VMX-12211,VM-017,Kolkata,Hospital,25-08-2025,15:57:00,P-100,Lays Classic,Snacks,121.64,99.0,97.0,2.0,11799.08,RP-008,Anita,Maintenance,22.8,Cash,4.0,13.0,2.65,163.0,1.0,2025-08-25 15:57:00
VMX-12212,VM-045,Mumbai,Office,07-03-2025,21:47:00,P-100,Lays Classic,Snacks,114.51,170.0,151.0,19.0,17291.01,RP-012,Rajesh,Low Power,22.6,UPI,3.0,82.0,1.72,307.0,0.0,2025-03-07 21:47:00
VMX-12213,VM-047,Chennai,College,15-09-2025,10:58:00,P-102,Bisleri Water,Drinks,116.44,122.0,107.0,15.0,12459.08,RP-014,Kiran,Maintenance,24.0,Cash,3.0,95.0,2.87,404.0,1.0,2025-09-15 10:58:00
VMX-12214,VM-287,Pune,Office,11-02-2025,13:26:00,P-105,Dettol Wipe,Hygiene,127.02,193.0,180.0,13.0,22863.6,RP-002,Rahul,Working,16.3,Card,2.7,32.0,2.63,57.0,1.0,2025-02-11 13:26:00
VMX-12215,VM-037,Bangalore,Mall,31-07-2025,03:55:00,P-109,Doritos,Snacks,133.57,100.0,97.0,3.0,12956.29,RP-019,Deepa,Low Power,24.8,Cash,2.4,116.0,2.49,88.0,0.0,2025-07-31 03:55:00
VMX-12216,VM-220,Pune,Hospital,07-03-2025,02:09:00,P-105,Dettol Wipe,Hygiene,65.29,123.0,121.0,2.0,7900.09,RP-010,Fatima,Maintenance,23.2,Card,3.5,38.0,3.1,342.0,1.0,2025-03-07 02:09:00
VMX-12217,VM-254,Delhi,College,30-01-2025,11:10:00,P-103,Oreo Pack,Snacks,21.94,128.0,121.0,7.0,2654.74,RP-009,Suresh,Low Power,18.6,Cash,2.5,44.0,4.25,424.0,0.0,2025-01-30 11:10:00
VMX-12218,VM-145,Mumbai,Metro Station,03-03-2025,04:30:00,P-106,Snickers Bar,Snacks,45.06,80.0,80.0,0.0,3604.8,RP-001,Ravi,Low Power,15.9,Cash,4.3,11.0,3.28,307.0,1.0,2025-03-03 04:30:00
VMX-12219,VM-178,Bangalore,Hospital,09-01-2025,16:23:00,P-103,Oreo Pack,Snacks,75.34,194.0,174.0,20.0,13109.16,RP-001,Kiran,Working,12.6,Cash,3.2,44.0,2.67,155.0,1.0,2025-01-09 16:23:00
VMX-12220,VM-267,Chennai,College,29-05-2025,05:49:00,P-107,Colgate Mini,Hygiene,73.67,120.0,101.0,19.0,7440.67,RP-001,Anita,Working,22.6,Card,2.1,109.0,3.98,290.0,0.0,2025-05-29 05:49:00
VMX-12221,VM-228,Chennai,Hospital,26-09-2025,05:45:00,P-100,Lays Classic,Snacks,40.52,52.0,43.0,9.0,1742.36,RP-007,Deepa,Working,20.3,Cash,4.4,107.0,2.65,109.0,0.0,2025-09-26 05:45:00
VMX-12222,VM-299,Chennai,Metro Station,08-08-2025,21:45:00,P-100,Lays Classic,Snacks,145.15,158.0,158.0,0.0,22933.7,RP-014,Amit,Maintenance,11.0,UPI,2.6,83.0,4.87,497.0,0.0,2025-08-08 21:45:00
VMX-12223,VM-016,Kolkata,Mall,10-02-2025,14:31:00,P-101,Pepsi Can,Drinks,23.14,61.0,45.0,16.0,1041.3,RP-013,Kiran,Low Power,15.9,UPI,4.0,120.0,3.47,295.0,0.0,2025-02-10 14:31:00
VMX-12224,VM-264,Chennai,Office,01-08-2025,10:37:00,P-108,Sprite Bottle,Drinks,20.31,83.0,78.0,5.0,1584.18,RP-001,Suresh,Working,24.7,UPI,3.8,91.0,0.0,389.0,1.0,2025-08-01 10:37:00
VMX-12225,VM-102,Delhi,College,22-04-2025,11:40:00,P-100,Lays Classic,Snacks,126.56,145.0,134.0,11.0,16959.04,RP-007,Amit,Maintenance,13.8,UPI,2.4,88.0,2.79,402.0,1.0,2025-04-22 11:40:00
VMX-12226,VM-128,Hyderabad,Office,25-06-2025,01:52:00,P-106,Snickers Bar,Snacks,73.23,45.0,27.0,18.0,1977.21,RP-013,Fatima,Low Power,18.3,UPI,4.4,16.0,3.8,445.0,1.0,2025-06-25 01:52:00
VMX-12227,VM-257,Chennai,Mall,05-10-2025,19:04:00,P-105,Dettol Wipe,Hygiene,31.25,179.0,170.0,9.0,5312.5,RP-020,Fatima,Working,17.6,Cash,4.7,116.0,3.85,217.0,0.0,2025-10-05 19:04:00
VMX-12228,VM-046,Bangalore,Hospital,31-07-2025,08:36:00,P-104,Red Bull,Drinks,92.19,133.0,118.0,15.0,10878.42,RP-003,Kiran,Low Power,16.6,UPI,2.4,115.0,4.98,118.0,1.0,2025-07-31 08:36:00
VMX-12229,VM-289,Delhi,College,18-05-2025,22:59:00,P-101,Pepsi Can,Drinks,127.56,187.0,177.0,10.0,22578.12,RP-005,Rahul,Low Power,18.4,UPI,3.7,37.0,1.76,486.0,1.0,2025-05-18 22:59:00
VMX-12230,VM-122,Pune,Metro Station,09-02-2025,23:56:00,P-105,Dettol Wipe,Hygiene,74.12,124.0,112.0,12.0,8301.44,RP-014,Deepa,Maintenance,15.1,Card,4.9,117.0,1.14,348.0,0.0,2025-02-09 23:56:00
VMX-12231,VM-107,Pune,Office,21-09-2025,06:09:00,P-105,Dettol Wipe,Hygiene,93.21,122.0,108.0,14.0,10066.68,RP-019,Suresh,Low Power,22.1,Cash,3.7,36.0,1.35,376.0,1.0,2025-09-21 06:09:00
VMX-12232,VM-210,Hyderabad,Metro Station,17-06-2025,21:14:00,P-100,Lays Classic,Snacks,68.11,47.0,30.0,17.0,2043.3,RP-016,Fatima,Working,24.9,UPI,2.4,85.0,1.56,489.0,0.0,2025-06-17 21:14:00
VMX-12233,VM-296,Pune,Hospital,04-02-2025,05:00:00,P-103,Oreo Pack,Snacks,87.08,160.0,157.0,3.0,13671.56,RP-013,Rajesh,Low Power,24.7,UPI,2.5,2.0,1.8,277.0,0.0,2025-02-04 05:00:00
VMX-12234,VM-248,Hyderabad,Hospital,12-07-2025,11:26:00,P-104,Red Bull,Drinks,118.41,148.0,141.0,7.0,16695.81,RP-004,Rahul,Maintenance,20.4,UPI,3.2,109.0,2.3,462.0,1.0,2025-07-12 11:26:00
VMX-12235,VM-201,Kolkata,Hospital,18-01-2025,10:16:00,P-103,Oreo Pack,Snacks,92.45,145.0,130.0,15.0,12018.5,RP-007,Rahul,Working,11.1,UPI,4.2,0.0,3.36,430.0,1.0,2025-01-18 10:16:00
VMX-12236,VM-124,Delhi,College,30-09-2025,15:47:00,P-104,Red Bull,Drinks,148.28,160.0,140.0,20.0,20759.2,RP-012,Fatima,Maintenance,16.4,Cash,2.2,20.0,2.32,98.0,0.0,2025-09-30 15:47:00
VMX-12237,VM-254,Kolkata,Metro Station,07-03-2025,10:17:00,P-109,Doritos,Snacks,122.11,128.0,115.0,13.0,14042.65,RP-002,Mahesh,Maintenance,14.9,Cash,2.9,108.0,1.36,200.0,1.0,2025-03-07 10:17:00
VMX-12238,VM-037,Pune,College,07-01-2025,01:01:00,P-101,Pepsi Can,Drinks,126.48,175.0,185.0,14.0,20363.28,RP-002,Rajesh,Working,17.8,UPI,2.8,56.0,4.67,413.0,0.0,2025-01-07 01:01:00
VMX-12239,VM-294,Delhi,College,25-07-2025,18:14:00,P-104,Red Bull,Drinks,111.98,92.0,85.0,7.0,9518.3,RP-018,Rahul,Low Power,11.6,Cash,3.7,40.0,4.79,243.0,1.0,2025-07-25 18:14:00
VMX-12240,VM-151,Bangalore,Metro Station,13-04-2025,00:22:00,P-101,Pepsi Can,Drinks,83.31,56.0,53.0,3.0,4415.43,RP-009,Amit,Low Power,19.5,Cash,2.3,115.0,3.33,71.0,0.0,2025-04-13 00:22:00
VMX-12241,VM-296,Chennai,College,31-05-2025,05:42:00,P-105,Dettol Wipe,Hygiene,94.16,23.0,5.0,18.0,470.8,RP-006,Deepa,Maintenance,16.7,Card,4.2,75.0,1.15,399.0,0.0,2025-05-31 05:42:00
VMX-12242,VM-221,Hyderabad,Hospital,03-08-2025,14:24:00,P-102,Bisleri Water,Drinks,44.57,158.0,144.0,14.0,6418.08,RP-006,Fatima,Maintenance,24.1,Cash,4.7,99.0,4.8,208.0,0.0,2025-08-03 14:24:00
VMX-12243,VM-147,Chennai,Mall,22-04-2025,17:29:00,P-103,Oreo Pack,Snacks,88.98,140.0,123.0,17.0,10944.54,RP-001,Fatima,Working,17.7,UPI,2.7,88.0,4.02,390.0,0.0,2025-04-22 17:29:00
VMX-12244,VM-196,Bangalore,Metro Station,03-04-2025,12:48:00,P-109,Doritos,Snacks,132.16,134.0,134.0,0.0,17709.44,RP-006,Mahesh,Low Power,11.8,UPI,3.7,70.0,2.3,163.0,0.0,2025-04-03 12:48:00
VMX-12245,VM-225,Kolkata,Hospital,01-08-2025,01:21:00,P-101,Pepsi Can,Drinks,20.88,140.0,124.0,16.0,2589.12,RP-013,Unknown,Low Power,11.1,Cash,5.0,100.0,4.5,390.0,0.0,2025-08-01 01:21:00
VMX-12246,VM-225,Chennai,College,29-09-2025,14:20:00,P-100,Lays Classic,Snacks,132.44,35.0,31.0,4.0,4105.64,RP-012,Fatima,Maintenance,21.3,Cash,2.7,107.0,1.05,263.0,0.0,2025-09-29 14:20:00
VMX-12247,VM-087,Chennai,Metro Station,26-02-2025,19:55:00,P-106,Snickers Bar,Snacks,71.31,155.0,140.0,15.0,9983.4,RP-016,Amit,Low Power,14.9,UPI,2.2,118.0,2.62,345.0,1.0,2025-02-26 19:55:00
VMX-12248,VM-159,Chennai,Mall,18-02-2025,22:47:00,P-107,Colgate Mini,Hygiene,142.72,198.0,187.0,11.0,26688.64,RP-015,Deepa,Working,15.3,Card,2.9,103.0,2.19,465.0,0.0,2025-02-18 22:47:00
VMX-12249,VM-267,Chennai,College,25-01-2025,22:07:00,P-105,Dettol Wipe,Hygiene,29.53,127.0,107.0,20.0,3159.71,RP-004,Ravi,Low Power,21.0,UPI,4.7,100.0,1.93,492.0,1.0,2025-01-25 22:07:00
VMX-12250,VM-189,Hyderabad,Hospital,04-08-2025,15:02:00,P-101,Pepsi Can,Drinks,54.77,129.0,120.0,9.0,6572.4,RP-018,Mahesh,Maintenance,18.2,Card,4.2,8.0,4.44,164.0,1.0,2025-08-04 15:02:00
VMX-12251,VM-220,Hyderabad,Unknown,06-09-2025,10:32:00,P-106,Snickers Bar,Snacks,55.31,35.0,30.0,5.0,1659.3,RP-010,Deepa,Low Power,13.0,Cash,4.6,99.0,3.16,127.0,0.0,2025-09-06 10:32:00
VMX-12252,VM-028,Chennai,College,23-05-2025,10:28:00,P-104,Red Bull,Drinks,97.31,112.0,108.0,4.0,10509.48,RP-011,Deepa,Maintenance,17.1,Card,4.8,81.0,1.53,148.0,0.0,2025-05-23 10:28:00
VMX-12253,VM-057,Delhi,Metro Station,26-08-2025,02:24:00,P-103,Oreo Pack,Snacks,122.57,88.0,84.0,4.0,10295.88,RP-013,Amit,Maintenance,23.9,Card,4.7,48.0,3.32,286.0,1.0,2025-08-26 02:24:00
VMX-12254,VM-285,Chennai,Office,29-08-2025,00:13:00,P-107,Colgate Mini,Hygiene,68.52,66.0,60.0,6.0,4111.2,RP-016,Fatima,Low Power,21.3,Card,2.6,67.0,1.38,494.0,0.0,2025-08-29 00:13:00
VMX-12255,VM-090,Delhi,Mall,24-05-2025,02:49:00,P-101,Pepsi Can,Drinks,121.51,59.0,54.0,5.0,6561.54,RP-005,Fatima,Maintenance,10.0,UPI,2.6,30.0,3.74,178.0,0.0,2025-05-24 02:49:00
VMX-12256,VM-277,Pune,Mall,23-05-2025,02:53:00,P-108,Sprite Bottle,Drinks,60.47,107.0,96.0,11.0,5805.12,RP-011,Fatima,Maintenance,23.3,Cash,2.3,98.0,1.01,168.0,1.0,2025-05-23 02:53:00
VMX-12257,VM-244,Bangalore,Office,16-09-2025,04:27:00,P-106,Snickers Bar,Snacks,41.45,71.0,66.0,5.0,2735.7,RP-010,Rahul,Working,14.6,UPI,3.7,96.0,3.19,244.0,1.0,2025-09-16 04:27:00
VMX-12258,VM-048,Bangalore,Mall,12-08-2025,20:08:00,P-107,Colgate Mini,Hygiene,24.04,148.0,130.0,18.0,3125.2,RP-012,Mahesh,Maintenance,16.3,Card,3.2,68.0,2.25,199.0,0.0,2025-08-12 20:08:00
VMX-12259,VM-011,Pune,Mall,03-10-2025,05:13:00,P-104,Red Bull,Drinks,71.36,32.0,16.0,16.0,1141.76,RP-012,Fatima,Low Power,12.7,Card,4.4,81.0,2.16,289.0,0.0,2025-10-03 05:13:00
VMX-12260,VM-284,Chennai,Hospital,05-05-2025,00:54:00,P-106,Snickers Bar,Snacks,39.31,121.0,115.0,6.0,4520.65,RP-002,Ravi,Low Power,12.4,UPI,4.9,19.0,3.06,57.0,0.0,2025-05-05 00:54:00
VMX-12261,VM-146,Kolkata,Hospital,26-01-2025,16:52:00,P-103,Oreo Pack,Snacks,108.14,123.0,114.0,9.0,12327.96,RP-010,Rahul,Working,19.5,UPI,4.4,30.0,2.02,383.0,0.0,2025-01-26 16:52:00
VMX-12262,VM-121,Kolkata,Hospital,20-02-2025,12:26:00,P-100,Lays Classic,Snacks,42.02,44.0,43.0,1.0,1806.86,RP-014,Amit,Working,17.9,UPI,4.5,39.0,1.29,434.0,0.0,2025-02-20 12:26:00
VMX-12263,VM-295,Chennai,College,13-07-2025,04:10:00,P-108,Sprite Bottle,Drinks,98.99,136.0,117.0,19.0,11581.83,RP-004,Mahesh,Maintenance,14.7,UPI,2.2,48.0,3.92,446.0,1.0,2025-07-13 04:10:00
VMX-12264,VM-215,Pune,College,19-07-2025,00:18:00,P-100,Lays Classic,Snacks,113.57,35.0,30.0,5.0,3407.1,RP-004,Rajesh,Low Power,19.2,UPI,2.6,106.0,3.54,104.0,1.0,2025-07-19 00:18:00
VMX-12265,VM-252,Pune,Metro Station,13-01-2025,13:24:00,P-102,Bisleri Water,Drinks,136.21,91.0,89.0,2.0,12122.69,RP-010,Deepa,Low Power,23.1,Cash,4.5,18.0,4.64,270.0,1.0,2025-01-13 13:24:00
VMX-12266,VM-269,Pune,Mall,20-03-2025,06:49:00,P-100,Lays Classic,Snacks,132.48,194.0,186.0,8.0,24641.28,RP-012,Anita,Maintenance,13.8,Cash,3.4,102.0,1.27,57.0,1.0,2025-03-20 06:49:00
VMX-12267,VM-014,Chennai,College,28-03-2025,07:42:00,P-102,Bisleri Water,Drinks,96.32,115.0,115.0,0.0,11076.8,RP-014,Kiran,Low Power,11.4,Card,3.0,119.0,1.89,151.0,0.0,2025-03-28 07:42:00
VMX-12268,VM-034,Bangalore,Metro Station,12-06-2025,11:16:00,P-107,Colgate Mini,Hygiene,116.95,85.0,71.0,14.0,8303.45,RP-018,Amit,Low Power,21.3,Card,2.5,0.0,4.28,142.0,0.0,2025-06-12 11:16:00
VMX-12269,VM-182,Bangalore,College,18-09-2025,18:55:00,P-105,Dettol Wipe,Hygiene,120.06,66.0,65.0,1.0,7803.9,RP-015,Kiran,Maintenance,10.1,Cash,3.3,55.0,1.66,73.0,1.0,2025-09-18 18:55:00
VMX-12270,VM-033,Bangalore,Metro Station,23-05-2025,23:58:00,P-100,Lays Classic,Snacks,76.81,78.0,74.0,4.0,5683.94,RP-010,Suresh,Working,13.7,Card,4.3,46.0,1.18,436.0,0.0,2025-05-23 23:58:00
VMX-12271,VM-259,Chennai,Office,03-05-2025,17:14:00,P-107,Colgate Mini,Hygiene,45.08,121.0,117.0,4.0,5274.36,RP-002,Suresh,Low Power,19.6,UPI,2.8,76.0,3.34,186.0,0.0,2025-05-03 17:14:00
VMX-12272,VM-268,Mumbai,Office,08-04-2025,07:01:00,P-108,Sprite Bottle,Drinks,116.05,154.0,154.0,0.0,17871.7,RP-004,Anita,Maintenance,16.2,Cash,4.5,75.0,3.6,313.0,1.0,2025-04-08 07:01:00
VMX-12273,VM-055,Chennai,Metro Station,19-09-2025,15:42:00,P-100,Lays Classic,Snacks,56.58,34.0,26.0,8.0,1471.08,RP-001,Deepa,Working,18.4,Cash,3.4,21.0,1.42,364.0,0.0,2025-09-19 15:42:00
VMX-12274,VM-037,Mumbai,College,29-04-2025,18:06:00,P-107,Colgate Mini,Hygiene,45.44,85.0,70.0,15.0,3180.8,RP-016,Anita,Maintenance,10.1,Cash,4.1,45.0,2.58,397.0,1.0,2025-04-29 18:06:00
VMX-12275,VM-143,Pune,Hospital,17-04-2025,15:18:00,P-108,Sprite Bottle,Drinks,65.46,192.0,177.0,15.0,11586.42,RP-013,Kiran,Working,16.6,Cash,3.2,93.0,1.23,199.0,1.0,2025-04-17 15:18:00
VMX-12276,VM-099,Mumbai,Metro Station,24-02-2025,17:00:00,P-104,Red Bull,Drinks,24.5,21.0,4.0,17.0,98.0,RP-020,Suresh,Maintenance,19.6,UPI,4.5,16.0,4.16,397.0,1.0,2025-02-24 17:00:00
VMX-12277,VM-010,Bangalore,Hospital,06-07-2025,03:25:00,P-100,Lays Classic,Snacks,52.86,168.0,161.0,7.0,8510.46,RP-020,Deepa,Low Power,24.6,UPI,2.4,117.0,2.72,337.0,1.0,2025-07-06 03:25:00
VMX-12278,VM-241,Pune,College,07-08-2025,06:25:00,P-108,Sprite Bottle,Drinks,140.94,75.0,72.0,3.0,10147.68,RP-015,Deepa,Working,13.9,Card,3.7,31.0,2.35,299.0,1.0,2025-08-07 06:25:00
VMX-12279,VM-184,Bangalore,Metro Station,23-04-2025,00:13:00,P-104,Red Bull,Drinks,31.94,151.0,144.0,7.0,4599.36,RP-012,Amit,Maintenance,20.5,UPI,2.1,83.0,3.15,227.0,0.0,2025-04-23 00:13:00
VMX-12280,VM-016,Hyderabad,College,02-05-2025,09:45:00,P-102,Bisleri Water,Drinks,94.01,163.0,149.0,14.0,14007.49,RP-009,Rahul,Maintenance,17.3,Card,2.9,42.0,2.09,300.0,0.0,2025-05-02 09:45:00
VMX-12281,VM-235,Pune,College,21-01-2025,18:26:00,P-107,Colgate Mini,Hygiene,129.87,29.0,21.0,8.0,2727.27,RP-020,Anita,Low Power,22.3,UPI,4.9,43.0,3.3,280.0,0.0,2025-01-21 18:26:00
VMX-12282,VM-241,Bangalore,Hospital,09-05-2025,00:21:00,P-109,Doritos,Snacks,63.89,28.0,22.0,6.0,1405.58,RP-018,Rahul,Working,23.8,Card,4.6,2.0,2.17,106.0,1.0,2025-05-09 00:21:00
VMX-12283,VM-083,Kolkata,College,20-04-2025,01:30:00,P-105,Dettol Wipe,Hygiene,70.1,183.0,175.0,8.0,12267.5,RP-017,Fatima,Low Power,19.9,Cash,4.0,54.0,4.81,345.0,0.0,2025-04-20 01:30:00
VMX-12284,VM-158,Kolkata,College,29-04-2025,13:15:00,P-106,Snickers Bar,Snacks,54.84,138.0,133.0,5.0,7293.72,RP-004,Mahesh,Low Power,18.1,UPI,3.3,71.0,4.67,264.0,1.0,2025-04-29 13:15:00
VMX-12285,VM-282,Kolkata,College,02-09-2025,22:10:00,P-101,Pepsi Can,Drinks,141.72,118.0,108.0,10.0,15305.76,RP-018,Amit,Maintenance,22.6,Cash,4.5,97.0,3.25,378.0,1.0,2025-09-02 22:10:00
VMX-12286,VM-208,Hyderabad,Metro Station,02-02-2025,19:56:00,P-102,Bisleri Water,Drinks,46.16,192.0,174.0,18.0,8031.84,RP-010,Ravi,Maintenance,20.4,Card,5.0,99.0,2.34,238.0,0.0,2025-02-02 19:56:00
VMX-12287,VM-214,Bangalore,College,20-04-2025,14:57:00,P-107,Colgate Mini,Hygiene,109.86,35.0,27.0,8.0,2966.22,RP-017,Deepa,Low Power,18.5,UPI,2.1,105.0,1.49,434.0,1.0,2025-04-20 14:57:00
VMX-12288,VM-031,Delhi,Office,06-06-2025,00:00:00,P-104,Red Bull,Drinks,86.64,44.0,36.0,8.0,3119.04,RP-002,Rajesh,Low Power,16.2,Cash,2.7,110.0,4.98,76.0,1.0,2025-06-06 00:00:00
VMX-12289,VM-211,Pune,Mall,06-09-2025,05:37:00,P-104,Red Bull,Drinks,145.66,30.0,16.0,14.0,2330.56,RP-006,Fatima,Maintenance,19.9,UPI,4.2,39.0,1.62,155.0,1.0,2025-09-06 05:37:00
VMX-12290,VM-246,Delhi,Mall,18-03-2025,11:07:00,P-104,Red Bull,Drinks,149.28,144.0,126.0,18.0,18809.28,RP-014,Kiran,Maintenance,22.4,UPI,5.0,57.0,3.93,237.0,1.0,2025-03-18 11:07:00
VMX-12291,VM-031,Kolkata,Office,05-09-2025,02:58:00,P-108,Sprite Bottle,Drinks,108.31,190.0,183.0,7.0,19820.73,RP-007,Rahul,Maintenance,20.4,UPI,3.9,75.0,1.22,270.0,1.0,2025-09-05 02:58:00
VMX-12292,VM-055,Mumbai,Office,25-07-2025,00:49:00,P-107,Colgate Mini,Hygiene,26.85,102.0,96.0,6.0,2577.6,RP-008,Mahesh,Low Power,10.9,Cash,3.1,101.0,1.24,200.0,0.0,2025-07-25 00:49:00
VMX-12293,VM-076,Mumbai,College,11-09-2025,14:22:00,P-103,Oreo Pack,Snacks,136.05,124.0,112.0,12.0,15237.6,RP-015,Ravi,Working,23.2,Card,5.0,94.0,3.75,102.0,1.0,2025-09-11 14:22:00
VMX-12294,VM-235,Bangalore,Metro Station,30-07-2025,09:11:00,P-106,Snickers Bar,Snacks,39.82,103.0,103.0,0.0,4101.46,RP-020,Mahesh,Maintenance,14.4,Card,3.6,12.0,2.95,418.0,1.0,2025-07-30 09:11:00
VMX-12295,VM-179,Chennai,Mall,18-01-2025,04:47:00,P-107,Colgate Mini,Hygiene,65.67,62.0,48.0,14.0,3152.16,RP-003,Kiran,Maintenance,24.8,Cash,3.7,40.0,3.04,265.0,1.0,2025-01-18 04:47:00
VMX-12296,VM-240,Pune,Mall,25-05-2025,12:51:00,P-107,Colgate Mini,Hygiene,27.66,127.0,126.0,1.0,3485.16,RP-002,Suresh,Low Power,19.3,UPI,4.1,13.0,2.28,457.0,1.0,2025-05-25 12:51:00
VMX-12297,VM-016,Delhi,Metro Station,03-02-2025,07:16:00,P-100,Lays Classic,Snacks,102.84,67.0,55.0,12.0,5656.2,RP-016,Suresh,Working,23.0,Cash,4.4,86.0,1.22,466.0,1.0,2025-02-03 07:16:00
VMX-12298,VM-167,Bangalore,Mall,27-05-2025,20:00:00,P-106,Snickers Bar,Snacks,71.47,123.0,113.0,10.0,8076.11,RP-009,Amit,Maintenance,24.6,Cash,4.1,52.0,4.91,192.0,0.0,2025-05-27 20:00:00
VMX-12299,VM-282,Delhi,College,11-08-2025,02:29:00,P-105,Dettol Wipe,Hygiene,41.31,62.0,46.0,16.0,1900.26,RP-012,Fatima,Working,13.6,Card,2.1,42.0,2.81,145.0,0.0,2025-08-11 02:29:00
VMX-12300,VM-171,Kolkata,Office,17-07-2025,09:22:00,P-103,Oreo Pack,Snacks,62.94,133.0,116.0,17.0,7301.04,RP-005,Kiran,Working,14.7,Cash,3.3,94.0,2.39,237.0,1.0,2025-07-17 09:22:00
VMX-12301,VM-205,Pune,Hospital,11-07-2025,01:35:00,P-100,Lays Classic,Snacks,60.98,60.0,41.0,19.0,2500.18,RP-009,Anita,Working,11.9,Cash,3.0,86.0,3.35,478.0,1.0,2025-07-11 01:35:00
VMX-12302,VM-205,Bangalore,Office,23-07-2025,19:09:00,P-102,Bisleri Water,Drinks,140.59,101.0,84.0,17.0,11809.56,RP-014,Mahesh,Working,15.7,Cash,3.0,44.0,1.25,94.0,1.0,2025-07-23 19:09:00
VMX-12303,VM-244,Pune,Office,08-02-2025,18:12:00,P-109,Doritos,Snacks,132.16,134.0,123.0,11.0,16255.68,RP-019,Deepa,Working,11.0,Cash,3.4,25.0,2.07,494.0,1.0,2025-02-08 18:12:00
VMX-12304,VM-082,Hyderabad,Mall,10-09-2025,13:44:00,P-105,Dettol Wipe,Hygiene,84.19,25.0,23.0,2.0,1936.37,RP-009,Kiran,Working,16.0,Card,3.1,40.0,1.59,408.0,1.0,2025-09-10 13:44:00
VMX-12305,VM-262,Hyderabad,College,14-05-2025,14:02:00,P-105,Dettol Wipe,Hygiene,44.76,56.0,52.0,4.0,2327.52,RP-004,Anita,Maintenance,20.4,Cash,3.7,56.0,1.29,335.0,1.0,2025-05-14 14:02:00
VMX-12306,VM-155,Pune,College,09-05-2025,07:28:00,P-100,Lays Classic,Snacks,118.42,162.0,143.0,19.0,16934.06,RP-005,Kiran,Maintenance,11.6,Card,2.7,93.0,1.06,486.0,0.0,2025-05-09 07:28:00
VMX-12307,VM-261,Hyderabad,Metro Station,07-01-2025,10:54:00,P-105,Dettol Wipe,Hygiene,82.1,171.0,152.0,19.0,12479.2,RP-004,Anita,Working,12.9,UPI,4.1,3.0,2.36,67.0,0.0,2025-01-07 10:54:00
VMX-12308,VM-222,Kolkata,Metro Station,23-09-2025,23:52:00,P-100,Lays Classic,Snacks,57.47,76.0,66.0,10.0,3793.02,RP-019,Mahesh,Maintenance,12.8,Cash,4.3,8.0,1.39,409.0,1.0,2025-09-23 23:52:00
VMX-12309,VM-149,Mumbai,Hospital,08-02-2025,05:58:00,P-109,Doritos,Snacks,52.48,25.0,21.0,4.0,1102.08,RP-014,Anita,Working,17.6,Cash,4.1,92.0,3.91,339.0,0.0,2025-02-08 05:58:00
VMX-12310,VM-287,Kolkata,Office,17-05-2025,19:32:00,P-106,Snickers Bar,Snacks,118.83,33.0,19.0,14.0,2257.77,RP-019,Deepa,Maintenance,11.1,Cash,3.2,110.0,3.31,50.0,0.0,2025-05-17 19:32:00
VMX-12311,VM-182,Mumbai,College,09-07-2025,13:43:00,P-103,Oreo Pack,Snacks,21.06,86.0,73.0,13.0,1537.38,RP-014,Kiran,Low Power,17.4,Card,3.9,27.0,1.09,344.0,1.0,2025-07-09 13:43:00
VMX-12312,VM-052,Mumbai,Office,22-07-2025,09:41:00,P-100,Lays Classic,Snacks,52.45,148.0,130.0,18.0,6818.5,RP-012,Mahesh,Maintenance,15.8,Card,4.1,72.0,4.51,147.0,0.0,2025-07-22 09:41:00
VMX-12313,VM-283,Mumbai,Hospital,17-03-2025,08:57:00,P-102,Bisleri Water,Drinks,128.58,25.0,10.0,15.0,1285.8,RP-009,Ravi,Working,16.2,Cash,4.0,72.0,2.46,479.0,1.0,2025-03-17 08:57:00
VMX-12314,VM-007,Delhi,Office,02-03-2025,16:47:00,P-107,Colgate Mini,Hygiene,45.18,159.0,147.0,12.0,6641.46,RP-017,Suresh,Maintenance,13.7,Cash,3.6,47.0,2.09,467.0,1.0,2025-03-02 16:47:00
VMX-12315,VM-280,Pune,College,29-09-2025,11:36:00,P-102,Bisleri Water,Drinks,104.55,141.0,125.0,16.0,13068.75,RP-019,Amit,Working,16.5,UPI,3.1,78.0,1.78,239.0,1.0,2025-09-29 11:36:00
VMX-12316,VM-276,Bangalore,College,13-03-2025,07:26:00,P-102,Bisleri Water,Drinks,143.26,131.0,126.0,5.0,18050.76,RP-006,Rajesh,Low Power,13.5,UPI,2.4,26.0,3.45,360.0,1.0,2025-03-13 07:26:00
VMX-12317,VM-069,Pune,College,17-01-2025,05:57:00,P-105,Dettol Wipe,Hygiene,98.87,140.0,123.0,17.0,12161.01,RP-003,Rajesh,Low Power,11.2,Cash,3.3,72.0,2.18,494.0,0.0,2025-01-17 05:57:00
VMX-12318,VM-115,Kolkata,Office,27-05-2025,08:29:00,P-102,Bisleri Water,Drinks,114.85,189.0,171.0,18.0,19639.35,RP-007,Anita,Working,24.9,Card,2.8,31.0,3.49,65.0,0.0,2025-05-27 08:29:00
VMX-12319,VM-219,Mumbai,Metro Station,28-09-2025,13:53:00,P-102,Bisleri Water,Drinks,142.97,199.0,196.0,3.0,28022.12,RP-002,Kiran,Low Power,19.6,Card,2.8,61.0,3.58,119.0,0.0,2025-09-28 13:53:00
VMX-12320,VM-261,Chennai,Mall,01-01-2025,17:14:00,P-101,Pepsi Can,Drinks,21.13,35.0,26.0,9.0,549.38,RP-015,Fatima,Working,15.9,Cash,3.9,57.0,2.88,293.0,1.0,2025-01-01 17:14:00
VMX-12321,VM-116,Pune,Mall,10-03-2025,10:13:00,P-103,Oreo Pack,Snacks,36.37,92.0,88.0,4.0,3200.56,RP-005,Anita,Working,15.4,UPI,3.4,98.0,1.73,283.0,1.0,2025-03-10 10:13:00
VMX-12322,VM-267,Pune,Office,26-03-2025,03:42:00,P-105,Dettol Wipe,Hygiene,72.43,106.0,105.0,1.0,7605.15,RP-006,Ravi,Working,24.0,UPI,3.6,55.0,4.98,166.0,1.0,2025-03-26 03:42:00
VMX-12323,VM-259,Kolkata,Office,01-10-2025,15:34:00,P-103,Oreo Pack,Snacks,84.37,169.0,157.0,12.0,13246.09,RP-006,Mahesh,Maintenance,21.9,UPI,3.4,115.0,3.75,404.0,0.0,2025-10-01 15:34:00
VMX-12324,VM-197,Pune,Mall,17-08-2025,15:03:00,P-105,Dettol Wipe,Hygiene,102.87,172.0,163.0,9.0,16767.81,RP-019,Amit,Maintenance,15.1,Cash,3.9,6.0,1.6,212.0,1.0,2025-08-17 15:03:00
VMX-12325,VM-211,Delhi,Hospital,31-08-2025,18:18:00,P-106,Snickers Bar,Snacks,21.37,127.0,107.0,20.0,2286.59,RP-015,Fatima,Maintenance,21.9,Card,5.0,72.0,3.07,272.0,0.0,2025-08-31 18:18:00
VMX-12326,VM-149,Kolkata,Office,16-06-2025,19:45:00,P-106,Snickers Bar,Snacks,114.48,40.0,33.0,7.0,3777.84,RP-019,Amit,Maintenance,24.6,Cash,4.1,42.0,3.99,138.0,0.0,2025-06-16 19:45:00
VMX-12327,VM-254,Mumbai,Metro Station,24-05-2025,14:13:00,P-105,Dettol Wipe,Hygiene,144.57,33.0,31.0,2.0,4481.67,RP-014,Amit,Low Power,20.1,Card,4.7,74.0,2.52,475.0,1.0,2025-05-24 14:13:00
VMX-12328,VM-292,Hyderabad,Hospital,10-09-2025,21:29:00,P-104,Red Bull,Drinks,117.21,164.0,145.0,19.0,16995.45,RP-018,Amit,Working,10.3,Card,4.2,15.0,1.09,65.0,0.0,2025-09-10 21:29:00
VMX-12329,VM-164,Hyderabad,Office,30-01-2025,12:11:00,P-104,Red Bull,Drinks,34.91,124.0,111.0,13.0,3875.01,RP-016,Deepa,Maintenance,15.1,UPI,4.6,98.0,4.02,71.0,1.0,2025-01-30 12:11:00
VMX-12330,VM-136,Delhi,Office,19-09-2025,00:00:00,P-107,Colgate Mini,Hygiene,23.74,198.0,198.0,0.0,4700.52,RP-017,Rajesh,Working,14.1,Card,2.5,109.0,3.69,378.0,1.0,2025-09-19 00:00:00
VMX-12331,VM-265,Bangalore,College,07-03-2025,19:19:00,P-109,Doritos,Snacks,144.2,128.0,117.0,11.0,16871.4,RP-012,Ravi,Low Power,11.9,UPI,2.5,42.0,1.26,384.0,0.0,2025-03-07 19:19:00
VMX-12332,VM-192,Delhi,Hospital,29-04-2025,13:29:00,P-104,Red Bull,Drinks,38.79,80.0,70.0,10.0,2715.3,RP-016,Rajesh,Low Power,13.2,Card,4.4,16.0,2.55,476.0,1.0,2025-04-29 13:29:00
VMX-12333,VM-005,Chennai,Metro Station,16-04-2025,21:04:00,P-108,Sprite Bottle,Drinks,129.59,102.0,101.0,1.0,13088.59,RP-015,Rahul,Working,13.9,UPI,4.7,9.0,3.52,401.0,0.0,2025-04-16 21:04:00
VMX-12334,VM-136,Mumbai,Hospital,19-01-2025,15:53:00,P-108,Sprite Bottle,Drinks,14.18,125.0,123.0,2.0,1744.14,RP-014,Rahul,Low Power,22.5,UPI,3.4,101.0,4.38,433.0,0.0,2025-01-19 15:53:00
VMX-12335,VM-217,Pune,Mall,28-04-2025,11:24:00,P-107,Colgate Mini,Hygiene,26.76,63.0,54.0,9.0,1445.04,RP-002,Suresh,Working,15.2,Cash,3.2,108.0,4.67,240.0,0.0,2025-04-28 11:24:00
VMX-12336,VM-006,Mumbai,Metro Station,08-09-2025,06:20:00,P-105,Dettol Wipe,Hygiene,55.63,134.0,122.0,12.0,6786.86,RP-003,Mahesh,Maintenance,17.5,Card,4.1,83.0,3.38,465.0,1.0,2025-09-08 06:20:00
VMX-12337,VM-046,Chennai,Metro Station,04-04-2025,21:24:00,P-106,Snickers Bar,Snacks,47.52,126.0,124.0,2.0,5892.48,RP-020,Suresh,Maintenance,16.1,Cash,2.3,73.0,2.58,490.0,1.0,2025-04-04 21:24:00
VMX-12338,VM-020,Pune,Office,25-04-2025,18:55:00,P-105,Dettol Wipe,Hygiene,65.22,96.0,56.0,8.0,5739.36,RP-003,Rahul,Low Power,15.9,UPI,2.7,2.0,1.25,251.0,0.0,2025-04-25 18:55:00
VMX-12339,VM-200,Chennai,College,03-07-2025,21:04:00,P-106,Snickers Bar,Snacks,30.31,50.0,49.0,1.0,1485.19,RP-015,Fatima,Low Power,23.1,Card,4.5,7.0,4.48,479.0,0.0,2025-07-03 21:04:00
VMX-12340,VM-244,Delhi,Mall,11-04-2025,22:46:00,P-101,Pepsi Can,Drinks,38.63,187.0,176.0,11.0,6798.88,RP-020,Kiran,Low Power,24.0,UPI,4.8,113.0,1.65,460.0,1.0,2025-04-11 22:46:00
VMX-12341,VM-032,Chennai,Office,24-08-2025,15:44:00,P-109,Doritos,Snacks,114.9,120.0,106.0,14.0,12179.4,RP-010,Fatima,Maintenance,18.8,Cash,3.4,23.0,3.77,359.0,1.0,2025-08-24 15:44:00
VMX-12342,VM-094,Kolkata,Hospital,30-05-2025,22:35:00,P-109,Doritos,Snacks,117.18,44.0,34.0,10.0,3984.12,RP-001,Mahesh,Maintenance,11.9,Cash,2.7,89.0,4.3,158.0,0.0,2025-05-30 22:35:00
VMX-12343,VM-081,Hyderabad,Mall,15-05-2025,13:01:00,P-106,Snickers Bar,Snacks,81.3,69.0,54.0,15.0,4390.2,RP-014,Fatima,Maintenance,14.3,UPI,3.5,10.0,3.77,429.0,0.0,2025-05-15 13:01:00
VMX-12344,VM-181,Kolkata,Hospital,11-07-2025,02:46:00,P-108,Sprite Bottle,Drinks,47.23,199.0,179.0,20.0,8454.17,RP-003,Rajesh,Low Power,20.0,UPI,3.0,76.0,1.63,162.0,1.0,2025-07-11 02:46:00
VMX-12345,VM-014,Kolkata,Hospital,15-06-2025,17:31:00,P-105,Dettol Wipe,Hygiene,133.61,196.0,179.0,17.0,23916.19,RP-007,Mahesh,Maintenance,12.3,Cash,3.6,111.0,3.85,361.0,0.0,2025-06-15 17:31:00
VMX-12346,VM-255,Hyderabad,Office,13-08-2025,16:39:00,P-103,Oreo Pack,Snacks,59.95,56.0,39.0,17.0,2338.05,RP-007,Deepa,Maintenance,19.7,UPI,3.5,20.0,2.64,390.0,1.0,2025-08-13 16:39:00
VMX-12347,VM-078,Pune,Mall,14-06-2025,01:29:00,P-107,Colgate Mini,Hygiene,47.25,90.0,79.0,11.0,3732.75,RP-004,Mahesh,Working,25.0,UPI,4.2,6.0,3.11,75.0,1.0,2025-06-14 01:29:00
VMX-12348,VM-174,Pune,College,14-01-2025,23:43:00,P-105,Dettol Wipe,Hygiene,66.44,99.0,88.0,11.0,5846.72,RP-001,Deepa,Maintenance,10.2,Cash,3.7,82.0,3.22,398.0,1.0,2025-01-14 23:43:00
VMX-12349,VM-109,Mumbai,Metro Station,13-09-2025,13:05:00,P-107,Colgate Mini,Hygiene,93.24,86.0,78.0,8.0,7272.72,RP-018,Kiran,Low Power,12.9,UPI,4.4,37.0,2.55,219.0,0.0,2025-09-13 13:05:00
VMX-12350,VM-210,Bangalore,Mall,22-05-2025,23:36:00,P-103,Oreo Pack,Snacks,42.76,133.0,119.0,14.0,5088.44,RP-016,Rahul,Working,12.3,Card,3.3,114.0,1.68,108.0,0.0,2025-05-22 23:36:00
VMX-12351,VM-256,Bangalore,Office,29-05-2025,06:35:00,P-105,Dettol Wipe,Hygiene,10.07,75.0,60.0,15.0,604.2,RP-011,Mahesh,Low Power,24.5,Cash,3.8,1.0,2.28,374.0,0.0,2025-05-29 06:35:00
VMX-12352,VM-219,Bangalore,Metro Station,02-09-2025,20:36:00,P-104,Red Bull,Drinks,76.25,126.0,126.0,0.0,9607.5,RP-003,Anita,Low Power,24.2,UPI,3.4,52.0,2.51,342.0,1.0,2025-09-02 20:36:00
VMX-12353,VM-119,Mumbai,Hospital,13-08-2025,09:31:00,P-109,Doritos,Snacks,26.08,162.0,160.0,2.0,4172.8,RP-012,Suresh,Maintenance,16.6,Card,3.6,67.0,2.8,203.0,1.0,2025-08-13 09:31:00
VMX-12354,VM-136,Kolkata,Metro Station,02-10-2025,08:16:00,P-105,Dettol Wipe,Hygiene,73.38,82.0,79.0,3.0,5797.02,RP-013,Ravi,Low Power,13.6,Card,3.0,43.0,2.92,294.0,1.0,2025-10-02 08:16:00
VMX-12355,VM-114,Pune,Office,22-03-2025,02:09:00,P-107,Colgate Mini,Hygiene,48.87,132.0,112.0,20.0,5473.44,RP-017,Rajesh,Low Power,15.5,Cash,4.4,117.0,3.48,330.0,1.0,2025-03-22 02:09:00
VMX-12356,VM-096,Kolkata,Metro Station,24-04-2025,04:46:00,P-105,Dettol Wipe,Hygiene,62.26,171.0,154.0,17.0,9588.04,RP-002,Mahesh,Working,14.9,Cash,3.0,44.0,3.96,274.0,0.0,2025-04-24 04:46:00
VMX-12357,VM-291,Hyderabad,Metro Station,17-01-2025,10:46:00,P-106,Snickers Bar,Snacks,55.09,113.0,104.0,9.0,5729.36,RP-008,Anita,Low Power,23.9,UPI,3.2,110.0,3.63,495.0,1.0,2025-01-17 10:46:00
VMX-12358,VM-029,Kolkata,Hospital,30-04-2025,07:56:00,P-101,Pepsi Can,Drinks,147.29,68.0,49.0,19.0,7217.21,RP-011,Suresh,Working,15.6,Cash,4.6,47.0,3.45,291.0,1.0,2025-04-30 07:56:00
VMX-12359,VM-096,Delhi,College,22-07-2025,05:32:00,P-109,Doritos,Snacks,103.88,25.0,7.0,18.0,727.16,RP-020,Kiran,Working,17.9,Card,3.5,80.0,2.3,290.0,0.0,2025-07-22 05:32:00
VMX-12360,VM-241,Mumbai,Mall,07-05-2025,01:37:00,P-107,Colgate Mini,Hygiene,147.79,139.0,126.0,13.0,18621.54,RP-019,Fatima,Maintenance,13.7,UPI,4.5,52.0,1.11,305.0,1.0,2025-05-07 01:37:00
VMX-12361,VM-150,Chennai,Office,29-01-2025,21:41:00,P-108,Sprite Bottle,Drinks,123.46,105.0,105.0,0.0,12963.3,RP-002,Rajesh,Maintenance,12.1,UPI,2.5,78.0,4.58,423.0,0.0,2025-01-29 21:41:00
VMX-12362,VM-076,Mumbai,Office,29-04-2025,22:11:00,P-101,Pepsi Can,Drinks,12.41,133.0,114.0,19.0,1414.74,RP-005,Rajesh,Maintenance,12.4,UPI,3.2,2.0,2.33,205.0,0.0,2025-04-29 22:11:00
VMX-12363,VM-105,Pune,Metro Station,23-08-2025,14:20:00,P-105,Dettol Wipe,Hygiene,69.55,50.0,48.0,2.0,3338.4,RP-015,Amit,Low Power,22.0,UPI,3.7,91.0,4.52,452.0,1.0,2025-08-23 14:20:00
VMX-12364,VM-169,Delhi,Office,05-06-2025,00:31:00,P-100,Lays Classic,Snacks,147.51,191.0,175.0,16.0,25814.25,RP-007,Fatima,Working,15.5,Card,3.2,79.0,3.51,122.0,1.0,2025-06-05 00:31:00
VMX-12365,VM-013,Chennai,College,18-01-2025,14:47:00,P-108,Sprite Bottle,Drinks,40.37,178.0,167.0,11.0,6741.79,RP-007,Mahesh,Low Power,19.1,UPI,2.5,99.0,1.51,104.0,1.0,2025-01-18 14:47:00
VMX-12366,VM-267,Chennai,Mall,15-01-2025,05:30:00,P-106,Snickers Bar,Snacks,86.65,161.0,147.0,14.0,12737.55,RP-015,Rahul,Maintenance,21.6,Cash,2.9,92.0,3.29,208.0,0.0,2025-01-15 05:30:00
VMX-12367,VM-099,Pune,College,02-01-2025,13:44:00,P-103,Oreo Pack,Snacks,76.24,142.0,135.0,7.0,10292.4,RP-017,Deepa,Maintenance,13.2,UPI,3.7,87.0,4.69,154.0,1.0,2025-01-02 13:44:00
VMX-12368,VM-203,Mumbai,Office,24-03-2025,06:34:00,P-108,Sprite Bottle,Drinks,140.04,128.0,114.0,14.0,15964.56,RP-014,Mahesh,Low Power,17.1,UPI,5.0,44.0,3.26,279.0,0.0,2025-03-24 06:34:00
VMX-12369,VM-067,Chennai,College,15-08-2025,15:57:00,P-105,Dettol Wipe,Hygiene,50.69,20.0,10.0,10.0,506.9,RP-010,Mahesh,Working,14.9,Card,3.6,78.0,3.95,330.0,0.0,2025-08-15 15:57:00
VMX-12370,VM-109,Chennai,Hospital,28-09-2025,14:09:00,P-100,Lays Classic,Snacks,97.95,101.0,91.0,10.0,8913.45,RP-017,Anita,Low Power,21.8,Card,2.4,67.0,1.09,197.0,0.0,2025-09-28 14:09:00
VMX-12371,VM-156,Pune,Mall,31-01-2025,14:47:00,P-100,Lays Classic,Snacks,121.02,41.0,30.0,11.0,3630.6,RP-004,Kiran,Low Power,10.2,Card,2.4,98.0,3.72,108.0,0.0,2025-01-31 14:47:00
VMX-12372,VM-146,Hyderabad,Office,12-08-2025,02:14:00,P-105,Dettol Wipe,Hygiene,98.93,181.0,169.0,12.0,16719.17,RP-015,Deepa,Working,10.6,UPI,3.0,38.0,1.14,378.0,0.0,2025-08-12 02:14:00
VMX-12373,VM-159,Pune,Office,20-01-2025,20:24:00,P-102,Bisleri Water,Drinks,97.67,25.0,13.0,12.0,1269.71,RP-020,Suresh,Low Power,16.6,UPI,4.2,109.0,4.58,472.0,0.0,2025-01-20 20:24:00
VMX-12374,VM-250,Bangalore,Mall,22-04-2025,12:18:00,P-103,Oreo Pack,Snacks,120.39,120.0,114.0,6.0,13724.46,RP-010,Deepa,Low Power,21.6,Card,2.3,4.0,3.1,163.0,0.0,2025-04-22 12:18:00
VMX-12375,VM-209,Mumbai,Mall,05-04-2025,08:17:00,P-105,Dettol Wipe,Hygiene,19.05,95.0,75.0,20.0,1428.75,RP-020,Mahesh,Working,20.9,UPI,3.1,75.0,4.63,413.0,0.0,2025-04-05 08:17:00
VMX-12376,VM-085,Kolkata,Office,02-08-2025,15:40:00,P-104,Red Bull,Drinks,108.21,160.0,143.0,17.0,15474.03,RP-004,Anita,Working,20.3,UPI,2.3,56.0,1.2,346.0,1.0,2025-08-02 15:40:00
VMX-12377,VM-204,Mumbai,Metro Station,14-09-2025,03:56:00,P-103,Oreo Pack,Snacks,20.29,23.0,5.0,18.0,101.45,RP-018,Ravi,Working,23.4,Cash,4.6,69.0,2.18,358.0,0.0,2025-09-14 03:56:00
VMX-12378,VM-167,Chennai,Hospital,21-02-2025,12:16:00,P-102,Bisleri Water,Drinks,86.93,113.0,112.0,1.0,9736.16,RP-013,Amit,Low Power,16.6,Cash,2.5,44.0,1.88,105.0,0.0,2025-02-21 12:16:00
VMX-12379,VM-083,Kolkata,Metro Station,22-07-2025,05:49:00,P-107,Colgate Mini,Hygiene,66.34,148.0,134.0,14.0,8889.56,RP-012,Rajesh,Maintenance,19.6,UPI,3.5,46.0,1.15,80.0,1.0,2025-07-22 05:49:00
VMX-12380,VM-173,Kolkata,Hospital,23-04-2025,02:48:00,P-101,Pepsi Can,Drinks,75.27,79.0,59.0,20.0,4440.93,RP-004,Kiran,Working,23.4,Cash,3.1,120.0,4.31,185.0,1.0,2025-04-23 02:48:00
VMX-12381,VM-054,Chennai,Mall,19-01-2025,08:16:00,P-107,Colgate Mini,Hygiene,22.26,126.0,116.0,10.0,2582.16,RP-014,Anita,Low Power,24.5,Card,4.0,94.0,3.53,356.0,1.0,2025-01-19 08:16:00
VMX-12382,VM-294,Kolkata,College,14-02-2025,21:43:00,P-109,Doritos,Snacks,50.01,114.0,106.0,8.0,5301.06,RP-008,Rajesh,Maintenance,10.7,Card,3.5,106.0,2.71,60.0,0.0,2025-02-14 21:43:00
VMX-12383,VM-085,Chennai,Mall,20-07-2025,10:47:00,P-108,Sprite Bottle,Drinks,123.12,133.0,126.0,7.0,15513.12,RP-016,Kiran,Working,20.6,UPI,2.8,86.0,1.48,273.0,1.0,2025-07-20 10:47:00
VMX-12384,VM-098,Chennai,Mall,05-03-2025,06:22:00,P-104,Red Bull,Drinks,10.48,63.0,50.0,13.0,524.0,RP-011,Deepa,Low Power,15.8,Card,2.6,104.0,4.78,418.0,0.0,2025-03-05 06:22:00
VMX-12385,VM-005,Pune,Office,04-07-2025,11:04:00,P-101,Pepsi Can,Drinks,39.1,85.0,82.0,3.0,3206.2,RP-009,Amit,Maintenance,15.4,Cash,4.6,43.0,1.03,255.0,0.0,2025-07-04 11:04:00
VMX-12386,VM-225,Bangalore,Hospital,30-03-2025,22:00:00,P-108,Sprite Bottle,Drinks,136.66,185.0,169.0,16.0,23095.54,RP-003,Amit,Low Power,12.8,UPI,2.1,84.0,1.74,366.0,0.0,2025-03-30 22:00:00
VMX-12387,VM-082,Mumbai,Mall,19-03-2025,13:30:00,P-107,Colgate Mini,Hygiene,84.13,46.0,39.0,7.0,3281.07,RP-008,Amit,Low Power,11.9,UPI,4.7,54.0,2.76,272.0,1.0,2025-03-19 13:30:00
VMX-12388,VM-229,Delhi,Hospital,30-05-2025,12:34:00,P-108,Sprite Bottle,Drinks,121.09,51.0,33.0,18.0,3995.97,RP-010,Rahul,Maintenance,12.3,Card,2.9,77.0,3.44,453.0,0.0,2025-05-30 12:34:00
VMX-12389,VM-207,Mumbai,Metro Station,11-09-2025,05:55:00,P-103,Oreo Pack,Snacks,68.39,108.0,88.0,20.0,6018.32,RP-009,Rahul,Working,23.6,UPI,2.7,83.0,2.69,274.0,0.0,2025-09-11 05:55:00
VMX-12390,VM-106,Kolkata,College,05-03-2025,22:45:00,P-102,Bisleri Water,Drinks,14.44,39.0,27.0,12.0,389.88,RP-016,Rajesh,Maintenance,10.2,Cash,2.9,117.0,1.83,398.0,0.0,2025-03-05 22:45:00
VMX-12391,VM-054,Mumbai,Hospital,19-02-2025,16:01:00,P-103,Oreo Pack,Snacks,0,187.0,177.0,10.0,6718.92,RP-009,Fatima,Working,12.4,UPI,2.4,7.0,4.47,496.0,0.0,2025-02-19 16:01:00
VMX-12392,VM-057,Chennai,Office,07-07-2025,06:04:00,P-108,Sprite Bottle,Drinks,83.99,197.0,178.0,19.0,14950.22,RP-008,Rahul,Low Power,18.2,Cash,3.1,31.0,2.04,94.0,1.0,2025-07-07 06:04:00
VMX-12393,VM-216,Kolkata,Mall,07-08-2025,00:32:00,P-109,Doritos,Snacks,122.49,25.0,13.0,12.0,1592.37,RP-008,Kiran,Low Power,10.9,UPI,2.1,18.0,2.64,384.0,0.0,2025-08-07 00:32:00
VMX-12394,VM-173,Hyderabad,Metro Station,09-03-2025,04:59:00,P-102,Bisleri Water,Drinks,53.53,146.0,129.0,17.0,6905.37,RP-005,Kiran,Maintenance,11.5,Cash,3.0,53.0,1.5,80.0,1.0,2025-03-09 04:59:00
VMX-12395,VM-203,Bangalore,Metro Station,12-09-2025,20:01:00,P-100,Lays Classic,Snacks,20.83,142.0,123.0,19.0,2562.09,RP-017,Ravi,Working,18.5,Card,3.4,45.0,1.74,266.0,1.0,2025-09-12 20:01:00
VMX-12396,VM-048,Kolkata,Hospital,20-04-2025,13:35:00,P-106,Snickers Bar,Snacks,140.59,32.0,15.0,17.0,2108.85,RP-018,Amit,Working,14.4,UPI,4.9,60.0,4.94,77.0,1.0,2025-04-20 13:35:00
VMX-12397,VM-006,Pune,Mall,10-01-2025,06:39:00,P-101,Pepsi Can,Drinks,139.29,70.0,52.0,18.0,7243.08,RP-001,Mahesh,Low Power,22.7,Card,4.0,22.0,2.59,70.0,1.0,2025-01-10 06:39:00
VMX-12398,VM-168,Delhi,Hospital,10-09-2025,09:32:00,P-100,Lays Classic,Snacks,98.55,186.0,177.0,9.0,17443.35,RP-020,Fatima,Maintenance,18.0,Card,3.8,8.0,1.92,286.0,0.0,2025-09-10 09:32:00
VMX-12399,VM-107,Bangalore,Mall,20-03-2025,19:50:00,P-108,Sprite Bottle,Drinks,26.41,104.0,99.0,5.0,2614.59,RP-019,Rajesh,Maintenance,20.2,UPI,2.8,14.0,2.19,393.0,0.0,2025-03-20 19:50:00
VMX-12400,VM-044,Pune,Metro Station,08-07-2025,09:15:00,P-108,Sprite Bottle,Drinks,105.75,95.0,80.0,15.0,8460.0,RP-013,Anita,Low Power,19.0,UPI,3.6,7.0,2.9,372.0,0.0,2025-07-08 09:15:00
VMX-12401,VM-268,Bangalore,Hospital,30-07-2025,19:53:00,P-104,Red Bull,Drinks,115.49,75.0,63.0,12.0,7275.87,RP-012,Deepa,Maintenance,19.7,Card,2.1,106.0,4.67,328.0,0.0,2025-07-30 19:53:00
VMX-12402,VM-017,Pune,Metro Station,13-09-2025,23:29:00,P-108,Sprite Bottle,Drinks,79,29.0,29.0,0.0,2291.0,RP-002,Suresh,Working,16.7,Cash,2.3,112.0,1.31,166.0,1.0,2025-09-13 23:29:00
VMX-12403,VM-057,Kolkata,Office,09-04-2025,06:15:00,P-109,Doritos,Snacks,108.93,20.0,11.0,9.0,1198.23,RP-014,Rahul,Low Power,14.0,Cash,2.1,39.0,0.0,96.0,0.0,2025-04-09 06:15:00
VMX-12404,VM-197,Hyderabad,Metro Station,27-03-2025,05:51:00,P-103,Oreo Pack,Snacks,55.76,21.0,8.0,13.0,446.08,RP-007,Ravi,Low Power,21.1,Cash,4.3,51.0,4.35,166.0,0.0,2025-03-27 05:51:00
VMX-12405,VM-004,Hyderabad,Hospital,21-03-2025,06:06:00,P-101,Pepsi Can,Drinks,63.08,94.0,93.0,1.0,5866.44,RP-003,Rajesh,Working,19.0,Card,2.9,59.0,4.68,178.0,0.0,2025-03-21 06:06:00
VMX-12406,VM-038,Pune,College,05-07-2025,00:35:00,P-105,Dettol Wipe,Hygiene,116.74,174.0,154.0,20.0,17977.96,RP-001,Deepa,Low Power,21.6,Cash,3.9,20.0,4.21,165.0,1.0,2025-07-05 00:35:00
VMX-12407,VM-136,Hyderabad,Mall,03-05-2025,11:11:00,P-109,Doritos,Snacks,61.67,140.0,127.0,13.0,7832.09,RP-001,Amit,Maintenance,12.8,Card,4.4,48.0,2.92,100.0,0.0,2025-05-03 11:11:00
VMX-12408,VM-086,Bangalore,Office,28-03-2025,09:37:00,P-106,Snickers Bar,Snacks,67.99,128.0,128.0,0.0,8702.72,RP-015,Rajesh,Low Power,14.3,Card,2.9,5.0,2.47,93.0,1.0,2025-03-28 09:37:00
VMX-12409,VM-179,Bangalore,Hospital,10-09-2025,22:50:00,P-105,Dettol Wipe,Hygiene,36.83,52.0,37.0,15.0,1362.71,RP-004,Deepa,Maintenance,17.0,Card,3.9,116.0,4.38,318.0,0.0,2025-09-10 22:50:00
VMX-12410,VM-163,Kolkata,College,20-02-2025,15:06:00,P-106,Snickers Bar,Snacks,124.19,161.0,154.0,7.0,19125.26,RP-003,Ravi,Low Power,12.4,UPI,2.3,37.0,3.81,306.0,1.0,2025-02-20 15:06:00
VMX-12411,VM-105,Mumbai,College,22-04-2025,02:58:00,P-105,Dettol Wipe,Hygiene,134.16,126.0,112.0,14.0,15025.92,RP-016,Anita,Working,18.6,Cash,4.0,51.0,3.39,208.0,1.0,2025-04-22 02:58:00
VMX-12412,VM-063,Delhi,College,09-04-2025,08:00:00,P-100,Lays Classic,Snacks,85.98,141.0,141.0,0.0,12123.18,RP-016,Kiran,Working,16.9,UPI,2.3,83.0,4.51,108.0,0.0,2025-04-09 08:00:00
VMX-12413,VM-045,Mumbai,Mall,16-02-2025,21:33:00,P-102,Bisleri Water,Drinks,73.27,156.0,149.0,7.0,10917.23,RP-001,Suresh,Low Power,17.1,UPI,3.1,107.0,2.69,56.0,0.0,2025-02-16 21:33:00
VMX-12414,VM-067,Kolkata,Hospital,12-06-2025,09:54:00,P-101,Pepsi Can,Drinks,89.76,190.0,170.0,20.0,15259.2,RP-002,Rajesh,Maintenance,22.3,Cash,4.6,9.0,1.49,495.0,1.0,2025-06-12 09:54:00
VMX-12415,VM-036,Kolkata,College,05-06-2025,21:45:00,P-103,Oreo Pack,Snacks,47.97,196.0,191.0,5.0,9162.27,RP-009,Rajesh,Low Power,23.2,Card,3.2,55.0,1.58,435.0,0.0,2025-06-05 21:45:00
VMX-12416,VM-038,Kolkata,College,06-08-2025,09:08:00,P-102,Bisleri Water,Drinks,42.04,35.0,15.0,20.0,630.6,RP-014,Fatima,Low Power,16.0,Cash,3.6,120.0,3.39,228.0,0.0,2025-08-06 09:08:00
VMX-12417,VM-076,Hyderabad,Hospital,05-08-2025,12:20:00,P-105,Dettol Wipe,Hygiene,95.87,80.0,72.0,8.0,6902.64,RP-010,Kiran,Low Power,14.9,Cash,2.3,55.0,4.01,188.0,1.0,2025-08-05 12:20:00
VMX-12418,VM-110,Mumbai,College,28-05-2025,03:06:00,P-100,Lays Classic,Snacks,70.22,102.0,82.0,20.0,5758.04,RP-008,Anita,Maintenance,16.4,Cash,3.9,96.0,3.73,304.0,0.0,2025-05-28 03:06:00
VMX-12419,VM-028,Hyderabad,Metro Station,20-08-2025,23:24:00,P-107,Colgate Mini,Hygiene,84.97,167.0,157.0,10.0,13340.29,RP-017,Suresh,Working,14.1,Card,4.0,81.0,4.43,192.0,1.0,2025-08-20 23:24:00
VMX-12420,VM-115,Chennai,Metro Station,02-05-2025,08:44:00,P-107,Colgate Mini,Hygiene,52.9,147.0,140.0,7.0,7406.0,RP-016,Suresh,Low Power,21.4,UPI,2.1,85.0,2.71,445.0,1.0,2025-05-02 08:44:00
VMX-12421,VM-248,Kolkata,Office,09-02-2025,21:51:00,P-102,Bisleri Water,Drinks,127.05,112.0,105.0,7.0,13340.25,RP-002,Anita,Working,21.9,Cash,3.4,10.0,4.65,109.0,1.0,2025-02-09 21:51:00
VMX-12422,VM-184,Bangalore,Metro Station,18-05-2025,20:01:00,P-109,Doritos,Snacks,65.7,166.0,152.0,14.0,9986.4,RP-001,Deepa,Maintenance,21.8,UPI,2.1,44.0,2.93,342.0,0.0,2025-05-18 20:01:00
VMX-12423,VM-259,Hyderabad,Hospital,20-03-2025,12:25:00,P-108,Sprite Bottle,Drinks,19.44,88.0,74.0,14.0,1438.56,RP-007,Rahul,Maintenance,19.5,Cash,2.9,54.0,4.76,98.0,0.0,2025-03-20 12:25:00
VMX-12424,VM-250,Pune,Metro Station,15-07-2025,05:47:00,P-109,Doritos,Snacks,58.49,88.0,87.0,1.0,5088.63,RP-001,Fatima,Maintenance,25.0,Card,4.0,50.0,3.01,153.0,0.0,2025-07-15 05:47:00
VMX-12425,VM-072,Pune,Mall,24-08-2025,18:21:00,P-101,Pepsi Can,Drinks,31.01,190.0,187.0,3.0,5798.87,RP-006,Suresh,Working,24.3,Cash,3.0,62.0,2.99,227.0,0.0,2025-08-24 18:21:00
VMX-12426,VM-236,Delhi,College,05-03-2025,13:11:00,P-103,Oreo Pack,Snacks,82.67,108.0,95.0,13.0,7853.65,RP-009,Ravi,Working,14.2,Cash,3.5,90.0,2.98,123.0,0.0,2025-03-05 13:11:00
VMX-12427,VM-052,Delhi,Office,11-05-2025,05:58:00,P-105,Dettol Wipe,Hygiene,101.08,79.0,64.0,15.0,6469.12,RP-005,Mahesh,Maintenance,13.8,Cash,3.3,30.0,4.59,0.0,0.0,2025-05-11 05:58:00
VMX-12428,VM-026,Kolkata,Office,28-05-2025,04:21:00,P-105,Dettol Wipe,Hygiene,100.93,136.0,134.0,2.0,13524.62,RP-019,Amit,Maintenance,24.4,UPI,2.7,111.0,4.62,463.0,0.0,2025-05-28 04:21:00
VMX-12429,VM-115,Mumbai,Office,09-09-2025,15:38:00,P-109,Doritos,Snacks,60.98,196.0,179.0,17.0,10915.42,RP-006,Rajesh,Working,16.9,UPI,3.4,28.0,3.08,370.0,0.0,2025-09-09 15:38:00
VMX-12430,VM-165,Hyderabad,College,18-03-2025,02:15:00,P-106,Snickers Bar,Snacks,144.53,38.0,34.0,4.0,4914.02,RP-003,Suresh,Maintenance,13.1,Cash,2.1,42.0,1.75,441.0,0.0,2025-03-18 02:15:00
VMX-12431,VM-148,Delhi,College,23-05-2025,16:53:00,P-102,Bisleri Water,Drinks,131.58,123.0,105.0,18.0,13815.9,RP-006,Suresh,Working,22.3,Cash,2.5,109.0,1.68,67.0,1.0,2025-05-23 16:53:00
VMX-12432,VM-156,Bangalore,Metro Station,31-01-2025,23:36:00,P-103,Oreo Pack,Snacks,83.32,102.0,87.0,15.0,7248.84,RP-004,Suresh,Low Power,10.2,Card,4.9,71.0,4.51,315.0,0.0,2025-01-31 23:36:00
VMX-12433,VM-284,Bangalore,Mall,27-02-2025,13:52:00,P-107,Colgate Mini,Hygiene,96.52,51.0,44.0,7.0,4246.88,RP-013,Mahesh,Maintenance,10.1,Card,2.6,8.0,2.49,369.0,0.0,2025-02-27 13:52:00
VMX-12434,VM-279,Pune,Mall,19-05-2025,22:38:00,P-101,Pepsi Can,Drinks,139.56,159.0,150.0,9.0,20934.0,Unknown,Mahesh,Working,16.7,UPI,5.0,56.0,4.55,461.0,0.0,2025-05-19 22:38:00
VMX-12435,VM-129,Pune,Office,17-08-2025,01:42:00,P-108,Sprite Bottle,Drinks,27.26,77.0,71.0,6.0,1935.46,RP-013,Amit,Low Power,22.6,UPI,2.9,56.0,4.43,57.0,0.0,2025-08-17 01:42:00
VMX-12436,VM-105,Chennai,Metro Station,17-09-2025,16:08:00,P-105,Dettol Wipe,Hygiene,137.93,111.0,101.0,10.0,13930.93,RP-004,Ravi,Maintenance,10.4,Card,4.4,72.0,3.61,168.0,1.0,2025-09-17 16:08:00
VMX-12437,VM-284,Kolkata,Mall,24-05-2025,15:30:00,P-100,Lays Classic,Snacks,122.84,54.0,37.0,17.0,4545.08,RP-011,Fatima,Low Power,21.0,Cash,3.4,47.0,2.7,200.0,0.0,2025-05-24 15:30:00
VMX-12438,VM-009,Mumbai,Hospital,18-01-2025,14:49:00,P-105,Dettol Wipe,Hygiene,133.8,80.0,74.0,6.0,9901.2,RP-014,Rajesh,Working,19.7,Card,4.1,27.0,4.06,169.0,0.0,2025-01-18 14:49:00
VMX-12439,VM-171,Chennai,Mall,17-02-2025,03:37:00,P-101,Pepsi Can,Drinks,90.23,37.0,24.0,13.0,2165.52,RP-001,Rahul,Working,17.4,Card,2.3,24.0,2.02,79.0,0.0,2025-02-17 03:37:00
VMX-12440,VM-293,Delhi,Mall,05-01-2025,06:31:00,P-107,Colgate Mini,Hygiene,79.01,39.0,25.0,14.0,1975.25,RP-001,Kiran,Working,22.2,Card,2.4,6.0,4.58,196.0,1.0,2025-01-05 06:31:00
VMX-12441,VM-139,Mumbai,Office,19-02-2025,12:11:00,P-108,Sprite Bottle,Drinks,28.14,142.0,138.0,4.0,3883.32,RP-005,Anita,Low Power,18.4,UPI,2.7,46.0,4.52,214.0,0.0,2025-02-19 12:11:00
VMX-12442,VM-113,Mumbai,Hospital,13-01-2025,10:45:00,P-106,Snickers Bar,Snacks,142.3,54.0,36.0,18.0,5122.8,RP-020,Ravi,Working,10.4,UPI,5.0,116.0,4.59,422.0,0.0,2025-01-13 10:45:00
VMX-12443,VM-165,Hyderabad,Metro Station,12-01-2025,07:20:00,P-109,Doritos,Snacks,58.38,160.0,141.0,19.0,8231.58,RP-004,Rahul,Maintenance,21.3,UPI,3.6,102.0,4.75,432.0,1.0,2025-01-12 07:20:00
VMX-12444,VM-229,Chennai,Office,03-10-2025,02:52:00,P-104,Red Bull,Drinks,55.06,103.0,89.0,14.0,4900.34,RP-006,Mahesh,Low Power,13.9,Card,3.1,10.0,4.89,239.0,1.0,2025-10-03 02:52:00
VMX-12445,VM-202,Delhi,Hospital,31-03-2025,01:07:00,P-106,Snickers Bar,Snacks,77.81,91.0,91.0,0.0,7080.71,RP-011,Rahul,Maintenance,19.0,Cash,2.1,3.0,1.29,181.0,0.0,2025-03-31 01:07:00
VMX-12446,VM-246,Hyderabad,Metro Station,03-10-2025,01:24:00,P-104,Red Bull,Drinks,132.24,109.0,89.0,20.0,11769.36,RP-003,Anita,Low Power,24.3,UPI,2.9,32.0,1.02,75.0,0.0,2025-10-03 01:24:00
VMX-12447,VM-131,Kolkata,Office,30-05-2025,22:26:00,P-100,Lays Classic,Snacks,134.52,29.0,29.0,0.0,3901.08,RP-009,Rahul,Low Power,15.8,Cash,2.9,68.0,4.24,229.0,0.0,2025-05-30 22:26:00
VMX-12448,VM-218,Bangalore,Office,14-03-2025,09:25:00,P-105,Dettol Wipe,Hygiene,66.88,92.0,75.0,17.0,5016.0,RP-015,Kiran,Working,11.2,Cash,3.6,89.0,2.88,219.0,0.0,2025-03-14 09:25:00
VMX-12449,VM-091,Delhi,Office,24-02-2025,12:22:00,P-101,Pepsi Can,Drinks,148.28,48.0,43.0,5.0,6376.04,RP-002,Fatima,Maintenance,11.8,Card,3.0,2.0,2.23,105.0,1.0,2025-02-24 12:22:00
VMX-12450,VM-222,Delhi,Office,12-05-2025,02:40:00,P-100,Lays Classic,Snacks,71.49,38.0,23.0,15.0,1644.27,RP-016,Rajesh,Maintenance,19.9,Cash,4.5,106.0,4.26,370.0,0.0,2025-05-12 02:40:00
VMX-12451,VM-206,Mumbai,College,04-03-2025,18:29:00,P-103,Oreo Pack,Snacks,118.77,60.0,53.0,7.0,6294.81,RP-006,Deepa,Low Power,24.5,Cash,3.2,32.0,4.68,192.0,1.0,2025-03-04 18:29:00
VMX-12452,VM-093,Chennai,Office,16-09-2025,19:57:00,P-109,Doritos,Snacks,68.72,113.0,93.0,20.0,6390.96,RP-003,Fatima,Working,12.8,Cash,4.6,109.0,4.2,173.0,1.0,2025-09-16 19:57:00
VMX-12453,VM-081,Kolkata,Metro Station,10-09-2025,22:38:00,P-102,Bisleri Water,Drinks,48.06,194.0,186.0,8.0,8939.16,RP-015,Deepa,Maintenance,11.4,UPI,4.7,38.0,4.89,344.0,1.0,2025-09-10 22:38:00
VMX-12454,VM-279,Chennai,Hospital,16-07-2025,10:54:00,P-100,Lays Classic,Snacks,134.47,167.0,158.0,9.0,21246.26,RP-008,Rahul,Working,19.7,UPI,3.7,107.0,4.2,303.0,0.0,2025-07-16 10:54:00
VMX-12455,VM-131,Kolkata,Metro Station,02-09-2025,13:51:00,P-107,Colgate Mini,Hygiene,115.27,142.0,130.0,12.0,14985.1,RP-016,Suresh,Low Power,18.0,UPI,2.7,109.0,1.59,107.0,0.0,2025-09-02 13:51:00
VMX-12456,VM-157,Mumbai,Hospital,03-10-2025,18:28:00,P-108,Sprite Bottle,Drinks,73.64,128.0,124.0,4.0,9131.36,RP-015,Kiran,Low Power,20.4,UPI,4.3,88.0,3.44,351.0,0.0,2025-10-03 18:28:00
VMX-12457,VM-176,Pune,Metro Station,14-07-2025,08:08:00,P-109,Doritos,Snacks,36.56,113.0,108.0,5.0,3948.48,RP-007,Ravi,Low Power,16.5,Card,3.5,118.0,4.39,321.0,1.0,2025-07-14 08:08:00
VMX-12458,VM-192,Kolkata,Hospital,01-03-2025,00:40:00,P-106,Snickers Bar,Snacks,115.28,134.0,124.0,10.0,14294.72,RP-007,Rahul,Maintenance,20.1,UPI,3.5,84.0,2.21,192.0,1.0,2025-03-01 00:40:00
VMX-12459,VM-231,Kolkata,Hospital,18-01-2025,11:51:00,P-107,Colgate Mini,Hygiene,145.24,48.0,40.0,8.0,5809.6,RP-002,Amit,Low Power,24.9,Card,2.1,10.0,2.44,194.0,1.0,2025-01-18 11:51:00
VMX-12460,VM-166,Bangalore,Office,03-10-2025,10:29:00,P-109,Doritos,Snacks,49.5,183.0,164.0,19.0,8118.0,RP-013,Suresh,Low Power,13.9,UPI,4.8,70.0,2.08,222.0,1.0,2025-10-03 10:29:00
VMX-12461,VM-174,Delhi,Office,18-04-2025,07:52:00,P-107,Colgate Mini,Hygiene,64.65,192.0,179.0,13.0,11572.35,RP-006,Mahesh,Maintenance,23.6,UPI,2.1,72.0,4.59,160.0,0.0,2025-04-18 07:52:00
VMX-12462,VM-074,Mumbai,Hospital,28-09-2025,20:45:00,P-107,Colgate Mini,Hygiene,32.48,140.0,136.0,4.0,4417.28,RP-019,Deepa,Maintenance,17.6,Card,3.5,91.0,3.22,189.0,0.0,2025-09-28 20:45:00
VMX-12463,VM-277,Hyderabad,Mall,29-07-2025,13:51:00,P-106,Snickers Bar,Snacks,124.37,25.0,18.0,7.0,2238.66,RP-015,Kiran,Maintenance,23.1,UPI,3.6,82.0,4.62,357.0,1.0,2025-07-29 13:51:00
VMX-12464,VM-204,Kolkata,College,04-09-2025,19:53:00,P-103,Oreo Pack,Snacks,106.87,31.0,30.0,1.0,3206.1,RP-014,Deepa,Working,17.2,UPI,4.0,32.0,1.56,301.0,0.0,2025-09-04 19:53:00
VMX-12465,VM-220,Pune,Office,27-02-2025,12:12:00,P-106,Snickers Bar,Snacks,149.13,164.0,162.0,2.0,24159.06,RP-001,Rajesh,Working,15.1,Cash,3.0,12.0,2.55,87.0,1.0,2025-02-27 12:12:00
VMX-12466,VM-073,Bangalore,College,03-09-2025,19:32:00,P-106,Snickers Bar,Snacks,95.83,155.0,154.0,1.0,14757.82,RP-016,Mahesh,Working,17.9,Cash,2.6,108.0,4.0,472.0,0.0,2025-09-03 19:32:00
VMX-12467,VM-222,Pune,Mall,29-04-2025,05:53:00,P-102,Bisleri Water,Drinks,39.19,142.0,133.0,9.0,5212.27,RP-009,Rahul,Low Power,11.5,Cash,2.3,48.0,3.69,377.0,1.0,2025-04-29 05:53:00
VMX-12468,VM-154,Mumbai,Office,31-03-2025,18:54:00,P-109,Doritos,Snacks,95.84,50.0,30.0,20.0,2875.2,RP-002,Suresh,Working,24.9,Card,2.5,59.0,4.97,98.0,1.0,2025-03-31 18:54:00
VMX-12469,VM-075,Hyderabad,Mall,19-02-2025,02:41:00,P-106,Snickers Bar,Snacks,138.08,171.0,160.0,11.0,22092.8,RP-008,Rahul,Maintenance,24.7,UPI,3.8,49.0,4.94,398.0,1.0,2025-02-19 02:41:00
VMX-12470,VM-107,Delhi,Hospital,29-05-2025,06:35:00,P-109,Doritos,Snacks,45.53,75.0,57.0,18.0,2595.21,RP-012,Anita,Working,17.9,UPI,3.2,60.0,3.88,173.0,1.0,2025-05-29 06:35:00
VMX-12471,VM-092,Kolkata,Hospital,05-05-2025,00:52:00,P-108,Sprite Bottle,Drinks,98.19,103.0,102.0,1.0,10015.38,RP-016,Amit,Maintenance,21.9,UPI,3.7,104.0,1.3,131.0,1.0,2025-05-05 00:52:00
VMX-12472,VM-228,Pune,Metro Station,12-04-2025,05:27:00,P-100,Lays Classic,Snacks,142.83,104.0,93.0,11.0,13283.19,RP-005,Anita,Maintenance,19.5,Card,4.3,65.0,1.98,288.0,0.0,2025-04-12 05:27:00
VMX-12473,VM-270,Pune,Office,04-05-2025,23:32:00,P-106,Snickers Bar,Snacks,143.58,138.0,123.0,15.0,17660.34,RP-020,Ravi,Working,22.8,UPI,3.3,64.0,2.95,181.0,1.0,2025-05-04 23:32:00
VMX-12474,VM-227,Mumbai,Mall,27-01-2025,09:01:00,P-108,Sprite Bottle,Drinks,63.7,177.0,175.0,2.0,11147.5,RP-020,Kiran,Maintenance,24.4,UPI,2.9,106.0,4.0,101.0,1.0,2025-01-27 09:01:00
VMX-12475,VM-147,Hyderabad,Office,26-01-2025,04:01:00,P-107,Colgate Mini,Hygiene,40.86,190.0,174.0,16.0,7109.64,RP-003,Mahesh,Low Power,22.1,Card,2.2,76.0,4.1,193.0,0.0,2025-01-26 04:01:00
VMX-12476,VM-052,Chennai,Metro Station,06-07-2025,14:33:00,P-103,Oreo Pack,Snacks,73.89,66.0,53.0,13.0,3916.17,RP-013,Suresh,Low Power,14.8,Cash,3.7,47.0,1.84,82.0,0.0,2025-07-06 14:33:00
VMX-12477,VM-227,Kolkata,Mall,04-06-2025,11:25:00,P-100,Lays Classic,Snacks,133.52,102.0,86.0,16.0,11482.72,RP-003,Suresh,Low Power,10.9,Cash,4.2,91.0,1.26,390.0,1.0,2025-06-04 11:25:00
VMX-12478,VM-256,Bangalore,College,04-07-2025,13:01:00,P-104,Red Bull,Drinks,89.41,43.0,29.0,14.0,2592.89,RP-006,Ravi,Maintenance,24.0,UPI,2.6,27.0,1.94,354.0,1.0,2025-07-04 13:01:00
VMX-12479,VM-212,Bangalore,College,29-05-2025,18:10:00,P-100,Lays Classic,Snacks,21.68,21.0,18.0,3.0,390.24,RP-018,Rahul,Working,23.8,Cash,4.8,86.0,4.59,57.0,0.0,2025-05-29 18:10:00
VMX-12480,VM-219,Mumbai,College,21-06-2025,08:54:00,P-106,Snickers Bar,Snacks,20.83,154.0,142.0,12.0,2957.86,RP-006,Deepa,Working,24.6,UPI,2.7,69.0,3.89,477.0,1.0,2025-06-21 08:54:00
VMX-12481,VM-027,Hyderabad,Office,17-01-2025,09:21:00,P-107,Colgate Mini,Hygiene,21.68,162.0,162.0,0.0,3512.16,RP-008,Ravi,Maintenance,11.7,UPI,3.8,116.0,4.58,466.0,1.0,2025-01-17 09:21:00
VMX-12482,VM-098,Kolkata,Office,27-07-2025,19:49:00,P-100,Lays Classic,Snacks,126.27,58.0,152.0,15.0,5429.61,RP-016,Rajesh,Maintenance,16.6,Cash,4.5,32.0,4.65,481.0,1.0,2025-07-27 19:49:00
VMX-12483,VM-092,Chennai,Hospital,05-01-2025,08:10:00,P-106,Snickers Bar,Snacks,30.95,140.0,129.0,11.0,3992.55,RP-009,Mahesh,Low Power,18.9,UPI,4.0,88.0,3.0,437.0,0.0,2025-01-05 08:10:00
VMX-12484,VM-256,Hyderabad,College,23-09-2025,05:31:00,P-107,Colgate Mini,Hygiene,57.25,86.0,83.0,3.0,4751.75,RP-010,Fatima,Maintenance,22.4,Cash,3.1,47.0,4.86,60.0,0.0,2025-09-23 05:31:00
VMX-12485,VM-088,Mumbai,Hospital,08-09-2025,01:35:00,P-109,Doritos,Snacks,79.89,104.0,93.0,11.0,7429.77,RP-018,Kiran,Low Power,23.3,UPI,2.8,37.0,1.37,203.0,1.0,2025-09-08 01:35:00
VMX-12486,VM-010,Pune,Metro Station,27-07-2025,15:50:00,P-102,Bisleri Water,Drinks,97.38,86.0,82.0,4.0,7985.16,RP-002,Deepa,Working,11.0,Cash,2.7,85.0,3.05,262.0,0.0,2025-07-27 15:50:00
VMX-12487,VM-131,Hyderabad,Hospital,23-01-2025,09:09:00,P-106,Snickers Bar,Snacks,81.38,178.0,164.0,14.0,13346.32,RP-019,Fatima,Working,14.4,Cash,3.3,48.0,3.64,90.0,1.0,2025-01-23 09:09:00
VMX-12488,VM-185,Pune,Hospital,16-05-2025,07:27:00,P-100,Lays Classic,Snacks,16.17,156.0,154.0,2.0,2490.18,RP-005,Suresh,Maintenance,21.2,UPI,3.2,94.0,1.42,74.0,1.0,2025-05-16 07:27:00
VMX-12489,VM-254,Mumbai,College,15-06-2025,01:01:00,P-104,Red Bull,Drinks,27.01,137.0,135.0,2.0,3646.35,RP-003,Rajesh,Low Power,21.4,Cash,4.1,68.0,4.52,52.0,1.0,2025-06-15 01:01:00
VMX-12490,VM-234,Mumbai,College,26-05-2025,11:23:00,P-107,Colgate Mini,Hygiene,87.5,65.0,49.0,16.0,4287.5,RP-017,Kiran,Low Power,17.2,Cash,3.3,62.0,1.52,97.0,0.0,2025-05-26 11:23:00
VMX-12491,VM-006,Delhi,Metro Station,02-03-2025,08:13:00,P-102,Bisleri Water,Drinks,87.45,79.0,70.0,9.0,6121.5,RP-005,Ravi,Low Power,12.4,Cash,4.2,79.0,2.94,163.0,0.0,2025-03-02 08:13:00
VMX-12492,VM-296,Hyderabad,Mall,28-01-2025,16:43:00,P-106,Snickers Bar,Snacks,143.52,138.0,130.0,8.0,18657.6,RP-002,Deepa,Maintenance,18.8,UPI,4.4,88.0,2.86,499.0,1.0,2025-01-28 16:43:00
VMX-12493,VM-085,Chennai,Hospital,15-01-2025,02:11:00,P-109,Doritos,Snacks,112.83,156.0,139.0,17.0,15683.37,RP-005,Mahesh,Maintenance,13.2,Cash,4.2,110.0,3.24,69.0,0.0,2025-01-15 02:11:00
VMX-12494,VM-087,Delhi,College,05-02-2025,12:55:00,P-105,Dettol Wipe,Hygiene,78.72,188.0,187.0,1.0,14720.64,RP-013,Suresh,Low Power,10.9,UPI,4.8,79.0,2.41,368.0,0.0,2025-02-05 12:55:00
VMX-12495,VM-212,Bangalore,Metro Station,09-02-2025,13:45:00,P-105,Dettol Wipe,Hygiene,27.25,132.0,120.0,12.0,3270.0,RP-013,Deepa,Maintenance,22.9,Card,2.6,109.0,4.95,117.0,1.0,2025-02-09 13:45:00
VMX-12496,VM-074,Kolkata,College,07-09-2025,06:59:00,P-103,Oreo Pack,Snacks,147.31,116.0,100.0,16.0,14731.0,RP-020,Amit,Working,14.9,UPI,3.1,103.0,3.2,60.0,1.0,2025-09-07 06:59:00
VMX-12497,VM-287,Mumbai,College,26-08-2025,06:52:00,P-109,Doritos,Snacks,47.55,176.0,162.0,14.0,7703.1,RP-018,Suresh,Maintenance,23.3,Cash,4.3,6.0,3.56,273.0,1.0,2025-08-26 06:52:00
VMX-12498,VM-289,Bangalore,College,04-05-2025,22:48:00,P-105,Dettol Wipe,Hygiene,85.59,151.0,142.0,9.0,12153.78,RP-001,Anita,Low Power,10.9,Card,4.4,107.0,3.6,262.0,0.0,2025-05-04 22:48:00
VMX-12499,VM-290,Kolkata,Mall,20-01-2025,12:17:00,P-108,Sprite Bottle,Drinks,95.29,180.0,165.0,15.0,15722.85,RP-016,Deepa,Maintenance,22.0,UPI,2.8,113.0,3.44,76.0,1.0,2025-01-20 12:17:00
VMX-12500,VM-251,Delhi,Metro Station,29-08-2025,00:08:00,P-108,Sprite Bottle,Drinks,125,34.0,26.0,8.0,3250.0,RP-019,Mahesh,Working,22.7,UPI,2.8,14.0,4.99,52.0,0.0,2025-08-29 00:08:00
VMX-12501,VM-252,Chennai,Office,07-10-2025,10:58:00,P-105,Dettol Wipe,Hygiene,138.96,32.0,29.0,3.0,4029.84,RP-016,Suresh,Maintenance,17.6,Cash,3.6,23.0,2.94,62.0,1.0,2025-10-07 10:58:00
VMX-12502,VM-177,Chennai,Mall,02-01-2025,14:10:00,P-102,Bisleri Water,Drinks,81.47,148.0,138.0,10.0,11242.86,RP-006,Mahesh,Low Power,20.4,Card,3.1,40.0,4.37,78.0,0.0,2025-01-02 14:10:00
VMX-12503,VM-225,Pune,Metro Station,11-02-2025,02:51:00,P-103,Oreo Pack,Snacks,56.13,84.0,70.0,14.0,3929.1,RP-016,Deepa,Working,20.8,Cash,2.6,110.0,3.49,404.0,0.0,2025-02-11 02:51:00
VMX-12504,VM-048,Kolkata,Office,13-01-2025,11:47:00,P-108,Sprite Bottle,Drinks,98.91,42.0,26.0,16.0,2571.66,RP-004,Amit,Working,24.5,Cash,3.5,80.0,4.7,190.0,1.0,2025-01-13 11:47:00
VMX-12505,VM-079,Mumbai,Hospital,19-04-2025,06:51:00,P-101,Pepsi Can,Drinks,56.37,168.0,149.0,19.0,8399.13,RP-020,Amit,Low Power,18.4,Card,2.8,28.0,3.04,478.0,0.0,2025-04-19 06:51:00
VMX-12506,VM-025,Mumbai,College,02-04-2025,06:38:00,P-100,Lays Classic,Snacks,89.43,58.0,47.0,11.0,4203.21,RP-012,Kiran,Working,16.2,Cash,3.3,19.0,2.21,466.0,0.0,2025-04-02 06:38:00
VMX-12507,VM-161,Pune,College,14-02-2025,04:41:00,P-103,Oreo Pack,Snacks,76.81,176.0,167.0,9.0,12827.27,RP-019,Suresh,Low Power,15.8,UPI,4.6,55.0,2.19,268.0,1.0,2025-02-14 04:41:00
VMX-12508,VM-283,Kolkata,College,24-05-2025,11:26:00,P-103,Oreo Pack,Snacks,21.77,98.0,88.0,10.0,1915.76,RP-012,Mahesh,Maintenance,18.8,Cash,4.7,48.0,3.8,454.0,0.0,2025-05-24 11:26:00
VMX-12509,VM-117,Bangalore,College,03-09-2025,13:49:00,P-108,Sprite Bottle,Drinks,72.68,160.0,142.0,18.0,10320.56,RP-005,Suresh,Working,14.2,Cash,2.7,28.0,3.77,318.0,0.0,2025-09-03 13:49:00
VMX-12510,VM-079,Mumbai,College,16-03-2025,10:01:00,P-101,Pepsi Can,Drinks,102.6,118.0,118.0,0.0,12106.8,RP-009,Mahesh,Working,21.7,Cash,4.3,69.0,4.67,244.0,1.0,2025-03-16 10:01:00
VMX-12511,VM-083,Mumbai,Office,20-03-2025,12:02:00,P-108,Sprite Bottle,Drinks,52.45,30.0,15.0,15.0,786.75,RP-016,Fatima,Maintenance,16.3,UPI,2.6,64.0,1.12,155.0,1.0,2025-03-20 12:02:00
VMX-12512,VM-023,Pune,Hospital,17-03-2025,06:12:00,P-103,Oreo Pack,Snacks,84.19,162.0,146.0,16.0,12291.74,RP-001,Ravi,Maintenance,22.0,Card,3.6,37.0,2.86,75.0,1.0,2025-03-17 06:12:00
VMX-12513,VM-289,Pune,Hospital,12-03-2025,03:00:00,P-105,Dettol Wipe,Hygiene,23.9,197.0,185.0,12.0,4421.5,RP-007,Kiran,Low Power,17.9,Card,2.5,83.0,3.6,500.0,1.0,2025-03-12 03:00:00
VMX-12514,VM-205,Kolkata,Metro Station,08-01-2025,12:49:00,P-108,Sprite Bottle,Drinks,142.64,119.0,119.0,0.0,16974.16,RP-017,Ravi,Working,17.3,Cash,2.9,110.0,1.65,137.0,1.0,2025-01-08 12:49:00
VMX-12515,VM-231,Pune,Mall,07-10-2025,02:43:00,P-106,Snickers Bar,Snacks,55.15,25.0,12.0,13.0,661.8,RP-006,Anita,Working,20.0,Card,4.4,77.0,2.77,161.0,0.0,2025-10-07 02:43:00
VMX-12516,VM-003,Pune,Metro Station,16-05-2025,17:46:00,P-100,Lays Classic,Snacks,88.07,155.0,149.0,6.0,13122.43,RP-012,Anita,Low Power,23.6,UPI,3.7,5.0,4.78,458.0,1.0,2025-05-16 17:46:00
VMX-12517,VM-235,Delhi,Mall,12-06-2025,17:24:00,P-108,Sprite Bottle,Drinks,44.54,85.0,72.0,13.0,3206.88,RP-013,Mahesh,Working,11.5,Cash,4.0,64.0,3.75,266.0,1.0,2025-06-12 17:24:00
VMX-12518,VM-156,Bangalore,College,01-09-2025,20:43:00,P-106,Snickers Bar,Snacks,51.67,101.0,81.0,20.0,4185.27,RP-017,Rajesh,Maintenance,18.3,Card,2.6,67.0,1.69,378.0,1.0,2025-09-01 20:43:00
VMX-12519,VM-012,Chennai,College,27-09-2025,16:31:00,P-103,Oreo Pack,Snacks,71.43,52.0,39.0,13.0,0.0,RP-011,Deepa,Low Power,18.1,Card,2.3,80.0,3.94,152.0,0.0,2025-09-27 16:31:00
VMX-12520,VM-139,Mumbai,Metro Station,23-06-2025,12:08:00,P-104,Red Bull,Drinks,124.6,50.0,35.0,15.0,4361.0,RP-020,Anita,Maintenance,13.8,Cash,4.5,63.0,4.9,0.0,1.0,2025-06-23 12:08:00
VMX-12521,VM-070,Hyderabad,Metro Station,02-09-2025,13:27:00,P-103,Oreo Pack,Snacks,111.14,29.0,18.0,11.0,2000.52,RP-010,Mahesh,Low Power,17.8,Card,4.7,32.0,4.59,441.0,0.0,2025-09-02 13:27:00
VMX-12522,VM-249,Pune,Office,17-07-2025,04:07:00,P-105,Dettol Wipe,Hygiene,71.91,95.0,82.0,13.0,5896.62,RP-014,Deepa,Maintenance,11.9,UPI,4.0,38.0,1.6,221.0,1.0,2025-07-17 04:07:00
VMX-12523,VM-070,Delhi,Hospital,29-01-2025,14:10:00,P-106,Snickers Bar,Snacks,73.62,176.0,171.0,5.0,12589.02,RP-016,Rahul,Low Power,10.7,Card,2.1,40.0,4.96,183.0,0.0,2025-01-29 14:10:00
VMX-12524,VM-270,Bangalore,Mall,28-07-2025,21:34:00,P-103,Oreo Pack,Snacks,82.35,132.0,125.0,7.0,10293.75,RP-020,Amit,Working,22.5,Card,4.3,67.0,2.56,129.0,1.0,2025-07-28 21:34:00
VMX-12525,VM-221,Hyderabad,College,06-04-2025,18:26:00,P-104,Red Bull,Drinks,69.25,148.0,135.0,13.0,9348.75,RP-008,Deepa,Low Power,15.6,UPI,3.9,6.0,3.24,209.0,0.0,2025-04-06 18:26:00
VMX-12526,VM-247,Bangalore,Office,24-03-2025,13:09:00,P-107,Colgate Mini,Hygiene,101.26,40.0,31.0,9.0,3139.06,RP-001,Kiran,Working,10.8,Cash,2.4,54.0,2.65,196.0,1.0,2025-03-24 13:09:00
VMX-12527,VM-019,Pune,College,26-05-2025,19:50:00,P-100,Lays Classic,Snacks,91.97,131.0,129.0,2.0,11864.13,RP-001,Mahesh,Maintenance,11.6,UPI,3.1,85.0,3.37,215.0,1.0,2025-05-26 19:50:00
VMX-12528,VM-266,Kolkata,Office,28-01-2025,03:30:00,P-105,Dettol Wipe,Hygiene,141.99,83.0,82.0,1.0,11643.18,RP-013,Amit,Maintenance,21.0,UPI,4.2,110.0,4.04,403.0,0.0,2025-01-28 03:30:00
VMX-12529,VM-282,Pune,Metro Station,08-03-2025,10:42:00,P-100,Lays Classic,Snacks,137.59,100.0,95.0,5.0,13071.05,RP-015,Suresh,Working,17.5,Cash,2.5,52.0,4.97,241.0,1.0,2025-03-08 10:42:00
VMX-12530,VM-207,Kolkata,College,31-01-2025,20:34:00,P-109,Doritos,Snacks,134.13,31.0,17.0,14.0,2280.21,RP-004,Rajesh,Working,13.2,UPI,2.0,18.0,2.43,61.0,1.0,2025-01-31 20:34:00
VMX-12531,VM-295,Delhi,Office,12-05-2025,07:19:00,P-104,Red Bull,Drinks,34.66,137.0,124.0,13.0,4297.84,RP-014,Deepa,Working,23.8,Card,4.1,45.0,1.24,213.0,0.0,2025-05-12 07:19:00
VMX-12532,VM-008,Bangalore,Metro Station,10-02-2025,02:26:00,P-104,Red Bull,Drinks,79.87,145.0,137.0,8.0,10942.19,RP-012,Rahul,Low Power,12.9,Card,3.6,63.0,2.37,356.0,1.0,2025-02-10 02:26:00
VMX-12533,VM-177,Chennai,Mall,14-05-2025,23:04:00,P-105,Dettol Wipe,Hygiene,88.93,67.0,66.0,1.0,5869.38,RP-017,Amit,Working,10.7,Cash,3.2,120.0,2.1,168.0,0.0,2025-05-14 23:04:00
VMX-12534,VM-143,Chennai,Office,11-09-2025,14:45:00,P-103,Oreo Pack,Snacks,97.8,54.0,35.0,19.0,3423.0,RP-008,Suresh,Maintenance,24.6,Card,4.1,44.0,3.72,318.0,1.0,2025-09-11 14:45:00
VMX-12535,VM-067,Chennai,Hospital,01-06-2025,15:29:00,P-107,Colgate Mini,Hygiene,107.05,92.0,91.0,1.0,9741.55,RP-009,Rahul,Low Power,12.3,Card,4.4,27.0,3.65,201.0,0.0,2025-06-01 15:29:00
VMX-12536,VM-294,Mumbai,Metro Station,08-02-2025,00:02:00,P-109,Doritos,Snacks,121.31,124.0,110.0,14.0,13344.1,RP-010,Anita,Working,19.2,Cash,3.7,31.0,1.26,375.0,1.0,2025-02-08 00:02:00
VMX-12537,VM-179,Pune,Hospital,05-08-2025,11:32:00,P-102,Bisleri Water,Drinks,26.95,148.0,144.0,4.0,3880.8,RP-002,Amit,Low Power,17.7,Cash,2.0,82.0,2.45,338.0,0.0,2025-08-05 11:32:00
VMX-12538,VM-180,Mumbai,Office,28-04-2025,08:43:00,P-105,Dettol Wipe,Hygiene,117.38,155.0,147.0,8.0,17254.86,RP-004,Amit,Working,14.3,UPI,2.8,91.0,4.48,404.0,0.0,2025-04-28 08:43:00
VMX-12539,VM-123,Pune,Office,21-04-2025,02:46:00,P-108,Sprite Bottle,Drinks,118.1,126.0,106.0,20.0,12518.6,RP-020,Anita,Working,14.8,UPI,3.6,100.0,3.62,187.0,1.0,2025-04-21 02:46:00
VMX-12540,VM-084,Hyderabad,College,05-03-2025,04:33:00,P-109,Doritos,Snacks,12.88,140.0,134.0,6.0,1725.92,RP-003,Amit,Low Power,14.6,Cash,2.3,84.0,3.04,213.0,1.0,2025-03-05 04:33:00
VMX-12541,VM-234,Hyderabad,Hospital,22-04-2025,14:40:00,P-104,Red Bull,Drinks,117.54,161.0,145.0,16.0,17043.3,RP-002,Deepa,Working,16.7,Card,3.1,82.0,3.89,376.0,1.0,2025-04-22 14:40:00
VMX-12542,VM-131,Delhi,Mall,16-08-2025,12:11:00,P-102,Bisleri Water,Drinks,63.88,75.0,70.0,5.0,4471.6,RP-005,Kiran,Low Power,16.8,Cash,4.9,63.0,3.43,76.0,1.0,2025-08-16 12:11:00
VMX-12543,VM-265,Mumbai,Hospital,04-05-2025,14:38:00,P-107,Colgate Mini,Hygiene,15.61,151.0,132.0,19.0,2060.52,RP-011,Amit,Maintenance,24.6,Cash,3.9,79.0,2.74,477.0,0.0,2025-05-04 14:38:00
VMX-12544,VM-138,Hyderabad,Metro Station,03-06-2025,11:17:00,P-106,Snickers Bar,Snacks,89.2,47.0,31.0,16.0,2765.2,RP-018,Suresh,Maintenance,23.7,UPI,4.9,113.0,3.27,319.0,0.0,2025-06-03 11:17:00
VMX-12545,VM-181,Hyderabad,Office,21-02-2025,13:51:00,P-106,Snickers Bar,Snacks,123.2,174.0,174.0,0.0,21436.8,RP-020,Rahul,Low Power,12.5,UPI,3.3,102.0,3.17,429.0,1.0,2025-02-21 13:51:00
VMX-12546,VM-229,Pune,Mall,09-04-2025,06:04:00,P-101,Pepsi Can,Drinks,60.56,104.0,97.0,7.0,5874.32,RP-003,Suresh,Maintenance,14.5,UPI,3.0,49.0,4.52,365.0,1.0,2025-04-09 06:04:00
VMX-12547,VM-011,Kolkata,College,26-01-2025,04:07:00,P-101,Pepsi Can,Drinks,130.31,117.0,106.0,11.0,13812.86,RP-002,Amit,Low Power,17.9,UPI,4.0,98.0,3.25,468.0,1.0,2025-01-26 04:07:00
VMX-12548,VM-263,Delhi,College,06-03-2025,10:14:00,P-100,Lays Classic,Snacks,117.58,109.0,106.0,3.0,12463.48,RP-014,Suresh,Working,19.2,Cash,3.0,27.0,4.55,477.0,1.0,2025-03-06 10:14:00
VMX-12549,VM-255,Chennai,Hospital,27-03-2025,22:55:00,P-109,Doritos,Snacks,39.15,162.0,148.0,14.0,5794.2,RP-006,Amit,Low Power,23.7,Card,3.8,40.0,1.78,89.0,1.0,2025-03-27 22:55:00
VMX-12550,VM-014,Mumbai,Office,09-09-2025,04:54:00,P-102,Bisleri Water,Drinks,103.57,72.0,55.0,17.0,5696.35,RP-015,Rahul,Working,21.0,UPI,4.6,38.0,2.0,361.0,1.0,2025-09-09 04:54:00
VMX-12551,VM-295,Kolkata,Hospital,19-05-2025,10:43:00,P-101,Pepsi Can,Drinks,93.12,164.0,152.0,12.0,14154.24,RP-006,Anita,Maintenance,13.0,UPI,2.0,73.0,4.79,416.0,0.0,2025-05-19 10:43:00
VMX-12552,VM-118,Delhi,Hospital,01-07-2025,14:54:00,P-107,Colgate Mini,Hygiene,72.55,190.0,188.0,2.0,13639.4,RP-017,Deepa,Working,19.7,Cash,3.0,14.0,4.58,129.0,1.0,2025-07-01 14:54:00
VMX-12553,VM-273,Mumbai,Hospital,09-04-2025,02:41:00,P-101,Pepsi Can,Drinks,100.48,50.0,50.0,0.0,5024.0,RP-005,Mahesh,Low Power,15.3,Cash,2.8,106.0,3.97,262.0,1.0,2025-04-09 02:41:00
VMX-12554,VM-171,Hyderabad,Office,12-07-2025,00:05:00,P-101,Pepsi Can,Drinks,96.69,123.0,109.0,14.0,10539.21,RP-008,Anita,Working,21.5,Cash,5.0,50.0,3.62,225.0,1.0,2025-07-12 00:05:00
VMX-12555,VM-203,Chennai,Hospital,03-08-2025,20:54:00,P-106,Snickers Bar,Snacks,107.21,138.0,127.0,11.0,13615.67,RP-007,Amit,Maintenance,19.6,UPI,4.9,10.0,4.06,222.0,0.0,2025-08-03 20:54:00
VMX-12556,VM-028,Pune,Office,19-03-2025,07:15:00,P-106,Snickers Bar,Snacks,82.75,177.0,177.0,0.0,14646.75,RP-014,Amit,Working,14.7,UPI,3.9,110.0,2.67,100.0,1.0,2025-03-19 07:15:00
VMX-12557,VM-152,Bangalore,Metro Station,07-01-2025,10:13:00,P-105,Dettol Wipe,Hygiene,40.84,138.0,131.0,7.0,5350.04,RP-020,Mahesh,Low Power,20.6,Cash,3.9,106.0,2.67,346.0,0.0,2025-01-07 10:13:00
VMX-12558,VM-029,Mumbai,College,27-02-2025,11:55:00,P-100,Lays Classic,Snacks,140.84,186.0,174.0,12.0,24506.16,RP-002,Kiran,Low Power,11.8,Card,2.2,55.0,4.39,285.0,0.0,2025-02-27 11:55:00
VMX-12559,VM-294,Delhi,Hospital,03-03-2025,14:42:00,P-105,Dettol Wipe,Hygiene,90.67,88.0,85.0,3.0,7706.95,RP-015,Rahul,Low Power,20.1,Cash,3.8,36.0,2.65,66.0,1.0,2025-03-03 14:42:00
VMX-12560,VM-077,Bangalore,Metro Station,04-08-2025,02:55:00,P-100,Lays Classic,Snacks,86.93,89.0,70.0,19.0,6085.1,RP-017,Suresh,Working,17.7,UPI,3.6,39.0,3.85,281.0,0.0,2025-08-04 02:55:00
VMX-12561,VM-201,Pune,Hospital,26-07-2025,16:47:00,P-104,Red Bull,Drinks,118.88,136.0,125.0,11.0,14860.0,RP-006,Rajesh,Low Power,23.8,Cash,4.8,29.0,1.05,449.0,0.0,2025-07-26 16:47:00
VMX-12562,VM-171,Pune,Office,12-05-2025,15:52:00,P-109,Doritos,Snacks,109.82,36.0,26.0,10.0,2855.32,RP-001,Ravi,Working,22.8,Cash,3.2,109.0,1.61,386.0,0.0,2025-05-12 15:52:00
VMX-12563,VM-010,Pune,Mall,25-09-2025,02:17:00,P-101,Pepsi Can,Drinks,126.94,117.0,103.0,14.0,13074.82,RP-018,Amit,Low Power,21.3,UPI,2.9,77.0,3.57,476.0,0.0,2025-09-25 02:17:00
VMX-12564,VM-086,Delhi,Mall,29-01-2025,18:17:00,P-103,Oreo Pack,Snacks,72.91,127.0,117.0,10.0,8530.47,RP-004,Deepa,Maintenance,16.1,Cash,3.4,68.0,1.34,164.0,0.0,2025-01-29 18:17:00
VMX-12565,VM-196,Kolkata,Metro Station,08-02-2025,22:15:00,P-109,Doritos,Snacks,18.78,47.0,31.0,16.0,582.18,RP-001,Mahesh,Low Power,23.5,Card,2.1,55.0,3.93,194.0,1.0,2025-02-08 22:15:00
VMX-12566,VM-115,Pune,Office,03-02-2025,10:06:00,P-100,Lays Classic,Snacks,117.8,194.0,177.0,17.0,20850.6,RP-005,Rajesh,Maintenance,18.5,Cash,5.0,90.0,3.5,87.0,0.0,2025-02-03 10:06:00
VMX-12567,VM-257,Kolkata,Hospital,28-01-2025,00:39:00,P-106,Snickers Bar,Snacks,120.54,156.0,137.0,19.0,16513.98,RP-002,Kiran,Maintenance,11.1,UPI,2.9,10.0,2.72,377.0,1.0,2025-01-28 00:39:00
VMX-12568,VM-084,Hyderabad,Hospital,19-03-2025,19:17:00,P-106,Snickers Bar,Snacks,23.44,142.0,128.0,14.0,3000.32,RP-016,Mahesh,Maintenance,24.5,UPI,4.2,95.0,4.91,333.0,0.0,2025-03-19 19:17:00
VMX-12569,VM-166,Delhi,Hospital,03-09-2025,15:45:00,P-104,Red Bull,Drinks,149.85,22.0,14.0,8.0,2097.9,RP-006,Anita,Working,10.5,Cash,2.6,46.0,1.26,452.0,1.0,2025-09-03 15:45:00
VMX-12570,VM-078,Delhi,Office,11-08-2025,05:49:00,P-101,Pepsi Can,Drinks,72.63,170.0,153.0,17.0,11112.39,RP-020,Anita,Maintenance,23.9,UPI,2.8,12.0,3.44,351.0,1.0,2025-08-11 05:49:00
VMX-12571,VM-020,Hyderabad,College,08-02-2025,19:36:00,P-108,Sprite Bottle,Drinks,140.51,66.0,55.0,11.0,7728.05,RP-005,Kiran,Working,13.2,Card,4.5,18.0,2.77,434.0,1.0,2025-02-08 19:36:00
VMX-12572,VM-217,Pune,Mall,06-06-2025,21:10:00,P-107,Colgate Mini,Hygiene,17.68,103.0,85.0,18.0,1502.8,RP-008,Rahul,Maintenance,21.2,Card,3.1,25.0,3.78,181.0,0.0,2025-06-06 21:10:00
VMX-12573,VM-174,Mumbai,Hospital,02-03-2025,03:20:00,P-101,Pepsi Can,Drinks,43.75,182.0,182.0,0.0,7962.5,RP-020,Anita,Working,20.1,UPI,4.6,13.0,1.84,329.0,1.0,2025-03-02 03:20:00
VMX-12574,VM-008,Pune,Mall,15-04-2025,15:23:00,P-105,Dettol Wipe,Hygiene,122.84,83.0,78.0,5.0,9581.52,RP-020,Rajesh,Working,11.8,UPI,4.7,104.0,2.28,398.0,0.0,2025-04-15 15:23:00
VMX-12575,VM-292,Chennai,Hospital,19-02-2025,23:13:00,P-102,Bisleri Water,Drinks,49.03,84.0,80.0,4.0,3922.4,RP-019,Kiran,Low Power,24.1,Cash,3.7,62.0,1.79,164.0,1.0,2025-02-19 23:13:00
VMX-12576,VM-023,Chennai,Metro Station,16-06-2025,23:33:00,P-100,Lays Classic,Snacks,11.72,86.0,76.0,10.0,890.72,RP-006,Rahul,Low Power,10.6,Card,3.6,66.0,2.52,237.0,1.0,2025-06-16 23:33:00
VMX-12577,VM-232,Hyderabad,Hospital,07-04-2025,23:47:00,P-108,Sprite Bottle,Drinks,71.7,66.0,48.0,18.0,3441.6,RP-006,Deepa,Maintenance,24.3,Card,2.7,2.0,3.09,238.0,1.0,2025-04-07 23:47:00
VMX-12578,VM-104,Delhi,College,03-08-2025,04:48:00,P-108,Sprite Bottle,Drinks,28.62,193.0,189.0,4.0,5409.18,RP-014,Rajesh,Low Power,22.7,Cash,2.3,25.0,4.4,375.0,1.0,2025-08-03 04:48:00
VMX-12579,VM-228,Mumbai,Office,18-02-2025,09:59:00,P-100,Lays Classic,Snacks,148.35,75.0,66.0,9.0,9791.1,RP-013,Fatima,Maintenance,20.4,UPI,2.6,62.0,1.36,275.0,1.0,2025-02-18 09:59:00
VMX-12580,VM-277,Pune,Metro Station,08-05-2025,16:11:00,P-100,Lays Classic,Snacks,83.5,196.0,186.0,10.0,15531.0,RP-003,Amit,Maintenance,12.3,Cash,5.0,111.0,3.45,460.0,1.0,2025-05-08 16:11:00
VMX-12581,VM-148,Chennai,College,07-09-2025,12:17:00,P-107,Colgate Mini,Hygiene,106.31,113.0,107.0,6.0,11375.17,RP-006,Deepa,Low Power,12.3,Cash,2.5,69.0,4.86,386.0,0.0,2025-09-07 12:17:00
VMX-12582,VM-198,Hyderabad,Mall,09-03-2025,18:36:00,P-104,Red Bull,Drinks,118.03,85.0,77.0,8.0,9088.31,RP-017,Mahesh,Low Power,11.1,Card,4.6,48.0,1.18,423.0,1.0,2025-03-09 18:36:00
VMX-12583,VM-019,Mumbai,Metro Station,15-05-2025,10:04:00,P-109,Doritos,Snacks,92.97,186.0,180.0,6.0,16734.6,RP-007,Fatima,Maintenance,12.3,Cash,2.2,18.0,4.9,314.0,1.0,2025-05-15 10:04:00
VMX-12584,VM-254,Kolkata,College,17-09-2025,11:44:00,P-100,Lays Classic,Snacks,52.86,67.0,52.0,15.0,2748.72,RP-002,Suresh,Low Power,19.8,Card,2.0,48.0,3.39,383.0,1.0,2025-09-17 11:44:00
VMX-12585,VM-038,Bangalore,Mall,16-07-2025,19:19:00,P-102,Bisleri Water,Drinks,54.24,28.0,10.0,18.0,542.4,RP-011,Amit,Maintenance,17.9,Card,3.7,101.0,4.29,396.0,1.0,2025-07-16 19:19:00
VMX-12586,VM-090,Bangalore,Hospital,24-08-2025,03:18:00,P-100,Lays Classic,Snacks,83.54,43.0,43.0,0.0,3592.22,RP-001,Suresh,Low Power,17.7,Card,4.0,71.0,3.65,196.0,1.0,2025-08-24 03:18:00
VMX-12587,VM-221,Kolkata,Hospital,27-02-2025,06:11:00,P-104,Red Bull,Drinks,39.32,144.0,140.0,4.0,5504.8,RP-016,Kiran,Working,23.0,Cash,4.3,9.0,3.86,88.0,0.0,2025-02-27 06:11:00
VMX-12588,VM-292,Mumbai,Office,24-01-2025,18:30:00,P-104,Red Bull,Drinks,42.61,96.0,89.0,7.0,3792.29,RP-013,Fatima,Maintenance,21.8,Cash,2.4,15.0,3.22,66.0,0.0,2025-01-24 18:30:00
VMX-12589,VM-047,Delhi,Mall,25-08-2025,05:38:00,P-108,Sprite Bottle,Drinks,128.75,140.0,132.0,8.0,16995.0,RP-004,Ravi,Working,24.5,UPI,3.9,56.0,2.24,53.0,0.0,2025-08-25 05:38:00
VMX-12590,VM-271,Hyderabad,Hospital,10-03-2025,02:31:00,P-100,Lays Classic,Snacks,28.36,74.0,71.0,3.0,2013.56,RP-001,Anita,Working,20.5,Cash,3.5,40.0,3.1,332.0,0.0,2025-03-10 02:31:00
VMX-12591,VM-013,Kolkata,Office,13-01-2025,13:13:00,P-101,Pepsi Can,Drinks,84.63,176.0,171.0,5.0,14471.73,RP-004,Kiran,Low Power,12.0,UPI,2.5,50.0,1.36,340.0,0.0,2025-01-13 13:13:00
VMX-12592,VM-036,Mumbai,Metro Station,22-01-2025,00:57:00,P-100,Lays Classic,Snacks,90.47,77.0,74.0,3.0,6694.78,RP-006,Deepa,Working,13.4,Card,2.5,24.0,3.17,59.0,0.0,2025-01-22 00:57:00
VMX-12593,VM-287,Kolkata,College,16-01-2025,18:41:00,P-103,Oreo Pack,Snacks,102.75,28.0,23.0,5.0,2363.25,RP-020,Anita,Working,11.1,UPI,3.2,49.0,1.33,410.0,0.0,2025-01-16 18:41:00
VMX-12594,VM-019,Delhi,Office,15-03-2025,15:10:00,P-106,Snickers Bar,Snacks,15.02,139.0,124.0,15.0,1862.48,RP-012,Mahesh,Maintenance,20.7,Card,2.0,94.0,4.37,154.0,1.0,2025-03-15 15:10:00
VMX-12595,VM-096,Mumbai,Mall,14-01-2025,03:25:00,P-103,Oreo Pack,Snacks,43.74,72.0,61.0,11.0,2668.14,RP-011,Ravi,Working,14.7,Card,2.8,120.0,1.48,175.0,0.0,2025-01-14 03:25:00
VMX-12596,VM-065,Hyderabad,Metro Station,16-04-2025,07:42:00,P-105,Dettol Wipe,Hygiene,103.18,106.0,103.0,3.0,10627.54,RP-013,Rajesh,Working,10.8,Card,4.5,105.0,4.17,200.0,0.0,2025-04-16 07:42:00
VMX-12597,VM-215,Mumbai,Office,23-06-2025,18:40:00,P-107,Colgate Mini,Hygiene,53.32,183.0,177.0,6.0,9437.64,RP-008,Suresh,Maintenance,10.7,UPI,2.7,66.0,4.82,235.0,1.0,2025-06-23 18:40:00
VMX-12598,VM-006,Hyderabad,Metro Station,13-06-2025,16:01:00,P-104,Red Bull,Drinks,38.09,174.0,171.0,3.0,6513.39,RP-010,Ravi,Low Power,12.1,UPI,3.5,5.0,1.37,208.0,1.0,2025-06-13 16:01:00
VMX-12599,VM-010,Bangalore,Metro Station,20-07-2025,11:00:00,P-108,Sprite Bottle,Drinks,43.76,51.0,43.0,8.0,1881.68,RP-009,Deepa,Low Power,17.7,Card,4.2,37.0,2.55,430.0,1.0,2025-07-20 11:00:00
VMX-12600,VM-087,Hyderabad,College,11-01-2025,04:13:00,P-102,Bisleri Water,Drinks,18.21,148.0,145.0,3.0,2640.45,RP-013,Deepa,Working,19.0,Card,4.8,0.0,2.62,58.0,0.0,2025-01-11 04:13:00
VMX-12601,VM-297,Bangalore,Hospital,25-06-2025,03:58:00,P-107,Colgate Mini,Hygiene,117.19,28.0,14.0,14.0,1640.66,RP-015,Rajesh,Maintenance,15.3,Cash,2.8,12.0,4.54,381.0,0.0,2025-06-25 03:58:00
VMX-12602,VM-221,Chennai,Hospital,26-05-2025,06:46:00,P-102,Bisleri Water,Drinks,104.31,151.0,131.0,20.0,13664.61,RP-018,Fatima,Maintenance,17.5,Cash,2.0,113.0,1.01,482.0,1.0,2025-05-26 06:46:00
VMX-12603,VM-250,Mumbai,Office,23-06-2025,07:18:00,P-101,Pepsi Can,Drinks,134.57,78.0,66.0,12.0,8881.62,RP-003,Anita,Low Power,21.8,Card,4.9,110.0,3.98,108.0,1.0,2025-06-23 07:18:00
VMX-12604,VM-182,Hyderabad,Metro Station,06-07-2025,18:23:00,P-104,Red Bull,Drinks,57.2,36.0,27.0,9.0,1544.4,RP-002,Mahesh,Working,19.4,Cash,4.9,92.0,3.33,206.0,1.0,2025-07-06 18:23:00
VMX-12605,VM-072,Pune,Office,11-03-2025,14:44:00,P-103,Oreo Pack,Snacks,146.34,128.0,120.0,8.0,17560.8,RP-007,Kiran,Maintenance,11.4,Card,2.1,66.0,4.76,183.0,1.0,2025-03-11 14:44:00
VMX-12606,VM-227,Hyderabad,Mall,09-08-2025,21:19:00,P-100,Lays Classic,Snacks,100.3,49.0,41.0,8.0,4112.3,RP-007,Kiran,Working,16.6,Cash,3.5,100.0,2.71,135.0,0.0,2025-08-09 21:19:00
VMX-12607,VM-048,Mumbai,Hospital,11-02-2025,06:16:00,P-105,Dettol Wipe,Hygiene,33.77,102.0,96.0,6.0,3241.92,RP-006,Amit,Maintenance,10.4,Card,3.0,118.0,1.28,239.0,1.0,2025-02-11 06:16:00
VMX-12608,VM-282,Chennai,Metro Station,19-01-2025,11:49:00,P-100,Lays Classic,Snacks,23.47,83.0,69.0,14.0,1619.43,RP-006,Fatima,Working,16.7,Card,2.6,96.0,4.39,430.0,1.0,2025-01-19 11:49:00
VMX-12609,VM-300,Mumbai,Office,06-10-2025,05:51:00,P-109,Doritos,Snacks,98.28,46.0,46.0,0.0,4520.88,RP-014,Ravi,Working,22.2,UPI,2.9,35.0,3.88,478.0,1.0,2025-10-06 05:51:00
VMX-12610,VM-025,Pune,Office,15-07-2025,05:21:00,P-106,Snickers Bar,Snacks,46.36,162.0,151.0,11.0,7000.36,RP-012,Mahesh,Maintenance,20.2,Card,4.6,113.0,4.77,176.0,0.0,2025-07-15 05:21:00
VMX-12611,VM-062,Hyderabad,Mall,29-03-2025,16:27:00,P-105,Dettol Wipe,Hygiene,75.59,23.0,5.0,18.0,377.95,RP-017,Deepa,Maintenance,15.0,Cash,2.8,67.0,3.7,128.0,1.0,2025-03-29 16:27:00
VMX-12612,VM-289,Hyderabad,Metro Station,05-10-2025,13:21:00,P-105,Dettol Wipe,Hygiene,29.73,83.0,78.0,5.0,2318.94,RP-004,Rahul,Maintenance,10.5,UPI,2.6,109.0,1.82,359.0,0.0,2025-10-05 13:21:00
VMX-12613,VM-278,Bangalore,College,23-04-2025,00:46:00,P-105,Dettol Wipe,Hygiene,37.27,130.0,115.0,15.0,4286.05,RP-008,Fatima,Maintenance,14.3,Cash,4.2,81.0,2.9,455.0,1.0,2025-04-23 00:46:00
VMX-12614,VM-169,Hyderabad,Hospital,04-03-2025,23:01:00,P-109,Doritos,Snacks,29.92,196.0,194.0,2.0,5804.48,RP-004,Rahul,Low Power,10.5,UPI,4.9,37.0,4.89,438.0,1.0,2025-03-04 23:01:00
VMX-12615,VM-159,Bangalore,Metro Station,12-08-2025,18:07:00,P-105,Dettol Wipe,Hygiene,141.07,91.0,91.0,0.0,12837.37,RP-015,Kiran,Low Power,13.1,Card,2.9,14.0,4.09,374.0,1.0,2025-08-12 18:07:00
VMX-12616,VM-237,Pune,Mall,11-06-2025,19:58:00,P-105,Dettol Wipe,Hygiene,67.84,128.0,109.0,19.0,7394.56,RP-019,Kiran,Working,21.1,Cash,2.5,60.0,1.87,185.0,0.0,2025-06-11 19:58:00
VMX-12617,VM-021,Chennai,Hospital,10-02-2025,18:42:00,P-107,Colgate Mini,Hygiene,115.85,68.0,48.0,20.0,5560.8,RP-013,Deepa,Maintenance,22.1,Cash,4.8,33.0,1.25,169.0,1.0,2025-02-10 18:42:00
VMX-12618,Unknown,Bangalore,Metro Station,23-09-2025,20:54:00,P-103,Oreo Pack,Snacks,12.95,134.0,122.0,12.0,1579.9,RP-017,Rajesh,Low Power,22.2,Card,2.3,81.0,3.99,67.0,1.0,2025-09-23 20:54:00
VMX-12619,VM-096,Kolkata,Mall,23-03-2025,21:17:00,P-101,Pepsi Can,Drinks,91.62,140.0,140.0,0.0,12826.8,RP-014,Suresh,Low Power,13.8,Card,2.6,31.0,3.14,84.0,0.0,2025-03-23 21:17:00
VMX-12620,VM-177,Kolkata,Hospital,28-05-2025,02:12:00,P-101,Pepsi Can,Drinks,83.57,87.0,81.0,6.0,6769.17,RP-004,Kiran,Maintenance,18.4,UPI,2.4,13.0,3.96,196.0,1.0,2025-05-28 02:12:00
VMX-12621,VM-237,Pune,Hospital,16-08-2025,06:16:00,P-106,Snickers Bar,Snacks,139.53,63.0,63.0,0.0,8790.39,RP-008,Deepa,Low Power,11.8,UPI,4.8,101.0,4.74,495.0,1.0,2025-08-16 06:16:00
VMX-12622,VM-274,Chennai,Metro Station,20-02-2025,12:32:00,P-107,Colgate Mini,Hygiene,136.38,69.0,67.0,2.0,9137.46,RP-006,Kiran,Low Power,13.5,Card,4.2,1.0,3.18,381.0,1.0,2025-02-20 12:32:00
VMX-12623,VM-188,Mumbai,Metro Station,02-06-2025,17:42:00,P-103,Oreo Pack,Snacks,86.83,31.0,28.0,3.0,2431.24,RP-004,Kiran,Low Power,23.5,Cash,3.6,6.0,4.56,455.0,1.0,2025-06-02 17:42:00
VMX-12624,VM-206,Kolkata,Mall,08-03-2025,09:18:00,P-101,Pepsi Can,Drinks,81.16,178.0,177.0,1.0,14365.32,RP-018,Fatima,Working,16.5,UPI,2.6,88.0,2.51,465.0,1.0,2025-03-08 09:18:00
VMX-12625,VM-100,Delhi,College,10-02-2025,08:36:00,P-103,Oreo Pack,Snacks,116.97,131.0,125.0,6.0,14621.25,RP-017,Ravi,Working,16.8,Cash,4.3,75.0,3.95,316.0,0.0,2025-02-10 08:36:00
VMX-12626,VM-118,Chennai,Metro Station,02-01-2025,20:33:00,P-104,Red Bull,Drinks,57.51,186.0,179.0,7.0,10294.29,RP-004,Ravi,Low Power,14.3,UPI,2.8,23.0,3.9,151.0,1.0,2025-01-02 20:33:00
VMX-12627,VM-083,Delhi,Hospital,01-09-2025,20:08:00,P-108,Sprite Bottle,Drinks,123.38,72.0,65.0,7.0,8019.7,RP-018,Ravi,Maintenance,11.1,UPI,4.7,84.0,3.32,236.0,0.0,2025-09-01 20:08:00
VMX-12628,VM-209,Hyderabad,Mall,23-07-2025,15:04:00,P-100,Lays Classic,Snacks,140.55,42.0,36.0,6.0,5059.8,RP-008,Fatima,Low Power,11.1,Card,3.4,66.0,2.82,56.0,0.0,2025-07-23 15:04:00
VMX-12629,VM-129,Pune,Metro Station,30-08-2025,05:26:00,P-108,Sprite Bottle,Drinks,79.04,173.0,173.0,0.0,13673.92,RP-003,Mahesh,Low Power,20.4,Cash,3.8,53.0,2.92,88.0,0.0,2025-08-30 05:26:00
VMX-12630,VM-277,Chennai,Metro Station,24-04-2025,19:41:00,P-108,Sprite Bottle,Drinks,81.5,82.0,68.0,14.0,5542.0,RP-008,Mahesh,Maintenance,23.4,Cash,4.4,82.0,4.82,99.0,1.0,2025-04-24 19:41:00
VMX-12631,VM-216,Pune,Metro Station,12-06-2025,07:52:00,P-106,Snickers Bar,Snacks,90.1,83.0,65.0,18.0,5856.5,RP-005,Suresh,Working,10.6,Cash,3.9,104.0,3.05,100.0,0.0,2025-06-12 07:52:00
VMX-12632,VM-200,Mumbai,Metro Station,29-04-2025,01:52:00,P-105,Dettol Wipe,Hygiene,70.45,192.0,187.0,5.0,13174.15,RP-001,Ravi,Maintenance,18.6,UPI,3.5,10.0,2.11,89.0,0.0,2025-04-29 01:52:00
VMX-12633,VM-082,Hyderabad,Metro Station,31-05-2025,14:06:00,P-108,Sprite Bottle,Drinks,134.23,20.0,12.0,8.0,1610.76,RP-007,Kiran,Working,14.3,UPI,2.9,42.0,2.61,159.0,1.0,2025-05-31 14:06:00
VMX-12634,VM-114,Kolkata,Mall,05-02-2025,15:59:00,P-108,Sprite Bottle,Drinks,100.52,162.0,149.0,13.0,14977.48,RP-015,Rajesh,Low Power,10.4,UPI,4.9,24.0,3.44,382.0,1.0,2025-02-05 15:59:00
VMX-12635,VM-243,Chennai,College,26-01-2025,13:23:00,P-101,Pepsi Can,Drinks,108.83,124.0,107.0,17.0,11644.81,RP-014,Rahul,Maintenance,13.8,Cash,4.9,53.0,2.62,412.0,0.0,2025-01-26 13:23:00
VMX-12636,VM-182,Bangalore,Office,13-02-2025,16:17:00,P-103,Oreo Pack,Snacks,76.59,115.0,102.0,13.0,7812.18,RP-016,Rajesh,Low Power,20.7,Card,3.1,17.0,3.75,191.0,1.0,2025-02-13 16:17:00
VMX-12637,VM-226,Chennai,Office,20-09-2025,22:12:00,P-108,Sprite Bottle,Drinks,42.72,38.0,21.0,17.0,897.12,RP-018,Rahul,Working,12.9,Card,4.7,48.0,1.15,116.0,1.0,2025-09-20 22:12:00
VMX-12638,VM-032,Bangalore,College,19-07-2025,15:40:00,P-104,Red Bull,Drinks,55.42,66.0,55.0,11.0,3048.1,RP-016,Fatima,Working,19.3,Card,3.7,116.0,1.29,253.0,0.0,2025-07-19 15:40:00
VMX-12639,VM-150,Hyderabad,Mall,17-04-2025,05:37:00,P-100,Lays Classic,Snacks,144.75,132.0,119.0,13.0,17225.25,RP-017,Mahesh,Low Power,13.2,UPI,2.3,20.0,2.75,470.0,0.0,2025-04-17 05:37:00
VMX-12640,VM-212,Kolkata,College,03-03-2025,00:33:00,P-108,Sprite Bottle,Drinks,112.36,101.0,91.0,10.0,10224.76,RP-020,Rahul,Low Power,23.8,Cash,4.6,108.0,3.9,307.0,0.0,2025-03-03 00:33:00
VMX-12641,VM-156,Hyderabad,Mall,01-05-2025,04:39:00,P-109,Doritos,Snacks,120.7,193.0,191.0,2.0,23053.7,RP-016,Deepa,Maintenance,14.4,UPI,4.7,8.0,4.55,256.0,1.0,2025-05-01 04:39:00
VMX-12642,VM-109,Delhi,Mall,04-06-2025,16:24:00,P-107,Colgate Mini,Hygiene,61.02,101.0,86.0,15.0,5247.72,RP-018,Ravi,Working,20.3,Card,3.5,95.0,4.02,451.0,1.0,2025-06-04 16:24:00
VMX-12643,VM-146,Hyderabad,College,03-09-2025,06:33:00,P-106,Snickers Bar,Snacks,18.3,106.0,96.0,10.0,1756.8,RP-019,Kiran,Working,21.7,Card,3.3,48.0,4.31,258.0,0.0,2025-09-03 06:33:00
VMX-12644,VM-085,Chennai,Office,13-07-2025,12:01:00,P-105,Dettol Wipe,Hygiene,37.12,40.0,26.0,14.0,965.12,RP-012,Kiran,Maintenance,16.9,Card,2.3,10.0,2.17,167.0,1.0,2025-07-13 12:01:00
VMX-12645,VM-202,Kolkata,College,20-06-2025,11:16:00,P-109,Doritos,Snacks,146.52,104.0,90.0,14.0,13186.8,RP-013,Fatima,Working,14.0,Cash,3.3,47.0,1.78,495.0,0.0,2025-06-20 11:16:00
VMX-12646,VM-026,Pune,College,24-07-2025,12:46:00,P-104,Red Bull,Drinks,95.12,170.0,157.0,13.0,14933.84,RP-017,Rajesh,Low Power,17.8,Cash,2.9,37.0,3.56,148.0,1.0,2025-07-24 12:46:00
VMX-12647,VM-071,Kolkata,Hospital,14-05-2025,10:06:00,P-103,Oreo Pack,Snacks,141.27,154.0,140.0,14.0,19777.8,RP-004,Rahul,Working,23.0,Card,2.2,21.0,1.63,430.0,0.0,2025-05-14 10:06:00
VMX-12648,VM-084,Hyderabad,Mall,31-05-2025,06:04:00,P-100,Lays Classic,Snacks,94.09,196.0,187.0,9.0,17594.83,RP-009,Deepa,Low Power,22.5,Card,3.8,3.0,4.68,293.0,0.0,2025-05-31 06:04:00
VMX-12649,VM-196,Delhi,Mall,09-03-2025,07:03:00,P-105,Dettol Wipe,Hygiene,66.15,162.0,147.0,15.0,9724.05,RP-014,Deepa,Low Power,23.0,Cash,3.3,9.0,3.59,239.0,0.0,2025-03-09 07:03:00
VMX-12650,VM-195,Mumbai,Metro Station,06-09-2025,14:30:00,P-100,Lays Classic,Snacks,49.87,80.0,68.0,12.0,3391.16,RP-012,Rahul,Maintenance,20.4,Cash,4.2,92.0,4.81,188.0,1.0,2025-09-06 14:30:00
VMX-12651,VM-169,Kolkata,Hospital,04-08-2025,15:20:00,P-107,Colgate Mini,Hygiene,40.54,40.0,22.0,18.0,891.88,RP-019,Ravi,Working,10.5,Card,2.9,33.0,3.68,133.0,1.0,2025-08-04 15:20:00
VMX-12652,VM-207,Pune,Office,13-07-2025,18:28:00,P-104,Red Bull,Drinks,38.47,155.0,151.0,4.0,5808.97,RP-004,Suresh,Maintenance,15.8,UPI,2.8,69.0,3.08,480.0,1.0,2025-07-13 18:28:00
VMX-12653,VM-290,Hyderabad,Office,23-09-2025,13:14:00,P-109,Doritos,Snacks,132.03,152.0,137.0,15.0,18088.11,RP-004,Fatima,Maintenance,13.6,Card,2.1,92.0,4.6,196.0,0.0,2025-09-23 13:14:00
VMX-12654,VM-028,Mumbai,Mall,23-05-2025,05:29:00,P-104,Red Bull,Drinks,120.59,86.0,72.0,14.0,8682.48,RP-012,Anita,Low Power,15.2,Cash,3.4,52.0,1.25,358.0,1.0,2025-05-23 05:29:00
VMX-12655,VM-029,Mumbai,Office,01-09-2025,08:57:00,P-104,Red Bull,Drinks,74.41,186.0,181.0,5.0,13468.21,RP-003,Rahul,Working,19.2,UPI,3.1,0.0,1.96,329.0,0.0,2025-09-01 08:57:00
VMX-12656,VM-059,Delhi,College,10-06-2025,13:33:00,P-108,Sprite Bottle,Drinks,141.69,27.0,20.0,7.0,2833.8,RP-018,Deepa,Maintenance,17.4,UPI,2.0,92.0,2.88,65.0,0.0,2025-06-10 13:33:00
VMX-12657,VM-089,Chennai,Hospital,21-04-2025,19:40:00,P-103,Oreo Pack,Snacks,90.6,192.0,173.0,19.0,15673.8,RP-015,Rahul,Low Power,20.4,UPI,4.3,103.0,2.58,175.0,0.0,2025-04-21 19:40:00
VMX-12658,VM-209,Delhi,Hospital,26-07-2025,05:26:00,P-107,Colgate Mini,Hygiene,118.88,37.0,21.0,16.0,2496.48,RP-017,Kiran,Working,16.1,Cash,4.4,97.0,3.25,156.0,0.0,2025-07-26 05:26:00
VMX-12659,VM-265,Mumbai,Office,29-07-2025,04:19:00,P-103,Oreo Pack,Snacks,11.45,70.0,66.0,4.0,755.7,RP-001,Rahul,Low Power,16.0,UPI,4.4,35.0,3.27,281.0,0.0,2025-07-29 04:19:00
VMX-12660,VM-173,Chennai,College,08-05-2025,08:36:00,P-105,Dettol Wipe,Hygiene,41.5,96.0,88.0,8.0,3652.0,RP-005,Ravi,Maintenance,17.0,Cash,2.1,69.0,3.61,484.0,0.0,2025-05-08 08:36:00
VMX-12661,VM-273,Hyderabad,College,11-05-2025,16:10:00,P-102,Bisleri Water,Drinks,130.97,177.0,170.0,7.0,22264.9,RP-019,Amit,Working,15.3,UPI,3.0,36.0,3.53,254.0,1.0,2025-05-11 16:10:00
VMX-12662,VM-112,Bangalore,College,10-02-2025,19:10:00,P-109,Doritos,Snacks,68.63,30.0,29.0,1.0,1990.27,RP-011,Amit,Low Power,10.2,UPI,4.7,15.0,4.71,376.0,1.0,2025-02-10 19:10:00
VMX-12663,Unknown,Kolkata,College,25-08-2025,13:33:00,P-105,Dettol Wipe,Hygiene,81.96,88.0,84.0,4.0,6884.64,RP-006,Rajesh,Low Power,22.2,Card,4.9,73.0,3.97,151.0,0.0,2025-08-25 13:33:00
VMX-12664,VM-048,Pune,Office,09-06-2025,00:00:00,P-103,Oreo Pack,Snacks,43.46,104.0,91.0,13.0,3954.86,RP-009,Deepa,Low Power,15.9,UPI,2.3,111.0,4.31,392.0,0.0,2025-06-09 00:00:00
VMX-12665,VM-008,Bangalore,College,01-08-2025,09:04:00,P-109,Doritos,Snacks,127.77,113.0,112.0,1.0,14310.24,RP-018,Anita,Working,19.5,UPI,4.7,85.0,1.72,258.0,1.0,2025-08-01 09:04:00
VMX-12666,VM-186,Chennai,Hospital,09-07-2025,22:57:00,P-102,Bisleri Water,Drinks,39.67,182.0,169.0,13.0,6704.23,RP-003,Amit,Maintenance,22.0,Cash,4.3,69.0,2.12,260.0,1.0,2025-07-09 22:57:00
VMX-12667,VM-263,Pune,Mall,08-02-2025,19:52:00,P-102,Bisleri Water,Drinks,error,97.0,96.0,1.0,6814.08,RP-017,Rahul,Working,23.4,Card,2.6,42.0,4.93,223.0,1.0,2025-02-08 19:52:00
VMX-12668,VM-217,Kolkata,College,30-09-2025,21:55:00,P-102,Bisleri Water,Drinks,58,130.0,126.0,4.0,7308.0,RP-016,Fatima,Working,22.5,Cash,4.3,64.0,2.13,414.0,1.0,2025-09-30 21:55:00
VMX-12669,VM-140,Pune,College,23-01-2025,14:43:00,P-105,Dettol Wipe,Hygiene,128.55,82.0,74.0,8.0,9512.7,RP-017,Deepa,Working,15.6,Card,4.7,17.0,3.68,76.0,1.0,2025-01-23 14:43:00
VMX-12670,VM-206,Pune,College,09-02-2025,04:03:00,P-105,Dettol Wipe,Hygiene,117.64,126.0,115.0,11.0,13528.6,RP-014,Ravi,Working,19.4,Card,3.0,75.0,2.82,377.0,1.0,2025-02-09 04:03:00
VMX-12671,VM-140,Mumbai,Office,02-03-2025,10:34:00,P-102,Bisleri Water,Drinks,55.95,20.0,13.0,7.0,727.35,RP-008,Rahul,Low Power,14.1,Cash,3.6,88.0,2.28,394.0,0.0,2025-03-02 10:34:00
VMX-12672,VM-025,Mumbai,Metro Station,25-02-2025,18:22:00,P-100,Lays Classic,Snacks,91.82,62.0,56.0,6.0,5141.92,RP-016,Suresh,Working,23.2,UPI,4.1,74.0,1.11,69.0,0.0,2025-02-25 18:22:00
VMX-12673,VM-082,Mumbai,Mall,06-04-2025,23:39:00,P-104,Red Bull,Drinks,98.76,181.0,175.0,6.0,17283.0,RP-001,Deepa,Maintenance,15.5,Card,3.1,44.0,4.76,421.0,1.0,2025-04-06 23:39:00
VMX-12674,VM-177,Delhi,Hospital,12-09-2025,11:24:00,P-102,Bisleri Water,Drinks,134.34,97.0,78.0,19.0,10478.52,RP-018,Suresh,Working,18.9,Card,3.7,37.0,1.83,65.0,1.0,2025-09-12 11:24:00
VMX-12675,VM-226,Pune,Mall,30-06-2025,14:35:00,P-101,Pepsi Can,Drinks,145.95,149.0,133.0,16.0,19411.35,RP-017,Mahesh,Maintenance,22.7,UPI,3.4,92.0,4.48,310.0,0.0,2025-06-30 14:35:00
VMX-12676,VM-288,Mumbai,Office,06-02-2025,17:38:00,P-109,Doritos,Snacks,72.4,70.0,70.0,0.0,5068.0,RP-019,Fatima,Low Power,16.1,Card,4.1,2.0,4.33,435.0,1.0,2025-02-06 17:38:00
VMX-12677,VM-002,Bangalore,Mall,13-07-2025,20:29:00,P-105,Dettol Wipe,Hygiene,131.67,60.0,50.0,10.0,6583.5,RP-015,Ravi,Maintenance,22.1,Card,3.3,66.0,2.81,218.0,0.0,2025-07-13 20:29:00
VMX-12678,VM-065,Hyderabad,Office,18-01-2025,15:21:00,P-109,Doritos,Snacks,87.3,28.0,24.0,4.0,2095.2,RP-013,Rahul,Working,23.3,UPI,2.6,2.0,3.53,472.0,1.0,2025-01-18 15:21:00
VMX-12679,VM-153,Delhi,Office,27-03-2025,01:09:00,P-108,Sprite Bottle,Drinks,45.2,146.0,140.0,6.0,6328.0,RP-009,Mahesh,Maintenance,17.2,Card,2.3,61.0,1.32,327.0,0.0,2025-03-27 01:09:00
VMX-12680,VM-093,Pune,College,23-07-2025,15:58:00,P-101,Pepsi Can,Drinks,19.46,34.0,28.0,6.0,544.88,RP-013,Rahul,Maintenance,13.8,Cash,4.7,10.0,4.92,447.0,1.0,2025-07-23 15:58:00
VMX-12681,VM-294,Bangalore,Office,03-02-2025,00:31:00,P-106,Snickers Bar,Snacks,102.72,90.0,75.0,15.0,7704.0,RP-006,Rajesh,Low Power,16.3,Cash,5.0,90.0,1.1,176.0,0.0,2025-02-03 00:31:00
VMX-12682,VM-269,Bangalore,Mall,17-07-2025,02:40:00,P-103,Oreo Pack,Snacks,11.6,21.0,19.0,2.0,220.4,RP-003,Deepa,Working,24.8,Cash,2.2,63.0,2.18,463.0,1.0,2025-07-17 02:40:00
VMX-12683,VM-013,Kolkata,Office,20-01-2025,17:24:00,P-106,Snickers Bar,Snacks,109.59,88.0,82.0,6.0,8986.38,RP-005,Fatima,Maintenance,13.5,UPI,3.5,27.0,1.52,203.0,1.0,2025-01-20 17:24:00
VMX-12684,VM-202,Hyderabad,Hospital,20-01-2025,12:03:00,P-104,Red Bull,Drinks,147.97,141.0,138.0,3.0,20419.86,RP-015,Unknown,Low Power,23.6,Card,3.6,79.0,1.66,180.0,0.0,2025-01-20 12:03:00
VMX-12685,VM-258,Delhi,Office,24-03-2025,19:01:00,P-108,Sprite Bottle,Drinks,26.5,35.0,21.0,14.0,556.5,RP-016,Rahul,Maintenance,20.8,Card,2.3,12.0,2.82,426.0,1.0,2025-03-24 19:01:00
VMX-12686,VM-190,Mumbai,Office,19-06-2025,17:40:00,P-106,Snickers Bar,Snacks,48,183.0,170.0,13.0,8160.0,RP-015,Rahul,Working,23.3,Card,2.7,80.0,2.84,422.0,1.0,2025-06-19 17:40:00
VMX-12687,VM-299,Kolkata,Metro Station,12-02-2025,00:52:00,P-109,Doritos,Snacks,115.05,91.0,76.0,15.0,8743.8,RP-020,Rahul,Maintenance,13.3,UPI,3.6,69.0,3.86,255.0,1.0,2025-02-12 00:52:00
VMX-12688,VM-110,Bangalore,Office,03-01-2025,09:20:00,P-102,Bisleri Water,Drinks,40.41,31.0,14.0,17.0,565.74,RP-007,Mahesh,Low Power,19.2,Card,2.5,100.0,2.85,66.0,0.0,2025-01-03 09:20:00
VMX-12689,VM-178,Bangalore,Metro Station,22-06-2025,08:28:00,P-100,Lays Classic,Snacks,31.55,139.0,128.0,11.0,4038.4,RP-014,Anita,Maintenance,11.3,UPI,2.6,17.0,2.37,103.0,1.0,2025-06-22 08:28:00
VMX-12690,VM-179,Pune,Mall,27-01-2025,06:53:00,P-102,Bisleri Water,Drinks,124.83,182.0,0.0,6.0,21970.08,RP-003,Rajesh,Working,24.7,Cash,4.1,110.0,1.12,442.0,0.0,2025-01-27 06:53:00
VMX-12691,VM-264,Delhi,Hospital,07-01-2025,17:56:00,P-104,Red Bull,Drinks,87.47,183.0,163.0,20.0,14257.61,RP-003,Ravi,Working,21.6,Card,2.1,38.0,3.81,168.0,0.0,2025-01-07 17:56:00
VMX-12692,VM-052,Bangalore,Hospital,05-09-2025,04:05:00,P-106,Snickers Bar,Snacks,147.42,194.0,180.0,14.0,26535.6,RP-004,Kiran,Maintenance,11.6,Card,3.6,0.0,4.86,485.0,1.0,2025-09-05 04:05:00
VMX-12693,VM-078,Mumbai,Hospital,07-03-2025,02:21:00,P-106,Snickers Bar,Snacks,136.04,79.0,68.0,11.0,9250.72,RP-007,Rajesh,Working,11.1,UPI,4.3,119.0,2.58,260.0,1.0,2025-03-07 02:21:00
VMX-12694,VM-121,Chennai,Metro Station,29-05-2025,15:56:00,P-104,Red Bull,Drinks,68.69,98.0,95.0,3.0,6525.55,RP-010,Kiran,Maintenance,18.5,Cash,3.9,37.0,4.91,225.0,0.0,2025-05-29 15:56:00
VMX-12695,VM-114,Delhi,Metro Station,09-09-2025,22:30:00,P-105,Dettol Wipe,Hygiene,74.31,117.0,100.0,17.0,7431.0,RP-012,Ravi,Low Power,19.4,UPI,2.1,92.0,1.64,392.0,0.0,2025-09-09 22:30:00
VMX-12696,VM-009,Pune,Office,16-05-2025,21:46:00,P-107,Colgate Mini,Hygiene,113.54,27.0,24.0,3.0,2724.96,Unknown,Rajesh,Maintenance,22.2,UPI,3.9,98.0,1.39,362.0,1.0,2025-05-16 21:46:00
VMX-12697,VM-252,Bangalore,Office,07-06-2025,15:58:00,P-103,Oreo Pack,Snacks,29.72,34.0,14.0,20.0,416.08,RP-019,Kiran,Working,20.5,UPI,3.9,82.0,3.43,411.0,1.0,2025-06-07 15:58:00
VMX-12698,VM-297,Delhi,College,16-02-2025,12:08:00,P-103,Oreo Pack,Snacks,42.21,149.0,140.0,9.0,5909.4,RP-014,Amit,Maintenance,21.0,Card,2.3,92.0,3.78,259.0,1.0,2025-02-16 12:08:00
VMX-12699,VM-043,Delhi,Metro Station,01-10-2025,01:22:00,P-100,Lays Classic,Snacks,102.63,69.0,69.0,0.0,7081.47,RP-007,Anita,Working,14.1,Card,2.6,31.0,2.29,320.0,0.0,2025-10-01 01:22:00
VMX-12700,VM-075,Chennai,Office,08-05-2025,09:31:00,P-108,Sprite Bottle,Drinks,79.83,177.0,157.0,20.0,12533.31,RP-004,Kiran,Low Power,15.8,Cash,4.4,62.0,3.98,173.0,0.0,2025-05-08 09:31:00
VMX-12701,VM-103,Bangalore,Hospital,08-03-2025,19:40:00,P-109,Doritos,Snacks,66.99,147.0,138.0,9.0,9244.62,RP-017,Suresh,Maintenance,14.5,UPI,2.1,92.0,4.8,138.0,1.0,2025-03-08 19:40:00
VMX-12702,VM-179,Chennai,Metro Station,21-01-2025,17:19:00,P-101,Pepsi Can,Drinks,68.89,63.0,46.0,17.0,3168.94,RP-005,Kiran,Working,16.6,Cash,2.7,110.0,4.7,222.0,0.0,2025-01-21 17:19:00
VMX-12703,VM-137,Hyderabad,Office,21-07-2025,12:14:00,P-102,Bisleri Water,Drinks,103.86,163.0,149.0,14.0,15475.14,RP-004,Rahul,Low Power,24.6,Card,2.8,117.0,4.95,267.0,1.0,2025-07-21 12:14:00
VMX-12704,VM-265,Kolkata,Office,25-07-2025,19:25:00,P-102,Bisleri Water,Drinks,128.97,53.0,44.0,9.0,5674.68,RP-004,Kiran,Maintenance,12.7,UPI,3.1,59.0,1.42,240.0,0.0,2025-07-25 19:25:00
VMX-12705,VM-168,Hyderabad,College,21-08-2025,00:45:00,P-108,Sprite Bottle,Drinks,51.59,86.0,66.0,20.0,3404.94,RP-012,Rajesh,Low Power,20.2,Card,3.6,5.0,2.94,264.0,1.0,2025-08-21 00:45:00
VMX-12706,VM-128,Hyderabad,Mall,26-04-2025,17:42:00,P-108,Sprite Bottle,Drinks,74.35,96.0,93.0,3.0,6914.55,RP-015,Kiran,Working,17.4,Cash,2.6,77.0,2.14,140.0,0.0,2025-04-26 17:42:00
VMX-12707,VM-008,Delhi,Mall,02-10-2025,03:24:00,P-104,Red Bull,Drinks,60.72,93.0,76.0,17.0,4614.72,RP-012,Suresh,Low Power,11.6,UPI,4.1,45.0,2.25,104.0,1.0,2025-10-02 03:24:00
